Julia Version 1.5.0-DEV.460
Commit 3935491dc5 (2020-03-13 16:05 UTC)
Platform Info:
  OS: Linux (x86_64-pc-linux-gnu)
  CPU: Intel(R) Xeon(R) Silver 4114 CPU @ 2.20GHz
  WORD_SIZE: 64
  LIBM: libopenlibm
  LLVM: libLLVM-9.0.1 (ORCJIT, skylake)
Environment:
  JULIA_DEPOT_PATH = ::/usr/local/share/julia
  JULIA_NUM_THREADS = 2

  Resolving package versions...
  Installed Reexport ───────────────────── v0.2.0
  Installed InvertedIndices ────────────── v1.0.0
  Installed TableTraits ────────────────── v1.0.0
  Installed RecipesBase ────────────────── v0.8.0
  Installed QuadGK ─────────────────────── v2.3.1
  Installed DataStructures ─────────────── v0.17.10
  Installed PrettyTables ───────────────── v0.8.4
  Installed MLJBase ────────────────────── v0.12.0
  Installed IniFile ────────────────────── v0.5.0
  Installed LearnBase ──────────────────── v0.2.2
  Installed Compat ─────────────────────── v3.8.0
  Installed StatsFuns ──────────────────── v0.9.4
  Installed OpenBLAS_jll ───────────────── v0.3.7+7
  Installed Missings ───────────────────── v0.4.3
  Installed Arpack ─────────────────────── v0.4.0
  Installed Formatting ─────────────────── v0.4.1
  Installed CategoricalArrays ──────────── v0.7.7
  Installed HTTP ───────────────────────── v0.8.12
  Installed Rmath_jll ──────────────────── v0.2.2+0
  Installed DataAPI ────────────────────── v1.1.0
  Installed Rmath ──────────────────────── v0.6.1
  Installed ComputationalResources ─────── v0.3.1
  Installed FixedPointNumbers ──────────── v0.7.1
  Installed OpenSpecFun_jll ────────────── v0.5.3+3
  Installed Parameters ─────────────────── v0.12.0
  Installed Tables ─────────────────────── v1.0.3
  Installed PDMats ─────────────────────── v0.9.12
  Installed Arpack_jll ─────────────────── v3.5.0+2
  Installed SortingAlgorithms ──────────── v0.3.1
  Installed IteratorInterfaceExtensions ── v1.0.0
  Installed ColorTypes ─────────────────── v0.9.1
  Installed ProgressMeter ──────────────── v1.2.0
  Installed MbedTLS ────────────────────── v1.0.1
  Installed CompilerSupportLibraries_jll ─ v0.2.0+1
  Installed Crayons ────────────────────── v4.0.1
  Installed MLJModelInterface ──────────── v0.2.0
  Installed FillArrays ─────────────────── v0.8.5
  Installed JSON ───────────────────────── v0.21.0
  Installed StatsBase ──────────────────── v0.32.2
  Installed LossFunctions ──────────────── v0.5.1
  Installed Distributions ──────────────── v0.22.5
  Installed ScientificTypes ────────────── v0.7.2
  Installed OrderedCollections ─────────── v1.1.0
  Installed DataValueInterfaces ────────── v1.0.0
  Installed MbedTLS_jll ────────────────── v2.16.0+1
  Installed Parsers ────────────────────── v0.3.12
  Installed SpecialFunctions ───────────── v0.10.0
  Installed MLJScientificTypes ─────────── v0.2.1
#=#=#                                                                         ##O#- #                                                                       ######                                                                     9.6%##################################                                        47.8%#################################################################         91.1%######################################################################## 100.0%
#########                                                                 13.7%######################################################################## 100.0%
#####                                                                      7.0%######################################################################## 100.0%
#######                                                                   10.8%######################################################################## 100.0%
#=#=#                                                                         ############                                                              17.8%###################################################                       70.9%######################################################################## 100.0%
#                                                                          1.6%######################################################################## 100.0%
   Updating `~/.julia/environments/v1.5/Project.toml`
   a7f614a8 + MLJBase v0.12.0
   Updating `~/.julia/environments/v1.5/Manifest.toml`
   7d9fca2a + Arpack v0.4.0
   68821587 + Arpack_jll v3.5.0+2
   324d7699 + CategoricalArrays v0.7.7
   3da002f7 + ColorTypes v0.9.1
   34da2185 + Compat v3.8.0
   e66e0078 + CompilerSupportLibraries_jll v0.2.0+1
   ed09eef8 + ComputationalResources v0.3.1
   a8cc5b0e + Crayons v4.0.1
   9a962f9c + DataAPI v1.1.0
   864edb3b + DataStructures v0.17.10
   e2d170a0 + DataValueInterfaces v1.0.0
   31c24e10 + Distributions v0.22.5
   1a297f60 + FillArrays v0.8.5
   53c48c17 + FixedPointNumbers v0.7.1
   59287772 + Formatting v0.4.1
   cd3eb016 + HTTP v0.8.12
   83e8ac13 + IniFile v0.5.0
   41ab1584 + InvertedIndices v1.0.0
   82899510 + IteratorInterfaceExtensions v1.0.0
   682c06a0 + JSON v0.21.0
   7f8f8fb0 + LearnBase v0.2.2
   30fc2ffe + LossFunctions v0.5.1
   a7f614a8 + MLJBase v0.12.0
   e80e1ace + MLJModelInterface v0.2.0
   2e2323e0 + MLJScientificTypes v0.2.1
   739be429 + MbedTLS v1.0.1
   c8ffd9c3 + MbedTLS_jll v2.16.0+1
   e1d29d7a + Missings v0.4.3
   4536629a + OpenBLAS_jll v0.3.7+7
   efe28fd5 + OpenSpecFun_jll v0.5.3+3
   bac558e1 + OrderedCollections v1.1.0
   90014a1f + PDMats v0.9.12
   d96e819e + Parameters v0.12.0
   69de0a69 + Parsers v0.3.12
   08abe8d2 + PrettyTables v0.8.4
   92933f4c + ProgressMeter v1.2.0
   1fd47b50 + QuadGK v2.3.1
   3cdcf5f2 + RecipesBase v0.8.0
   189a3867 + Reexport v0.2.0
   79098fc4 + Rmath v0.6.1
   f50d1b31 + Rmath_jll v0.2.2+0
   321657f4 + ScientificTypes v0.7.2
   a2af1166 + SortingAlgorithms v0.3.1
   276daf66 + SpecialFunctions v0.10.0
   2913bbd2 + StatsBase v0.32.2
   4c63d2b9 + StatsFuns v0.9.4
   3783bdb8 + TableTraits v1.0.0
   bd369af6 + Tables v1.0.3
   2a0f44e3 + Base64
   ade2ca70 + Dates
   8bb1440f + DelimitedFiles
   8ba89e20 + Distributed
   9fa8497b + Future
   b77e0a4c + InteractiveUtils
   76f85450 + LibGit2
   8f399da3 + Libdl
   37e2e46d + LinearAlgebra
   56ddb016 + Logging
   d6f4376e + Markdown
   a63ad114 + Mmap
   44cfe95a + Pkg
   de0858da + Printf
   3fa0cd96 + REPL
   9a3f8284 + Random
   ea8e919c + SHA
   9e88b42a + Serialization
   1a1011a3 + SharedArrays
   6462fe0b + Sockets
   2f01184e + SparseArrays
   10745b16 + Statistics
   4607b0f0 + SuiteSparse
   8dfed614 + Test
   cf7118a7 + UUIDs
   4ec0a83e + Unicode
    Testing MLJBase
     Status `/tmp/jl_0z5Wd9/Project.toml`
   336ed68f CSV v0.5.26
   324d7699 CategoricalArrays v0.7.7
   ed09eef8 ComputationalResources v0.3.1
   a93c6f00 DataFrames v0.20.2
   7806a523 DecisionTree v0.10.1
   b4f34e82 Distances v0.8.2
   31c24e10 Distributions v0.22.5
   cd3eb016 HTTP v0.8.12
   41ab1584 InvertedIndices v1.0.0
   682c06a0 JSON v0.21.0
   30fc2ffe LossFunctions v0.5.1
   a7f614a8 MLJBase v0.12.0
   e80e1ace MLJModelInterface v0.2.0
   2e2323e0 MLJScientificTypes v0.2.1
   e1d29d7a Missings v0.4.3
   6f286f6a MultivariateStats v0.7.0
   b8a86587 NearestNeighbors v0.4.4
   bac558e1 OrderedCollections v1.1.0
   d96e819e Parameters v0.12.0
   08abe8d2 PrettyTables v0.8.4
   92933f4c ProgressMeter v1.2.0
   321657f4 ScientificTypes v0.7.2
   2913bbd2 StatsBase v0.32.2
   bd369af6 Tables v1.0.3
   9d95f2ec TypedTables v1.2.0
   8bb1440f DelimitedFiles
   8ba89e20 Distributed
   b77e0a4c InteractiveUtils
   37e2e46d LinearAlgebra
   56ddb016 Logging
   9a3f8284 Random
   10745b16 Statistics
   8dfed614 Test
     Status `/tmp/jl_0z5Wd9/Manifest.toml`
   7d9fca2a Arpack v0.4.0
   68821587 Arpack_jll v3.5.0+2
   336ed68f CSV v0.5.26
   324d7699 CategoricalArrays v0.7.7
   3da002f7 ColorTypes v0.9.1
   34da2185 Compat v3.8.0
   e66e0078 CompilerSupportLibraries_jll v0.2.0+1
   ed09eef8 ComputationalResources v0.3.1
   a8cc5b0e Crayons v4.0.1
   9a962f9c DataAPI v1.1.0
   a93c6f00 DataFrames v0.20.2
   864edb3b DataStructures v0.17.10
   e2d170a0 DataValueInterfaces v1.0.0
   7806a523 DecisionTree v0.10.1
   85a47980 Dictionaries v0.2.1
   b4f34e82 Distances v0.8.2
   31c24e10 Distributions v0.22.5
   48062228 FilePathsBase v0.7.0
   1a297f60 FillArrays v0.8.5
   53c48c17 FixedPointNumbers v0.7.1
   59287772 Formatting v0.4.1
   cd3eb016 HTTP v0.8.12
   313cdc1a Indexing v1.1.0
   83e8ac13 IniFile v0.5.0
   41ab1584 InvertedIndices v1.0.0
   82899510 IteratorInterfaceExtensions v1.0.0
   682c06a0 JSON v0.21.0
   7f8f8fb0 LearnBase v0.2.2
   30fc2ffe LossFunctions v0.5.1
   a7f614a8 MLJBase v0.12.0
   e80e1ace MLJModelInterface v0.2.0
   2e2323e0 MLJScientificTypes v0.2.1
   739be429 MbedTLS v1.0.1
   c8ffd9c3 MbedTLS_jll v2.16.0+1
   e1d29d7a Missings v0.4.3
   6f286f6a MultivariateStats v0.7.0
   b8a86587 NearestNeighbors v0.4.4
   4536629a OpenBLAS_jll v0.3.7+7
   efe28fd5 OpenSpecFun_jll v0.5.3+3
   bac558e1 OrderedCollections v1.1.0
   90014a1f PDMats v0.9.12
   d96e819e Parameters v0.12.0
   69de0a69 Parsers v0.3.12
   2dfb63ee PooledArrays v0.5.3
   08abe8d2 PrettyTables v0.8.4
   92933f4c ProgressMeter v1.2.0
   1fd47b50 QuadGK v2.3.1
   3cdcf5f2 RecipesBase v0.8.0
   189a3867 Reexport v0.2.0
   79098fc4 Rmath v0.6.1
   f50d1b31 Rmath_jll v0.2.2+0
   321657f4 ScientificTypes v0.7.2
   6e75b9c4 ScikitLearnBase v0.5.0
   a2af1166 SortingAlgorithms v0.3.1
   276daf66 SpecialFunctions v0.10.0
   03a91e81 SplitApplyCombine v1.0.0
   90137ffa StaticArrays v0.12.1
   2913bbd2 StatsBase v0.32.2
   4c63d2b9 StatsFuns v0.9.4
   3783bdb8 TableTraits v1.0.0
   bd369af6 Tables v1.0.3
   9d95f2ec TypedTables v1.2.0
   ea10d353 WeakRefStrings v0.6.2
   2a0f44e3 Base64
   ade2ca70 Dates
   8bb1440f DelimitedFiles
   8ba89e20 Distributed
   9fa8497b Future
   b77e0a4c InteractiveUtils
   76f85450 LibGit2
   8f399da3 Libdl
   37e2e46d LinearAlgebra
   56ddb016 Logging
   d6f4376e Markdown
   a63ad114 Mmap
   44cfe95a Pkg
   de0858da Printf
   3fa0cd96 REPL
   9a3f8284 Random
   ea8e919c SHA
   9e88b42a Serialization
   1a1011a3 SharedArrays
   6462fe0b Sockets
   2f01184e SparseArrays
   10745b16 Statistics
   4607b0f0 SuiteSparse
   8dfed614 Test
   cf7118a7 UUIDs
   4ec0a83e Unicode
[ Info: nprocs() = 41
[ Info: nthreads() = 2
Loading some models for testing...                                           Test Summary: | Pass  Total
misc          |   94     94
Test Summary: | Pass  Total
interface     |   72     72
Test Summary: | Pass  Total
measures      |  211    211
Progress:  17%|██████▉                                  |  ETA: 0:00:07[KProgress: 100%|█████████████████████████████████████████| Time: 0:00:01[K
Progress:  17%|██████▉                                  |  ETA: 0:00:19[KProgress:  33%|█████████████▋                           |  ETA: 0:00:08[KProgress:  50%|████████████████████▌                    |  ETA: 0:00:04[KProgress:  67%|███████████████████████████▁             |  ETA: 0:00:02[KProgress:  83%|██████████████████████████████████▁      |  ETA: 0:00:01[KProgress: 100%|█████████████████████████████████████████| Time: 0:00:04[K
Progress:  17%|██████▉                                  |  ETA: 0:00:02[KProgress: 100%|█████████████████████████████████████████| Time: 0:00:00[K
[ Info: Updating [34mMachine{Resampler{Holdout,…}} @ 7…86[39m.
[ Info: Updating [34mMachine{Resampler{Holdout,…}} @ 6…44[39m.
[ Info: Updating [34mMachine{Resampler{Holdout,…}} @ 7…72[39m.
[ Info: Distributing evaluations among 40 workers.
[ Info: Creating subsamples from a subset of all rows. 
[ Info: Training [34mMachine{Resampler{CV,…}} @ 3…19[39m.
[ Info: Passing machine sample weights to any supported measures. 
[ Info: Training [34mMachine{Resampler{CV,…}} @ 1…41[39m.
[ Info: Creating subsamples from a subset of all rows. 
[ Info: Training [34mMachine{Resampler{CV,…}} @ 5…04[39m.
[ Info: Passing machine sample weights to any supported measures. 
[ Info: Training [34mMachine{Resampler{CV,…}} @ 7…31[39m.
[ Info: Creating subsamples from a subset of all rows. 
[ Info: Training [34mMachine{Resampler{CV,…}} @ 8…73[39m.
[ Info: Passing machine sample weights to any supported measures. 
[ Info: Training [34mMachine{Resampler{CV,…}} @ 7…95[39m.
Test Summary: | Pass  Total
resampling    |  125    125
Test Summary: | Pass  Total
data          |  119    119
[ Info: Training [34mMachine{ConstantClassifier} @ 1…08[39m.
[ Info: Training [34mMachine{ConstantClassifier} @ 4…30[39m.
[ Info: Training [34mNodalMachine{FeatureSelector} @ 1…51[39m.
[ Info: Training [34mNodalMachine{FooBarRegressor} @ 5…25[39m.
[ Info: Training [34mNodalMachine{SimpleDeterministicCompositeModel{FooBarRegressor,…}} @ 1…65[39m.
[ Info: Training [34mNodalMachine{FeatureSelector} @ 5…91[39m.
[ Info: Training [34mNodalMachine{FooBarRegressor} @ 1…82[39m.
[ Info: Updating [34mNodalMachine{SimpleDeterministicCompositeModel{FooBarRegressor,…}} @ 1…65[39m.
[ Info: Updating [34mNodalMachine{FeatureSelector} @ 5…91[39m.
[ Info: Training [34mNodalMachine{FooBarRegressor} @ 1…82[39m.
[ Info: Training [34mNodalMachine{SimpleDeterministicCompositeModel{FooBarRegressor,…}} @ 1…65[39m.
[ Info: Training [34mNodalMachine{FeatureSelector} @ 1…84[39m.
[ Info: Training [34mNodalMachine{FooBarRegressor} @ 6…67[39m.
[ Info: Training [34mMachine{WrappedRidge} @ 1…93[39m.
[ Info: Training [34mNodalMachine{Standardizer} @ 2…74[39m.
[ Info: Training [34mNodalMachine{UnivariateBoxCoxTransformer} @ 1…87[39m.
[ Info: Training [34mNodalMachine{FooBarRegressor} @ 1…36[39m.
[ Info: Updating [34mMachine{WrappedRidge} @ 1…93[39m.
┌ Info: Not retraining [34mNodalMachine{Standardizer} @ 2…74[39m.
└  It appears up-to-date. Use `force=true` to force retraining.
┌ Info: Not retraining [34mNodalMachine{UnivariateBoxCoxTransformer} @ 1…87[39m.
└  It appears up-to-date. Use `force=true` to force retraining.
[ Info: Updating [34mNodalMachine{FooBarRegressor} @ 1…36[39m.
[ Info: Training [34mNodalMachine{OneHotEncoder} @ 1…26[39m.
[ Info: Spawning 3 sub-features to one-hot encode feature :x1.
[ Info: Training [34mNodalMachine{UnivariateStandardizer} @ 8…00[39m.
[ Info: Training [34mNodalMachine{KNNRegressor} @ 1…99[39m.
[ Info: Training [34mNodalMachine{DecisionTreeRegressor} @ 1…62[39m.
[ Info: Training [34mNodalMachine{Standardizer} @ 1…23[39m.
[ Info: Training [34mNodalMachine{ConstantClassifier} @ 4…07[39m.
[ Info: Training [34mNodalMachine{Standardizer} @ 1…23[39m.
[ Info: Training [34mNodalMachine{ConstantClassifier} @ 4…07[39m.
[ Info: Training [34mMachine{Composite3} @ 5…73[39m.
[ Info: Training [34mNodalMachine{Standardizer} @ 9…29[39m.
[ Info: Training [34mNodalMachine{ConstantClassifier} @ 8…30[39m.
[ Info: Training [34mMachine{Composite3} @ 1…31[39m.
[ Info: Training [34mNodalMachine{Standardizer} @ 1…51[39m.
[ Info: Training [34mNodalMachine{ConstantClassifier} @ 1…75[39m.
[ Info: Training [34mMachine{CompositeWithNoFields} @ 1…00[39m.
[ Info: Training [34mNodalMachine{Standardizer} @ 2…16[39m.
[ Info: Training [34mNodalMachine{ConstantClassifier} @ 1…82[39m.
[ Info: Training [34mNodalMachine{FeatureSelector} @ 1…01[39m.
[ Info: Training [34mNodalMachine{UnivariateStandardizer} @ 2…12[39m.
[ Info: Training [34mNodalMachine{KNNRegressor} @ 1…71[39m.
[ Info: Training [34mNodalMachine{FeatureSelector} @ 2…67[39m.
[ Info: Training [34mNodalMachine{UnivariateStandardizer} @ 1…08[39m.
[ Info: Training [34mNodalMachine{KNNRegressor} @ 1…57[39m.
[ Info: Updating [34mNodalMachine{FeatureSelector} @ 1…01[39m.
┌ Info: Not retraining [34mNodalMachine{UnivariateStandardizer} @ 2…12[39m.
└  It appears up-to-date. Use `force=true` to force retraining.
[ Info: Training [34mNodalMachine{KNNRegressor} @ 1…71[39m.
[ Info: Updating [34mNodalMachine{FeatureSelector} @ 2…67[39m.
┌ Info: Not retraining [34mNodalMachine{UnivariateStandardizer} @ 1…08[39m.
└  It appears up-to-date. Use `force=true` to force retraining.
[ Info: Training [34mNodalMachine{KNNRegressor} @ 1…57[39m.
[ Info: Training [34mMachine{Pipe} @ 1…24[39m.
[ Info: Training [34mNodalMachine{FeatureSelector} @ 1…22[39m.
[ Info: Training [34mNodalMachine{UnivariateStandardizer} @ 1…23[39m.
[ Info: Training [34mNodalMachine{KNNRegressor} @ 1…14[39m.
[ Info: Training [34mMachine{Pipe21} @ 4…09[39m.
[ Info: Training [34mNodalMachine{OneHotEncoder} @ 8…91[39m.
[ Info: Training [34mNodalMachine{ConstantClassifier} @ 1…01[39m.
[ Info: Training [34mMachine{Piper3} @ 1…50[39m.
[ Info: Training [34mNodalMachine{OneHotEncoder} @ 1…78[39m.
[ Info: Training [34mNodalMachine{ConstantClassifier} @ 7…78[39m.
[ Info: Training [34mMachine{Piper3} @ 4…73[39m.
[ Info: Training [34mNodalMachine{OneHotEncoder} @ 3…16[39m.
[ Info: Training [34mNodalMachine{ConstantClassifier} @ 2…21[39m.
[ Info: Training [34mNodalMachine{OneHotEncoder} @ 1…75[39m.
[ Info: Spawning 3 sub-features to one-hot encode feature :x3.
[ Info: Training [34mNodalMachine{FeatureSelector} @ 1…98[39m.
[ Info: Training [34mNodalMachine{KNNRegressor} @ 1…41[39m.
[ Info: Training [34mMachine{Pipe4} @ 1…30[39m.
[ Info: Training [34mNodalMachine{OneHotEncoder} @ 1…08[39m.
[ Info: Spawning 3 sub-features to one-hot encode feature :x3.
[ Info: Training [34mNodalMachine{FeatureSelector} @ 4…39[39m.
[ Info: Training [34mNodalMachine{StaticTransformer} @ 7…01[39m.
[ Info: Training [34mNodalMachine{KNNRegressor} @ 1…62[39m.
[ Info: Training [34mNodalMachine{StaticTransformer} @ 1…64[39m.
[ Info: Training [34mMachine{Pipe9} @ 6…04[39m.
[ Info: Training [34mNodalMachine{OneHotEncoder} @ 1…94[39m.
[ Info: Spawning 2 sub-features to one-hot encode feature :gender.
[ Info: Training [34mNodalMachine{UnivariateStandardizer} @ 1…01[39m.
[ Info: Training [34mNodalMachine{KNNRegressor} @ 9…44[39m.
[ Info: Training [34mMachine{Pipe99} @ 1…66[39m.
[ Info: Training [34mNodalMachine{OneHotEncoder} @ 1…85[39m.
[ Info: Spawning 2 sub-features to one-hot encode feature :gender.
[ Info: Training [34mNodalMachine{MyTransformer} @ 6…83[39m.
[ Info: Training [34mMachine{MyTransformer} @ 1…24[39m.
[ Info: Training [34mNodalMachine{KNNRegressor} @ 1…33[39m.
[ Info: Training [34mNodalMachine{Standardizer} @ 1…94[39m.
[ Info: Training [34mNodalMachine{UnivariateBoxCoxTransformer} @ 3…90[39m.
[ Info: Training [34mNodalMachine{RidgeRegressor} @ 5…81[39m.
┌ Info: Not retraining [34mNodalMachine{Standardizer} @ 1…94[39m.
└  It appears up-to-date. Use `force=true` to force retraining.
┌ Info: Not retraining [34mNodalMachine{UnivariateBoxCoxTransformer} @ 3…90[39m.
└  It appears up-to-date. Use `force=true` to force retraining.
[ Info: Updating [34mNodalMachine{RidgeRegressor} @ 5…81[39m.
[ Info: Training [34mNodalMachine{Standardizer} @ 1…08[39m.
[ Info: Training [34mNodalMachine{PCA} @ 1…67[39m.
┌ Info: Not retraining [34mNodalMachine{Standardizer} @ 1…08[39m.
└  It appears up-to-date. Use `force=true` to force retraining.
┌ Info: Not retraining [34mNodalMachine{PCA} @ 1…67[39m.
└  It appears up-to-date. Use `force=true` to force retraining.
[ Info: Training [34mNodalMachine{RidgeRegressor} @ 3…73[39m.
[ Info: Training [34mNodalMachine{Standardizer} @ 9…78[39m.
[ Info: Training [34mNodalMachine{PCA} @ 1…30[39m.
[ Info: Training [34mNodalMachine{RidgeRegressor} @ 1…17[39m.
[ Info: Training [34mNodalMachine{Standardizer} @ 1…94[39m.
[ Info: Training [34mNodalMachine{PCA} @ 1…53[39m.
[ Info: Training [34mNodalMachine{UnivariateBoxCoxTransformer} @ 6…89[39m.
[ Info: Training [34mNodalMachine{RidgeRegressor} @ 1…81[39m.
[ Info: Training [34mNodalMachine{DecisionTreeRegressor} @ 2…39[39m.
[ Info: Training [34mNodalMachine{DecisionTreeRegressor} @ 7…21[39m.
Test Summary:        | Pass  Total
machines+composition |  278    278
Test Summary: | Pass  Total
hyperparam    |  114    114
Test Summary: | Pass  Total
openml        |   15     15
┌ Warning: Forcibly interrupting busy workers
│   exception = rmprocs: pids [2, 3, 4, 5, 6, 7, 9, 10, 11, 12, 13, 14, 15, 16, 17, 18, 19, 20, 21, 22, 23, 24, 25, 26, 27, 28, 29, 30, 31, 32, 33, 34, 35, 36, 37, 38, 39, 40, 41] not terminated after 5.0 seconds.
└ @ Distributed /buildworker/worker/package_linux64/build/usr/share/julia/stdlib/v1.5/Distributed/src/cluster.jl:1234
┌ Warning: rmprocs: process 1 not removed
└ @ Distributed /buildworker/worker/package_linux64/build/usr/share/julia/stdlib/v1.5/Distributed/src/cluster.jl:1030
    Testing MLJBase tests passed 
