Julia Version 1.6.0-DEV.203
Commit 4e2fb5c72c (2020-06-09 12:13 UTC)
Platform Info:
  OS: Linux (x86_64-pc-linux-gnu)
  CPU: Intel(R) Xeon(R) Silver 4114 CPU @ 2.20GHz
  WORD_SIZE: 64
  LIBM: libopenlibm
  LLVM: libLLVM-9.0.1 (ORCJIT, skylake)
Environment:
  JULIA_DEPOT_PATH = ::/usr/local/share/julia
  JULIA_NUM_THREADS = 2

  Resolving package versions...
  Installed Reexport ───────────────────── v0.2.0
  Installed Mocking ────────────────────── v0.7.1
  Installed GenericSVD ─────────────────── v0.3.0
  Installed RecipesBase ────────────────── v1.0.1
  Installed Parameters ─────────────────── v0.12.1
  Installed GenericSchur ───────────────── v0.4.0
  Installed DataStructures ─────────────── v0.17.17
  Installed HomotopyContinuation ───────── v1.4.4
  Installed DataValueInterfaces ────────── v1.0.0
  Installed CompilerSupportLibraries_jll ─ v0.3.3+0
  Installed ProjectiveVectors ──────────── v1.1.2
  Installed StaticPolynomials ──────────── v1.3.3
  Installed TableTraits ────────────────── v1.0.0
  Installed LaTeXStrings ───────────────── v1.1.0
  Installed FixedPolynomials ───────────── v0.4.0
  Installed EzXML ──────────────────────── v1.1.0
  Installed ExprTools ──────────────────── v0.1.1
  Installed XML2_jll ───────────────────── v2.9.9+4
  Installed StaticArrays ───────────────── v0.12.3
  Installed DoubleFloats ───────────────── v1.1.11
  Installed UnPack ─────────────────────── v1.0.1
  Installed Tables ─────────────────────── v1.0.4
  Installed DataAPI ────────────────────── v1.3.0
  Installed DynamicPolynomials ─────────── v0.3.10
  Installed MacroTools ─────────────────── v0.5.5
  Installed MutableArithmetics ─────────── v0.2.9
  Installed Polynomials ────────────────── v1.1.1
  Installed PrettyTables ───────────────── v0.9.0
  Installed Adapt ──────────────────────── v1.1.0
  Installed OrderedCollections ─────────── v1.2.0
  Installed OpenSpecFun_jll ────────────── v0.5.3+3
  Installed IteratorInterfaceExtensions ── v1.0.0
  Installed ElasticArrays ──────────────── v1.2.1
  Installed MixedSubdivisions ──────────── v1.0.0
  Installed MultivariatePolynomials ────── v0.3.9
  Installed Libiconv_jll ───────────────── v1.16.0+2
  Installed SpecialFunctions ───────────── v0.10.3
  Installed Zlib_jll ───────────────────── v1.2.11+10
  Installed Latexify ───────────────────── v0.13.5
  Installed Formatting ─────────────────── v0.4.1
  Installed ProgressMeter ──────────────── v1.3.0
  Installed Requires ───────────────────── v1.0.1
  Installed Crayons ────────────────────── v4.0.2
  Installed Quadmath ───────────────────── v0.5.4
  Installed TimeZones ──────────────────── v1.2.0
  Installed Intervals ──────────────────── v1.2.0
  Installed TreeViews ──────────────────── v0.3.0
Updating `~/.julia/environments/v1.6/Project.toml`
  [f213a82b] + HomotopyContinuation v1.4.4
Updating `~/.julia/environments/v1.6/Manifest.toml`
  [79e6a3ab] + Adapt v1.1.0
  [e66e0078] + CompilerSupportLibraries_jll v0.3.3+0
  [a8cc5b0e] + Crayons v4.0.2
  [9a962f9c] + DataAPI v1.3.0
  [864edb3b] + DataStructures v0.17.17
  [e2d170a0] + DataValueInterfaces v1.0.0
  [497a8b3b] + DoubleFloats v1.1.11
  [7c1d4256] + DynamicPolynomials v0.3.10
  [fdbdab4c] + ElasticArrays v1.2.1
  [e2ba6199] + ExprTools v0.1.1
  [8f5d6c58] + EzXML v1.1.0
  [3dd14ad9] + FixedPolynomials v0.4.0
  [59287772] + Formatting v0.4.1
  [01680d73] + GenericSVD v0.3.0
  [c145ed77] + GenericSchur v0.4.0
  [f213a82b] + HomotopyContinuation v1.4.4
  [d8418881] + Intervals v1.2.0
  [82899510] + IteratorInterfaceExtensions v1.0.0
  [b964fa9f] + LaTeXStrings v1.1.0
  [23fbe1c1] + Latexify v0.13.5
  [94ce4f54] + Libiconv_jll v1.16.0+2
  [1914dd2f] + MacroTools v0.5.5
  [291d046c] + MixedSubdivisions v1.0.0
  [78c3b35d] + Mocking v0.7.1
  [102ac46a] + MultivariatePolynomials v0.3.9
  [d8a4904e] + MutableArithmetics v0.2.9
  [efe28fd5] + OpenSpecFun_jll v0.5.3+3
  [bac558e1] + OrderedCollections v1.2.0
  [d96e819e] + Parameters v0.12.1
  [f27b6e38] + Polynomials v1.1.1
  [08abe8d2] + PrettyTables v0.9.0
  [92933f4c] + ProgressMeter v1.3.0
  [01f381cc] + ProjectiveVectors v1.1.2
  [be4d8f0f] + Quadmath v0.5.4
  [3cdcf5f2] + RecipesBase v1.0.1
  [189a3867] + Reexport v0.2.0
  [ae029012] + Requires v1.0.1
  [276daf66] + SpecialFunctions v0.10.3
  [90137ffa] + StaticArrays v0.12.3
  [62e018b1] + StaticPolynomials v1.3.3
  [3783bdb8] + TableTraits v1.0.0
  [bd369af6] + Tables v1.0.4
  [f269a46b] + TimeZones v1.2.0
  [a2a6695c] + TreeViews v0.3.0
  [3a884ed6] + UnPack v1.0.1
  [02c8fc9c] + XML2_jll v2.9.9+4
  [83775a58] + Zlib_jll v1.2.11+10
  [2a0f44e3] + Base64
  [ade2ca70] + Dates
  [8ba89e20] + Distributed
  [9fa8497b] + Future
  [b77e0a4c] + InteractiveUtils
  [76f85450] + LibGit2
  [8f399da3] + Libdl
  [37e2e46d] + LinearAlgebra
  [56ddb016] + Logging
  [d6f4376e] + Markdown
  [44cfe95a] + Pkg
  [de0858da] + Printf
  [3fa0cd96] + REPL
  [9a3f8284] + Random
  [ea8e919c] + SHA
  [9e88b42a] + Serialization
  [6462fe0b] + Sockets
  [2f01184e] + SparseArrays
  [10745b16] + Statistics
  [8dfed614] + Test
  [cf7118a7] + UUIDs
  [4ec0a83e] + Unicode
   Building TimeZones → `~/.julia/packages/TimeZones/OjMoF/deps/build.log`
    Testing HomotopyContinuation
Status `/tmp/jl_hIfTMX/Project.toml`
  [e30172f5] Documenter v0.24.11
  [497a8b3b] DoubleFloats v1.1.11
  [7c1d4256] DynamicPolynomials v0.3.10
  [fdbdab4c] ElasticArrays v1.2.1
  [26cc04aa] FiniteDifferences v0.10.2
  [3dd14ad9] FixedPolynomials v0.4.0
  [f213a82b] HomotopyContinuation v1.4.4
  [23fbe1c1] Latexify v0.13.5
  [291d046c] MixedSubdivisions v1.0.0
  [102ac46a] MultivariatePolynomials v0.3.9
  [bac558e1] OrderedCollections v1.2.0
  [d96e819e] Parameters v0.12.1
  [4c526841] PolynomialTestSystems v0.1.4
  [08abe8d2] PrettyTables v0.9.0
  [01f381cc] ProjectiveVectors v1.1.2
  [90137ffa] StaticArrays v0.12.3
  [62e018b1] StaticPolynomials v1.3.3
  [a2a6695c] TreeViews v0.3.0
  [37e2e46d] LinearAlgebra
  [de0858da] Printf
  [9a3f8284] Random
  [8dfed614] Test
Status `/tmp/jl_hIfTMX/Manifest.toml`
  [79e6a3ab] Adapt v1.1.0
  [e66e0078] CompilerSupportLibraries_jll v0.3.3+0
  [a8cc5b0e] Crayons v4.0.2
  [9a962f9c] DataAPI v1.3.0
  [864edb3b] DataStructures v0.17.17
  [e2d170a0] DataValueInterfaces v1.0.0
  [ffbed154] DocStringExtensions v0.8.1
  [e30172f5] Documenter v0.24.11
  [497a8b3b] DoubleFloats v1.1.11
  [7c1d4256] DynamicPolynomials v0.3.10
  [fdbdab4c] ElasticArrays v1.2.1
  [e2ba6199] ExprTools v0.1.1
  [8f5d6c58] EzXML v1.1.0
  [26cc04aa] FiniteDifferences v0.10.2
  [3dd14ad9] FixedPolynomials v0.4.0
  [59287772] Formatting v0.4.1
  [01680d73] GenericSVD v0.3.0
  [c145ed77] GenericSchur v0.4.0
  [f213a82b] HomotopyContinuation v1.4.4
  [d8418881] Intervals v1.2.0
  [82899510] IteratorInterfaceExtensions v1.0.0
  [682c06a0] JSON v0.21.0
  [b964fa9f] LaTeXStrings v1.1.0
  [23fbe1c1] Latexify v0.13.5
  [94ce4f54] Libiconv_jll v1.16.0+2
  [1914dd2f] MacroTools v0.5.5
  [291d046c] MixedSubdivisions v1.0.0
  [78c3b35d] Mocking v0.7.1
  [102ac46a] MultivariatePolynomials v0.3.9
  [d8a4904e] MutableArithmetics v0.2.9
  [efe28fd5] OpenSpecFun_jll v0.5.3+3
  [bac558e1] OrderedCollections v1.2.0
  [d96e819e] Parameters v0.12.1
  [69de0a69] Parsers v1.0.5
  [4c526841] PolynomialTestSystems v0.1.4
  [f27b6e38] Polynomials v1.1.1
  [08abe8d2] PrettyTables v0.9.0
  [92933f4c] ProgressMeter v1.3.0
  [01f381cc] ProjectiveVectors v1.1.2
  [be4d8f0f] Quadmath v0.5.4
  [3cdcf5f2] RecipesBase v1.0.1
  [189a3867] Reexport v0.2.0
  [ae029012] Requires v1.0.1
  [276daf66] SpecialFunctions v0.10.3
  [90137ffa] StaticArrays v0.12.3
  [62e018b1] StaticPolynomials v1.3.3
  [3783bdb8] TableTraits v1.0.0
  [bd369af6] Tables v1.0.4
  [f269a46b] TimeZones v1.2.0
  [a2a6695c] TreeViews v0.3.0
  [3a884ed6] UnPack v1.0.1
  [02c8fc9c] XML2_jll v2.9.9+4
  [83775a58] Zlib_jll v1.2.11+10
  [2a0f44e3] Base64
  [ade2ca70] Dates
  [8ba89e20] Distributed
  [9fa8497b] Future
  [b77e0a4c] InteractiveUtils
  [76f85450] LibGit2
  [8f399da3] Libdl
  [37e2e46d] LinearAlgebra
  [56ddb016] Logging
  [d6f4376e] Markdown
  [a63ad114] Mmap
  [44cfe95a] Pkg
  [de0858da] Printf
  [3fa0cd96] REPL
  [9a3f8284] Random
  [ea8e919c] SHA
  [9e88b42a] Serialization
  [6462fe0b] Sockets
  [2f01184e] SparseArrays
  [10745b16] Statistics
  [8dfed614] Test
  [cf7118a7] UUIDs
  [4ec0a83e] Unicode
┌ Warning: `setup!(tracker::CoreTracker, x, t, t₀; kwargs...)` is deprecated, use `init!(tracker, x, t, t₀; kwargs...)` instead.
│   caller = top-level scope at core_tracker_test.jl:40
└ @ Core ~/.julia/packages/HomotopyContinuation/mJDHb/test/core_tracker_test.jl:40
┌ Warning: Solutions are now automatically refined to maximal achievable accuracy.
└ @ HomotopyContinuation ~/.julia/packages/HomotopyContinuation/mJDHb/src/core_tracker.jl:1410
┌ Warning: `set_refinement_accuracy!` is deprecated. Solutions are now automatically refined to maximal achievable accuracy.
└ @ HomotopyContinuation ~/.julia/packages/HomotopyContinuation/mJDHb/src/core_tracker.jl:1420
┌ Warning: `max_refinement_iters` is deprecated. Solutions are now automatically refined to the maximal achievable accuracy.
└ @ HomotopyContinuation ~/.julia/packages/HomotopyContinuation/mJDHb/src/core_tracker.jl:1429
┌ Warning: `set_max_refinement_iters` is deprecated. Solutions are now automatically refined to the maximal achievable accuracy.
└ @ HomotopyContinuation ~/.julia/packages/HomotopyContinuation/mJDHb/src/core_tracker.jl:1439
Univariate singular: 2,3,4,5,6,7,8,9,10,11,12,
Wilkinson: 1,2,3,4,5,6,7,8,9,10,11,12,13,14,15,16,17,18,
Computing mixed cells... 1 	 Time: 0:00:00[K
  mixed_volume:  5[K[AComputing mixed cells... 14 	 Time: 0:00:00[K
  mixed_volume:  70
Computing mixed cells... 1 	 Time: 0:00:00[K
  mixed_volume:  4[K[AComputing mixed cells... 133 	 Time: 0:00:00[K
  mixed_volume:  986[K[AComputing mixed cells... 483 	 Time: 0:00:01[K
  mixed_volume:  3690[K[AComputing mixed cells... 773 	 Time: 0:00:01[K
  mixed_volume:  5663[K[AComputing mixed cells... 1146 	 Time: 0:00:01[K
  mixed_volume:  8302[K[AComputing mixed cells... 1625 	 Time: 0:00:01[K
  mixed_volume:  11345[K[AComputing mixed cells... 1881 	 Time: 0:00:02[K
  mixed_volume:  12636
Tracking 120 paths...  27%|██████████▋                             |  ETA: 0:00:01[K
  # paths tracked:                  32
  # non-singular solutions (real):  17 (3)
  # singular solutions (real):      0 (0)
  # total solutions (real):         17 (3)[A[A[A[A



[K[A[K[A[K[A[K[ATracking 120 paths... 100%|████████████████████████████████████████| Time: 0:00:00[K
  # paths tracked:                  120
  # non-singular solutions (real):  70 (10)
  # singular solutions (real):      0 (0)
  # total solutions (real):         70 (10)
Tracking 120 paths...  54%|█████████████████████▋                  |  ETA: 0:00:03[K
  # paths tracked:                  65
  # non-singular solutions (real):  37 (6)
  # singular solutions (real):      0 (0)
  # total solutions (real):         37 (6)[A[A[A[A



[K[A[K[A[K[A[K[ATracking 120 paths... 100%|████████████████████████████████████████| Time: 0:00:03[K
  # paths tracked:                  120
  # non-singular solutions (real):  70 (10)
  # singular solutions (real):      0 (0)
  # total solutions (real):         70 (10)
Tracking 216 paths...  31%|████████████▁                           |  ETA: 0:00:02[K
  # paths tracked:                  66
  # non-singular solutions (real):  25 (5)
  # singular solutions (real):      0 (0)
  # total solutions (real):         25 (5)[A[A[A[A



[K[A[K[A[K[A[K[ATracking 216 paths...  61%|████████████████████████▌               |  ETA: 0:00:01[K
  # paths tracked:                  132
  # non-singular solutions (real):  50 (7)
  # singular solutions (real):      0 (0)
  # total solutions (real):         50 (7)[A[A[A[A



[K[A[K[A[K[A[K[ATracking 216 paths...  91%|████████████████████████████████████▌   |  ETA: 0:00:00[K
  # paths tracked:                  197
  # non-singular solutions (real):  74 (8)
  # singular solutions (real):      0 (0)
  # total solutions (real):         74 (8)[A[A[A[A



[K[A[K[A[K[A[K[ATracking 216 paths... 100%|████████████████████████████████████████| Time: 0:00:01[K
  # paths tracked:                  216
  # non-singular solutions (real):  80 (8)
  # singular solutions (real):      0 (0)
  # total solutions (real):         80 (8)
Tracking 3 paths...  67%|██████████████████████████▋             |  ETA: 0:00:00[K
  # paths tracked:                  2
  # non-singular solutions (real):  2 (2)
  # singular solutions (real):      0 (0)
  # total solutions (real):         2 (2)[A[A[A[ATracking 125 paths...   2%|▋                                       |  ETA: 0:00:28[K
  # paths tracked:                  2
  # non-singular solutions (real):  2 (2)
  # singular solutions (real):      0 (0)
  # total solutions (real):         2 (2)[A[A[A[A┌ Warning: None of the provided solutions is a valid start solution.
└ @ HomotopyContinuation ~/.julia/packages/HomotopyContinuation/mJDHb/src/monodromy.jl:878
[ Info: Compute additional witnesses for completeness...
[ Info: Found 2 additional witnesses
[ Info: Compute trace...
[ Info: Norm of trace: 8.694542048499867e-15
[ Info: Compute additional witnesses for completeness...
[ Info: Found 36 additional witnesses
[ Info: Compute trace...
[ Info: Norm of trace: 5.567297291902841e-9
Solutions found: 2 	 Time: 0:00:00[K
  # paths tracked:                   2
  # loops generated:                 1
  # completed loops without change:  0
  # solutions in current loop:       1
  # real solutions:                  0[K[A[K[A[K[A[K[A[K[ASolutions found: 7 	 Time: 0:00:01[K
  # paths tracked:                   12
  # loops generated:                 1
  # completed loops without change:  0
  # solutions in current loop:       6
  # real solutions:                  0[K[A[K[A[K[A[K[A[K[ASolutions found: 11 	 Time: 0:00:01[K
  # paths tracked:                   20
  # loops generated:                 1
  # completed loops without change:  0
  # solutions in current loop:       10
  # real solutions:                  0[K[A[K[A[K[A[K[A[K[ASolutions found: 15 	 Time: 0:00:01[K
  # paths tracked:                   28
  # loops generated:                 1
  # completed loops without change:  0
  # solutions in current loop:       14
  # real solutions:                  0[K[A[K[A[K[A[K[A[K[ASolutions found: 20 	 Time: 0:00:01[K
  # paths tracked:                   38
  # loops generated:                 1
  # completed loops without change:  0
  # solutions in current loop:       19
  # real solutions:                  0[K[A[K[A[K[A[K[A[K[ASolutions found: 33 	 Time: 0:00:01[K
  # paths tracked:                   64
  # loops generated:                 1
  # completed loops without change:  0
  # solutions in current loop:       32
  # real solutions:                  0[K[A[K[A[K[A[K[A[K[ASolutions found: 42 	 Time: 0:00:01[K
  # paths tracked:                   82
  # loops generated:                 1
  # completed loops without change:  0
  # solutions in current loop:       41
  # real solutions:                  0[K[A[K[A[K[A[K[A[K[ASolutions found: 49 	 Time: 0:00:01[K
  # paths tracked:                   96
  # loops generated:                 1
  # completed loops without change:  0
  # solutions in current loop:       48
  # real solutions:                  0[K[A[K[A[K[A[K[A[K[ASolutions found: 50 	 Time: 0:00:01[K
monodromy group: Test Failed at /home/pkgeval/.julia/packages/HomotopyContinuation/mJDHb/test/monodromy_test.jl:500
  Expression: size(A) == (2, 2)
   Evaluated: (2, 3) == (2, 2)
Stacktrace:
 [1] top-level scope at /home/pkgeval/.julia/packages/HomotopyContinuation/mJDHb/test/monodromy_test.jl:500
 [2] top-level scope at /buildworker/worker/package_linux64/build/usr/share/julia/stdlib/v1.6/Test/src/Test.jl:1115
 [3] top-level scope at /home/pkgeval/.julia/packages/HomotopyContinuation/mJDHb/test/monodromy_test.jl:489
 [4] top-level scope at /buildworker/worker/package_linux64/build/usr/share/julia/stdlib/v1.6/Test/src/Test.jl:1115
 [5] top-level scope at /home/pkgeval/.julia/packages/HomotopyContinuation/mJDHb/test/monodromy_test.jl:2
monodromy group: Test Failed at /home/pkgeval/.julia/packages/HomotopyContinuation/mJDHb/test/monodromy_test.jl:501
  Expression: A == [1 2; 2 1] || A == [2 1; 1 2]
Stacktrace:
 [1] top-level scope at /home/pkgeval/.julia/packages/HomotopyContinuation/mJDHb/test/monodromy_test.jl:501
 [2] top-level scope at /buildworker/worker/package_linux64/build/usr/share/julia/stdlib/v1.6/Test/src/Test.jl:1115
 [3] top-level scope at /home/pkgeval/.julia/packages/HomotopyContinuation/mJDHb/test/monodromy_test.jl:489
 [4] top-level scope at /buildworker/worker/package_linux64/build/usr/share/julia/stdlib/v1.6/Test/src/Test.jl:1115
 [5] top-level scope at /home/pkgeval/.julia/packages/HomotopyContinuation/mJDHb/test/monodromy_test.jl:2
Solutions found: 4 	 Time: 0:00:00[K
  # paths tracked:                   6
  # loops generated:                 1
  # completed loops without change:  0
  # solutions in current loop:       3
  # real solutions:                  0[K[A[K[A[K[A[K[A[K[ASolutions found: 7 	 Time: 0:00:00[K
  # paths tracked:                   12
  # loops generated:                 1
  # completed loops without change:  0
  # solutions in current loop:       6
  # real solutions:                  0[K[A[K[A[K[A[K[A[K[ASolutions found: 21 	 Time: 0:00:00[K
  # paths tracked:                   40
  # loops generated:                 1
  # completed loops without change:  0
  # solutions in current loop:       20
  # real solutions:                  0[K[A[K[A[K[A[K[A[K[ASolutions found: 41 	 Time: 0:00:00[K
  # paths tracked:                   80
  # loops generated:                 1
  # completed loops without change:  0
  # solutions in current loop:       40
  # real solutions:                  0[K[A[K[A[K[A[K[A[K[ASolutions found: 54 	 Time: 0:00:01[K
  # paths tracked:                   106
  # loops generated:                 1
  # completed loops without change:  0
  # solutions in current loop:       53
  # real solutions:                  0[K[A[K[A[K[A[K[A[K[ASolutions found: 70 	 Time: 0:00:01[K
  # paths tracked:                   138
  # loops generated:                 1
  # completed loops without change:  0
  # solutions in current loop:       69
  # real solutions:                  0[K[A[K[A[K[A[K[A[K[ASolutions found: 91 	 Time: 0:00:01[K
  # paths tracked:                   184
  # loops generated:                 2
  # completed loops without change:  0
  # solutions in current loop:       13
  # real solutions:                  0[K[A[K[A[K[A[K[A[K[ASolutions found: 116 	 Time: 0:00:01[K
  # paths tracked:                   240
  # loops generated:                 2
  # completed loops without change:  0
  # solutions in current loop:       38
  # real solutions:                  0[K[A[K[A[K[A[K[A[K[ASolutions found: 146 	 Time: 0:00:01[K
  # paths tracked:                   310
  # loops generated:                 2
  # completed loops without change:  0
  # solutions in current loop:       68
  # real solutions:                  0[K[A[K[A[K[A[K[A[K[ASolutions found: 165 	 Time: 0:00:01[K
  # paths tracked:                   361
  # loops generated:                 2
  # completed loops without change:  0
  # solutions in current loop:       87
  # real solutions:                  0[K[A[K[A[K[A[K[A[K[ASolutions found: 197 	 Time: 0:00:01[K
  # paths tracked:                   434
  # loops generated:                 2
  # completed loops without change:  0
  # solutions in current loop:       119
  # real solutions:                  0[K[A[K[A[K[A[K[A[K[ASolutions found: 214 	 Time: 0:00:01[K
  # paths tracked:                   476
  # loops generated:                 2
  # completed loops without change:  0
  # solutions in current loop:       136
  # real solutions:                  0[K[A[K[A[K[A[K[A[K[ASolutions found: 231 	 Time: 0:00:02[K
  # paths tracked:                   519
  # loops generated:                 2
  # completed loops without change:  0
  # solutions in current loop:       153
  # real solutions:                  0[K[A[K[A[K[A[K[A[K[ASolutions found: 249 	 Time: 0:00:02[K
  # paths tracked:                   561
  # loops generated:                 2
  # completed loops without change:  0
  # solutions in current loop:       171
  # real solutions:                  0[K[A[K[A[K[A[K[A[K[ASolutions found: 261 	 Time: 0:00:02[K
  # paths tracked:                   597
  # loops generated:                 2
  # completed loops without change:  0
  # solutions in current loop:       183
  # real solutions:                  0[K[A[K[A[K[A[K[A[K[ASolutions found: 282 	 Time: 0:00:02[K
  # paths tracked:                   644
  # loops generated:                 2
  # completed loops without change:  0
  # solutions in current loop:       204
  # real solutions:                  0[K[A[K[A[K[A[K[A[K[ASolutions found: 297 	 Time: 0:00:02[K
  # paths tracked:                   687
  # loops generated:                 2
  # completed loops without change:  0
  # solutions in current loop:       219
  # real solutions:                  0[K[A[K[A[K[A[K[A[K[ASolutions found: 307 	 Time: 0:00:02[K
  # paths tracked:                   715
  # loops generated:                 2
  # completed loops without change:  0
  # solutions in current loop:       229
  # real solutions:                  0[K[A[K[A[K[A[K[A[K[ASolutions found: 324 	 Time: 0:00:02[K
  # paths tracked:                   761
  # loops generated:                 2
  # completed loops without change:  0
  # solutions in current loop:       246
  # real solutions:                  0[K[A[K[A[K[A[K[A[K[ASolutions found: 336 	 Time: 0:00:02[K
  # paths tracked:                   796
  # loops generated:                 2
  # completed loops without change:  0
  # solutions in current loop:       258
  # real solutions:                  0[K[A[K[A[K[A[K[A[K[ASolutions found: 353 	 Time: 0:00:02[K
  # paths tracked:                   842
  # loops generated:                 2
  # completed loops without change:  0
  # solutions in current loop:       275
  # real solutions:                  0[K[A[K[A[K[A[K[A[K[ASolutions found: 373 	 Time: 0:00:03[K
  # paths tracked:                   910
  # loops generated:                 2
  # completed loops without change:  0
  # solutions in current loop:       295
  # real solutions:                  0[K[A[K[A[K[A[K[A[K[ASolutions found: 409 	 Time: 0:00:03[K
  # paths tracked:                   1012
  # loops generated:                 2
  # completed loops without change:  0
  # solutions in current loop:       331
  # real solutions:                  0[K[A[K[A[K[A[K[A[K[ASolutions found: 435 	 Time: 0:00:03[K
  # paths tracked:                   1084
  # loops generated:                 2
  # completed loops without change:  0
  # solutions in current loop:       357
  # real solutions:                  0[K[A[K[A[K[A[K[A[K[ASolutions found: 453 	 Time: 0:00:03[K
  # paths tracked:                   1150
  # loops generated:                 2
  # completed loops without change:  0
  # solutions in current loop:       375
  # real solutions:                  0[K[A[K[A[K[A[K[A[K[ASolutions found: 459 	 Time: 0:00:03[K
  # paths tracked:                   1178
  # loops generated:                 2
  # completed loops without change:  0
  # solutions in current loop:       381
  # real solutions:                  0[K[A[K[A[K[A[K[A[K[ASolutions found: 475 	 Time: 0:00:03[K
  # paths tracked:                   1232
  # loops generated:                 2
  # completed loops without change:  0
  # solutions in current loop:       397
  # real solutions:                  0[K[A[K[A[K[A[K[A[K[ASolutions found: 496 	 Time: 0:00:03[K
  # paths tracked:                   1306
  # loops generated:                 2
  # completed loops without change:  0
  # solutions in current loop:       418
  # real solutions:                  0[K[A[K[A[K[A[K[A[K[ASolutions found: 517 	 Time: 0:00:03[K
  # paths tracked:                   1377
  # loops generated:                 2
  # completed loops without change:  0
  # solutions in current loop:       439
  # real solutions:                  0[K[A[K[A[K[A[K[A[K[ASolutions found: 531 	 Time: 0:00:03[K
  # paths tracked:                   1447
  # loops generated:                 2
  # completed loops without change:  0
  # solutions in current loop:       453
  # real solutions:                  0[K[A[K[A[K[A[K[A[K[ASolutions found: 550 	 Time: 0:00:04[K
  # paths tracked:                   1518
  # loops generated:                 2
  # completed loops without change:  0
  # solutions in current loop:       472
  # real solutions:                  0[K[A[K[A[K[A[K[A[K[ASolutions found: 567 	 Time: 0:00:04[K
  # paths tracked:                   1598
  # loops generated:                 2
  # completed loops without change:  0
  # solutions in current loop:       489
  # real solutions:                  0[K[A[K[A[K[A[K[A[K[ASolutions found: 577 	 Time: 0:00:04[K
  # paths tracked:                   1635
  # loops generated:                 2
  # completed loops without change:  0
  # solutions in current loop:       499
  # real solutions:                  0[K[A[K[A[K[A[K[A[K[ASolutions found: 589 	 Time: 0:00:04[K
  # paths tracked:                   1707
  # loops generated:                 2
  # completed loops without change:  0
  # solutions in current loop:       511
  # real solutions:                  0[K[A[K[A[K[A[K[A[K[ASolutions found: 601 	 Time: 0:00:04[K
  # paths tracked:                   1768
  # loops generated:                 2
  # completed loops without change:  0
  # solutions in current loop:       523
  # real solutions:                  0[K[A[K[A[K[A[K[A[K[ASolutions found: 608 	 Time: 0:00:04[K
  # paths tracked:                   1813
  # loops generated:                 2
  # completed loops without change:  0
  # solutions in current loop:       530
  # real solutions:                  0[K[A[K[A[K[A[K[A[K[ASolutions found: 619 	 Time: 0:00:04[K
  # paths tracked:                   1873
  # loops generated:                 2
  # completed loops without change:  0
  # solutions in current loop:       541
  # real solutions:                  0[K[A[K[A[K[A[K[A[K[ASolutions found: 636 	 Time: 0:00:04[K
  # paths tracked:                   1942
  # loops generated:                 2
  # completed loops without change:  0
  # solutions in current loop:       558
  # real solutions:                  0[K[A[K[A[K[A[K[A[K[ASolutions found: 649 	 Time: 0:00:04[K
  # paths tracked:                   2022
  # loops generated:                 2
  # completed loops without change:  0
  # solutions in current loop:       571
  # real solutions:                  0[K[A[K[A[K[A[K[A[K[ASolutions found: 663 	 Time: 0:00:05[K
  # paths tracked:                   2098
  # loops generated:                 2
  # completed loops without change:  0
  # solutions in current loop:       585
  # real solutions:                  0[K[A[K[A[K[A[K[A[K[ASolutions found: 674 	 Time: 0:00:05[K
  # paths tracked:                   2164
  # loops generated:                 2
  # completed loops without change:  0
  # solutions in current loop:       596
  # real solutions:                  0[K[A[K[A[K[A[K[A[K[ASolutions found: 678 	 Time: 0:00:05[K
  # paths tracked:                   2224
  # loops generated:                 2
  # completed loops without change:  0
  # solutions in current loop:       600
  # real solutions:                  0[K[A[K[A[K[A[K[A[K[ASolutions found: 683 	 Time: 0:00:05[K
  # paths tracked:                   2268
  # loops generated:                 2
  # completed loops without change:  0
  # solutions in current loop:       605
  # real solutions:                  0[K[A[K[A[K[A[K[A[K[ASolutions found: 686 	 Time: 0:00:05[K
  # paths tracked:                   2310
  # loops generated:                 2
  # completed loops without change:  0
  # solutions in current loop:       608
  # real solutions:                  0[K[A[K[A[K[A[K[A[K[ASolutions found: 688 	 Time: 0:00:05[K
  # paths tracked:                   2363
  # loops generated:                 2
  # completed loops without change:  0
  # solutions in current loop:       610
  # real solutions:                  0[K[A[K[A[K[A[K[A[K[ASolutions found: 698 	 Time: 0:00:05[K
  # paths tracked:                   2436
  # loops generated:                 2
  # completed loops without change:  0
  # solutions in current loop:       620
  # real solutions:                  0[K[A[K[A[K[A[K[A[K[ASolutions found: 702 	 Time: 0:00:05[K
  # paths tracked:                   2492
  # loops generated:                 2
  # completed loops without change:  0
  # solutions in current loop:       624
  # real solutions:                  0[K[A[K[A[K[A[K[A[K[ASolutions found: 706 	 Time: 0:00:05[K
  # paths tracked:                   2550
  # loops generated:                 2
  # completed loops without change:  0
  # solutions in current loop:       628
  # real solutions:                  0[K[A[K[A[K[A[K[A[K[ASolutions found: 710 	 Time: 0:00:06[K
  # paths tracked:                   2594
  # loops generated:                 2
  # completed loops without change:  0
  # solutions in current loop:       632
  # real solutions:                  0[K[A[K[A[K[A[K[A[K[ASolutions found: 715 	 Time: 0:00:06[K
  # paths tracked:                   2654
  # loops generated:                 2
  # completed loops without change:  0
  # solutions in current loop:       637
  # real solutions:                  0[K[A[K[A[K[A[K[A[K[ASolutions found: 717 	 Time: 0:00:06[K
  # paths tracked:                   2722
  # loops generated:                 2
  # completed loops without change:  0
  # solutions in current loop:       639
  # real solutions:                  0[K[A[K[A[K[A[K[A[K[ASolutions found: 720 	 Time: 0:00:06[K
  # paths tracked:                   2790
  # loops generated:                 2
  # completed loops without change:  0
  # solutions in current loop:       642
  # real solutions:                  0[K[A[K[A[K[A[K[A[K[ASolutions found: 720 	 Time: 0:00:06[K
Computing mixed cells... 1 	 Time: 0:00:00[K
  mixed_volume:  1[K[AComputing mixed cells... 47 	 Time: 0:00:00[K
  mixed_volume:  76
[ Info: SetupBuildDirectory: setting up build directory.
[ Info: Doctest: running doctests.
[ Info: Skipped ExpandTemplates step (doctest only).
[ Info: Skipped CrossReferences step (doctest only).
[ Info: Skipped CheckDocument step (doctest only).
[ Info: Skipped Populate step (doctest only).
[ Info: Skipped RenderDocument step (doctest only).
Test Summary:                        | Pass  Fail  Total
HomotopyContinuation                 | 1518     2   1520
  ModelKit                           |   82           82
  Utilities                          |  280          280
  Norms                              |   18           18
  LinearAlgebra                      |   70           70
  AffinePatches                      |   22           22
  Problems                           |   59           59
  Systems                            |   59           59
  Homotopies                         |  123          123
  Predictors                         |   48           48
  NewtonCorrector                    |   21           21
  CoreTracker                        |   76           76
  Valuation                          |   53           53
  Cauchy Endgame                     |   20           20
  PathTracker                        |  221          221
  Polyhedral                         |   18           18
  Overdetermined systems             |    5            5
  Solver                             |   84           84
  Result                             |  139          139
  Composition                        |    9            9
  ModelKit integration               |   19           19
  Monodromy                          |   66     2     68
    monodromy_solve                  |   46           46
    Method of Moments                |    2            2
    Trace Test                       |    2            2
    monodromy - automatic start pair |    5            5
    projective                       |    7            7
    monodromy group                  |    3     2      5
    monodromy group Fano problem     |    1            1
  Root counts                        |   23           23
  path_info                          |    2            2
  Doctests: HomotopyContinuation     |    1            1
ERROR: LoadError: Some tests did not pass: 1518 passed, 2 failed, 0 errored, 0 broken.
in expression starting at /home/pkgeval/.julia/packages/HomotopyContinuation/mJDHb/test/runtests.jl:26
ERROR: Package HomotopyContinuation errored during testing
Stacktrace:
 [1] pkgerror(::String) at /buildworker/worker/package_linux64/build/usr/share/julia/stdlib/v1.6/Pkg/src/Types.jl:52
 [2] test(::Pkg.Types.Context, ::Array{Pkg.Types.PackageSpec,1}; coverage::Bool, julia_args::Cmd, test_args::Cmd, test_fn::Nothing) at /buildworker/worker/package_linux64/build/usr/share/julia/stdlib/v1.6/Pkg/src/Operations.jl:1561
 [3] test(::Pkg.Types.Context, ::Array{Pkg.Types.PackageSpec,1}; coverage::Bool, test_fn::Nothing, julia_args::Cmd, test_args::Cmd, kwargs::Base.Iterators.Pairs{Union{},Union{},Tuple{},NamedTuple{(),Tuple{}}}) at /buildworker/worker/package_linux64/build/usr/share/julia/stdlib/v1.6/Pkg/src/API.jl:327
 [4] test(::Pkg.Types.Context, ::Array{Pkg.Types.PackageSpec,1}) at /buildworker/worker/package_linux64/build/usr/share/julia/stdlib/v1.6/Pkg/src/API.jl:314
 [5] #test#61 at /buildworker/worker/package_linux64/build/usr/share/julia/stdlib/v1.6/Pkg/src/API.jl:67 [inlined]
 [6] test at /buildworker/worker/package_linux64/build/usr/share/julia/stdlib/v1.6/Pkg/src/API.jl:67 [inlined]
 [7] #test#60 at /buildworker/worker/package_linux64/build/usr/share/julia/stdlib/v1.6/Pkg/src/API.jl:66 [inlined]
 [8] test at /buildworker/worker/package_linux64/build/usr/share/julia/stdlib/v1.6/Pkg/src/API.jl:66 [inlined]
 [9] test(::String; kwargs::Base.Iterators.Pairs{Union{},Union{},Tuple{},NamedTuple{(),Tuple{}}}) at /buildworker/worker/package_linux64/build/usr/share/julia/stdlib/v1.6/Pkg/src/API.jl:65
 [10] test(::String) at /buildworker/worker/package_linux64/build/usr/share/julia/stdlib/v1.6/Pkg/src/API.jl:65
 [11] top-level scope at none:16
