Julia Version 1.6.0-DEV.192
Commit 07385aba13 (2020-06-08 16:02 UTC)
Platform Info:
  OS: Linux (x86_64-linux-gnu)
  CPU: Intel(R) Xeon(R) Silver 4114 CPU @ 2.20GHz
  WORD_SIZE: 64
  LIBM: libopenlibm
  LLVM: libLLVM-9.0.1 (ORCJIT, skylake)
Environment:
  JULIA_DEPOT_PATH = ::/usr/local/share/julia
  JULIA_NUM_THREADS = 2

  Resolving package versions...
  Installed OpenSpecFun_jll ────────────── v0.5.3+3
  Installed Reexport ───────────────────── v0.2.0
  Installed XML2_jll ───────────────────── v2.9.9+4
  Installed LaTeXStrings ───────────────── v1.1.0
  Installed DynamicPolynomials ─────────── v0.3.10
  Installed ProgressMeter ──────────────── v1.3.0
  Installed EzXML ──────────────────────── v1.1.0
  Installed HomotopyContinuation ───────── v1.4.4
  Installed IteratorInterfaceExtensions ── v1.0.0
  Installed CompilerSupportLibraries_jll ─ v0.3.3+0
  Installed Crayons ────────────────────── v4.0.2
  Installed StaticArrays ───────────────── v0.12.3
  Installed Quadmath ───────────────────── v0.5.4
  Installed GenericSchur ───────────────── v0.4.0
  Installed Intervals ──────────────────── v1.2.0
  Installed Mocking ────────────────────── v0.7.1
  Installed DataAPI ────────────────────── v1.3.0
  Installed ElasticArrays ──────────────── v1.2.1
  Installed Requires ───────────────────── v1.0.1
  Installed Formatting ─────────────────── v0.4.1
  Installed FixedPolynomials ───────────── v0.4.0
  Installed DataValueInterfaces ────────── v1.0.0
  Installed MultivariatePolynomials ────── v0.3.9
  Installed MutableArithmetics ─────────── v0.2.9
  Installed PrettyTables ───────────────── v0.9.0
  Installed Tables ─────────────────────── v1.0.4
  Installed Libiconv_jll ───────────────── v1.16.0+2
  Installed TableTraits ────────────────── v1.0.0
  Installed Parameters ─────────────────── v0.12.1
  Installed TreeViews ──────────────────── v0.3.0
  Installed ExprTools ──────────────────── v0.1.1
  Installed GenericSVD ─────────────────── v0.3.0
  Installed Latexify ───────────────────── v0.13.5
  Installed DoubleFloats ───────────────── v1.1.11
  Installed StaticPolynomials ──────────── v1.3.3
  Installed TimeZones ──────────────────── v1.2.0
  Installed ProjectiveVectors ──────────── v1.1.2
  Installed MixedSubdivisions ──────────── v1.0.0
  Installed Zlib_jll ───────────────────── v1.2.11+10
  Installed Adapt ──────────────────────── v1.1.0
  Installed UnPack ─────────────────────── v1.0.1
  Installed MacroTools ─────────────────── v0.5.5
  Installed RecipesBase ────────────────── v1.0.1
  Installed DataStructures ─────────────── v0.17.17
  Installed Polynomials ────────────────── v1.1.1
  Installed SpecialFunctions ───────────── v0.10.3
  Installed OrderedCollections ─────────── v1.2.0
Updating `~/.julia/environments/v1.6/Project.toml`
  [f213a82b] + HomotopyContinuation v1.4.4
Updating `~/.julia/environments/v1.6/Manifest.toml`
  [79e6a3ab] + Adapt v1.1.0
  [e66e0078] + CompilerSupportLibraries_jll v0.3.3+0
  [a8cc5b0e] + Crayons v4.0.2
  [9a962f9c] + DataAPI v1.3.0
  [864edb3b] + DataStructures v0.17.17
  [e2d170a0] + DataValueInterfaces v1.0.0
  [497a8b3b] + DoubleFloats v1.1.11
  [7c1d4256] + DynamicPolynomials v0.3.10
  [fdbdab4c] + ElasticArrays v1.2.1
  [e2ba6199] + ExprTools v0.1.1
  [8f5d6c58] + EzXML v1.1.0
  [3dd14ad9] + FixedPolynomials v0.4.0
  [59287772] + Formatting v0.4.1
  [01680d73] + GenericSVD v0.3.0
  [c145ed77] + GenericSchur v0.4.0
  [f213a82b] + HomotopyContinuation v1.4.4
  [d8418881] + Intervals v1.2.0
  [82899510] + IteratorInterfaceExtensions v1.0.0
  [b964fa9f] + LaTeXStrings v1.1.0
  [23fbe1c1] + Latexify v0.13.5
  [94ce4f54] + Libiconv_jll v1.16.0+2
  [1914dd2f] + MacroTools v0.5.5
  [291d046c] + MixedSubdivisions v1.0.0
  [78c3b35d] + Mocking v0.7.1
  [102ac46a] + MultivariatePolynomials v0.3.9
  [d8a4904e] + MutableArithmetics v0.2.9
  [efe28fd5] + OpenSpecFun_jll v0.5.3+3
  [bac558e1] + OrderedCollections v1.2.0
  [d96e819e] + Parameters v0.12.1
  [f27b6e38] + Polynomials v1.1.1
  [08abe8d2] + PrettyTables v0.9.0
  [92933f4c] + ProgressMeter v1.3.0
  [01f381cc] + ProjectiveVectors v1.1.2
  [be4d8f0f] + Quadmath v0.5.4
  [3cdcf5f2] + RecipesBase v1.0.1
  [189a3867] + Reexport v0.2.0
  [ae029012] + Requires v1.0.1
  [276daf66] + SpecialFunctions v0.10.3
  [90137ffa] + StaticArrays v0.12.3
  [62e018b1] + StaticPolynomials v1.3.3
  [3783bdb8] + TableTraits v1.0.0
  [bd369af6] + Tables v1.0.4
  [f269a46b] + TimeZones v1.2.0
  [a2a6695c] + TreeViews v0.3.0
  [3a884ed6] + UnPack v1.0.1
  [02c8fc9c] + XML2_jll v2.9.9+4
  [83775a58] + Zlib_jll v1.2.11+10
  [2a0f44e3] + Base64
  [ade2ca70] + Dates
  [8ba89e20] + Distributed
  [9fa8497b] + Future
  [b77e0a4c] + InteractiveUtils
  [76f85450] + LibGit2
  [8f399da3] + Libdl
  [37e2e46d] + LinearAlgebra
  [56ddb016] + Logging
  [d6f4376e] + Markdown
  [44cfe95a] + Pkg
  [de0858da] + Printf
  [3fa0cd96] + REPL
  [9a3f8284] + Random
  [ea8e919c] + SHA
  [9e88b42a] + Serialization
  [6462fe0b] + Sockets
  [2f01184e] + SparseArrays
  [10745b16] + Statistics
  [8dfed614] + Test
  [cf7118a7] + UUIDs
  [4ec0a83e] + Unicode
   Building TimeZones → `~/.julia/packages/TimeZones/OjMoF/deps/build.log`
    Testing HomotopyContinuation
Status `/tmp/jl_rmu2hs/Project.toml`
  [e30172f5] Documenter v0.24.11
  [497a8b3b] DoubleFloats v1.1.11
  [7c1d4256] DynamicPolynomials v0.3.10
  [fdbdab4c] ElasticArrays v1.2.1
  [26cc04aa] FiniteDifferences v0.10.2
  [3dd14ad9] FixedPolynomials v0.4.0
  [f213a82b] HomotopyContinuation v1.4.4
  [23fbe1c1] Latexify v0.13.5
  [291d046c] MixedSubdivisions v1.0.0
  [102ac46a] MultivariatePolynomials v0.3.9
  [bac558e1] OrderedCollections v1.2.0
  [d96e819e] Parameters v0.12.1
  [4c526841] PolynomialTestSystems v0.1.4
  [08abe8d2] PrettyTables v0.9.0
  [01f381cc] ProjectiveVectors v1.1.2
  [90137ffa] StaticArrays v0.12.3
  [62e018b1] StaticPolynomials v1.3.3
  [a2a6695c] TreeViews v0.3.0
  [37e2e46d] LinearAlgebra
  [de0858da] Printf
  [9a3f8284] Random
  [8dfed614] Test
Status `/tmp/jl_rmu2hs/Manifest.toml`
  [79e6a3ab] Adapt v1.1.0
  [e66e0078] CompilerSupportLibraries_jll v0.3.3+0
  [a8cc5b0e] Crayons v4.0.2
  [9a962f9c] DataAPI v1.3.0
  [864edb3b] DataStructures v0.17.17
  [e2d170a0] DataValueInterfaces v1.0.0
  [ffbed154] DocStringExtensions v0.8.1
  [e30172f5] Documenter v0.24.11
  [497a8b3b] DoubleFloats v1.1.11
  [7c1d4256] DynamicPolynomials v0.3.10
  [fdbdab4c] ElasticArrays v1.2.1
  [e2ba6199] ExprTools v0.1.1
  [8f5d6c58] EzXML v1.1.0
  [26cc04aa] FiniteDifferences v0.10.2
  [3dd14ad9] FixedPolynomials v0.4.0
  [59287772] Formatting v0.4.1
  [01680d73] GenericSVD v0.3.0
  [c145ed77] GenericSchur v0.4.0
  [f213a82b] HomotopyContinuation v1.4.4
  [d8418881] Intervals v1.2.0
  [82899510] IteratorInterfaceExtensions v1.0.0
  [682c06a0] JSON v0.21.0
  [b964fa9f] LaTeXStrings v1.1.0
  [23fbe1c1] Latexify v0.13.5
  [94ce4f54] Libiconv_jll v1.16.0+2
  [1914dd2f] MacroTools v0.5.5
  [291d046c] MixedSubdivisions v1.0.0
  [78c3b35d] Mocking v0.7.1
  [102ac46a] MultivariatePolynomials v0.3.9
  [d8a4904e] MutableArithmetics v0.2.9
  [efe28fd5] OpenSpecFun_jll v0.5.3+3
  [bac558e1] OrderedCollections v1.2.0
  [d96e819e] Parameters v0.12.1
  [69de0a69] Parsers v1.0.5
  [4c526841] PolynomialTestSystems v0.1.4
  [f27b6e38] Polynomials v1.1.1
  [08abe8d2] PrettyTables v0.9.0
  [92933f4c] ProgressMeter v1.3.0
  [01f381cc] ProjectiveVectors v1.1.2
  [be4d8f0f] Quadmath v0.5.4
  [3cdcf5f2] RecipesBase v1.0.1
  [189a3867] Reexport v0.2.0
  [ae029012] Requires v1.0.1
  [276daf66] SpecialFunctions v0.10.3
  [90137ffa] StaticArrays v0.12.3
  [62e018b1] StaticPolynomials v1.3.3
  [3783bdb8] TableTraits v1.0.0
  [bd369af6] Tables v1.0.4
  [f269a46b] TimeZones v1.2.0
  [a2a6695c] TreeViews v0.3.0
  [3a884ed6] UnPack v1.0.1
  [02c8fc9c] XML2_jll v2.9.9+4
  [83775a58] Zlib_jll v1.2.11+10
  [2a0f44e3] Base64
  [ade2ca70] Dates
  [8ba89e20] Distributed
  [9fa8497b] Future
  [b77e0a4c] InteractiveUtils
  [76f85450] LibGit2
  [8f399da3] Libdl
  [37e2e46d] LinearAlgebra
  [56ddb016] Logging
  [d6f4376e] Markdown
  [a63ad114] Mmap
  [44cfe95a] Pkg
  [de0858da] Printf
  [3fa0cd96] REPL
  [9a3f8284] Random
  [ea8e919c] SHA
  [9e88b42a] Serialization
  [6462fe0b] Sockets
  [2f01184e] SparseArrays
  [10745b16] Statistics
  [8dfed614] Test
  [cf7118a7] UUIDs
  [4ec0a83e] Unicode
┌ Warning: `setup!(tracker::CoreTracker, x, t, t₀; kwargs...)` is deprecated, use `init!(tracker, x, t, t₀; kwargs...)` instead.
│   caller = top-level scope at core_tracker_test.jl:40
└ @ Core ~/.julia/packages/HomotopyContinuation/mJDHb/test/core_tracker_test.jl:40
┌ Warning: Solutions are now automatically refined to maximal achievable accuracy.
└ @ HomotopyContinuation ~/.julia/packages/HomotopyContinuation/mJDHb/src/core_tracker.jl:1410
┌ Warning: `set_refinement_accuracy!` is deprecated. Solutions are now automatically refined to maximal achievable accuracy.
└ @ HomotopyContinuation ~/.julia/packages/HomotopyContinuation/mJDHb/src/core_tracker.jl:1420
┌ Warning: `max_refinement_iters` is deprecated. Solutions are now automatically refined to the maximal achievable accuracy.
└ @ HomotopyContinuation ~/.julia/packages/HomotopyContinuation/mJDHb/src/core_tracker.jl:1429
┌ Warning: `set_max_refinement_iters` is deprecated. Solutions are now automatically refined to the maximal achievable accuracy.
└ @ HomotopyContinuation ~/.julia/packages/HomotopyContinuation/mJDHb/src/core_tracker.jl:1439
Univariate singular: 2,3,4,5,6,7,8,9,10,11,12,
Wilkinson: 1,2,3,4,5,6,7,8,9,10,11,12,13,14,15,16,17,18,
Computing mixed cells... 1 	 Time: 0:00:00[K
  mixed_volume:  5[K[AComputing mixed cells... 14 	 Time: 0:00:00[K
  mixed_volume:  70
Computing mixed cells... 1 	 Time: 0:00:00[K
  mixed_volume:  4[K[AComputing mixed cells... 190 	 Time: 0:00:00[K
  mixed_volume:  2195[K[AComputing mixed cells... 594 	 Time: 0:00:00[K
  mixed_volume:  4166[K[AComputing mixed cells... 939 	 Time: 0:00:01[K
  mixed_volume:  6941[K[AComputing mixed cells... 1495 	 Time: 0:00:01[K
  mixed_volume:  10794[K[AComputing mixed cells... 1822 	 Time: 0:00:01[K
  mixed_volume:  12192[K[AComputing mixed cells... 1881 	 Time: 0:00:01[K
  mixed_volume:  12636
Tracking 70 paths...  97%|██████████████████████████████████████▉ |  ETA: 0:00:00[K
  # paths tracked:                  68
  # non-singular solutions (real):  68 (10)
  # singular solutions (real):      0 (0)
  # total solutions (real):         68 (10)[A[A[A[A



[K[A[K[A[K[A[K[ATracking 70 paths... 100%|████████████████████████████████████████| Time: 0:00:00[K
  # paths tracked:                  70
  # non-singular solutions (real):  70 (10)
  # singular solutions (real):      0 (0)
  # total solutions (real):         70 (10)
Tracking 120 paths...  27%|██████████▋                             |  ETA: 0:00:01[K
  # paths tracked:                  32
  # non-singular solutions (real):  20 (4)
  # singular solutions (real):      0 (0)
  # total solutions (real):         20 (4)[A[A[A[A



[K[A[K[A[K[A[K[ATracking 120 paths... 100%|████████████████████████████████████████| Time: 0:00:00[K
  # paths tracked:                  120
  # non-singular solutions (real):  70 (10)
  # singular solutions (real):      0 (0)
  # total solutions (real):         70 (10)
Tracking 120 paths...  55%|██████████████████████                  |  ETA: 0:00:03[K
  # paths tracked:                  66
  # non-singular solutions (real):  38 (6)
  # singular solutions (real):      0 (0)
  # total solutions (real):         38 (6)[A[A[A[A



[K[A[K[A[K[A[K[ATracking 120 paths... 100%|████████████████████████████████████████| Time: 0:00:03[K
  # paths tracked:                  120
  # non-singular solutions (real):  70 (10)
  # singular solutions (real):      0 (0)
  # total solutions (real):         70 (10)
Tracking 216 paths...  31%|████████████▋                           |  ETA: 0:00:02[K
  # paths tracked:                  68
  # non-singular solutions (real):  26 (5)
  # singular solutions (real):      0 (0)
  # total solutions (real):         26 (5)[A[A[A[A



[K[A[K[A[K[A[K[ATracking 216 paths...  62%|████████████████████████▉               |  ETA: 0:00:01[K
  # paths tracked:                  134
  # non-singular solutions (real):  50 (7)
  # singular solutions (real):      0 (0)
  # total solutions (real):         50 (7)[A[A[A[A



[K[A[K[A[K[A[K[ATracking 216 paths...  93%|█████████████████████████████████████▁  |  ETA: 0:00:00[K
  # paths tracked:                  201
  # non-singular solutions (real):  75 (8)
  # singular solutions (real):      0 (0)
  # total solutions (real):         75 (8)[A[A[A[A



[K[A[K[A[K[A[K[ATracking 216 paths... 100%|████████████████████████████████████████| Time: 0:00:01[K
  # paths tracked:                  216
  # non-singular solutions (real):  80 (8)
  # singular solutions (real):      0 (0)
  # total solutions (real):         80 (8)
Tracking 125 paths...   2%|▋                                       |  ETA: 0:00:35[K
  # paths tracked:                  2
  # non-singular solutions (real):  2 (2)
  # singular solutions (real):      0 (0)
  # total solutions (real):         2 (2)[A[A[A[ASolutions found: 32 	 Time: 0:00:00[K
  # paths tracked:                   418
  # loops generated:                 7
  # completed loops without change:  0
  # solutions in current loop:       0
  # real solutions:                  0[K[A[K[A[K[A[K[A[K[ASolutions found: 36 	 Time: 0:00:00[K
  # paths tracked:                   612
  # loops generated:                 9
  # completed loops without change:  0
  # solutions in current loop:       1
  # real solutions:                  0[K[A[K[A[K[A[K[A[K[ASolutions found: 36 	 Time: 0:00:00[K
  # paths tracked:                   900
  # loops generated:                 13
  # completed loops without change:  3
  # solutions in current loop:       0
  # real solutions:                  0[K[A[K[A[K[A[K[A[K[ASolutions found: 36 	 Time: 0:00:00[K
  # paths tracked:                   1224
  # loops generated:                 17
  # completed loops without change:  7
  # solutions in current loop:       0
  # real solutions:                  0[K[A[K[A[K[A[K[A[K[ASolutions found: 36 	 Time: 0:00:00[K
┌ Warning: None of the provided solutions is a valid start solution.
└ @ HomotopyContinuation ~/.julia/packages/HomotopyContinuation/mJDHb/src/monodromy.jl:878
Solutions found: 15 	 Time: 0:00:00[K
  # paths tracked:                   45
  # loops generated:                 2
  # completed loops without change:  0
  # solutions in current loop:       3
  # real solutions:                  3[K[A[K[A[K[A[K[A[K[ASolutions found: 21 	 Time: 0:00:00[K
[ Info: Compute additional witnesses for completeness...
[ Info: Found 2 additional witnesses
[ Info: Compute trace...
[ Info: Norm of trace: 3.1722374355954876e-13
[ Info: Compute additional witnesses for completeness...
[ Info: Found 36 additional witnesses
[ Info: Compute trace...
[ Info: Norm of trace: 5.567326649918716e-9
Solutions found: 2 	 Time: 0:00:00[K
  # paths tracked:                   2
  # loops generated:                 1
  # completed loops without change:  0
  # solutions in current loop:       1
  # real solutions:                  0[K[A[K[A[K[A[K[A[K[ASolutions found: 20 	 Time: 0:00:00[K
  # paths tracked:                   38
  # loops generated:                 1
  # completed loops without change:  0
  # solutions in current loop:       19
  # real solutions:                  0[K[A[K[A[K[A[K[A[K[ASolutions found: 40 	 Time: 0:00:00[K
  # paths tracked:                   78
  # loops generated:                 1
  # completed loops without change:  0
  # solutions in current loop:       39
  # real solutions:                  0[K[A[K[A[K[A[K[A[K[ASolutions found: 50 	 Time: 0:00:01[K
Solutions found: 2 	 Time: 0:00:00[K
  # paths tracked:                   2
  # loops generated:                 1
  # completed loops without change:  0
  # solutions in current loop:       1
  # real solutions:                  0[K[A[K[A[K[A[K[A[K[ASolutions found: 14 	 Time: 0:00:00[K
  # paths tracked:                   26
  # loops generated:                 1
  # completed loops without change:  0
  # solutions in current loop:       13
  # real solutions:                  0[K[A[K[A[K[A[K[A[K[ASolutions found: 21 	 Time: 0:00:00[K
  # paths tracked:                   40
  # loops generated:                 1
  # completed loops without change:  0
  # solutions in current loop:       20
  # real solutions:                  0[K[A[K[A[K[A[K[A[K[ASolutions found: 24 	 Time: 0:00:01[K
  # paths tracked:                   46
  # loops generated:                 1
  # completed loops without change:  0
  # solutions in current loop:       23
  # real solutions:                  0[K[A[K[A[K[A[K[A[K[ASolutions found: 38 	 Time: 0:00:01[K
  # paths tracked:                   74
  # loops generated:                 1
  # completed loops without change:  0
  # solutions in current loop:       37
  # real solutions:                  0[K[A[K[A[K[A[K[A[K[ASolutions found: 48 	 Time: 0:00:01[K
  # paths tracked:                   94
  # loops generated:                 1
  # completed loops without change:  0
  # solutions in current loop:       47
  # real solutions:                  0[K[A[K[A[K[A[K[A[K[ASolutions found: 52 	 Time: 0:00:01[K
  # paths tracked:                   102
  # loops generated:                 1
  # completed loops without change:  0
  # solutions in current loop:       51
  # real solutions:                  0[K[A[K[A[K[A[K[A[K[ASolutions found: 67 	 Time: 0:00:01[K
  # paths tracked:                   132
  # loops generated:                 1
  # completed loops without change:  0
  # solutions in current loop:       66
  # real solutions:                  0[K[A[K[A[K[A[K[A[K[ASolutions found: 74 	 Time: 0:00:01[K
  # paths tracked:                   146
  # loops generated:                 1
  # completed loops without change:  0
  # solutions in current loop:       73
  # real solutions:                  0[K[A[K[A[K[A[K[A[K[ASolutions found: 83 	 Time: 0:00:01[K
  # paths tracked:                   164
  # loops generated:                 1
  # completed loops without change:  0
  # solutions in current loop:       82
  # real solutions:                  0[K[A[K[A[K[A[K[A[K[ASolutions found: 90 	 Time: 0:00:01[K
  # paths tracked:                   178
  # loops generated:                 1
  # completed loops without change:  0
  # solutions in current loop:       89
  # real solutions:                  0[K[A[K[A[K[A[K[A[K[ASolutions found: 102 	 Time: 0:00:01[K
  # paths tracked:                   202
  # loops generated:                 1
  # completed loops without change:  0
  # solutions in current loop:       101
  # real solutions:                  0[K[A[K[A[K[A[K[A[K[ASolutions found: 107 	 Time: 0:00:02[K
  # paths tracked:                   212
  # loops generated:                 1
  # completed loops without change:  0
  # solutions in current loop:       106
  # real solutions:                  0[K[A[K[A[K[A[K[A[K[ASolutions found: 115 	 Time: 0:00:02[K
  # paths tracked:                   228
  # loops generated:                 1
  # completed loops without change:  0
  # solutions in current loop:       114
  # real solutions:                  0[K[A[K[A[K[A[K[A[K[ASolutions found: 122 	 Time: 0:00:02[K
  # paths tracked:                   242
  # loops generated:                 1
  # completed loops without change:  0
  # solutions in current loop:       121
  # real solutions:                  0[K[A[K[A[K[A[K[A[K[ASolutions found: 137 	 Time: 0:00:02[K
  # paths tracked:                   272
  # loops generated:                 1
  # completed loops without change:  0
  # solutions in current loop:       136
  # real solutions:                  0[K[A[K[A[K[A[K[A[K[ASolutions found: 145 	 Time: 0:00:02[K
  # paths tracked:                   288
  # loops generated:                 1
  # completed loops without change:  0
  # solutions in current loop:       144
  # real solutions:                  0[K[A[K[A[K[A[K[A[K[ASolutions found: 156 	 Time: 0:00:02[K
  # paths tracked:                   310
  # loops generated:                 1
  # completed loops without change:  0
  # solutions in current loop:       155
  # real solutions:                  0[K[A[K[A[K[A[K[A[K[ASolutions found: 164 	 Time: 0:00:02[K
  # paths tracked:                   326
  # loops generated:                 1
  # completed loops without change:  0
  # solutions in current loop:       163
  # real solutions:                  0[K[A[K[A[K[A[K[A[K[ASolutions found: 175 	 Time: 0:00:02[K
  # paths tracked:                   348
  # loops generated:                 1
  # completed loops without change:  0
  # solutions in current loop:       174
  # real solutions:                  0[K[A[K[A[K[A[K[A[K[ASolutions found: 182 	 Time: 0:00:02[K
  # paths tracked:                   362
  # loops generated:                 1
  # completed loops without change:  0
  # solutions in current loop:       181
  # real solutions:                  0[K[A[K[A[K[A[K[A[K[ASolutions found: 197 	 Time: 0:00:03[K
  # paths tracked:                   392
  # loops generated:                 1
  # completed loops without change:  0
  # solutions in current loop:       196
  # real solutions:                  0[K[A[K[A[K[A[K[A[K[ASolutions found: 212 	 Time: 0:00:03[K
  # paths tracked:                   422
  # loops generated:                 1
  # completed loops without change:  0
  # solutions in current loop:       211
  # real solutions:                  0[K[A[K[A[K[A[K[A[K[ASolutions found: 226 	 Time: 0:00:03[K
  # paths tracked:                   450
  # loops generated:                 1
  # completed loops without change:  0
  # solutions in current loop:       225
  # real solutions:                  0[K[A[K[A[K[A[K[A[K[ASolutions found: 230 	 Time: 0:00:03[K
  # paths tracked:                   458
  # loops generated:                 1
  # completed loops without change:  0
  # solutions in current loop:       229
  # real solutions:                  0[K[A[K[A[K[A[K[A[K[ASolutions found: 237 	 Time: 0:00:03[K
  # paths tracked:                   472
  # loops generated:                 1
  # completed loops without change:  0
  # solutions in current loop:       236
  # real solutions:                  0[K[A[K[A[K[A[K[A[K[ASolutions found: 244 	 Time: 0:00:03[K
  # paths tracked:                   486
  # loops generated:                 1
  # completed loops without change:  0
  # solutions in current loop:       243
  # real solutions:                  0[K[A[K[A[K[A[K[A[K[ASolutions found: 248 	 Time: 0:00:03[K
  # paths tracked:                   494
  # loops generated:                 1
  # completed loops without change:  0
  # solutions in current loop:       247
  # real solutions:                  0[K[A[K[A[K[A[K[A[K[ASolutions found: 260 	 Time: 0:00:03[K
  # paths tracked:                   526
  # loops generated:                 2
  # completed loops without change:  0
  # solutions in current loop:       12
  # real solutions:                  0[K[A[K[A[K[A[K[A[K[ASolutions found: 271 	 Time: 0:00:03[K
  # paths tracked:                   567
  # loops generated:                 2
  # completed loops without change:  0
  # solutions in current loop:       23
  # real solutions:                  0[K[A[K[A[K[A[K[A[K[ASolutions found: 288 	 Time: 0:00:04[K
  # paths tracked:                   621
  # loops generated:                 2
  # completed loops without change:  0
  # solutions in current loop:       40
  # real solutions:                  0[K[A[K[A[K[A[K[A[K[ASolutions found: 308 	 Time: 0:00:04[K
  # paths tracked:                   681
  # loops generated:                 2
  # completed loops without change:  0
  # solutions in current loop:       60
  # real solutions:                  0[K[A[K[A[K[A[K[A[K[ASolutions found: 323 	 Time: 0:00:04[K
  # paths tracked:                   733
  # loops generated:                 2
  # completed loops without change:  0
  # solutions in current loop:       75
  # real solutions:                  0[K[A[K[A[K[A[K[A[K[ASolutions found: 338 	 Time: 0:00:04[K
  # paths tracked:                   793
  # loops generated:                 2
  # completed loops without change:  0
  # solutions in current loop:       90
  # real solutions:                  0[K[A[K[A[K[A[K[A[K[ASolutions found: 354 	 Time: 0:00:04[K
  # paths tracked:                   854
  # loops generated:                 2
  # completed loops without change:  0
  # solutions in current loop:       106
  # real solutions:                  0[K[A[K[A[K[A[K[A[K[ASolutions found: 370 	 Time: 0:00:04[K
  # paths tracked:                   891
  # loops generated:                 2
  # completed loops without change:  0
  # solutions in current loop:       122
  # real solutions:                  0[K[A[K[A[K[A[K[A[K[ASolutions found: 376 	 Time: 0:00:04[K
  # paths tracked:                   915
  # loops generated:                 2
  # completed loops without change:  0
  # solutions in current loop:       128
  # real solutions:                  0[K[A[K[A[K[A[K[A[K[ASolutions found: 388 	 Time: 0:00:04[K
  # paths tracked:                   945
  # loops generated:                 2
  # completed loops without change:  0
  # solutions in current loop:       140
  # real solutions:                  0[K[A[K[A[K[A[K[A[K[ASolutions found: 399 	 Time: 0:00:04[K
  # paths tracked:                   979
  # loops generated:                 2
  # completed loops without change:  0
  # solutions in current loop:       151
  # real solutions:                  0[K[A[K[A[K[A[K[A[K[ASolutions found: 409 	 Time: 0:00:04[K
  # paths tracked:                   1014
  # loops generated:                 2
  # completed loops without change:  0
  # solutions in current loop:       161
  # real solutions:                  0[K[A[K[A[K[A[K[A[K[ASolutions found: 421 	 Time: 0:00:05[K
  # paths tracked:                   1055
  # loops generated:                 2
  # completed loops without change:  0
  # solutions in current loop:       173
  # real solutions:                  0[K[A[K[A[K[A[K[A[K[ASolutions found: 435 	 Time: 0:00:05[K
  # paths tracked:                   1097
  # loops generated:                 2
  # completed loops without change:  0
  # solutions in current loop:       187
  # real solutions:                  0[K[A[K[A[K[A[K[A[K[ASolutions found: 445 	 Time: 0:00:05[K
  # paths tracked:                   1141
  # loops generated:                 2
  # completed loops without change:  0
  # solutions in current loop:       197
  # real solutions:                  0[K[A[K[A[K[A[K[A[K[ASolutions found: 450 	 Time: 0:00:05[K
  # paths tracked:                   1164
  # loops generated:                 2
  # completed loops without change:  0
  # solutions in current loop:       202
  # real solutions:                  0[K[A[K[A[K[A[K[A[K[ASolutions found: 461 	 Time: 0:00:05[K
  # paths tracked:                   1197
  # loops generated:                 2
  # completed loops without change:  0
  # solutions in current loop:       213
  # real solutions:                  0[K[A[K[A[K[A[K[A[K[ASolutions found: 472 	 Time: 0:00:05[K
  # paths tracked:                   1233
  # loops generated:                 2
  # completed loops without change:  0
  # solutions in current loop:       224
  # real solutions:                  0[K[A[K[A[K[A[K[A[K[ASolutions found: 484 	 Time: 0:00:05[K
  # paths tracked:                   1271
  # loops generated:                 2
  # completed loops without change:  0
  # solutions in current loop:       236
  # real solutions:                  0[K[A[K[A[K[A[K[A[K[ASolutions found: 490 	 Time: 0:00:05[K
  # paths tracked:                   1309
  # loops generated:                 2
  # completed loops without change:  0
  # solutions in current loop:       242
  # real solutions:                  0[K[A[K[A[K[A[K[A[K[ASolutions found: 507 	 Time: 0:00:06[K
  # paths tracked:                   1371
  # loops generated:                 2
  # completed loops without change:  0
  # solutions in current loop:       259
  # real solutions:                  0[K[A[K[A[K[A[K[A[K[ASolutions found: 528 	 Time: 0:00:06[K
  # paths tracked:                   1447
  # loops generated:                 2
  # completed loops without change:  0
  # solutions in current loop:       280
  # real solutions:                  0[K[A[K[A[K[A[K[A[K[ASolutions found: 543 	 Time: 0:00:06[K
  # paths tracked:                   1519
  # loops generated:                 2
  # completed loops without change:  0
  # solutions in current loop:       295
  # real solutions:                  0[K[A[K[A[K[A[K[A[K[ASolutions found: 556 	 Time: 0:00:06[K
  # paths tracked:                   1561
  # loops generated:                 2
  # completed loops without change:  0
  # solutions in current loop:       308
  # real solutions:                  0[K[A[K[A[K[A[K[A[K[ASolutions found: 561 	 Time: 0:00:06[K
  # paths tracked:                   1589
  # loops generated:                 2
  # completed loops without change:  0
  # solutions in current loop:       313
  # real solutions:                  0[K[A[K[A[K[A[K[A[K[ASolutions found: 571 	 Time: 0:00:06[K
  # paths tracked:                   1624
  # loops generated:                 2
  # completed loops without change:  0
  # solutions in current loop:       323
  # real solutions:                  0[K[A[K[A[K[A[K[A[K[ASolutions found: 582 	 Time: 0:00:06[K
  # paths tracked:                   1669
  # loops generated:                 2
  # completed loops without change:  0
  # solutions in current loop:       334
  # real solutions:                  0[K[A[K[A[K[A[K[A[K[ASolutions found: 591 	 Time: 0:00:06[K
  # paths tracked:                   1707
  # loops generated:                 2
  # completed loops without change:  0
  # solutions in current loop:       343
  # real solutions:                  0[K[A[K[A[K[A[K[A[K[ASolutions found: 600 	 Time: 0:00:06[K
  # paths tracked:                   1756
  # loops generated:                 2
  # completed loops without change:  0
  # solutions in current loop:       352
  # real solutions:                  0[K[A[K[A[K[A[K[A[K[ASolutions found: 613 	 Time: 0:00:06[K
  # paths tracked:                   1819
  # loops generated:                 2
  # completed loops without change:  0
  # solutions in current loop:       365
  # real solutions:                  0[K[A[K[A[K[A[K[A[K[ASolutions found: 625 	 Time: 0:00:07[K
  # paths tracked:                   1876
  # loops generated:                 2
  # completed loops without change:  0
  # solutions in current loop:       377
  # real solutions:                  0[K[A[K[A[K[A[K[A[K[ASolutions found: 632 	 Time: 0:00:07[K
  # paths tracked:                   1916
  # loops generated:                 2
  # completed loops without change:  0
  # solutions in current loop:       384
  # real solutions:                  0[K[A[K[A[K[A[K[A[K[ASolutions found: 643 	 Time: 0:00:07[K
  # paths tracked:                   1976
  # loops generated:                 2
  # completed loops without change:  0
  # solutions in current loop:       395
  # real solutions:                  0[K[A[K[A[K[A[K[A[K[ASolutions found: 647 	 Time: 0:00:07[K
  # paths tracked:                   2012
  # loops generated:                 2
  # completed loops without change:  0
  # solutions in current loop:       399
  # real solutions:                  0[K[A[K[A[K[A[K[A[K[ASolutions found: 656 	 Time: 0:00:07[K
  # paths tracked:                   2062
  # loops generated:                 2
  # completed loops without change:  0
  # solutions in current loop:       408
  # real solutions:                  0[K[A[K[A[K[A[K[A[K[ASolutions found: 668 	 Time: 0:00:07[K
  # paths tracked:                   2134
  # loops generated:                 2
  # completed loops without change:  0
  # solutions in current loop:       420
  # real solutions:                  0[K[A[K[A[K[A[K[A[K[ASolutions found: 677 	 Time: 0:00:07[K
  # paths tracked:                   2240
  # loops generated:                 2
  # completed loops without change:  0
  # solutions in current loop:       429
  # real solutions:                  0[K[A[K[A[K[A[K[A[K[ASolutions found: 686 	 Time: 0:00:08[K
  # paths tracked:                   2310
  # loops generated:                 2
  # completed loops without change:  0
  # solutions in current loop:       438
  # real solutions:                  0[K[A[K[A[K[A[K[A[K[ASolutions found: 693 	 Time: 0:00:08[K
  # paths tracked:                   2368
  # loops generated:                 2
  # completed loops without change:  0
  # solutions in current loop:       445
  # real solutions:                  0[K[A[K[A[K[A[K[A[K[ASolutions found: 701 	 Time: 0:00:08[K
  # paths tracked:                   2418
  # loops generated:                 2
  # completed loops without change:  0
  # solutions in current loop:       453
  # real solutions:                  0[K[A[K[A[K[A[K[A[K[ASolutions found: 702 	 Time: 0:00:08[K
  # paths tracked:                   2469
  # loops generated:                 2
  # completed loops without change:  0
  # solutions in current loop:       454
  # real solutions:                  0[K[A[K[A[K[A[K[A[K[ASolutions found: 707 	 Time: 0:00:08[K
  # paths tracked:                   2528
  # loops generated:                 2
  # completed loops without change:  0
  # solutions in current loop:       459
  # real solutions:                  0[K[A[K[A[K[A[K[A[K[ASolutions found: 712 	 Time: 0:00:08[K
  # paths tracked:                   2576
  # loops generated:                 2
  # completed loops without change:  0
  # solutions in current loop:       464
  # real solutions:                  0[K[A[K[A[K[A[K[A[K[ASolutions found: 712 	 Time: 0:00:08[K
  # paths tracked:                   2617
  # loops generated:                 2
  # completed loops without change:  0
  # solutions in current loop:       464
  # real solutions:                  0[K[A[K[A[K[A[K[A[K[ASolutions found: 712 	 Time: 0:00:08[K
  # paths tracked:                   2656
  # loops generated:                 2
  # completed loops without change:  0
  # solutions in current loop:       464
  # real solutions:                  0[K[A[K[A[K[A[K[A[K[ASolutions found: 715 	 Time: 0:00:08[K
  # paths tracked:                   2696
  # loops generated:                 2
  # completed loops without change:  0
  # solutions in current loop:       467
  # real solutions:                  0[K[A[K[A[K[A[K[A[K[ASolutions found: 717 	 Time: 0:00:09[K
  # paths tracked:                   2760
  # loops generated:                 2
  # completed loops without change:  0
  # solutions in current loop:       469
  # real solutions:                  0[K[A[K[A[K[A[K[A[K[ASolutions found: 719 	 Time: 0:00:09[K
  # paths tracked:                   2820
  # loops generated:                 2
  # completed loops without change:  0
  # solutions in current loop:       471
  # real solutions:                  0[K[A[K[A[K[A[K[A[K[ASolutions found: 720 	 Time: 0:00:09[K
Computing mixed cells... 1 	 Time: 0:00:00[K
  mixed_volume:  1[K[AComputing mixed cells... 47 	 Time: 0:00:00[K
  mixed_volume:  76
Bio-chemical reaction networks: Test Failed at /home/pkgeval/.julia/packages/HomotopyContinuation/mJDHb/test/root_count_test.jl:216
  Expression: 97 ≤ results3_template[7] ≤ 100
   Evaluated: 97 ≤ 96 ≤ 100
Stacktrace:
 [1] top-level scope at /home/pkgeval/.julia/packages/HomotopyContinuation/mJDHb/test/root_count_test.jl:216
 [2] top-level scope at /workspace/srcdir/usr/share/julia/stdlib/v1.6/Test/src/Test.jl:1115
 [3] top-level scope at /home/pkgeval/.julia/packages/HomotopyContinuation/mJDHb/test/root_count_test.jl:71
 [4] top-level scope at /workspace/srcdir/usr/share/julia/stdlib/v1.6/Test/src/Test.jl:1115
 [5] top-level scope at /home/pkgeval/.julia/packages/HomotopyContinuation/mJDHb/test/root_count_test.jl:3
[ Info: SetupBuildDirectory: setting up build directory.
[ Info: Doctest: running doctests.
[ Info: Skipped ExpandTemplates step (doctest only).
[ Info: Skipped CrossReferences step (doctest only).
[ Info: Skipped CheckDocument step (doctest only).
[ Info: Skipped Populate step (doctest only).
[ Info: Skipped RenderDocument step (doctest only).
Test Summary:                      | Pass  Fail  Total
HomotopyContinuation               | 1519     1   1520
  ModelKit                         |   82           82
  Utilities                        |  280          280
  Norms                            |   18           18
  LinearAlgebra                    |   70           70
  AffinePatches                    |   22           22
  Problems                         |   59           59
  Systems                          |   59           59
  Homotopies                       |  123          123
  Predictors                       |   48           48
  NewtonCorrector                  |   21           21
  CoreTracker                      |   76           76
  Valuation                        |   53           53
  Cauchy Endgame                   |   20           20
  PathTracker                      |  221          221
  Polyhedral                       |   18           18
  Overdetermined systems           |    5            5
  Solver                           |   84           84
  Result                           |  139          139
  Composition                      |    9            9
  ModelKit integration             |   19           19
  Monodromy                        |   68           68
  Root counts                      |   22     1     23
    Benchmark systems              |   10           10
    Multi-homogeneous              |    2            2
    Bio-chemical reaction networks |   10     1     11
      bacillus_subtilis            |    3            3
  path_info                        |    2            2
  Doctests: HomotopyContinuation   |    1            1
ERROR: LoadError: Some tests did not pass: 1519 passed, 1 failed, 0 errored, 0 broken.
in expression starting at /home/pkgeval/.julia/packages/HomotopyContinuation/mJDHb/test/runtests.jl:26
ERROR: Package HomotopyContinuation errored during testing
Stacktrace:
 [1] pkgerror(::String) at /workspace/srcdir/usr/share/julia/stdlib/v1.6/Pkg/src/Types.jl:52
 [2] test(::Pkg.Types.Context, ::Array{Pkg.Types.PackageSpec,1}; coverage::Bool, julia_args::Cmd, test_args::Cmd, test_fn::Nothing) at /workspace/srcdir/usr/share/julia/stdlib/v1.6/Pkg/src/Operations.jl:1561
 [3] test(::Pkg.Types.Context, ::Array{Pkg.Types.PackageSpec,1}; coverage::Bool, test_fn::Nothing, julia_args::Cmd, test_args::Cmd, kwargs::Base.Iterators.Pairs{Union{},Union{},Tuple{},NamedTuple{(),Tuple{}}}) at /workspace/srcdir/usr/share/julia/stdlib/v1.6/Pkg/src/API.jl:327
 [4] test(::Pkg.Types.Context, ::Array{Pkg.Types.PackageSpec,1}) at /workspace/srcdir/usr/share/julia/stdlib/v1.6/Pkg/src/API.jl:314
 [5] #test#61 at /workspace/srcdir/usr/share/julia/stdlib/v1.6/Pkg/src/API.jl:67 [inlined]
 [6] test at /workspace/srcdir/usr/share/julia/stdlib/v1.6/Pkg/src/API.jl:67 [inlined]
 [7] #test#60 at /workspace/srcdir/usr/share/julia/stdlib/v1.6/Pkg/src/API.jl:66 [inlined]
 [8] test at /workspace/srcdir/usr/share/julia/stdlib/v1.6/Pkg/src/API.jl:66 [inlined]
 [9] test(::String; kwargs::Base.Iterators.Pairs{Union{},Union{},Tuple{},NamedTuple{(),Tuple{}}}) at /workspace/srcdir/usr/share/julia/stdlib/v1.6/Pkg/src/API.jl:65
 [10] test(::String) at /workspace/srcdir/usr/share/julia/stdlib/v1.6/Pkg/src/API.jl:65
 [11] top-level scope at none:16
