Julia Version 1.5.0-DEV.82
Commit 67f5a10e9b (2020-01-16 22:11 UTC)
Platform Info:
  OS: Linux (x86_64-linux-gnu)
  CPU: Intel(R) Xeon(R) Silver 4114 CPU @ 2.20GHz
  WORD_SIZE: 64
  LIBM: libopenlibm
  LLVM: libLLVM-8.0.1 (ORCJIT, skylake)
Environment:
  JULIA_DEPOT_PATH = ::/usr/local/share/julia
  JULIA_NUM_THREADS = 2

 Resolving package versions...
 Installed SortingAlgorithms ─────────── v0.3.1
 Installed OpenSpecFun_jll ───────────── v0.5.3+1
 Installed MultivariateStats ─────────── v0.7.0
 Installed Arpack ────────────────────── v0.4.0
 Installed TableTraits ───────────────── v1.0.0
 Installed Parameters ────────────────── v0.12.0
 Installed BinaryProvider ────────────── v0.5.8
 Installed MLJ ───────────────────────── v0.7.0
 Installed Parsers ───────────────────── v0.3.10
 Installed ComputationalResources ────── v0.3.0
 Installed ProgressMeter ─────────────── v1.2.0
 Installed StatsFuns ─────────────────── v0.9.3
 Installed OrderedCollections ────────── v1.1.0
 Installed DataStructures ────────────── v0.17.9
 Installed Rmath ─────────────────────── v0.6.0
 Installed Crayons ───────────────────── v4.0.1
 Installed SpecialFunctions ──────────── v0.9.0
 Installed InvertedIndices ───────────── v1.0.0
 Installed DataAPI ───────────────────── v1.1.0
 Installed LearnBase ─────────────────── v0.2.2
 Installed Formatting ────────────────── v0.4.1
 Installed Distributions ─────────────── v0.21.12
 Installed DataValueInterfaces ───────── v1.0.0
 Installed FixedPointNumbers ─────────── v0.7.1
 Installed Tables ────────────────────── v0.2.11
 Installed LossFunctions ─────────────── v0.5.1
 Installed MLJModels ─────────────────── v0.7.0
 Installed JSON ──────────────────────── v0.21.0
 Installed QuadGK ────────────────────── v2.3.1
 Installed Arpack_jll ────────────────── v3.5.0+2
 Installed Reexport ──────────────────── v0.2.0
 Installed PDMats ────────────────────── v0.9.10
 Installed OpenBLAS_jll ──────────────── v0.3.7+4
 Installed FillArrays ────────────────── v0.8.4
 Installed Distances ─────────────────── v0.8.2
 Installed Requires ──────────────────── v0.5.2
 Installed Compat ────────────────────── v2.2.0
 Installed Missings ──────────────────── v0.4.3
 Installed StatsBase ─────────────────── v0.32.0
 Installed ColorTypes ────────────────── v0.8.1
 Installed RecipesBase ───────────────── v0.7.0
 Installed IteratorInterfaceExtensions ─ v1.0.0
 Installed PrettyTables ──────────────── v0.6.0
 Installed MLJBase ───────────────────── v0.10.1
 Installed CategoricalArrays ─────────── v0.7.7
 Installed ScientificTypes ───────────── v0.5.1
 Installed DocStringExtensions ───────── v0.8.1
  Updating `~/.julia/environments/v1.5/Project.toml`
  [add582a8] + MLJ v0.7.0
  Updating `~/.julia/environments/v1.5/Manifest.toml`
  [7d9fca2a] + Arpack v0.4.0
  [68821587] + Arpack_jll v3.5.0+2
  [b99e7846] + BinaryProvider v0.5.8
  [324d7699] + CategoricalArrays v0.7.7
  [3da002f7] + ColorTypes v0.8.1
  [34da2185] + Compat v2.2.0
  [ed09eef8] + ComputationalResources v0.3.0
  [a8cc5b0e] + Crayons v4.0.1
  [9a962f9c] + DataAPI v1.1.0
  [864edb3b] + DataStructures v0.17.9
  [e2d170a0] + DataValueInterfaces v1.0.0
  [b4f34e82] + Distances v0.8.2
  [31c24e10] + Distributions v0.21.12
  [ffbed154] + DocStringExtensions v0.8.1
  [1a297f60] + FillArrays v0.8.4
  [53c48c17] + FixedPointNumbers v0.7.1
  [59287772] + Formatting v0.4.1
  [41ab1584] + InvertedIndices v1.0.0
  [82899510] + IteratorInterfaceExtensions v1.0.0
  [682c06a0] + JSON v0.21.0
  [7f8f8fb0] + LearnBase v0.2.2
  [30fc2ffe] + LossFunctions v0.5.1
  [add582a8] + MLJ v0.7.0
  [a7f614a8] + MLJBase v0.10.1
  [d491faf4] + MLJModels v0.7.0
  [e1d29d7a] + Missings v0.4.3
  [6f286f6a] + MultivariateStats v0.7.0
  [4536629a] + OpenBLAS_jll v0.3.7+4
  [efe28fd5] + OpenSpecFun_jll v0.5.3+1
  [bac558e1] + OrderedCollections v1.1.0
  [90014a1f] + PDMats v0.9.10
  [d96e819e] + Parameters v0.12.0
  [69de0a69] + Parsers v0.3.10
  [08abe8d2] + PrettyTables v0.6.0
  [92933f4c] + ProgressMeter v1.2.0
  [1fd47b50] + QuadGK v2.3.1
  [3cdcf5f2] + RecipesBase v0.7.0
  [189a3867] + Reexport v0.2.0
  [ae029012] + Requires v0.5.2
  [79098fc4] + Rmath v0.6.0
  [321657f4] + ScientificTypes v0.5.1
  [a2af1166] + SortingAlgorithms v0.3.1
  [276daf66] + SpecialFunctions v0.9.0
  [2913bbd2] + StatsBase v0.32.0
  [4c63d2b9] + StatsFuns v0.9.3
  [3783bdb8] + TableTraits v1.0.0
  [bd369af6] + Tables v0.2.11
  [2a0f44e3] + Base64 
  [ade2ca70] + Dates 
  [8bb1440f] + DelimitedFiles 
  [8ba89e20] + Distributed 
  [9fa8497b] + Future 
  [b77e0a4c] + InteractiveUtils 
  [76f85450] + LibGit2 
  [8f399da3] + Libdl 
  [37e2e46d] + LinearAlgebra 
  [56ddb016] + Logging 
  [d6f4376e] + Markdown 
  [a63ad114] + Mmap 
  [44cfe95a] + Pkg 
  [de0858da] + Printf 
  [3fa0cd96] + REPL 
  [9a3f8284] + Random 
  [ea8e919c] + SHA 
  [9e88b42a] + Serialization 
  [1a1011a3] + SharedArrays 
  [6462fe0b] + Sockets 
  [2f01184e] + SparseArrays 
  [10745b16] + Statistics 
  [4607b0f0] + SuiteSparse 
  [8dfed614] + Test 
  [cf7118a7] + UUIDs 
  [4ec0a83e] + Unicode 
  Building Rmath → `~/.julia/packages/Rmath/BoBag/deps/build.log`
  Updating `/tmp/jl_rEnZPf/Project.toml`
 [no changes]
  Updating `/tmp/jl_rEnZPf/Manifest.toml`
 [no changes]
   Testing MLJ
 Installed Zlib_jll ─────────── v1.2.11+7
 Installed StaticArrays ─────── v0.12.1
 Installed NearestNeighbors ─── v0.4.4
 Installed EzXML ────────────── v1.1.0
 Installed PooledArrays ─────── v0.5.3
 Installed DecisionTree ─────── v0.10.1
 Installed CodecZlib ────────── v0.6.0
 Installed WeakRefStrings ───── v0.6.2
 Installed FileIO ───────────── v1.2.1
 Installed RData ────────────── v0.6.3
 Installed UnicodePlots ─────── v1.1.0
 Installed FilePathsBase ────── v0.7.0
 Installed Libiconv_jll ─────── v1.16.0+0
 Installed Mocking ──────────── v0.7.0
 Installed TranscodingStreams ─ v0.9.5
 Installed ScikitLearnBase ──── v0.5.0
 Installed XML2_jll ─────────── v2.9.9+1
 Installed CSV ──────────────── v0.5.22
 Installed DataFrames ───────── v0.20.0
 Installed TimeZones ────────── v0.9.2
 Installed RDatasets ────────── v0.6.6
  Updating `/tmp/jl_aTwNhY/Project.toml`
  [7806a523] + DecisionTree v0.10.1
  [b8a86587] + NearestNeighbors v0.4.4
  [ce6b1742] + RDatasets v0.6.6
  [b8865327] + UnicodePlots v1.1.0
  Updating `/tmp/jl_aTwNhY/Manifest.toml`
  [336ed68f] + CSV v0.5.22
  [944b1d66] + CodecZlib v0.6.0
  [a93c6f00] + DataFrames v0.20.0
  [7806a523] + DecisionTree v0.10.1
  [8f5d6c58] + EzXML v1.1.0
  [5789e2e9] + FileIO v1.2.1
  [48062228] + FilePathsBase v0.7.0
  [94ce4f54] + Libiconv_jll v1.16.0+0
  [78c3b35d] + Mocking v0.7.0
  [b8a86587] + NearestNeighbors v0.4.4
  [2dfb63ee] + PooledArrays v0.5.3
  [df47a6cb] + RData v0.6.3
  [ce6b1742] + RDatasets v0.6.6
  [6e75b9c4] + ScikitLearnBase v0.5.0
  [90137ffa] + StaticArrays v0.12.1
  [f269a46b] + TimeZones v0.9.2
  [3bb67fe8] + TranscodingStreams v0.9.5
  [b8865327] + UnicodePlots v1.1.0
  [ea10d353] + WeakRefStrings v0.6.2
  [02c8fc9c] + XML2_jll v2.9.9+1
  [83775a58] + Zlib_jll v1.2.11+7
  Building CodecZlib → `~/.julia/packages/CodecZlib/5t9zO/deps/build.log`
  Updating `/tmp/jl_oeajY4/Project.toml`
 [no changes]
  Updating `/tmp/jl_oeajY4/Manifest.toml`
 [no changes]
  Building TimeZones → `~/.julia/packages/TimeZones/M8H2J/deps/build.log`
  Updating `/tmp/jl_tGXfmi/Project.toml`
 [no changes]
  Updating `/tmp/jl_tGXfmi/Manifest.toml`
 [no changes]
Running sandbox
Status `/tmp/jl_aTwNhY/Project.toml`
  [324d7699] CategoricalArrays v0.7.7
  [ed09eef8] ComputationalResources v0.3.0
  [7806a523] DecisionTree v0.10.1
  [31c24e10] Distributions v0.21.12
  [ffbed154] DocStringExtensions v0.8.1
  [30fc2ffe] LossFunctions v0.5.1
  [add582a8] MLJ v0.7.0
  [a7f614a8] MLJBase v0.10.1
  [d491faf4] MLJModels v0.7.0
  [6f286f6a] MultivariateStats v0.7.0
  [b8a86587] NearestNeighbors v0.4.4
  [bac558e1] OrderedCollections v1.1.0
  [92933f4c] ProgressMeter v1.2.0
  [ce6b1742] RDatasets v0.6.6
  [3cdcf5f2] RecipesBase v0.7.0
  [321657f4] ScientificTypes v0.5.1
  [2913bbd2] StatsBase v0.32.0
  [bd369af6] Tables v0.2.11
  [b8865327] UnicodePlots v1.1.0
  [ade2ca70] Dates 
  [8bb1440f] DelimitedFiles 
  [8ba89e20] Distributed 
  [b77e0a4c] InteractiveUtils 
  [37e2e46d] LinearAlgebra 
  [44cfe95a] Pkg 
  [9a3f8284] Random 
  [10745b16] Statistics 
  [8dfed614] Test 
[ Info: Model metadata loaded from registry. 
Test Summary: | Pass  Total
utilities     |    4      4
[ Info: Training [34mMachine{DeterministicTunedModel} @ 8…40[39m.
[ Info: Mimimizing rms. 
Iterating over a 40-point grid:   2%[>                        ]  ETA: 0:00:00[KIterating over a 40-point grid:   7%[=>                       ]  ETA: 0:04:17[KIterating over a 40-point grid:  10%[==>                      ]  ETA: 0:03:32[KIterating over a 40-point grid:  12%[===>                     ]  ETA: 0:02:48[KIterating over a 40-point grid:  15%[===>                     ]  ETA: 0:02:18[KIterating over a 40-point grid:  17%[====>                    ]  ETA: 0:01:55[KIterating over a 40-point grid:  20%[====>                    ]  ETA: 0:01:38[KIterating over a 40-point grid:  22%[=====>                   ]  ETA: 0:01:24[KIterating over a 40-point grid:  24%[======>                  ]  ETA: 0:01:13[KIterating over a 40-point grid:  27%[======>                  ]  ETA: 0:01:05[KIterating over a 40-point grid:  29%[=======>                 ]  ETA: 0:00:57[KIterating over a 40-point grid:  32%[=======>                 ]  ETA: 0:00:51[KIterating over a 40-point grid:  34%[========>                ]  ETA: 0:00:46[KIterating over a 40-point grid:  37%[=========>               ]  ETA: 0:00:41[KIterating over a 40-point grid:  39%[=========>               ]  ETA: 0:00:37[KIterating over a 40-point grid:  41%[==========>              ]  ETA: 0:00:33[KIterating over a 40-point grid:  44%[==========>              ]  ETA: 0:00:30[KIterating over a 40-point grid:  46%[===========>             ]  ETA: 0:00:27[KIterating over a 40-point grid:  49%[============>            ]  ETA: 0:00:25[KIterating over a 40-point grid:  51%[============>            ]  ETA: 0:00:23[KIterating over a 40-point grid:  54%[=============>           ]  ETA: 0:00:20[KIterating over a 40-point grid:  56%[==============>          ]  ETA: 0:00:19[KIterating over a 40-point grid:  59%[==============>          ]  ETA: 0:00:17[KIterating over a 40-point grid:  61%[===============>         ]  ETA: 0:00:15[KIterating over a 40-point grid:  63%[===============>         ]  ETA: 0:00:14[KIterating over a 40-point grid:  66%[================>        ]  ETA: 0:00:12[KIterating over a 40-point grid:  68%[=================>       ]  ETA: 0:00:11[KIterating over a 40-point grid:  71%[=================>       ]  ETA: 0:00:10[KIterating over a 40-point grid:  73%[==================>      ]  ETA: 0:00:09[KIterating over a 40-point grid:  76%[==================>      ]  ETA: 0:00:08[KIterating over a 40-point grid:  78%[===================>     ]  ETA: 0:00:07[KIterating over a 40-point grid:  80%[====================>    ]  ETA: 0:00:06[KIterating over a 40-point grid:  83%[====================>    ]  ETA: 0:00:05[KIterating over a 40-point grid:  85%[=====================>   ]  ETA: 0:00:04[KIterating over a 40-point grid:  88%[=====================>   ]  ETA: 0:00:03[KIterating over a 40-point grid:  90%[======================>  ]  ETA: 0:00:03[KIterating over a 40-point grid:  93%[=======================> ]  ETA: 0:00:02[KIterating over a 40-point grid:  95%[=======================> ]  ETA: 0:00:01[KIterating over a 40-point grid:  98%[========================>]  ETA: 0:00:01[KIterating over a 40-point grid: 100%[=========================] Time: 0:00:23[K
[ Info: Training best model on all supplied data.
[ Info: Updating [34mMachine{DeterministicTunedModel} @ 8…40[39m.
[ Info: Mimimizing rms. 
Iterating over a 40-point grid:   2%[>                        ]  ETA: 0:00:00[KIterating over a 40-point grid:   7%[=>                       ]  ETA: 0:00:00[KIterating over a 40-point grid:  10%[==>                      ]  ETA: 0:00:00[KIterating over a 40-point grid:  12%[===>                     ]  ETA: 0:00:00[KIterating over a 40-point grid:  15%[===>                     ]  ETA: 0:00:00[KIterating over a 40-point grid:  17%[====>                    ]  ETA: 0:00:00[KIterating over a 40-point grid:  20%[====>                    ]  ETA: 0:00:00[KIterating over a 40-point grid:  22%[=====>                   ]  ETA: 0:00:00[KIterating over a 40-point grid:  24%[======>                  ]  ETA: 0:00:00[KIterating over a 40-point grid:  27%[======>                  ]  ETA: 0:00:00[KIterating over a 40-point grid:  29%[=======>                 ]  ETA: 0:00:00[KIterating over a 40-point grid:  32%[=======>                 ]  ETA: 0:00:00[KIterating over a 40-point grid:  34%[========>                ]  ETA: 0:00:00[KIterating over a 40-point grid:  37%[=========>               ]  ETA: 0:00:00[KIterating over a 40-point grid:  39%[=========>               ]  ETA: 0:00:00[KIterating over a 40-point grid:  41%[==========>              ]  ETA: 0:00:00[KIterating over a 40-point grid:  44%[==========>              ]  ETA: 0:00:00[KIterating over a 40-point grid:  46%[===========>             ]  ETA: 0:00:00[KIterating over a 40-point grid:  49%[============>            ]  ETA: 0:00:00[KIterating over a 40-point grid:  51%[============>            ]  ETA: 0:00:00[KIterating over a 40-point grid:  54%[=============>           ]  ETA: 0:00:00[KIterating over a 40-point grid:  56%[==============>          ]  ETA: 0:00:00[KIterating over a 40-point grid:  59%[==============>          ]  ETA: 0:00:00[KIterating over a 40-point grid:  61%[===============>         ]  ETA: 0:00:00[KIterating over a 40-point grid:  63%[===============>         ]  ETA: 0:00:00[KIterating over a 40-point grid:  66%[================>        ]  ETA: 0:00:00[KIterating over a 40-point grid:  68%[=================>       ]  ETA: 0:00:00[KIterating over a 40-point grid:  71%[=================>       ]  ETA: 0:00:00[KIterating over a 40-point grid:  73%[==================>      ]  ETA: 0:00:00[KIterating over a 40-point grid:  76%[==================>      ]  ETA: 0:00:00[KIterating over a 40-point grid:  78%[===================>     ]  ETA: 0:00:00[KIterating over a 40-point grid:  80%[====================>    ]  ETA: 0:00:00[KIterating over a 40-point grid:  83%[====================>    ]  ETA: 0:00:00[KIterating over a 40-point grid:  85%[=====================>   ]  ETA: 0:00:00[KIterating over a 40-point grid:  88%[=====================>   ]  ETA: 0:00:00[KIterating over a 40-point grid:  90%[======================>  ]  ETA: 0:00:00[KIterating over a 40-point grid:  93%[=======================> ]  ETA: 0:00:00[KIterating over a 40-point grid:  95%[=======================> ]  ETA: 0:00:00[KIterating over a 40-point grid:  98%[========================>]  ETA: 0:00:00[KIterating over a 40-point grid: 100%[=========================] Time: 0:00:00[K
[ Info: Training best model on all supplied data.
[ Info: Updating [34mMachine{DeterministicTunedModel} @ 8…40[39m.
[ Info: Mimimizing rms. 
Iterating over a 40-point grid:   2%[>                        ]  ETA: 0:00:00[KIterating over a 40-point grid:   7%[=>                       ]  ETA: 0:00:04[KIterating over a 40-point grid:  10%[==>                      ]  ETA: 0:00:03[KIterating over a 40-point grid:  12%[===>                     ]  ETA: 0:00:02[KIterating over a 40-point grid:  15%[===>                     ]  ETA: 0:00:02[KIterating over a 40-point grid:  17%[====>                    ]  ETA: 0:00:02[KIterating over a 40-point grid:  20%[====>                    ]  ETA: 0:00:01[KIterating over a 40-point grid:  22%[=====>                   ]  ETA: 0:00:01[KIterating over a 40-point grid:  24%[======>                  ]  ETA: 0:00:01[KIterating over a 40-point grid:  27%[======>                  ]  ETA: 0:00:01[KIterating over a 40-point grid:  29%[=======>                 ]  ETA: 0:00:01[KIterating over a 40-point grid:  32%[=======>                 ]  ETA: 0:00:01[KIterating over a 40-point grid:  34%[========>                ]  ETA: 0:00:01[KIterating over a 40-point grid:  37%[=========>               ]  ETA: 0:00:01[KIterating over a 40-point grid:  39%[=========>               ]  ETA: 0:00:01[KIterating over a 40-point grid:  41%[==========>              ]  ETA: 0:00:00[KIterating over a 40-point grid:  44%[==========>              ]  ETA: 0:00:00[KIterating over a 40-point grid:  46%[===========>             ]  ETA: 0:00:00[KIterating over a 40-point grid:  49%[============>            ]  ETA: 0:00:00[KIterating over a 40-point grid:  51%[============>            ]  ETA: 0:00:00[KIterating over a 40-point grid:  54%[=============>           ]  ETA: 0:00:00[KIterating over a 40-point grid:  56%[==============>          ]  ETA: 0:00:00[KIterating over a 40-point grid:  59%[==============>          ]  ETA: 0:00:00[KIterating over a 40-point grid:  61%[===============>         ]  ETA: 0:00:00[KIterating over a 40-point grid:  63%[===============>         ]  ETA: 0:00:00[KIterating over a 40-point grid:  66%[================>        ]  ETA: 0:00:00[KIterating over a 40-point grid:  68%[=================>       ]  ETA: 0:00:00[KIterating over a 40-point grid:  71%[=================>       ]  ETA: 0:00:00[KIterating over a 40-point grid:  73%[==================>      ]  ETA: 0:00:00[KIterating over a 40-point grid:  76%[==================>      ]  ETA: 0:00:00[KIterating over a 40-point grid:  78%[===================>     ]  ETA: 0:00:00[KIterating over a 40-point grid:  80%[====================>    ]  ETA: 0:00:00[KIterating over a 40-point grid:  83%[====================>    ]  ETA: 0:00:00[KIterating over a 40-point grid:  85%[=====================>   ]  ETA: 0:00:00[KIterating over a 40-point grid:  88%[=====================>   ]  ETA: 0:00:00[KIterating over a 40-point grid:  90%[======================>  ]  ETA: 0:00:00[KIterating over a 40-point grid:  93%[=======================> ]  ETA: 0:00:00[KIterating over a 40-point grid:  95%[=======================> ]  ETA: 0:00:00[KIterating over a 40-point grid:  98%[========================>]  ETA: 0:00:00[KIterating over a 40-point grid: 100%[=========================] Time: 0:00:00[K
[ Info: Training best model on all supplied data.
┌ Info: A model type "KNNRegressor" is already loaded. 
└ No new code loaded. 
[ Info: Training [34mMachine{DeterministicTunedModel} @ 2…92[39m.
[ Info: Mimimizing rms. 
Iterating over a 72-point grid:   1%[>                        ]  ETA: 0:00:00[KIterating over a 72-point grid:   4%[=>                       ]  ETA: 0:06:03[KIterating over a 72-point grid:   5%[=>                       ]  ETA: 0:05:14[KIterating over a 72-point grid:   7%[=>                       ]  ETA: 0:04:08[KIterating over a 72-point grid:   8%[==>                      ]  ETA: 0:03:24[KIterating over a 72-point grid:  10%[==>                      ]  ETA: 0:02:53[KIterating over a 72-point grid:  11%[==>                      ]  ETA: 0:02:29[KIterating over a 72-point grid:  12%[===>                     ]  ETA: 0:02:11[KIterating over a 72-point grid:  14%[===>                     ]  ETA: 0:01:56[KIterating over a 72-point grid:  15%[===>                     ]  ETA: 0:01:44[KIterating over a 72-point grid:  16%[====>                    ]  ETA: 0:01:34[KIterating over a 72-point grid:  18%[====>                    ]  ETA: 0:01:26[KIterating over a 72-point grid:  19%[====>                    ]  ETA: 0:01:18[KIterating over a 72-point grid:  21%[=====>                   ]  ETA: 0:01:12[KIterating over a 72-point grid:  22%[=====>                   ]  ETA: 0:01:06[KIterating over a 72-point grid:  23%[=====>                   ]  ETA: 0:01:02[KIterating over a 72-point grid:  25%[======>                  ]  ETA: 0:00:57[KIterating over a 72-point grid:  26%[======>                  ]  ETA: 0:00:53[KIterating over a 72-point grid:  27%[======>                  ]  ETA: 0:00:50[KIterating over a 72-point grid:  29%[=======>                 ]  ETA: 0:00:47[KIterating over a 72-point grid:  30%[=======>                 ]  ETA: 0:00:44[KIterating over a 72-point grid:  32%[=======>                 ]  ETA: 0:00:41[KIterating over a 72-point grid:  33%[========>                ]  ETA: 0:00:39[KIterating over a 72-point grid:  34%[========>                ]  ETA: 0:00:36[KIterating over a 72-point grid:  36%[========>                ]  ETA: 0:00:34[KIterating over a 72-point grid:  37%[=========>               ]  ETA: 0:00:33[KIterating over a 72-point grid:  38%[=========>               ]  ETA: 0:00:31[KIterating over a 72-point grid:  40%[=========>               ]  ETA: 0:00:29[KIterating over a 72-point grid:  41%[==========>              ]  ETA: 0:00:28[KIterating over a 72-point grid:  42%[==========>              ]  ETA: 0:00:26[KIterating over a 72-point grid:  44%[==========>              ]  ETA: 0:00:25[KIterating over a 72-point grid:  45%[===========>             ]  ETA: 0:00:23[KIterating over a 72-point grid:  47%[===========>             ]  ETA: 0:00:22[KIterating over a 72-point grid:  48%[===========>             ]  ETA: 0:00:21[KIterating over a 72-point grid:  49%[============>            ]  ETA: 0:00:20[KIterating over a 72-point grid:  51%[============>            ]  ETA: 0:00:19[KIterating over a 72-point grid:  52%[=============>           ]  ETA: 0:00:18[KIterating over a 72-point grid:  53%[=============>           ]  ETA: 0:00:17[KIterating over a 72-point grid:  55%[=============>           ]  ETA: 0:00:16[KIterating over a 72-point grid:  56%[==============>          ]  ETA: 0:00:15[KIterating over a 72-point grid:  58%[==============>          ]  ETA: 0:00:15[KIterating over a 72-point grid:  59%[==============>          ]  ETA: 0:00:14[KIterating over a 72-point grid:  60%[===============>         ]  ETA: 0:00:13[KIterating over a 72-point grid:  62%[===============>         ]  ETA: 0:00:12[KIterating over a 72-point grid:  63%[===============>         ]  ETA: 0:00:12[KIterating over a 72-point grid:  64%[================>        ]  ETA: 0:00:11[KIterating over a 72-point grid:  66%[================>        ]  ETA: 0:00:10[KIterating over a 72-point grid:  67%[================>        ]  ETA: 0:00:10[KIterating over a 72-point grid:  68%[=================>       ]  ETA: 0:00:09[KIterating over a 72-point grid:  70%[=================>       ]  ETA: 0:00:09[KIterating over a 72-point grid:  71%[=================>       ]  ETA: 0:00:08[KIterating over a 72-point grid:  73%[==================>      ]  ETA: 0:00:08[KIterating over a 72-point grid:  74%[==================>      ]  ETA: 0:00:07[KIterating over a 72-point grid:  75%[==================>      ]  ETA: 0:00:07[KIterating over a 72-point grid:  77%[===================>     ]  ETA: 0:00:06[KIterating over a 72-point grid:  78%[===================>     ]  ETA: 0:00:06[KIterating over a 72-point grid:  79%[===================>     ]  ETA: 0:00:05[KIterating over a 72-point grid:  81%[====================>    ]  ETA: 0:00:05[KIterating over a 72-point grid:  82%[====================>    ]  ETA: 0:00:04[KIterating over a 72-point grid:  84%[====================>    ]  ETA: 0:00:04[KIterating over a 72-point grid:  85%[=====================>   ]  ETA: 0:00:04[KIterating over a 72-point grid:  86%[=====================>   ]  ETA: 0:00:03[KIterating over a 72-point grid:  88%[=====================>   ]  ETA: 0:00:03[KIterating over a 72-point grid:  89%[======================>  ]  ETA: 0:00:03[KIterating over a 72-point grid:  90%[======================>  ]  ETA: 0:00:02[KIterating over a 72-point grid:  92%[======================>  ]  ETA: 0:00:02[KIterating over a 72-point grid:  93%[=======================> ]  ETA: 0:00:02[KIterating over a 72-point grid:  95%[=======================> ]  ETA: 0:00:01[KIterating over a 72-point grid:  96%[=======================> ]  ETA: 0:00:01[KIterating over a 72-point grid:  97%[========================>]  ETA: 0:00:01[KIterating over a 72-point grid:  99%[========================>]  ETA: 0:00:00[KIterating over a 72-point grid: 100%[=========================] Time: 0:00:21[K
[ Info: Training best model on all supplied data.
[ Info: Updating [34mMachine{DeterministicTunedModel} @ 2…92[39m.
[ Info: Mimimizing rms. 
Iterating over a 56-point grid:   2%[>                        ]  ETA: 0:00:00[KIterating over a 56-point grid:   5%[=>                       ]  ETA: 0:00:01[KIterating over a 56-point grid:   7%[=>                       ]  ETA: 0:00:01[KIterating over a 56-point grid:   9%[==>                      ]  ETA: 0:00:01[KIterating over a 56-point grid:  11%[==>                      ]  ETA: 0:00:01[KIterating over a 56-point grid:  12%[===>                     ]  ETA: 0:00:01[KIterating over a 56-point grid:  14%[===>                     ]  ETA: 0:00:01[KIterating over a 56-point grid:  16%[===>                     ]  ETA: 0:00:01[KIterating over a 56-point grid:  18%[====>                    ]  ETA: 0:00:01[KIterating over a 56-point grid:  19%[====>                    ]  ETA: 0:00:01[KIterating over a 56-point grid:  21%[=====>                   ]  ETA: 0:00:01[KIterating over a 56-point grid:  23%[=====>                   ]  ETA: 0:00:01[KIterating over a 56-point grid:  25%[======>                  ]  ETA: 0:00:01[KIterating over a 56-point grid:  26%[======>                  ]  ETA: 0:00:01[KIterating over a 56-point grid:  28%[=======>                 ]  ETA: 0:00:01[KIterating over a 56-point grid:  30%[=======>                 ]  ETA: 0:00:01[KIterating over a 56-point grid:  32%[=======>                 ]  ETA: 0:00:01[KIterating over a 56-point grid:  33%[========>                ]  ETA: 0:00:01[KIterating over a 56-point grid:  35%[========>                ]  ETA: 0:00:01[KIterating over a 56-point grid:  37%[=========>               ]  ETA: 0:00:01[KIterating over a 56-point grid:  39%[=========>               ]  ETA: 0:00:01[KIterating over a 56-point grid:  40%[==========>              ]  ETA: 0:00:01[KIterating over a 56-point grid:  42%[==========>              ]  ETA: 0:00:01[KIterating over a 56-point grid:  44%[==========>              ]  ETA: 0:00:01[KIterating over a 56-point grid:  46%[===========>             ]  ETA: 0:00:01[KIterating over a 56-point grid:  47%[===========>             ]  ETA: 0:00:01[KIterating over a 56-point grid:  49%[============>            ]  ETA: 0:00:01[KIterating over a 56-point grid:  51%[============>            ]  ETA: 0:00:01[KIterating over a 56-point grid:  53%[=============>           ]  ETA: 0:00:01[KIterating over a 56-point grid:  54%[=============>           ]  ETA: 0:00:01[KIterating over a 56-point grid:  56%[==============>          ]  ETA: 0:00:01[KIterating over a 56-point grid:  58%[==============>          ]  ETA: 0:00:01[KIterating over a 56-point grid:  60%[==============>          ]  ETA: 0:00:01[KIterating over a 56-point grid:  61%[===============>         ]  ETA: 0:00:01[KIterating over a 56-point grid:  63%[===============>         ]  ETA: 0:00:01[KIterating over a 56-point grid:  65%[================>        ]  ETA: 0:00:01[KIterating over a 56-point grid:  67%[================>        ]  ETA: 0:00:01[KIterating over a 56-point grid:  68%[=================>       ]  ETA: 0:00:01[KIterating over a 56-point grid:  70%[=================>       ]  ETA: 0:00:01[KIterating over a 56-point grid:  72%[=================>       ]  ETA: 0:00:00[KIterating over a 56-point grid:  74%[==================>      ]  ETA: 0:00:00[KIterating over a 56-point grid:  75%[==================>      ]  ETA: 0:00:00[KIterating over a 56-point grid:  77%[===================>     ]  ETA: 0:00:00[KIterating over a 56-point grid:  79%[===================>     ]  ETA: 0:00:00[KIterating over a 56-point grid:  81%[====================>    ]  ETA: 0:00:00[KIterating over a 56-point grid:  82%[====================>    ]  ETA: 0:00:00[KIterating over a 56-point grid:  84%[=====================>   ]  ETA: 0:00:00[KIterating over a 56-point grid:  86%[=====================>   ]  ETA: 0:00:00[KIterating over a 56-point grid:  88%[=====================>   ]  ETA: 0:00:00[KIterating over a 56-point grid:  89%[======================>  ]  ETA: 0:00:00[KIterating over a 56-point grid:  91%[======================>  ]  ETA: 0:00:00[KIterating over a 56-point grid:  93%[=======================> ]  ETA: 0:00:00[KIterating over a 56-point grid:  95%[=======================> ]  ETA: 0:00:00[KIterating over a 56-point grid:  96%[========================>]  ETA: 0:00:00[KIterating over a 56-point grid:  98%[========================>]  ETA: 0:00:00[KIterating over a 56-point grid: 100%[=========================] Time: 0:00:01[K
[ Info: Training best model on all supplied data.
[ Info: Updating [34mMachine{DeterministicTunedModel} @ 2…92[39m.
┌ Warning: No resolution specified for forest.bagging_fraction. Will use a value of 5. 
└ @ MLJ ~/.julia/packages/MLJ/YWvn8/src/tuning.jl:202
[ Info: Mimimizing rms. 
Iterating over a 60-point grid:   2%[>                        ]  ETA: 0:00:00[KIterating over a 60-point grid:   5%[=>                       ]  ETA: 0:00:00[KIterating over a 60-point grid:   7%[=>                       ]  ETA: 0:00:01[KIterating over a 60-point grid:   8%[==>                      ]  ETA: 0:00:01[KIterating over a 60-point grid:  10%[==>                      ]  ETA: 0:00:01[KIterating over a 60-point grid:  11%[==>                      ]  ETA: 0:00:01[KIterating over a 60-point grid:  13%[===>                     ]  ETA: 0:00:01[KIterating over a 60-point grid:  15%[===>                     ]  ETA: 0:00:01[KIterating over a 60-point grid:  16%[====>                    ]  ETA: 0:00:01[KIterating over a 60-point grid:  18%[====>                    ]  ETA: 0:00:01[KIterating over a 60-point grid:  20%[====>                    ]  ETA: 0:00:01[KIterating over a 60-point grid:  21%[=====>                   ]  ETA: 0:00:01[KIterating over a 60-point grid:  23%[=====>                   ]  ETA: 0:00:01[KIterating over a 60-point grid:  25%[======>                  ]  ETA: 0:00:01[KIterating over a 60-point grid:  26%[======>                  ]  ETA: 0:00:01[KIterating over a 60-point grid:  28%[======>                  ]  ETA: 0:00:01[KIterating over a 60-point grid:  30%[=======>                 ]  ETA: 0:00:01[KIterating over a 60-point grid:  31%[=======>                 ]  ETA: 0:00:01[KIterating over a 60-point grid:  33%[========>                ]  ETA: 0:00:01[KIterating over a 60-point grid:  34%[========>                ]  ETA: 0:00:01[KIterating over a 60-point grid:  36%[=========>               ]  ETA: 0:00:01[KIterating over a 60-point grid:  38%[=========>               ]  ETA: 0:00:01[KIterating over a 60-point grid:  39%[=========>               ]  ETA: 0:00:01[KIterating over a 60-point grid:  41%[==========>              ]  ETA: 0:00:01[KIterating over a 60-point grid:  43%[==========>              ]  ETA: 0:00:01[KIterating over a 60-point grid:  44%[===========>             ]  ETA: 0:00:01[KIterating over a 60-point grid:  46%[===========>             ]  ETA: 0:00:01[KIterating over a 60-point grid:  48%[===========>             ]  ETA: 0:00:01[KIterating over a 60-point grid:  49%[============>            ]  ETA: 0:00:01[KIterating over a 60-point grid:  51%[============>            ]  ETA: 0:00:01[KIterating over a 60-point grid:  52%[=============>           ]  ETA: 0:00:01[KIterating over a 60-point grid:  54%[=============>           ]  ETA: 0:00:01[KIterating over a 60-point grid:  56%[=============>           ]  ETA: 0:00:01[KIterating over a 60-point grid:  57%[==============>          ]  ETA: 0:00:01[KIterating over a 60-point grid:  59%[==============>          ]  ETA: 0:00:01[KIterating over a 60-point grid:  61%[===============>         ]  ETA: 0:00:01[KIterating over a 60-point grid:  62%[===============>         ]  ETA: 0:00:01[KIterating over a 60-point grid:  64%[===============>         ]  ETA: 0:00:01[KIterating over a 60-point grid:  66%[================>        ]  ETA: 0:00:01[KIterating over a 60-point grid:  67%[================>        ]  ETA: 0:00:01[KIterating over a 60-point grid:  69%[=================>       ]  ETA: 0:00:01[KIterating over a 60-point grid:  70%[=================>       ]  ETA: 0:00:01[KIterating over a 60-point grid:  72%[==================>      ]  ETA: 0:00:00[KIterating over a 60-point grid:  74%[==================>      ]  ETA: 0:00:00[KIterating over a 60-point grid:  75%[==================>      ]  ETA: 0:00:00[KIterating over a 60-point grid:  77%[===================>     ]  ETA: 0:00:00[KIterating over a 60-point grid:  79%[===================>     ]  ETA: 0:00:00[KIterating over a 60-point grid:  80%[====================>    ]  ETA: 0:00:00[KIterating over a 60-point grid:  82%[====================>    ]  ETA: 0:00:00[KIterating over a 60-point grid:  84%[====================>    ]  ETA: 0:00:00[KIterating over a 60-point grid:  85%[=====================>   ]  ETA: 0:00:00[KIterating over a 60-point grid:  87%[=====================>   ]  ETA: 0:00:00[KIterating over a 60-point grid:  89%[======================>  ]  ETA: 0:00:00[KIterating over a 60-point grid:  90%[======================>  ]  ETA: 0:00:00[KIterating over a 60-point grid:  92%[======================>  ]  ETA: 0:00:00[KIterating over a 60-point grid:  93%[=======================> ]  ETA: 0:00:00[KIterating over a 60-point grid:  95%[=======================> ]  ETA: 0:00:00[KIterating over a 60-point grid:  97%[========================>]  ETA: 0:00:00[KIterating over a 60-point grid:  98%[========================>]  ETA: 0:00:00[KIterating over a 60-point grid: 100%[=========================] Time: 0:00:01[K
[ Info: Training best model on all supplied data.
tuning: Error During Test at /home/pkgeval/.julia/packages/MLJ/YWvn8/test/runtests.jl:21
  Test threw exception
  Expression: include("tuning.jl")
  LoadError: syntax: Assignment to `tuned` in top-level block is ambiguous because an outer global binding by the same name already exists. Use `global tuned` to assign to the outer global `tuned` variable or use `local tuned` to force a new local by the same name. At /home/pkgeval/.julia/packages/MLJ/YWvn8/test/tuning.jl:115
  Stacktrace:
   [1] top-level scope at /home/pkgeval/.julia/packages/MLJ/YWvn8/test/tuning.jl:111
   [2] include(::String) at ./client.jl:439
   [3] macro expansion at /home/pkgeval/.julia/packages/MLJ/YWvn8/test/runtests.jl:21 [inlined]
   [4] macro expansion at /workspace/srcdir/usr/share/julia/stdlib/v1.5/Test/src/Test.jl:1116 [inlined]
   [5] top-level scope at /home/pkgeval/.julia/packages/MLJ/YWvn8/test/runtests.jl:21
  in expression starting at /home/pkgeval/.julia/packages/MLJ/YWvn8/test/tuning.jl:111
  
Test Summary:                  | Pass  Error  Total
tuning                         |   11      1     12
  2-parameter tune, no nesting |    8             8
ERROR: LoadError: Some tests did not pass: 11 passed, 0 failed, 1 errored, 0 broken.
in expression starting at /home/pkgeval/.julia/packages/MLJ/YWvn8/test/runtests.jl:20
err = ProcessFailedException(Base.Process[Process(`/opt/julia/bin/julia -Cnative -J/opt/julia/lib/julia/sys.so -g1 --code-coverage=none --color=no --compiled-modules=yes --check-bounds=yes --inline=yes --startup-file=no --track-allocation=none --eval 'append!(empty!(Base.DEPOT_PATH), ["/home/pkgeval/.julia", "/opt/julia/local/share/julia", "/opt/julia/share/julia", "/usr/local/share/julia"])
append!(empty!(Base.DL_LOAD_PATH), String[])

cd("/home/pkgeval/.julia/packages/MLJ/YWvn8/test")
append!(empty!(ARGS), String[])
include("/home/pkgeval/.julia/packages/MLJ/YWvn8/test/runtests.jl")
'`, ProcessExited(1))])
ERROR: Package MLJ errored during testing
Stacktrace:
 [1] pkgerror(::String, ::Vararg{String,N} where N) at /workspace/srcdir/usr/share/julia/stdlib/v1.5/Pkg/src/Types.jl:54
 [2] test(::Pkg.Types.Context, ::Array{Pkg.Types.PackageSpec,1}; coverage::Bool, julia_args::Cmd, test_args::Cmd, test_fn::Nothing) at /workspace/srcdir/usr/share/julia/stdlib/v1.5/Pkg/src/Operations.jl:1471
 [3] test(::Pkg.Types.Context, ::Array{Pkg.Types.PackageSpec,1}; coverage::Bool, test_fn::Nothing, julia_args::Cmd, test_args::Cmd, kwargs::Base.Iterators.Pairs{Union{},Union{},Tuple{},NamedTuple{(),Tuple{}}}) at /workspace/srcdir/usr/share/julia/stdlib/v1.5/Pkg/src/API.jl:313
 [4] test(::Pkg.Types.Context, ::Array{Pkg.Types.PackageSpec,1}) at /workspace/srcdir/usr/share/julia/stdlib/v1.5/Pkg/src/API.jl:300
 [5] #test#66 at /workspace/srcdir/usr/share/julia/stdlib/v1.5/Pkg/src/API.jl:294 [inlined]
 [6] test at /workspace/srcdir/usr/share/julia/stdlib/v1.5/Pkg/src/API.jl:294 [inlined]
 [7] #test#65 at /workspace/srcdir/usr/share/julia/stdlib/v1.5/Pkg/src/API.jl:293 [inlined]
 [8] test at /workspace/srcdir/usr/share/julia/stdlib/v1.5/Pkg/src/API.jl:293 [inlined]
 [9] test(::String; kwargs::Base.Iterators.Pairs{Union{},Union{},Tuple{},NamedTuple{(),Tuple{}}}) at /workspace/srcdir/usr/share/julia/stdlib/v1.5/Pkg/src/API.jl:292
 [10] test(::String) at /workspace/srcdir/usr/share/julia/stdlib/v1.5/Pkg/src/API.jl:292
 [11] top-level scope at none:13
