Julia Version 1.5.0-DEV.719
Commit 5a71af311a (2020-04-29 17:39 UTC)
Platform Info:
  OS: Linux (x86_64-linux-gnu)
  CPU: Intel(R) Xeon(R) Silver 4114 CPU @ 2.20GHz
  WORD_SIZE: 64
  LIBM: libopenlibm
  LLVM: libLLVM-9.0.1 (ORCJIT, skylake)
Environment:
  JULIA_DEPOT_PATH = ::/usr/local/share/julia
  JULIA_NUM_THREADS = 2

  Resolving package versions...
  Installed ArrayLayouts ───────────────── v0.2.5
  Installed DiffRules ──────────────────── v1.0.1
  Installed LazyArrays ─────────────────── v0.16.6
  Installed NamedDims ──────────────────── v0.2.21
  Installed OffsetArrays ───────────────── v1.0.4
  Installed SparseGaussianProcesses ────── v0.1.0
  Installed ForwardDiff ────────────────── v0.10.10
  Installed CUDAnative ─────────────────── v3.0.4
  Installed FillArrays ─────────────────── v0.8.8
  Installed Cthulhu ────────────────────── v1.0.2
  Installed Compat ─────────────────────── v3.9.0
  Installed FixedPointNumbers ──────────── v0.8.0
  Installed LazyStack ──────────────────── v0.0.7
  Installed DiffResults ────────────────── v1.0.2
  Installed StatsBase ──────────────────── v0.33.0
  Installed Zygote ─────────────────────── v0.4.18
  Installed Requires ───────────────────── v1.0.1
  Installed CUDAdrv ────────────────────── v6.2.3
  Installed Juno ───────────────────────── v0.8.1
  Installed LLVM ───────────────────────── v1.3.4
  Installed TimerOutputs ───────────────── v0.5.5
  Installed OpenSpecFun_jll ────────────── v0.5.3+3
  Installed ZipFile ────────────────────── v0.9.1
  Installed CommonSubexpressions ───────── v0.2.0
  Installed CodeTracking ───────────────── v0.5.9
  Installed Zlib_jll ───────────────────── v1.2.11+9
  Installed SpecialFunctions ───────────── v0.10.0
  Installed DataStructures ─────────────── v0.17.15
  Installed StaticArrays ───────────────── v0.12.2
  Installed AbstractFFTs ───────────────── v0.5.0
  Installed AbstractTrees ──────────────── v0.3.3
  Installed IRTools ────────────────────── v0.3.2
  Installed CompilerSupportLibraries_jll ─ v0.3.3+0
  Installed BinaryProvider ─────────────── v0.5.9
  Installed CEnum ──────────────────────── v0.2.0
  Installed NaNMath ────────────────────── v0.3.3
  Installed TensorCast ─────────────────── v0.2.2
  Installed CodecZlib ──────────────────── v0.7.0
  Installed CUDAapi ────────────────────── v4.0.0
  Installed SortingAlgorithms ──────────── v0.3.1
  Installed ZygoteRules ────────────────── v0.2.0
  Installed Adapt ──────────────────────── v1.0.1
  Installed TranscodingStreams ─────────── v0.9.5
  Installed ColorTypes ─────────────────── v0.10.2
  Installed OrderedCollections ─────────── v1.1.0
  Installed NNlib ──────────────────────── v0.6.6
  Installed MacroTools ─────────────────── v0.5.5
  Installed Flux ───────────────────────── v0.10.4
  Installed Media ──────────────────────── v0.5.0
  Installed DataAPI ────────────────────── v1.3.0
  Installed ExprTools ──────────────────── v0.1.1
  Installed Reexport ───────────────────── v0.2.0
  Installed Missings ───────────────────── v0.4.3
  Installed GPUArrays ──────────────────── v3.2.0
  Installed CuArrays ───────────────────── v2.1.0
  Installed Colors ─────────────────────── v0.12.0
Updating `~/.julia/environments/v1.5/Project.toml`
  [48e2ed6f] + SparseGaussianProcesses v0.1.0
Updating `~/.julia/environments/v1.5/Manifest.toml`
  [621f4979] + AbstractFFTs v0.5.0
  [1520ce14] + AbstractTrees v0.3.3
  [79e6a3ab] + Adapt v1.0.1
  [4c555306] + ArrayLayouts v0.2.5
  [b99e7846] + BinaryProvider v0.5.9
  [fa961155] + CEnum v0.2.0
  [3895d2a7] + CUDAapi v4.0.0
  [c5f51814] + CUDAdrv v6.2.3
  [be33ccc6] + CUDAnative v3.0.4
  [da1fd8a2] + CodeTracking v0.5.9
  [944b1d66] + CodecZlib v0.7.0
  [3da002f7] + ColorTypes v0.10.2
  [5ae59095] + Colors v0.12.0
  [bbf7d656] + CommonSubexpressions v0.2.0
  [34da2185] + Compat v3.9.0
  [e66e0078] + CompilerSupportLibraries_jll v0.3.3+0
  [f68482b8] + Cthulhu v1.0.2
  [3a865a2d] + CuArrays v2.1.0
  [9a962f9c] + DataAPI v1.3.0
  [864edb3b] + DataStructures v0.17.15
  [163ba53b] + DiffResults v1.0.2
  [b552c78f] + DiffRules v1.0.1
  [e2ba6199] + ExprTools v0.1.1
  [1a297f60] + FillArrays v0.8.8
  [53c48c17] + FixedPointNumbers v0.8.0
  [587475ba] + Flux v0.10.4
  [f6369f11] + ForwardDiff v0.10.10
  [0c68f7d7] + GPUArrays v3.2.0
  [7869d1d1] + IRTools v0.3.2
  [e5e0dc1b] + Juno v0.8.1
  [929cbde3] + LLVM v1.3.4
  [5078a376] + LazyArrays v0.16.6
  [1fad7336] + LazyStack v0.0.7
  [1914dd2f] + MacroTools v0.5.5
  [e89f7d12] + Media v0.5.0
  [e1d29d7a] + Missings v0.4.3
  [872c559c] + NNlib v0.6.6
  [77ba4419] + NaNMath v0.3.3
  [356022a1] + NamedDims v0.2.21
  [6fe1bfb0] + OffsetArrays v1.0.4
  [efe28fd5] + OpenSpecFun_jll v0.5.3+3
  [bac558e1] + OrderedCollections v1.1.0
  [189a3867] + Reexport v0.2.0
  [ae029012] + Requires v1.0.1
  [a2af1166] + SortingAlgorithms v0.3.1
  [48e2ed6f] + SparseGaussianProcesses v0.1.0
  [276daf66] + SpecialFunctions v0.10.0
  [90137ffa] + StaticArrays v0.12.2
  [2913bbd2] + StatsBase v0.33.0
  [02d47bb6] + TensorCast v0.2.2
  [a759f4b9] + TimerOutputs v0.5.5
  [3bb67fe8] + TranscodingStreams v0.9.5
  [a5390f91] + ZipFile v0.9.1
  [83775a58] + Zlib_jll v1.2.11+9
  [e88e6eb3] + Zygote v0.4.18
  [700de1a5] + ZygoteRules v0.2.0
  [2a0f44e3] + Base64
  [ade2ca70] + Dates
  [8bb1440f] + DelimitedFiles
  [8ba89e20] + Distributed
  [b77e0a4c] + InteractiveUtils
  [76f85450] + LibGit2
  [8f399da3] + Libdl
  [37e2e46d] + LinearAlgebra
  [56ddb016] + Logging
  [d6f4376e] + Markdown
  [a63ad114] + Mmap
  [44cfe95a] + Pkg
  [de0858da] + Printf
  [9abbd945] + Profile
  [3fa0cd96] + REPL
  [9a3f8284] + Random
  [ea8e919c] + SHA
  [9e88b42a] + Serialization
  [1a1011a3] + SharedArrays
  [6462fe0b] + Sockets
  [2f01184e] + SparseArrays
  [10745b16] + Statistics
  [8dfed614] + Test
  [cf7118a7] + UUIDs
  [4ec0a83e] + Unicode
   Building NNlib → `~/.julia/packages/NNlib/FAI3o/deps/build.log`
    Testing SparseGaussianProcesses
Status `/tmp/jl_gNhAIw/Project.toml`
  [587475ba] Flux v0.10.4
  [92933f4c] ProgressMeter v1.2.0
  [ae029012] Requires v1.0.1
  [48e2ed6f] SparseGaussianProcesses v0.1.0
  [02d47bb6] TensorCast v0.2.2
  [37e2e46d] LinearAlgebra
  [9a3f8284] Random
  [10745b16] Statistics
  [8dfed614] Test
Status `/tmp/jl_gNhAIw/Manifest.toml`
  [621f4979] AbstractFFTs v0.5.0
  [1520ce14] AbstractTrees v0.3.3
  [79e6a3ab] Adapt v1.0.1
  [4c555306] ArrayLayouts v0.2.5
  [b99e7846] BinaryProvider v0.5.9
  [fa961155] CEnum v0.2.0
  [3895d2a7] CUDAapi v4.0.0
  [c5f51814] CUDAdrv v6.2.3
  [be33ccc6] CUDAnative v3.0.4
  [da1fd8a2] CodeTracking v0.5.9
  [944b1d66] CodecZlib v0.7.0
  [3da002f7] ColorTypes v0.10.2
  [5ae59095] Colors v0.12.0
  [bbf7d656] CommonSubexpressions v0.2.0
  [34da2185] Compat v3.9.0
  [e66e0078] CompilerSupportLibraries_jll v0.3.3+0
  [f68482b8] Cthulhu v1.0.2
  [3a865a2d] CuArrays v2.1.0
  [9a962f9c] DataAPI v1.3.0
  [864edb3b] DataStructures v0.17.15
  [163ba53b] DiffResults v1.0.2
  [b552c78f] DiffRules v1.0.1
  [e2ba6199] ExprTools v0.1.1
  [1a297f60] FillArrays v0.8.8
  [53c48c17] FixedPointNumbers v0.8.0
  [587475ba] Flux v0.10.4
  [f6369f11] ForwardDiff v0.10.10
  [0c68f7d7] GPUArrays v3.2.0
  [7869d1d1] IRTools v0.3.2
  [e5e0dc1b] Juno v0.8.1
  [929cbde3] LLVM v1.3.4
  [5078a376] LazyArrays v0.16.6
  [1fad7336] LazyStack v0.0.7
  [1914dd2f] MacroTools v0.5.5
  [e89f7d12] Media v0.5.0
  [e1d29d7a] Missings v0.4.3
  [872c559c] NNlib v0.6.6
  [77ba4419] NaNMath v0.3.3
  [356022a1] NamedDims v0.2.21
  [6fe1bfb0] OffsetArrays v1.0.4
  [efe28fd5] OpenSpecFun_jll v0.5.3+3
  [bac558e1] OrderedCollections v1.1.0
  [92933f4c] ProgressMeter v1.2.0
  [189a3867] Reexport v0.2.0
  [ae029012] Requires v1.0.1
  [a2af1166] SortingAlgorithms v0.3.1
  [48e2ed6f] SparseGaussianProcesses v0.1.0
  [276daf66] SpecialFunctions v0.10.0
  [90137ffa] StaticArrays v0.12.2
  [2913bbd2] StatsBase v0.33.0
  [02d47bb6] TensorCast v0.2.2
  [a759f4b9] TimerOutputs v0.5.5
  [3bb67fe8] TranscodingStreams v0.9.5
  [a5390f91] ZipFile v0.9.1
  [83775a58] Zlib_jll v1.2.11+9
  [e88e6eb3] Zygote v0.4.18
  [700de1a5] ZygoteRules v0.2.0
  [2a0f44e3] Base64
  [ade2ca70] Dates
  [8bb1440f] DelimitedFiles
  [8ba89e20] Distributed
  [b77e0a4c] InteractiveUtils
  [76f85450] LibGit2
  [8f399da3] Libdl
  [37e2e46d] LinearAlgebra
  [56ddb016] Logging
  [d6f4376e] Markdown
  [a63ad114] Mmap
  [44cfe95a] Pkg
  [de0858da] Printf
  [9abbd945] Profile
  [3fa0cd96] REPL
  [9a3f8284] Random
  [ea8e919c] SHA
  [9e88b42a] Serialization
  [1a1011a3] SharedArrays
  [6462fe0b] Sockets
  [2f01184e] SparseArrays
  [10745b16] Statistics
  [8dfed614] Test
  [cf7118a7] UUIDs
  [4ec0a83e] Unicode
WARNING: could not import Compiler.just_construct_ssa into Wrap
WARNING: Method definition _pullback(Zygote.Context, typeof(Random.randn!), Any...) in module Zygote at /home/pkgeval/.julia/packages/Zygote/2JFwA/src/lib/grad.jl:14 overwritten in module SparseGaussianProcesses at /home/pkgeval/.julia/packages/Zygote/2JFwA/src/lib/grad.jl:14.
  ** incremental compilation may be fatally broken for this module **

Progress:   1%|▁                                        |  ETA: 0:03:58[KProgress:   4%|█▋                                       |  ETA: 0:01:10[KProgress:   5%|██                                       |  ETA: 0:00:59[KProgress:   6%|██▌                                      |  ETA: 0:00:51[KProgress:   7%|██▉                                      |  ETA: 0:00:45[KProgress:   8%|███▁                                     |  ETA: 0:00:41[KProgress:   9%|███▊                                     |  ETA: 0:00:37[KProgress:  11%|████▌                                    |  ETA: 0:00:31[KProgress:  12%|████▉                                    |  ETA: 0:00:29[KProgress:  14%|█████▊                                   |  ETA: 0:00:25[KProgress:  16%|██████▌                                  |  ETA: 0:00:22[KProgress:  18%|███████▁                                 |  ETA: 0:00:20[KProgress:  19%|███████▊                                 |  ETA: 0:00:19[KProgress:  21%|████████▋                                |  ETA: 0:00:17[KProgress:  23%|█████████▁                               |  ETA: 0:00:16[KProgress:  24%|█████████▉                               |  ETA: 0:00:16[KProgress:  25%|██████████▁                              |  ETA: 0:00:16[KProgress:  26%|██████████▋                              |  ETA: 0:00:15[KProgress:  27%|███████████▁                             |  ETA: 0:00:15[KProgress:  28%|███████████▌                             |  ETA: 0:00:14[KProgress:  29%|███████████▉                             |  ETA: 0:00:14[KProgress:  30%|████████████▁                            |  ETA: 0:00:14[KProgress:  31%|████████████▊                            |  ETA: 0:00:13[KProgress:  32%|█████████████▁                           |  ETA: 0:00:13[KProgress:  33%|█████████████▌                           |  ETA: 0:00:13[KProgress:  34%|██████████████                           |  ETA: 0:00:12[KProgress:  36%|██████████████▊                          |  ETA: 0:00:12[KProgress:  37%|███████████████▁                         |  ETA: 0:00:11[KProgress:  38%|███████████████▋                         |  ETA: 0:00:11[KProgress:  39%|████████████████                         |  ETA: 0:00:11[KProgress:  40%|████████████████▁                        |  ETA: 0:00:11[KProgress:  41%|████████████████▊                        |  ETA: 0:00:11[KProgress:  42%|█████████████████▁                       |  ETA: 0:00:11[KProgress:  44%|██████████████████                       |  ETA: 0:00:10[KProgress:  46%|██████████████████▉                      |  ETA: 0:00:09[KProgress:  48%|███████████████████▋                     |  ETA: 0:00:09[KProgress:  51%|████████████████████▉                    |  ETA: 0:00:08[KProgress:  53%|█████████████████████▊                   |  ETA: 0:00:07[KProgress:  55%|██████████████████████▌                  |  ETA: 0:00:07[KProgress:  57%|███████████████████████▁                 |  ETA: 0:00:06[KProgress:  59%|████████████████████████▁                |  ETA: 0:00:06[KProgress:  61%|█████████████████████████                |  ETA: 0:00:06[KProgress:  63%|█████████████████████████▉               |  ETA: 0:00:05[KProgress:  65%|██████████████████████████▋              |  ETA: 0:00:05[KProgress:  68%|███████████████████████████▉             |  ETA: 0:00:04[KProgress:  69%|████████████████████████████▁            |  ETA: 0:00:04[KProgress:  71%|█████████████████████████████▁           |  ETA: 0:00:04[KProgress:  72%|█████████████████████████████▌           |  ETA: 0:00:04[KProgress:  74%|██████████████████████████████▁          |  ETA: 0:00:03[KProgress:  76%|███████████████████████████████▁         |  ETA: 0:00:03[KProgress:  78%|████████████████████████████████         |  ETA: 0:00:03[KProgress:  80%|████████████████████████████████▊        |  ETA: 0:00:03[KProgress:  82%|█████████████████████████████████▋       |  ETA: 0:00:02[KProgress:  84%|██████████████████████████████████▌      |  ETA: 0:00:02[KProgress:  86%|███████████████████████████████████▁     |  ETA: 0:00:02[KProgress:  89%|████████████████████████████████████▌    |  ETA: 0:00:01[KProgress:  92%|█████████████████████████████████████▊   |  ETA: 0:00:01[KProgress:  95%|███████████████████████████████████████  |  ETA: 0:00:01[KProgress:  98%|████████████████████████████████████████▁|  ETA: 0:00:00[KProgress: 100%|█████████████████████████████████████████| Time: 0:00:11[K
[ Info: Skipping slow RFF test
[ Info: Skipping slow RFF test
[ Info: Skipping slow RFF test
[ Info: Skipping slow RFF test
[ Info: Skipping slow RFF test
[ Info: Skipping slow RFF test
[ Info: Skipping slow RFF test
[ Info: Skipping slow RFF test
[ Info: Skipping slow RFF test
[ Info: Skipping slow RFF test
[ Info: Skipping slow RFF test
[ Info: Skipping slow RFF test
[ Info: Skipping slow RFF test
[ Info: Skipping slow RFF test
[ Info: Skipping slow RFF test
[ Info: Skipping slow RFF test
[ Info: Skipping slow RFF test
[ Info: Skipping slow RFF test
[ Info: Skipping slow RFF test
[ Info: Skipping slow RFF test
[ Info: Skipping slow RFF test
[ Info: Skipping slow RFF test
[ Info: Skipping slow RFF test
[ Info: Skipping slow RFF test
[ Info: Skipping slow RFF test
[ Info: Skipping slow RFF test
[ Info: Skipping slow RFF test
[ Info: Skipping slow RFF test
[ Info: Skipping slow RFF test
[ Info: Skipping slow RFF test
[ Info: Skipping slow RFF test
[ Info: Skipping slow RFF test
[ Info: Skipping slow RFF test
[ Info: Skipping slow RFF test
[ Info: Skipping slow RFF test
gp: Test Failed at /home/pkgeval/.julia/packages/SparseGaussianProcesses/emEpO/test/runtests.jl:183
  Expression: (abs.(mu_f .- mu_x) .< 0.025) |> all
Stacktrace:
 [1] top-level scope at /home/pkgeval/.julia/packages/SparseGaussianProcesses/emEpO/test/runtests.jl:183
 [2] top-level scope at /workspace/srcdir/usr/share/julia/stdlib/v1.5/Test/src/Test.jl:1114
 [3] top-level scope at /home/pkgeval/.julia/packages/SparseGaussianProcesses/emEpO/test/runtests.jl:141
 [4] top-level scope at /workspace/srcdir/usr/share/julia/stdlib/v1.5/Test/src/Test.jl:1114
 [5] top-level scope at /home/pkgeval/.julia/packages/SparseGaussianProcesses/emEpO/test/runtests.jl:13
od = 1
id = 1
var = 1.0
ls = (0.5,)
zd = 8
z = [-1.521602957029573 -0.15191007620142896 -2.187982910023275 -1.588552545850579 1.084546915555393 -0.262054305581671 -0.7183799831014623 -0.5845039521085563]
u = [-0.9987902501800551 -0.1513264868255243 -0.8155099275219546 -0.9998423624841951 0.8840917727945384 -0.25906526836014304 -0.658165869256156 -0.5517857532868548]
1×128 Adjoint{Float64,Array{Float64,2}}:
 0.466143  -0.724083  -0.952277  -0.61299  -0.930524  0.448948  -0.195322  -0.288662  0.167173  -0.249986  -0.945872  -0.701156  0.0170729  0.740531  0.620707  -0.139655  -0.614472  -0.00345896  -0.884732  0.84822  -0.893678  0.000454279  0.167264  0.0213667  0.607327  -0.975987  0.013337  0.114863  -0.953764  -0.999678  0.75794  -0.977225  0.0159156  0.704112  -0.22809  0.007337  -0.0401557  -0.770751  -0.699666  0.0273851  -0.763334  -0.000794213  -0.173017  0.235708  0.0128166  -0.587018  0.00196849  -0.969741  0.0299789  0.0169902  -0.0572378  -0.490946  0.0253064  0.682709  -0.233851  -0.721588  0.00828814  -0.673408  0.0567982  0.109741  0.294833  -0.773346  0.00875144  0.223197  -0.659011  -0.536217  0.0107928  0.0207402  -0.497819  0.000583017  -0.996591  0.0921135  0.00563018  0.00479063  0.0921394  -0.62138  0.0876573  0.869654  -0.983014  0.158514  0.00811891  0.251976  0.168226  0.0531702  -0.0465126  0.0860946  0.0103528  -0.229884  -0.822969  0.00850153  0.0143874  0.663253  0.400391  -0.831159  -0.815948  -0.803782  -0.661957  0.379004  -0.868524  0.860695  0.644455  -0.683519  -0.624557  0.339959  -0.0251357  0.00123538  0.330852  -0.756339  0.530481  -0.967865  0.0242463  -0.00759034  -0.0182001  0.00927141  -0.749707  0.162031  0.0246571  0.487853  -0.830984  -0.74891  -0.844539  -0.196333  -0.319826  -0.734888  -0.252533  -0.629331  0.149045  -0.486577

1×128 Adjoint{Float64,Array{Float64,1}}:
 0.464596  -0.724457  -0.952875  -0.612587  -0.928672  0.447055  -0.194454  -0.288549  0.159569  -0.248058  -0.944109  -0.699521  0.0143481  0.742188  0.621579  -0.138626  -0.614048  -3.1658e-7  -0.885584  0.849211  -0.891952  -3.12528e-11  0.159661  1.66778e-5  0.6071  -0.976315  3.46462e-10  0.12251  -0.954349  -0.998975  0.756448  -0.977535  1.36406e-9  0.705653  -0.227455  0.00884074  -0.0404745  -0.770605  -0.698041  0.0241025  -0.762694  6.75042e-19  -0.172039  0.24187  0.000168393  -0.586955  3.47308e-14  -0.968275  0.0355598  0.0210491  -0.0571  -0.492071  1.03827e-6  0.684128  -0.233262  -0.719982  0.000542618  -0.672085  0.051879  0.117395  0.299901  -0.773168  2.45398e-11  0.216272  -0.657907  -0.53745  0.00839382  2.05937e-5  -0.498472  3.55011e-16  -0.996481  0.0855579  3.12001e-27  0.00240942  0.0855829  -0.620856  0.095235  0.870027  -0.981795  0.150886  3.75921e-29  0.245615  0.175438  0.0484483  -0.046648  0.0797703  6.49885e-11  -0.227453  -0.823457  0.000510474  0.000114859  0.662406  0.397453  -0.831735  -0.815208  -0.803209  -0.660807  0.37558  -0.86934  0.859689  0.64557  -0.682058  -0.623987  0.335621  -0.0108093  5.48214e-15  0.33523  -0.755509  0.530105  -0.968301  4.44575e-6  -0.000228041  -0.00422797  1.18045e-30  -0.748693  0.15441  2.6524e-7  0.486724  -0.830035  -0.747874  -0.845229  -0.195471  -0.319287  -0.733497  -0.252102  -0.62869  0.156473  -0.487269

maximum(abs.(mu_f .- mu_x)) = 0.025305337531139494
Test Summary:           | Pass  Fail  Broken  Total
SparseGaussianProcesses |  139     1      35    175
  hyperprior            |    3                    3
  kernel                |   18                   18
  randomfeature         |   37            35     72
  inducing              |   44                   44
  gp                    |   26     1             27
  loss                  |   11                   11
  gpu                   |                     No tests
ERROR: LoadError: Some tests did not pass: 139 passed, 1 failed, 0 errored, 35 broken.
in expression starting at /home/pkgeval/.julia/packages/SparseGaussianProcesses/emEpO/test/runtests.jl:11
ERROR: Package SparseGaussianProcesses errored during testing
Stacktrace:
 [1] pkgerror(::String, ::Vararg{String,N} where N) at /workspace/srcdir/usr/share/julia/stdlib/v1.5/Pkg/src/Types.jl:52
 [2] test(::Pkg.Types.Context, ::Array{Pkg.Types.PackageSpec,1}; coverage::Bool, julia_args::Cmd, test_args::Cmd, test_fn::Nothing) at /workspace/srcdir/usr/share/julia/stdlib/v1.5/Pkg/src/Operations.jl:1515
 [3] test(::Pkg.Types.Context, ::Array{Pkg.Types.PackageSpec,1}; coverage::Bool, test_fn::Nothing, julia_args::Cmd, test_args::Cmd, kwargs::Base.Iterators.Pairs{Union{},Union{},Tuple{},NamedTuple{(),Tuple{}}}) at /workspace/srcdir/usr/share/julia/stdlib/v1.5/Pkg/src/API.jl:316
 [4] test(::Pkg.Types.Context, ::Array{Pkg.Types.PackageSpec,1}) at /workspace/srcdir/usr/share/julia/stdlib/v1.5/Pkg/src/API.jl:303
 [5] #test#68 at /workspace/srcdir/usr/share/julia/stdlib/v1.5/Pkg/src/API.jl:297 [inlined]
 [6] test at /workspace/srcdir/usr/share/julia/stdlib/v1.5/Pkg/src/API.jl:297 [inlined]
 [7] #test#67 at /workspace/srcdir/usr/share/julia/stdlib/v1.5/Pkg/src/API.jl:296 [inlined]
 [8] test at /workspace/srcdir/usr/share/julia/stdlib/v1.5/Pkg/src/API.jl:296 [inlined]
 [9] test(::String; kwargs::Base.Iterators.Pairs{Union{},Union{},Tuple{},NamedTuple{(),Tuple{}}}) at /workspace/srcdir/usr/share/julia/stdlib/v1.5/Pkg/src/API.jl:295
 [10] test(::String) at /workspace/srcdir/usr/share/julia/stdlib/v1.5/Pkg/src/API.jl:295
 [11] top-level scope at none:16
