Julia Version 1.3.1-pre.13
Commit 8639e5771d (2019-12-07 10:31 UTC)
Platform Info:
  OS: Linux (x86_64-linux-gnu)
  CPU: Intel(R) Xeon(R) Silver 4114 CPU @ 2.20GHz
  WORD_SIZE: 64
  LIBM: libopenlibm
  LLVM: libLLVM-6.0.1 (ORCJIT, skylake)

   Cloning default registries into `~/.julia`
   Cloning registry from "https://github.com/JuliaRegistries/General.git"
[?25l    Fetching: [>                                        ]  0.0 %    Fetching: [==============>                          ]  33.2 %    Fetching: [==================================>      ]  82.7 %[2K[?25h     Added registry `General` to `~/.julia/registries/General`
 Resolving package versions...
 Installed SweepOperator ─────────────── v0.3.0
 Installed LearnBase ─────────────────── v0.2.2
 Installed RecipesBase ───────────────── v0.7.0
 Installed FillArrays ────────────────── v0.8.2
 Installed IteratorInterfaceExtensions ─ v1.0.0
 Installed StatsFuns ─────────────────── v0.9.2
 Installed Pathogen ──────────────────── v0.3.1
 Installed JSON ──────────────────────── v0.21.0
 Installed Tables ────────────────────── v0.2.11
 Installed Missings ──────────────────── v0.4.3
 Installed Arpack_jll ────────────────── v3.5.0+2
 Installed PDMats ────────────────────── v0.9.10
 Installed OrderedCollections ────────── v1.1.0
 Installed CategoricalArrays ─────────── v0.7.4
 Installed Arpack ────────────────────── v0.4.0
 Installed SpecialFunctions ──────────── v0.9.0
 Installed PooledArrays ──────────────── v0.5.2
 Installed Rmath ─────────────────────── v0.6.0
 Installed Compat ────────────────────── v3.0.0
 Installed PenaltyFunctions ──────────── v0.1.2
 Installed BinaryProvider ────────────── v0.5.8
 Installed StatsBase ─────────────────── v0.32.0
 Installed SortingAlgorithms ─────────── v0.3.1
 Installed Polynomials ───────────────── v0.6.0
 Installed OnlineStatsBase ───────────── v1.0.2
 Installed Parsers ───────────────────── v0.3.10
 Installed Reexport ──────────────────── v0.2.0
 Installed DataAPI ───────────────────── v1.1.0
 Installed DataFrames ────────────────── v0.20.0
 Installed TableTraits ───────────────── v1.0.0
 Installed LossFunctions ─────────────── v0.5.1
 Installed Distances ─────────────────── v0.8.2
 Installed DataValueInterfaces ───────── v1.0.0
 Installed InvertedIndices ───────────── v1.0.0
 Installed ProgressMeter ─────────────── v1.2.0
 Installed DataStructures ────────────── v0.17.6
 Installed Distributions ─────────────── v0.21.11
 Installed QuadGK ────────────────────── v2.2.0
 Installed OpenBLAS_jll ──────────────── v0.3.7+1
 Installed OnlineStats ───────────────── v1.0.2
 Installed OpenSpecFun_jll ───────────── v0.5.3+1
  Updating `~/.julia/environments/v1.3/Project.toml`
  [c8189ad9] + Pathogen v0.3.1
  Updating `~/.julia/environments/v1.3/Manifest.toml`
  [7d9fca2a] + Arpack v0.4.0
  [68821587] + Arpack_jll v3.5.0+2
  [b99e7846] + BinaryProvider v0.5.8
  [324d7699] + CategoricalArrays v0.7.4
  [34da2185] + Compat v3.0.0
  [9a962f9c] + DataAPI v1.1.0
  [a93c6f00] + DataFrames v0.20.0
  [864edb3b] + DataStructures v0.17.6
  [e2d170a0] + DataValueInterfaces v1.0.0
  [b4f34e82] + Distances v0.8.2
  [31c24e10] + Distributions v0.21.11
  [1a297f60] + FillArrays v0.8.2
  [41ab1584] + InvertedIndices v1.0.0
  [82899510] + IteratorInterfaceExtensions v1.0.0
  [682c06a0] + JSON v0.21.0
  [7f8f8fb0] + LearnBase v0.2.2
  [30fc2ffe] + LossFunctions v0.5.1
  [e1d29d7a] + Missings v0.4.3
  [a15396b6] + OnlineStats v1.0.2
  [925886fa] + OnlineStatsBase v1.0.2
  [4536629a] + OpenBLAS_jll v0.3.7+1
  [efe28fd5] + OpenSpecFun_jll v0.5.3+1
  [bac558e1] + OrderedCollections v1.1.0
  [90014a1f] + PDMats v0.9.10
  [69de0a69] + Parsers v0.3.10
  [c8189ad9] + Pathogen v0.3.1
  [06bb1623] + PenaltyFunctions v0.1.2
  [f27b6e38] + Polynomials v0.6.0
  [2dfb63ee] + PooledArrays v0.5.2
  [92933f4c] + ProgressMeter v1.2.0
  [1fd47b50] + QuadGK v2.2.0
  [3cdcf5f2] + RecipesBase v0.7.0
  [189a3867] + Reexport v0.2.0
  [79098fc4] + Rmath v0.6.0
  [a2af1166] + SortingAlgorithms v0.3.1
  [276daf66] + SpecialFunctions v0.9.0
  [2913bbd2] + StatsBase v0.32.0
  [4c63d2b9] + StatsFuns v0.9.2
  [7522ee7d] + SweepOperator v0.3.0
  [3783bdb8] + TableTraits v1.0.0
  [bd369af6] + Tables v0.2.11
  [2a0f44e3] + Base64 
  [ade2ca70] + Dates 
  [8bb1440f] + DelimitedFiles 
  [8ba89e20] + Distributed 
  [9fa8497b] + Future 
  [b77e0a4c] + InteractiveUtils 
  [76f85450] + LibGit2 
  [8f399da3] + Libdl 
  [37e2e46d] + LinearAlgebra 
  [56ddb016] + Logging 
  [d6f4376e] + Markdown 
  [a63ad114] + Mmap 
  [44cfe95a] + Pkg 
  [de0858da] + Printf 
  [3fa0cd96] + REPL 
  [9a3f8284] + Random 
  [ea8e919c] + SHA 
  [9e88b42a] + Serialization 
  [1a1011a3] + SharedArrays 
  [6462fe0b] + Sockets 
  [2f01184e] + SparseArrays 
  [10745b16] + Statistics 
  [4607b0f0] + SuiteSparse 
  [8dfed614] + Test 
  [cf7118a7] + UUIDs 
  [4ec0a83e] + Unicode 
  Building Rmath → `~/.julia/packages/Rmath/BoBag/deps/build.log`
   Testing Pathogen
 Resolving package versions...
    Status `/tmp/jl_cIOb61/Manifest.toml`
  [7d9fca2a] Arpack v0.4.0
  [68821587] Arpack_jll v3.5.0+2
  [b99e7846] BinaryProvider v0.5.8
  [324d7699] CategoricalArrays v0.7.4
  [34da2185] Compat v3.0.0
  [9a962f9c] DataAPI v1.1.0
  [a93c6f00] DataFrames v0.20.0
  [864edb3b] DataStructures v0.17.6
  [e2d170a0] DataValueInterfaces v1.0.0
  [b4f34e82] Distances v0.8.2
  [31c24e10] Distributions v0.21.11
  [1a297f60] FillArrays v0.8.2
  [41ab1584] InvertedIndices v1.0.0
  [82899510] IteratorInterfaceExtensions v1.0.0
  [682c06a0] JSON v0.21.0
  [7f8f8fb0] LearnBase v0.2.2
  [30fc2ffe] LossFunctions v0.5.1
  [e1d29d7a] Missings v0.4.3
  [a15396b6] OnlineStats v1.0.2
  [925886fa] OnlineStatsBase v1.0.2
  [4536629a] OpenBLAS_jll v0.3.7+1
  [efe28fd5] OpenSpecFun_jll v0.5.3+1
  [bac558e1] OrderedCollections v1.1.0
  [90014a1f] PDMats v0.9.10
  [69de0a69] Parsers v0.3.10
  [c8189ad9] Pathogen v0.3.1
  [06bb1623] PenaltyFunctions v0.1.2
  [f27b6e38] Polynomials v0.6.0
  [2dfb63ee] PooledArrays v0.5.2
  [92933f4c] ProgressMeter v1.2.0
  [1fd47b50] QuadGK v2.2.0
  [3cdcf5f2] RecipesBase v0.7.0
  [189a3867] Reexport v0.2.0
  [79098fc4] Rmath v0.6.0
  [a2af1166] SortingAlgorithms v0.3.1
  [276daf66] SpecialFunctions v0.9.0
  [2913bbd2] StatsBase v0.32.0
  [4c63d2b9] StatsFuns v0.9.2
  [7522ee7d] SweepOperator v0.3.0
  [3783bdb8] TableTraits v1.0.0
  [bd369af6] Tables v0.2.11
  [2a0f44e3] Base64  [`@stdlib/Base64`]
  [ade2ca70] Dates  [`@stdlib/Dates`]
  [8bb1440f] DelimitedFiles  [`@stdlib/DelimitedFiles`]
  [8ba89e20] Distributed  [`@stdlib/Distributed`]
  [9fa8497b] Future  [`@stdlib/Future`]
  [b77e0a4c] InteractiveUtils  [`@stdlib/InteractiveUtils`]
  [76f85450] LibGit2  [`@stdlib/LibGit2`]
  [8f399da3] Libdl  [`@stdlib/Libdl`]
  [37e2e46d] LinearAlgebra  [`@stdlib/LinearAlgebra`]
  [56ddb016] Logging  [`@stdlib/Logging`]
  [d6f4376e] Markdown  [`@stdlib/Markdown`]
  [a63ad114] Mmap  [`@stdlib/Mmap`]
  [44cfe95a] Pkg  [`@stdlib/Pkg`]
  [de0858da] Printf  [`@stdlib/Printf`]
  [3fa0cd96] REPL  [`@stdlib/REPL`]
  [9a3f8284] Random  [`@stdlib/Random`]
  [ea8e919c] SHA  [`@stdlib/SHA`]
  [9e88b42a] Serialization  [`@stdlib/Serialization`]
  [1a1011a3] SharedArrays  [`@stdlib/SharedArrays`]
  [6462fe0b] Sockets  [`@stdlib/Sockets`]
  [2f01184e] SparseArrays  [`@stdlib/SparseArrays`]
  [10745b16] Statistics  [`@stdlib/Statistics`]
  [4607b0f0] SuiteSparse  [`@stdlib/SuiteSparse`]
  [8dfed614] Test  [`@stdlib/Test`]
  [cf7118a7] UUIDs  [`@stdlib/UUIDs`]
  [4ec0a83e] Unicode  [`@stdlib/Unicode`]
WARNING: Compat.Statistics is deprecated, use Statistics instead.
  likely near /home/pkgeval/.julia/packages/CategoricalArrays/u89s1/src/extras.jl:1
┌ Warning: `getindex(df::DataFrame, col_ind::ColumnIndex)` is deprecated, use `df[!, col_ind]` instead.
│   caller = (::var"#3#4")(::Tuple{Int64,Int64}) at none:0
└ @ Main ./none:0
┌ Warning: `getindex(df::DataFrame, col_ind::ColumnIndex)` is deprecated, use `df[!, col_ind]` instead.
│   caller = (::var"#3#4")(::Tuple{Int64,Int64}) at none:0
└ @ Main ./none:0
┌ Warning: `getindex(df::DataFrame, col_ind::ColumnIndex)` is deprecated, use `df[!, col_ind]` instead.
│   caller = (::var"#3#4")(::Tuple{Int64,Int64}) at none:0
└ @ Main ./none:0
┌ Warning: `getindex(df::DataFrame, col_ind::ColumnIndex)` is deprecated, use `df[!, col_ind]` instead.
│   caller = (::var"#3#4")(::Tuple{Int64,Int64}) at none:0
└ @ Main ./none:0
┌ Warning: `getindex(df::DataFrame, col_ind::ColumnIndex)` is deprecated, use `df[!, col_ind]` instead.
│   caller = _coefficient(::Array{Float64,1}, ::Population, ::Int64) at risk_functions.jl:14
└ @ Main ~/.julia/packages/Pathogen/o7ZBj/test/risk_functions.jl:14
┌ Info: Simulating until: 
│ * a simulation time maximum of 100.0,
│ * an iteration maximum of 1000, or,
└ * a processing time maximum of Inf seconds.
[ Info: Simulation stopped: simulation time maximum reached
┌ Warning: `getindex(df::DataFrame, col_ind::ColumnIndex)` is deprecated, use `df[!, col_ind]` instead.
│   caller = _coefficient(::Array{Float64,1}, ::Population, ::Int64) at risk_functions.jl:14
└ @ Main ~/.julia/packages/Pathogen/o7ZBj/test/risk_functions.jl:14
┌ Warning: `getindex(df::DataFrame, col_ind::ColumnIndex)` is deprecated, use `df[!, col_ind]` instead.
│   caller = _coefficient(::Array{Float64,1}, ::Population, ::Int64) at risk_functions.jl:14
└ @ Main ~/.julia/packages/Pathogen/o7ZBj/test/risk_functions.jl:14
┌ Warning: `getindex(df::DataFrame, col_ind::ColumnIndex)` is deprecated, use `df[!, col_ind]` instead.
│   caller = _coefficient(::Array{Float64,1}, ::Population, ::Int64) at risk_functions.jl:14
└ @ Main ~/.julia/packages/Pathogen/o7ZBj/test/risk_functions.jl:14
Initialization progress  0%|▏                           |  ETA: 1:44:34[KInitialization progress  2%|▌                           |  ETA: 0:17:29[KInitialization progress  3%|▉                           |  ETA: 0:11:36[KInitialization progress  5%|█▎                          |  ETA: 0:07:22[KInitialization progress  6%|█▋                          |  ETA: 0:05:42[KInitialization progress  9%|██▌                         |  ETA: 0:03:42[KInitialization progress 12%|███▌                        |  ETA: 0:02:37[KInitialization progress 14%|████                        |  ETA: 0:02:13[KInitialization progress 17%|████▊                       |  ETA: 0:01:49[KInitialization progress 19%|█████▍                      |  ETA: 0:01:34[KInitialization progress 23%|██████▍                     |  ETA: 0:01:17[KInitialization progress 24%|██████▊                     |  ETA: 0:01:12[KInitialization progress 28%|███████▉                    |  ETA: 0:00:58[KInitialization progress 32%|████████▉                   |  ETA: 0:00:49[KInitialization progress 36%|██████████                  |  ETA: 0:00:42[KInitialization progress 38%|██████████▊                 |  ETA: 0:00:37[KInitialization progress 41%|███████████▍                |  ETA: 0:00:34[KInitialization progress 44%|████████████▎               |  ETA: 0:00:30[KInitialization progress 46%|████████████▉               |  ETA: 0:00:28[KInitialization progress 48%|█████████████▍              |  ETA: 0:00:26[KInitialization progress 50%|█████████████▉              |  ETA: 0:00:24[KInitialization progress 51%|██████████████▏             |  ETA: 0:00:23[KInitialization progress 52%|██████████████▋             |  ETA: 0:00:22[KInitialization progress 53%|██████████████▉             |  ETA: 0:00:21[KInitialization progress 57%|████████████████            |  ETA: 0:00:18[KInitialization progress 59%|████████████████▍           |  ETA: 0:00:17[KInitialization progress 61%|█████████████████           |  ETA: 0:00:16[KInitialization progress 63%|█████████████████▊          |  ETA: 0:00:14[KInitialization progress 66%|██████████████████▍         |  ETA: 0:00:13[KInitialization progress 68%|███████████████████         |  ETA: 0:00:12[KInitialization progress 69%|███████████████████▍        |  ETA: 0:00:11[KInitialization progress 71%|███████████████████▉        |  ETA: 0:00:10[KInitialization progress 72%|████████████████████▎       |  ETA: 0:00:10[KInitialization progress 76%|█████████████████████▎      |  ETA: 0:00:08[KInitialization progress 79%|██████████████████████▎     |  ETA: 0:00:07[KInitialization progress 83%|███████████████████████▎    |  ETA: 0:00:05[KInitialization progress 85%|███████████████████████▊    |  ETA: 0:00:05[KInitialization progress 87%|████████████████████████▎   |  ETA: 0:00:04[KInitialization progress 88%|████████████████████████▋   |  ETA: 0:00:04[KInitialization progress 90%|█████████████████████████▎  |  ETA: 0:00:03[KInitialization progress 93%|██████████████████████████  |  ETA: 0:00:02[KInitialization progress 95%|██████████████████████████▋ |  ETA: 0:00:01[KInitialization progress 96%|███████████████████████████ |  ETA: 0:00:01[KInitialization progress 97%|███████████████████████████▎|  ETA: 0:00:01[KInitialization progress100%|████████████████████████████| Time: 0:00:26[K
┌ Warning: `TruncatedNormal(mu::Real, sigma::Real, a::Real, b::Real)` is deprecated, use `truncated(Normal(mu, sigma), a, b)` instead.
│   caller = generate(::Type{Pathogen.Event}, ::Pathogen.Event{SEIR}, ::Float64, ::EventExtents{SEIR}, ::EventObservations{SEIR}, ::Events{SEIR}) at generate.jl:92
└ @ Pathogen ~/.julia/packages/Pathogen/o7ZBj/src/functions/generate.jl:92
┌ Warning: `TruncatedNormal(mu::Real, sigma::Real, a::Real, b::Real)` is deprecated, use `truncated(Normal(mu, sigma), a, b)` instead.
│   caller = generate(::Type{Pathogen.Event}, ::Pathogen.Event{SEIR}, ::Float64, ::EventExtents{SEIR}, ::EventObservations{SEIR}, ::Events{SEIR}) at generate.jl:92
└ @ Pathogen ~/.julia/packages/Pathogen/o7ZBj/src/functions/generate.jl:92
┌ Warning: `TruncatedNormal(mu::Real, sigma::Real, a::Real, b::Real)` is deprecated, use `truncated(Normal(mu, sigma), a, b)` instead.
│   caller = generate(::Type{Pathogen.Event}, ::Pathogen.Event{SEIR}, ::Float64, ::EventExtents{SEIR}, ::EventObservations{SEIR}, ::Events{SEIR}) at generate.jl:92
└ @ Pathogen ~/.julia/packages/Pathogen/o7ZBj/src/functions/generate.jl:92
MCMC progress  0%|▏                                     |  ETA: 1:29:01[KMCMC progress  1%|▎                                     |  ETA: 0:44:45[KMCMC progress  1%|▍                                     |  ETA: 0:29:57[KMCMC progress  2%|▋                                     |  ETA: 0:18:02[KMCMC progress  2%|▊                                     |  ETA: 0:15:04[KMCMC progress  3%|█                                     |  ETA: 0:11:24[KMCMC progress  3%|█▏                                    |  ETA: 0:10:12[KMCMC progress  3%|█▎                                    |  ETA: 0:09:12[KMCMC progress  4%|█▍                                    |  ETA: 0:08:23[KMCMC progress  4%|█▌                                    |  ETA: 0:07:43[KMCMC progress  4%|█▋                                    |  ETA: 0:07:09[KMCMC progress  5%|█▊                                    |  ETA: 0:06:40[KMCMC progress  5%|█▉                                    |  ETA: 0:06:15[KMCMC progress  5%|██                                    |  ETA: 0:05:53[KMCMC progress  6%|██▏                                   |  ETA: 0:05:33[KMCMC progress  6%|██▍                                   |  ETA: 0:05:01[KMCMC progress  7%|██▌                                   |  ETA: 0:04:47[KMCMC progress  7%|██▋                                   |  ETA: 0:04:34[KMCMC progress  7%|██▊                                   |  ETA: 0:04:22[KMCMC progress  8%|██▉                                   |  ETA: 0:04:11[KMCMC progress  8%|███▏                                  |  ETA: 0:03:51[KMCMC progress  9%|███▌                                  |  ETA: 0:03:27[KMCMC progress 10%|███▋                                  |  ETA: 0:03:20[KMCMC progress 10%|███▊                                  |  ETA: 0:03:14[KMCMC progress 10%|███▉                                  |  ETA: 0:03:08[KMCMC progress 11%|████                                  |  ETA: 0:03:03[KMCMC progress 11%|████▏                                 |  ETA: 0:02:58[KMCMC progress 11%|████▎                                 |  ETA: 0:02:53[KMCMC progress 12%|████▋                                 |  ETA: 0:02:38[KMCMC progress 13%|█████▏                                |  ETA: 0:02:26[KMCMC progress 14%|█████▎                                |  ETA: 0:02:23[KMCMC progress 14%|█████▌                                |  ETA: 0:02:17[KMCMC progress 15%|█████▊                                |  ETA: 0:02:10[KMCMC progress 16%|██████                                |  ETA: 0:02:05[KMCMC progress 16%|██████▏                               |  ETA: 0:02:02[KMCMC progress 16%|██████▎                               |  ETA: 0:02:00[KMCMC progress 17%|██████▍                               |  ETA: 0:01:58[KMCMC progress 17%|██████▌                               |  ETA: 0:01:56[KMCMC progress 18%|██████▊                               |  ETA: 0:01:52[KMCMC progress 18%|███████                               |  ETA: 0:01:48[KMCMC progress 19%|███████▏                              |  ETA: 0:01:46[KMCMC progress 19%|███████▎                              |  ETA: 0:01:44[KMCMC progress 20%|███████▌                              |  ETA: 0:01:41[KMCMC progress 20%|███████▋                              |  ETA: 0:01:39[KMCMC progress 20%|███████▊                              |  ETA: 0:01:37[KMCMC progress 21%|███████▉                              |  ETA: 0:01:36[KMCMC progress 21%|████████                              |  ETA: 0:01:35[KMCMC progress 21%|████████▏                             |  ETA: 0:01:33[KMCMC progress 22%|████████▌                             |  ETA: 0:01:29[KMCMC progress 23%|████████▋                             |  ETA: 0:01:28[KMCMC progress 23%|████████▊                             |  ETA: 0:01:26[KMCMC progress 23%|████████▉                             |  ETA: 0:01:25[KMCMC progress 24%|█████████                             |  ETA: 0:01:24[KMCMC progress 24%|█████████▏                            |  ETA: 0:01:23[KMCMC progress 25%|█████████▍                            |  ETA: 0:01:21[KMCMC progress 25%|█████████▌                            |  ETA: 0:01:20[KMCMC progress 25%|█████████▋                            |  ETA: 0:01:19[KMCMC progress 26%|█████████▉                            |  ETA: 0:01:17[KMCMC progress 27%|██████████▏                           |  ETA: 0:01:15[KMCMC progress 27%|██████████▎                           |  ETA: 0:01:14[KMCMC progress 27%|██████████▍                           |  ETA: 0:01:13[KMCMC progress 28%|██████████▌                           |  ETA: 0:01:12[KMCMC progress 28%|██████████▊                           |  ETA: 0:01:11[KMCMC progress 29%|██████████▉                           |  ETA: 0:01:10[KMCMC progress 29%|███████████                           |  ETA: 0:01:09[KMCMC progress 29%|███████████▏                          |  ETA: 0:01:08[KMCMC progress 30%|███████████▎                          |  ETA: 0:01:08[KMCMC progress 30%|███████████▌                          |  ETA: 0:01:06[KMCMC progress 31%|███████████▋                          |  ETA: 0:01:05[KMCMC progress 31%|███████████▊                          |  ETA: 0:01:04[KMCMC progress 31%|███████████▉                          |  ETA: 0:01:04[KMCMC progress 32%|████████████▏                         |  ETA: 0:01:02[KMCMC progress 32%|████████████▎                         |  ETA: 0:01:01[KMCMC progress 33%|████████████▍                         |  ETA: 0:01:01[KMCMC progress 33%|████████████▌                         |  ETA: 0:01:00[KMCMC progress 33%|████████████▋                         |  ETA: 0:01:00[KMCMC progress 34%|████████████▊                         |  ETA: 0:00:59[KMCMC progress 34%|████████████▉                         |  ETA: 0:00:58[KMCMC progress 35%|█████████████▏                        |  ETA: 0:00:57[KMCMC progress 35%|█████████████▎                        |  ETA: 0:00:56[KMCMC progress 35%|█████████████▍                        |  ETA: 0:00:56[KMCMC progress 36%|█████████████▋                        |  ETA: 0:00:55[KMCMC progress 37%|█████████████▉                        |  ETA: 0:00:54[KMCMC progress 37%|██████████████                        |  ETA: 0:00:53[KMCMC progress 37%|██████████████▏                       |  ETA: 0:00:53[KMCMC progress 38%|██████████████▌                       |  ETA: 0:00:52[KMCMC progress 38%|██████████████▋                       |  ETA: 0:00:51[KMCMC progress 39%|██████████████▉                       |  ETA: 0:00:50[KMCMC progress 39%|███████████████                       |  ETA: 0:00:49[KMCMC progress 40%|███████████████▏                      |  ETA: 0:00:49[KMCMC progress 40%|███████████████▎                      |  ETA: 0:00:48[KMCMC progress 40%|███████████████▍                      |  ETA: 0:00:48[KMCMC progress 41%|███████████████▌                      |  ETA: 0:00:48[KMCMC progress 41%|███████████████▋                      |  ETA: 0:00:47[KMCMC progress 41%|███████████████▊                      |  ETA: 0:00:47[KMCMC progress 42%|████████████████                      |  ETA: 0:00:46[KMCMC progress 42%|████████████████▏                     |  ETA: 0:00:45[KMCMC progress 43%|████████████████▎                     |  ETA: 0:00:45[KMCMC progress 43%|████████████████▍                     |  ETA: 0:00:44[KMCMC progress 43%|████████████████▌                     |  ETA: 0:00:44[KMCMC progress 44%|████████████████▋                     |  ETA: 0:00:44[KMCMC progress 44%|████████████████▊                     |  ETA: 0:00:43[KMCMC progress 44%|████████████████▉                     |  ETA: 0:00:43[KMCMC progress 45%|█████████████████                     |  ETA: 0:00:43[KMCMC progress 45%|█████████████████▏                    |  ETA: 0:00:42[KMCMC progress 45%|█████████████████▎                    |  ETA: 0:00:42[KMCMC progress 46%|█████████████████▍                    |  ETA: 0:00:41[KMCMC progress 46%|█████████████████▋                    |  ETA: 0:00:40[KMCMC progress 47%|█████████████████▊                    |  ETA: 0:00:40[KMCMC progress 47%|██████████████████                    |  ETA: 0:00:39[KMCMC progress 48%|██████████████████▏                   |  ETA: 0:00:39[KMCMC progress 48%|██████████████████▎                   |  ETA: 0:00:39[KMCMC progress 48%|██████████████████▍                   |  ETA: 0:00:38[KMCMC progress 49%|██████████████████▌                   |  ETA: 0:00:38[KMCMC progress 49%|██████████████████▋                   |  ETA: 0:00:37[KMCMC progress 50%|██████████████████▉                   |  ETA: 0:00:37[KMCMC progress 50%|███████████████████                   |  ETA: 0:00:36[KMCMC progress 51%|███████████████████▍                  |  ETA: 0:00:35[KMCMC progress 52%|███████████████████▋                  |  ETA: 0:00:34[KMCMC progress 52%|███████████████████▊                  |  ETA: 0:00:34[KMCMC progress 53%|████████████████████                  |  ETA: 0:00:33[KMCMC progress 53%|████████████████████▏                 |  ETA: 0:00:33[KMCMC progress 53%|████████████████████▎                 |  ETA: 0:00:33[KMCMC progress 54%|████████████████████▍                 |  ETA: 0:00:32[KMCMC progress 54%|████████████████████▌                 |  ETA: 0:00:32[KMCMC progress 54%|████████████████████▋                 |  ETA: 0:00:32[KMCMC progress 55%|█████████████████████                 |  ETA: 0:00:31[KMCMC progress 56%|█████████████████████▏                |  ETA: 0:00:30[KMCMC progress 56%|█████████████████████▎                |  ETA: 0:00:30[KMCMC progress 56%|█████████████████████▍                |  ETA: 0:00:30[KMCMC progress 57%|█████████████████████▌                |  ETA: 0:00:30[KMCMC progress 57%|█████████████████████▋                |  ETA: 0:00:29[KMCMC progress 57%|█████████████████████▊                |  ETA: 0:00:29[KMCMC progress 58%|█████████████████████▉                |  ETA: 0:00:29[KMCMC progress 58%|██████████████████████                |  ETA: 0:00:28[KMCMC progress 59%|██████████████████████▎               |  ETA: 0:00:28[KMCMC progress 59%|██████████████████████▍               |  ETA: 0:00:28[KMCMC progress 59%|██████████████████████▌               |  ETA: 0:00:27[KMCMC progress 60%|██████████████████████▊               |  ETA: 0:00:27[KMCMC progress 60%|██████████████████████▉               |  ETA: 0:00:26[KMCMC progress 61%|███████████████████████               |  ETA: 0:00:26[KMCMC progress 61%|███████████████████████▏              |  ETA: 0:00:26[KMCMC progress 62%|███████████████████████▍              |  ETA: 0:00:25[KMCMC progress 62%|███████████████████████▌              |  ETA: 0:00:25[KMCMC progress 62%|███████████████████████▋              |  ETA: 0:00:25[KMCMC progress 63%|███████████████████████▉              |  ETA: 0:00:25[KMCMC progress 63%|████████████████████████              |  ETA: 0:00:24[KMCMC progress 64%|████████████████████████▎             |  ETA: 0:00:24[KMCMC progress 65%|████████████████████████▋             |  ETA: 0:00:23[KMCMC progress 65%|████████████████████████▊             |  ETA: 0:00:23[KMCMC progress 65%|████████████████████████▉             |  ETA: 0:00:22[KMCMC progress 66%|█████████████████████████▏            |  ETA: 0:00:22[KMCMC progress 67%|█████████████████████████▍            |  ETA: 0:00:21[KMCMC progress 67%|█████████████████████████▌            |  ETA: 0:00:21[KMCMC progress 68%|█████████████████████████▊            |  ETA: 0:00:21[KMCMC progress 68%|█████████████████████████▉            |  ETA: 0:00:20[KMCMC progress 69%|██████████████████████████▏           |  ETA: 0:00:20[KMCMC progress 69%|██████████████████████████▎           |  ETA: 0:00:20[KMCMC progress 70%|██████████████████████████▌           |  ETA: 0:00:19[KMCMC progress 70%|██████████████████████████▋           |  ETA: 0:00:19[KMCMC progress 70%|██████████████████████████▊           |  ETA: 0:00:19[KMCMC progress 71%|██████████████████████████▉           |  ETA: 0:00:18[KMCMC progress 71%|███████████████████████████           |  ETA: 0:00:18[KMCMC progress 71%|███████████████████████████▏          |  ETA: 0:00:18[KMCMC progress 72%|███████████████████████████▎          |  ETA: 0:00:18[KMCMC progress 72%|███████████████████████████▍          |  ETA: 0:00:17[KMCMC progress 72%|███████████████████████████▌          |  ETA: 0:00:17[KMCMC progress 73%|███████████████████████████▊          |  ETA: 0:00:17[KMCMC progress 74%|████████████████████████████          |  ETA: 0:00:16[KMCMC progress 74%|████████████████████████████▎         |  ETA: 0:00:16[KMCMC progress 75%|████████████████████████████▍         |  ETA: 0:00:16[KMCMC progress 75%|████████████████████████████▋         |  ETA: 0:00:15[KMCMC progress 76%|████████████████████████████▊         |  ETA: 0:00:15[KMCMC progress 76%|████████████████████████████▉         |  ETA: 0:00:15[KMCMC progress 76%|█████████████████████████████         |  ETA: 0:00:14[KMCMC progress 77%|█████████████████████████████▏        |  ETA: 0:00:14[KMCMC progress 77%|█████████████████████████████▎        |  ETA: 0:00:14[KMCMC progress 77%|█████████████████████████████▍        |  ETA: 0:00:14[KMCMC progress 78%|█████████████████████████████▋        |  ETA: 0:00:13[KMCMC progress 78%|█████████████████████████████▊        |  ETA: 0:00:13[KMCMC progress 79%|█████████████████████████████▉        |  ETA: 0:00:13[KMCMC progress 79%|██████████████████████████████        |  ETA: 0:00:13[KMCMC progress 79%|██████████████████████████████▏       |  ETA: 0:00:12[KMCMC progress 80%|██████████████████████████████▍       |  ETA: 0:00:12[KMCMC progress 81%|██████████████████████████████▊       |  ETA: 0:00:11[KMCMC progress 82%|███████████████████████████████▏      |  ETA: 0:00:11[KMCMC progress 82%|███████████████████████████████▎      |  ETA: 0:00:10[KMCMC progress 83%|███████████████████████████████▌      |  ETA: 0:00:10[KMCMC progress 84%|███████████████████████████████▉      |  ETA: 0:00:09[KMCMC progress 85%|████████████████████████████████▏     |  ETA: 0:00:09[KMCMC progress 85%|████████████████████████████████▍     |  ETA: 0:00:09[KMCMC progress 86%|████████████████████████████████▌     |  ETA: 0:00:08[KMCMC progress 86%|████████████████████████████████▊     |  ETA: 0:00:08[KMCMC progress 87%|█████████████████████████████████▏    |  ETA: 0:00:07[KMCMC progress 88%|█████████████████████████████████▍    |  ETA: 0:00:07[KMCMC progress 88%|█████████████████████████████████▌    |  ETA: 0:00:07[KMCMC progress 88%|█████████████████████████████████▋    |  ETA: 0:00:07[KMCMC progress 89%|█████████████████████████████████▊    |  ETA: 0:00:06[KMCMC progress 89%|█████████████████████████████████▉    |  ETA: 0:00:06[KMCMC progress 90%|██████████████████████████████████▏   |  ETA: 0:00:06[KMCMC progress 90%|██████████████████████████████████▍   |  ETA: 0:00:06[KMCMC progress 91%|██████████████████████████████████▌   |  ETA: 0:00:05[KMCMC progress 91%|██████████████████████████████████▋   |  ETA: 0:00:05[KMCMC progress 92%|██████████████████████████████████▉   |  ETA: 0:00:05[KMCMC progress 93%|███████████████████████████████████▎  |  ETA: 0:00:04[KMCMC progress 94%|███████████████████████████████████▋  |  ETA: 0:00:04[KMCMC progress 94%|███████████████████████████████████▊  |  ETA: 0:00:03[KMCMC progress 94%|███████████████████████████████████▉  |  ETA: 0:00:03[KMCMC progress 95%|████████████████████████████████████▎ |  ETA: 0:00:03[KMCMC progress 96%|████████████████████████████████████▋ |  ETA: 0:00:02[KMCMC progress 97%|████████████████████████████████████▊ |  ETA: 0:00:02[KMCMC progress 97%|████████████████████████████████████▉ |  ETA: 0:00:02[KMCMC progress100%|██████████████████████████████████████| Time: 0:00:54[K
SEIR Model: Error During Test at /home/pkgeval/.julia/packages/Pathogen/o7ZBj/test/runtests.jl:22
  Got exception outside of a @test
  On worker 2:
  The input for CovMatrix is a Union{Tuple, AbstractArray{T,1} where T, NamedTuple}.  Found Float64.
  error at ./error.jl:33
  fit! at /home/pkgeval/.julia/packages/OnlineStatsBase/L6i9N/src/OnlineStatsBase.jl:108
  fit! at /home/pkgeval/.julia/packages/OnlineStatsBase/L6i9N/src/OnlineStatsBase.jl:110
  #iterate!#29 at /home/pkgeval/.julia/packages/Pathogen/o7ZBj/src/functions/iterate!.jl:66
  #iterate! at ./none:0
  #32 at /workspace/srcdir/julia/usr/share/julia/stdlib/v1.3/Distributed/src/macros.jl:47
  #105 at /workspace/srcdir/julia/usr/share/julia/stdlib/v1.3/Distributed/src/process_messages.jl:290
  run_work_thunk at /workspace/srcdir/julia/usr/share/julia/stdlib/v1.3/Distributed/src/process_messages.jl:79
  run_work_thunk at /workspace/srcdir/julia/usr/share/julia/stdlib/v1.3/Distributed/src/process_messages.jl:88
  #98 at ./task.jl:333
  Stacktrace:
   [1] #remotecall_fetch#145 at /workspace/srcdir/julia/usr/share/julia/stdlib/v1.3/Distributed/src/remotecall.jl:390 [inlined]
   [2] remotecall_fetch(::Function, ::Distributed.Worker, ::Distributed.RRID) at /workspace/srcdir/julia/usr/share/julia/stdlib/v1.3/Distributed/src/remotecall.jl:382
   [3] #remotecall_fetch#148 at /workspace/srcdir/julia/usr/share/julia/stdlib/v1.3/Distributed/src/remotecall.jl:417 [inlined]
   [4] remotecall_fetch at /workspace/srcdir/julia/usr/share/julia/stdlib/v1.3/Distributed/src/remotecall.jl:417 [inlined]
   [5] call_on_owner at /workspace/srcdir/julia/usr/share/julia/stdlib/v1.3/Distributed/src/remotecall.jl:490 [inlined]
   [6] fetch(::Future) at /workspace/srcdir/julia/usr/share/julia/stdlib/v1.3/Distributed/src/remotecall.jl:529
   [7] iterate at ./generator.jl:47 [inlined]
   [8] collect(::Base.Generator{Array{Future,1},typeof(fetch)}) at ./array.jl:622
   [9] #iterate!#30(::Bool, ::Int64, ::Int64, ::typeof(iterate!), ::MCMC{SEIR}, ::Int64, ::Array{Float64,2}, ::Float64) at /home/pkgeval/.julia/packages/Pathogen/o7ZBj/src/functions/iterate!.jl:104
   [10] #iterate! at ./none:0 [inlined]
   [11] #iterate!#38(::Bool, ::Int64, ::Int64, ::typeof(iterate!), ::MCMC{SEIR}, ::Int64, ::Float64) at /home/pkgeval/.julia/packages/Pathogen/o7ZBj/src/functions/iterate!.jl:132
   [12] iterate!(::MCMC{SEIR}, ::Int64, ::Float64) at /home/pkgeval/.julia/packages/Pathogen/o7ZBj/src/functions/iterate!.jl:132
   [13] top-level scope at /home/pkgeval/.julia/packages/Pathogen/o7ZBj/test/runtests.jl:87
   [14] top-level scope at /workspace/srcdir/julia/usr/share/julia/stdlib/v1.3/Test/src/Test.jl:1107
   [15] top-level scope at /home/pkgeval/.julia/packages/Pathogen/o7ZBj/test/runtests.jl:25
   [16] include at ./boot.jl:328 [inlined]
   [17] include_relative(::Module, ::String) at ./loading.jl:1105
   [18] include(::Module, ::String) at ./Base.jl:31
   [19] include(::String) at ./client.jl:424
   [20] top-level scope at none:6
   [21] eval(::Module, ::Any) at ./boot.jl:330
   [22] exec_options(::Base.JLOptions) at ./client.jl:263
   [23] _start() at ./client.jl:460
  
Test Summary: | Pass  Error  Total
SEIR Model    |  222      1    223
ERROR: LoadError: Some tests did not pass: 222 passed, 0 failed, 1 errored, 0 broken.
in expression starting at /home/pkgeval/.julia/packages/Pathogen/o7ZBj/test/runtests.jl:22
ERROR: Package Pathogen errored during testing
Stacktrace:
 [1] pkgerror(::String, ::Vararg{String,N} where N) at /workspace/srcdir/julia/usr/share/julia/stdlib/v1.3/Pkg/src/Types.jl:113
 [2] #test#131(::Bool, ::Nothing, ::Cmd, ::Cmd, ::typeof(Pkg.Operations.test), ::Pkg.Types.Context, ::Array{Pkg.Types.PackageSpec,1}) at /workspace/srcdir/julia/usr/share/julia/stdlib/v1.3/Pkg/src/Operations.jl:1370
 [3] #test at ./none:0 [inlined]
 [4] #test#62(::Bool, ::Nothing, ::Cmd, ::Cmd, ::Base.Iterators.Pairs{Union{},Union{},Tuple{},NamedTuple{(),Tuple{}}}, ::typeof(Pkg.API.test), ::Pkg.Types.Context, ::Array{Pkg.Types.PackageSpec,1}) at /workspace/srcdir/julia/usr/share/julia/stdlib/v1.3/Pkg/src/API.jl:253
 [5] test(::Pkg.Types.Context, ::Array{Pkg.Types.PackageSpec,1}) at /workspace/srcdir/julia/usr/share/julia/stdlib/v1.3/Pkg/src/API.jl:239
 [6] #test#61 at /workspace/srcdir/julia/usr/share/julia/stdlib/v1.3/Pkg/src/API.jl:233 [inlined]
 [7] test at /workspace/srcdir/julia/usr/share/julia/stdlib/v1.3/Pkg/src/API.jl:233 [inlined]
 [8] #test#60 at /workspace/srcdir/julia/usr/share/julia/stdlib/v1.3/Pkg/src/API.jl:232 [inlined]
 [9] test at /workspace/srcdir/julia/usr/share/julia/stdlib/v1.3/Pkg/src/API.jl:232 [inlined]
 [10] #test#59(::Base.Iterators.Pairs{Union{},Union{},Tuple{},NamedTuple{(),Tuple{}}}, ::typeof(Pkg.API.test), ::String) at /workspace/srcdir/julia/usr/share/julia/stdlib/v1.3/Pkg/src/API.jl:231
 [11] test(::String) at /workspace/srcdir/julia/usr/share/julia/stdlib/v1.3/Pkg/src/API.jl:231
 [12] top-level scope at none:12
