Julia Version 1.6.0-DEV.1016
Commit 2bc0d8b624 (2020-09-23 03:05 UTC)
Platform Info:
  OS: Linux (x86_64-linux-gnu)
  CPU: Intel(R) Xeon(R) Silver 4114 CPU @ 2.20GHz
  WORD_SIZE: 64
  LIBM: libopenlibm
  LLVM: libLLVM-10.0.1 (ORCJIT, skylake-avx512)
Environment:
  JULIA_DEPOT_PATH = ::/usr/local/share/julia
  JULIA_NUM_THREADS = 2

  Resolving package versions...
  Installed OpenSpecFun_jll ────────────── v0.5.3+3
  Installed Rmath_jll ──────────────────── v0.2.2+1
  Installed StatsFuns ──────────────────── v0.9.5
  Installed QuadGK ─────────────────────── v2.4.1
  Installed DataStructures ─────────────── v0.17.20
  Installed StatsBase ──────────────────── v0.33.1
  Installed GlobalSensitivityAnalysis ──── v1.0.1
  Installed Sobol ──────────────────────── v1.4.0
  Installed Missings ───────────────────── v0.4.4
  Installed PDMats ─────────────────────── v0.10.1
  Installed ProgressMeter ──────────────── v1.4.0
  Installed FillArrays ─────────────────── v0.9.6
  Installed OrderedCollections ─────────── v1.3.1
  Installed SpecialFunctions ───────────── v0.10.3
  Installed Distributions ──────────────── v0.23.12
  Installed SortingAlgorithms ──────────── v0.3.1
  Installed Rmath ──────────────────────── v0.6.1
  Installed CompilerSupportLibraries_jll ─ v0.3.3+0
  Installed DataAPI ────────────────────── v1.3.0
  Installed StaticArrays ───────────────── v0.12.4
Updating `~/.julia/environments/v1.6/Project.toml`
  [1b10255b] + GlobalSensitivityAnalysis v1.0.1
Updating `~/.julia/environments/v1.6/Manifest.toml`
  [e66e0078] + CompilerSupportLibraries_jll v0.3.3+0
  [9a962f9c] + DataAPI v1.3.0
  [864edb3b] + DataStructures v0.17.20
  [31c24e10] + Distributions v0.23.12
  [1a297f60] + FillArrays v0.9.6
  [1b10255b] + GlobalSensitivityAnalysis v1.0.1
  [e1d29d7a] + Missings v0.4.4
  [efe28fd5] + OpenSpecFun_jll v0.5.3+3
  [bac558e1] + OrderedCollections v1.3.1
  [90014a1f] + PDMats v0.10.1
  [92933f4c] + ProgressMeter v1.4.0
  [1fd47b50] + QuadGK v2.4.1
  [79098fc4] + Rmath v0.6.1
  [f50d1b31] + Rmath_jll v0.2.2+1
  [ed01d8cd] + Sobol v1.4.0
  [a2af1166] + SortingAlgorithms v0.3.1
  [276daf66] + SpecialFunctions v0.10.3
  [90137ffa] + StaticArrays v0.12.4
  [2913bbd2] + StatsBase v0.33.1
  [4c63d2b9] + StatsFuns v0.9.5
  [56f22d72] + Artifacts
  [2a0f44e3] + Base64
  [ade2ca70] + Dates
  [8bb1440f] + DelimitedFiles
  [8ba89e20] + Distributed
  [b77e0a4c] + InteractiveUtils
  [76f85450] + LibGit2
  [8f399da3] + Libdl
  [37e2e46d] + LinearAlgebra
  [56ddb016] + Logging
  [d6f4376e] + Markdown
  [a63ad114] + Mmap
  [44cfe95a] + Pkg
  [de0858da] + Printf
  [3fa0cd96] + REPL
  [9a3f8284] + Random
  [ea8e919c] + SHA
  [9e88b42a] + Serialization
  [6462fe0b] + Sockets
  [2f01184e] + SparseArrays
  [10745b16] + Statistics
  [4607b0f0] + SuiteSparse
  [fa267f1f] + TOML
  [8dfed614] + Test
  [cf7118a7] + UUIDs
  [4ec0a83e] + Unicode
    Testing GlobalSensitivityAnalysis
Status `/tmp/jl_AMZs1i/Project.toml`
  [5d742f6a] CSVFiles v1.0.0
  [a93c6f00] DataFrames v0.21.7
  [864edb3b] DataStructures v0.17.20
  [31c24e10] Distributions v0.23.12
  [1b10255b] GlobalSensitivityAnalysis v1.0.1
  [92933f4c] ProgressMeter v1.4.0
  [ed01d8cd] Sobol v1.4.0
  [10745b16] Statistics
  [8dfed614] Test
Status `/tmp/jl_AMZs1i/Manifest.toml`
  [b99e7846] BinaryProvider v0.5.10
  [5d742f6a] CSVFiles v1.0.0
  [324d7699] CategoricalArrays v0.8.3
  [944b1d66] CodecZlib v0.6.0
  [34da2185] Compat v3.16.0
  [e66e0078] CompilerSupportLibraries_jll v0.3.3+0
  [9a962f9c] DataAPI v1.3.0
  [a93c6f00] DataFrames v0.21.7
  [864edb3b] DataStructures v0.17.20
  [e2d170a0] DataValueInterfaces v1.0.0
  [e7dc6d0d] DataValues v0.4.13
  [31c24e10] Distributions v0.23.12
  [497a8b3b] DoubleFloats v1.1.13
  [e2ba6199] ExprTools v0.1.2
  [8f5d6c58] EzXML v1.1.0
  [5789e2e9] FileIO v1.4.3
  [1a297f60] FillArrays v0.9.6
  [01680d73] GenericSVD v0.3.0
  [c145ed77] GenericSchur v0.4.0
  [1b10255b] GlobalSensitivityAnalysis v1.0.1
  [cd3eb016] HTTP v0.8.19
  [83e8ac13] IniFile v0.5.0
  [d8418881] Intervals v1.4.2
  [41ab1584] InvertedIndices v1.0.0
  [1c8ee90f] IterableTables v1.0.0
  [82899510] IteratorInterfaceExtensions v1.0.0
  [682c06a0] JSON v0.21.1
  [94ce4f54] Libiconv_jll v1.16.0+6
  [739be429] MbedTLS v1.0.2
  [c8ffd9c3] MbedTLS_jll v2.16.8+0
  [e1d29d7a] Missings v0.4.4
  [78c3b35d] Mocking v0.7.1
  [4d1e1d77] Nullables v1.0.0
  [6fe1bfb0] OffsetArrays v1.2.1
  [efe28fd5] OpenSpecFun_jll v0.5.3+3
  [bac558e1] OrderedCollections v1.3.1
  [90014a1f] PDMats v0.10.1
  [69de0a69] Parsers v1.0.10
  [f27b6e38] Polynomials v1.1.8
  [2dfb63ee] PooledArrays v0.5.3
  [92933f4c] ProgressMeter v1.4.0
  [1fd47b50] QuadGK v2.4.1
  [be4d8f0f] Quadmath v0.5.4
  [3cdcf5f2] RecipesBase v1.1.0
  [189a3867] Reexport v0.2.0
  [ae029012] Requires v1.0.3
  [79098fc4] Rmath v0.6.1
  [f50d1b31] Rmath_jll v0.2.2+1
  [ed01d8cd] Sobol v1.4.0
  [a2af1166] SortingAlgorithms v0.3.1
  [276daf66] SpecialFunctions v0.10.3
  [90137ffa] StaticArrays v0.12.4
  [2913bbd2] StatsBase v0.33.1
  [4c63d2b9] StatsFuns v0.9.5
  [856f2bd8] StructTypes v1.1.0
  [5e66a065] TableShowUtils v0.2.5
  [3783bdb8] TableTraits v1.0.0
  [382cd787] TableTraitsUtils v1.0.1
  [bd369af6] Tables v1.0.5
  [e0df1984] TextParse v1.0.1
  [f269a46b] TimeZones v1.3.2
  [3bb67fe8] TranscodingStreams v0.9.5
  [ea10d353] WeakRefStrings v0.6.2
  [02c8fc9c] XML2_jll v2.9.10+2
  [83775a58] Zlib_jll v1.2.11+16
  [56f22d72] Artifacts
  [2a0f44e3] Base64
  [ade2ca70] Dates
  [8bb1440f] DelimitedFiles
  [8ba89e20] Distributed
  [9fa8497b] Future
  [b77e0a4c] InteractiveUtils
  [76f85450] LibGit2
  [8f399da3] Libdl
  [37e2e46d] LinearAlgebra
  [56ddb016] Logging
  [d6f4376e] Markdown
  [a63ad114] Mmap
  [44cfe95a] Pkg
  [de0858da] Printf
  [3fa0cd96] REPL
  [9a3f8284] Random
  [ea8e919c] SHA
  [9e88b42a] Serialization
  [1a1011a3] SharedArrays
  [6462fe0b] Sockets
  [2f01184e] SparseArrays
  [10745b16] Statistics
  [4607b0f0] SuiteSparse
  [fa267f1f] TOML
  [8dfed614] Test
  [cf7118a7] UUIDs
  [4ec0a83e] Unicode
    Testing Running tests...
WARNING: could not import Printf.ini_hex into Quadmath
WARNING: could not import Printf.ini_HEX into Quadmath
WARNING: could not import Printf.ini_hex into DoubleFloats
WARNING: could not import Printf.ini_HEX into DoubleFloats
Calculating indices for 3 parameters ... 33%%|███▋       |  ETA: 0:00:00[KCalculating indices for 3 parameters ... 67%%|███████▁   |  ETA: 0:00:04[KCalculating indices for 3 parameters ...100%%|███████████| Time: 0:00:13[K
Calculating indices for 3 parameters ... 33%%|███▋       |  ETA: 0:00:00[KCalculating indices for 3 parameters ... 67%%|███████▁   |  ETA: 0:00:04[KCalculating indices for 3 parameters ...100%%|███████████| Time: 0:00:11[K
Calculating indices for 3 parameters ... 33%%|███▋       |  ETA: 0:00:00[KCalculating indices for 3 parameters ... 67%%|███████▁   |  ETA: 0:00:01[KCalculating indices for 3 parameters ...100%%|███████████| Time: 0:00:03[K
Calculating indices for 3 parameters ... 33%%|███▋       |  ETA: 0:00:00[KCalculating indices for 3 parameters ... 67%%|███████▁   |  ETA: 0:00:01[KCalculating indices for 3 parameters ...100%%|███████████| Time: 0:00:03[K
Calculating indices for 3 parameters ... 33%%|███▋       |  ETA: 0:00:00[KCalculating indices for 3 parameters ... 67%%|███████▁   |  ETA: 0:00:01[KCalculating indices for 3 parameters ...100%%|███████████| Time: 0:00:03[K
Calculating indices for 3 parameters ... 33%%|███▋       |  ETA: 0:00:00[KCalculating indices for 3 parameters ... 67%%|███████▁   |  ETA: 0:00:01[KCalculating indices for 3 parameters ...100%%|███████████| Time: 0:00:04[K
Calculating indices for 3 parameters ... 33%%|███▋       |  ETA: 0:00:00[KCalculating indices for 3 parameters ... 67%%|███████▁   |  ETA: 0:00:01[KCalculating indices for 3 parameters ...100%%|███████████| Time: 0:00:03[K
Calculating indices for 3 parameters ... 33%%|███▋       |  ETA: 0:00:00[KCalculating indices for 3 parameters ... 67%%|███████▁   |  ETA: 0:00:01[KCalculating indices for 3 parameters ...100%%|███████████| Time: 0:00:04[K
Calculating indices for 3 parameters ... 33%%|███▋       |  ETA: 0:00:00[KCalculating indices for 3 parameters ... 67%%|███████▁   |  ETA: 0:00:01[KCalculating indices for 3 parameters ...100%%|███████████| Time: 0:00:04[K
Calculating indices for 3 parameters ... 33%%|███▋       |  ETA: 0:00:00[KCalculating indices for 3 parameters ... 67%%|███████▁   |  ETA: 0:00:01[KCalculating indices for 3 parameters ...100%%|███████████| Time: 0:00:03[K
Calculating indices for 3 parameters ... 33%%|███▋       |  ETA: 0:00:00[KCalculating indices for 3 parameters ... 67%%|███████▁   |  ETA: 0:00:01[KCalculating indices for 3 parameters ...100%%|███████████| Time: 0:00:04[K
Calculating indices for 3 parameters ... 33%%|███▋       |  ETA: 0:00:00[KCalculating indices for 3 parameters ... 67%%|███████▁   |  ETA: 0:00:01[KCalculating indices for 3 parameters ...100%%|███████████| Time: 0:00:04[K
Calculating indices for 3 parameters ... 33%%|███▋       |  ETA: 0:00:00[KCalculating indices for 3 parameters ... 67%%|███████▁   |  ETA: 0:00:01[KCalculating indices for 3 parameters ...100%%|███████████| Time: 0:00:03[K
Calculating indices for 3 parameters ... 33%%|███▋       |  ETA: 0:00:00[KCalculating indices for 3 parameters ... 67%%|███████▁   |  ETA: 0:00:01[KCalculating indices for 3 parameters ...100%%|███████████| Time: 0:00:04[K
Calculating indices for 3 parameters ... 33%%|███▋       |  ETA: 0:00:00[KCalculating indices for 3 parameters ... 67%%|███████▁   |  ETA: 0:00:01[KCalculating indices for 3 parameters ...100%%|███████████| Time: 0:00:03[K
Calculating indices for 3 parameters ... 33%%|███▋       |  ETA: 0:00:00[KCalculating indices for 3 parameters ... 67%%|███████▁   |  ETA: 0:00:01[KCalculating indices for 3 parameters ...100%%|███████████| Time: 0:00:03[K
Calculating indices for 3 parameters ... 33%%|███▋       |  ETA: 0:00:00[KCalculating indices for 3 parameters ... 67%%|███████▁   |  ETA: 0:00:01[KCalculating indices for 3 parameters ...100%%|███████████| Time: 0:00:04[K
Calculating indices for 3 parameters ... 33%%|███▋       |  ETA: 0:00:00[KCalculating indices for 3 parameters ... 67%%|███████▁   |  ETA: 0:00:01[KCalculating indices for 3 parameters ...100%%|███████████| Time: 0:00:03[K
Calculating indices for 3 parameters ... 33%%|███▋       |  ETA: 0:00:00[KCalculating indices for 3 parameters ... 67%%|███████▁   |  ETA: 0:00:01[KCalculating indices for 3 parameters ...100%%|███████████| Time: 0:00:03[K
Calculating indices for 3 parameters ... 33%%|███▋       |  ETA: 0:00:00[KCalculating indices for 3 parameters ... 67%%|███████▁   |  ETA: 0:00:01[KCalculating indices for 3 parameters ...100%%|███████████| Time: 0:00:04[K
Calculating indices for 3 parameters ... 33%%|███▋       |  ETA: 0:00:00[KCalculating indices for 3 parameters ... 67%%|███████▁   |  ETA: 0:00:01[KCalculating indices for 3 parameters ...100%%|███████████| Time: 0:00:04[K
Calculating indices for 3 parameters ... 33%%|███▋       |  ETA: 0:00:00[KCalculating indices for 3 parameters ... 67%%|███████▁   |  ETA: 0:00:01[KCalculating indices for 3 parameters ...100%%|███████████| Time: 0:00:03[K
Test Summary:       | Pass  Total
Compare to SALib.py |   39     39
Calculating indices for 3 parameters ... 33%%|███▋       |  ETA: 0:00:00[KCalculating indices for 3 parameters ... 67%%|███████▁   |  ETA: 0:00:00[KCalculating indices for 3 parameters ...100%%|███████████| Time: 0:00:00[K
Calculating indices for 3 parameters ... 33%%|███▋       |  ETA: 0:00:00[KCalculating indices for 3 parameters ... 67%%|███████▁   |  ETA: 0:00:04[KCalculating indices for 3 parameters ...100%%|███████████| Time: 0:00:12[K
Calculating indices for 3 parameters ... 33%%|███▋       |  ETA: 0:00:00[KCalculating indices for 3 parameters ... 67%%|███████▁   |  ETA: 0:00:04[KCalculating indices for 3 parameters ...100%%|███████████| Time: 0:00:11[K
Calculating indices for 3 parameters ... 33%%|███▋       |  ETA: 0:00:00[KCalculating indices for 3 parameters ... 67%%|███████▁   |  ETA: 0:00:00[KCalculating indices for 3 parameters ...100%%|███████████| Time: 0:00:00[K
Calculating indices for 3 parameters ... 33%%|███▋       |  ETA: 0:00:00[KCalculating indices for 3 parameters ... 67%%|███████▁   |  ETA: 0:00:00[KCalculating indices for 3 parameters ...100%%|███████████| Time: 0:00:00[K
Calculating indices for 3 parameters ... 33%%|███▋       |  ETA: 0:00:00[KCalculating indices for 3 parameters ... 67%%|███████▁   |  ETA: 0:00:03[KCalculating indices for 3 parameters ...100%%|███████████| Time: 0:00:10[K
Calculating indices for 3 parameters ... 33%%|███▋       |  ETA: 0:00:00[KCalculating indices for 3 parameters ... 67%%|███████▁   |  ETA: 0:00:03[KCalculating indices for 3 parameters ...100%%|███████████| Time: 0:00:10[K
Test Summary: | Pass  Total
Unit Testing  |   69     69
    Testing GlobalSensitivityAnalysis tests passed 
