Julia Version 1.6.0-DEV.356
Commit 0960c9a308 (2020-07-02 17:55 UTC)
Platform Info:
  OS: Linux (x86_64-linux-gnu)
  CPU: Intel(R) Xeon(R) Silver 4114 CPU @ 2.20GHz
  WORD_SIZE: 64
  LIBM: libopenlibm
  LLVM: libLLVM-9.0.1 (ORCJIT, skylake)
Environment:
  JULIA_DEPOT_PATH = ::/usr/local/share/julia
  JULIA_NUM_THREADS = 2

  Resolving package versions...
  Installed CompilerSupportLibraries_jll ─ v0.3.3+0
  Installed UnPack ─────────────────────── v1.0.1
  Installed ElasticArrays ──────────────── v1.2.2
  Installed DataAPI ────────────────────── v1.3.0
  Installed ProgressMeter ──────────────── v1.3.1
  Installed StaticPolynomials ──────────── v1.3.3
  Installed MutableArithmetics ─────────── v0.2.10
  Installed HomotopyContinuation ───────── v1.4.4
  Installed OpenSpecFun_jll ────────────── v0.5.3+3
  Installed OrderedCollections ─────────── v1.3.0
  Installed Reexport ───────────────────── v0.2.0
  Installed MixedSubdivisions ──────────── v1.0.0
  Installed GenericSchur ───────────────── v0.4.0
  Installed StaticArrays ───────────────── v0.12.3
  Installed Polynomials ────────────────── v1.1.2
  Installed Tables ─────────────────────── v1.0.4
  Installed DoubleFloats ───────────────── v1.1.12
  Installed DataValueInterfaces ────────── v1.0.0
  Installed Mocking ────────────────────── v0.7.1
  Installed Zlib_jll ───────────────────── v1.2.11+14
  Installed DynamicPolynomials ─────────── v0.3.10
  Installed ProjectiveVectors ──────────── v1.1.2
  Installed Quadmath ───────────────────── v0.5.4
  Installed FixedPolynomials ───────────── v0.4.0
  Installed PrettyTables ───────────────── v0.9.1
  Installed Formatting ─────────────────── v0.4.1
  Installed RecipesBase ────────────────── v1.0.1
  Installed ExprTools ──────────────────── v0.1.1
  Installed SpecialFunctions ───────────── v0.10.3
  Installed DataStructures ─────────────── v0.17.19
  Installed MultivariatePolynomials ────── v0.3.9
  Installed MacroTools ─────────────────── v0.5.5
  Installed TimeZones ──────────────────── v1.2.0
  Installed XML2_jll ───────────────────── v2.9.10+1
  Installed Requires ───────────────────── v1.0.1
  Installed Libiconv_jll ───────────────── v1.16.0+5
  Installed TableTraits ────────────────── v1.0.0
  Installed LaTeXStrings ───────────────── v1.1.0
  Installed EzXML ──────────────────────── v1.1.0
  Installed TreeViews ──────────────────── v0.3.0
  Installed Parameters ─────────────────── v0.12.1
  Installed Latexify ───────────────────── v0.13.5
  Installed IteratorInterfaceExtensions ── v1.0.0
  Installed Crayons ────────────────────── v4.0.3
  Installed Adapt ──────────────────────── v2.0.2
  Installed Intervals ──────────────────── v1.3.4
  Installed GenericSVD ─────────────────── v0.3.0
Updating `~/.julia/environments/v1.6/Project.toml`
  [f213a82b] + HomotopyContinuation v1.4.4
Updating `~/.julia/environments/v1.6/Manifest.toml`
  [79e6a3ab] + Adapt v2.0.2
  [e66e0078] + CompilerSupportLibraries_jll v0.3.3+0
  [a8cc5b0e] + Crayons v4.0.3
  [9a962f9c] + DataAPI v1.3.0
  [864edb3b] + DataStructures v0.17.19
  [e2d170a0] + DataValueInterfaces v1.0.0
  [497a8b3b] + DoubleFloats v1.1.12
  [7c1d4256] + DynamicPolynomials v0.3.10
  [fdbdab4c] + ElasticArrays v1.2.2
  [e2ba6199] + ExprTools v0.1.1
  [8f5d6c58] + EzXML v1.1.0
  [3dd14ad9] + FixedPolynomials v0.4.0
  [59287772] + Formatting v0.4.1
  [01680d73] + GenericSVD v0.3.0
  [c145ed77] + GenericSchur v0.4.0
  [f213a82b] + HomotopyContinuation v1.4.4
  [d8418881] + Intervals v1.3.4
  [82899510] + IteratorInterfaceExtensions v1.0.0
  [b964fa9f] + LaTeXStrings v1.1.0
  [23fbe1c1] + Latexify v0.13.5
  [94ce4f54] + Libiconv_jll v1.16.0+5
  [1914dd2f] + MacroTools v0.5.5
  [291d046c] + MixedSubdivisions v1.0.0
  [78c3b35d] + Mocking v0.7.1
  [102ac46a] + MultivariatePolynomials v0.3.9
  [d8a4904e] + MutableArithmetics v0.2.10
  [efe28fd5] + OpenSpecFun_jll v0.5.3+3
  [bac558e1] + OrderedCollections v1.3.0
  [d96e819e] + Parameters v0.12.1
  [f27b6e38] + Polynomials v1.1.2
  [08abe8d2] + PrettyTables v0.9.1
  [92933f4c] + ProgressMeter v1.3.1
  [01f381cc] + ProjectiveVectors v1.1.2
  [be4d8f0f] + Quadmath v0.5.4
  [3cdcf5f2] + RecipesBase v1.0.1
  [189a3867] + Reexport v0.2.0
  [ae029012] + Requires v1.0.1
  [276daf66] + SpecialFunctions v0.10.3
  [90137ffa] + StaticArrays v0.12.3
  [62e018b1] + StaticPolynomials v1.3.3
  [3783bdb8] + TableTraits v1.0.0
  [bd369af6] + Tables v1.0.4
  [f269a46b] + TimeZones v1.2.0
  [a2a6695c] + TreeViews v0.3.0
  [3a884ed6] + UnPack v1.0.1
  [02c8fc9c] + XML2_jll v2.9.10+1
  [83775a58] + Zlib_jll v1.2.11+14
  [2a0f44e3] + Base64
  [ade2ca70] + Dates
  [8ba89e20] + Distributed
  [9fa8497b] + Future
  [b77e0a4c] + InteractiveUtils
  [76f85450] + LibGit2
  [8f399da3] + Libdl
  [37e2e46d] + LinearAlgebra
  [56ddb016] + Logging
  [d6f4376e] + Markdown
  [44cfe95a] + Pkg
  [de0858da] + Printf
  [3fa0cd96] + REPL
  [9a3f8284] + Random
  [ea8e919c] + SHA
  [9e88b42a] + Serialization
  [6462fe0b] + Sockets
  [2f01184e] + SparseArrays
  [10745b16] + Statistics
  [8dfed614] + Test
  [cf7118a7] + UUIDs
  [4ec0a83e] + Unicode
   Building TimeZones → `~/.julia/packages/TimeZones/OjMoF/deps/build.log`
    Testing HomotopyContinuation
Status `/tmp/jl_5fO5Pg/Project.toml`
  [e30172f5] Documenter v0.24.11
  [497a8b3b] DoubleFloats v1.1.12
  [7c1d4256] DynamicPolynomials v0.3.10
  [fdbdab4c] ElasticArrays v1.2.2
  [26cc04aa] FiniteDifferences v0.10.2
  [3dd14ad9] FixedPolynomials v0.4.0
  [f213a82b] HomotopyContinuation v1.4.4
  [23fbe1c1] Latexify v0.13.5
  [291d046c] MixedSubdivisions v1.0.0
  [102ac46a] MultivariatePolynomials v0.3.9
  [bac558e1] OrderedCollections v1.3.0
  [d96e819e] Parameters v0.12.1
  [4c526841] PolynomialTestSystems v0.1.4
  [08abe8d2] PrettyTables v0.9.1
  [01f381cc] ProjectiveVectors v1.1.2
  [90137ffa] StaticArrays v0.12.3
  [62e018b1] StaticPolynomials v1.3.3
  [a2a6695c] TreeViews v0.3.0
  [37e2e46d] LinearAlgebra
  [de0858da] Printf
  [9a3f8284] Random
  [8dfed614] Test
Status `/tmp/jl_5fO5Pg/Manifest.toml`
  [79e6a3ab] Adapt v2.0.2
  [e66e0078] CompilerSupportLibraries_jll v0.3.3+0
  [a8cc5b0e] Crayons v4.0.3
  [9a962f9c] DataAPI v1.3.0
  [864edb3b] DataStructures v0.17.19
  [e2d170a0] DataValueInterfaces v1.0.0
  [ffbed154] DocStringExtensions v0.8.2
  [e30172f5] Documenter v0.24.11
  [497a8b3b] DoubleFloats v1.1.12
  [7c1d4256] DynamicPolynomials v0.3.10
  [fdbdab4c] ElasticArrays v1.2.2
  [e2ba6199] ExprTools v0.1.1
  [8f5d6c58] EzXML v1.1.0
  [26cc04aa] FiniteDifferences v0.10.2
  [3dd14ad9] FixedPolynomials v0.4.0
  [59287772] Formatting v0.4.1
  [01680d73] GenericSVD v0.3.0
  [c145ed77] GenericSchur v0.4.0
  [f213a82b] HomotopyContinuation v1.4.4
  [d8418881] Intervals v1.3.4
  [82899510] IteratorInterfaceExtensions v1.0.0
  [682c06a0] JSON v0.21.0
  [b964fa9f] LaTeXStrings v1.1.0
  [23fbe1c1] Latexify v0.13.5
  [94ce4f54] Libiconv_jll v1.16.0+5
  [1914dd2f] MacroTools v0.5.5
  [291d046c] MixedSubdivisions v1.0.0
  [78c3b35d] Mocking v0.7.1
  [102ac46a] MultivariatePolynomials v0.3.9
  [d8a4904e] MutableArithmetics v0.2.10
  [efe28fd5] OpenSpecFun_jll v0.5.3+3
  [bac558e1] OrderedCollections v1.3.0
  [d96e819e] Parameters v0.12.1
  [69de0a69] Parsers v1.0.6
  [4c526841] PolynomialTestSystems v0.1.4
  [f27b6e38] Polynomials v1.1.2
  [08abe8d2] PrettyTables v0.9.1
  [92933f4c] ProgressMeter v1.3.1
  [01f381cc] ProjectiveVectors v1.1.2
  [be4d8f0f] Quadmath v0.5.4
  [3cdcf5f2] RecipesBase v1.0.1
  [189a3867] Reexport v0.2.0
  [ae029012] Requires v1.0.1
  [276daf66] SpecialFunctions v0.10.3
  [90137ffa] StaticArrays v0.12.3
  [62e018b1] StaticPolynomials v1.3.3
  [3783bdb8] TableTraits v1.0.0
  [bd369af6] Tables v1.0.4
  [f269a46b] TimeZones v1.2.0
  [a2a6695c] TreeViews v0.3.0
  [3a884ed6] UnPack v1.0.1
  [02c8fc9c] XML2_jll v2.9.10+1
  [83775a58] Zlib_jll v1.2.11+14
  [2a0f44e3] Base64
  [ade2ca70] Dates
  [8ba89e20] Distributed
  [9fa8497b] Future
  [b77e0a4c] InteractiveUtils
  [76f85450] LibGit2
  [8f399da3] Libdl
  [37e2e46d] LinearAlgebra
  [56ddb016] Logging
  [d6f4376e] Markdown
  [a63ad114] Mmap
  [44cfe95a] Pkg
  [de0858da] Printf
  [3fa0cd96] REPL
  [9a3f8284] Random
  [ea8e919c] SHA
  [9e88b42a] Serialization
  [6462fe0b] Sockets
  [2f01184e] SparseArrays
  [10745b16] Statistics
  [8dfed614] Test
  [cf7118a7] UUIDs
  [4ec0a83e] Unicode
UniquePoints: Test Failed at /home/pkgeval/.julia/packages/HomotopyContinuation/mJDHb/test/utilities_test.jl:69
  Expression: string(data) == "UniquePoints{Array{Complex{Float64},1},Float64,typeof(euclidean_distance),Nothing} with 2000 points"
   Evaluated: "UniquePoints{Vector{ComplexF64},Float64,typeof(euclidean_distance),Nothing} with 2000 points" == "UniquePoints{Array{Complex{Float64},1},Float64,typeof(euclidean_distance),Nothing} with 2000 points"
Stacktrace:
 [1] top-level scope
   @ ~/.julia/packages/HomotopyContinuation/mJDHb/test/utilities_test.jl:69
 [2] top-level scope
   @ /workspace/srcdir/usr/share/julia/stdlib/v1.6/Test/src/Test.jl:1115
 [3] top-level scope
   @ ~/.julia/packages/HomotopyContinuation/mJDHb/test/utilities_test.jl:63
 [4] top-level scope
   @ /workspace/srcdir/usr/share/julia/stdlib/v1.6/Test/src/Test.jl:1115
 [5] top-level scope
   @ ~/.julia/packages/HomotopyContinuation/mJDHb/test/utilities_test.jl:3
┌ Warning: `setup!(tracker::CoreTracker, x, t, t₀; kwargs...)` is deprecated, use `init!(tracker, x, t, t₀; kwargs...)` instead.
│   caller = top-level scope at core_tracker_test.jl:40
└ @ Core ~/.julia/packages/HomotopyContinuation/mJDHb/test/core_tracker_test.jl:40
┌ Warning: Solutions are now automatically refined to maximal achievable accuracy.
└ @ HomotopyContinuation ~/.julia/packages/HomotopyContinuation/mJDHb/src/core_tracker.jl:1410
┌ Warning: `set_refinement_accuracy!` is deprecated. Solutions are now automatically refined to maximal achievable accuracy.
└ @ HomotopyContinuation ~/.julia/packages/HomotopyContinuation/mJDHb/src/core_tracker.jl:1420
┌ Warning: `max_refinement_iters` is deprecated. Solutions are now automatically refined to the maximal achievable accuracy.
└ @ HomotopyContinuation ~/.julia/packages/HomotopyContinuation/mJDHb/src/core_tracker.jl:1429
┌ Warning: `set_max_refinement_iters` is deprecated. Solutions are now automatically refined to the maximal achievable accuracy.
└ @ HomotopyContinuation ~/.julia/packages/HomotopyContinuation/mJDHb/src/core_tracker.jl:1439
Univariate singular: 2,3,4,5,6,7,8,9,10,11,12,
Wilkinson: 1,2,3,4,5,6,7,8,9,10,11,12,13,14,15,16,17,18,
Computing mixed cells... 1 	 Time: 0:00:00[K
  mixed_volume:  5[K[AComputing mixed cells... 14 	 Time: 0:00:00[K
  mixed_volume:  70
Computing mixed cells... 1 	 Time: 0:00:00[K
  mixed_volume:  4[K[AComputing mixed cells... 94 	 Time: 0:00:00[K
  mixed_volume:  556[K[AComputing mixed cells... 478 	 Time: 0:00:00[K
  mixed_volume:  3673[K[AComputing mixed cells... 797 	 Time: 0:00:01[K
  mixed_volume:  5858[K[AComputing mixed cells... 1129 	 Time: 0:00:01[K
  mixed_volume:  8212[K[AComputing mixed cells... 1641 	 Time: 0:00:01[K
  mixed_volume:  11398[K[AComputing mixed cells... 1881 	 Time: 0:00:01[K
  mixed_volume:  12636
Tracking 120 paths...  27%|██████████▋                             |  ETA: 0:00:02[K
  # paths tracked:                  32
  # non-singular solutions (real):  20 (4)
  # singular solutions (real):      0 (0)
  # total solutions (real):         20 (4)[A[A[A[A



[K[A[K[A[K[A[K[ATracking 120 paths... 100%|████████████████████████████████████████| Time: 0:00:00[K
  # paths tracked:                  120
  # non-singular solutions (real):  70 (10)
  # singular solutions (real):      0 (0)
  # total solutions (real):         70 (10)
Tracking 120 paths...  56%|██████████████████████▁                 |  ETA: 0:00:03[K
  # paths tracked:                  67
  # non-singular solutions (real):  38 (5)
  # singular solutions (real):      0 (0)
  # total solutions (real):         38 (5)[A[A[A[A



[K[A[K[A[K[A[K[ATracking 120 paths... 100%|████████████████████████████████████████| Time: 0:00:03[K
  # paths tracked:                  120
  # non-singular solutions (real):  70 (10)
  # singular solutions (real):      0 (0)
  # total solutions (real):         70 (10)
Tracking 216 paths...  30%|████████████                            |  ETA: 0:00:02[K
  # paths tracked:                  65
  # non-singular solutions (real):  25 (5)
  # singular solutions (real):      0 (0)
  # total solutions (real):         25 (5)[A[A[A[A



[K[A[K[A[K[A[K[ATracking 216 paths...  60%|████████████████████████▁               |  ETA: 0:00:01[K
  # paths tracked:                  130
  # non-singular solutions (real):  49 (7)
  # singular solutions (real):      0 (0)
  # total solutions (real):         49 (7)[A[A[A[A



[K[A[K[A[K[A[K[ATracking 216 paths...  91%|████████████████████████████████████▎   |  ETA: 0:00:00[K
  # paths tracked:                  196
  # non-singular solutions (real):  75 (8)
  # singular solutions (real):      0 (0)
  # total solutions (real):         75 (8)[A[A[A[A



[K[A[K[A[K[A[K[ATracking 216 paths... 100%|████████████████████████████████████████| Time: 0:00:01[K
  # paths tracked:                  216
  # non-singular solutions (real):  80 (8)
  # singular solutions (real):      0 (0)
  # total solutions (real):         80 (8)
Tracking 125 paths...   2%|▋                                       |  ETA: 0:00:30[K
  # paths tracked:                  2
  # non-singular solutions (real):  2 (2)
  # singular solutions (real):      0 (0)
  # total solutions (real):         2 (2)[A[A[A[ASolutions found: 36 	 Time: 0:00:00[K
  # paths tracked:                   428
  # loops generated:                 6
  # completed loops without change:  1
  # solutions in current loop:       0
  # real solutions:                  0[K[A[K[A[K[A[K[A[K[ASolutions found: 36 	 Time: 0:00:00[K
  # paths tracked:                   692
  # loops generated:                 10
  # completed loops without change:  5
  # solutions in current loop:       0
  # real solutions:                  0[K[A[K[A[K[A[K[A[K[ASolutions found: 36 	 Time: 0:00:00[K
┌ Warning: None of the provided solutions is a valid start solution.
└ @ HomotopyContinuation ~/.julia/packages/HomotopyContinuation/mJDHb/src/monodromy.jl:878
Solutions found: 3 	 Time: 0:00:00[K
  # paths tracked:                   2
  # loops generated:                 1
  # completed loops without change:  0
  # solutions in current loop:       2
  # real solutions:                  1[K[A[K[A[K[A[K[A[K[ASolutions found: 21 	 Time: 0:00:00[K
[ Info: Compute additional witnesses for completeness...
[ Info: Found 2 additional witnesses
[ Info: Compute trace...
[ Info: Norm of trace: 1.4440185721393217e-13
[ Info: Compute additional witnesses for completeness...
[ Info: Found 36 additional witnesses
[ Info: Compute trace...
[ Info: Norm of trace: 5.566893946109752e-9
Solutions found: 2 	 Time: 0:00:00[K
  # paths tracked:                   2
  # loops generated:                 1
  # completed loops without change:  0
  # solutions in current loop:       1
  # real solutions:                  0[K[A[K[A[K[A[K[A[K[ASolutions found: 6 	 Time: 0:00:01[K
  # paths tracked:                   10
  # loops generated:                 1
  # completed loops without change:  0
  # solutions in current loop:       5
  # real solutions:                  0[K[A[K[A[K[A[K[A[K[ASolutions found: 15 	 Time: 0:00:01[K
  # paths tracked:                   28
  # loops generated:                 1
  # completed loops without change:  0
  # solutions in current loop:       14
  # real solutions:                  0[K[A[K[A[K[A[K[A[K[ASolutions found: 23 	 Time: 0:00:01[K
  # paths tracked:                   44
  # loops generated:                 1
  # completed loops without change:  0
  # solutions in current loop:       22
  # real solutions:                  0[K[A[K[A[K[A[K[A[K[ASolutions found: 32 	 Time: 0:00:01[K
  # paths tracked:                   62
  # loops generated:                 1
  # completed loops without change:  0
  # solutions in current loop:       31
  # real solutions:                  0[K[A[K[A[K[A[K[A[K[ASolutions found: 38 	 Time: 0:00:01[K
  # paths tracked:                   74
  # loops generated:                 1
  # completed loops without change:  0
  # solutions in current loop:       37
  # real solutions:                  0[K[A[K[A[K[A[K[A[K[ASolutions found: 45 	 Time: 0:00:01[K
  # paths tracked:                   88
  # loops generated:                 1
  # completed loops without change:  0
  # solutions in current loop:       44
  # real solutions:                  0[K[A[K[A[K[A[K[A[K[ASolutions found: 50 	 Time: 0:00:01[K
Solutions found: 1 	 Time: 0:00:00[K
  # paths tracked:                   2
  # loops generated:                 1
  # completed loops without change:  0
  # solutions in current loop:       0
  # real solutions:                  1[K[A[K[A[K[A[K[A[K[ASolutions found: 2 	 Time: 0:00:00[K
monodromy group: Test Failed at /home/pkgeval/.julia/packages/HomotopyContinuation/mJDHb/test/monodromy_test.jl:500
  Expression: size(A) == (2, 2)
   Evaluated: (2, 3) == (2, 2)
Stacktrace:
 [1] top-level scope
   @ ~/.julia/packages/HomotopyContinuation/mJDHb/test/monodromy_test.jl:500
 [2] top-level scope
   @ /workspace/srcdir/usr/share/julia/stdlib/v1.6/Test/src/Test.jl:1115
 [3] top-level scope
   @ ~/.julia/packages/HomotopyContinuation/mJDHb/test/monodromy_test.jl:489
 [4] top-level scope
   @ /workspace/srcdir/usr/share/julia/stdlib/v1.6/Test/src/Test.jl:1115
 [5] top-level scope
   @ ~/.julia/packages/HomotopyContinuation/mJDHb/test/monodromy_test.jl:2
monodromy group: Test Failed at /home/pkgeval/.julia/packages/HomotopyContinuation/mJDHb/test/monodromy_test.jl:501
  Expression: A == [1 2; 2 1] || A == [2 1; 1 2]
Stacktrace:
 [1] top-level scope
   @ ~/.julia/packages/HomotopyContinuation/mJDHb/test/monodromy_test.jl:501
 [2] top-level scope
   @ /workspace/srcdir/usr/share/julia/stdlib/v1.6/Test/src/Test.jl:1115
 [3] top-level scope
   @ ~/.julia/packages/HomotopyContinuation/mJDHb/test/monodromy_test.jl:489
 [4] top-level scope
   @ /workspace/srcdir/usr/share/julia/stdlib/v1.6/Test/src/Test.jl:1115
 [5] top-level scope
   @ ~/.julia/packages/HomotopyContinuation/mJDHb/test/monodromy_test.jl:2
Solutions found: 2 	 Time: 0:00:00[K
  # paths tracked:                   2
  # loops generated:                 1
  # completed loops without change:  0
  # solutions in current loop:       1
  # real solutions:                  0[K[A[K[A[K[A[K[A[K[ASolutions found: 6 	 Time: 0:00:00[K
  # paths tracked:                   10
  # loops generated:                 1
  # completed loops without change:  0
  # solutions in current loop:       5
  # real solutions:                  0[K[A[K[A[K[A[K[A[K[ASolutions found: 9 	 Time: 0:00:00[K
  # paths tracked:                   16
  # loops generated:                 1
  # completed loops without change:  0
  # solutions in current loop:       8
  # real solutions:                  0[K[A[K[A[K[A[K[A[K[ASolutions found: 13 	 Time: 0:00:01[K
  # paths tracked:                   24
  # loops generated:                 1
  # completed loops without change:  0
  # solutions in current loop:       12
  # real solutions:                  0[K[A[K[A[K[A[K[A[K[ASolutions found: 21 	 Time: 0:00:01[K
  # paths tracked:                   40
  # loops generated:                 1
  # completed loops without change:  0
  # solutions in current loop:       20
  # real solutions:                  0[K[A[K[A[K[A[K[A[K[ASolutions found: 25 	 Time: 0:00:01[K
  # paths tracked:                   48
  # loops generated:                 1
  # completed loops without change:  0
  # solutions in current loop:       24
  # real solutions:                  0[K[A[K[A[K[A[K[A[K[ASolutions found: 31 	 Time: 0:00:01[K
  # paths tracked:                   60
  # loops generated:                 1
  # completed loops without change:  0
  # solutions in current loop:       30
  # real solutions:                  0[K[A[K[A[K[A[K[A[K[ASolutions found: 35 	 Time: 0:00:01[K
  # paths tracked:                   68
  # loops generated:                 1
  # completed loops without change:  0
  # solutions in current loop:       34
  # real solutions:                  0[K[A[K[A[K[A[K[A[K[ASolutions found: 43 	 Time: 0:00:01[K
  # paths tracked:                   84
  # loops generated:                 1
  # completed loops without change:  0
  # solutions in current loop:       42
  # real solutions:                  0[K[A[K[A[K[A[K[A[K[ASolutions found: 56 	 Time: 0:00:01[K
  # paths tracked:                   110
  # loops generated:                 1
  # completed loops without change:  0
  # solutions in current loop:       55
  # real solutions:                  0[K[A[K[A[K[A[K[A[K[ASolutions found: 67 	 Time: 0:00:01[K
  # paths tracked:                   132
  # loops generated:                 1
  # completed loops without change:  0
  # solutions in current loop:       66
  # real solutions:                  0[K[A[K[A[K[A[K[A[K[ASolutions found: 74 	 Time: 0:00:02[K
  # paths tracked:                   146
  # loops generated:                 1
  # completed loops without change:  0
  # solutions in current loop:       73
  # real solutions:                  0[K[A[K[A[K[A[K[A[K[ASolutions found: 83 	 Time: 0:00:02[K
  # paths tracked:                   164
  # loops generated:                 1
  # completed loops without change:  0
  # solutions in current loop:       82
  # real solutions:                  0[K[A[K[A[K[A[K[A[K[ASolutions found: 87 	 Time: 0:00:02[K
  # paths tracked:                   172
  # loops generated:                 1
  # completed loops without change:  0
  # solutions in current loop:       86
  # real solutions:                  0[K[A[K[A[K[A[K[A[K[ASolutions found: 91 	 Time: 0:00:02[K
  # paths tracked:                   180
  # loops generated:                 1
  # completed loops without change:  0
  # solutions in current loop:       90
  # real solutions:                  0[K[A[K[A[K[A[K[A[K[ASolutions found: 99 	 Time: 0:00:02[K
  # paths tracked:                   196
  # loops generated:                 1
  # completed loops without change:  0
  # solutions in current loop:       98
  # real solutions:                  0[K[A[K[A[K[A[K[A[K[ASolutions found: 115 	 Time: 0:00:02[K
  # paths tracked:                   228
  # loops generated:                 1
  # completed loops without change:  0
  # solutions in current loop:       114
  # real solutions:                  0[K[A[K[A[K[A[K[A[K[ASolutions found: 120 	 Time: 0:00:02[K
  # paths tracked:                   238
  # loops generated:                 1
  # completed loops without change:  0
  # solutions in current loop:       119
  # real solutions:                  0[K[A[K[A[K[A[K[A[K[ASolutions found: 126 	 Time: 0:00:02[K
  # paths tracked:                   250
  # loops generated:                 1
  # completed loops without change:  0
  # solutions in current loop:       125
  # real solutions:                  0[K[A[K[A[K[A[K[A[K[ASolutions found: 130 	 Time: 0:00:03[K
  # paths tracked:                   258
  # loops generated:                 1
  # completed loops without change:  0
  # solutions in current loop:       129
  # real solutions:                  0[K[A[K[A[K[A[K[A[K[ASolutions found: 138 	 Time: 0:00:03[K
  # paths tracked:                   274
  # loops generated:                 1
  # completed loops without change:  0
  # solutions in current loop:       137
  # real solutions:                  0[K[A[K[A[K[A[K[A[K[ASolutions found: 149 	 Time: 0:00:03[K
  # paths tracked:                   296
  # loops generated:                 1
  # completed loops without change:  0
  # solutions in current loop:       148
  # real solutions:                  0[K[A[K[A[K[A[K[A[K[ASolutions found: 161 	 Time: 0:00:03[K
  # paths tracked:                   320
  # loops generated:                 1
  # completed loops without change:  0
  # solutions in current loop:       160
  # real solutions:                  0[K[A[K[A[K[A[K[A[K[ASolutions found: 174 	 Time: 0:00:03[K
  # paths tracked:                   346
  # loops generated:                 1
  # completed loops without change:  0
  # solutions in current loop:       173
  # real solutions:                  0[K[A[K[A[K[A[K[A[K[ASolutions found: 192 	 Time: 0:00:03[K
  # paths tracked:                   382
  # loops generated:                 1
  # completed loops without change:  0
  # solutions in current loop:       191
  # real solutions:                  0[K[A[K[A[K[A[K[A[K[ASolutions found: 206 	 Time: 0:00:03[K
  # paths tracked:                   410
  # loops generated:                 1
  # completed loops without change:  0
  # solutions in current loop:       205
  # real solutions:                  0[K[A[K[A[K[A[K[A[K[ASolutions found: 212 	 Time: 0:00:03[K
  # paths tracked:                   422
  # loops generated:                 1
  # completed loops without change:  0
  # solutions in current loop:       211
  # real solutions:                  0[K[A[K[A[K[A[K[A[K[ASolutions found: 218 	 Time: 0:00:03[K
  # paths tracked:                   434
  # loops generated:                 1
  # completed loops without change:  0
  # solutions in current loop:       217
  # real solutions:                  0[K[A[K[A[K[A[K[A[K[ASolutions found: 236 	 Time: 0:00:04[K
  # paths tracked:                   521
  # loops generated:                 2
  # completed loops without change:  0
  # solutions in current loop:       18
  # real solutions:                  0[K[A[K[A[K[A[K[A[K[ASolutions found: 261 	 Time: 0:00:04[K
  # paths tracked:                   663
  # loops generated:                 2
  # completed loops without change:  0
  # solutions in current loop:       43
  # real solutions:                  0[K[A[K[A[K[A[K[A[K[ASolutions found: 280 	 Time: 0:00:04[K
  # paths tracked:                   791
  # loops generated:                 2
  # completed loops without change:  0
  # solutions in current loop:       62
  # real solutions:                  0[K[A[K[A[K[A[K[A[K[ASolutions found: 303 	 Time: 0:00:04[K
  # paths tracked:                   908
  # loops generated:                 2
  # completed loops without change:  0
  # solutions in current loop:       85
  # real solutions:                  0[K[A[K[A[K[A[K[A[K[ASolutions found: 338 	 Time: 0:00:04[K
  # paths tracked:                   1006
  # loops generated:                 2
  # completed loops without change:  0
  # solutions in current loop:       120
  # real solutions:                  0[K[A[K[A[K[A[K[A[K[ASolutions found: 363 	 Time: 0:00:04[K
  # paths tracked:                   1086
  # loops generated:                 2
  # completed loops without change:  0
  # solutions in current loop:       145
  # real solutions:                  0[K[A[K[A[K[A[K[A[K[ASolutions found: 376 	 Time: 0:00:04[K
  # paths tracked:                   1130
  # loops generated:                 2
  # completed loops without change:  0
  # solutions in current loop:       158
  # real solutions:                  0[K[A[K[A[K[A[K[A[K[ASolutions found: 388 	 Time: 0:00:04[K
  # paths tracked:                   1191
  # loops generated:                 2
  # completed loops without change:  0
  # solutions in current loop:       170
  # real solutions:                  0[K[A[K[A[K[A[K[A[K[ASolutions found: 418 	 Time: 0:00:05[K
  # paths tracked:                   1297
  # loops generated:                 2
  # completed loops without change:  0
  # solutions in current loop:       200
  # real solutions:                  0[K[A[K[A[K[A[K[A[K[ASolutions found: 448 	 Time: 0:00:05[K
  # paths tracked:                   1399
  # loops generated:                 2
  # completed loops without change:  0
  # solutions in current loop:       230
  # real solutions:                  0[K[A[K[A[K[A[K[A[K[ASolutions found: 480 	 Time: 0:00:05[K
  # paths tracked:                   1519
  # loops generated:                 2
  # completed loops without change:  0
  # solutions in current loop:       262
  # real solutions:                  0[K[A[K[A[K[A[K[A[K[ASolutions found: 507 	 Time: 0:00:05[K
  # paths tracked:                   1625
  # loops generated:                 2
  # completed loops without change:  0
  # solutions in current loop:       289
  # real solutions:                  0[K[A[K[A[K[A[K[A[K[ASolutions found: 533 	 Time: 0:00:05[K
  # paths tracked:                   1744
  # loops generated:                 2
  # completed loops without change:  0
  # solutions in current loop:       315
  # real solutions:                  0[K[A[K[A[K[A[K[A[K[ASolutions found: 561 	 Time: 0:00:05[K
  # paths tracked:                   1866
  # loops generated:                 2
  # completed loops without change:  0
  # solutions in current loop:       343
  # real solutions:                  0[K[A[K[A[K[A[K[A[K[ASolutions found: 575 	 Time: 0:00:05[K
  # paths tracked:                   1953
  # loops generated:                 2
  # completed loops without change:  0
  # solutions in current loop:       357
  # real solutions:                  0[K[A[K[A[K[A[K[A[K[ASolutions found: 596 	 Time: 0:00:05[K
  # paths tracked:                   2049
  # loops generated:                 2
  # completed loops without change:  0
  # solutions in current loop:       378
  # real solutions:                  0[K[A[K[A[K[A[K[A[K[ASolutions found: 613 	 Time: 0:00:05[K
  # paths tracked:                   2147
  # loops generated:                 2
  # completed loops without change:  0
  # solutions in current loop:       395
  # real solutions:                  0[K[A[K[A[K[A[K[A[K[ASolutions found: 633 	 Time: 0:00:06[K
  # paths tracked:                   2249
  # loops generated:                 2
  # completed loops without change:  0
  # solutions in current loop:       415
  # real solutions:                  0[K[A[K[A[K[A[K[A[K[ASolutions found: 650 	 Time: 0:00:06[K
  # paths tracked:                   2336
  # loops generated:                 2
  # completed loops without change:  0
  # solutions in current loop:       432
  # real solutions:                  0[K[A[K[A[K[A[K[A[K[ASolutions found: 666 	 Time: 0:00:06[K
  # paths tracked:                   2445
  # loops generated:                 2
  # completed loops without change:  0
  # solutions in current loop:       448
  # real solutions:                  0[K[A[K[A[K[A[K[A[K[ASolutions found: 678 	 Time: 0:00:06[K
  # paths tracked:                   2548
  # loops generated:                 2
  # completed loops without change:  0
  # solutions in current loop:       460
  # real solutions:                  0[K[A[K[A[K[A[K[A[K[ASolutions found: 692 	 Time: 0:00:06[K
  # paths tracked:                   2646
  # loops generated:                 2
  # completed loops without change:  0
  # solutions in current loop:       474
  # real solutions:                  0[K[A[K[A[K[A[K[A[K[ASolutions found: 701 	 Time: 0:00:06[K
  # paths tracked:                   2719
  # loops generated:                 2
  # completed loops without change:  0
  # solutions in current loop:       483
  # real solutions:                  0[K[A[K[A[K[A[K[A[K[ASolutions found: 712 	 Time: 0:00:06[K
  # paths tracked:                   2807
  # loops generated:                 2
  # completed loops without change:  0
  # solutions in current loop:       494
  # real solutions:                  0[K[A[K[A[K[A[K[A[K[ASolutions found: 718 	 Time: 0:00:06[K
  # paths tracked:                   2887
  # loops generated:                 3
  # completed loops without change:  0
  # solutions in current loop:       0
  # real solutions:                  0[K[A[K[A[K[A[K[A[K[ASolutions found: 718 	 Time: 0:00:06[K
  # paths tracked:                   2951
  # loops generated:                 3
  # completed loops without change:  0
  # solutions in current loop:       0
  # real solutions:                  0[K[A[K[A[K[A[K[A[K[ASolutions found: 718 	 Time: 0:00:07[K
  # paths tracked:                   3031
  # loops generated:                 3
  # completed loops without change:  0
  # solutions in current loop:       0
  # real solutions:                  0[K[A[K[A[K[A[K[A[K[ASolutions found: 718 	 Time: 0:00:07[K
  # paths tracked:                   3100
  # loops generated:                 3
  # completed loops without change:  0
  # solutions in current loop:       0
  # real solutions:                  0[K[A[K[A[K[A[K[A[K[ASolutions found: 718 	 Time: 0:00:07[K
  # paths tracked:                   3180
  # loops generated:                 3
  # completed loops without change:  0
  # solutions in current loop:       0
  # real solutions:                  0[K[A[K[A[K[A[K[A[K[ASolutions found: 718 	 Time: 0:00:07[K
  # paths tracked:                   3233
  # loops generated:                 3
  # completed loops without change:  0
  # solutions in current loop:       0
  # real solutions:                  0[K[A[K[A[K[A[K[A[K[ASolutions found: 719 	 Time: 0:00:07[K
  # paths tracked:                   3303
  # loops generated:                 3
  # completed loops without change:  0
  # solutions in current loop:       1
  # real solutions:                  0[K[A[K[A[K[A[K[A[K[ASolutions found: 719 	 Time: 0:00:07[K
  # paths tracked:                   3366
  # loops generated:                 3
  # completed loops without change:  0
  # solutions in current loop:       1
  # real solutions:                  0[K[A[K[A[K[A[K[A[K[ASolutions found: 719 	 Time: 0:00:07[K
  # paths tracked:                   3432
  # loops generated:                 3
  # completed loops without change:  0
  # solutions in current loop:       1
  # real solutions:                  0[K[A[K[A[K[A[K[A[K[ASolutions found: 719 	 Time: 0:00:07[K
  # paths tracked:                   3485
  # loops generated:                 3
  # completed loops without change:  0
  # solutions in current loop:       1
  # real solutions:                  0[K[A[K[A[K[A[K[A[K[ASolutions found: 719 	 Time: 0:00:07[K
  # paths tracked:                   3545
  # loops generated:                 3
  # completed loops without change:  0
  # solutions in current loop:       1
  # real solutions:                  0[K[A[K[A[K[A[K[A[K[ASolutions found: 719 	 Time: 0:00:07[K
  # paths tracked:                   3605
  # loops generated:                 3
  # completed loops without change:  0
  # solutions in current loop:       1
  # real solutions:                  0[K[A[K[A[K[A[K[A[K[ASolutions found: 719 	 Time: 0:00:08[K
  # paths tracked:                   3675
  # loops generated:                 3
  # completed loops without change:  0
  # solutions in current loop:       1
  # real solutions:                  0[K[A[K[A[K[A[K[A[K[ASolutions found: 719 	 Time: 0:00:08[K
  # paths tracked:                   3745
  # loops generated:                 3
  # completed loops without change:  0
  # solutions in current loop:       1
  # real solutions:                  0[K[A[K[A[K[A[K[A[K[ASolutions found: 719 	 Time: 0:00:08[K
  # paths tracked:                   3798
  # loops generated:                 3
  # completed loops without change:  0
  # solutions in current loop:       1
  # real solutions:                  0[K[A[K[A[K[A[K[A[K[ASolutions found: 719 	 Time: 0:00:08[K
  # paths tracked:                   3860
  # loops generated:                 3
  # completed loops without change:  0
  # solutions in current loop:       1
  # real solutions:                  0[K[A[K[A[K[A[K[A[K[ASolutions found: 719 	 Time: 0:00:08[K
  # paths tracked:                   3940
  # loops generated:                 3
  # completed loops without change:  0
  # solutions in current loop:       1
  # real solutions:                  0[K[A[K[A[K[A[K[A[K[ASolutions found: 719 	 Time: 0:00:08[K
  # paths tracked:                   4003
  # loops generated:                 3
  # completed loops without change:  0
  # solutions in current loop:       1
  # real solutions:                  0[K[A[K[A[K[A[K[A[K[ASolutions found: 719 	 Time: 0:00:08[K
  # paths tracked:                   4081
  # loops generated:                 3
  # completed loops without change:  0
  # solutions in current loop:       1
  # real solutions:                  0[K[A[K[A[K[A[K[A[K[ASolutions found: 719 	 Time: 0:00:08[K
  # paths tracked:                   4141
  # loops generated:                 3
  # completed loops without change:  0
  # solutions in current loop:       1
  # real solutions:                  0[K[A[K[A[K[A[K[A[K[ASolutions found: 720 	 Time: 0:00:09[K
  # paths tracked:                   4225
  # loops generated:                 3
  # completed loops without change:  0
  # solutions in current loop:       2
  # real solutions:                  0[K[A[K[A[K[A[K[A[K[ASolutions found: 720 	 Time: 0:00:09[K
Computing mixed cells... 1 	 Time: 0:00:00[K
  mixed_volume:  1[K[AComputing mixed cells... 47 	 Time: 0:00:00[K
  mixed_volume:  76
[ Info: SetupBuildDirectory: setting up build directory.
[ Info: Doctest: running doctests.
┌ Error: doctest failure in ~/.julia/packages/HomotopyContinuation/mJDHb/src/model_kit/expression.jl:634-643
│ 
│ ```jldoctest
│ julia> @var x y;
│ 
│ julia> F = System([x^2, y^2], [y, x]);
│ 
│ julia> F([2, 3])
│ 2-element Array{Int64,1}:
│  9
│  4
│ ```
│ 
│ Subexpression:
│ 
│ F([2, 3])
│ 
│ Evaluated output:
│ 
│ 2-element Vector{Int64}:
│  9
│  4
│ 
│ Expected output:
│ 
│ 2-element Array{Int64,1}:
│  9
│  4
│ 
│   diff =
│    Warning: Diff output requires color.
│    2-element Array{Int64,1}:
│     Vector{Int64}:
│     9
│     4
└ @ Documenter.DocTests ~/.julia/packages/Documenter/PLD7m/src/DocTests.jl:369
┌ Error: doctest failure in ~/.julia/packages/HomotopyContinuation/mJDHb/src/model_kit/expression.jl:646-655
│ 
│ ```jldoctest
│ julia> @var x y t a b;
│ 
│ julia> F = System([x^2 + a, y^2 + b^2], [x, y], [a, b]);
│ 
│ julia> F([2, 3], [5, 2])
│ 2-element Array{Int64,1}:
│   9
│  13
│ ```
│ 
│ Subexpression:
│ 
│ F([2, 3], [5, 2])
│ 
│ Evaluated output:
│ 
│ 2-element Vector{Int64}:
│   9
│  13
│ 
│ Expected output:
│ 
│ 2-element Array{Int64,1}:
│   9
│  13
│ 
│   diff =
│    Warning: Diff output requires color.
│    2-element Array{Int64,1}:
│      Vector{Int64}:
│      9
│     13
└ @ Documenter.DocTests ~/.julia/packages/Documenter/PLD7m/src/DocTests.jl:369
┌ Error: doctest failure in ~/.julia/packages/HomotopyContinuation/mJDHb/src/model_kit/expression.jl:742-756
│ 
│ ```jldoctest
│ julia> @var x y t;
│ 
│ julia> H = Homotopy([x + t, y + 2t], [y, x], t);
│ 
│ julia> H([2, 3], 0)
│ 2-element Array{Int64,1}:
│  3
│  2
│ 
│ julia> H([2, 3], 1)
│ 2-element Array{Int64,1}:
│  4
│  4
│ ```
│ 
│ Subexpression:
│ 
│ H([2, 3], 0)
│ 
│ Evaluated output:
│ 
│ 2-element Vector{Int64}:
│  3
│  2
│ 
│ Expected output:
│ 
│ 2-element Array{Int64,1}:
│  3
│  2
│ 
│   diff =
│    Warning: Diff output requires color.
│    2-element Array{Int64,1}:
│     Vector{Int64}:
│     3
│     2
└ @ Documenter.DocTests ~/.julia/packages/Documenter/PLD7m/src/DocTests.jl:369
┌ Error: doctest failure in ~/.julia/packages/HomotopyContinuation/mJDHb/src/model_kit/expression.jl:742-756
│ 
│ ```jldoctest
│ julia> @var x y t;
│ 
│ julia> H = Homotopy([x + t, y + 2t], [y, x], t);
│ 
│ julia> H([2, 3], 0)
│ 2-element Array{Int64,1}:
│  3
│  2
│ 
│ julia> H([2, 3], 1)
│ 2-element Array{Int64,1}:
│  4
│  4
│ ```
│ 
│ Subexpression:
│ 
│ H([2, 3], 1)
│ 
│ Evaluated output:
│ 
│ 2-element Vector{Int64}:
│  4
│  4
│ 
│ Expected output:
│ 
│ 2-element Array{Int64,1}:
│  4
│  4
│ 
│   diff =
│    Warning: Diff output requires color.
│    2-element Array{Int64,1}:
│     Vector{Int64}:
│     4
│     4
└ @ Documenter.DocTests ~/.julia/packages/Documenter/PLD7m/src/DocTests.jl:369
┌ Error: doctest failure in ~/.julia/packages/HomotopyContinuation/mJDHb/src/model_kit/expression.jl:759-768
│ 
│ ```jldoctest
│ julia> @var x y t a b;
│ 
│ julia> H = Homotopy([x^2 + t*a, y^2 + t*b], [x, y], t, [a, b]);
│ 
│ julia> H([2, 3], 1, [5, 2])
│ 2-element Array{Int64,1}:
│   9
│  11
│ ```
│ 
│ Subexpression:
│ 
│ H([2, 3], 1, [5, 2])
│ 
│ Evaluated output:
│ 
│ 2-element Vector{Int64}:
│   9
│  11
│ 
│ Expected output:
│ 
│ 2-element Array{Int64,1}:
│   9
│  11
│ 
│   diff =
│    Warning: Diff output requires color.
│    2-element Array{Int64,1}:
│      Vector{Int64}:
│      9
│     11
└ @ Documenter.DocTests ~/.julia/packages/Documenter/PLD7m/src/DocTests.jl:369
┌ Error: Doctesting failed
│   exception =
│    `makedocs` encountered a doctest error. Terminating build
│    Stacktrace:
│      [1] error(s::String)
│        @ Base ./error.jl:33
│      [2] runner(#unused#::Type{Documenter.Builder.Doctest}, doc::Documenter.Documents.Document)
│        @ Documenter.Builder ~/.julia/packages/Documenter/PLD7m/src/Builder.jl:204
│      [3] dispatch(#unused#::Type{Documenter.Builder.DocumentPipeline}, x::Documenter.Documents.Document)
│        @ Documenter.Utilities.Selectors ~/.julia/packages/Documenter/PLD7m/src/Utilities/Selectors.jl:167
│      [4] #2
│        @ ~/.julia/packages/Documenter/PLD7m/src/Documenter.jl:240 [inlined]
│      [5] cd(f::Documenter.var"#2#3"{Documenter.Documents.Document}, dir::String)
│        @ Base.Filesystem ./file.jl:104
│      [6] makedocs(; debug::Bool, format::Documenter.Writers.HTMLWriter.HTML, kwargs::Base.Iterators.Pairs{Symbol,Any,NTuple{5,Symbol},NamedTuple{(:root, :source, :sitename, :doctest, :modules),Tuple{String,String,String,Symbol,Vector{Module}}}})
│        @ Documenter ~/.julia/packages/Documenter/PLD7m/src/Documenter.jl:239
│      [7] (::Documenter.var"#all_doctests#30"{Bool,Vector{Module}})()
│        @ Documenter ~/.julia/packages/Documenter/PLD7m/src/Documenter.jl:728
│      [8] macro expansion
│        @ ~/.julia/packages/Documenter/PLD7m/src/Documenter.jl:744 [inlined]
│      [9] macro expansion
│        @ /workspace/srcdir/usr/share/julia/stdlib/v1.6/Test/src/Test.jl:1115 [inlined]
│     [10] doctest(source::String, modules::Vector{Module}; fix::Bool, testset::String)
│        @ Documenter ~/.julia/packages/Documenter/PLD7m/src/Documenter.jl:744
│     [11] doctest(package::Module; manual::Bool, testset::Nothing, kwargs::Base.Iterators.Pairs{Union{},Union{},Tuple{},NamedTuple{(),Tuple{}}})
│        @ Documenter ~/.julia/packages/Documenter/PLD7m/src/Documenter.jl:687
│     [12] doctest(package::Module)
│        @ Documenter ~/.julia/packages/Documenter/PLD7m/src/Documenter.jl:674
│     [13] top-level scope
│        @ ~/.julia/packages/HomotopyContinuation/mJDHb/test/runtests.jl:54
│     [14] top-level scope
│        @ /workspace/srcdir/usr/share/julia/stdlib/v1.6/Test/src/Test.jl:1115
│     [15] top-level scope
│        @ ~/.julia/packages/HomotopyContinuation/mJDHb/test/runtests.jl:27
│     [16] include(fname::String)
│        @ Base.MainInclude ./client.jl:444
│     [17] top-level scope
│        @ none:6
│     [18] eval(m::Module, e::Any)
│        @ Core ./boot.jl:340
│     [19] exec_options(opts::Base.JLOptions)
│        @ Base ./client.jl:260
│     [20] _start()
│        @ Base ./client.jl:485
└ @ Documenter ~/.julia/packages/Documenter/PLD7m/src/Documenter.jl:737
Doctests: HomotopyContinuation: Test Failed at /home/pkgeval/.julia/packages/Documenter/PLD7m/src/Documenter.jl:744
  Expression: all_doctests()
Stacktrace:
 [1] macro expansion
   @ ~/.julia/packages/Documenter/PLD7m/src/Documenter.jl:744 [inlined]
 [2] macro expansion
   @ /workspace/srcdir/usr/share/julia/stdlib/v1.6/Test/src/Test.jl:1115 [inlined]
 [3] doctest(source::String, modules::Vector{Module}; fix::Bool, testset::String)
   @ Documenter ~/.julia/packages/Documenter/PLD7m/src/Documenter.jl:744
Test Summary:                        | Pass  Fail  Total
HomotopyContinuation                 | 1516     4   1520
  ModelKit                           |   82           82
  Utilities                          |  279     1    280
    Group actions                    |    7            7
    UniquePoints                     |  216     1    217
    Multiplicities                   |   10           10
    Polynomials                      |   34           34
    Multihomogeneous                 |    4            4
    Misc                             |    8            8
  Norms                              |   18           18
  LinearAlgebra                      |   70           70
  AffinePatches                      |   22           22
  Problems                           |   59           59
  Systems                            |   59           59
  Homotopies                         |  123          123
  Predictors                         |   48           48
  NewtonCorrector                    |   21           21
  CoreTracker                        |   76           76
  Valuation                          |   53           53
  Cauchy Endgame                     |   20           20
  PathTracker                        |  221          221
  Polyhedral                         |   18           18
  Overdetermined systems             |    5            5
  Solver                             |   84           84
  Result                             |  139          139
  Composition                        |    9            9
  ModelKit integration               |   19           19
  Monodromy                          |   66     2     68
    monodromy_solve                  |   46           46
    Method of Moments                |    2            2
    Trace Test                       |    2            2
    monodromy - automatic start pair |    5            5
    projective                       |    7            7
    monodromy group                  |    3     2      5
    monodromy group Fano problem     |    1            1
  Root counts                        |   23           23
  path_info                          |    2            2
  Doctests: HomotopyContinuation     |          1      1
ERROR: LoadError: Some tests did not pass: 1516 passed, 4 failed, 0 errored, 0 broken.
in expression starting at /home/pkgeval/.julia/packages/HomotopyContinuation/mJDHb/test/runtests.jl:26
ERROR: Package HomotopyContinuation errored during testing
Stacktrace:
  [1] pkgerror(msg::String)
    @ Pkg.Types /workspace/srcdir/usr/share/julia/stdlib/v1.6/Pkg/src/Types.jl:52
  [2] test(ctx::Pkg.Types.Context, pkgs::Vector{Pkg.Types.PackageSpec}; coverage::Bool, julia_args::Cmd, test_args::Cmd, test_fn::Nothing)
    @ Pkg.Operations /workspace/srcdir/usr/share/julia/stdlib/v1.6/Pkg/src/Operations.jl:1561
  [3] test(ctx::Pkg.Types.Context, pkgs::Vector{Pkg.Types.PackageSpec}; coverage::Bool, test_fn::Nothing, julia_args::Cmd, test_args::Cmd, kwargs::Base.Iterators.Pairs{Union{},Union{},Tuple{},NamedTuple{(),Tuple{}}})
    @ Pkg.API /workspace/srcdir/usr/share/julia/stdlib/v1.6/Pkg/src/API.jl:327
  [4] test(ctx::Pkg.Types.Context, pkgs::Vector{Pkg.Types.PackageSpec})
    @ Pkg.API /workspace/srcdir/usr/share/julia/stdlib/v1.6/Pkg/src/API.jl:314
  [5] #test#61
    @ /workspace/srcdir/usr/share/julia/stdlib/v1.6/Pkg/src/API.jl:67 [inlined]
  [6] test
    @ /workspace/srcdir/usr/share/julia/stdlib/v1.6/Pkg/src/API.jl:67 [inlined]
  [7] #test#60
    @ /workspace/srcdir/usr/share/julia/stdlib/v1.6/Pkg/src/API.jl:66 [inlined]
  [8] test
    @ /workspace/srcdir/usr/share/julia/stdlib/v1.6/Pkg/src/API.jl:66 [inlined]
  [9] test(pkg::String; kwargs::Base.Iterators.Pairs{Union{},Union{},Tuple{},NamedTuple{(),Tuple{}}})
    @ Pkg.API /workspace/srcdir/usr/share/julia/stdlib/v1.6/Pkg/src/API.jl:65
 [10] test(pkg::String)
    @ Pkg.API /workspace/srcdir/usr/share/julia/stdlib/v1.6/Pkg/src/API.jl:65
 [11] top-level scope
    @ none:16
