Julia Version 1.6.0-DEV.360
Commit 66f41c5868 (2020-07-03 11:12 UTC)
Platform Info:
  OS: Linux (x86_64-pc-linux-gnu)
  CPU: Intel(R) Xeon(R) Silver 4114 CPU @ 2.20GHz
  WORD_SIZE: 64
  LIBM: libopenlibm
  LLVM: libLLVM-9.0.1 (ORCJIT, skylake)
Environment:
  JULIA_DEPOT_PATH = ::/usr/local/share/julia
  JULIA_NUM_THREADS = 2

  Resolving package versions...
  Installed Requires ───────────────────── v1.0.1
  Installed OpenSpecFun_jll ────────────── v0.5.3+3
  Installed DynamicPolynomials ─────────── v0.3.10
  Installed Quadmath ───────────────────── v0.5.4
  Installed MacroTools ─────────────────── v0.5.5
  Installed Polynomials ────────────────── v1.1.2
  Installed HomotopyContinuation ───────── v1.4.4
  Installed DoubleFloats ───────────────── v1.1.12
  Installed DataValueInterfaces ────────── v1.0.0
  Installed Adapt ──────────────────────── v2.0.2
  Installed XML2_jll ───────────────────── v2.9.10+1
  Installed Formatting ─────────────────── v0.4.1
  Installed DataAPI ────────────────────── v1.3.0
  Installed ElasticArrays ──────────────── v1.2.2
  Installed ProjectiveVectors ──────────── v1.1.2
  Installed SpecialFunctions ───────────── v0.10.3
  Installed Parameters ─────────────────── v0.12.1
  Installed DataStructures ─────────────── v0.17.19
  Installed Latexify ───────────────────── v0.13.5
  Installed StaticArrays ───────────────── v0.12.3
  Installed Libiconv_jll ───────────────── v1.16.0+5
  Installed GenericSVD ─────────────────── v0.3.0
  Installed IteratorInterfaceExtensions ── v1.0.0
  Installed FixedPolynomials ───────────── v0.4.0
  Installed CompilerSupportLibraries_jll ─ v0.3.3+0
  Installed ExprTools ──────────────────── v0.1.1
  Installed MutableArithmetics ─────────── v0.2.10
  Installed MultivariatePolynomials ────── v0.3.9
  Installed Mocking ────────────────────── v0.7.1
  Installed TreeViews ──────────────────── v0.3.0
  Installed MixedSubdivisions ──────────── v1.0.0
  Installed TableTraits ────────────────── v1.0.0
  Installed UnPack ─────────────────────── v1.0.1
  Installed EzXML ──────────────────────── v1.1.0
  Installed GenericSchur ───────────────── v0.4.0
  Installed Tables ─────────────────────── v1.0.4
  Installed Reexport ───────────────────── v0.2.0
  Installed LaTeXStrings ───────────────── v1.1.0
  Installed StaticPolynomials ──────────── v1.3.3
  Installed ProgressMeter ──────────────── v1.3.1
  Installed RecipesBase ────────────────── v1.0.1
  Installed Intervals ──────────────────── v1.3.4
  Installed TimeZones ──────────────────── v1.2.0
  Installed Zlib_jll ───────────────────── v1.2.11+14
  Installed Crayons ────────────────────── v4.0.3
  Installed OrderedCollections ─────────── v1.3.0
  Installed PrettyTables ───────────────── v0.9.1
Updating `~/.julia/environments/v1.6/Project.toml`
  [f213a82b] + HomotopyContinuation v1.4.4
Updating `~/.julia/environments/v1.6/Manifest.toml`
  [79e6a3ab] + Adapt v2.0.2
  [e66e0078] + CompilerSupportLibraries_jll v0.3.3+0
  [a8cc5b0e] + Crayons v4.0.3
  [9a962f9c] + DataAPI v1.3.0
  [864edb3b] + DataStructures v0.17.19
  [e2d170a0] + DataValueInterfaces v1.0.0
  [497a8b3b] + DoubleFloats v1.1.12
  [7c1d4256] + DynamicPolynomials v0.3.10
  [fdbdab4c] + ElasticArrays v1.2.2
  [e2ba6199] + ExprTools v0.1.1
  [8f5d6c58] + EzXML v1.1.0
  [3dd14ad9] + FixedPolynomials v0.4.0
  [59287772] + Formatting v0.4.1
  [01680d73] + GenericSVD v0.3.0
  [c145ed77] + GenericSchur v0.4.0
  [f213a82b] + HomotopyContinuation v1.4.4
  [d8418881] + Intervals v1.3.4
  [82899510] + IteratorInterfaceExtensions v1.0.0
  [b964fa9f] + LaTeXStrings v1.1.0
  [23fbe1c1] + Latexify v0.13.5
  [94ce4f54] + Libiconv_jll v1.16.0+5
  [1914dd2f] + MacroTools v0.5.5
  [291d046c] + MixedSubdivisions v1.0.0
  [78c3b35d] + Mocking v0.7.1
  [102ac46a] + MultivariatePolynomials v0.3.9
  [d8a4904e] + MutableArithmetics v0.2.10
  [efe28fd5] + OpenSpecFun_jll v0.5.3+3
  [bac558e1] + OrderedCollections v1.3.0
  [d96e819e] + Parameters v0.12.1
  [f27b6e38] + Polynomials v1.1.2
  [08abe8d2] + PrettyTables v0.9.1
  [92933f4c] + ProgressMeter v1.3.1
  [01f381cc] + ProjectiveVectors v1.1.2
  [be4d8f0f] + Quadmath v0.5.4
  [3cdcf5f2] + RecipesBase v1.0.1
  [189a3867] + Reexport v0.2.0
  [ae029012] + Requires v1.0.1
  [276daf66] + SpecialFunctions v0.10.3
  [90137ffa] + StaticArrays v0.12.3
  [62e018b1] + StaticPolynomials v1.3.3
  [3783bdb8] + TableTraits v1.0.0
  [bd369af6] + Tables v1.0.4
  [f269a46b] + TimeZones v1.2.0
  [a2a6695c] + TreeViews v0.3.0
  [3a884ed6] + UnPack v1.0.1
  [02c8fc9c] + XML2_jll v2.9.10+1
  [83775a58] + Zlib_jll v1.2.11+14
  [2a0f44e3] + Base64
  [ade2ca70] + Dates
  [8ba89e20] + Distributed
  [9fa8497b] + Future
  [b77e0a4c] + InteractiveUtils
  [76f85450] + LibGit2
  [8f399da3] + Libdl
  [37e2e46d] + LinearAlgebra
  [56ddb016] + Logging
  [d6f4376e] + Markdown
  [44cfe95a] + Pkg
  [de0858da] + Printf
  [3fa0cd96] + REPL
  [9a3f8284] + Random
  [ea8e919c] + SHA
  [9e88b42a] + Serialization
  [6462fe0b] + Sockets
  [2f01184e] + SparseArrays
  [10745b16] + Statistics
  [8dfed614] + Test
  [cf7118a7] + UUIDs
  [4ec0a83e] + Unicode
   Building TimeZones → `~/.julia/packages/TimeZones/OjMoF/deps/build.log`
    Testing HomotopyContinuation
Status `/tmp/jl_GXkYu4/Project.toml`
  [e30172f5] Documenter v0.24.11
  [497a8b3b] DoubleFloats v1.1.12
  [7c1d4256] DynamicPolynomials v0.3.10
  [fdbdab4c] ElasticArrays v1.2.2
  [26cc04aa] FiniteDifferences v0.10.2
  [3dd14ad9] FixedPolynomials v0.4.0
  [f213a82b] HomotopyContinuation v1.4.4
  [23fbe1c1] Latexify v0.13.5
  [291d046c] MixedSubdivisions v1.0.0
  [102ac46a] MultivariatePolynomials v0.3.9
  [bac558e1] OrderedCollections v1.3.0
  [d96e819e] Parameters v0.12.1
  [4c526841] PolynomialTestSystems v0.1.4
  [08abe8d2] PrettyTables v0.9.1
  [01f381cc] ProjectiveVectors v1.1.2
  [90137ffa] StaticArrays v0.12.3
  [62e018b1] StaticPolynomials v1.3.3
  [a2a6695c] TreeViews v0.3.0
  [37e2e46d] LinearAlgebra
  [de0858da] Printf
  [9a3f8284] Random
  [8dfed614] Test
Status `/tmp/jl_GXkYu4/Manifest.toml`
  [79e6a3ab] Adapt v2.0.2
  [e66e0078] CompilerSupportLibraries_jll v0.3.3+0
  [a8cc5b0e] Crayons v4.0.3
  [9a962f9c] DataAPI v1.3.0
  [864edb3b] DataStructures v0.17.19
  [e2d170a0] DataValueInterfaces v1.0.0
  [ffbed154] DocStringExtensions v0.8.2
  [e30172f5] Documenter v0.24.11
  [497a8b3b] DoubleFloats v1.1.12
  [7c1d4256] DynamicPolynomials v0.3.10
  [fdbdab4c] ElasticArrays v1.2.2
  [e2ba6199] ExprTools v0.1.1
  [8f5d6c58] EzXML v1.1.0
  [26cc04aa] FiniteDifferences v0.10.2
  [3dd14ad9] FixedPolynomials v0.4.0
  [59287772] Formatting v0.4.1
  [01680d73] GenericSVD v0.3.0
  [c145ed77] GenericSchur v0.4.0
  [f213a82b] HomotopyContinuation v1.4.4
  [d8418881] Intervals v1.3.4
  [82899510] IteratorInterfaceExtensions v1.0.0
  [682c06a0] JSON v0.21.0
  [b964fa9f] LaTeXStrings v1.1.0
  [23fbe1c1] Latexify v0.13.5
  [94ce4f54] Libiconv_jll v1.16.0+5
  [1914dd2f] MacroTools v0.5.5
  [291d046c] MixedSubdivisions v1.0.0
  [78c3b35d] Mocking v0.7.1
  [102ac46a] MultivariatePolynomials v0.3.9
  [d8a4904e] MutableArithmetics v0.2.10
  [efe28fd5] OpenSpecFun_jll v0.5.3+3
  [bac558e1] OrderedCollections v1.3.0
  [d96e819e] Parameters v0.12.1
  [69de0a69] Parsers v1.0.6
  [4c526841] PolynomialTestSystems v0.1.4
  [f27b6e38] Polynomials v1.1.2
  [08abe8d2] PrettyTables v0.9.1
  [92933f4c] ProgressMeter v1.3.1
  [01f381cc] ProjectiveVectors v1.1.2
  [be4d8f0f] Quadmath v0.5.4
  [3cdcf5f2] RecipesBase v1.0.1
  [189a3867] Reexport v0.2.0
  [ae029012] Requires v1.0.1
  [276daf66] SpecialFunctions v0.10.3
  [90137ffa] StaticArrays v0.12.3
  [62e018b1] StaticPolynomials v1.3.3
  [3783bdb8] TableTraits v1.0.0
  [bd369af6] Tables v1.0.4
  [f269a46b] TimeZones v1.2.0
  [a2a6695c] TreeViews v0.3.0
  [3a884ed6] UnPack v1.0.1
  [02c8fc9c] XML2_jll v2.9.10+1
  [83775a58] Zlib_jll v1.2.11+14
  [2a0f44e3] Base64
  [ade2ca70] Dates
  [8ba89e20] Distributed
  [9fa8497b] Future
  [b77e0a4c] InteractiveUtils
  [76f85450] LibGit2
  [8f399da3] Libdl
  [37e2e46d] LinearAlgebra
  [56ddb016] Logging
  [d6f4376e] Markdown
  [a63ad114] Mmap
  [44cfe95a] Pkg
  [de0858da] Printf
  [3fa0cd96] REPL
  [9a3f8284] Random
  [ea8e919c] SHA
  [9e88b42a] Serialization
  [6462fe0b] Sockets
  [2f01184e] SparseArrays
  [10745b16] Statistics
  [8dfed614] Test
  [cf7118a7] UUIDs
  [4ec0a83e] Unicode
UniquePoints: Test Failed at /home/pkgeval/.julia/packages/HomotopyContinuation/mJDHb/test/utilities_test.jl:69
  Expression: string(data) == "UniquePoints{Array{Complex{Float64},1},Float64,typeof(euclidean_distance),Nothing} with 2000 points"
   Evaluated: "UniquePoints{Vector{ComplexF64},Float64,typeof(euclidean_distance),Nothing} with 2000 points" == "UniquePoints{Array{Complex{Float64},1},Float64,typeof(euclidean_distance),Nothing} with 2000 points"
Stacktrace:
 [1] top-level scope
   @ ~/.julia/packages/HomotopyContinuation/mJDHb/test/utilities_test.jl:69
 [2] top-level scope
   @ /buildworker/worker/package_linux64/build/usr/share/julia/stdlib/v1.6/Test/src/Test.jl:1115
 [3] top-level scope
   @ ~/.julia/packages/HomotopyContinuation/mJDHb/test/utilities_test.jl:63
 [4] top-level scope
   @ /buildworker/worker/package_linux64/build/usr/share/julia/stdlib/v1.6/Test/src/Test.jl:1115
 [5] top-level scope
   @ ~/.julia/packages/HomotopyContinuation/mJDHb/test/utilities_test.jl:3
┌ Warning: `setup!(tracker::CoreTracker, x, t, t₀; kwargs...)` is deprecated, use `init!(tracker, x, t, t₀; kwargs...)` instead.
│   caller = top-level scope at core_tracker_test.jl:40
└ @ Core ~/.julia/packages/HomotopyContinuation/mJDHb/test/core_tracker_test.jl:40
┌ Warning: Solutions are now automatically refined to maximal achievable accuracy.
└ @ HomotopyContinuation ~/.julia/packages/HomotopyContinuation/mJDHb/src/core_tracker.jl:1410
┌ Warning: `set_refinement_accuracy!` is deprecated. Solutions are now automatically refined to maximal achievable accuracy.
└ @ HomotopyContinuation ~/.julia/packages/HomotopyContinuation/mJDHb/src/core_tracker.jl:1420
┌ Warning: `max_refinement_iters` is deprecated. Solutions are now automatically refined to the maximal achievable accuracy.
└ @ HomotopyContinuation ~/.julia/packages/HomotopyContinuation/mJDHb/src/core_tracker.jl:1429
┌ Warning: `set_max_refinement_iters` is deprecated. Solutions are now automatically refined to the maximal achievable accuracy.
└ @ HomotopyContinuation ~/.julia/packages/HomotopyContinuation/mJDHb/src/core_tracker.jl:1439
Univariate singular: 2,3,4,5,6,7,8,9,10,11,12,
Wilkinson: 1,2,3,4,5,6,7,8,9,10,11,12,13,14,15,16,17,18,
Computing mixed cells... 1 	 Time: 0:00:00[K
  mixed_volume:  5[K[AComputing mixed cells... 12 	 Time: 0:00:00[K
  mixed_volume:  70
Computing mixed cells... 1 	 Time: 0:00:00[K
  mixed_volume:  4[K[AComputing mixed cells... 100 	 Time: 0:00:00[K
  mixed_volume:  588[K[AComputing mixed cells... 525 	 Time: 0:00:00[K
  mixed_volume:  3862[K[AComputing mixed cells... 865 	 Time: 0:00:01[K
  mixed_volume:  6234[K[AComputing mixed cells... 1315 	 Time: 0:00:01[K
  mixed_volume:  9551[K[AComputing mixed cells... 1664 	 Time: 0:00:01[K
  mixed_volume:  11510[K[AComputing mixed cells... 1881 	 Time: 0:00:01[K
  mixed_volume:  12636
Tracking 120 paths...  27%|██████████▋                             |  ETA: 0:00:01[K
  # paths tracked:                  32
  # non-singular solutions (real):  18 (3)
  # singular solutions (real):      0 (0)
  # total solutions (real):         18 (3)[A[A[A[A



[K[A[K[A[K[A[K[ATracking 120 paths... 100%|████████████████████████████████████████| Time: 0:00:00[K
  # paths tracked:                  120
  # non-singular solutions (real):  70 (10)
  # singular solutions (real):      0 (0)
  # total solutions (real):         70 (10)
Tracking 120 paths...  54%|█████████████████████▋                  |  ETA: 0:00:03[K
  # paths tracked:                  65
  # non-singular solutions (real):  36 (5)
  # singular solutions (real):      0 (0)
  # total solutions (real):         36 (5)[A[A[A[A



[K[A[K[A[K[A[K[ATracking 120 paths... 100%|████████████████████████████████████████| Time: 0:00:03[K
  # paths tracked:                  120
  # non-singular solutions (real):  70 (10)
  # singular solutions (real):      0 (0)
  # total solutions (real):         70 (10)
Tracking 216 paths...  30%|████████████                            |  ETA: 0:00:02[K
  # paths tracked:                  65
  # non-singular solutions (real):  24 (5)
  # singular solutions (real):      0 (0)
  # total solutions (real):         24 (5)[A[A[A[A



[K[A[K[A[K[A[K[ATracking 216 paths...  61%|████████████████████████▁               |  ETA: 0:00:01[K
  # paths tracked:                  131
  # non-singular solutions (real):  50 (7)
  # singular solutions (real):      0 (0)
  # total solutions (real):         50 (7)[A[A[A[A



[K[A[K[A[K[A[K[ATracking 216 paths...  91%|████████████████████████████████████▌   |  ETA: 0:00:00[K
  # paths tracked:                  197
  # non-singular solutions (real):  75 (8)
  # singular solutions (real):      0 (0)
  # total solutions (real):         75 (8)[A[A[A[A



[K[A[K[A[K[A[K[ATracking 216 paths... 100%|████████████████████████████████████████| Time: 0:00:01[K
  # paths tracked:                  216
  # non-singular solutions (real):  80 (8)
  # singular solutions (real):      0 (0)
  # total solutions (real):         80 (8)
Tracking 125 paths...   2%|▋                                       |  ETA: 0:00:32[K
  # paths tracked:                  2
  # non-singular solutions (real):  2 (2)
  # singular solutions (real):      0 (0)
  # total solutions (real):         2 (2)[A[A[A[A┌ Warning: None of the provided solutions is a valid start solution.
└ @ HomotopyContinuation ~/.julia/packages/HomotopyContinuation/mJDHb/src/monodromy.jl:878
Solutions found: 21 	 Time: 0:00:00[K
  # paths tracked:                   72
  # loops generated:                 2
  # completed loops without change:  0
  # solutions in current loop:       3
  # real solutions:                  2[K[A[K[A[K[A[K[A[K[ASolutions found: 21 	 Time: 0:00:00[K
[ Info: Compute additional witnesses for completeness...
[ Info: Found 2 additional witnesses
[ Info: Compute trace...
[ Info: Norm of trace: 1.8978320078226424e-14
Solutions found: 36 	 Time: 0:00:00[K
  # paths tracked:                   360
  # loops generated:                 5
  # completed loops without change:  0
  # solutions in current loop:       1
  # real solutions:                  0[K[A[K[A[K[A[K[A[K[ASolutions found: 36 	 Time: 0:00:00[K
  # paths tracked:                   686
  # loops generated:                 10
  # completed loops without change:  4
  # solutions in current loop:       0
  # real solutions:                  0[K[A[K[A[K[A[K[A[K[ASolutions found: 36 	 Time: 0:00:00[K
[ Info: Compute additional witnesses for completeness...
Solutions found: 23 	 Time: 0:00:00[K
  # paths tracked:                   171
  # loops generated:                 5
  # completed loops without change:  0
  # solutions in current loop:       22
  # real solutions:                  0[K[A[K[A[K[A[K[A[K[ASolutions found: 30 	 Time: 0:00:00[K
  # paths tracked:                   870
  # loops generated:                 10
  # completed loops without change:  0
  # solutions in current loop:       1
  # real solutions:                  0[K[A[K[A[K[A[K[A[K[ASolutions found: 36 	 Time: 0:00:00[K
  # paths tracked:                   2314
  # loops generated:                 22
  # completed loops without change:  1
  # solutions in current loop:       0
  # real solutions:                  0[K[A[K[A[K[A[K[A[K[ASolutions found: 36 	 Time: 0:00:00[K
[ Info: Found 36 additional witnesses
[ Info: Compute trace...
[ Info: Norm of trace: 5.62488072179686e-9
Solutions found: 2 	 Time: 0:00:00[K
  # paths tracked:                   2
  # loops generated:                 1
  # completed loops without change:  0
  # solutions in current loop:       1
  # real solutions:                  0[K[A[K[A[K[A[K[A[K[ASolutions found: 6 	 Time: 0:00:00[K
  # paths tracked:                   10
  # loops generated:                 1
  # completed loops without change:  0
  # solutions in current loop:       5
  # real solutions:                  0[K[A[K[A[K[A[K[A[K[ASolutions found: 9 	 Time: 0:00:00[K
  # paths tracked:                   16
  # loops generated:                 1
  # completed loops without change:  0
  # solutions in current loop:       8
  # real solutions:                  0[K[A[K[A[K[A[K[A[K[ASolutions found: 13 	 Time: 0:00:01[K
  # paths tracked:                   24
  # loops generated:                 1
  # completed loops without change:  0
  # solutions in current loop:       12
  # real solutions:                  0[K[A[K[A[K[A[K[A[K[ASolutions found: 16 	 Time: 0:00:01[K
  # paths tracked:                   30
  # loops generated:                 1
  # completed loops without change:  0
  # solutions in current loop:       15
  # real solutions:                  0[K[A[K[A[K[A[K[A[K[ASolutions found: 20 	 Time: 0:00:01[K
  # paths tracked:                   38
  # loops generated:                 1
  # completed loops without change:  0
  # solutions in current loop:       19
  # real solutions:                  0[K[A[K[A[K[A[K[A[K[ASolutions found: 23 	 Time: 0:00:01[K
  # paths tracked:                   44
  # loops generated:                 1
  # completed loops without change:  0
  # solutions in current loop:       22
  # real solutions:                  0[K[A[K[A[K[A[K[A[K[ASolutions found: 27 	 Time: 0:00:01[K
  # paths tracked:                   52
  # loops generated:                 1
  # completed loops without change:  0
  # solutions in current loop:       26
  # real solutions:                  0[K[A[K[A[K[A[K[A[K[ASolutions found: 30 	 Time: 0:00:01[K
  # paths tracked:                   58
  # loops generated:                 1
  # completed loops without change:  0
  # solutions in current loop:       29
  # real solutions:                  0[K[A[K[A[K[A[K[A[K[ASolutions found: 34 	 Time: 0:00:01[K
  # paths tracked:                   66
  # loops generated:                 1
  # completed loops without change:  0
  # solutions in current loop:       33
  # real solutions:                  0[K[A[K[A[K[A[K[A[K[ASolutions found: 37 	 Time: 0:00:01[K
  # paths tracked:                   72
  # loops generated:                 1
  # completed loops without change:  0
  # solutions in current loop:       36
  # real solutions:                  0[K[A[K[A[K[A[K[A[K[ASolutions found: 43 	 Time: 0:00:02[K
  # paths tracked:                   84
  # loops generated:                 1
  # completed loops without change:  0
  # solutions in current loop:       42
  # real solutions:                  0[K[A[K[A[K[A[K[A[K[ASolutions found: 47 	 Time: 0:00:02[K
  # paths tracked:                   92
  # loops generated:                 1
  # completed loops without change:  0
  # solutions in current loop:       46
  # real solutions:                  0[K[A[K[A[K[A[K[A[K[ASolutions found: 50 	 Time: 0:00:02[K
Solutions found: 2 	 Time: 0:00:00[K
  # paths tracked:                   2
  # loops generated:                 1
  # completed loops without change:  0
  # solutions in current loop:       1
  # real solutions:                  0[K[A[K[A[K[A[K[A[K[ASolutions found: 2 	 Time: 0:00:00[K
Solutions found: 2 	 Time: 0:00:00[K
  # paths tracked:                   2
  # loops generated:                 1
  # completed loops without change:  0
  # solutions in current loop:       1
  # real solutions:                  0[K[A[K[A[K[A[K[A[K[ASolutions found: 7 	 Time: 0:00:00[K
  # paths tracked:                   12
  # loops generated:                 1
  # completed loops without change:  0
  # solutions in current loop:       6
  # real solutions:                  0[K[A[K[A[K[A[K[A[K[ASolutions found: 11 	 Time: 0:00:00[K
  # paths tracked:                   20
  # loops generated:                 1
  # completed loops without change:  0
  # solutions in current loop:       10
  # real solutions:                  0[K[A[K[A[K[A[K[A[K[ASolutions found: 18 	 Time: 0:00:01[K
  # paths tracked:                   34
  # loops generated:                 1
  # completed loops without change:  0
  # solutions in current loop:       17
  # real solutions:                  0[K[A[K[A[K[A[K[A[K[ASolutions found: 28 	 Time: 0:00:01[K
  # paths tracked:                   54
  # loops generated:                 1
  # completed loops without change:  0
  # solutions in current loop:       27
  # real solutions:                  0[K[A[K[A[K[A[K[A[K[ASolutions found: 33 	 Time: 0:00:01[K
  # paths tracked:                   64
  # loops generated:                 1
  # completed loops without change:  0
  # solutions in current loop:       32
  # real solutions:                  0[K[A[K[A[K[A[K[A[K[ASolutions found: 38 	 Time: 0:00:01[K
  # paths tracked:                   74
  # loops generated:                 1
  # completed loops without change:  0
  # solutions in current loop:       37
  # real solutions:                  0[K[A[K[A[K[A[K[A[K[ASolutions found: 42 	 Time: 0:00:01[K
  # paths tracked:                   82
  # loops generated:                 1
  # completed loops without change:  0
  # solutions in current loop:       41
  # real solutions:                  0[K[A[K[A[K[A[K[A[K[ASolutions found: 47 	 Time: 0:00:01[K
  # paths tracked:                   92
  # loops generated:                 1
  # completed loops without change:  0
  # solutions in current loop:       46
  # real solutions:                  0[K[A[K[A[K[A[K[A[K[ASolutions found: 51 	 Time: 0:00:01[K
  # paths tracked:                   100
  # loops generated:                 1
  # completed loops without change:  0
  # solutions in current loop:       50
  # real solutions:                  0[K[A[K[A[K[A[K[A[K[ASolutions found: 55 	 Time: 0:00:01[K
  # paths tracked:                   108
  # loops generated:                 1
  # completed loops without change:  0
  # solutions in current loop:       54
  # real solutions:                  0[K[A[K[A[K[A[K[A[K[ASolutions found: 59 	 Time: 0:00:02[K
  # paths tracked:                   116
  # loops generated:                 1
  # completed loops without change:  0
  # solutions in current loop:       58
  # real solutions:                  0[K[A[K[A[K[A[K[A[K[ASolutions found: 64 	 Time: 0:00:02[K
  # paths tracked:                   126
  # loops generated:                 1
  # completed loops without change:  0
  # solutions in current loop:       63
  # real solutions:                  0[K[A[K[A[K[A[K[A[K[ASolutions found: 69 	 Time: 0:00:02[K
  # paths tracked:                   136
  # loops generated:                 1
  # completed loops without change:  0
  # solutions in current loop:       68
  # real solutions:                  0[K[A[K[A[K[A[K[A[K[ASolutions found: 73 	 Time: 0:00:02[K
  # paths tracked:                   144
  # loops generated:                 1
  # completed loops without change:  0
  # solutions in current loop:       72
  # real solutions:                  0[K[A[K[A[K[A[K[A[K[ASolutions found: 77 	 Time: 0:00:02[K
  # paths tracked:                   152
  # loops generated:                 1
  # completed loops without change:  0
  # solutions in current loop:       76
  # real solutions:                  0[K[A[K[A[K[A[K[A[K[ASolutions found: 82 	 Time: 0:00:02[K
  # paths tracked:                   162
  # loops generated:                 1
  # completed loops without change:  0
  # solutions in current loop:       81
  # real solutions:                  0[K[A[K[A[K[A[K[A[K[ASolutions found: 86 	 Time: 0:00:02[K
  # paths tracked:                   170
  # loops generated:                 1
  # completed loops without change:  0
  # solutions in current loop:       85
  # real solutions:                  0[K[A[K[A[K[A[K[A[K[ASolutions found: 90 	 Time: 0:00:03[K
  # paths tracked:                   178
  # loops generated:                 1
  # completed loops without change:  0
  # solutions in current loop:       89
  # real solutions:                  0[K[A[K[A[K[A[K[A[K[ASolutions found: 94 	 Time: 0:00:03[K
  # paths tracked:                   186
  # loops generated:                 1
  # completed loops without change:  0
  # solutions in current loop:       93
  # real solutions:                  0[K[A[K[A[K[A[K[A[K[ASolutions found: 100 	 Time: 0:00:03[K
  # paths tracked:                   198
  # loops generated:                 1
  # completed loops without change:  0
  # solutions in current loop:       99
  # real solutions:                  0[K[A[K[A[K[A[K[A[K[ASolutions found: 105 	 Time: 0:00:03[K
  # paths tracked:                   208
  # loops generated:                 1
  # completed loops without change:  0
  # solutions in current loop:       104
  # real solutions:                  0[K[A[K[A[K[A[K[A[K[ASolutions found: 109 	 Time: 0:00:03[K
  # paths tracked:                   216
  # loops generated:                 1
  # completed loops without change:  0
  # solutions in current loop:       108
  # real solutions:                  0[K[A[K[A[K[A[K[A[K[ASolutions found: 114 	 Time: 0:00:03[K
  # paths tracked:                   226
  # loops generated:                 1
  # completed loops without change:  0
  # solutions in current loop:       113
  # real solutions:                  0[K[A[K[A[K[A[K[A[K[ASolutions found: 118 	 Time: 0:00:03[K
  # paths tracked:                   234
  # loops generated:                 1
  # completed loops without change:  0
  # solutions in current loop:       117
  # real solutions:                  0[K[A[K[A[K[A[K[A[K[ASolutions found: 124 	 Time: 0:00:03[K
  # paths tracked:                   246
  # loops generated:                 1
  # completed loops without change:  0
  # solutions in current loop:       123
  # real solutions:                  0[K[A[K[A[K[A[K[A[K[ASolutions found: 143 	 Time: 0:00:04[K
  # paths tracked:                   284
  # loops generated:                 1
  # completed loops without change:  0
  # solutions in current loop:       142
  # real solutions:                  0[K[A[K[A[K[A[K[A[K[ASolutions found: 163 	 Time: 0:00:04[K
  # paths tracked:                   324
  # loops generated:                 1
  # completed loops without change:  0
  # solutions in current loop:       162
  # real solutions:                  0[K[A[K[A[K[A[K[A[K[ASolutions found: 180 	 Time: 0:00:04[K
  # paths tracked:                   358
  # loops generated:                 1
  # completed loops without change:  0
  # solutions in current loop:       179
  # real solutions:                  0[K[A[K[A[K[A[K[A[K[ASolutions found: 196 	 Time: 0:00:04[K
  # paths tracked:                   390
  # loops generated:                 1
  # completed loops without change:  0
  # solutions in current loop:       195
  # real solutions:                  0[K[A[K[A[K[A[K[A[K[ASolutions found: 212 	 Time: 0:00:04[K
  # paths tracked:                   422
  # loops generated:                 1
  # completed loops without change:  0
  # solutions in current loop:       211
  # real solutions:                  0[K[A[K[A[K[A[K[A[K[ASolutions found: 233 	 Time: 0:00:04[K
  # paths tracked:                   464
  # loops generated:                 1
  # completed loops without change:  0
  # solutions in current loop:       232
  # real solutions:                  0[K[A[K[A[K[A[K[A[K[ASolutions found: 249 	 Time: 0:00:04[K
  # paths tracked:                   496
  # loops generated:                 1
  # completed loops without change:  0
  # solutions in current loop:       248
  # real solutions:                  0[K[A[K[A[K[A[K[A[K[ASolutions found: 253 	 Time: 0:00:04[K
  # paths tracked:                   504
  # loops generated:                 1
  # completed loops without change:  0
  # solutions in current loop:       252
  # real solutions:                  0[K[A[K[A[K[A[K[A[K[ASolutions found: 273 	 Time: 0:00:04[K
  # paths tracked:                   544
  # loops generated:                 1
  # completed loops without change:  0
  # solutions in current loop:       272
  # real solutions:                  0[K[A[K[A[K[A[K[A[K[ASolutions found: 287 	 Time: 0:00:05[K
  # paths tracked:                   572
  # loops generated:                 1
  # completed loops without change:  0
  # solutions in current loop:       286
  # real solutions:                  0[K[A[K[A[K[A[K[A[K[ASolutions found: 294 	 Time: 0:00:05[K
  # paths tracked:                   586
  # loops generated:                 1
  # completed loops without change:  0
  # solutions in current loop:       293
  # real solutions:                  0[K[A[K[A[K[A[K[A[K[ASolutions found: 299 	 Time: 0:00:05[K
  # paths tracked:                   596
  # loops generated:                 1
  # completed loops without change:  0
  # solutions in current loop:       298
  # real solutions:                  0[K[A[K[A[K[A[K[A[K[ASolutions found: 304 	 Time: 0:00:05[K
  # paths tracked:                   606
  # loops generated:                 1
  # completed loops without change:  0
  # solutions in current loop:       303
  # real solutions:                  0[K[A[K[A[K[A[K[A[K[ASolutions found: 311 	 Time: 0:00:05[K
  # paths tracked:                   620
  # loops generated:                 1
  # completed loops without change:  0
  # solutions in current loop:       310
  # real solutions:                  0[K[A[K[A[K[A[K[A[K[ASolutions found: 317 	 Time: 0:00:05[K
  # paths tracked:                   632
  # loops generated:                 1
  # completed loops without change:  0
  # solutions in current loop:       316
  # real solutions:                  0[K[A[K[A[K[A[K[A[K[ASolutions found: 324 	 Time: 0:00:05[K
  # paths tracked:                   646
  # loops generated:                 1
  # completed loops without change:  0
  # solutions in current loop:       323
  # real solutions:                  0[K[A[K[A[K[A[K[A[K[ASolutions found: 329 	 Time: 0:00:05[K
  # paths tracked:                   656
  # loops generated:                 1
  # completed loops without change:  0
  # solutions in current loop:       328
  # real solutions:                  0[K[A[K[A[K[A[K[A[K[ASolutions found: 341 	 Time: 0:00:06[K
  # paths tracked:                   680
  # loops generated:                 1
  # completed loops without change:  0
  # solutions in current loop:       340
  # real solutions:                  0[K[A[K[A[K[A[K[A[K[ASolutions found: 355 	 Time: 0:00:06[K
  # paths tracked:                   708
  # loops generated:                 1
  # completed loops without change:  0
  # solutions in current loop:       354
  # real solutions:                  0[K[A[K[A[K[A[K[A[K[ASolutions found: 371 	 Time: 0:00:06[K
  # paths tracked:                   740
  # loops generated:                 1
  # completed loops without change:  0
  # solutions in current loop:       370
  # real solutions:                  0[K[A[K[A[K[A[K[A[K[ASolutions found: 384 	 Time: 0:00:06[K
  # paths tracked:                   766
  # loops generated:                 1
  # completed loops without change:  0
  # solutions in current loop:       383
  # real solutions:                  0[K[A[K[A[K[A[K[A[K[ASolutions found: 408 	 Time: 0:00:06[K
  # paths tracked:                   814
  # loops generated:                 1
  # completed loops without change:  0
  # solutions in current loop:       407
  # real solutions:                  0[K[A[K[A[K[A[K[A[K[ASolutions found: 430 	 Time: 0:00:06[K
  # paths tracked:                   858
  # loops generated:                 1
  # completed loops without change:  0
  # solutions in current loop:       429
  # real solutions:                  0[K[A[K[A[K[A[K[A[K[ASolutions found: 439 	 Time: 0:00:06[K
  # paths tracked:                   876
  # loops generated:                 1
  # completed loops without change:  0
  # solutions in current loop:       438
  # real solutions:                  0[K[A[K[A[K[A[K[A[K[ASolutions found: 452 	 Time: 0:00:06[K
  # paths tracked:                   902
  # loops generated:                 1
  # completed loops without change:  0
  # solutions in current loop:       451
  # real solutions:                  0[K[A[K[A[K[A[K[A[K[ASolutions found: 468 	 Time: 0:00:06[K
  # paths tracked:                   934
  # loops generated:                 1
  # completed loops without change:  0
  # solutions in current loop:       467
  # real solutions:                  0[K[A[K[A[K[A[K[A[K[ASolutions found: 487 	 Time: 0:00:07[K
  # paths tracked:                   972
  # loops generated:                 1
  # completed loops without change:  0
  # solutions in current loop:       486
  # real solutions:                  0[K[A[K[A[K[A[K[A[K[ASolutions found: 496 	 Time: 0:00:07[K
  # paths tracked:                   990
  # loops generated:                 1
  # completed loops without change:  0
  # solutions in current loop:       495
  # real solutions:                  0[K[A[K[A[K[A[K[A[K[ASolutions found: 502 	 Time: 0:00:07[K
  # paths tracked:                   1031
  # loops generated:                 2
  # completed loops without change:  0
  # solutions in current loop:       6
  # real solutions:                  0[K[A[K[A[K[A[K[A[K[ASolutions found: 507 	 Time: 0:00:07[K
  # paths tracked:                   1067
  # loops generated:                 2
  # completed loops without change:  0
  # solutions in current loop:       11
  # real solutions:                  0[K[A[K[A[K[A[K[A[K[ASolutions found: 517 	 Time: 0:00:07[K
  # paths tracked:                   1110
  # loops generated:                 2
  # completed loops without change:  0
  # solutions in current loop:       21
  # real solutions:                  0[K[A[K[A[K[A[K[A[K[ASolutions found: 522 	 Time: 0:00:07[K
  # paths tracked:                   1145
  # loops generated:                 2
  # completed loops without change:  0
  # solutions in current loop:       26
  # real solutions:                  0[K[A[K[A[K[A[K[A[K[ASolutions found: 529 	 Time: 0:00:07[K
  # paths tracked:                   1177
  # loops generated:                 2
  # completed loops without change:  0
  # solutions in current loop:       33
  # real solutions:                  0[K[A[K[A[K[A[K[A[K[ASolutions found: 531 	 Time: 0:00:07[K
  # paths tracked:                   1203
  # loops generated:                 2
  # completed loops without change:  0
  # solutions in current loop:       35
  # real solutions:                  0[K[A[K[A[K[A[K[A[K[ASolutions found: 540 	 Time: 0:00:07[K
  # paths tracked:                   1245
  # loops generated:                 2
  # completed loops without change:  0
  # solutions in current loop:       44
  # real solutions:                  0[K[A[K[A[K[A[K[A[K[ASolutions found: 548 	 Time: 0:00:08[K
  # paths tracked:                   1274
  # loops generated:                 2
  # completed loops without change:  0
  # solutions in current loop:       52
  # real solutions:                  0[K[A[K[A[K[A[K[A[K[ASolutions found: 552 	 Time: 0:00:08[K
  # paths tracked:                   1303
  # loops generated:                 2
  # completed loops without change:  0
  # solutions in current loop:       56
  # real solutions:                  0[K[A[K[A[K[A[K[A[K[ASolutions found: 556 	 Time: 0:00:08[K
  # paths tracked:                   1337
  # loops generated:                 2
  # completed loops without change:  0
  # solutions in current loop:       60
  # real solutions:                  0[K[A[K[A[K[A[K[A[K[ASolutions found: 561 	 Time: 0:00:08[K
  # paths tracked:                   1375
  # loops generated:                 2
  # completed loops without change:  0
  # solutions in current loop:       65
  # real solutions:                  0[K[A[K[A[K[A[K[A[K[ASolutions found: 566 	 Time: 0:00:08[K
  # paths tracked:                   1405
  # loops generated:                 2
  # completed loops without change:  0
  # solutions in current loop:       70
  # real solutions:                  0[K[A[K[A[K[A[K[A[K[ASolutions found: 572 	 Time: 0:00:08[K
  # paths tracked:                   1435
  # loops generated:                 2
  # completed loops without change:  0
  # solutions in current loop:       76
  # real solutions:                  0[K[A[K[A[K[A[K[A[K[ASolutions found: 573 	 Time: 0:00:08[K
  # paths tracked:                   1469
  # loops generated:                 2
  # completed loops without change:  0
  # solutions in current loop:       77
  # real solutions:                  0[K[A[K[A[K[A[K[A[K[ASolutions found: 581 	 Time: 0:00:08[K
  # paths tracked:                   1510
  # loops generated:                 2
  # completed loops without change:  0
  # solutions in current loop:       85
  # real solutions:                  0[K[A[K[A[K[A[K[A[K[ASolutions found: 589 	 Time: 0:00:08[K
  # paths tracked:                   1543
  # loops generated:                 2
  # completed loops without change:  0
  # solutions in current loop:       93
  # real solutions:                  0[K[A[K[A[K[A[K[A[K[ASolutions found: 591 	 Time: 0:00:09[K
  # paths tracked:                   1571
  # loops generated:                 2
  # completed loops without change:  0
  # solutions in current loop:       95
  # real solutions:                  0[K[A[K[A[K[A[K[A[K[ASolutions found: 599 	 Time: 0:00:09[K
  # paths tracked:                   1610
  # loops generated:                 2
  # completed loops without change:  0
  # solutions in current loop:       103
  # real solutions:                  0[K[A[K[A[K[A[K[A[K[ASolutions found: 605 	 Time: 0:00:09[K
  # paths tracked:                   1647
  # loops generated:                 2
  # completed loops without change:  0
  # solutions in current loop:       109
  # real solutions:                  0[K[A[K[A[K[A[K[A[K[ASolutions found: 613 	 Time: 0:00:09[K
  # paths tracked:                   1689
  # loops generated:                 2
  # completed loops without change:  0
  # solutions in current loop:       117
  # real solutions:                  0[K[A[K[A[K[A[K[A[K[ASolutions found: 616 	 Time: 0:00:09[K
  # paths tracked:                   1735
  # loops generated:                 2
  # completed loops without change:  0
  # solutions in current loop:       120
  # real solutions:                  0[K[A[K[A[K[A[K[A[K[ASolutions found: 625 	 Time: 0:00:09[K
  # paths tracked:                   1791
  # loops generated:                 2
  # completed loops without change:  0
  # solutions in current loop:       129
  # real solutions:                  0[K[A[K[A[K[A[K[A[K[ASolutions found: 635 	 Time: 0:00:09[K
  # paths tracked:                   1845
  # loops generated:                 2
  # completed loops without change:  0
  # solutions in current loop:       139
  # real solutions:                  0[K[A[K[A[K[A[K[A[K[ASolutions found: 641 	 Time: 0:00:09[K
  # paths tracked:                   1895
  # loops generated:                 2
  # completed loops without change:  0
  # solutions in current loop:       145
  # real solutions:                  0[K[A[K[A[K[A[K[A[K[ASolutions found: 644 	 Time: 0:00:09[K
  # paths tracked:                   1927
  # loops generated:                 2
  # completed loops without change:  0
  # solutions in current loop:       148
  # real solutions:                  0[K[A[K[A[K[A[K[A[K[ASolutions found: 648 	 Time: 0:00:10[K
  # paths tracked:                   1963
  # loops generated:                 2
  # completed loops without change:  0
  # solutions in current loop:       152
  # real solutions:                  0[K[A[K[A[K[A[K[A[K[ASolutions found: 653 	 Time: 0:00:10[K
  # paths tracked:                   1993
  # loops generated:                 2
  # completed loops without change:  0
  # solutions in current loop:       157
  # real solutions:                  0[K[A[K[A[K[A[K[A[K[ASolutions found: 655 	 Time: 0:00:10[K
  # paths tracked:                   2040
  # loops generated:                 2
  # completed loops without change:  0
  # solutions in current loop:       159
  # real solutions:                  0[K[A[K[A[K[A[K[A[K[ASolutions found: 663 	 Time: 0:00:10[K
  # paths tracked:                   2081
  # loops generated:                 2
  # completed loops without change:  0
  # solutions in current loop:       167
  # real solutions:                  0[K[A[K[A[K[A[K[A[K[ASolutions found: 670 	 Time: 0:00:10[K
  # paths tracked:                   2140
  # loops generated:                 2
  # completed loops without change:  0
  # solutions in current loop:       174
  # real solutions:                  0[K[A[K[A[K[A[K[A[K[ASolutions found: 677 	 Time: 0:00:10[K
  # paths tracked:                   2208
  # loops generated:                 2
  # completed loops without change:  0
  # solutions in current loop:       181
  # real solutions:                  0[K[A[K[A[K[A[K[A[K[ASolutions found: 681 	 Time: 0:00:10[K
  # paths tracked:                   2275
  # loops generated:                 2
  # completed loops without change:  0
  # solutions in current loop:       185
  # real solutions:                  0[K[A[K[A[K[A[K[A[K[ASolutions found: 689 	 Time: 0:00:10[K
  # paths tracked:                   2337
  # loops generated:                 2
  # completed loops without change:  0
  # solutions in current loop:       193
  # real solutions:                  0[K[A[K[A[K[A[K[A[K[ASolutions found: 695 	 Time: 0:00:10[K
  # paths tracked:                   2403
  # loops generated:                 2
  # completed loops without change:  0
  # solutions in current loop:       199
  # real solutions:                  0[K[A[K[A[K[A[K[A[K[ASolutions found: 699 	 Time: 0:00:11[K
  # paths tracked:                   2470
  # loops generated:                 2
  # completed loops without change:  0
  # solutions in current loop:       203
  # real solutions:                  0[K[A[K[A[K[A[K[A[K[ASolutions found: 706 	 Time: 0:00:11[K
  # paths tracked:                   2523
  # loops generated:                 2
  # completed loops without change:  0
  # solutions in current loop:       210
  # real solutions:                  0[K[A[K[A[K[A[K[A[K[ASolutions found: 708 	 Time: 0:00:11[K
  # paths tracked:                   2594
  # loops generated:                 2
  # completed loops without change:  0
  # solutions in current loop:       212
  # real solutions:                  0[K[A[K[A[K[A[K[A[K[ASolutions found: 710 	 Time: 0:00:11[K
  # paths tracked:                   2651
  # loops generated:                 2
  # completed loops without change:  0
  # solutions in current loop:       214
  # real solutions:                  0[K[A[K[A[K[A[K[A[K[ASolutions found: 712 	 Time: 0:00:11[K
  # paths tracked:                   2707
  # loops generated:                 2
  # completed loops without change:  0
  # solutions in current loop:       216
  # real solutions:                  0[K[A[K[A[K[A[K[A[K[ASolutions found: 718 	 Time: 0:00:11[K
  # paths tracked:                   2780
  # loops generated:                 2
  # completed loops without change:  0
  # solutions in current loop:       222
  # real solutions:                  0[K[A[K[A[K[A[K[A[K[ASolutions found: 718 	 Time: 0:00:11[K
  # paths tracked:                   2839
  # loops generated:                 2
  # completed loops without change:  0
  # solutions in current loop:       222
  # real solutions:                  0[K[A[K[A[K[A[K[A[K[ASolutions found: 719 	 Time: 0:00:11[K
  # paths tracked:                   2921
  # loops generated:                 3
  # completed loops without change:  0
  # solutions in current loop:       0
  # real solutions:                  0[K[A[K[A[K[A[K[A[K[ASolutions found: 719 	 Time: 0:00:12[K
  # paths tracked:                   3096
  # loops generated:                 3
  # completed loops without change:  0
  # solutions in current loop:       0
  # real solutions:                  0[K[A[K[A[K[A[K[A[K[ASolutions found: 719 	 Time: 0:00:12[K
  # paths tracked:                   3259
  # loops generated:                 3
  # completed loops without change:  0
  # solutions in current loop:       0
  # real solutions:                  0[K[A[K[A[K[A[K[A[K[ASolutions found: 719 	 Time: 0:00:12[K
  # paths tracked:                   3421
  # loops generated:                 3
  # completed loops without change:  0
  # solutions in current loop:       0
  # real solutions:                  0[K[A[K[A[K[A[K[A[K[ASolutions found: 719 	 Time: 0:00:12[K
  # paths tracked:                   3591
  # loops generated:                 3
  # completed loops without change:  0
  # solutions in current loop:       0
  # real solutions:                  0[K[A[K[A[K[A[K[A[K[ASolutions found: 719 	 Time: 0:00:12[K
  # paths tracked:                   3735
  # loops generated:                 3
  # completed loops without change:  0
  # solutions in current loop:       0
  # real solutions:                  0[K[A[K[A[K[A[K[A[K[ASolutions found: 719 	 Time: 0:00:12[K
  # paths tracked:                   3846
  # loops generated:                 3
  # completed loops without change:  0
  # solutions in current loop:       0
  # real solutions:                  0[K[A[K[A[K[A[K[A[K[ASolutions found: 719 	 Time: 0:00:12[K
  # paths tracked:                   4007
  # loops generated:                 3
  # completed loops without change:  0
  # solutions in current loop:       0
  # real solutions:                  0[K[A[K[A[K[A[K[A[K[ASolutions found: 719 	 Time: 0:00:12[K
  # paths tracked:                   4124
  # loops generated:                 3
  # completed loops without change:  0
  # solutions in current loop:       0
  # real solutions:                  0[K[A[K[A[K[A[K[A[K[ASolutions found: 719 	 Time: 0:00:12[K
  # paths tracked:                   4210
  # loops generated:                 3
  # completed loops without change:  0
  # solutions in current loop:       0
  # real solutions:                  0[K[A[K[A[K[A[K[A[K[ASolutions found: 719 	 Time: 0:00:12[K
  # paths tracked:                   4322
  # loops generated:                 4
  # completed loops without change:  1
  # solutions in current loop:       0
  # real solutions:                  0[K[A[K[A[K[A[K[A[K[ASolutions found: 719 	 Time: 0:00:13[K
  # paths tracked:                   4396
  # loops generated:                 4
  # completed loops without change:  1
  # solutions in current loop:       0
  # real solutions:                  0[K[A[K[A[K[A[K[A[K[ASolutions found: 719 	 Time: 0:00:13[K
  # paths tracked:                   4475
  # loops generated:                 4
  # completed loops without change:  1
  # solutions in current loop:       0
  # real solutions:                  0[K[A[K[A[K[A[K[A[K[ASolutions found: 719 	 Time: 0:00:13[K
  # paths tracked:                   4544
  # loops generated:                 4
  # completed loops without change:  1
  # solutions in current loop:       0
  # real solutions:                  0[K[A[K[A[K[A[K[A[K[ASolutions found: 719 	 Time: 0:00:13[K
  # paths tracked:                   4658
  # loops generated:                 4
  # completed loops without change:  1
  # solutions in current loop:       0
  # real solutions:                  0[K[A[K[A[K[A[K[A[K[ASolutions found: 719 	 Time: 0:00:13[K
  # paths tracked:                   4740
  # loops generated:                 4
  # completed loops without change:  1
  # solutions in current loop:       0
  # real solutions:                  0[K[A[K[A[K[A[K[A[K[ASolutions found: 719 	 Time: 0:00:13[K
  # paths tracked:                   4820
  # loops generated:                 4
  # completed loops without change:  1
  # solutions in current loop:       0
  # real solutions:                  0[K[A[K[A[K[A[K[A[K[ASolutions found: 719 	 Time: 0:00:13[K
  # paths tracked:                   4946
  # loops generated:                 4
  # completed loops without change:  1
  # solutions in current loop:       0
  # real solutions:                  0[K[A[K[A[K[A[K[A[K[ASolutions found: 719 	 Time: 0:00:14[K
  # paths tracked:                   5050
  # loops generated:                 4
  # completed loops without change:  1
  # solutions in current loop:       0
  # real solutions:                  0[K[A[K[A[K[A[K[A[K[ASolutions found: 719 	 Time: 0:00:14[K
  # paths tracked:                   5150
  # loops generated:                 4
  # completed loops without change:  1
  # solutions in current loop:       0
  # real solutions:                  0[K[A[K[A[K[A[K[A[K[ASolutions found: 719 	 Time: 0:00:14[K
  # paths tracked:                   5204
  # loops generated:                 4
  # completed loops without change:  1
  # solutions in current loop:       0
  # real solutions:                  0[K[A[K[A[K[A[K[A[K[ASolutions found: 719 	 Time: 0:00:14[K
  # paths tracked:                   5297
  # loops generated:                 4
  # completed loops without change:  1
  # solutions in current loop:       0
  # real solutions:                  0[K[A[K[A[K[A[K[A[K[ASolutions found: 720 	 Time: 0:00:14[K
[ Info: SetupBuildDirectory: setting up build directory.
[ Info: Doctest: running doctests.
┌ Error: doctest failure in ~/.julia/packages/HomotopyContinuation/mJDHb/src/model_kit/expression.jl:742-756
│ 
│ ```jldoctest
│ julia> @var x y t;
│ 
│ julia> H = Homotopy([x + t, y + 2t], [y, x], t);
│ 
│ julia> H([2, 3], 0)
│ 2-element Array{Int64,1}:
│  3
│  2
│ 
│ julia> H([2, 3], 1)
│ 2-element Array{Int64,1}:
│  4
│  4
│ ```
│ 
│ Subexpression:
│ 
│ H([2, 3], 0)
│ 
│ Evaluated output:
│ 
│ 2-element Vector{Int64}:
│  3
│  2
│ 
│ Expected output:
│ 
│ 2-element Array{Int64,1}:
│  3
│  2
│ 
│   diff =
│    Warning: Diff output requires color.
│    2-element Array{Int64,1}:
│     Vector{Int64}:
│     3
│     2
└ @ Documenter.DocTests ~/.julia/packages/Documenter/PLD7m/src/DocTests.jl:369
┌ Error: doctest failure in ~/.julia/packages/HomotopyContinuation/mJDHb/src/model_kit/expression.jl:742-756
│ 
│ ```jldoctest
│ julia> @var x y t;
│ 
│ julia> H = Homotopy([x + t, y + 2t], [y, x], t);
│ 
│ julia> H([2, 3], 0)
│ 2-element Array{Int64,1}:
│  3
│  2
│ 
│ julia> H([2, 3], 1)
│ 2-element Array{Int64,1}:
│  4
│  4
│ ```
│ 
│ Subexpression:
│ 
│ H([2, 3], 1)
│ 
│ Evaluated output:
│ 
│ 2-element Vector{Int64}:
│  4
│  4
│ 
│ Expected output:
│ 
│ 2-element Array{Int64,1}:
│  4
│  4
│ 
│   diff =
│    Warning: Diff output requires color.
│    2-element Array{Int64,1}:
│     Vector{Int64}:
│     4
│     4
└ @ Documenter.DocTests ~/.julia/packages/Documenter/PLD7m/src/DocTests.jl:369
┌ Error: doctest failure in ~/.julia/packages/HomotopyContinuation/mJDHb/src/model_kit/expression.jl:759-768
│ 
│ ```jldoctest
│ julia> @var x y t a b;
│ 
│ julia> H = Homotopy([x^2 + t*a, y^2 + t*b], [x, y], t, [a, b]);
│ 
│ julia> H([2, 3], 1, [5, 2])
│ 2-element Array{Int64,1}:
│   9
│  11
│ ```
│ 
│ Subexpression:
│ 
│ H([2, 3], 1, [5, 2])
│ 
│ Evaluated output:
│ 
│ 2-element Vector{Int64}:
│   9
│  11
│ 
│ Expected output:
│ 
│ 2-element Array{Int64,1}:
│   9
│  11
│ 
│   diff =
│    Warning: Diff output requires color.
│    2-element Array{Int64,1}:
│      Vector{Int64}:
│      9
│     11
└ @ Documenter.DocTests ~/.julia/packages/Documenter/PLD7m/src/DocTests.jl:369
┌ Error: doctest failure in ~/.julia/packages/HomotopyContinuation/mJDHb/src/model_kit/expression.jl:634-643
│ 
│ ```jldoctest
│ julia> @var x y;
│ 
│ julia> F = System([x^2, y^2], [y, x]);
│ 
│ julia> F([2, 3])
│ 2-element Array{Int64,1}:
│  9
│  4
│ ```
│ 
│ Subexpression:
│ 
│ F([2, 3])
│ 
│ Evaluated output:
│ 
│ 2-element Vector{Int64}:
│  9
│  4
│ 
│ Expected output:
│ 
│ 2-element Array{Int64,1}:
│  9
│  4
│ 
│   diff =
│    Warning: Diff output requires color.
│    2-element Array{Int64,1}:
│     Vector{Int64}:
│     9
│     4
└ @ Documenter.DocTests ~/.julia/packages/Documenter/PLD7m/src/DocTests.jl:369
┌ Error: doctest failure in ~/.julia/packages/HomotopyContinuation/mJDHb/src/model_kit/expression.jl:646-655
│ 
│ ```jldoctest
│ julia> @var x y t a b;
│ 
│ julia> F = System([x^2 + a, y^2 + b^2], [x, y], [a, b]);
│ 
│ julia> F([2, 3], [5, 2])
│ 2-element Array{Int64,1}:
│   9
│  13
│ ```
│ 
│ Subexpression:
│ 
│ F([2, 3], [5, 2])
│ 
│ Evaluated output:
│ 
│ 2-element Vector{Int64}:
│   9
│  13
│ 
│ Expected output:
│ 
│ 2-element Array{Int64,1}:
│   9
│  13
│ 
│   diff =
│    Warning: Diff output requires color.
│    2-element Array{Int64,1}:
│      Vector{Int64}:
│      9
│     13
└ @ Documenter.DocTests ~/.julia/packages/Documenter/PLD7m/src/DocTests.jl:369
┌ Error: Doctesting failed
│   exception =
│    `makedocs` encountered a doctest error. Terminating build
│    Stacktrace:
│      [1] error(s::String)
│        @ Base ./error.jl:33
│      [2] runner(#unused#::Type{Documenter.Builder.Doctest}, doc::Documenter.Documents.Document)
│        @ Documenter.Builder ~/.julia/packages/Documenter/PLD7m/src/Builder.jl:204
│      [3] dispatch(#unused#::Type{Documenter.Builder.DocumentPipeline}, x::Documenter.Documents.Document)
│        @ Documenter.Utilities.Selectors ~/.julia/packages/Documenter/PLD7m/src/Utilities/Selectors.jl:167
│      [4] #2
│        @ ~/.julia/packages/Documenter/PLD7m/src/Documenter.jl:240 [inlined]
│      [5] cd(f::Documenter.var"#2#3"{Documenter.Documents.Document}, dir::String)
│        @ Base.Filesystem ./file.jl:104
│      [6] makedocs(; debug::Bool, format::Documenter.Writers.HTMLWriter.HTML, kwargs::Base.Iterators.Pairs{Symbol,Any,NTuple{5,Symbol},NamedTuple{(:root, :source, :sitename, :doctest, :modules),Tuple{String,String,String,Symbol,Vector{Module}}}})
│        @ Documenter ~/.julia/packages/Documenter/PLD7m/src/Documenter.jl:239
│      [7] (::Documenter.var"#all_doctests#30"{Bool,Vector{Module}})()
│        @ Documenter ~/.julia/packages/Documenter/PLD7m/src/Documenter.jl:728
│      [8] macro expansion
│        @ ~/.julia/packages/Documenter/PLD7m/src/Documenter.jl:744 [inlined]
│      [9] macro expansion
│        @ /buildworker/worker/package_linux64/build/usr/share/julia/stdlib/v1.6/Test/src/Test.jl:1115 [inlined]
│     [10] doctest(source::String, modules::Vector{Module}; fix::Bool, testset::String)
│        @ Documenter ~/.julia/packages/Documenter/PLD7m/src/Documenter.jl:744
│     [11] doctest(package::Module; manual::Bool, testset::Nothing, kwargs::Base.Iterators.Pairs{Union{},Union{},Tuple{},NamedTuple{(),Tuple{}}})
│        @ Documenter ~/.julia/packages/Documenter/PLD7m/src/Documenter.jl:687
│     [12] doctest(package::Module)
│        @ Documenter ~/.julia/packages/Documenter/PLD7m/src/Documenter.jl:674
│     [13] top-level scope
│        @ ~/.julia/packages/HomotopyContinuation/mJDHb/test/runtests.jl:54
│     [14] top-level scope
│        @ /buildworker/worker/package_linux64/build/usr/share/julia/stdlib/v1.6/Test/src/Test.jl:1115
│     [15] top-level scope
│        @ ~/.julia/packages/HomotopyContinuation/mJDHb/test/runtests.jl:27
│     [16] include(fname::String)
│        @ Base.MainInclude ./client.jl:444
│     [17] top-level scope
│        @ none:6
│     [18] eval(m::Module, e::Any)
│        @ Core ./boot.jl:340
│     [19] exec_options(opts::Base.JLOptions)
│        @ Base ./client.jl:260
│     [20] _start()
│        @ Base ./client.jl:485
└ @ Documenter ~/.julia/packages/Documenter/PLD7m/src/Documenter.jl:737
Doctests: HomotopyContinuation: Test Failed at /home/pkgeval/.julia/packages/Documenter/PLD7m/src/Documenter.jl:744
  Expression: all_doctests()
Stacktrace:
 [1] macro expansion
   @ ~/.julia/packages/Documenter/PLD7m/src/Documenter.jl:744 [inlined]
 [2] macro expansion
   @ /buildworker/worker/package_linux64/build/usr/share/julia/stdlib/v1.6/Test/src/Test.jl:1115 [inlined]
 [3] doctest(source::String, modules::Vector{Module}; fix::Bool, testset::String)
   @ Documenter ~/.julia/packages/Documenter/PLD7m/src/Documenter.jl:744
Test Summary:                    | Pass  Fail  Total
HomotopyContinuation             | 1518     2   1520
  ModelKit                       |   82           82
  Utilities                      |  279     1    280
    Group actions                |    7            7
    UniquePoints                 |  216     1    217
    Multiplicities               |   10           10
    Polynomials                  |   34           34
    Multihomogeneous             |    4            4
    Misc                         |    8            8
  Norms                          |   18           18
  LinearAlgebra                  |   70           70
  AffinePatches                  |   22           22
  Problems                       |   59           59
  Systems                        |   59           59
  Homotopies                     |  123          123
  Predictors                     |   48           48
  NewtonCorrector                |   21           21
  CoreTracker                    |   76           76
  Valuation                      |   53           53
  Cauchy Endgame                 |   20           20
  PathTracker                    |  221          221
  Polyhedral                     |   18           18
  Overdetermined systems         |    5            5
  Solver                         |   84           84
  Result                         |  139          139
  Composition                    |    9            9
  ModelKit integration           |   19           19
  Monodromy                      |   68           68
  Root counts                    |   23           23
  path_info                      |    2            2
  Doctests: HomotopyContinuation |          1      1
ERROR: LoadError: Some tests did not pass: 1518 passed, 2 failed, 0 errored, 0 broken.
in expression starting at /home/pkgeval/.julia/packages/HomotopyContinuation/mJDHb/test/runtests.jl:26
ERROR: Package HomotopyContinuation errored during testing
Stacktrace:
  [1] pkgerror(msg::String)
    @ Pkg.Types /buildworker/worker/package_linux64/build/usr/share/julia/stdlib/v1.6/Pkg/src/Types.jl:52
  [2] test(ctx::Pkg.Types.Context, pkgs::Vector{Pkg.Types.PackageSpec}; coverage::Bool, julia_args::Cmd, test_args::Cmd, test_fn::Nothing)
    @ Pkg.Operations /buildworker/worker/package_linux64/build/usr/share/julia/stdlib/v1.6/Pkg/src/Operations.jl:1561
  [3] test(ctx::Pkg.Types.Context, pkgs::Vector{Pkg.Types.PackageSpec}; coverage::Bool, test_fn::Nothing, julia_args::Cmd, test_args::Cmd, kwargs::Base.Iterators.Pairs{Union{},Union{},Tuple{},NamedTuple{(),Tuple{}}})
    @ Pkg.API /buildworker/worker/package_linux64/build/usr/share/julia/stdlib/v1.6/Pkg/src/API.jl:327
  [4] test(ctx::Pkg.Types.Context, pkgs::Vector{Pkg.Types.PackageSpec})
    @ Pkg.API /buildworker/worker/package_linux64/build/usr/share/julia/stdlib/v1.6/Pkg/src/API.jl:314
  [5] #test#61
    @ /buildworker/worker/package_linux64/build/usr/share/julia/stdlib/v1.6/Pkg/src/API.jl:67 [inlined]
  [6] test
    @ /buildworker/worker/package_linux64/build/usr/share/julia/stdlib/v1.6/Pkg/src/API.jl:67 [inlined]
  [7] #test#60
    @ /buildworker/worker/package_linux64/build/usr/share/julia/stdlib/v1.6/Pkg/src/API.jl:66 [inlined]
  [8] test
    @ /buildworker/worker/package_linux64/build/usr/share/julia/stdlib/v1.6/Pkg/src/API.jl:66 [inlined]
  [9] test(pkg::String; kwargs::Base.Iterators.Pairs{Union{},Union{},Tuple{},NamedTuple{(),Tuple{}}})
    @ Pkg.API /buildworker/worker/package_linux64/build/usr/share/julia/stdlib/v1.6/Pkg/src/API.jl:65
 [10] test(pkg::String)
    @ Pkg.API /buildworker/worker/package_linux64/build/usr/share/julia/stdlib/v1.6/Pkg/src/API.jl:65
 [11] top-level scope
    @ none:16
