Julia Version 1.6.0-DEV.157
Commit cd6d830082 (2020-06-03 13:26 UTC)
Platform Info:
  OS: Linux (x86_64-linux-gnu)
  CPU: Intel(R) Xeon(R) Silver 4114 CPU @ 2.20GHz
  WORD_SIZE: 64
  LIBM: libopenlibm
  LLVM: libLLVM-9.0.1 (ORCJIT, skylake)
Environment:
  JULIA_DEPOT_PATH = ::/usr/local/share/julia
  JULIA_NUM_THREADS = 2

  Resolving package versions...
  Installed DataValueInterfaces ────────── v1.0.0
  Installed OpenSpecFun_jll ────────────── v0.5.3+3
  Installed IteratorInterfaceExtensions ── v1.0.0
  Installed OnlineStatsBase ────────────── v1.4.1
  Installed ProgressMeter ──────────────── v1.3.0
  Installed StatsFuns ──────────────────── v0.9.5
  Installed SpecialFunctions ───────────── v0.10.3
  Installed Pathogen ───────────────────── v0.4.12
  Installed Rmath_jll ──────────────────── v0.2.2+0
  Installed Arpack ─────────────────────── v0.4.0
  Installed FillArrays ─────────────────── v0.8.10
  Installed AbstractTrees ──────────────── v0.3.3
  Installed Compat ─────────────────────── v3.10.0
  Installed DataStructures ─────────────── v0.17.17
  Installed QuadGK ─────────────────────── v2.3.1
  Installed SweepOperator ──────────────── v0.3.0
  Installed DataAPI ────────────────────── v1.3.0
  Installed InvertedIndices ────────────── v1.0.0
  Installed CompilerSupportLibraries_jll ─ v0.3.3+0
  Installed Arpack_jll ─────────────────── v3.5.0+3
  Installed SortingAlgorithms ──────────── v0.3.1
  Installed Parsers ────────────────────── v1.0.4
  Installed RecipesBase ────────────────── v1.0.1
  Installed DataFrames ─────────────────── v0.20.2
  Installed OnlineStats ────────────────── v1.5.3
  Installed TableTraits ────────────────── v1.0.0
  Installed CategoricalArrays ──────────── v0.7.7
  Installed Reexport ───────────────────── v0.2.0
  Installed OpenBLAS_jll ───────────────── v0.3.9+4
  Installed Missings ───────────────────── v0.4.3
  Installed OrderedCollections ─────────── v1.2.0
  Installed Tables ─────────────────────── v1.0.4
  Installed JSON ───────────────────────── v0.21.0
  Installed Rmath ──────────────────────── v0.6.1
  Installed PooledArrays ───────────────── v0.5.3
  Installed StatsBase ──────────────────── v0.33.0
  Installed PDMats ─────────────────────── v0.9.12
  Installed Distributions ──────────────── v0.23.3
Updating `~/.julia/environments/v1.6/Project.toml`
  [c8189ad9] + Pathogen v0.4.12
Updating `~/.julia/environments/v1.6/Manifest.toml`
  [1520ce14] + AbstractTrees v0.3.3
  [7d9fca2a] + Arpack v0.4.0
  [68821587] + Arpack_jll v3.5.0+3
  [324d7699] + CategoricalArrays v0.7.7
  [34da2185] + Compat v3.10.0
  [e66e0078] + CompilerSupportLibraries_jll v0.3.3+0
  [9a962f9c] + DataAPI v1.3.0
  [a93c6f00] + DataFrames v0.20.2
  [864edb3b] + DataStructures v0.17.17
  [e2d170a0] + DataValueInterfaces v1.0.0
  [31c24e10] + Distributions v0.23.3
  [1a297f60] + FillArrays v0.8.10
  [41ab1584] + InvertedIndices v1.0.0
  [82899510] + IteratorInterfaceExtensions v1.0.0
  [682c06a0] + JSON v0.21.0
  [e1d29d7a] + Missings v0.4.3
  [a15396b6] + OnlineStats v1.5.3
  [925886fa] + OnlineStatsBase v1.4.1
  [4536629a] + OpenBLAS_jll v0.3.9+4
  [efe28fd5] + OpenSpecFun_jll v0.5.3+3
  [bac558e1] + OrderedCollections v1.2.0
  [90014a1f] + PDMats v0.9.12
  [69de0a69] + Parsers v1.0.4
  [c8189ad9] + Pathogen v0.4.12
  [2dfb63ee] + PooledArrays v0.5.3
  [92933f4c] + ProgressMeter v1.3.0
  [1fd47b50] + QuadGK v2.3.1
  [3cdcf5f2] + RecipesBase v1.0.1
  [189a3867] + Reexport v0.2.0
  [79098fc4] + Rmath v0.6.1
  [f50d1b31] + Rmath_jll v0.2.2+0
  [a2af1166] + SortingAlgorithms v0.3.1
  [276daf66] + SpecialFunctions v0.10.3
  [2913bbd2] + StatsBase v0.33.0
  [4c63d2b9] + StatsFuns v0.9.5
  [7522ee7d] + SweepOperator v0.3.0
  [3783bdb8] + TableTraits v1.0.0
  [bd369af6] + Tables v1.0.4
  [2a0f44e3] + Base64
  [ade2ca70] + Dates
  [8bb1440f] + DelimitedFiles
  [8ba89e20] + Distributed
  [9fa8497b] + Future
  [b77e0a4c] + InteractiveUtils
  [76f85450] + LibGit2
  [8f399da3] + Libdl
  [37e2e46d] + LinearAlgebra
  [56ddb016] + Logging
  [d6f4376e] + Markdown
  [a63ad114] + Mmap
  [44cfe95a] + Pkg
  [de0858da] + Printf
  [3fa0cd96] + REPL
  [9a3f8284] + Random
  [ea8e919c] + SHA
  [9e88b42a] + Serialization
  [1a1011a3] + SharedArrays
  [6462fe0b] + Sockets
  [2f01184e] + SparseArrays
  [10745b16] + Statistics
  [4607b0f0] + SuiteSparse
  [8dfed614] + Test
  [cf7118a7] + UUIDs
  [4ec0a83e] + Unicode
    Testing Pathogen
Status `/tmp/jl_hPby4q/Project.toml`
  [a93c6f00] DataFrames v0.20.2
  [b4f34e82] Distances v0.9.0
  [31c24e10] Distributions v0.23.3
  [a15396b6] OnlineStats v1.5.3
  [c8189ad9] Pathogen v0.4.12
  [92933f4c] ProgressMeter v1.3.0
  [3cdcf5f2] RecipesBase v1.0.1
  [2913bbd2] StatsBase v0.33.0
  [8ba89e20] Distributed
  [37e2e46d] LinearAlgebra
  [56ddb016] Logging
  [9a3f8284] Random
  [10745b16] Statistics
  [8dfed614] Test
Status `/tmp/jl_hPby4q/Manifest.toml`
  [1520ce14] AbstractTrees v0.3.3
  [7d9fca2a] Arpack v0.4.0
  [68821587] Arpack_jll v3.5.0+3
  [324d7699] CategoricalArrays v0.7.7
  [34da2185] Compat v3.10.0
  [e66e0078] CompilerSupportLibraries_jll v0.3.3+0
  [9a962f9c] DataAPI v1.3.0
  [a93c6f00] DataFrames v0.20.2
  [864edb3b] DataStructures v0.17.17
  [e2d170a0] DataValueInterfaces v1.0.0
  [b4f34e82] Distances v0.9.0
  [31c24e10] Distributions v0.23.3
  [1a297f60] FillArrays v0.8.10
  [41ab1584] InvertedIndices v1.0.0
  [82899510] IteratorInterfaceExtensions v1.0.0
  [682c06a0] JSON v0.21.0
  [e1d29d7a] Missings v0.4.3
  [a15396b6] OnlineStats v1.5.3
  [925886fa] OnlineStatsBase v1.4.1
  [4536629a] OpenBLAS_jll v0.3.9+4
  [efe28fd5] OpenSpecFun_jll v0.5.3+3
  [bac558e1] OrderedCollections v1.2.0
  [90014a1f] PDMats v0.9.12
  [69de0a69] Parsers v1.0.4
  [c8189ad9] Pathogen v0.4.12
  [2dfb63ee] PooledArrays v0.5.3
  [92933f4c] ProgressMeter v1.3.0
  [1fd47b50] QuadGK v2.3.1
  [3cdcf5f2] RecipesBase v1.0.1
  [189a3867] Reexport v0.2.0
  [79098fc4] Rmath v0.6.1
  [f50d1b31] Rmath_jll v0.2.2+0
  [a2af1166] SortingAlgorithms v0.3.1
  [276daf66] SpecialFunctions v0.10.3
  [2913bbd2] StatsBase v0.33.0
  [4c63d2b9] StatsFuns v0.9.5
  [7522ee7d] SweepOperator v0.3.0
  [3783bdb8] TableTraits v1.0.0
  [bd369af6] Tables v1.0.4
  [2a0f44e3] Base64
  [ade2ca70] Dates
  [8bb1440f] DelimitedFiles
  [8ba89e20] Distributed
  [9fa8497b] Future
  [b77e0a4c] InteractiveUtils
  [76f85450] LibGit2
  [8f399da3] Libdl
  [37e2e46d] LinearAlgebra
  [56ddb016] Logging
  [d6f4376e] Markdown
  [a63ad114] Mmap
  [44cfe95a] Pkg
  [de0858da] Printf
  [3fa0cd96] REPL
  [9a3f8284] Random
  [ea8e919c] SHA
  [9e88b42a] Serialization
  [1a1011a3] SharedArrays
  [6462fe0b] Sockets
  [2f01184e] SparseArrays
  [10745b16] Statistics
  [4607b0f0] SuiteSparse
  [8dfed614] Test
  [cf7118a7] UUIDs
  [4ec0a83e] Unicode
Initialization progress  0%|▁                           |  ETA: 3:02:41[KInitialization progress 41%|███████████▋                |  ETA: 0:00:53[KInitialization progress 60%|████████████████▉           |  ETA: 0:00:24[KInitialization progress 81%|██████████████████████▋     |  ETA: 0:00:09[KInitialization progress 90%|█████████████████████████▁  |  ETA: 0:00:04[KInitialization progress 97%|███████████████████████████▁|  ETA: 0:00:01[KInitialization progress100%|████████████████████████████| Time: 0:00:37[K
MCMC progress  0%|▁                                     |  ETA: 2:02:45[KMCMC progress  7%|██▌                                   |  ETA: 0:05:46[KMCMC progress 11%|████▁                                 |  ETA: 0:03:14[KMCMC progress 16%|██████▁                               |  ETA: 0:02:11[KMCMC progress 21%|████████                              |  ETA: 0:01:34[KMCMC progress 27%|██████████▁                           |  ETA: 0:01:08[KMCMC progress 33%|████████████▋                         |  ETA: 0:00:51[KMCMC progress 40%|███████████████▁                      |  ETA: 0:00:38[KMCMC progress 47%|█████████████████▊                    |  ETA: 0:00:29[KMCMC progress 54%|████████████████████▁                 |  ETA: 0:00:22[KMCMC progress 61%|███████████████████████               |  ETA: 0:00:17[KMCMC progress 66%|█████████████████████████▁            |  ETA: 0:00:13[KMCMC progress 73%|███████████████████████████▋          |  ETA: 0:00:10[KMCMC progress 81%|██████████████████████████████▋       |  ETA: 0:00:06[KMCMC progress 89%|█████████████████████████████████▊    |  ETA: 0:00:03[KMCMC progress 92%|███████████████████████████████████▁  |  ETA: 0:00:02[KMCMC progress 97%|████████████████████████████████████▊ |  ETA: 0:00:01[KMCMC progress 97%|████████████████████████████████████▉ |  ETA: 0:00:01[KMCMC progress100%|██████████████████████████████████████| Time: 0:00:31[K
Initialization progress  2%|▌                           |  ETA: 0:04:06[KInitialization progress100%|████████████████████████████| Time: 0:00:05[K
MCMC progress  1%|▁                                     |  ETA: 0:02:34[KMCMC progress 35%|█████████████▁                        |  ETA: 0:00:03[KMCMC progress 65%|████████████████████████▊             |  ETA: 0:00:01[KMCMC progress100%|██████████████████████████████████████| Time: 0:00:01[K
Test Summary: | Pass  Total
SEIR Model    |   83     83
Initialization progress  0%|▁                           |  ETA: 1:04:29[KInitialization progress 27%|███████▋                    |  ETA: 0:00:35[KInitialization progress 47%|█████████████▁              |  ETA: 0:00:15[KInitialization progress 68%|███████████████████         |  ETA: 0:00:06[KInitialization progress 89%|████████████████████████▉   |  ETA: 0:00:02[KInitialization progress 90%|█████████████████████████▁  |  ETA: 0:00:02[KInitialization progress 97%|███████████████████████████▁|  ETA: 0:00:00[KInitialization progress100%|████████████████████████████| Time: 0:00:13[K
MCMC progress  0%|▁                                     |  ETA: 0:56:31[KMCMC progress  1%|▁                                     |  ETA: 0:18:54[KMCMC progress  9%|███▁                                  |  ETA: 0:01:57[KMCMC progress 18%|██████▉                               |  ETA: 0:00:53[KMCMC progress 27%|██████████▁                           |  ETA: 0:00:32[KMCMC progress 36%|█████████████▋                        |  ETA: 0:00:21[KMCMC progress 43%|████████████████▁                     |  ETA: 0:00:16[KMCMC progress 50%|███████████████████▁                  |  ETA: 0:00:12[KMCMC progress 60%|██████████████████████▊               |  ETA: 0:00:08[KMCMC progress 70%|██████████████████████████▌           |  ETA: 0:00:05[KMCMC progress 75%|████████████████████████████▋         |  ETA: 0:00:04[KMCMC progress 82%|███████████████████████████████       |  ETA: 0:00:03[KMCMC progress 89%|█████████████████████████████████▉    |  ETA: 0:00:02[KMCMC progress 96%|████████████████████████████████████▌ |  ETA: 0:00:01[KMCMC progress 97%|█████████████████████████████████████ |  ETA: 0:00:00[KMCMC progress100%|██████████████████████████████████████| Time: 0:00:13[K
Initialization progress  4%|█▁                          |  ETA: 0:00:47[KInitialization progress100%|████████████████████████████| Time: 0:00:02[K
MCMC progress  1%|▁                                     |  ETA: 0:00:13[KMCMC progress 54%|████████████████████▌                 |  ETA: 0:00:00[KMCMC progress100%|██████████████████████████████████████| Time: 0:00:00[K
Test Summary: | Pass  Total
SEI Model     |  164    164
Initialization progress  0%|▁                           |  ETA: 1:02:57[KInitialization progress 19%|█████▁                      |  ETA: 0:00:55[KInitialization progress 34%|█████████▌                  |  ETA: 0:00:25[KInitialization progress 36%|██████████▁                 |  ETA: 0:00:23[KInitialization progress 40%|███████████▁                |  ETA: 0:00:20[KInitialization progress 48%|█████████████▁              |  ETA: 0:00:14[KInitialization progress 60%|████████████████▊           |  ETA: 0:00:09[KInitialization progress 73%|████████████████████▁       |  ETA: 0:00:05[KInitialization progress 83%|███████████████████████▁    |  ETA: 0:00:03[KInitialization progress 87%|████████████████████████▁   |  ETA: 0:00:02[KInitialization progress 95%|██████████████████████████▌ |  ETA: 0:00:01[KInitialization progress 97%|███████████████████████████▁|  ETA: 0:00:00[KInitialization progress100%|████████████████████████████| Time: 0:00:14[K
MCMC progress  0%|▁                                     |  ETA: 0:47:20[KMCMC progress  7%|██▊                                   |  ETA: 0:02:01[KMCMC progress 12%|████▌                                 |  ETA: 0:01:11[KMCMC progress 16%|██████▁                               |  ETA: 0:00:50[KMCMC progress 21%|████████▁                             |  ETA: 0:00:37[KMCMC progress 26%|██████████                            |  ETA: 0:00:28[KMCMC progress 31%|███████████▊                          |  ETA: 0:00:23[KMCMC progress 40%|███████████████▁                      |  ETA: 0:00:15[KMCMC progress 43%|████████████████▌                     |  ETA: 0:00:14[KMCMC progress 46%|█████████████████▁                    |  ETA: 0:00:13[KMCMC progress 55%|████████████████████▉                 |  ETA: 0:00:09[KMCMC progress 65%|████████████████████████▊             |  ETA: 0:00:06[KMCMC progress 75%|████████████████████████████▌         |  ETA: 0:00:04[KMCMC progress 82%|███████████████████████████████       |  ETA: 0:00:02[KMCMC progress 88%|█████████████████████████████████▋    |  ETA: 0:00:01[KMCMC progress 92%|███████████████████████████████████   |  ETA: 0:00:01[KMCMC progress 97%|████████████████████████████████████▊ |  ETA: 0:00:00[KMCMC progress 97%|████████████████████████████████████▉ |  ETA: 0:00:00[KMCMC progress100%|██████████████████████████████████████| Time: 0:00:11[K
Initialization progress  4%|█▁                          |  ETA: 0:00:47[KInitialization progress100%|████████████████████████████| Time: 0:00:01[K
MCMC progress  1%|▁                                     |  ETA: 0:00:15[K┌ Error: All transmission rates = 0.0, No transmission generated
│   external_or_internal =
│    2-element StatsBase.Weights{Float64,Float64,Array{Float64,1}}:
│     0.0
│     0.0
└ @ Pathogen ~/.julia/packages/Pathogen/39xDw/src/inference/generate.jl:28
MCMC progress 15%|█████▊                                |  ETA: 0:00:05[K┌ Error: All transmission rates = 0.0, No transmission generated
│   external_or_internal =
│    2-element StatsBase.Weights{Float64,Float64,Array{Float64,1}}:
│     0.0
│     0.0
└ @ Pathogen ~/.julia/packages/Pathogen/39xDw/src/inference/generate.jl:28
┌ Error: All transmission rates = 0.0, No transmission generated
│   external_or_internal =
│    2-element StatsBase.Weights{Float64,Float64,Array{Float64,1}}:
│     0.0
│     0.0
└ @ Pathogen ~/.julia/packages/Pathogen/39xDw/src/inference/generate.jl:28
┌ Error: All transmission rates = 0.0, No transmission generated
│   external_or_internal =
│    2-element StatsBase.Weights{Float64,Float64,Array{Float64,1}}:
│     0.0
│     0.0
└ @ Pathogen ~/.julia/packages/Pathogen/39xDw/src/inference/generate.jl:28
┌ Error: All transmission rates = 0.0, No transmission generated
│   external_or_internal =
│    2-element StatsBase.Weights{Float64,Float64,Array{Float64,1}}:
│     0.0
│     0.0
└ @ Pathogen ~/.julia/packages/Pathogen/39xDw/src/inference/generate.jl:28
┌ Error: All transmission rates = 0.0, No transmission generated
│   external_or_internal =
│    2-element StatsBase.Weights{Float64,Float64,Array{Float64,1}}:
│     0.0
│     0.0
└ @ Pathogen ~/.julia/packages/Pathogen/39xDw/src/inference/generate.jl:28
┌ Error: All transmission rates = 0.0, No transmission generated
│   external_or_internal =
│    2-element StatsBase.Weights{Float64,Float64,Array{Float64,1}}:
│     0.0
│     0.0
└ @ Pathogen ~/.julia/packages/Pathogen/39xDw/src/inference/generate.jl:28
┌ Error: All transmission rates = 0.0, No transmission generated
│   external_or_internal =
│    2-element StatsBase.Weights{Float64,Float64,Array{Float64,1}}:
│     0.0
│     0.0
└ @ Pathogen ~/.julia/packages/Pathogen/39xDw/src/inference/generate.jl:28
┌ Error: All transmission rates = 0.0, No transmission generated
│   external_or_internal =
│    2-element StatsBase.Weights{Float64,Float64,Array{Float64,1}}:
│     0.0
│     0.0
└ @ Pathogen ~/.julia/packages/Pathogen/39xDw/src/inference/generate.jl:28
┌ Error: All transmission rates = 0.0, No transmission generated
│   external_or_internal =
│    2-element StatsBase.Weights{Float64,Float64,Array{Float64,1}}:
│     0.0
│     0.0
└ @ Pathogen ~/.julia/packages/Pathogen/39xDw/src/inference/generate.jl:28
┌ Error: All transmission rates = 0.0, No transmission generated
│   external_or_internal =
│    2-element StatsBase.Weights{Float64,Float64,Array{Float64,1}}:
│     0.0
│     0.0
└ @ Pathogen ~/.julia/packages/Pathogen/39xDw/src/inference/generate.jl:28
┌ Error: All transmission rates = 0.0, No transmission generated
│   external_or_internal =
│    2-element StatsBase.Weights{Float64,Float64,Array{Float64,1}}:
│     0.0
│     0.0
└ @ Pathogen ~/.julia/packages/Pathogen/39xDw/src/inference/generate.jl:28
┌ Error: All transmission rates = 0.0, No transmission generated
│   external_or_internal =
│    2-element StatsBase.Weights{Float64,Float64,Array{Float64,1}}:
│     0.0
│     0.0
└ @ Pathogen ~/.julia/packages/Pathogen/39xDw/src/inference/generate.jl:28
┌ Error: All transmission rates = 0.0, No transmission generated
│   external_or_internal =
│    2-element StatsBase.Weights{Float64,Float64,Array{Float64,1}}:
│     0.0
│     0.0
└ @ Pathogen ~/.julia/packages/Pathogen/39xDw/src/inference/generate.jl:28
┌ Error: All transmission rates = 0.0, No transmission generated
│   external_or_internal =
│    2-element StatsBase.Weights{Float64,Float64,Array{Float64,1}}:
│     0.0
│     0.0
└ @ Pathogen ~/.julia/packages/Pathogen/39xDw/src/inference/generate.jl:28
┌ Error: All transmission rates = 0.0, No transmission generated
│   external_or_internal =
│    2-element StatsBase.Weights{Float64,Float64,Array{Float64,1}}:
│     0.0
│     0.0
└ @ Pathogen ~/.julia/packages/Pathogen/39xDw/src/inference/generate.jl:28
┌ Error: All transmission rates = 0.0, No transmission generated
│   external_or_internal =
│    2-element StatsBase.Weights{Float64,Float64,Array{Float64,1}}:
│     0.0
│     0.0
└ @ Pathogen ~/.julia/packages/Pathogen/39xDw/src/inference/generate.jl:28
┌ Error: All transmission rates = 0.0, No transmission generated
│   external_or_internal =
│    2-element StatsBase.Weights{Float64,Float64,Array{Float64,1}}:
│     0.0
│     0.0
└ @ Pathogen ~/.julia/packages/Pathogen/39xDw/src/inference/generate.jl:28
┌ Error: All transmission rates = 0.0, No transmission generated
│   external_or_internal =
│    2-element StatsBase.Weights{Float64,Float64,Array{Float64,1}}:
│     0.0
│     0.0
└ @ Pathogen ~/.julia/packages/Pathogen/39xDw/src/inference/generate.jl:28
┌ Error: All transmission rates = 0.0, No transmission generated
│   external_or_internal =
│    2-element StatsBase.Weights{Float64,Float64,Array{Float64,1}}:
│     0.0
│     0.0
└ @ Pathogen ~/.julia/packages/Pathogen/39xDw/src/inference/generate.jl:28
┌ Error: All transmission rates = 0.0, No transmission generated
│   external_or_internal =
│    2-element StatsBase.Weights{Float64,Float64,Array{Float64,1}}:
│     0.0
│     0.0
└ @ Pathogen ~/.julia/packages/Pathogen/39xDw/src/inference/generate.jl:28
┌ Error: All transmission rates = 0.0, No transmission generated
│   external_or_internal =
│    2-element StatsBase.Weights{Float64,Float64,Array{Float64,1}}:
│     0.0
│     0.0
└ @ Pathogen ~/.julia/packages/Pathogen/39xDw/src/inference/generate.jl:28
┌ Error: All transmission rates = 0.0, No transmission generated
│   external_or_internal =
│    2-element StatsBase.Weights{Float64,Float64,Array{Float64,1}}:
│     0.0
│     0.0
└ @ Pathogen ~/.julia/packages/Pathogen/39xDw/src/inference/generate.jl:28
┌ Error: All transmission rates = 0.0, No transmission generated
│   external_or_internal =
│    2-element StatsBase.Weights{Float64,Float64,Array{Float64,1}}:
│     0.0
│     0.0
└ @ Pathogen ~/.julia/packages/Pathogen/39xDw/src/inference/generate.jl:28
┌ Error: All transmission rates = 0.0, No transmission generated
│   external_or_internal =
│    2-element StatsBase.Weights{Float64,Float64,Array{Float64,1}}:
│     0.0
│     0.0
└ @ Pathogen ~/.julia/packages/Pathogen/39xDw/src/inference/generate.jl:28
┌ Error: All transmission rates = 0.0, No transmission generated
│   external_or_internal =
│    2-element StatsBase.Weights{Float64,Float64,Array{Float64,1}}:
│     0.0
│     0.0
└ @ Pathogen ~/.julia/packages/Pathogen/39xDw/src/inference/generate.jl:28
┌ Error: All transmission rates = 0.0, No transmission generated
│   external_or_internal =
│    2-element StatsBase.Weights{Float64,Float64,Array{Float64,1}}:
│     0.0
│     0.0
└ @ Pathogen ~/.julia/packages/Pathogen/39xDw/src/inference/generate.jl:28
┌ Error: All transmission rates = 0.0, No transmission generated
│   external_or_internal =
│    2-element StatsBase.Weights{Float64,Float64,Array{Float64,1}}:
│     0.0
│     0.0
└ @ Pathogen ~/.julia/packages/Pathogen/39xDw/src/inference/generate.jl:28
┌ Error: All transmission rates = 0.0, No transmission generated
│   external_or_internal =
│    2-element StatsBase.Weights{Float64,Float64,Array{Float64,1}}:
│     0.0
│     0.0
└ @ Pathogen ~/.julia/packages/Pathogen/39xDw/src/inference/generate.jl:28
┌ Error: All transmission rates = 0.0, No transmission generated
│   external_or_internal =
│    2-element StatsBase.Weights{Float64,Float64,Array{Float64,1}}:
│     0.0
│     0.0
└ @ Pathogen ~/.julia/packages/Pathogen/39xDw/src/inference/generate.jl:28
┌ Error: All transmission rates = 0.0, No transmission generated
│   external_or_internal =
│    2-element StatsBase.Weights{Float64,Float64,Array{Float64,1}}:
│     0.0
│     0.0
└ @ Pathogen ~/.julia/packages/Pathogen/39xDw/src/inference/generate.jl:28
MCMC progress 49%|██████████████████▋                   |  ETA: 0:00:01[KMCMC progress100%|██████████████████████████████████████| Time: 0:00:01[K
Test Summary: | Pass  Total
SIR Model     |  170    170
Initialization progress  0%|▁                           |  ETA: 0:59:05[KInitialization progress 23%|██████▌                     |  ETA: 0:00:39[KInitialization progress 46%|█████████████               |  ETA: 0:00:14[KInitialization progress 68%|███████████████████         |  ETA: 0:00:06[KInitialization progress 90%|█████████████████████████▁  |  ETA: 0:00:01[KInitialization progress 97%|███████████████████████████▁|  ETA: 0:00:00[KInitialization progress100%|████████████████████████████| Time: 0:00:12[K
MCMC progress  0%|▁                                     |  ETA: 0:45:56[KMCMC progress 10%|███▋                                  |  ETA: 0:01:27[KMCMC progress 16%|██████▁                               |  ETA: 0:00:48[KMCMC progress 24%|█████████▁                            |  ETA: 0:00:30[KMCMC progress 35%|█████████████▁                        |  ETA: 0:00:18[KMCMC progress 45%|█████████████████▁                    |  ETA: 0:00:12[KMCMC progress 52%|███████████████████▊                  |  ETA: 0:00:09[KMCMC progress 62%|███████████████████████▋              |  ETA: 0:00:06[KMCMC progress 73%|███████████████████████████▋          |  ETA: 0:00:04[KMCMC progress 84%|████████████████████████████████      |  ETA: 0:00:02[KMCMC progress 89%|█████████████████████████████████▊    |  ETA: 0:00:01[KMCMC progress 96%|████████████████████████████████████▌ |  ETA: 0:00:00[KMCMC progress 97%|█████████████████████████████████████ |  ETA: 0:00:00[KMCMC progress100%|██████████████████████████████████████| Time: 0:00:10[K
Initialization progress  4%|█▁                          |  ETA: 0:00:46[KInitialization progress100%|████████████████████████████| Time: 0:00:01[K
MCMC progress  1%|▁                                     |  ETA: 0:00:16[KMCMC progress 60%|██████████████████████▊               |  ETA: 0:00:00[KMCMC progress100%|██████████████████████████████████████| Time: 0:00:00[K
Test Summary: | Pass  Total
SI Model      |  106    106
    Testing Pathogen tests passed 
