################################################################################
# Set-up: 2020-10-28T07:39:24.653
#

Julia Version 1.6.0-DEV.1352
Commit 8f71ea7f35 (2020-10-28 02:10 UTC)
Platform Info:
  OS: Linux (x86_64-linux-gnu)
  CPU: AMD EPYC 7502 32-Core Processor
  WORD_SIZE: 64
  LIBM: libopenlibm
  LLVM: libLLVM-11.0.0 (ORCJIT, znver2)
Environment:
  JULIA_DEPOT_PATH = ::/usr/local/share/julia
  JULIA_NUM_THREADS = 2
  JULIA_MAX_NUM_PRECOMPILE_FILES = 9223372036854775807



################################################################################
# Installation: 2020-10-28T07:39:27.903
#

   Resolving package versions...
   Installed ProgressMeter ──────────────── v1.4.0
   Installed OnlineStatsBase ────────────── v1.4.4
   Installed PDMats ─────────────────────── v0.10.1
   Installed Parsers ────────────────────── v1.0.11
   Installed OrderedCollections ─────────── v1.3.1
   Installed RecipesBase ────────────────── v1.1.0
   Installed OnlineStats ────────────────── v1.5.7
   Installed CompilerSupportLibraries_jll ─ v0.3.4+0
   Installed StatsFuns ──────────────────── v0.9.5
   Installed SortingAlgorithms ──────────── v0.3.1
   Installed DataAPI ────────────────────── v1.3.0
   Installed Tables ─────────────────────── v1.1.0
   Installed QuadGK ─────────────────────── v2.4.1
   Installed Pathogen ───────────────────── v0.4.12
   Installed InvertedIndices ────────────── v1.0.0
   Installed DataFrames ─────────────────── v0.20.2
   Installed OpenSpecFun_jll ────────────── v0.5.3+4
   Installed Rmath ──────────────────────── v0.6.1
   Installed AbstractTrees ──────────────── v0.3.3
   Installed CategoricalArrays ──────────── v0.7.7
   Installed PooledArrays ───────────────── v0.5.3
   Installed Reexport ───────────────────── v0.2.0
   Installed SweepOperator ──────────────── v0.3.0
   Installed Compat ─────────────────────── v3.23.0
   Installed FillArrays ─────────────────── v0.9.7
   Installed SpecialFunctions ───────────── v0.10.3
   Installed JSON ───────────────────────── v0.21.1
   Installed Missings ───────────────────── v0.4.4
   Installed DataValueInterfaces ────────── v1.0.0
   Installed Distributions ──────────────── v0.23.12
   Installed StatsBase ──────────────────── v0.33.2
   Installed DataStructures ─────────────── v0.18.8
   Installed TableTraits ────────────────── v1.0.0
   Installed StaticArrays ───────────────── v0.12.4
   Installed Rmath_jll ──────────────────── v0.2.2+1
   Installed IteratorInterfaceExtensions ── v1.0.0
   Installed JLLWrappers ────────────────── v1.1.3
Updating `~/.julia/environments/v1.6/Project.toml`
  [c8189ad9] + Pathogen v0.4.12
Updating `~/.julia/environments/v1.6/Manifest.toml`
  [1520ce14] + AbstractTrees v0.3.3
  [324d7699] + CategoricalArrays v0.7.7
  [34da2185] + Compat v3.23.0
  [9a962f9c] + DataAPI v1.3.0
  [a93c6f00] + DataFrames v0.20.2
  [864edb3b] + DataStructures v0.18.8
  [e2d170a0] + DataValueInterfaces v1.0.0
  [31c24e10] + Distributions v0.23.12
  [1a297f60] + FillArrays v0.9.7
  [41ab1584] + InvertedIndices v1.0.0
  [82899510] + IteratorInterfaceExtensions v1.0.0
  [692b3bcd] + JLLWrappers v1.1.3
  [682c06a0] + JSON v0.21.1
  [e1d29d7a] + Missings v0.4.4
  [a15396b6] + OnlineStats v1.5.7
  [925886fa] + OnlineStatsBase v1.4.4
  [bac558e1] + OrderedCollections v1.3.1
  [90014a1f] + PDMats v0.10.1
  [69de0a69] + Parsers v1.0.11
  [c8189ad9] + Pathogen v0.4.12
  [2dfb63ee] + PooledArrays v0.5.3
  [92933f4c] + ProgressMeter v1.4.0
  [1fd47b50] + QuadGK v2.4.1
  [3cdcf5f2] + RecipesBase v1.1.0
  [189a3867] + Reexport v0.2.0
  [79098fc4] + Rmath v0.6.1
  [a2af1166] + SortingAlgorithms v0.3.1
  [276daf66] + SpecialFunctions v0.10.3
  [90137ffa] + StaticArrays v0.12.4
  [2913bbd2] + StatsBase v0.33.2
  [4c63d2b9] + StatsFuns v0.9.5
  [7522ee7d] + SweepOperator v0.3.0
  [3783bdb8] + TableTraits v1.0.0
  [bd369af6] + Tables v1.1.0
  [e66e0078] + CompilerSupportLibraries_jll v0.3.4+0
  [efe28fd5] + OpenSpecFun_jll v0.5.3+4
  [f50d1b31] + Rmath_jll v0.2.2+1
  [0dad84c5] + ArgTools
  [56f22d72] + Artifacts
  [2a0f44e3] + Base64
  [ade2ca70] + Dates
  [8bb1440f] + DelimitedFiles
  [8ba89e20] + Distributed
  [f43a241f] + Downloads
  [9fa8497b] + Future
  [b77e0a4c] + InteractiveUtils
  [b27032c2] + LibCURL
  [76f85450] + LibGit2
  [8f399da3] + Libdl
  [37e2e46d] + LinearAlgebra
  [56ddb016] + Logging
  [d6f4376e] + Markdown
  [a63ad114] + Mmap
  [44cfe95a] + Pkg
  [de0858da] + Printf
  [3fa0cd96] + REPL
  [9a3f8284] + Random
  [ea8e919c] + SHA
  [9e88b42a] + Serialization
  [1a1011a3] + SharedArrays
  [6462fe0b] + Sockets
  [2f01184e] + SparseArrays
  [10745b16] + Statistics
  [4607b0f0] + SuiteSparse
  [fa267f1f] + TOML
  [8dfed614] + Test
  [cf7118a7] + UUIDs
  [4ec0a83e] + Unicode
  [deac9b47] + LibCURL_jll
  [14a3606d] + MozillaCACerts_jll
Precompiling project... (tip: to disable auto-precompilation set ENV["JULIA_PKG_PRECOMPILE_AUTO"]=0)
[32m  ✓ [39m[90mIteratorInterfaceExtensions[39m
[32m  ✓ [39m[90mReexport[39m
[32m  ✓ [39m[90mSweepOperator[39m
[32m  ✓ [39m[90mDataValueInterfaces[39m
[32m  ✓ [39m[90mRecipesBase[39m
[32m  ✓ [39m[90mDataAPI[39m
[32m  ✓ [39m[90mInvertedIndices[39m
[32m  ✓ [39m[90mJLLWrappers[39m
[32m  ✓ [39m[90mOrderedCollections[39m
[32m  ✓ [39m[90mTableTraits[39m
[32m  ✓ [39m[90mAbstractTrees[39m
[32m  ✓ [39m[90mPDMats[39m
[32m  ✓ [39m[90mCompat[39m
[32m  ✓ [39m[90mMissings[39m
[32m  ✓ [39m[90mProgressMeter[39m
[32m  ✓ [39m[90mPooledArrays[39m
[32m  ✓ [39m[90mFillArrays[39m
[32m  ✓ [39m[90mTables[39m
[32m  ✓ [39m[90mRmath_jll[39m
[32m  ✓ [39m[90mCompilerSupportLibraries_jll[39m
[32m  ✓ [39m[90mRmath[39m
[32m  ✓ [39m[90mDataStructures[39m
[32m  ✓ [39m[90mSortingAlgorithms[39m
[32m  ✓ [39m[90mOpenSpecFun_jll[39m
[32m  ✓ [39m[90mQuadGK[39m
[32m  ✓ [39m[90mParsers[39m
[32m  ✓ [39m[90mStaticArrays[39m
[32m  ✓ [39m[90mJSON[39m
[32m  ✓ [39m[90mStatsBase[39m
[32m  ✓ [39m[90mOnlineStatsBase[39m
[32m  ✓ [39m[90mSpecialFunctions[39m
[32m  ✓ [39m[90mOnlineStats[39m
[32m  ✓ [39m[90mStatsFuns[39m
[32m  ✓ [39m[90mCategoricalArrays[39m
[32m  ✓ [39m[90mDistributions[39m
[32m  ✓ [39m[90mDataFrames[39m
[32m  ✓ [39mPathogen
37 dependencies successfully precompiled


################################################################################
# Testing: 2020-10-28T07:40:26.160
#

     Testing Pathogen
Status `/tmp/jl_CDKLbZ/Project.toml`
  [a93c6f00] DataFrames v0.20.2
  [b4f34e82] Distances v0.10.0
  [31c24e10] Distributions v0.23.12
  [a15396b6] OnlineStats v1.5.7
  [c8189ad9] Pathogen v0.4.12
  [92933f4c] ProgressMeter v1.4.0
  [3cdcf5f2] RecipesBase v1.1.0
  [2913bbd2] StatsBase v0.33.2
  [8ba89e20] Distributed
  [37e2e46d] LinearAlgebra
  [56ddb016] Logging
  [9a3f8284] Random
  [10745b16] Statistics
  [8dfed614] Test
Status `/tmp/jl_CDKLbZ/Manifest.toml`
  [1520ce14] AbstractTrees v0.3.3
  [324d7699] CategoricalArrays v0.7.7
  [34da2185] Compat v3.23.0
  [9a962f9c] DataAPI v1.3.0
  [a93c6f00] DataFrames v0.20.2
  [864edb3b] DataStructures v0.18.8
  [e2d170a0] DataValueInterfaces v1.0.0
  [b4f34e82] Distances v0.10.0
  [31c24e10] Distributions v0.23.12
  [1a297f60] FillArrays v0.9.7
  [41ab1584] InvertedIndices v1.0.0
  [82899510] IteratorInterfaceExtensions v1.0.0
  [692b3bcd] JLLWrappers v1.1.3
  [682c06a0] JSON v0.21.1
  [e1d29d7a] Missings v0.4.4
  [a15396b6] OnlineStats v1.5.7
  [925886fa] OnlineStatsBase v1.4.4
  [bac558e1] OrderedCollections v1.3.1
  [90014a1f] PDMats v0.10.1
  [69de0a69] Parsers v1.0.11
  [c8189ad9] Pathogen v0.4.12
  [2dfb63ee] PooledArrays v0.5.3
  [92933f4c] ProgressMeter v1.4.0
  [1fd47b50] QuadGK v2.4.1
  [3cdcf5f2] RecipesBase v1.1.0
  [189a3867] Reexport v0.2.0
  [79098fc4] Rmath v0.6.1
  [a2af1166] SortingAlgorithms v0.3.1
  [276daf66] SpecialFunctions v0.10.3
  [90137ffa] StaticArrays v0.12.4
  [2913bbd2] StatsBase v0.33.2
  [4c63d2b9] StatsFuns v0.9.5
  [7522ee7d] SweepOperator v0.3.0
  [3783bdb8] TableTraits v1.0.0
  [bd369af6] Tables v1.1.0
  [e66e0078] CompilerSupportLibraries_jll v0.3.4+0
  [efe28fd5] OpenSpecFun_jll v0.5.3+4
  [f50d1b31] Rmath_jll v0.2.2+1
  [0dad84c5] ArgTools
  [56f22d72] Artifacts
  [2a0f44e3] Base64
  [ade2ca70] Dates
  [8bb1440f] DelimitedFiles
  [8ba89e20] Distributed
  [f43a241f] Downloads
  [9fa8497b] Future
  [b77e0a4c] InteractiveUtils
  [b27032c2] LibCURL
  [76f85450] LibGit2
  [8f399da3] Libdl
  [37e2e46d] LinearAlgebra
  [56ddb016] Logging
  [d6f4376e] Markdown
  [a63ad114] Mmap
  [44cfe95a] Pkg
  [de0858da] Printf
  [3fa0cd96] REPL
  [9a3f8284] Random
  [ea8e919c] SHA
  [9e88b42a] Serialization
  [1a1011a3] SharedArrays
  [6462fe0b] Sockets
  [2f01184e] SparseArrays
  [10745b16] Statistics
  [4607b0f0] SuiteSparse
  [fa267f1f] TOML
  [8dfed614] Test
  [cf7118a7] UUIDs
  [4ec0a83e] Unicode
  [deac9b47] LibCURL_jll
  [14a3606d] MozillaCACerts_jll
     Testing Running tests...
Initialization progress  0%|▁                           |  ETA: 1:41:04[KInitialization progress100%|████████████████████████████| Time: 0:00:24[K
MCMC progress  0%|▁                                     |  ETA: 2:25:38[KMCMC progress 16%|██████▁                               |  ETA: 0:02:34[KMCMC progress 25%|█████████▁                            |  ETA: 0:01:31[KMCMC progress 36%|█████████████▌                        |  ETA: 0:00:54[KMCMC progress 44%|████████████████▊                     |  ETA: 0:00:38[KMCMC progress 50%|███████████████████                   |  ETA: 0:00:30[KMCMC progress 70%|██████████████████████████▊           |  ETA: 0:00:13[KMCMC progress 90%|██████████████████████████████████▁   |  ETA: 0:00:03[KMCMC progress 95%|████████████████████████████████████▁ |  ETA: 0:00:02[KMCMC progress 96%|████████████████████████████████████▌ |  ETA: 0:00:02[KMCMC progress 97%|█████████████████████████████████████ |  ETA: 0:00:01[KMCMC progress100%|██████████████████████████████████████| Time: 0:00:43[K
Initialization progress  2%|▌                           |  ETA: 0:02:21[KInitialization progress100%|████████████████████████████| Time: 0:00:02[K
MCMC progress  1%|▁                                     |  ETA: 0:06:09[KMCMC progress 19%|███████▁                              |  ETA: 0:00:16[KMCMC progress 73%|███████████████████████████▊          |  ETA: 0:00:01[KMCMC progress100%|██████████████████████████████████████| Time: 0:00:03[K
Test Summary: | Pass  Total
SEIR Model    |   85     85
Initialization progress  0%|▁                           |  ETA: 0:42:26[KInitialization progress 19%|█████▁                      |  ETA: 0:00:38[KInitialization progress 70%|███████████████████▊        |  ETA: 0:00:04[KInitialization progress 91%|█████████████████████████▌  |  ETA: 0:00:01[KInitialization progress 96%|███████████████████████████ |  ETA: 0:00:00[KInitialization progress100%|████████████████████████████| Time: 0:00:10[K
MCMC progress  0%|▁                                     |  ETA: 0:31:18[KMCMC progress 12%|████▋                                 |  ETA: 0:00:45[KMCMC progress 29%|██████████▉                           |  ETA: 0:00:16[KMCMC progress 40%|███████████████▁                      |  ETA: 0:00:10[KMCMC progress 53%|████████████████████                  |  ETA: 0:00:06[KMCMC progress 56%|█████████████████████▁                |  ETA: 0:00:05[KMCMC progress 57%|█████████████████████▋                |  ETA: 0:00:05[KMCMC progress 59%|██████████████████████▁               |  ETA: 0:00:05[KMCMC progress 68%|█████████████████████████▉            |  ETA: 0:00:03[KMCMC progress 89%|█████████████████████████████████▉    |  ETA: 0:00:01[KMCMC progress 95%|████████████████████████████████████▁ |  ETA: 0:00:00[KMCMC progress 97%|████████████████████████████████████▊ |  ETA: 0:00:00[KMCMC progress 97%|████████████████████████████████████▉ |  ETA: 0:00:00[KMCMC progress100%|██████████████████████████████████████| Time: 0:00:08[K
Initialization progress  4%|█▁                          |  ETA: 0:00:37[KInitialization progress100%|████████████████████████████| Time: 0:00:01[K
MCMC progress  1%|▁                                     |  ETA: 0:00:44[KMCMC progress 46%|█████████████████▌                    |  ETA: 0:00:01[KMCMC progress 92%|███████████████████████████████████   |  ETA: 0:00:00[KMCMC progress100%|██████████████████████████████████████| Time: 0:00:00[K
Test Summary: | Pass  Total
SEI Model     |  163    163
Initialization progress  0%|▁                           |  ETA: 0:40:06[KInitialization progress 46%|████████████▊               |  ETA: 0:00:10[KInitialization progress 86%|████████████████████████▁   |  ETA: 0:00:01[KInitialization progress 95%|██████████████████████████▋ |  ETA: 0:00:00[KInitialization progress 96%|██████████████████████████▉ |  ETA: 0:00:00[KInitialization progress100%|████████████████████████████| Time: 0:00:08[K
MCMC progress  0%|▁                                     |  ETA: 0:32:30[KMCMC progress  7%|██▋                                   |  ETA: 0:01:28[KMCMC progress 20%|███████▊                              |  ETA: 0:00:26[KMCMC progress 24%|█████████▁                            |  ETA: 0:00:21[KMCMC progress 27%|██████████▁                           |  ETA: 0:00:19[KMCMC progress 32%|████████████▁                         |  ETA: 0:00:15[KMCMC progress 33%|████████████▌                         |  ETA: 0:00:15[KMCMC progress 34%|████████████▉                         |  ETA: 0:00:14[KMCMC progress 42%|███████████████▉                      |  ETA: 0:00:11[KMCMC progress 49%|██████████████████▊                   |  ETA: 0:00:08[KMCMC progress 67%|█████████████████████████▌            |  ETA: 0:00:04[KMCMC progress 83%|███████████████████████████████▋      |  ETA: 0:00:02[KMCMC progress 87%|█████████████████████████████████▁    |  ETA: 0:00:01[KMCMC progress 93%|███████████████████████████████████▌  |  ETA: 0:00:01[KMCMC progress 97%|█████████████████████████████████████ |  ETA: 0:00:00[KMCMC progress100%|██████████████████████████████████████| Time: 0:00:08[K
Initialization progress  4%|█▁                          |  ETA: 0:00:33[KInitialization progress100%|████████████████████████████| Time: 0:00:01[K
MCMC progress  1%|▁                                     |  ETA: 0:00:53[K┌ Error: All transmission rates = 0.0, No transmission generated
│   external_or_internal =
│    2-element StatsBase.Weights{Float64, Float64, Vector{Float64}}:
│     0.0
│     0.0
└ @ Pathogen ~/.julia/packages/Pathogen/39xDw/src/inference/generate.jl:28
MCMC progress 21%|████████                              |  ETA: 0:00:30[K┌ Error: All transmission rates = 0.0, No transmission generated
│   external_or_internal =
│    2-element StatsBase.Weights{Float64, Float64, Vector{Float64}}:
│     0.0
│     0.0
└ @ Pathogen ~/.julia/packages/Pathogen/39xDw/src/inference/generate.jl:28
┌ Error: All transmission rates = 0.0, No transmission generated
│   external_or_internal =
│    2-element StatsBase.Weights{Float64, Float64, Vector{Float64}}:
│     0.0
│     0.0
└ @ Pathogen ~/.julia/packages/Pathogen/39xDw/src/inference/generate.jl:28
┌ Error: All transmission rates = 0.0, No transmission generated
│   external_or_internal =
│    2-element StatsBase.Weights{Float64, Float64, Vector{Float64}}:
│     0.0
│     0.0
└ @ Pathogen ~/.julia/packages/Pathogen/39xDw/src/inference/generate.jl:28
┌ Error: All transmission rates = 0.0, No transmission generated
│   external_or_internal =
│    2-element StatsBase.Weights{Float64, Float64, Vector{Float64}}:
│     0.0
│     0.0
└ @ Pathogen ~/.julia/packages/Pathogen/39xDw/src/inference/generate.jl:28
┌ Error: All transmission rates = 0.0, No transmission generated
│   external_or_internal =
│    2-element StatsBase.Weights{Float64, Float64, Vector{Float64}}:
│     0.0
│     0.0
└ @ Pathogen ~/.julia/packages/Pathogen/39xDw/src/inference/generate.jl:28
┌ Error: All transmission rates = 0.0, No transmission generated
│   external_or_internal =
│    2-element StatsBase.Weights{Float64, Float64, Vector{Float64}}:
│     0.0
│     0.0
└ @ Pathogen ~/.julia/packages/Pathogen/39xDw/src/inference/generate.jl:28
┌ Error: All transmission rates = 0.0, No transmission generated
│   external_or_internal =
│    2-element StatsBase.Weights{Float64, Float64, Vector{Float64}}:
│     0.0
│     0.0
└ @ Pathogen ~/.julia/packages/Pathogen/39xDw/src/inference/generate.jl:28
┌ Error: All transmission rates = 0.0, No transmission generated
│   external_or_internal =
│    2-element StatsBase.Weights{Float64, Float64, Vector{Float64}}:
│     0.0
│     0.0
└ @ Pathogen ~/.julia/packages/Pathogen/39xDw/src/inference/generate.jl:28
┌ Error: All transmission rates = 0.0, No transmission generated
│   external_or_internal =
│    2-element StatsBase.Weights{Float64, Float64, Vector{Float64}}:
│     0.0
│     0.0
└ @ Pathogen ~/.julia/packages/Pathogen/39xDw/src/inference/generate.jl:28
┌ Error: All transmission rates = 0.0, No transmission generated
│   external_or_internal =
│    2-element StatsBase.Weights{Float64, Float64, Vector{Float64}}:
│     0.0
│     0.0
└ @ Pathogen ~/.julia/packages/Pathogen/39xDw/src/inference/generate.jl:28
┌ Error: All transmission rates = 0.0, No transmission generated
│   external_or_internal =
│    2-element StatsBase.Weights{Float64, Float64, Vector{Float64}}:
│     0.0
│     0.0
└ @ Pathogen ~/.julia/packages/Pathogen/39xDw/src/inference/generate.jl:28
┌ Error: All transmission rates = 0.0, No transmission generated
│   external_or_internal =
│    2-element StatsBase.Weights{Float64, Float64, Vector{Float64}}:
│     0.0
│     0.0
└ @ Pathogen ~/.julia/packages/Pathogen/39xDw/src/inference/generate.jl:28
┌ Error: All transmission rates = 0.0, No transmission generated
│   external_or_internal =
│    2-element StatsBase.Weights{Float64, Float64, Vector{Float64}}:
│     0.0
│     0.0
└ @ Pathogen ~/.julia/packages/Pathogen/39xDw/src/inference/generate.jl:28
┌ Error: All transmission rates = 0.0, No transmission generated
│   external_or_internal =
│    2-element StatsBase.Weights{Float64, Float64, Vector{Float64}}:
│     0.0
│     0.0
└ @ Pathogen ~/.julia/packages/Pathogen/39xDw/src/inference/generate.jl:28
┌ Error: All transmission rates = 0.0, No transmission generated
│   external_or_internal =
│    2-element StatsBase.Weights{Float64, Float64, Vector{Float64}}:
│     0.0
│     0.0
└ @ Pathogen ~/.julia/packages/Pathogen/39xDw/src/inference/generate.jl:28
┌ Error: All transmission rates = 0.0, No transmission generated
│   external_or_internal =
│    2-element StatsBase.Weights{Float64, Float64, Vector{Float64}}:
│     0.0
│     0.0
└ @ Pathogen ~/.julia/packages/Pathogen/39xDw/src/inference/generate.jl:28
┌ Error: All transmission rates = 0.0, No transmission generated
│   external_or_internal =
│    2-element StatsBase.Weights{Float64, Float64, Vector{Float64}}:
│     0.0
│     0.0
└ @ Pathogen ~/.julia/packages/Pathogen/39xDw/src/inference/generate.jl:28
┌ Error: All transmission rates = 0.0, No transmission generated
│   external_or_internal =
│    2-element StatsBase.Weights{Float64, Float64, Vector{Float64}}:
│     0.0
│     0.0
└ @ Pathogen ~/.julia/packages/Pathogen/39xDw/src/inference/generate.jl:28
┌ Error: All transmission rates = 0.0, No transmission generated
│   external_or_internal =
│    2-element StatsBase.Weights{Float64, Float64, Vector{Float64}}:
│     0.0
│     0.0
└ @ Pathogen ~/.julia/packages/Pathogen/39xDw/src/inference/generate.jl:28
┌ Error: All transmission rates = 0.0, No transmission generated
│   external_or_internal =
│    2-element StatsBase.Weights{Float64, Float64, Vector{Float64}}:
│     0.0
│     0.0
└ @ Pathogen ~/.julia/packages/Pathogen/39xDw/src/inference/generate.jl:28
┌ Error: All transmission rates = 0.0, No transmission generated
│   external_or_internal =
│    2-element StatsBase.Weights{Float64, Float64, Vector{Float64}}:
│     0.0
│     0.0
└ @ Pathogen ~/.julia/packages/Pathogen/39xDw/src/inference/generate.jl:28
┌ Error: All transmission rates = 0.0, No transmission generated
│   external_or_internal =
│    2-element StatsBase.Weights{Float64, Float64, Vector{Float64}}:
│     0.0
│     0.0
└ @ Pathogen ~/.julia/packages/Pathogen/39xDw/src/inference/generate.jl:28
┌ Error: All transmission rates = 0.0, No transmission generated
│   external_or_internal =
│    2-element StatsBase.Weights{Float64, Float64, Vector{Float64}}:
│     0.0
│     0.0
└ @ Pathogen ~/.julia/packages/Pathogen/39xDw/src/inference/generate.jl:28
┌ Error: All transmission rates = 0.0, No transmission generated
│   external_or_internal =
│    2-element StatsBase.Weights{Float64, Float64, Vector{Float64}}:
│     0.0
│     0.0
└ @ Pathogen ~/.julia/packages/Pathogen/39xDw/src/inference/generate.jl:28
┌ Error: All transmission rates = 0.0, No transmission generated
│   external_or_internal =
│    2-element StatsBase.Weights{Float64, Float64, Vector{Float64}}:
│     0.0
│     0.0
└ @ Pathogen ~/.julia/packages/Pathogen/39xDw/src/inference/generate.jl:28
┌ Error: All transmission rates = 0.0, No transmission generated
│   external_or_internal =
│    2-element StatsBase.Weights{Float64, Float64, Vector{Float64}}:
│     0.0
│     0.0
└ @ Pathogen ~/.julia/packages/Pathogen/39xDw/src/inference/generate.jl:28
┌ Error: All transmission rates = 0.0, No transmission generated
│   external_or_internal =
│    2-element StatsBase.Weights{Float64, Float64, Vector{Float64}}:
│     0.0
│     0.0
└ @ Pathogen ~/.julia/packages/Pathogen/39xDw/src/inference/generate.jl:28
┌ Error: All transmission rates = 0.0, No transmission generated
│   external_or_internal =
│    2-element StatsBase.Weights{Float64, Float64, Vector{Float64}}:
│     0.0
│     0.0
└ @ Pathogen ~/.julia/packages/Pathogen/39xDw/src/inference/generate.jl:28
┌ Error: All transmission rates = 0.0, No transmission generated
│   external_or_internal =
│    2-element StatsBase.Weights{Float64, Float64, Vector{Float64}}:
│     0.0
│     0.0
└ @ Pathogen ~/.julia/packages/Pathogen/39xDw/src/inference/generate.jl:28
┌ Error: All transmission rates = 0.0, No transmission generated
│   external_or_internal =
│    2-element StatsBase.Weights{Float64, Float64, Vector{Float64}}:
│     0.0
│     0.0
└ @ Pathogen ~/.julia/packages/Pathogen/39xDw/src/inference/generate.jl:28
┌ Error: All transmission rates = 0.0, No transmission generated
│   external_or_internal =
│    2-element StatsBase.Weights{Float64, Float64, Vector{Float64}}:
│     0.0
│     0.0
└ @ Pathogen ~/.julia/packages/Pathogen/39xDw/src/inference/generate.jl:28
┌ Error: All transmission rates = 0.0, No transmission generated
│   external_or_internal =
│    2-element StatsBase.Weights{Float64, Float64, Vector{Float64}}:
│     0.0
│     0.0
└ @ Pathogen ~/.julia/packages/Pathogen/39xDw/src/inference/generate.jl:28
┌ Error: All transmission rates = 0.0, No transmission generated
│   external_or_internal =
│    2-element StatsBase.Weights{Float64, Float64, Vector{Float64}}:
│     0.0
│     0.0
└ @ Pathogen ~/.julia/packages/Pathogen/39xDw/src/inference/generate.jl:28
┌ Error: All transmission rates = 0.0, No transmission generated
│   external_or_internal =
│    2-element StatsBase.Weights{Float64, Float64, Vector{Float64}}:
│     0.0
│     0.0
└ @ Pathogen ~/.julia/packages/Pathogen/39xDw/src/inference/generate.jl:28
┌ Error: All transmission rates = 0.0, No transmission generated
│   external_or_internal =
│    2-element StatsBase.Weights{Float64, Float64, Vector{Float64}}:
│     0.0
│     0.0
└ @ Pathogen ~/.julia/packages/Pathogen/39xDw/src/inference/generate.jl:28
┌ Error: All transmission rates = 0.0, No transmission generated
│   external_or_internal =
│    2-element StatsBase.Weights{Float64, Float64, Vector{Float64}}:
│     0.0
│     0.0
└ @ Pathogen ~/.julia/packages/Pathogen/39xDw/src/inference/generate.jl:28
┌ Error: All transmission rates = 0.0, No transmission generated
│   external_or_internal =
│    2-element StatsBase.Weights{Float64, Float64, Vector{Float64}}:
│     0.0
│     0.0
└ @ Pathogen ~/.julia/packages/Pathogen/39xDw/src/inference/generate.jl:28
┌ Error: All transmission rates = 0.0, No transmission generated
│   external_or_internal =
│    2-element StatsBase.Weights{Float64, Float64, Vector{Float64}}:
│     0.0
│     0.0
└ @ Pathogen ~/.julia/packages/Pathogen/39xDw/src/inference/generate.jl:28
┌ Error: All transmission rates = 0.0, No transmission generated
│   external_or_internal =
│    2-element StatsBase.Weights{Float64, Float64, Vector{Float64}}:
│     0.0
│     0.0
└ @ Pathogen ~/.julia/packages/Pathogen/39xDw/src/inference/generate.jl:28
┌ Error: All transmission rates = 0.0, No transmission generated
│   external_or_internal =
│    2-element StatsBase.Weights{Float64, Float64, Vector{Float64}}:
│     0.0
│     0.0
└ @ Pathogen ~/.julia/packages/Pathogen/39xDw/src/inference/generate.jl:28
MCMC progress 61%|███████████████████████▁              |  ETA: 0:00:05[K┌ Error: All transmission rates = 0.0, No transmission generated
│   external_or_internal =
│    2-element StatsBase.Weights{Float64, Float64, Vector{Float64}}:
│     0.0
│     0.0
└ @ Pathogen ~/.julia/packages/Pathogen/39xDw/src/inference/generate.jl:28
┌ Error: All transmission rates = 0.0, No transmission generated
│   external_or_internal =
│    2-element StatsBase.Weights{Float64, Float64, Vector{Float64}}:
│     0.0
│     0.0
└ @ Pathogen ~/.julia/packages/Pathogen/39xDw/src/inference/generate.jl:28
┌ Error: All transmission rates = 0.0, No transmission generated
│   external_or_internal =
│    2-element StatsBase.Weights{Float64, Float64, Vector{Float64}}:
│     0.0
│     0.0
└ @ Pathogen ~/.julia/packages/Pathogen/39xDw/src/inference/generate.jl:28
┌ Error: All transmission rates = 0.0, No transmission generated
│   external_or_internal =
│    2-element StatsBase.Weights{Float64, Float64, Vector{Float64}}:
│     0.0
│     0.0
└ @ Pathogen ~/.julia/packages/Pathogen/39xDw/src/inference/generate.jl:28
┌ Error: All transmission rates = 0.0, No transmission generated
│   external_or_internal =
│    2-element StatsBase.Weights{Float64, Float64, Vector{Float64}}:
│     0.0
│     0.0
└ @ Pathogen ~/.julia/packages/Pathogen/39xDw/src/inference/generate.jl:28
┌ Error: All transmission rates = 0.0, No transmission generated
│   external_or_internal =
│    2-element StatsBase.Weights{Float64, Float64, Vector{Float64}}:
│     0.0
│     0.0
└ @ Pathogen ~/.julia/packages/Pathogen/39xDw/src/inference/generate.jl:28
┌ Error: All transmission rates = 0.0, No transmission generated
│   external_or_internal =
│    2-element StatsBase.Weights{Float64, Float64, Vector{Float64}}:
│     0.0
│     0.0
└ @ Pathogen ~/.julia/packages/Pathogen/39xDw/src/inference/generate.jl:28
┌ Error: All transmission rates = 0.0, No transmission generated
│   external_or_internal =
│    2-element StatsBase.Weights{Float64, Float64, Vector{Float64}}:
│     0.0
│     0.0
└ @ Pathogen ~/.julia/packages/Pathogen/39xDw/src/inference/generate.jl:28
┌ Error: All transmission rates = 0.0, No transmission generated
│   external_or_internal =
│    2-element StatsBase.Weights{Float64, Float64, Vector{Float64}}:
│     0.0
│     0.0
└ @ Pathogen ~/.julia/packages/Pathogen/39xDw/src/inference/generate.jl:28
┌ Error: All transmission rates = 0.0, No transmission generated
│   external_or_internal =
│    2-element StatsBase.Weights{Float64, Float64, Vector{Float64}}:
│     0.0
│     0.0
└ @ Pathogen ~/.julia/packages/Pathogen/39xDw/src/inference/generate.jl:28
┌ Error: All transmission rates = 0.0, No transmission generated
│   external_or_internal =
│    2-element StatsBase.Weights{Float64, Float64, Vector{Float64}}:
│     0.0
│     0.0
└ @ Pathogen ~/.julia/packages/Pathogen/39xDw/src/inference/generate.jl:28
┌ Error: All transmission rates = 0.0, No transmission generated
│   external_or_internal =
│    2-element StatsBase.Weights{Float64, Float64, Vector{Float64}}:
│     0.0
│     0.0
└ @ Pathogen ~/.julia/packages/Pathogen/39xDw/src/inference/generate.jl:28
┌ Error: All transmission rates = 0.0, No transmission generated
│   external_or_internal =
│    2-element StatsBase.Weights{Float64, Float64, Vector{Float64}}:
│     0.0
│     0.0
└ @ Pathogen ~/.julia/packages/Pathogen/39xDw/src/inference/generate.jl:28
┌ Error: All transmission rates = 0.0, No transmission generated
│   external_or_internal =
│    2-element StatsBase.Weights{Float64, Float64, Vector{Float64}}:
│     0.0
│     0.0
└ @ Pathogen ~/.julia/packages/Pathogen/39xDw/src/inference/generate.jl:28
┌ Error: All transmission rates = 0.0, No transmission generated
│   external_or_internal =
│    2-element StatsBase.Weights{Float64, Float64, Vector{Float64}}:
│     0.0
│     0.0
└ @ Pathogen ~/.julia/packages/Pathogen/39xDw/src/inference/generate.jl:28
┌ Error: All transmission rates = 0.0, No transmission generated
│   external_or_internal =
│    2-element StatsBase.Weights{Float64, Float64, Vector{Float64}}:
│     0.0
│     0.0
└ @ Pathogen ~/.julia/packages/Pathogen/39xDw/src/inference/generate.jl:28
MCMC progress 94%|███████████████████████████████████▊  |  ETA: 0:00:01[KMCMC progress100%|██████████████████████████████████████| Time: 0:00:08[K
Test Summary: | Pass  Total
SIR Model     |  166    166
Initialization progress  0%|▁                           |  ETA: 0:36:42[KInitialization progress 36%|██████████                  |  ETA: 0:00:13[KInitialization progress 94%|██████████████████████████▁ |  ETA: 0:00:01[KInitialization progress 97%|███████████████████████████▁|  ETA: 0:00:00[KInitialization progress100%|████████████████████████████| Time: 0:00:07[K
MCMC progress  0%|▁                                     |  ETA: 0:25:07[KMCMC progress 21%|████████                              |  ETA: 0:00:19[KMCMC progress 43%|████████████████▌                     |  ETA: 0:00:07[KMCMC progress 57%|█████████████████████▋                |  ETA: 0:00:04[KMCMC progress 71%|██████████████████████████▉           |  ETA: 0:00:02[KMCMC progress 87%|████████████████████████████████▉     |  ETA: 0:00:01[KMCMC progress 94%|███████████████████████████████████▊  |  ETA: 0:00:00[KMCMC progress 97%|█████████████████████████████████████ |  ETA: 0:00:00[KMCMC progress100%|██████████████████████████████████████| Time: 0:00:06[K
Initialization progress  4%|█▁                          |  ETA: 0:00:30[KInitialization progress100%|████████████████████████████| Time: 0:00:01[K
MCMC progress  1%|▁                                     |  ETA: 0:00:30[KMCMC progress 78%|█████████████████████████████▋        |  ETA: 0:00:00[KMCMC progress100%|██████████████████████████████████████| Time: 0:00:00[K
Test Summary: | Pass  Total
SI Model      |  104    104
     Testing Pathogen tests passed 


################################################################################
# Teardown: 2020-10-28T07:45:55.642
#

CPU usage: 331.67s (301.62s user, 32.05s kernel)

Network usage:
- eth0: 4.715 MiB received, 131.844 KiB sent
