Julia Version 1.4.0-DEV.670
Commit 032dbe33e3 (2019-12-29 22:39 UTC)
Platform Info:
  OS: Linux (x86_64-pc-linux-gnu)
  CPU: Intel(R) Xeon(R) Silver 4114 CPU @ 2.20GHz
  WORD_SIZE: 64
  LIBM: libopenlibm
  LLVM: libLLVM-8.0.1 (ORCJIT, skylake)
Environment:
  JULIA_DEPOT_PATH = ::/usr/local/share/julia

 Resolving package versions...
 Installed Tables ────────────────────── v0.2.11
 Installed FillArrays ────────────────── v0.8.2
 Installed FixedPointNumbers ─────────── v0.7.0
 Installed StatsBase ─────────────────── v0.32.0
 Installed MLJModels ─────────────────── v0.6.1
 Installed CategoricalArrays ─────────── v0.7.5
 Installed PrettyTables ──────────────── v0.6.0
 Installed MLJ ───────────────────────── v0.6.0
 Installed Parsers ───────────────────── v0.3.10
 Installed DocStringExtensions ───────── v0.8.1
 Installed Parameters ────────────────── v0.12.0
 Installed StatsFuns ─────────────────── v0.9.3
 Installed Arpack ────────────────────── v0.4.0
 Installed ComputationalResources ────── v0.3.0
 Installed Distances ─────────────────── v0.8.2
 Installed SpecialFunctions ──────────── v0.9.0
 Installed BinaryProvider ────────────── v0.5.8
 Installed Distributions ─────────────── v0.21.11
 Installed DataValueInterfaces ───────── v1.0.0
 Installed ColorTypes ────────────────── v0.8.1
 Installed OpenBLAS_jll ──────────────── v0.3.7+1
 Installed MultivariateStats ─────────── v0.7.0
 Installed Rmath ─────────────────────── v0.6.0
 Installed QuadGK ────────────────────── v2.3.1
 Installed DataAPI ───────────────────── v1.1.0
 Installed OrderedCollections ────────── v1.1.0
 Installed Missings ──────────────────── v0.4.3
 Installed LossFunctions ─────────────── v0.5.1
 Installed JSON ──────────────────────── v0.21.0
 Installed RecipesBase ───────────────── v0.7.0
 Installed ProgressMeter ─────────────── v1.2.0
 Installed Crayons ───────────────────── v4.0.1
 Installed SortingAlgorithms ─────────── v0.3.1
 Installed InvertedIndices ───────────── v1.0.0
 Installed ScientificTypes ───────────── v0.3.1
 Installed Arpack_jll ────────────────── v3.5.0+2
 Installed OpenSpecFun_jll ───────────── v0.5.3+1
 Installed Requires ──────────────────── v0.5.2
 Installed DataStructures ────────────── v0.17.6
 Installed PDMats ────────────────────── v0.9.10
 Installed Formatting ────────────────── v0.4.1
 Installed LearnBase ─────────────────── v0.2.2
 Installed IteratorInterfaceExtensions ─ v1.0.0
 Installed Reexport ──────────────────── v0.2.0
 Installed Compat ────────────────────── v2.2.0
 Installed TableTraits ───────────────── v1.0.0
 Installed MLJBase ───────────────────── v0.9.1
  Updating `~/.julia/environments/v1.4/Project.toml`
  [add582a8] + MLJ v0.6.0
  Updating `~/.julia/environments/v1.4/Manifest.toml`
  [7d9fca2a] + Arpack v0.4.0
  [68821587] + Arpack_jll v3.5.0+2
  [b99e7846] + BinaryProvider v0.5.8
  [324d7699] + CategoricalArrays v0.7.5
  [3da002f7] + ColorTypes v0.8.1
  [34da2185] + Compat v2.2.0
  [ed09eef8] + ComputationalResources v0.3.0
  [a8cc5b0e] + Crayons v4.0.1
  [9a962f9c] + DataAPI v1.1.0
  [864edb3b] + DataStructures v0.17.6
  [e2d170a0] + DataValueInterfaces v1.0.0
  [b4f34e82] + Distances v0.8.2
  [31c24e10] + Distributions v0.21.11
  [ffbed154] + DocStringExtensions v0.8.1
  [1a297f60] + FillArrays v0.8.2
  [53c48c17] + FixedPointNumbers v0.7.0
  [59287772] + Formatting v0.4.1
  [41ab1584] + InvertedIndices v1.0.0
  [82899510] + IteratorInterfaceExtensions v1.0.0
  [682c06a0] + JSON v0.21.0
  [7f8f8fb0] + LearnBase v0.2.2
  [30fc2ffe] + LossFunctions v0.5.1
  [add582a8] + MLJ v0.6.0
  [a7f614a8] + MLJBase v0.9.1
  [d491faf4] + MLJModels v0.6.1
  [e1d29d7a] + Missings v0.4.3
  [6f286f6a] + MultivariateStats v0.7.0
  [4536629a] + OpenBLAS_jll v0.3.7+1
  [efe28fd5] + OpenSpecFun_jll v0.5.3+1
  [bac558e1] + OrderedCollections v1.1.0
  [90014a1f] + PDMats v0.9.10
  [d96e819e] + Parameters v0.12.0
  [69de0a69] + Parsers v0.3.10
  [08abe8d2] + PrettyTables v0.6.0
  [92933f4c] + ProgressMeter v1.2.0
  [1fd47b50] + QuadGK v2.3.1
  [3cdcf5f2] + RecipesBase v0.7.0
  [189a3867] + Reexport v0.2.0
  [ae029012] + Requires v0.5.2
  [79098fc4] + Rmath v0.6.0
  [321657f4] + ScientificTypes v0.3.1
  [a2af1166] + SortingAlgorithms v0.3.1
  [276daf66] + SpecialFunctions v0.9.0
  [2913bbd2] + StatsBase v0.32.0
  [4c63d2b9] + StatsFuns v0.9.3
  [3783bdb8] + TableTraits v1.0.0
  [bd369af6] + Tables v0.2.11
  [2a0f44e3] + Base64 
  [ade2ca70] + Dates 
  [8bb1440f] + DelimitedFiles 
  [8ba89e20] + Distributed 
  [9fa8497b] + Future 
  [b77e0a4c] + InteractiveUtils 
  [76f85450] + LibGit2 
  [8f399da3] + Libdl 
  [37e2e46d] + LinearAlgebra 
  [56ddb016] + Logging 
  [d6f4376e] + Markdown 
  [a63ad114] + Mmap 
  [44cfe95a] + Pkg 
  [de0858da] + Printf 
  [3fa0cd96] + REPL 
  [9a3f8284] + Random 
  [ea8e919c] + SHA 
  [9e88b42a] + Serialization 
  [1a1011a3] + SharedArrays 
  [6462fe0b] + Sockets 
  [2f01184e] + SparseArrays 
  [10745b16] + Statistics 
  [4607b0f0] + SuiteSparse 
  [8dfed614] + Test 
  [cf7118a7] + UUIDs 
  [4ec0a83e] + Unicode 
  Building Rmath → `~/.julia/packages/Rmath/BoBag/deps/build.log`
  Updating `/tmp/jl_DOtjiP/Project.toml`
 [no changes]
  Updating `/tmp/jl_DOtjiP/Manifest.toml`
 [no changes]
   Testing MLJ
 Installed FileIO ───────────── v1.2.1
 Installed UnicodePlots ─────── v1.1.0
 Installed NearestNeighbors ─── v0.4.4
 Installed DecisionTree ─────── v0.10.0
 Installed FilePathsBase ────── v0.7.0
 Installed TimeZones ────────── v0.10.3
 Installed ScikitLearnBase ──── v0.5.0
 Installed EzXML ────────────── v0.9.5
 Installed WeakRefStrings ───── v0.6.2
 Installed CodecZlib ────────── v0.6.0
 Installed StaticArrays ─────── v0.12.1
 Installed RData ────────────── v0.6.3
 Installed Mocking ──────────── v0.7.0
 Installed PooledArrays ─────── v0.5.3
 Installed TranscodingStreams ─ v0.9.5
 Installed CSV ──────────────── v0.5.21
 Installed DataFrames ───────── v0.20.0
 Installed RDatasets ────────── v0.6.6
  Updating `/tmp/jl_mA3NTA/Project.toml`
  [7806a523] + DecisionTree v0.10.0
  [b8a86587] + NearestNeighbors v0.4.4
  [ce6b1742] + RDatasets v0.6.6
  [b8865327] + UnicodePlots v1.1.0
  Updating `/tmp/jl_mA3NTA/Manifest.toml`
  [336ed68f] + CSV v0.5.21
  [944b1d66] + CodecZlib v0.6.0
  [a93c6f00] + DataFrames v0.20.0
  [7806a523] + DecisionTree v0.10.0
  [8f5d6c58] + EzXML v0.9.5
  [5789e2e9] + FileIO v1.2.1
  [48062228] + FilePathsBase v0.7.0
  [78c3b35d] + Mocking v0.7.0
  [b8a86587] + NearestNeighbors v0.4.4
  [2dfb63ee] + PooledArrays v0.5.3
  [df47a6cb] + RData v0.6.3
  [ce6b1742] + RDatasets v0.6.6
  [6e75b9c4] + ScikitLearnBase v0.5.0
  [90137ffa] + StaticArrays v0.12.1
  [f269a46b] + TimeZones v0.10.3
  [3bb67fe8] + TranscodingStreams v0.9.5
  [b8865327] + UnicodePlots v1.1.0
  [ea10d353] + WeakRefStrings v0.6.2
  Building EzXML ────→ `~/.julia/packages/EzXML/QtGgF/deps/build.log`
  Updating `/tmp/jl_hdtXD0/Project.toml`
 [no changes]
  Updating `/tmp/jl_hdtXD0/Manifest.toml`
 [no changes]
  Building TimeZones → `~/.julia/packages/TimeZones/pjvlM/deps/build.log`
  Updating `/tmp/jl_gdryXb/Project.toml`
 [no changes]
  Updating `/tmp/jl_gdryXb/Manifest.toml`
 [no changes]
  Building CodecZlib → `~/.julia/packages/CodecZlib/5t9zO/deps/build.log`
  Updating `/tmp/jl_5NVfX0/Project.toml`
 [no changes]
  Updating `/tmp/jl_5NVfX0/Manifest.toml`
 [no changes]
Running sandbox
Status `/tmp/jl_mA3NTA/Project.toml`
  [324d7699] CategoricalArrays v0.7.5
  [ed09eef8] ComputationalResources v0.3.0
  [7806a523] DecisionTree v0.10.0
  [31c24e10] Distributions v0.21.11
  [ffbed154] DocStringExtensions v0.8.1
  [30fc2ffe] LossFunctions v0.5.1
  [add582a8] MLJ v0.6.0
  [a7f614a8] MLJBase v0.9.1
  [d491faf4] MLJModels v0.6.1
  [6f286f6a] MultivariateStats v0.7.0
  [b8a86587] NearestNeighbors v0.4.4
  [bac558e1] OrderedCollections v1.1.0
  [08abe8d2] PrettyTables v0.6.0
  [92933f4c] ProgressMeter v1.2.0
  [ce6b1742] RDatasets v0.6.6
  [3cdcf5f2] RecipesBase v0.7.0
  [321657f4] ScientificTypes v0.3.1
  [2913bbd2] StatsBase v0.32.0
  [bd369af6] Tables v0.2.11
  [b8865327] UnicodePlots v1.1.0
  [ade2ca70] Dates 
  [8bb1440f] DelimitedFiles 
  [8ba89e20] Distributed 
  [b77e0a4c] InteractiveUtils 
  [37e2e46d] LinearAlgebra 
  [44cfe95a] Pkg 
  [9a3f8284] Random 
  [10745b16] Statistics 
  [8dfed614] Test 
[ Info: Model metadata loaded from registry. 
Test Summary: | Pass  Total
utilities     |    4      4
Test Summary: | Pass  Total
parameters    |   17     17
Evaluating over 5 folds:  17%[====>                    ]  ETA: 0:00:00[KEvaluating over 5 folds:  33%[========>                ]  ETA: 0:00:05[KEvaluating over 5 folds:  50%[============>            ]  ETA: 0:00:03[KEvaluating over 5 folds:  67%[================>        ]  ETA: 0:00:02[KEvaluating over 5 folds:  83%[====================>    ]  ETA: 0:00:01[KEvaluating over 5 folds: 100%[=========================] Time: 0:00:03[K
┌─────────┬─────────────────────━
│ measure │ measurement         │
├─────────┼─────────────────────┤
│ my_rms  │ 0.6                 │
│ my_mav  │ 0.6                 │
│ rmslp1  │ 0.25095859542946747 │
└─────────┴─────────────────────┘
┌─────────────┬─────────────────────━
│ measure     │ measurement         │
├─────────────┼─────────────────────┤
│ #130#my_rms │ 0.6                 │
│ #131#my_mav │ 0.6                 │
│ rmslp1      │ 0.25095859542946747 │
└─────────────┴─────────────────────┘
Evaluating over 1 folds:  50%[============>            ]  ETA: 0:00:00[KEvaluating over 1 folds: 100%[=========================] Time: 0:00:00[K
┌─────────┬─────────────────────━
│ measure │ measurement         │
├─────────┼─────────────────────┤
│ rms     │ 0.6666666666666667  │
│ rmslp1  │ 0.25131442828090633 │
└─────────┴─────────────────────┘
[ Info: Distributing cross-validation computation among 2 workers.
┌─────────┬─────────────────────━
│ measure │ measurement         │
├─────────┼─────────────────────┤
│ rms     │ 0.6666666666666667  │
│ rmslp1  │ 0.25131442828090633 │
└─────────┴─────────────────────┘
┌─────────┬─────────────────────━
│ measure │ measurement         │
├─────────┼─────────────────────┤
│ rms     │ 0.6666666666666667  │
│ rmslp1  │ 0.25131442828090633 │
└─────────┴─────────────────────┘
Evaluating over 5 folds:  17%[====>                    ]  ETA: 0:00:00[KEvaluating over 5 folds:  33%[========>                ]  ETA: 0:00:00[KEvaluating over 5 folds:  50%[============>            ]  ETA: 0:00:00[KEvaluating over 5 folds:  67%[================>        ]  ETA: 0:00:00[KEvaluating over 5 folds:  83%[====================>    ]  ETA: 0:00:00[KEvaluating over 5 folds: 100%[=========================] Time: 0:00:00[K
┌─────────┬─────────────────────━
│ measure │ measurement         │
├─────────┼─────────────────────┤
│ rms     │ 0.6123724356957945  │
│ rmslp1  │ 0.25095859542946747 │
└─────────┴─────────────────────┘
Evaluating over 6 folds:  14%[===>                     ]  ETA: 0:00:00[KEvaluating over 6 folds:  29%[=======>                 ]  ETA: 0:00:00[KEvaluating over 6 folds:  43%[==========>              ]  ETA: 0:00:00[KEvaluating over 6 folds:  57%[==============>          ]  ETA: 0:00:00[KEvaluating over 6 folds:  71%[=================>       ]  ETA: 0:00:00[KEvaluating over 6 folds:  86%[=====================>   ]  ETA: 0:00:00[KEvaluating over 6 folds: 100%[=========================] Time: 0:00:00[K
[ Info: Distributing cross-validation computation among 2 workers.
┌─────────┬─────────────────────━
│ measure │ measurement         │
├─────────┼─────────────────────┤
│ rms     │ 0.6123724356957945  │
│ rmslp1  │ 0.25095859542946747 │
└─────────┴─────────────────────┘
[ Info: Distributing cross-validation computation among 2 workers.
┌─────────┬─────────────────────━
│ measure │ measurement         │
├─────────┼─────────────────────┤
│ rms     │ 0.6123724356957945  │
│ rmslp1  │ 0.25095859542946747 │
└─────────┴─────────────────────┘
[ Info: Updating [34mMachine{Resampler} @ 1…70[39m.
Evaluating over 1 folds:  50%[============>            ]  ETA: 0:00:00[KEvaluating over 1 folds: 100%[=========================] Time: 0:00:00[K
[ Info: Updating [34mMachine{Resampler} @ 1…36[39m.
Evaluating over 1 folds:  50%[============>            ]  ETA: 0:00:00[KEvaluating over 1 folds: 100%[=========================] Time: 0:00:00[K
Evaluating over 1 folds:  50%[============>            ]  ETA: 0:00:00[KEvaluating over 1 folds: 100%[=========================] Time: 0:00:04[K
[ Info: Distributing cross-validation computation among 2 workers.
┌ Info: A model type "KNNClassifier" is already loaded. 
└ No new code loaded. 
┌ Info: A model type "KNNClassifier" is already loaded. 
└ No new code loaded. 
Evaluating over 1 folds:  50%[============>            ]  ETA: 0:00:00[KEvaluating over 1 folds: 100%[=========================] Time: 0:00:04[K
[ Info: Passing machine sample weights to any supported measures. 
Evaluating over 1 folds:  50%[============>            ]  ETA: 0:00:00[KEvaluating over 1 folds: 100%[=========================] Time: 0:00:01[K
Evaluating over 1 folds:  50%[============>            ]  ETA: 0:00:00[KEvaluating over 1 folds: 100%[=========================] Time: 0:00:00[K
[ Info: Passing machine sample weights to any supported measures. 
Evaluating over 6 folds:  14%[===>                     ]  ETA: 0:00:00[KEvaluating over 6 folds:  29%[=======>                 ]  ETA: 0:00:26[KEvaluating over 6 folds:  43%[==========>              ]  ETA: 0:00:14[KEvaluating over 6 folds:  57%[==============>          ]  ETA: 0:00:08[KEvaluating over 6 folds:  71%[=================>       ]  ETA: 0:00:04[KEvaluating over 6 folds:  86%[=====================>   ]  ETA: 0:00:02[KEvaluating over 6 folds: 100%[=========================] Time: 0:00:10[K
[ Info: Passing machine sample weights to any supported measures. 
[ Info: Creating subsamples from a subset of all rows. 
Evaluating over 6 folds:  14%[===>                     ]  ETA: 0:00:00[KEvaluating over 6 folds:  29%[=======>                 ]  ETA: 0:00:00[KEvaluating over 6 folds:  43%[==========>              ]  ETA: 0:00:00[KEvaluating over 6 folds:  57%[==============>          ]  ETA: 0:00:00[KEvaluating over 6 folds:  71%[=================>       ]  ETA: 0:00:00[KEvaluating over 6 folds:  86%[=====================>   ]  ETA: 0:00:00[KEvaluating over 6 folds: 100%[=========================] Time: 0:00:00[K
[ Info: Training [34mMachine{Resampler} @ 2…11[39m.
[ Info: Passing machine sample weights to any supported measures. 
[ Info: Passing machine sample weights to any supported measures. 
Evaluating over 6 folds:  14%[===>                     ]  ETA: 0:00:00[KEvaluating over 6 folds:  29%[=======>                 ]  ETA: 0:00:00[KEvaluating over 6 folds:  43%[==========>              ]  ETA: 0:00:00[KEvaluating over 6 folds:  57%[==============>          ]  ETA: 0:00:00[KEvaluating over 6 folds:  71%[=================>       ]  ETA: 0:00:00[KEvaluating over 6 folds:  86%[=====================>   ]  ETA: 0:00:00[KEvaluating over 6 folds: 100%[=========================] Time: 0:00:00[K
[ Info: Training [34mMachine{Resampler} @ 4…12[39m.
Evaluating over 6 folds:  14%[===>                     ]  ETA: 0:00:00[KEvaluating over 6 folds:  29%[=======>                 ]  ETA: 0:00:00[KEvaluating over 6 folds:  43%[==========>              ]  ETA: 0:00:00[KEvaluating over 6 folds:  57%[==============>          ]  ETA: 0:00:00[KEvaluating over 6 folds:  71%[=================>       ]  ETA: 0:00:00[KEvaluating over 6 folds:  86%[=====================>   ]  ETA: 0:00:00[KEvaluating over 6 folds: 100%[=========================] Time: 0:00:00[K
[ Info: Distributing cross-validation computation among 2 workers.
[ Info: Passing machine sample weights to any supported measures. 
[ Info: Distributing cross-validation computation among 2 workers.
[ Info: Distributing cross-validation computation among 2 workers.
[ Info: Passing machine sample weights to any supported measures. 
[ Info: Distributing cross-validation computation among 2 workers.
[ Info: Passing machine sample weights to any supported measures. 
[ Info: Creating subsamples from a subset of all rows. 
[ Info: Distributing cross-validation computation among 2 workers.
[ Info: Training [34mMachine{Resampler} @ 1…59[39m.
[ Info: Passing machine sample weights to any supported measures. 
[ Info: Passing machine sample weights to any supported measures. 
[ Info: Distributing cross-validation computation among 2 workers.
[ Info: Training [34mMachine{Resampler} @ 2…57[39m.
[ Info: Distributing cross-validation computation among 2 workers.
[ Info: Passing machine sample weights to any supported measures. 
[ Info: Passing machine sample weights to any supported measures. 
[ Info: Passing machine sample weights to any supported measures. 
[ Info: Creating subsamples from a subset of all rows. 
[ Info: Training [34mMachine{Resampler} @ 6…27[39m.
[ Info: Passing machine sample weights to any supported measures. 
[ Info: Passing machine sample weights to any supported measures. 
[ Info: Training [34mMachine{Resampler} @ 1…94[39m.
Test Summary: | Pass  Broken  Total
resampling    |  102       2    104
[ Info: Training [34mMachine{DeterministicTunedModel} @ 2…67[39m.
[ Info: Mimimizing rms. 
Iterating over a 40-point grid:   2%[>                        ]  ETA: 0:00:00[KIterating over a 40-point grid:   7%[=>                       ]  ETA: 0:02:07[KIterating over a 40-point grid:  10%[==>                      ]  ETA: 0:01:51[KIterating over a 40-point grid:  12%[===>                     ]  ETA: 0:01:31[KIterating over a 40-point grid:  15%[===>                     ]  ETA: 0:01:15[KIterating over a 40-point grid:  17%[====>                    ]  ETA: 0:01:02[KIterating over a 40-point grid:  20%[====>                    ]  ETA: 0:00:53[KIterating over a 40-point grid:  22%[=====>                   ]  ETA: 0:00:45[KIterating over a 40-point grid:  24%[======>                  ]  ETA: 0:00:40[KIterating over a 40-point grid:  27%[======>                  ]  ETA: 0:00:35[KIterating over a 40-point grid:  29%[=======>                 ]  ETA: 0:00:31[KIterating over a 40-point grid:  32%[=======>                 ]  ETA: 0:00:28[KIterating over a 40-point grid:  34%[========>                ]  ETA: 0:00:25[KIterating over a 40-point grid:  37%[=========>               ]  ETA: 0:00:22[KIterating over a 40-point grid:  39%[=========>               ]  ETA: 0:00:20[KIterating over a 40-point grid:  41%[==========>              ]  ETA: 0:00:18[KIterating over a 40-point grid:  44%[==========>              ]  ETA: 0:00:16[KIterating over a 40-point grid:  46%[===========>             ]  ETA: 0:00:15[KIterating over a 40-point grid:  49%[============>            ]  ETA: 0:00:13[KIterating over a 40-point grid:  51%[============>            ]  ETA: 0:00:12[KIterating over a 40-point grid:  54%[=============>           ]  ETA: 0:00:11[KIterating over a 40-point grid:  56%[==============>          ]  ETA: 0:00:10[KIterating over a 40-point grid:  59%[==============>          ]  ETA: 0:00:09[KIterating over a 40-point grid:  61%[===============>         ]  ETA: 0:00:08[KIterating over a 40-point grid:  63%[===============>         ]  ETA: 0:00:07[KIterating over a 40-point grid:  66%[================>        ]  ETA: 0:00:07[KIterating over a 40-point grid:  68%[=================>       ]  ETA: 0:00:06[KIterating over a 40-point grid:  71%[=================>       ]  ETA: 0:00:05[KIterating over a 40-point grid:  73%[==================>      ]  ETA: 0:00:05[KIterating over a 40-point grid:  76%[==================>      ]  ETA: 0:00:04[KIterating over a 40-point grid:  78%[===================>     ]  ETA: 0:00:04[KIterating over a 40-point grid:  80%[====================>    ]  ETA: 0:00:03[KIterating over a 40-point grid:  83%[====================>    ]  ETA: 0:00:03[KIterating over a 40-point grid:  85%[=====================>   ]  ETA: 0:00:02[KIterating over a 40-point grid:  88%[=====================>   ]  ETA: 0:00:02[KIterating over a 40-point grid:  90%[======================>  ]  ETA: 0:00:01[KIterating over a 40-point grid:  93%[=======================> ]  ETA: 0:00:01[KIterating over a 40-point grid:  95%[=======================> ]  ETA: 0:00:01[KIterating over a 40-point grid:  98%[========================>]  ETA: 0:00:00[KIterating over a 40-point grid: 100%[=========================] Time: 0:00:12[K
[ Info: Training best model on all supplied data.
[ Info: Updating [34mMachine{DeterministicTunedModel} @ 2…67[39m.
[ Info: Mimimizing rms. 
Iterating over a 40-point grid:   2%[>                        ]  ETA: 0:00:00[KIterating over a 40-point grid:   7%[=>                       ]  ETA: 0:00:00[KIterating over a 40-point grid:  10%[==>                      ]  ETA: 0:00:00[KIterating over a 40-point grid:  12%[===>                     ]  ETA: 0:00:00[KIterating over a 40-point grid:  15%[===>                     ]  ETA: 0:00:00[KIterating over a 40-point grid:  17%[====>                    ]  ETA: 0:00:00[KIterating over a 40-point grid:  20%[====>                    ]  ETA: 0:00:00[KIterating over a 40-point grid:  22%[=====>                   ]  ETA: 0:00:00[KIterating over a 40-point grid:  24%[======>                  ]  ETA: 0:00:00[KIterating over a 40-point grid:  27%[======>                  ]  ETA: 0:00:00[KIterating over a 40-point grid:  29%[=======>                 ]  ETA: 0:00:00[KIterating over a 40-point grid:  32%[=======>                 ]  ETA: 0:00:00[KIterating over a 40-point grid:  34%[========>                ]  ETA: 0:00:00[KIterating over a 40-point grid:  37%[=========>               ]  ETA: 0:00:00[KIterating over a 40-point grid:  39%[=========>               ]  ETA: 0:00:00[KIterating over a 40-point grid:  41%[==========>              ]  ETA: 0:00:00[KIterating over a 40-point grid:  44%[==========>              ]  ETA: 0:00:00[KIterating over a 40-point grid:  46%[===========>             ]  ETA: 0:00:00[KIterating over a 40-point grid:  49%[============>            ]  ETA: 0:00:00[KIterating over a 40-point grid:  51%[============>            ]  ETA: 0:00:00[KIterating over a 40-point grid:  54%[=============>           ]  ETA: 0:00:00[KIterating over a 40-point grid:  56%[==============>          ]  ETA: 0:00:00[KIterating over a 40-point grid:  59%[==============>          ]  ETA: 0:00:00[KIterating over a 40-point grid:  61%[===============>         ]  ETA: 0:00:00[KIterating over a 40-point grid:  63%[===============>         ]  ETA: 0:00:00[KIterating over a 40-point grid:  66%[================>        ]  ETA: 0:00:00[KIterating over a 40-point grid:  68%[=================>       ]  ETA: 0:00:00[KIterating over a 40-point grid:  71%[=================>       ]  ETA: 0:00:00[KIterating over a 40-point grid:  73%[==================>      ]  ETA: 0:00:00[KIterating over a 40-point grid:  76%[==================>      ]  ETA: 0:00:00[KIterating over a 40-point grid:  78%[===================>     ]  ETA: 0:00:00[KIterating over a 40-point grid:  80%[====================>    ]  ETA: 0:00:00[KIterating over a 40-point grid:  83%[====================>    ]  ETA: 0:00:00[KIterating over a 40-point grid:  85%[=====================>   ]  ETA: 0:00:00[KIterating over a 40-point grid:  88%[=====================>   ]  ETA: 0:00:00[KIterating over a 40-point grid:  90%[======================>  ]  ETA: 0:00:00[KIterating over a 40-point grid:  93%[=======================> ]  ETA: 0:00:00[KIterating over a 40-point grid:  95%[=======================> ]  ETA: 0:00:00[KIterating over a 40-point grid:  98%[========================>]  ETA: 0:00:00[KIterating over a 40-point grid: 100%[=========================] Time: 0:00:00[K
[ Info: Training best model on all supplied data.
[ Info: Updating [34mMachine{DeterministicTunedModel} @ 2…67[39m.
[ Info: Mimimizing rms. 
Iterating over a 40-point grid:   2%[>                        ]  ETA: 0:00:00[KIterating over a 40-point grid:   7%[=>                       ]  ETA: 0:00:05[KIterating over a 40-point grid:  10%[==>                      ]  ETA: 0:00:03[KIterating over a 40-point grid:  12%[===>                     ]  ETA: 0:00:03[KIterating over a 40-point grid:  15%[===>                     ]  ETA: 0:00:02[KIterating over a 40-point grid:  17%[====>                    ]  ETA: 0:00:02[KIterating over a 40-point grid:  20%[====>                    ]  ETA: 0:00:02[KIterating over a 40-point grid:  22%[=====>                   ]  ETA: 0:00:01[KIterating over a 40-point grid:  24%[======>                  ]  ETA: 0:00:01[KIterating over a 40-point grid:  27%[======>                  ]  ETA: 0:00:01[KIterating over a 40-point grid:  29%[=======>                 ]  ETA: 0:00:01[KIterating over a 40-point grid:  32%[=======>                 ]  ETA: 0:00:01[KIterating over a 40-point grid:  34%[========>                ]  ETA: 0:00:01[KIterating over a 40-point grid:  37%[=========>               ]  ETA: 0:00:01[KIterating over a 40-point grid:  39%[=========>               ]  ETA: 0:00:01[KIterating over a 40-point grid:  41%[==========>              ]  ETA: 0:00:01[KIterating over a 40-point grid:  44%[==========>              ]  ETA: 0:00:00[KIterating over a 40-point grid:  46%[===========>             ]  ETA: 0:00:00[KIterating over a 40-point grid:  49%[============>            ]  ETA: 0:00:00[KIterating over a 40-point grid:  51%[============>            ]  ETA: 0:00:00[KIterating over a 40-point grid:  54%[=============>           ]  ETA: 0:00:00[KIterating over a 40-point grid:  56%[==============>          ]  ETA: 0:00:00[KIterating over a 40-point grid:  59%[==============>          ]  ETA: 0:00:00[KIterating over a 40-point grid:  61%[===============>         ]  ETA: 0:00:00[KIterating over a 40-point grid:  63%[===============>         ]  ETA: 0:00:00[KIterating over a 40-point grid:  66%[================>        ]  ETA: 0:00:00[KIterating over a 40-point grid:  68%[=================>       ]  ETA: 0:00:00[KIterating over a 40-point grid:  71%[=================>       ]  ETA: 0:00:00[KIterating over a 40-point grid:  73%[==================>      ]  ETA: 0:00:00[KIterating over a 40-point grid:  76%[==================>      ]  ETA: 0:00:00[KIterating over a 40-point grid:  78%[===================>     ]  ETA: 0:00:00[KIterating over a 40-point grid:  80%[====================>    ]  ETA: 0:00:00[KIterating over a 40-point grid:  83%[====================>    ]  ETA: 0:00:00[KIterating over a 40-point grid:  85%[=====================>   ]  ETA: 0:00:00[KIterating over a 40-point grid:  88%[=====================>   ]  ETA: 0:00:00[KIterating over a 40-point grid:  90%[======================>  ]  ETA: 0:00:00[KIterating over a 40-point grid:  93%[=======================> ]  ETA: 0:00:00[KIterating over a 40-point grid:  95%[=======================> ]  ETA: 0:00:00[KIterating over a 40-point grid:  98%[========================>]  ETA: 0:00:00[KIterating over a 40-point grid: 100%[=========================] Time: 0:00:00[K
[ Info: Training best model on all supplied data.
┌ Info: A model type "KNNRegressor" is already loaded. 
└ No new code loaded. 
[ Info: Training [34mMachine{DeterministicTunedModel} @ 8…85[39m.
[ Info: Mimimizing rms. 
Iterating over a 72-point grid:   1%[>                        ]  ETA: 0:00:00[KIterating over a 72-point grid:   4%[=>                       ]  ETA: 0:04:46[KIterating over a 72-point grid:   5%[=>                       ]  ETA: 0:04:19[KIterating over a 72-point grid:   7%[=>                       ]  ETA: 0:03:25[KIterating over a 72-point grid:   8%[==>                      ]  ETA: 0:02:49[KIterating over a 72-point grid:  10%[==>                      ]  ETA: 0:02:23[KIterating over a 72-point grid:  11%[==>                      ]  ETA: 0:02:03[KIterating over a 72-point grid:  12%[===>                     ]  ETA: 0:01:48[KIterating over a 72-point grid:  14%[===>                     ]  ETA: 0:01:36[KIterating over a 72-point grid:  15%[===>                     ]  ETA: 0:01:26[KIterating over a 72-point grid:  16%[====>                    ]  ETA: 0:01:18[KIterating over a 72-point grid:  18%[====>                    ]  ETA: 0:01:11[KIterating over a 72-point grid:  19%[====>                    ]  ETA: 0:01:05[KIterating over a 72-point grid:  21%[=====>                   ]  ETA: 0:01:00[KIterating over a 72-point grid:  22%[=====>                   ]  ETA: 0:00:55[KIterating over a 72-point grid:  23%[=====>                   ]  ETA: 0:00:51[KIterating over a 72-point grid:  25%[======>                  ]  ETA: 0:00:48[KIterating over a 72-point grid:  26%[======>                  ]  ETA: 0:00:44[KIterating over a 72-point grid:  27%[======>                  ]  ETA: 0:00:41[KIterating over a 72-point grid:  29%[=======>                 ]  ETA: 0:00:39[KIterating over a 72-point grid:  30%[=======>                 ]  ETA: 0:00:36[KIterating over a 72-point grid:  32%[=======>                 ]  ETA: 0:00:34[KIterating over a 72-point grid:  33%[========>                ]  ETA: 0:00:32[KIterating over a 72-point grid:  34%[========>                ]  ETA: 0:00:30[KIterating over a 72-point grid:  36%[========>                ]  ETA: 0:00:29[KIterating over a 72-point grid:  37%[=========>               ]  ETA: 0:00:27[KIterating over a 72-point grid:  38%[=========>               ]  ETA: 0:00:26[KIterating over a 72-point grid:  40%[=========>               ]  ETA: 0:00:24[KIterating over a 72-point grid:  41%[==========>              ]  ETA: 0:00:23[KIterating over a 72-point grid:  42%[==========>              ]  ETA: 0:00:22[KIterating over a 72-point grid:  44%[==========>              ]  ETA: 0:00:21[KIterating over a 72-point grid:  45%[===========>             ]  ETA: 0:00:20[KIterating over a 72-point grid:  47%[===========>             ]  ETA: 0:00:19[KIterating over a 72-point grid:  48%[===========>             ]  ETA: 0:00:18[KIterating over a 72-point grid:  49%[============>            ]  ETA: 0:00:17[KIterating over a 72-point grid:  51%[============>            ]  ETA: 0:00:16[KIterating over a 72-point grid:  52%[=============>           ]  ETA: 0:00:15[KIterating over a 72-point grid:  53%[=============>           ]  ETA: 0:00:14[KIterating over a 72-point grid:  55%[=============>           ]  ETA: 0:00:14[KIterating over a 72-point grid:  56%[==============>          ]  ETA: 0:00:13[KIterating over a 72-point grid:  58%[==============>          ]  ETA: 0:00:12[KIterating over a 72-point grid:  59%[==============>          ]  ETA: 0:00:12[KIterating over a 72-point grid:  60%[===============>         ]  ETA: 0:00:11[KIterating over a 72-point grid:  62%[===============>         ]  ETA: 0:00:10[KIterating over a 72-point grid:  63%[===============>         ]  ETA: 0:00:10[KIterating over a 72-point grid:  64%[================>        ]  ETA: 0:00:09[KIterating over a 72-point grid:  66%[================>        ]  ETA: 0:00:09[KIterating over a 72-point grid:  67%[================>        ]  ETA: 0:00:08[KIterating over a 72-point grid:  68%[=================>       ]  ETA: 0:00:08[KIterating over a 72-point grid:  70%[=================>       ]  ETA: 0:00:07[KIterating over a 72-point grid:  71%[=================>       ]  ETA: 0:00:07[KIterating over a 72-point grid:  73%[==================>      ]  ETA: 0:00:06[KIterating over a 72-point grid:  74%[==================>      ]  ETA: 0:00:06[KIterating over a 72-point grid:  75%[==================>      ]  ETA: 0:00:06[KIterating over a 72-point grid:  77%[===================>     ]  ETA: 0:00:05[KIterating over a 72-point grid:  78%[===================>     ]  ETA: 0:00:05[KIterating over a 72-point grid:  79%[===================>     ]  ETA: 0:00:04[KIterating over a 72-point grid:  81%[====================>    ]  ETA: 0:00:04[KIterating over a 72-point grid:  82%[====================>    ]  ETA: 0:00:04[KIterating over a 72-point grid:  84%[====================>    ]  ETA: 0:00:03[KIterating over a 72-point grid:  85%[=====================>   ]  ETA: 0:00:03[KIterating over a 72-point grid:  86%[=====================>   ]  ETA: 0:00:03[KIterating over a 72-point grid:  88%[=====================>   ]  ETA: 0:00:03[KIterating over a 72-point grid:  89%[======================>  ]  ETA: 0:00:02[KIterating over a 72-point grid:  90%[======================>  ]  ETA: 0:00:02[KIterating over a 72-point grid:  92%[======================>  ]  ETA: 0:00:02[KIterating over a 72-point grid:  93%[=======================> ]  ETA: 0:00:01[KIterating over a 72-point grid:  95%[=======================> ]  ETA: 0:00:01[KIterating over a 72-point grid:  96%[=======================> ]  ETA: 0:00:01[KIterating over a 72-point grid:  97%[========================>]  ETA: 0:00:01[KIterating over a 72-point grid:  99%[========================>]  ETA: 0:00:00[KIterating over a 72-point grid: 100%[=========================] Time: 0:00:18[K
[ Info: Training best model on all supplied data.
[ Info: Updating [34mMachine{DeterministicTunedModel} @ 8…85[39m.
[ Info: Mimimizing rms. 
Iterating over a 56-point grid:   2%[>                        ]  ETA: 0:00:00[KIterating over a 56-point grid:   5%[=>                       ]  ETA: 0:00:01[KIterating over a 56-point grid:   7%[=>                       ]  ETA: 0:00:01[KIterating over a 56-point grid:   9%[==>                      ]  ETA: 0:00:01[KIterating over a 56-point grid:  11%[==>                      ]  ETA: 0:00:01[KIterating over a 56-point grid:  12%[===>                     ]  ETA: 0:00:01[KIterating over a 56-point grid:  14%[===>                     ]  ETA: 0:00:01[KIterating over a 56-point grid:  16%[===>                     ]  ETA: 0:00:01[KIterating over a 56-point grid:  18%[====>                    ]  ETA: 0:00:01[KIterating over a 56-point grid:  19%[====>                    ]  ETA: 0:00:01[KIterating over a 56-point grid:  21%[=====>                   ]  ETA: 0:00:01[KIterating over a 56-point grid:  23%[=====>                   ]  ETA: 0:00:01[KIterating over a 56-point grid:  25%[======>                  ]  ETA: 0:00:01[KIterating over a 56-point grid:  26%[======>                  ]  ETA: 0:00:01[KIterating over a 56-point grid:  28%[=======>                 ]  ETA: 0:00:02[KIterating over a 56-point grid:  30%[=======>                 ]  ETA: 0:00:02[KIterating over a 56-point grid:  32%[=======>                 ]  ETA: 0:00:01[KIterating over a 56-point grid:  33%[========>                ]  ETA: 0:00:01[KIterating over a 56-point grid:  35%[========>                ]  ETA: 0:00:01[KIterating over a 56-point grid:  37%[=========>               ]  ETA: 0:00:01[KIterating over a 56-point grid:  39%[=========>               ]  ETA: 0:00:01[KIterating over a 56-point grid:  40%[==========>              ]  ETA: 0:00:01[KIterating over a 56-point grid:  42%[==========>              ]  ETA: 0:00:01[KIterating over a 56-point grid:  44%[==========>              ]  ETA: 0:00:01[KIterating over a 56-point grid:  46%[===========>             ]  ETA: 0:00:01[KIterating over a 56-point grid:  47%[===========>             ]  ETA: 0:00:01[KIterating over a 56-point grid:  49%[============>            ]  ETA: 0:00:01[KIterating over a 56-point grid:  51%[============>            ]  ETA: 0:00:01[KIterating over a 56-point grid:  53%[=============>           ]  ETA: 0:00:01[KIterating over a 56-point grid:  54%[=============>           ]  ETA: 0:00:01[KIterating over a 56-point grid:  56%[==============>          ]  ETA: 0:00:01[KIterating over a 56-point grid:  58%[==============>          ]  ETA: 0:00:01[KIterating over a 56-point grid:  60%[==============>          ]  ETA: 0:00:01[KIterating over a 56-point grid:  61%[===============>         ]  ETA: 0:00:01[KIterating over a 56-point grid:  63%[===============>         ]  ETA: 0:00:01[KIterating over a 56-point grid:  65%[================>        ]  ETA: 0:00:01[KIterating over a 56-point grid:  67%[================>        ]  ETA: 0:00:01[KIterating over a 56-point grid:  68%[=================>       ]  ETA: 0:00:01[KIterating over a 56-point grid:  70%[=================>       ]  ETA: 0:00:01[KIterating over a 56-point grid:  72%[=================>       ]  ETA: 0:00:01[KIterating over a 56-point grid:  74%[==================>      ]  ETA: 0:00:01[KIterating over a 56-point grid:  75%[==================>      ]  ETA: 0:00:01[KIterating over a 56-point grid:  77%[===================>     ]  ETA: 0:00:01[KIterating over a 56-point grid:  79%[===================>     ]  ETA: 0:00:01[KIterating over a 56-point grid:  81%[====================>    ]  ETA: 0:00:00[KIterating over a 56-point grid:  82%[====================>    ]  ETA: 0:00:00[KIterating over a 56-point grid:  84%[=====================>   ]  ETA: 0:00:00[KIterating over a 56-point grid:  86%[=====================>   ]  ETA: 0:00:00[KIterating over a 56-point grid:  88%[=====================>   ]  ETA: 0:00:00[KIterating over a 56-point grid:  89%[======================>  ]  ETA: 0:00:00[KIterating over a 56-point grid:  91%[======================>  ]  ETA: 0:00:00[KIterating over a 56-point grid:  93%[=======================> ]  ETA: 0:00:00[KIterating over a 56-point grid:  95%[=======================> ]  ETA: 0:00:00[KIterating over a 56-point grid:  96%[========================>]  ETA: 0:00:00[KIterating over a 56-point grid:  98%[========================>]  ETA: 0:00:00[KIterating over a 56-point grid: 100%[=========================] Time: 0:00:02[K
[ Info: Training best model on all supplied data.
[ Info: Updating [34mMachine{DeterministicTunedModel} @ 8…85[39m.
┌ Warning: No resolution specified for forest.bagging_fraction. Will use a value of 5. 
└ @ MLJ ~/.julia/packages/MLJ/kNhIh/src/tuning.jl:189
[ Info: Mimimizing rms. 
Iterating over a 60-point grid:   2%[>                        ]  ETA: 0:00:00[KIterating over a 60-point grid:   5%[=>                       ]  ETA: 0:00:01[KIterating over a 60-point grid:   7%[=>                       ]  ETA: 0:00:01[KIterating over a 60-point grid:   8%[==>                      ]  ETA: 0:00:01[KIterating over a 60-point grid:  10%[==>                      ]  ETA: 0:00:01[KIterating over a 60-point grid:  11%[==>                      ]  ETA: 0:00:01[KIterating over a 60-point grid:  13%[===>                     ]  ETA: 0:00:01[KIterating over a 60-point grid:  15%[===>                     ]  ETA: 0:00:01[KIterating over a 60-point grid:  16%[====>                    ]  ETA: 0:00:01[KIterating over a 60-point grid:  18%[====>                    ]  ETA: 0:00:01[KIterating over a 60-point grid:  20%[====>                    ]  ETA: 0:00:01[KIterating over a 60-point grid:  21%[=====>                   ]  ETA: 0:00:01[KIterating over a 60-point grid:  23%[=====>                   ]  ETA: 0:00:02[KIterating over a 60-point grid:  25%[======>                  ]  ETA: 0:00:01[KIterating over a 60-point grid:  26%[======>                  ]  ETA: 0:00:01[KIterating over a 60-point grid:  28%[======>                  ]  ETA: 0:00:01[KIterating over a 60-point grid:  30%[=======>                 ]  ETA: 0:00:01[KIterating over a 60-point grid:  31%[=======>                 ]  ETA: 0:00:01[KIterating over a 60-point grid:  33%[========>                ]  ETA: 0:00:01[KIterating over a 60-point grid:  34%[========>                ]  ETA: 0:00:01[KIterating over a 60-point grid:  36%[=========>               ]  ETA: 0:00:01[KIterating over a 60-point grid:  38%[=========>               ]  ETA: 0:00:01[KIterating over a 60-point grid:  39%[=========>               ]  ETA: 0:00:01[KIterating over a 60-point grid:  41%[==========>              ]  ETA: 0:00:01[KIterating over a 60-point grid:  43%[==========>              ]  ETA: 0:00:01[KIterating over a 60-point grid:  44%[===========>             ]  ETA: 0:00:01[KIterating over a 60-point grid:  46%[===========>             ]  ETA: 0:00:01[KIterating over a 60-point grid:  48%[===========>             ]  ETA: 0:00:01[KIterating over a 60-point grid:  49%[============>            ]  ETA: 0:00:01[KIterating over a 60-point grid:  51%[============>            ]  ETA: 0:00:01[KIterating over a 60-point grid:  52%[=============>           ]  ETA: 0:00:01[KIterating over a 60-point grid:  54%[=============>           ]  ETA: 0:00:01[KIterating over a 60-point grid:  56%[=============>           ]  ETA: 0:00:01[KIterating over a 60-point grid:  57%[==============>          ]  ETA: 0:00:01[KIterating over a 60-point grid:  59%[==============>          ]  ETA: 0:00:01[KIterating over a 60-point grid:  61%[===============>         ]  ETA: 0:00:01[KIterating over a 60-point grid:  62%[===============>         ]  ETA: 0:00:01[KIterating over a 60-point grid:  64%[===============>         ]  ETA: 0:00:01[KIterating over a 60-point grid:  66%[================>        ]  ETA: 0:00:01[KIterating over a 60-point grid:  67%[================>        ]  ETA: 0:00:01[KIterating over a 60-point grid:  69%[=================>       ]  ETA: 0:00:01[KIterating over a 60-point grid:  70%[=================>       ]  ETA: 0:00:01[KIterating over a 60-point grid:  72%[==================>      ]  ETA: 0:00:01[KIterating over a 60-point grid:  74%[==================>      ]  ETA: 0:00:01[KIterating over a 60-point grid:  75%[==================>      ]  ETA: 0:00:01[KIterating over a 60-point grid:  77%[===================>     ]  ETA: 0:00:01[KIterating over a 60-point grid:  79%[===================>     ]  ETA: 0:00:00[KIterating over a 60-point grid:  80%[====================>    ]  ETA: 0:00:00[KIterating over a 60-point grid:  82%[====================>    ]  ETA: 0:00:00[KIterating over a 60-point grid:  84%[====================>    ]  ETA: 0:00:00[KIterating over a 60-point grid:  85%[=====================>   ]  ETA: 0:00:00[KIterating over a 60-point grid:  87%[=====================>   ]  ETA: 0:00:00[KIterating over a 60-point grid:  89%[======================>  ]  ETA: 0:00:00[KIterating over a 60-point grid:  90%[======================>  ]  ETA: 0:00:00[KIterating over a 60-point grid:  92%[======================>  ]  ETA: 0:00:00[KIterating over a 60-point grid:  93%[=======================> ]  ETA: 0:00:00[KIterating over a 60-point grid:  95%[=======================> ]  ETA: 0:00:00[KIterating over a 60-point grid:  97%[========================>]  ETA: 0:00:00[KIterating over a 60-point grid:  98%[========================>]  ETA: 0:00:00[KIterating over a 60-point grid: 100%[=========================] Time: 0:00:02[K
[ Info: Training best model on all supplied data.
┌ Warning: No measure specified. Setting measure=rms. 
└ @ MLJBase ~/.julia/packages/MLJBase/oMxBY/src/machines.jl:155
[ Info: Training [34mMachine{DeterministicTunedModel} @ 5…07[39m.
[ Info: Mimimizing rms. 
Iterating over a 10-point grid:   9%[==>                      ]  ETA: 0:00:00[KIterating over a 10-point grid:  27%[======>                  ]  ETA: 0:00:04[KIterating over a 10-point grid:  36%[=========>               ]  ETA: 0:00:03[KIterating over a 10-point grid:  45%[===========>             ]  ETA: 0:00:02[KIterating over a 10-point grid:  55%[=============>           ]  ETA: 0:00:01[KIterating over a 10-point grid:  64%[===============>         ]  ETA: 0:00:01[KIterating over a 10-point grid:  73%[==================>      ]  ETA: 0:00:01[KIterating over a 10-point grid:  82%[====================>    ]  ETA: 0:00:00[KIterating over a 10-point grid:  91%[======================>  ]  ETA: 0:00:00[KIterating over a 10-point grid: 100%[=========================] Time: 0:00:01[K
[ Info: Training best model on all supplied data.
[ Info: Training [34mMachine{DeterministicTunedModel} @ 1…09[39m.
[ Info: Mimimizing rms. 
atom.K=3 	bagging_fraction=0.4 	measurement=0.2973770670340338
atom.K=4 	bagging_fraction=0.4 	measurement=0.29487431347616055
atom.K=3 	bagging_fraction=0.7 	measurement=0.3053084971552806
atom.K=4 	bagging_fraction=0.7 	measurement=0.3007352876810562
atom.K=3 	bagging_fraction=1.0 	measurement=0.322315125056536
atom.K=4 	bagging_fraction=1.0 	measurement=0.31259942522260187
[ Info: Training best model on all supplied data.
[ Info: Training [34mMachine{DeterministicEnsembleModel{KNNRegressor}} @ 1…64[39m.

[ Info: Training [34mMachine{ProbabilisticTunedModel} @ 1…48[39m.
[ Info: Maximizing BrierScore(UnivariateFinite). 
Iterating over a 10-point grid:   9%[==>                      ]  ETA: 0:00:00[KIterating over a 10-point grid:  27%[======>                  ]  ETA: 0:00:07[KIterating over a 10-point grid:  36%[=========>               ]  ETA: 0:00:05[KIterating over a 10-point grid:  45%[===========>             ]  ETA: 0:00:04[KIterating over a 10-point grid:  55%[=============>           ]  ETA: 0:00:02[KIterating over a 10-point grid:  64%[===============>         ]  ETA: 0:00:02[KIterating over a 10-point grid:  73%[==================>      ]  ETA: 0:00:01[KIterating over a 10-point grid:  82%[====================>    ]  ETA: 0:00:01[KIterating over a 10-point grid:  91%[======================>  ]  ETA: 0:00:00[KIterating over a 10-point grid: 100%[=========================] Time: 0:00:03[K
[ Info: Training best model on all supplied data.
[ Info: Training [34mMachine{ProbabilisticTunedModel} @ 1…34[39m.
[ Info: Maximizing BrierScore(UnivariateFinite). 
Iterating over a 10-point grid:   9%[==>                      ]  ETA: 0:00:00[KIterating over a 10-point grid:  27%[======>                  ]  ETA: 0:00:03[KIterating over a 10-point grid:  36%[=========>               ]  ETA: 0:00:02[KIterating over a 10-point grid:  45%[===========>             ]  ETA: 0:00:01[KIterating over a 10-point grid:  55%[=============>           ]  ETA: 0:00:01[KIterating over a 10-point grid:  64%[===============>         ]  ETA: 0:00:01[KIterating over a 10-point grid:  73%[==================>      ]  ETA: 0:00:00[KIterating over a 10-point grid:  82%[====================>    ]  ETA: 0:00:00[KIterating over a 10-point grid:  91%[======================>  ]  ETA: 0:00:00[KIterating over a 10-point grid: 100%[=========================] Time: 0:00:01[K
[ Info: Training best model on all supplied data.
[ Info: Training [34mMachine{ProbabilisticTunedModel} @ 1…78[39m.
[ Info: Maximizing BrierScore(UnivariateFinite). 
Iterating over a 10-point grid:   9%[==>                      ]  ETA: 0:00:00[KIterating over a 10-point grid:  27%[======>                  ]  ETA: 0:00:00[KIterating over a 10-point grid:  36%[=========>               ]  ETA: 0:00:00[KIterating over a 10-point grid:  45%[===========>             ]  ETA: 0:00:00[KIterating over a 10-point grid:  55%[=============>           ]  ETA: 0:00:00[KIterating over a 10-point grid:  64%[===============>         ]  ETA: 0:00:00[KIterating over a 10-point grid:  73%[==================>      ]  ETA: 0:00:00[KIterating over a 10-point grid:  82%[====================>    ]  ETA: 0:00:00[KIterating over a 10-point grid:  91%[======================>  ]  ETA: 0:00:00[KIterating over a 10-point grid: 100%[=========================] Time: 0:00:00[K
[ Info: Training best model on all supplied data.
[ Info: No measure specified. Using measure=rms. 
[ Info: Training [34mMachine{DeterministicTunedModel} @ 1…93[39m.
Iterating over a 30-point grid:   3%[>                        ]  ETA: 0:00:00[KIterating over a 30-point grid:  10%[==>                      ]  ETA: 0:00:26[KIterating over a 30-point grid:  13%[===>                     ]  ETA: 0:00:23[KIterating over a 30-point grid:  16%[====>                    ]  ETA: 0:00:17[KIterating over a 30-point grid:  19%[====>                    ]  ETA: 0:00:14[KIterating over a 30-point grid:  23%[=====>                   ]  ETA: 0:00:12[KIterating over a 30-point grid:  26%[======>                  ]  ETA: 0:00:10[KIterating over a 30-point grid:  29%[=======>                 ]  ETA: 0:00:08[KIterating over a 30-point grid:  32%[========>                ]  ETA: 0:00:07[KIterating over a 30-point grid:  35%[========>                ]  ETA: 0:00:06[KIterating over a 30-point grid:  39%[=========>               ]  ETA: 0:00:05[KIterating over a 30-point grid:  42%[==========>              ]  ETA: 0:00:05[KIterating over a 30-point grid:  45%[===========>             ]  ETA: 0:00:04[KIterating over a 30-point grid:  48%[============>            ]  ETA: 0:00:04[KIterating over a 30-point grid:  52%[============>            ]  ETA: 0:00:03[KIterating over a 30-point grid:  55%[=============>           ]  ETA: 0:00:03[KIterating over a 30-point grid:  58%[==============>          ]  ETA: 0:00:02[KIterating over a 30-point grid:  61%[===============>         ]  ETA: 0:00:02[KIterating over a 30-point grid:  65%[================>        ]  ETA: 0:00:02[KIterating over a 30-point grid:  68%[================>        ]  ETA: 0:00:02[KIterating over a 30-point grid:  71%[=================>       ]  ETA: 0:00:01[KIterating over a 30-point grid:  74%[==================>      ]  ETA: 0:00:01[KIterating over a 30-point grid:  77%[===================>     ]  ETA: 0:00:01[KIterating over a 30-point grid:  81%[====================>    ]  ETA: 0:00:01[KIterating over a 30-point grid:  84%[====================>    ]  ETA: 0:00:01[KIterating over a 30-point grid:  87%[=====================>   ]  ETA: 0:00:01[KIterating over a 30-point grid:  90%[======================>  ]  ETA: 0:00:00[KIterating over a 30-point grid:  94%[=======================> ]  ETA: 0:00:00[KIterating over a 30-point grid:  97%[========================>]  ETA: 0:00:00[KIterating over a 30-point grid: 100%[=========================] Time: 0:00:03[K
┌ Info: Training of best model suppressed.
└  To train tuning machine `mach` on all supplied data, call `fit!(mach.fitresult)`.
[ Info: No measure specified. Using measure=rms. 
[ Info: Training [34mMachine{DeterministicTunedModel} @ 1…84[39m.
Iterating over a 30-point grid:   3%[>                        ]  ETA: 0:00:00[KIterating over a 30-point grid:  10%[==>                      ]  ETA: 0:00:00[KIterating over a 30-point grid:  13%[===>                     ]  ETA: 0:00:00[KIterating over a 30-point grid:  16%[====>                    ]  ETA: 0:00:00[KIterating over a 30-point grid:  19%[====>                    ]  ETA: 0:00:00[KIterating over a 30-point grid:  23%[=====>                   ]  ETA: 0:00:00[KIterating over a 30-point grid:  26%[======>                  ]  ETA: 0:00:00[KIterating over a 30-point grid:  29%[=======>                 ]  ETA: 0:00:00[KIterating over a 30-point grid:  32%[========>                ]  ETA: 0:00:00[KIterating over a 30-point grid:  35%[========>                ]  ETA: 0:00:00[KIterating over a 30-point grid:  39%[=========>               ]  ETA: 0:00:00[KIterating over a 30-point grid:  42%[==========>              ]  ETA: 0:00:00[KIterating over a 30-point grid:  45%[===========>             ]  ETA: 0:00:00[KIterating over a 30-point grid:  48%[============>            ]  ETA: 0:00:00[KIterating over a 30-point grid:  52%[============>            ]  ETA: 0:00:00[KIterating over a 30-point grid:  55%[=============>           ]  ETA: 0:00:00[KIterating over a 30-point grid:  58%[==============>          ]  ETA: 0:00:00[KIterating over a 30-point grid:  61%[===============>         ]  ETA: 0:00:00[KIterating over a 30-point grid:  65%[================>        ]  ETA: 0:00:00[KIterating over a 30-point grid:  68%[================>        ]  ETA: 0:00:00[KIterating over a 30-point grid:  71%[=================>       ]  ETA: 0:00:00[KIterating over a 30-point grid:  74%[==================>      ]  ETA: 0:00:00[KIterating over a 30-point grid:  77%[===================>     ]  ETA: 0:00:00[KIterating over a 30-point grid:  81%[====================>    ]  ETA: 0:00:00[KIterating over a 30-point grid:  84%[====================>    ]  ETA: 0:00:00[KIterating over a 30-point grid:  87%[=====================>   ]  ETA: 0:00:00[KIterating over a 30-point grid:  90%[======================>  ]  ETA: 0:00:00[KIterating over a 30-point grid:  94%[=======================> ]  ETA: 0:00:00[KIterating over a 30-point grid:  97%[========================>]  ETA: 0:00:00[KIterating over a 30-point grid: 100%[=========================] Time: 0:00:00[K
┌ Info: Training of best model suppressed.
└  To train tuning machine `mach` on all supplied data, call `fit!(mach.fitresult)`.
[ Info: No measure specified. Using measure=rms. 
[ Info: Training [34mMachine{DeterministicTunedModel} @ 2…83[39m.
Iterating over a 30-point grid:   3%[>                        ]  ETA: 0:00:00[KIterating over a 30-point grid:  10%[==>                      ]  ETA: 0:00:00[KIterating over a 30-point grid:  13%[===>                     ]  ETA: 0:00:00[KIterating over a 30-point grid:  16%[====>                    ]  ETA: 0:00:00[KIterating over a 30-point grid:  19%[====>                    ]  ETA: 0:00:00[KIterating over a 30-point grid:  23%[=====>                   ]  ETA: 0:00:00[KIterating over a 30-point grid:  26%[======>                  ]  ETA: 0:00:00[KIterating over a 30-point grid:  29%[=======>                 ]  ETA: 0:00:00[KIterating over a 30-point grid:  32%[========>                ]  ETA: 0:00:00[KIterating over a 30-point grid:  35%[========>                ]  ETA: 0:00:00[KIterating over a 30-point grid:  39%[=========>               ]  ETA: 0:00:00[KIterating over a 30-point grid:  42%[==========>              ]  ETA: 0:00:00[KIterating over a 30-point grid:  45%[===========>             ]  ETA: 0:00:00[KIterating over a 30-point grid:  48%[============>            ]  ETA: 0:00:00[KIterating over a 30-point grid:  52%[============>            ]  ETA: 0:00:00[KIterating over a 30-point grid:  55%[=============>           ]  ETA: 0:00:00[KIterating over a 30-point grid:  58%[==============>          ]  ETA: 0:00:00[KIterating over a 30-point grid:  61%[===============>         ]  ETA: 0:00:00[KIterating over a 30-point grid:  65%[================>        ]  ETA: 0:00:00[KIterating over a 30-point grid:  68%[================>        ]  ETA: 0:00:00[KIterating over a 30-point grid:  71%[=================>       ]  ETA: 0:00:00[KIterating over a 30-point grid:  74%[==================>      ]  ETA: 0:00:00[KIterating over a 30-point grid:  77%[===================>     ]  ETA: 0:00:00[KIterating over a 30-point grid:  81%[====================>    ]  ETA: 0:00:00[KIterating over a 30-point grid:  84%[====================>    ]  ETA: 0:00:00[KIterating over a 30-point grid:  87%[=====================>   ]  ETA: 0:00:00[KIterating over a 30-point grid:  90%[======================>  ]  ETA: 0:00:00[KIterating over a 30-point grid:  94%[=======================> ]  ETA: 0:00:00[KIterating over a 30-point grid:  97%[========================>]  ETA: 0:00:00[KIterating over a 30-point grid: 100%[=========================] Time: 0:00:00[K
┌ Info: Training of best model suppressed.
└  To train tuning machine `mach` on all supplied data, call `fit!(mach.fitresult)`.
Test Summary: | Pass  Total
tuning        |   19     19
Iterating over a 30-point grid:   3%[>                        ]  ETA: 0:00:00[KIterating over a 30-point grid:  10%[==>                      ]  ETA: 0:00:24[KIterating over a 30-point grid:  13%[===>                     ]  ETA: 0:00:21[KIterating over a 30-point grid:  16%[====>                    ]  ETA: 0:00:16[KIterating over a 30-point grid:  19%[====>                    ]  ETA: 0:00:13[KIterating over a 30-point grid:  23%[=====>                   ]  ETA: 0:00:11[KIterating over a 30-point grid:  26%[======>                  ]  ETA: 0:00:09[KIterating over a 30-point grid:  29%[=======>                 ]  ETA: 0:00:08[KIterating over a 30-point grid:  32%[========>                ]  ETA: 0:00:07[KIterating over a 30-point grid:  35%[========>                ]  ETA: 0:00:06[KIterating over a 30-point grid:  39%[=========>               ]  ETA: 0:00:05[KIterating over a 30-point grid:  42%[==========>              ]  ETA: 0:00:04[KIterating over a 30-point grid:  45%[===========>             ]  ETA: 0:00:04[KIterating over a 30-point grid:  48%[============>            ]  ETA: 0:00:03[KIterating over a 30-point grid:  52%[============>            ]  ETA: 0:00:03[KIterating over a 30-point grid:  55%[=============>           ]  ETA: 0:00:03[KIterating over a 30-point grid:  58%[==============>          ]  ETA: 0:00:02[KIterating over a 30-point grid:  61%[===============>         ]  ETA: 0:00:02[KIterating over a 30-point grid:  65%[================>        ]  ETA: 0:00:02[KIterating over a 30-point grid:  68%[================>        ]  ETA: 0:00:02[KIterating over a 30-point grid:  71%[=================>       ]  ETA: 0:00:01[KIterating over a 30-point grid:  74%[==================>      ]  ETA: 0:00:01[KIterating over a 30-point grid:  77%[===================>     ]  ETA: 0:00:01[KIterating over a 30-point grid:  81%[====================>    ]  ETA: 0:00:01[KIterating over a 30-point grid:  84%[====================>    ]  ETA: 0:00:01[KIterating over a 30-point grid:  87%[=====================>   ]  ETA: 0:00:00[KIterating over a 30-point grid:  90%[======================>  ]  ETA: 0:00:00[KIterating over a 30-point grid:  94%[=======================> ]  ETA: 0:00:00[KIterating over a 30-point grid:  97%[========================>]  ETA: 0:00:00[KIterating over a 30-point grid: 100%[=========================] Time: 0:00:03[K
[ Info: No measure specified. Using measure=rms. 
[ Info: Training [34mMachine{DeterministicTunedModel} @ 4…37[39m.
Iterating over a 30-point grid:   3%[>                        ]  ETA: 0:00:00[KIterating over a 30-point grid:  10%[==>                      ]  ETA: 0:00:00[KIterating over a 30-point grid:  13%[===>                     ]  ETA: 0:00:00[KIterating over a 30-point grid:  16%[====>                    ]  ETA: 0:00:00[KIterating over a 30-point grid:  19%[====>                    ]  ETA: 0:00:00[KIterating over a 30-point grid:  23%[=====>                   ]  ETA: 0:00:00[KIterating over a 30-point grid:  26%[======>                  ]  ETA: 0:00:00[KIterating over a 30-point grid:  29%[=======>                 ]  ETA: 0:00:00[KIterating over a 30-point grid:  32%[========>                ]  ETA: 0:00:00[KIterating over a 30-point grid:  35%[========>                ]  ETA: 0:00:00[KIterating over a 30-point grid:  39%[=========>               ]  ETA: 0:00:00[KIterating over a 30-point grid:  42%[==========>              ]  ETA: 0:00:00[KIterating over a 30-point grid:  45%[===========>             ]  ETA: 0:00:00[KIterating over a 30-point grid:  48%[============>            ]  ETA: 0:00:00[KIterating over a 30-point grid:  52%[============>            ]  ETA: 0:00:00[KIterating over a 30-point grid:  55%[=============>           ]  ETA: 0:00:00[KIterating over a 30-point grid:  58%[==============>          ]  ETA: 0:00:00[KIterating over a 30-point grid:  61%[===============>         ]  ETA: 0:00:00[KIterating over a 30-point grid:  65%[================>        ]  ETA: 0:00:00[KIterating over a 30-point grid:  68%[================>        ]  ETA: 0:00:00[KIterating over a 30-point grid:  71%[=================>       ]  ETA: 0:00:00[KIterating over a 30-point grid:  74%[==================>      ]  ETA: 0:00:00[KIterating over a 30-point grid:  77%[===================>     ]  ETA: 0:00:00[KIterating over a 30-point grid:  81%[====================>    ]  ETA: 0:00:00[KIterating over a 30-point grid:  84%[====================>    ]  ETA: 0:00:00[KIterating over a 30-point grid:  87%[=====================>   ]  ETA: 0:00:00[KIterating over a 30-point grid:  90%[======================>  ]  ETA: 0:00:00[KIterating over a 30-point grid:  94%[=======================> ]  ETA: 0:00:00[KIterating over a 30-point grid:  97%[========================>]  ETA: 0:00:00[KIterating over a 30-point grid: 100%[=========================] Time: 0:00:00[K
┌ Info: Training of best model suppressed.
└  To train tuning machine `mach` on all supplied data, call `fit!(mach.fitresult)`.
[ Info: No measure specified. Using measure=rms. 
[ Info: Training [34mMachine{DeterministicTunedModel} @ 3…85[39m.
Iterating over a 30-point grid:   3%[>                        ]  ETA: 0:00:00[KIterating over a 30-point grid:  10%[==>                      ]  ETA: 0:00:00[KIterating over a 30-point grid:  13%[===>                     ]  ETA: 0:00:00[KIterating over a 30-point grid:  16%[====>                    ]  ETA: 0:00:00[KIterating over a 30-point grid:  19%[====>                    ]  ETA: 0:00:00[KIterating over a 30-point grid:  23%[=====>                   ]  ETA: 0:00:00[KIterating over a 30-point grid:  26%[======>                  ]  ETA: 0:00:00[KIterating over a 30-point grid:  29%[=======>                 ]  ETA: 0:00:00[KIterating over a 30-point grid:  32%[========>                ]  ETA: 0:00:00[KIterating over a 30-point grid:  35%[========>                ]  ETA: 0:00:00[KIterating over a 30-point grid:  39%[=========>               ]  ETA: 0:00:00[KIterating over a 30-point grid:  42%[==========>              ]  ETA: 0:00:00[KIterating over a 30-point grid:  45%[===========>             ]  ETA: 0:00:00[KIterating over a 30-point grid:  48%[============>            ]  ETA: 0:00:00[KIterating over a 30-point grid:  52%[============>            ]  ETA: 0:00:00[KIterating over a 30-point grid:  55%[=============>           ]  ETA: 0:00:00[KIterating over a 30-point grid:  58%[==============>          ]  ETA: 0:00:00[KIterating over a 30-point grid:  61%[===============>         ]  ETA: 0:00:00[KIterating over a 30-point grid:  65%[================>        ]  ETA: 0:00:00[KIterating over a 30-point grid:  68%[================>        ]  ETA: 0:00:00[KIterating over a 30-point grid:  71%[=================>       ]  ETA: 0:00:00[KIterating over a 30-point grid:  74%[==================>      ]  ETA: 0:00:00[KIterating over a 30-point grid:  77%[===================>     ]  ETA: 0:00:00[KIterating over a 30-point grid:  81%[====================>    ]  ETA: 0:00:00[KIterating over a 30-point grid:  84%[====================>    ]  ETA: 0:00:00[KIterating over a 30-point grid:  87%[=====================>   ]  ETA: 0:00:00[KIterating over a 30-point grid:  90%[======================>  ]  ETA: 0:00:00[KIterating over a 30-point grid:  94%[=======================> ]  ETA: 0:00:00[KIterating over a 30-point grid:  97%[========================>]  ETA: 0:00:00[KIterating over a 30-point grid: 100%[=========================] Time: 0:00:00[K
┌ Info: Training of best model suppressed.
└  To train tuning machine `mach` on all supplied data, call `fit!(mach.fitresult)`.
Test Summary:   | Pass  Total
learning_curves |    3      3

Training ensemble:  20%[==========>                                       ]  ETA: 0:00:03[KTraining ensemble: 100%[==================================================] Time: 0:00:00[K





Training ensemble:  20%[==========>                                       ]  ETA: 0:00:03[KTraining ensemble: 100%[==================================================] Time: 0:00:00[K


Training ensemble:  20%[==========>                                       ]  ETA: 0:00:04[KTraining ensemble: 100%[==================================================] Time: 0:00:01[K








[ Info: Training [34mMachine{DeterministicEnsembleModel{KNNRegressor}} @ 1…24[39m.
Training ensemble:   2%[=>                                                ]  ETA: 0:00:42[KTraining ensemble: 100%[==================================================] Time: 0:00:00[K



Test Summary: | Pass  Total
ensembles     |   43     43
Test Summary:           | Pass  Total
matching models to data |   11     11
┌ Warning: SupervisedTask is deprecated. For model search options, see https://alan-turing-institute.github.io/MLJ.jl/dev/model_search/
└ @ MLJBase ~/.julia/packages/MLJBase/oMxBY/src/tasks.jl:103
┌ Info: 
│ is_probabilistic = true
│ input_scitype = ScientificTypes.Table{Union{AbstractArray{Count,1}, AbstractArray{Unknown,1}}} 
└ target_scitype = AbstractArray{Count,1}
┌ Warning: Missing values encountered coercing scitype to Count.
│ Coerced to Union{Missing,Count} instead. 
└ @ ScientificTypes ~/.julia/packages/ScientificTypes/FaL4R/src/conventions/mlj/mlj.jl:5
┌ Warning: SupervisedTask is deprecated. For model search options, see https://alan-turing-institute.github.io/MLJ.jl/dev/model_search/
└ @ MLJBase ~/.julia/packages/MLJBase/oMxBY/src/tasks.jl:103
┌ Info: 
│ is_probabilistic = false
│ input_scitype = ScientificTypes.Table{Union{AbstractArray{Continuous,1}, AbstractArray{Multiclass{4},1}, AbstractArray{Union{Missing, Count},1}}} 
└ target_scitype = AbstractArray{Count,1}
┌ Warning: SupervisedTask is deprecated. For model search options, see https://alan-turing-institute.github.io/MLJ.jl/dev/model_search/
└ @ MLJBase ~/.julia/packages/MLJBase/oMxBY/src/tasks.jl:103
┌ Info: 
│ is_probabilistic = true
│ input_scitype = ScientificTypes.Table{Union{AbstractArray{Continuous,1}, AbstractArray{Multiclass{4},1}, AbstractArray{Union{Missing, Count},1}}} 
└ target_scitype = AbstractArray{Count,1}
Test Summary: | Pass  Total
tasks         |   19     19
Test Summary: | Pass  Total
scitypes      |    3      3
   Testing MLJ tests passed 
