Julia Version 1.5.0-DEV.662
Commit ac82513795 (2020-04-22 15:15 UTC)
Platform Info:
  OS: Linux (x86_64-pc-linux-gnu)
  CPU: Intel(R) Xeon(R) Silver 4114 CPU @ 2.20GHz
  WORD_SIZE: 64
  LIBM: libopenlibm
  LLVM: libLLVM-9.0.1 (ORCJIT, skylake)
Environment:
  JULIA_DEPOT_PATH = ::/usr/local/share/julia
  JULIA_NUM_THREADS = 2

  Resolving package versions...
  Installed Arpack_jll ─────────────────── v3.5.0+3
  Installed Rmath_jll ──────────────────── v0.2.2+0
  Installed ColorTypes ─────────────────── v0.10.2
  Installed ExprTools ──────────────────── v0.1.1
  Installed FilePathsBase ──────────────── v0.8.0
  Installed ComputationalResources ─────── v0.3.2
  Installed MLJBase ────────────────────── v0.13.0
  Installed Distributions ──────────────── v0.23.2
  Installed Arpack ─────────────────────── v0.4.0
  Installed FillArrays ─────────────────── v0.8.7
  Installed RecipesBase ────────────────── v1.0.1
  Installed JLSO ───────────────────────── v2.3.1
  Installed Parameters ─────────────────── v0.12.0
  Installed CodecZlib ──────────────────── v0.7.0
  Installed ProgressMeter ──────────────── v1.2.0
  Installed SortingAlgorithms ──────────── v0.3.1
  Installed LearnBase ──────────────────── v0.3.0
  Installed IniFile ────────────────────── v0.5.0
  Installed Mocking ────────────────────── v0.7.1
  Installed TranscodingStreams ─────────── v0.9.5
  Installed IteratorInterfaceExtensions ── v1.0.0
  Installed StatsFuns ──────────────────── v0.9.4
  Installed HTTP ───────────────────────── v0.8.14
  Installed Memento ────────────────────── v1.1.0
  Installed PrettyTables ───────────────── v0.9.0
  Installed TimeZones ──────────────────── v1.1.1
  Installed MLJModelInterface ──────────── v0.2.1
  Installed Syslogs ────────────────────── v0.3.0
  Installed InvertedIndices ────────────── v1.0.0
  Installed FixedPointNumbers ──────────── v0.8.0
  Installed CategoricalArrays ──────────── v0.7.7
  Installed XML2_jll ───────────────────── v2.9.9+4
  Installed MbedTLS ────────────────────── v1.0.2
  Installed CompilerSupportLibraries_jll ─ v0.3.3+0
  Installed Tables ─────────────────────── v1.0.4
  Installed OpenBLAS_jll ───────────────── v0.3.9+2
  Installed Rmath ──────────────────────── v0.6.1
  Installed QuadGK ─────────────────────── v2.3.1
  Installed StatsBase ──────────────────── v0.33.0
  Installed BSON ───────────────────────── v0.2.6
  Installed Compat ─────────────────────── v3.8.0
  Installed LossFunctions ──────────────── v0.6.0
  Installed EzXML ──────────────────────── v1.1.0
  Installed JSON ───────────────────────── v0.21.0
  Installed Zlib_jll ───────────────────── v1.2.11+9
  Installed OpenSpecFun_jll ────────────── v0.5.3+3
  Installed TableTraits ────────────────── v1.0.0
  Installed DataAPI ────────────────────── v1.2.0
  Installed ScientificTypes ────────────── v0.7.2
  Installed DataValueInterfaces ────────── v1.0.0
  Installed Parsers ────────────────────── v1.0.2
  Installed SpecialFunctions ───────────── v0.10.0
  Installed Libiconv_jll ───────────────── v1.16.0+2
  Installed PDMats ─────────────────────── v0.9.12
  Installed Formatting ─────────────────── v0.4.1
  Installed Reexport ───────────────────── v0.2.0
  Installed Missings ───────────────────── v0.4.3
  Installed OrderedCollections ─────────── v1.1.0
  Installed MbedTLS_jll ────────────────── v2.16.0+2
  Installed Crayons ────────────────────── v4.0.1
  Installed DataStructures ─────────────── v0.17.13
  Installed MLJScientificTypes ─────────── v0.2.4
Updating `~/.julia/environments/v1.5/Project.toml`
  [a7f614a8] + MLJBase v0.13.0
Updating `~/.julia/environments/v1.5/Manifest.toml`
  [7d9fca2a] + Arpack v0.4.0
  [68821587] + Arpack_jll v3.5.0+3
  [fbb218c0] + BSON v0.2.6
  [324d7699] + CategoricalArrays v0.7.7
  [944b1d66] + CodecZlib v0.7.0
  [3da002f7] + ColorTypes v0.10.2
  [34da2185] + Compat v3.8.0
  [e66e0078] + CompilerSupportLibraries_jll v0.3.3+0
  [ed09eef8] + ComputationalResources v0.3.2
  [a8cc5b0e] + Crayons v4.0.1
  [9a962f9c] + DataAPI v1.2.0
  [864edb3b] + DataStructures v0.17.13
  [e2d170a0] + DataValueInterfaces v1.0.0
  [31c24e10] + Distributions v0.23.2
  [e2ba6199] + ExprTools v0.1.1
  [8f5d6c58] + EzXML v1.1.0
  [48062228] + FilePathsBase v0.8.0
  [1a297f60] + FillArrays v0.8.7
  [53c48c17] + FixedPointNumbers v0.8.0
  [59287772] + Formatting v0.4.1
  [cd3eb016] + HTTP v0.8.14
  [83e8ac13] + IniFile v0.5.0
  [41ab1584] + InvertedIndices v1.0.0
  [82899510] + IteratorInterfaceExtensions v1.0.0
  [9da8a3cd] + JLSO v2.3.1
  [682c06a0] + JSON v0.21.0
  [7f8f8fb0] + LearnBase v0.3.0
  [94ce4f54] + Libiconv_jll v1.16.0+2
  [30fc2ffe] + LossFunctions v0.6.0
  [a7f614a8] + MLJBase v0.13.0
  [e80e1ace] + MLJModelInterface v0.2.1
  [2e2323e0] + MLJScientificTypes v0.2.4
  [739be429] + MbedTLS v1.0.2
  [c8ffd9c3] + MbedTLS_jll v2.16.0+2
  [f28f55f0] + Memento v1.1.0
  [e1d29d7a] + Missings v0.4.3
  [78c3b35d] + Mocking v0.7.1
  [4536629a] + OpenBLAS_jll v0.3.9+2
  [efe28fd5] + OpenSpecFun_jll v0.5.3+3
  [bac558e1] + OrderedCollections v1.1.0
  [90014a1f] + PDMats v0.9.12
  [d96e819e] + Parameters v0.12.0
  [69de0a69] + Parsers v1.0.2
  [08abe8d2] + PrettyTables v0.9.0
  [92933f4c] + ProgressMeter v1.2.0
  [1fd47b50] + QuadGK v2.3.1
  [3cdcf5f2] + RecipesBase v1.0.1
  [189a3867] + Reexport v0.2.0
  [79098fc4] + Rmath v0.6.1
  [f50d1b31] + Rmath_jll v0.2.2+0
  [321657f4] + ScientificTypes v0.7.2
  [a2af1166] + SortingAlgorithms v0.3.1
  [276daf66] + SpecialFunctions v0.10.0
  [2913bbd2] + StatsBase v0.33.0
  [4c63d2b9] + StatsFuns v0.9.4
  [cea106d9] + Syslogs v0.3.0
  [3783bdb8] + TableTraits v1.0.0
  [bd369af6] + Tables v1.0.4
  [f269a46b] + TimeZones v1.1.1
  [3bb67fe8] + TranscodingStreams v0.9.5
  [02c8fc9c] + XML2_jll v2.9.9+4
  [83775a58] + Zlib_jll v1.2.11+9
  [2a0f44e3] + Base64
  [ade2ca70] + Dates
  [8bb1440f] + DelimitedFiles
  [8ba89e20] + Distributed
  [9fa8497b] + Future
  [b77e0a4c] + InteractiveUtils
  [76f85450] + LibGit2
  [8f399da3] + Libdl
  [37e2e46d] + LinearAlgebra
  [56ddb016] + Logging
  [d6f4376e] + Markdown
  [a63ad114] + Mmap
  [44cfe95a] + Pkg
  [de0858da] + Printf
  [3fa0cd96] + REPL
  [9a3f8284] + Random
  [ea8e919c] + SHA
  [9e88b42a] + Serialization
  [1a1011a3] + SharedArrays
  [6462fe0b] + Sockets
  [2f01184e] + SparseArrays
  [10745b16] + Statistics
  [4607b0f0] + SuiteSparse
  [8dfed614] + Test
  [cf7118a7] + UUIDs
  [4ec0a83e] + Unicode
   Building TimeZones → `~/.julia/packages/TimeZones/X323b/deps/build.log`
    Testing MLJBase
Status `/tmp/jl_PHk8ur/Project.toml`
  [336ed68f] CSV v0.3.1
  [324d7699] CategoricalArrays v0.7.7
  [ed09eef8] ComputationalResources v0.3.2
  [a93c6f00] DataFrames v0.20.2
  [7806a523] DecisionTree v0.10.1
  [b4f34e82] Distances v0.8.2
  [31c24e10] Distributions v0.23.2
  [cd3eb016] HTTP v0.8.14
  [41ab1584] InvertedIndices v1.0.0
  [9da8a3cd] JLSO v2.3.1
  [682c06a0] JSON v0.21.0
  [30fc2ffe] LossFunctions v0.6.0
  [a7f614a8] MLJBase v0.13.0
  [e80e1ace] MLJModelInterface v0.2.1
  [2e2323e0] MLJScientificTypes v0.2.4
  [e1d29d7a] Missings v0.4.3
  [6f286f6a] MultivariateStats v0.7.0
  [b8a86587] NearestNeighbors v0.4.4
  [bac558e1] OrderedCollections v1.1.0
  [d96e819e] Parameters v0.12.0
  [08abe8d2] PrettyTables v0.9.0
  [92933f4c] ProgressMeter v1.2.0
  [321657f4] ScientificTypes v0.7.2
  [2913bbd2] StatsBase v0.33.0
  [bd369af6] Tables v1.0.4
  [9d95f2ec] TypedTables v1.2.0
  [ade2ca70] Dates
  [8bb1440f] DelimitedFiles
  [8ba89e20] Distributed
  [b77e0a4c] InteractiveUtils
  [37e2e46d] LinearAlgebra
  [56ddb016] Logging
  [9a3f8284] Random
  [10745b16] Statistics
  [8dfed614] Test
Status `/tmp/jl_PHk8ur/Manifest.toml`
  [7d9fca2a] Arpack v0.4.0
  [68821587] Arpack_jll v3.5.0+3
  [fbb218c0] BSON v0.2.6
  [336ed68f] CSV v0.3.1
  [324d7699] CategoricalArrays v0.7.7
  [944b1d66] CodecZlib v0.7.0
  [3da002f7] ColorTypes v0.10.2
  [34da2185] Compat v3.8.0
  [e66e0078] CompilerSupportLibraries_jll v0.3.3+0
  [ed09eef8] ComputationalResources v0.3.2
  [a8cc5b0e] Crayons v4.0.1
  [9a962f9c] DataAPI v1.2.0
  [a93c6f00] DataFrames v0.20.2
  [9a8bc11e] DataStreams v0.4.2
  [864edb3b] DataStructures v0.17.13
  [e2d170a0] DataValueInterfaces v1.0.0
  [7806a523] DecisionTree v0.10.1
  [85a47980] Dictionaries v0.2.1
  [b4f34e82] Distances v0.8.2
  [31c24e10] Distributions v0.23.2
  [e2ba6199] ExprTools v0.1.1
  [8f5d6c58] EzXML v1.1.0
  [48062228] FilePathsBase v0.8.0
  [1a297f60] FillArrays v0.8.7
  [53c48c17] FixedPointNumbers v0.8.0
  [59287772] Formatting v0.4.1
  [cd3eb016] HTTP v0.8.14
  [313cdc1a] Indexing v1.1.0
  [83e8ac13] IniFile v0.5.0
  [7d512f48] InternedStrings v0.7.0
  [41ab1584] InvertedIndices v1.0.0
  [82899510] IteratorInterfaceExtensions v1.0.0
  [9da8a3cd] JLSO v2.3.1
  [682c06a0] JSON v0.21.0
  [7f8f8fb0] LearnBase v0.3.0
  [94ce4f54] Libiconv_jll v1.16.0+2
  [30fc2ffe] LossFunctions v0.6.0
  [a7f614a8] MLJBase v0.13.0
  [e80e1ace] MLJModelInterface v0.2.1
  [2e2323e0] MLJScientificTypes v0.2.4
  [739be429] MbedTLS v1.0.2
  [c8ffd9c3] MbedTLS_jll v2.16.0+2
  [f28f55f0] Memento v1.1.0
  [e1d29d7a] Missings v0.4.3
  [78c3b35d] Mocking v0.7.1
  [6f286f6a] MultivariateStats v0.7.0
  [b8a86587] NearestNeighbors v0.4.4
  [4536629a] OpenBLAS_jll v0.3.9+2
  [efe28fd5] OpenSpecFun_jll v0.5.3+3
  [bac558e1] OrderedCollections v1.1.0
  [90014a1f] PDMats v0.9.12
  [d96e819e] Parameters v0.12.0
  [69de0a69] Parsers v1.0.2
  [2dfb63ee] PooledArrays v0.5.3
  [08abe8d2] PrettyTables v0.9.0
  [92933f4c] ProgressMeter v1.2.0
  [1fd47b50] QuadGK v2.3.1
  [3cdcf5f2] RecipesBase v1.0.1
  [189a3867] Reexport v0.2.0
  [79098fc4] Rmath v0.6.1
  [f50d1b31] Rmath_jll v0.2.2+0
  [321657f4] ScientificTypes v0.7.2
  [6e75b9c4] ScikitLearnBase v0.5.0
  [a2af1166] SortingAlgorithms v0.3.1
  [276daf66] SpecialFunctions v0.10.0
  [03a91e81] SplitApplyCombine v1.0.0
  [90137ffa] StaticArrays v0.12.1
  [2913bbd2] StatsBase v0.33.0
  [4c63d2b9] StatsFuns v0.9.4
  [cea106d9] Syslogs v0.3.0
  [3783bdb8] TableTraits v1.0.0
  [bd369af6] Tables v1.0.4
  [f269a46b] TimeZones v1.1.1
  [3bb67fe8] TranscodingStreams v0.9.5
  [9d95f2ec] TypedTables v1.2.0
  [ea10d353] WeakRefStrings v0.5.8
  [02c8fc9c] XML2_jll v2.9.9+4
  [83775a58] Zlib_jll v1.2.11+9
  [2a0f44e3] Base64
  [ade2ca70] Dates
  [8bb1440f] DelimitedFiles
  [8ba89e20] Distributed
  [9fa8497b] Future
  [b77e0a4c] InteractiveUtils
  [76f85450] LibGit2
  [8f399da3] Libdl
  [37e2e46d] LinearAlgebra
  [56ddb016] Logging
  [d6f4376e] Markdown
  [a63ad114] Mmap
  [44cfe95a] Pkg
  [de0858da] Printf
  [3fa0cd96] REPL
  [9a3f8284] Random
  [ea8e919c] SHA
  [9e88b42a] Serialization
  [1a1011a3] SharedArrays
  [6462fe0b] Sockets
  [2f01184e] SparseArrays
  [10745b16] Statistics
  [4607b0f0] SuiteSparse
  [8dfed614] Test
  [cf7118a7] UUIDs
  [4ec0a83e] Unicode
[ Info: nprocs() = 41
[ Info: nthreads() = 2
Loading some models for testing...                                           Test Summary: | Pass  Total
misc          |   94     94
Test Summary: | Pass  Total
interface     |   79     79
Test Summary: | Pass  Total
measures      |  211    211
Progress:  17%|██████▉                                  |  ETA: 0:00:01[KProgress: 100%|█████████████████████████████████████████| Time: 0:00:00[K
Progress:  17%|██████▉                                  |  ETA: 0:00:20[KProgress:  83%|██████████████████████████████████▁      |  ETA: 0:00:01[KProgress: 100%|█████████████████████████████████████████| Time: 0:00:05[K
Progress:  17%|██████▉                                  |  ETA: 0:00:04[KProgress: 100%|█████████████████████████████████████████| Time: 0:00:00[K
[ Info: Updating [34mMachine{Resampler{Holdout,…}} @ 1…72[39m.
[ Info: Updating [34mMachine{Resampler{Holdout,…}} @ 1…55[39m.
[ Info: Updating [34mMachine{Resampler{Holdout,…}} @ 2…69[39m.
[ Info: Distributing evaluations among 40 workers.
[ Info: Performing evaluations using 2 threads.
[ Info: Creating subsamples from a subset of all rows. 
[ Info: Training [34mMachine{Resampler{CV,…}} @ 1…35[39m.
[ Info: Passing machine sample weights to any supported measures. 
[ Info: Training [34mMachine{Resampler{CV,…}} @ 1…03[39m.
[ Info: Creating subsamples from a subset of all rows. 
[ Info: Training [34mMachine{Resampler{CV,…}} @ 6…82[39m.
[ Info: Passing machine sample weights to any supported measures. 
[ Info: Training [34mMachine{Resampler{CV,…}} @ 5…53[39m.
[ Info: Creating subsamples from a subset of all rows. 
[ Info: Training [34mMachine{Resampler{CV,…}} @ 1…26[39m.
[ Info: Passing machine sample weights to any supported measures. 
[ Info: Training [34mMachine{Resampler{CV,…}} @ 9…90[39m.
Test Summary: | Pass  Total
resampling    |  129    129
Test Summary: | Pass  Total
data          |  121    121
[ Info: Training [34mMachine{ConstantClassifier} @ 7…18[39m.
[ Info: Training [34mMachine{ConstantClassifier} @ 1…69[39m.
[ Info: Training [34mNodalMachine{Scale} @ 1…00[39m.
[ Info: Training [34mMachine{DecisionTreeRegressor} @ 1…67[39m.
[ Info: Training [34mMachine{DecisionTreeRegressor} @ 1…28[39m.
[ Info: Training [34mMachine{DecisionTreeRegressor} @ 1…90[39m.
[ Info: Training [34mNodalMachine{FeatureSelector} @ 1…67[39m.
[ Info: Training [34mNodalMachine{FooBarRegressor} @ 1…83[39m.
[ Info: Training [34mNodalMachine{SimpleDeterministicCompositeModel{FooBarRegressor,…}} @ 2…38[39m.
[ Info: Training [34mNodalMachine{FeatureSelector} @ 9…75[39m.
[ Info: Training [34mNodalMachine{FooBarRegressor} @ 1…83[39m.
[ Info: Updating [34mNodalMachine{SimpleDeterministicCompositeModel{FooBarRegressor,…}} @ 2…38[39m.
[ Info: Updating [34mNodalMachine{FeatureSelector} @ 9…75[39m.
[ Info: Training [34mNodalMachine{FooBarRegressor} @ 1…83[39m.
[ Info: Training [34mNodalMachine{SimpleDeterministicCompositeModel{FooBarRegressor,…}} @ 2…38[39m.
[ Info: Training [34mNodalMachine{FeatureSelector} @ 1…00[39m.
[ Info: Training [34mNodalMachine{FooBarRegressor} @ 1…51[39m.
[ Info: Training [34mMachine{WrappedRidge} @ 4…55[39m.
[ Info: Training [34mNodalMachine{Standardizer} @ 9…91[39m.
[ Info: Training [34mNodalMachine{UnivariateBoxCoxTransformer} @ 4…49[39m.
[ Info: Training [34mNodalMachine{FooBarRegressor} @ 1…84[39m.
[ Info: Updating [34mMachine{WrappedRidge} @ 4…55[39m.
┌ Info: Not retraining [34mNodalMachine{Standardizer} @ 9…91[39m.
└  It appears up-to-date. Use `force=true` to force retraining.
┌ Info: Not retraining [34mNodalMachine{UnivariateBoxCoxTransformer} @ 4…49[39m.
└  It appears up-to-date. Use `force=true` to force retraining.
[ Info: Updating [34mNodalMachine{FooBarRegressor} @ 1…84[39m.
[ Info: Training [34mNodalMachine{OneHotEncoder} @ 1…13[39m.
[ Info: Spawning 3 sub-features to one-hot encode feature :x1.
[ Info: Training [34mNodalMachine{UnivariateStandardizer} @ 1…66[39m.
[ Info: Training [34mNodalMachine{KNNRegressor} @ 6…83[39m.
[ Info: Training [34mNodalMachine{DecisionTreeRegressor} @ 4…35[39m.
[ Info: Training [34mNodalMachine{Standardizer} @ 2…61[39m.
[ Info: Training [34mNodalMachine{ConstantClassifier} @ 1…89[39m.
[ Info: Training [34mNodalMachine{Standardizer} @ 2…61[39m.
[ Info: Training [34mNodalMachine{ConstantClassifier} @ 1…89[39m.
[ Info: Training [34mMachine{Composite3} @ 1…27[39m.
[ Info: Training [34mNodalMachine{Standardizer} @ 2…35[39m.
[ Info: Training [34mNodalMachine{ConstantClassifier} @ 1…99[39m.
[ Info: Training [34mMachine{Composite3} @ 1…10[39m.
[ Info: Training [34mNodalMachine{Standardizer} @ 3…91[39m.
[ Info: Training [34mNodalMachine{ConstantClassifier} @ 2…64[39m.
[ Info: Training [34mMachine{CompositeWithNoFields} @ 7…81[39m.
[ Info: Training [34mNodalMachine{Standardizer} @ 9…38[39m.
[ Info: Training [34mNodalMachine{ConstantClassifier} @ 1…74[39m.
[ Info: Training [34mNodalMachine{FeatureSelector} @ 7…68[39m.
[ Info: Training [34mNodalMachine{UnivariateStandardizer} @ 1…19[39m.
[ Info: Training [34mNodalMachine{KNNRegressor} @ 5…97[39m.
[ Info: Training [34mNodalMachine{FeatureSelector} @ 1…87[39m.
[ Info: Training [34mNodalMachine{UnivariateStandardizer} @ 6…25[39m.
[ Info: Training [34mNodalMachine{KNNRegressor} @ 1…52[39m.
[ Info: Updating [34mNodalMachine{FeatureSelector} @ 7…68[39m.
┌ Info: Not retraining [34mNodalMachine{UnivariateStandardizer} @ 1…19[39m.
└  It appears up-to-date. Use `force=true` to force retraining.
[ Info: Training [34mNodalMachine{KNNRegressor} @ 5…97[39m.
[ Info: Updating [34mNodalMachine{FeatureSelector} @ 1…87[39m.
┌ Info: Not retraining [34mNodalMachine{UnivariateStandardizer} @ 6…25[39m.
└  It appears up-to-date. Use `force=true` to force retraining.
[ Info: Training [34mNodalMachine{KNNRegressor} @ 1…52[39m.
[ Info: Training [34mMachine{Pipe} @ 4…32[39m.
[ Info: Training [34mNodalMachine{FeatureSelector} @ 3…47[39m.
[ Info: Training [34mNodalMachine{UnivariateStandardizer} @ 9…47[39m.
[ Info: Training [34mNodalMachine{KNNRegressor} @ 1…66[39m.
[ Info: Training [34mMachine{Pipe21} @ 1…38[39m.
[ Info: Training [34mNodalMachine{OneHotEncoder} @ 1…67[39m.
[ Info: Training [34mNodalMachine{ConstantClassifier} @ 1…24[39m.
[ Info: Training [34mMachine{Piper3} @ 5…00[39m.
[ Info: Training [34mNodalMachine{OneHotEncoder} @ 1…48[39m.
[ Info: Training [34mNodalMachine{ConstantClassifier} @ 1…68[39m.
[ Info: Training [34mMachine{Piper3} @ 9…23[39m.
[ Info: Training [34mNodalMachine{OneHotEncoder} @ 8…99[39m.
[ Info: Training [34mNodalMachine{ConstantClassifier} @ 1…37[39m.
[ Info: Training [34mNodalMachine{OneHotEncoder} @ 1…27[39m.
[ Info: Spawning 3 sub-features to one-hot encode feature :x3.
[ Info: Training [34mNodalMachine{FeatureSelector} @ 1…51[39m.
[ Info: Training [34mNodalMachine{KNNRegressor} @ 9…35[39m.
[ Info: Training [34mMachine{Pipe4} @ 1…17[39m.
[ Info: Training [34mNodalMachine{OneHotEncoder} @ 1…20[39m.
[ Info: Spawning 3 sub-features to one-hot encode feature :x3.
[ Info: Training [34mNodalMachine{FeatureSelector} @ 1…76[39m.
[ Info: Training [34mNodalMachine{StaticTransformer} @ 4…49[39m.
[ Info: Training [34mNodalMachine{KNNRegressor} @ 1…39[39m.
[ Info: Training [34mNodalMachine{StaticTransformer} @ 8…83[39m.
[ Info: Training [34mMachine{Pipe9} @ 1…33[39m.
[ Info: Training [34mNodalMachine{OneHotEncoder} @ 1…89[39m.
[ Info: Spawning 2 sub-features to one-hot encode feature :gender.
[ Info: Training [34mNodalMachine{UnivariateStandardizer} @ 9…05[39m.
[ Info: Training [34mNodalMachine{KNNRegressor} @ 8…97[39m.
[ Info: Training [34mMachine{Pipe99} @ 1…76[39m.
[ Info: Training [34mNodalMachine{OneHotEncoder} @ 5…51[39m.
[ Info: Spawning 2 sub-features to one-hot encode feature :gender.
[ Info: Training [34mNodalMachine{MyTransformer} @ 6…24[39m.
┌ Info: Not retraining [34mNodalMachine{KNNRegressor} @ 5…91[39m.
└  It appears up-to-date. Use `force=true` to force retraining.
[ Info: Training [34mMachine{KNNRegressor} @ 7…09[39m.
[ Info: Training [34mNodalMachine{MyTransformer1} @ 4…24[39m.
[ Info: Training [34mNodalMachine{KNNRegressor} @ 6…79[39m.
[ Info: Training [34mNodalMachine{Standardizer} @ 8…79[39m.
[ Info: Training [34mNodalMachine{UnivariateBoxCoxTransformer} @ 1…82[39m.
[ Info: Training [34mNodalMachine{RidgeRegressor} @ 3…59[39m.
┌ Info: Not retraining [34mNodalMachine{Standardizer} @ 8…79[39m.
└  It appears up-to-date. Use `force=true` to force retraining.
┌ Info: Not retraining [34mNodalMachine{UnivariateBoxCoxTransformer} @ 1…82[39m.
└  It appears up-to-date. Use `force=true` to force retraining.
[ Info: Updating [34mNodalMachine{RidgeRegressor} @ 3…59[39m.
[ Info: Training [34mNodalMachine{Standardizer} @ 1…32[39m.
[ Info: Training [34mNodalMachine{PCA} @ 5…88[39m.
┌ Info: Not retraining [34mNodalMachine{Standardizer} @ 1…32[39m.
└  It appears up-to-date. Use `force=true` to force retraining.
┌ Info: Not retraining [34mNodalMachine{PCA} @ 5…88[39m.
└  It appears up-to-date. Use `force=true` to force retraining.
[ Info: Training [34mNodalMachine{RidgeRegressor} @ 2…41[39m.
[ Info: Training [34mNodalMachine{Standardizer} @ 6…33[39m.
[ Info: Training [34mNodalMachine{PCA} @ 1…03[39m.
[ Info: Training [34mNodalMachine{RidgeRegressor} @ 1…28[39m.
[ Info: Training [34mNodalMachine{Standardizer} @ 1…93[39m.
[ Info: Training [34mNodalMachine{PCA} @ 8…04[39m.
[ Info: Training [34mNodalMachine{UnivariateBoxCoxTransformer} @ 1…75[39m.
[ Info: Training [34mNodalMachine{RidgeRegressor} @ 1…61[39m.
[ Info: Training [34mNodalMachine{DecisionTreeRegressor} @ 7…59[39m.
[ Info: Training [34mNodalMachine{DecisionTreeRegressor} @ 1…62[39m.
[ Info: Training [34mNodalMachine{Standardizer} @ 1…05[39m.
[ Info: Training [34mNodalMachine{UnivariateBoxCoxTransformer} @ 1…73[39m.
[ Info: Training [34mNodalMachine{KNNRegressor} @ 4…78[39m.
[ Info: Training [34mNodalMachine{MyTransformer} @ 1…96[39m.
[ Info: Training [34mNodalMachine{Standardizer} @ 1…75[39m.
[ Info: Training [34mNodalMachine{UnivariateBoxCoxTransformer} @ 2…63[39m.
[ Info: Training [34mNodalMachine{KNNRegressor} @ 6…28[39m.
Test Summary:        | Pass  Total
machines+composition |  292    292
Test Summary: | Pass  Total
hyperparam    |  118    118
Test Summary: | Pass  Total
openml        |   15     15
┌ Warning: Forcibly interrupting busy workers
│   exception = rmprocs: pids [2, 3, 4, 5, 6, 7, 8, 9, 10, 11, 12, 13, 14, 16, 17, 18, 19, 20, 21, 22, 23, 24, 25, 26, 27, 28, 29, 30, 31, 32, 33, 34, 35, 36, 37, 38, 39, 40, 41] not terminated after 5.0 seconds.
└ @ Distributed /buildworker/worker/package_linux64/build/usr/share/julia/stdlib/v1.5/Distributed/src/cluster.jl:1234
┌ Warning: rmprocs: process 1 not removed
└ @ Distributed /buildworker/worker/package_linux64/build/usr/share/julia/stdlib/v1.5/Distributed/src/cluster.jl:1030
    Testing MLJBase tests passed 
