Julia Version 1.6.0-DEV.893
Commit 3db0493ccf (2020-09-11 16:08 UTC)
Platform Info:
  OS: Linux (x86_64-linux-gnu)
  CPU: Intel(R) Xeon(R) Silver 4114 CPU @ 2.20GHz
  WORD_SIZE: 64
  LIBM: libopenlibm
  LLVM: libLLVM-9.0.1 (ORCJIT, skylake-avx512)
Environment:
  JULIA_DEPOT_PATH = ::/usr/local/share/julia
  JULIA_NUM_THREADS = 2

  Resolving package versions...
[ Info: LEGAL NOTICE: package operations send anonymous data about your system to https://pkg.julialang.org (your current package server), including the operating system and Julia versions you are using, and a random client UUID. Running `Pkg.telemetryinfo()` will show exactly what data is sent. See https://julialang.org/legal/data/ for more details about what this data is used for, how long it is retained, and how to opt out of sending it.
  Installed Zlib_jll ───────────────────── v1.2.11+16
  Installed CEnum ──────────────────────── v0.3.0
  Installed Compat ─────────────────────── v3.15.0
  Installed CodeTracking ───────────────── v1.0.2
  Installed Missings ───────────────────── v0.4.4
  Installed LazyStack ──────────────────── v0.0.7
  Installed FillArrays ─────────────────── v0.8.14
  Installed SparseGaussianProcesses ────── v0.1.0
  Installed MatrixFactorizations ───────── v0.5.2
  Installed TimerOutputs ───────────────── v0.5.6
  Installed SortingAlgorithms ──────────── v0.3.1
  Installed ZygoteRules ────────────────── v0.2.0
  Installed OpenSpecFun_jll ────────────── v0.5.3+3
  Installed NamedDims ──────────────────── v0.2.24
  Installed GPUArrays ──────────────────── v3.4.1
  Installed CUDAdrv ────────────────────── v6.3.0
  Installed Colors ─────────────────────── v0.12.4
  Installed CUDAnative ─────────────────── v3.2.0
  Installed NNlib ──────────────────────── v0.6.6
  Installed CompilerSupportLibraries_jll ─ v0.3.3+0
  Installed Reexport ───────────────────── v0.2.0
  Installed CommonSubexpressions ───────── v0.3.0
  Installed FixedPointNumbers ──────────── v0.8.4
  Installed NaNMath ────────────────────── v0.3.4
  Installed MacroTools ─────────────────── v0.5.5
  Installed IRTools ────────────────────── v0.4.1
  Installed LazyArrays ─────────────────── v0.16.16
  Installed OffsetArrays ───────────────── v1.1.3
  Installed ChainRulesCore ─────────────── v0.8.1
  Installed Media ──────────────────────── v0.5.0
  Installed CodecZlib ──────────────────── v0.7.0
  Installed FoldingTrees ───────────────── v1.0.1
  Installed MuladdMacro ────────────────── v0.2.2
  Installed OrderedCollections ─────────── v1.3.0
  Installed LLVM ───────────────────────── v1.7.0
  Installed Zygote ─────────────────────── v0.4.22
  Installed DataAPI ────────────────────── v1.3.0
  Installed Cthulhu ────────────────────── v1.2.2
  Installed AbstractFFTs ───────────────── v0.5.0
  Installed TranscodingStreams ─────────── v0.9.5
  Installed ArrayLayouts ───────────────── v0.3.8
  Installed CUDAapi ────────────────────── v4.0.0
  Installed Requires ───────────────────── v1.0.2
  Installed ChainRules ─────────────────── v0.6.5
  Installed CuArrays ───────────────────── v2.2.2
  Installed DiffResults ────────────────── v1.0.2
  Installed BinaryProvider ─────────────── v0.5.10
  Installed StaticArrays ───────────────── v0.12.4
  Installed DiffRules ──────────────────── v1.0.1
  Installed AbstractTrees ──────────────── v0.3.3
  Installed TensorCast ─────────────────── v0.2.2
  Installed SpecialFunctions ───────────── v0.10.3
  Installed DataStructures ─────────────── v0.17.20
  Installed ZipFile ────────────────────── v0.9.2
  Installed ColorTypes ─────────────────── v0.10.9
  Installed ExprTools ──────────────────── v0.1.2
  Installed Juno ───────────────────────── v0.8.3
  Installed Adapt ──────────────────────── v1.1.0
  Installed ForwardDiff ────────────────── v0.10.12
  Installed GPUCompiler ────────────────── v0.2.0
  Installed StatsBase ──────────────────── v0.33.1
  Installed Flux ───────────────────────── v0.10.4
Updating `~/.julia/environments/v1.6/Project.toml`
  [48e2ed6f] + SparseGaussianProcesses v0.1.0
Updating `~/.julia/environments/v1.6/Manifest.toml`
  [621f4979] + AbstractFFTs v0.5.0
  [1520ce14] + AbstractTrees v0.3.3
  [79e6a3ab] + Adapt v1.1.0
  [4c555306] + ArrayLayouts v0.3.8
  [b99e7846] + BinaryProvider v0.5.10
  [fa961155] + CEnum v0.3.0
  [3895d2a7] + CUDAapi v4.0.0
  [c5f51814] + CUDAdrv v6.3.0
  [be33ccc6] + CUDAnative v3.2.0
  [082447d4] + ChainRules v0.6.5
  [d360d2e6] + ChainRulesCore v0.8.1
  [da1fd8a2] + CodeTracking v1.0.2
  [944b1d66] + CodecZlib v0.7.0
  [3da002f7] + ColorTypes v0.10.9
  [5ae59095] + Colors v0.12.4
  [bbf7d656] + CommonSubexpressions v0.3.0
  [34da2185] + Compat v3.15.0
  [e66e0078] + CompilerSupportLibraries_jll v0.3.3+0
  [f68482b8] + Cthulhu v1.2.2
  [3a865a2d] + CuArrays v2.2.2
  [9a962f9c] + DataAPI v1.3.0
  [864edb3b] + DataStructures v0.17.20
  [163ba53b] + DiffResults v1.0.2
  [b552c78f] + DiffRules v1.0.1
  [e2ba6199] + ExprTools v0.1.2
  [1a297f60] + FillArrays v0.8.14
  [53c48c17] + FixedPointNumbers v0.8.4
  [587475ba] + Flux v0.10.4
  [1eca21be] + FoldingTrees v1.0.1
  [f6369f11] + ForwardDiff v0.10.12
  [0c68f7d7] + GPUArrays v3.4.1
  [61eb1bfa] + GPUCompiler v0.2.0
  [7869d1d1] + IRTools v0.4.1
  [e5e0dc1b] + Juno v0.8.3
  [929cbde3] + LLVM v1.7.0
  [5078a376] + LazyArrays v0.16.16
  [1fad7336] + LazyStack v0.0.7
  [1914dd2f] + MacroTools v0.5.5
  [a3b82374] + MatrixFactorizations v0.5.2
  [e89f7d12] + Media v0.5.0
  [e1d29d7a] + Missings v0.4.4
  [46d2c3a1] + MuladdMacro v0.2.2
  [872c559c] + NNlib v0.6.6
  [77ba4419] + NaNMath v0.3.4
  [356022a1] + NamedDims v0.2.24
  [6fe1bfb0] + OffsetArrays v1.1.3
  [efe28fd5] + OpenSpecFun_jll v0.5.3+3
  [bac558e1] + OrderedCollections v1.3.0
  [189a3867] + Reexport v0.2.0
  [ae029012] + Requires v1.0.2
  [a2af1166] + SortingAlgorithms v0.3.1
  [48e2ed6f] + SparseGaussianProcesses v0.1.0
  [276daf66] + SpecialFunctions v0.10.3
  [90137ffa] + StaticArrays v0.12.4
  [2913bbd2] + StatsBase v0.33.1
  [02d47bb6] + TensorCast v0.2.2
  [a759f4b9] + TimerOutputs v0.5.6
  [3bb67fe8] + TranscodingStreams v0.9.5
  [a5390f91] + ZipFile v0.9.2
  [83775a58] + Zlib_jll v1.2.11+16
  [e88e6eb3] + Zygote v0.4.22
  [700de1a5] + ZygoteRules v0.2.0
  [2a0f44e3] + Base64
  [ade2ca70] + Dates
  [8bb1440f] + DelimitedFiles
  [8ba89e20] + Distributed
  [9fa8497b] + Future
  [b77e0a4c] + InteractiveUtils
  [76f85450] + LibGit2
  [8f399da3] + Libdl
  [37e2e46d] + LinearAlgebra
  [56ddb016] + Logging
  [d6f4376e] + Markdown
  [a63ad114] + Mmap
  [44cfe95a] + Pkg
  [de0858da] + Printf
  [9abbd945] + Profile
  [3fa0cd96] + REPL
  [9a3f8284] + Random
  [ea8e919c] + SHA
  [9e88b42a] + Serialization
  [1a1011a3] + SharedArrays
  [6462fe0b] + Sockets
  [2f01184e] + SparseArrays
  [10745b16] + Statistics
  [fa267f1f] + TOML
  [8dfed614] + Test
  [cf7118a7] + UUIDs
  [4ec0a83e] + Unicode
   Building NNlib → `~/.julia/packages/NNlib/FAI3o/deps/build.log`
    Testing SparseGaussianProcesses
Status `/tmp/jl_Wh6VyS/Project.toml`
  [587475ba] Flux v0.10.4
  [92933f4c] ProgressMeter v1.3.2
  [ae029012] Requires v1.0.2
  [48e2ed6f] SparseGaussianProcesses v0.1.0
  [02d47bb6] TensorCast v0.2.2
  [37e2e46d] LinearAlgebra
  [9a3f8284] Random
  [10745b16] Statistics
  [8dfed614] Test
Status `/tmp/jl_Wh6VyS/Manifest.toml`
  [621f4979] AbstractFFTs v0.5.0
  [1520ce14] AbstractTrees v0.3.3
  [79e6a3ab] Adapt v1.1.0
  [4c555306] ArrayLayouts v0.3.8
  [b99e7846] BinaryProvider v0.5.10
  [fa961155] CEnum v0.3.0
  [3895d2a7] CUDAapi v4.0.0
  [c5f51814] CUDAdrv v6.3.0
  [be33ccc6] CUDAnative v3.2.0
  [082447d4] ChainRules v0.6.5
  [d360d2e6] ChainRulesCore v0.8.1
  [da1fd8a2] CodeTracking v1.0.2
  [944b1d66] CodecZlib v0.7.0
  [3da002f7] ColorTypes v0.10.9
  [5ae59095] Colors v0.12.4
  [bbf7d656] CommonSubexpressions v0.3.0
  [34da2185] Compat v3.15.0
  [e66e0078] CompilerSupportLibraries_jll v0.3.3+0
  [f68482b8] Cthulhu v1.2.2
  [3a865a2d] CuArrays v2.2.2
  [9a962f9c] DataAPI v1.3.0
  [864edb3b] DataStructures v0.17.20
  [163ba53b] DiffResults v1.0.2
  [b552c78f] DiffRules v1.0.1
  [e2ba6199] ExprTools v0.1.2
  [1a297f60] FillArrays v0.8.14
  [53c48c17] FixedPointNumbers v0.8.4
  [587475ba] Flux v0.10.4
  [1eca21be] FoldingTrees v1.0.1
  [f6369f11] ForwardDiff v0.10.12
  [0c68f7d7] GPUArrays v3.4.1
  [61eb1bfa] GPUCompiler v0.2.0
  [7869d1d1] IRTools v0.4.1
  [e5e0dc1b] Juno v0.8.3
  [929cbde3] LLVM v1.7.0
  [5078a376] LazyArrays v0.16.16
  [1fad7336] LazyStack v0.0.7
  [1914dd2f] MacroTools v0.5.5
  [a3b82374] MatrixFactorizations v0.5.2
  [e89f7d12] Media v0.5.0
  [e1d29d7a] Missings v0.4.4
  [46d2c3a1] MuladdMacro v0.2.2
  [872c559c] NNlib v0.6.6
  [77ba4419] NaNMath v0.3.4
  [356022a1] NamedDims v0.2.24
  [6fe1bfb0] OffsetArrays v1.1.3
  [efe28fd5] OpenSpecFun_jll v0.5.3+3
  [bac558e1] OrderedCollections v1.3.0
  [92933f4c] ProgressMeter v1.3.2
  [189a3867] Reexport v0.2.0
  [ae029012] Requires v1.0.2
  [a2af1166] SortingAlgorithms v0.3.1
  [48e2ed6f] SparseGaussianProcesses v0.1.0
  [276daf66] SpecialFunctions v0.10.3
  [90137ffa] StaticArrays v0.12.4
  [2913bbd2] StatsBase v0.33.1
  [02d47bb6] TensorCast v0.2.2
  [a759f4b9] TimerOutputs v0.5.6
  [3bb67fe8] TranscodingStreams v0.9.5
  [a5390f91] ZipFile v0.9.2
  [83775a58] Zlib_jll v1.2.11+16
  [e88e6eb3] Zygote v0.4.22
  [700de1a5] ZygoteRules v0.2.0
  [2a0f44e3] Base64
  [ade2ca70] Dates
  [8bb1440f] DelimitedFiles
  [8ba89e20] Distributed
  [9fa8497b] Future
  [b77e0a4c] InteractiveUtils
  [76f85450] LibGit2
  [8f399da3] Libdl
  [37e2e46d] LinearAlgebra
  [56ddb016] Logging
  [d6f4376e] Markdown
  [a63ad114] Mmap
  [44cfe95a] Pkg
  [de0858da] Printf
  [9abbd945] Profile
  [3fa0cd96] REPL
  [9a3f8284] Random
  [ea8e919c] SHA
  [9e88b42a] Serialization
  [1a1011a3] SharedArrays
  [6462fe0b] Sockets
  [2f01184e] SparseArrays
  [10745b16] Statistics
  [fa267f1f] TOML
  [8dfed614] Test
  [cf7118a7] UUIDs
  [4ec0a83e] Unicode
    Testing Running tests...
┌ Warning: `haskey(::TargetIterator, name::String)` is deprecated, use `Target(; name = name) !== nothing` instead.
│   caller = llvm_compat(version::VersionNumber) at compatibility.jl:176
└ @ CUDAnative ~/.julia/packages/CUDAnative/C91oY/src/compatibility.jl:176
WARNING: Method definition _pullback(Zygote.Context, typeof(Random.randn!), Any...) in module Zygote at /home/pkgeval/.julia/packages/Zygote/1GXzF/src/lib/grad.jl:8 overwritten in module SparseGaussianProcesses on the same line (check for duplicate calls to `include`).
  ** incremental compilation may be fatally broken for this module **

WARNING: Method definition +(LinearAlgebra.UnitUpperTriangular{T, #s31} where #s31<:(GPUArrays.AbstractGPUArray{T, 2} where T), LinearAlgebra.UniformScaling{T} where T<:Number) where {T} in module GPUArrays at /home/pkgeval/.julia/packages/GPUArrays/JqOUg/src/host/uniformscaling.jl:33 overwritten in module UniformScalingGPU at /home/pkgeval/.julia/packages/SparseGaussianProcesses/emEpO/src/gpu.jl:82.
  ** incremental compilation may be fatally broken for this module **

WARNING: Method definition -(LinearAlgebra.UniformScaling{T} where T<:Number, LinearAlgebra.UnitUpperTriangular{T, #s30} where #s30<:(GPUArrays.AbstractGPUArray{T, 2} where T)) where {T} in module GPUArrays at /home/pkgeval/.julia/packages/GPUArrays/JqOUg/src/host/uniformscaling.jl:41 overwritten in module UniformScalingGPU at /home/pkgeval/.julia/packages/SparseGaussianProcesses/emEpO/src/gpu.jl:89.
  ** incremental compilation may be fatally broken for this module **

WARNING: Method definition +(LinearAlgebra.UnitLowerTriangular{T, #s31} where #s31<:(GPUArrays.AbstractGPUArray{T, 2} where T), LinearAlgebra.UniformScaling{T} where T<:Number) where {T} in module GPUArrays at /home/pkgeval/.julia/packages/GPUArrays/JqOUg/src/host/uniformscaling.jl:33 overwritten in module UniformScalingGPU at /home/pkgeval/.julia/packages/SparseGaussianProcesses/emEpO/src/gpu.jl:82.
  ** incremental compilation may be fatally broken for this module **

WARNING: Method definition -(LinearAlgebra.UniformScaling{T} where T<:Number, LinearAlgebra.UnitLowerTriangular{T, #s30} where #s30<:(GPUArrays.AbstractGPUArray{T, 2} where T)) where {T} in module GPUArrays at /home/pkgeval/.julia/packages/GPUArrays/JqOUg/src/host/uniformscaling.jl:41 overwritten in module UniformScalingGPU at /home/pkgeval/.julia/packages/SparseGaussianProcesses/emEpO/src/gpu.jl:89.
  ** incremental compilation may be fatally broken for this module **

WARNING: Method definition +(LinearAlgebra.LowerTriangular{T, #s31} where #s31<:(GPUArrays.AbstractGPUArray{T, 2} where T), LinearAlgebra.UniformScaling{T} where T<:Number) where {T} in module GPUArrays at /home/pkgeval/.julia/packages/GPUArrays/JqOUg/src/host/uniformscaling.jl:53 overwritten in module UniformScalingGPU at /home/pkgeval/.julia/packages/SparseGaussianProcesses/emEpO/src/gpu.jl:100.
  ** incremental compilation may be fatally broken for this module **

WARNING: Method definition -(LinearAlgebra.UniformScaling{T} where T<:Number, LinearAlgebra.LowerTriangular{T, #s30} where #s30<:(GPUArrays.AbstractGPUArray{T, 2} where T)) where {T} in module GPUArrays at /home/pkgeval/.julia/packages/GPUArrays/JqOUg/src/host/uniformscaling.jl:61 overwritten in module UniformScalingGPU at /home/pkgeval/.julia/packages/SparseGaussianProcesses/emEpO/src/gpu.jl:107.
  ** incremental compilation may be fatally broken for this module **

WARNING: Method definition +(LinearAlgebra.UpperTriangular{T, #s31} where #s31<:(GPUArrays.AbstractGPUArray{T, 2} where T), LinearAlgebra.UniformScaling{T} where T<:Number) where {T} in module GPUArrays at /home/pkgeval/.julia/packages/GPUArrays/JqOUg/src/host/uniformscaling.jl:53 overwritten in module UniformScalingGPU at /home/pkgeval/.julia/packages/SparseGaussianProcesses/emEpO/src/gpu.jl:100.
  ** incremental compilation may be fatally broken for this module **

WARNING: Method definition -(LinearAlgebra.UniformScaling{T} where T<:Number, LinearAlgebra.UpperTriangular{T, #s30} where #s30<:(GPUArrays.AbstractGPUArray{T, 2} where T)) where {T} in module GPUArrays at /home/pkgeval/.julia/packages/GPUArrays/JqOUg/src/host/uniformscaling.jl:61 overwritten in module UniformScalingGPU at /home/pkgeval/.julia/packages/SparseGaussianProcesses/emEpO/src/gpu.jl:107.
  ** incremental compilation may be fatally broken for this module **

WARNING: Method definition +(LinearAlgebra.Hermitian{T, #s31} where #s31<:(GPUArrays.AbstractGPUArray{T, 2} where T), LinearAlgebra.UniformScaling{T} where T<:Number) where {T} in module GPUArrays at /home/pkgeval/.julia/packages/GPUArrays/JqOUg/src/host/uniformscaling.jl:53 overwritten in module UniformScalingGPU at /home/pkgeval/.julia/packages/SparseGaussianProcesses/emEpO/src/gpu.jl:100.
  ** incremental compilation may be fatally broken for this module **

WARNING: Method definition -(LinearAlgebra.UniformScaling{T} where T<:Number, LinearAlgebra.Hermitian{T, #s30} where #s30<:(GPUArrays.AbstractGPUArray{T, 2} where T)) where {T} in module GPUArrays at /home/pkgeval/.julia/packages/GPUArrays/JqOUg/src/host/uniformscaling.jl:61 overwritten in module UniformScalingGPU at /home/pkgeval/.julia/packages/SparseGaussianProcesses/emEpO/src/gpu.jl:107.
  ** incremental compilation may be fatally broken for this module **

WARNING: Method definition +(LinearAlgebra.Symmetric{T, #s31} where #s31<:(GPUArrays.AbstractGPUArray{T, 2} where T), LinearAlgebra.UniformScaling{T} where T<:Number) where {T} in module GPUArrays at /home/pkgeval/.julia/packages/GPUArrays/JqOUg/src/host/uniformscaling.jl:53 overwritten in module UniformScalingGPU at /home/pkgeval/.julia/packages/SparseGaussianProcesses/emEpO/src/gpu.jl:100.
  ** incremental compilation may be fatally broken for this module **

WARNING: Method definition -(LinearAlgebra.UniformScaling{T} where T<:Number, LinearAlgebra.Symmetric{T, #s30} where #s30<:(GPUArrays.AbstractGPUArray{T, 2} where T)) where {T} in module GPUArrays at /home/pkgeval/.julia/packages/GPUArrays/JqOUg/src/host/uniformscaling.jl:61 overwritten in module UniformScalingGPU at /home/pkgeval/.julia/packages/SparseGaussianProcesses/emEpO/src/gpu.jl:107.
  ** incremental compilation may be fatally broken for this module **

WARNING: Method definition +(LinearAlgebra.Hermitian{T, #s31} where #s31<:(GPUArrays.AbstractGPUArray{T, 2} where T), LinearAlgebra.UniformScaling{#s30} where #s30<:(Base.Complex{T} where T<:Real)) where {T} in module GPUArrays at /home/pkgeval/.julia/packages/GPUArrays/JqOUg/src/host/uniformscaling.jl:72 overwritten in module UniformScalingGPU at /home/pkgeval/.julia/packages/SparseGaussianProcesses/emEpO/src/gpu.jl:117.
  ** incremental compilation may be fatally broken for this module **

WARNING: Method definition -(LinearAlgebra.UniformScaling{#s31} where #s31<:(Base.Complex{T} where T<:Real), LinearAlgebra.Hermitian{T, #s30} where #s30<:(GPUArrays.AbstractGPUArray{T, 2} where T)) where {T} in module GPUArrays at /home/pkgeval/.julia/packages/GPUArrays/JqOUg/src/host/uniformscaling.jl:80 overwritten in module UniformScalingGPU at /home/pkgeval/.julia/packages/SparseGaussianProcesses/emEpO/src/gpu.jl:124.
  ** incremental compilation may be fatally broken for this module **

WARNING: Method definition +(GPUArrays.AbstractGPUArray{T, 2}, LinearAlgebra.UniformScaling{T} where T<:Number) where {T} in module GPUArrays at /home/pkgeval/.julia/packages/GPUArrays/JqOUg/src/host/uniformscaling.jl:89 overwritten in module UniformScalingGPU at /home/pkgeval/.julia/packages/SparseGaussianProcesses/emEpO/src/gpu.jl:132.
  ** incremental compilation may be fatally broken for this module **

WARNING: Method definition -(LinearAlgebra.UniformScaling{T} where T<:Number, GPUArrays.AbstractGPUArray{T, 2}) where {T} in module GPUArrays at /home/pkgeval/.julia/packages/GPUArrays/JqOUg/src/host/uniformscaling.jl:97 overwritten in module UniformScalingGPU at /home/pkgeval/.julia/packages/SparseGaussianProcesses/emEpO/src/gpu.jl:139.
  ** incremental compilation may be fatally broken for this module **

┌ Warning: `haskey(::TargetIterator, name::String)` is deprecated, use `Target(; name = name) !== nothing` instead.
│   caller = llvm_compat(version::VersionNumber) at compatibility.jl:176
└ @ CUDAnative ~/.julia/packages/CUDAnative/C91oY/src/compatibility.jl:176
Progress:   1%%|▁                                        |  ETA: 0:06:45[KProgress:   6%%|██▌                                      |  ETA: 0:01:35[KProgress:   7%%|██▉                                      |  ETA: 0:01:22[KProgress:   8%%|███▎                                     |  ETA: 0:01:13[KProgress:   9%%|███▊                                     |  ETA: 0:01:07[KProgress:  10%%|████▁                                    |  ETA: 0:01:01[KProgress:  11%%|████▌                                    |  ETA: 0:00:56[KProgress:  12%%|████▉                                    |  ETA: 0:00:53[KProgress:  13%%|█████▁                                   |  ETA: 0:00:49[KProgress:  14%%|█████▊                                   |  ETA: 0:00:46[KProgress:  15%%|██████▁                                  |  ETA: 0:00:44[KProgress:  16%%|██████▌                                  |  ETA: 0:00:42[KProgress:  17%%|███████                                  |  ETA: 0:00:40[KProgress:  18%%|███████▁                                 |  ETA: 0:00:38[KProgress:  19%%|███████▊                                 |  ETA: 0:00:37[KProgress:  20%%|████████▎                                |  ETA: 0:00:35[KProgress:  21%%|████████▋                                |  ETA: 0:00:34[KProgress:  22%%|█████████                                |  ETA: 0:00:32[KProgress:  23%%|█████████▁                               |  ETA: 0:00:31[KProgress:  24%%|█████████▉                               |  ETA: 0:00:30[KProgress:  25%%|██████████▎                              |  ETA: 0:00:29[KProgress:  26%%|██████████▋                              |  ETA: 0:00:29[KProgress:  27%%|███████████▁                             |  ETA: 0:00:28[KProgress:  28%%|███████████▌                             |  ETA: 0:00:27[KProgress:  29%%|███████████▉                             |  ETA: 0:00:26[KProgress:  30%%|████████████▎                            |  ETA: 0:00:25[KProgress:  31%%|████████████▊                            |  ETA: 0:00:25[KProgress:  32%%|█████████████▁                           |  ETA: 0:00:24[KProgress:  33%%|█████████████▌                           |  ETA: 0:00:23[KProgress:  34%%|██████████████                           |  ETA: 0:00:23[KProgress:  35%%|██████████████▁                          |  ETA: 0:00:22[KProgress:  36%%|██████████████▊                          |  ETA: 0:00:21[KProgress:  37%%|███████████████▁                         |  ETA: 0:00:21[KProgress:  38%%|███████████████▋                         |  ETA: 0:00:20[KProgress:  39%%|████████████████                         |  ETA: 0:00:20[KProgress:  40%%|████████████████▁                        |  ETA: 0:00:19[KProgress:  41%%|████████████████▊                        |  ETA: 0:00:19[KProgress:  42%%|█████████████████▎                       |  ETA: 0:00:18[KProgress:  43%%|█████████████████▋                       |  ETA: 0:00:18[KProgress:  44%%|██████████████████                       |  ETA: 0:00:17[KProgress:  45%%|██████████████████▌                      |  ETA: 0:00:17[KProgress:  46%%|██████████████████▉                      |  ETA: 0:00:16[KProgress:  47%%|███████████████████▎                     |  ETA: 0:00:16[KProgress:  48%%|███████████████████▋                     |  ETA: 0:00:15[KProgress:  49%%|████████████████████▁                    |  ETA: 0:00:15[KProgress:  50%%|████████████████████▌                    |  ETA: 0:00:14[KProgress:  51%%|████████████████████▉                    |  ETA: 0:00:14[KProgress:  52%%|█████████████████████▁                   |  ETA: 0:00:14[KProgress:  53%%|█████████████████████▊                   |  ETA: 0:00:13[KProgress:  54%%|██████████████████████▁                  |  ETA: 0:00:13[KProgress:  55%%|██████████████████████▌                  |  ETA: 0:00:13[KProgress:  56%%|███████████████████████                  |  ETA: 0:00:12[KProgress:  57%%|███████████████████████▁                 |  ETA: 0:00:12[KProgress:  58%%|███████████████████████▊                 |  ETA: 0:00:12[KProgress:  59%%|████████████████████████▎                |  ETA: 0:00:11[KProgress:  60%%|████████████████████████▋                |  ETA: 0:00:11[KProgress:  61%%|█████████████████████████                |  ETA: 0:00:11[KProgress:  62%%|█████████████████████████▁               |  ETA: 0:00:10[KProgress:  63%%|█████████████████████████▉               |  ETA: 0:00:10[KProgress:  64%%|██████████████████████████▎              |  ETA: 0:00:10[KProgress:  66%%|███████████████████████████              |  ETA: 0:00:09[KProgress:  67%%|███████████████████████████▌             |  ETA: 0:00:09[KProgress:  68%%|███████████████████████████▉             |  ETA: 0:00:09[KProgress:  69%%|████████████████████████████▎            |  ETA: 0:00:08[KProgress:  70%%|████████████████████████████▊            |  ETA: 0:00:08[KProgress:  71%%|█████████████████████████████▁           |  ETA: 0:00:08[KProgress:  72%%|█████████████████████████████▌           |  ETA: 0:00:07[KProgress:  73%%|█████████████████████████████▉           |  ETA: 0:00:07[KProgress:  74%%|██████████████████████████████▁          |  ETA: 0:00:07[KProgress:  75%%|██████████████████████████████▊          |  ETA: 0:00:06[KProgress:  76%%|███████████████████████████████▁         |  ETA: 0:00:06[KProgress:  78%%|████████████████████████████████         |  ETA: 0:00:06[KProgress:  79%%|████████████████████████████████▁        |  ETA: 0:00:05[KProgress:  80%%|████████████████████████████████▊        |  ETA: 0:00:05[KProgress:  81%%|█████████████████████████████████▎       |  ETA: 0:00:05[KProgress:  82%%|█████████████████████████████████▋       |  ETA: 0:00:04[KProgress:  83%%|██████████████████████████████████       |  ETA: 0:00:04[KProgress:  84%%|██████████████████████████████████▌      |  ETA: 0:00:04[KProgress:  85%%|██████████████████████████████████▉      |  ETA: 0:00:04[KProgress:  86%%|███████████████████████████████████▎     |  ETA: 0:00:03[KProgress:  87%%|███████████████████████████████████▋     |  ETA: 0:00:03[KProgress:  88%%|████████████████████████████████████▁    |  ETA: 0:00:03[KProgress:  89%%|████████████████████████████████████▌    |  ETA: 0:00:03[KProgress:  90%%|████████████████████████████████████▉    |  ETA: 0:00:02[KProgress:  91%%|█████████████████████████████████████▎   |  ETA: 0:00:02[KProgress:  92%%|█████████████████████████████████████▊   |  ETA: 0:00:02[KProgress:  93%%|██████████████████████████████████████▁  |  ETA: 0:00:02[KProgress:  94%%|██████████████████████████████████████▌  |  ETA: 0:00:01[KProgress:  95%%|███████████████████████████████████████  |  ETA: 0:00:01[KProgress:  96%%|███████████████████████████████████████▁ |  ETA: 0:00:01[KProgress:  97%%|███████████████████████████████████████▊ |  ETA: 0:00:01[KProgress:  98%%|████████████████████████████████████████▁|  ETA: 0:00:00[KProgress:  99%%|████████████████████████████████████████▋|  ETA: 0:00:00[KProgress: 100%%|█████████████████████████████████████████| Time: 0:00:24[K
[ Info: Skipping slow RFF test
[ Info: Skipping slow RFF test
[ Info: Skipping slow RFF test
[ Info: Skipping slow RFF test
[ Info: Skipping slow RFF test
[ Info: Skipping slow RFF test
[ Info: Skipping slow RFF test
[ Info: Skipping slow RFF test
[ Info: Skipping slow RFF test
[ Info: Skipping slow RFF test
[ Info: Skipping slow RFF test
[ Info: Skipping slow RFF test
[ Info: Skipping slow RFF test
[ Info: Skipping slow RFF test
[ Info: Skipping slow RFF test
[ Info: Skipping slow RFF test
[ Info: Skipping slow RFF test
[ Info: Skipping slow RFF test
[ Info: Skipping slow RFF test
[ Info: Skipping slow RFF test
[ Info: Skipping slow RFF test
[ Info: Skipping slow RFF test
[ Info: Skipping slow RFF test
[ Info: Skipping slow RFF test
[ Info: Skipping slow RFF test
[ Info: Skipping slow RFF test
[ Info: Skipping slow RFF test
[ Info: Skipping slow RFF test
[ Info: Skipping slow RFF test
[ Info: Skipping slow RFF test
[ Info: Skipping slow RFF test
[ Info: Skipping slow RFF test
[ Info: Skipping slow RFF test
[ Info: Skipping slow RFF test
[ Info: Skipping slow RFF test
inducing: Error During Test at /home/pkgeval/.julia/packages/SparseGaussianProcesses/emEpO/test/runtests.jl:90
  Got exception outside of a @test
  DimensionMismatch("second dimension of D, 10, does not match length of V, 1")
  Stacktrace:
    [1] *(D::Diagonal{Bool, Vector{Bool}}, V::Vector{Float64})
      @ LinearAlgebra /workspace/srcdir/usr/share/julia/stdlib/v1.6/LinearAlgebra/src/diagonal.jl:189
    [2] MarginalInducingPoints(k::SquaredExponentialKernel{Vector{Float64}, NormalHyperprior{Vector{Float64}}}, num_inducing::Int64)
      @ SparseGaussianProcesses ~/.julia/packages/SparseGaussianProcesses/emEpO/src/inducing.jl:43
    [3] top-level scope
      @ ~/.julia/packages/SparseGaussianProcesses/emEpO/test/runtests.jl:95
    [4] top-level scope
      @ /workspace/srcdir/usr/share/julia/stdlib/v1.6/Test/src/Test.jl:1113
    [5] top-level scope
      @ ~/.julia/packages/SparseGaussianProcesses/emEpO/test/runtests.jl:91
    [6] top-level scope
      @ /workspace/srcdir/usr/share/julia/stdlib/v1.6/Test/src/Test.jl:1113
    [7] top-level scope
      @ ~/.julia/packages/SparseGaussianProcesses/emEpO/test/runtests.jl:13
    [8] include(fname::String)
      @ Base.MainInclude ./client.jl:444
    [9] top-level scope
      @ none:6
   [10] eval(m::Module, e::Any)
      @ Core ./boot.jl:345
   [11] exec_options(opts::Base.JLOptions)
      @ Base ./client.jl:261
   [12] _start()
      @ Base ./client.jl:485
gp: Error During Test at /home/pkgeval/.julia/packages/SparseGaussianProcesses/emEpO/test/runtests.jl:140
  Got exception outside of a @test
  DimensionMismatch("second dimension of D, 10, does not match length of V, 1")
  Stacktrace:
    [1] *(D::Diagonal{Bool, Vector{Bool}}, V::Vector{Float64})
      @ LinearAlgebra /workspace/srcdir/usr/share/julia/stdlib/v1.6/LinearAlgebra/src/diagonal.jl:189
    [2] MarginalInducingPoints(k::SquaredExponentialKernel{Vector{Float64}, NormalHyperprior{Vector{Float64}}}, num_inducing::Int64)
      @ SparseGaussianProcesses ~/.julia/packages/SparseGaussianProcesses/emEpO/src/inducing.jl:43
    [3] SparseGaussianProcess(k::SquaredExponentialKernel{Vector{Float64}, NormalHyperprior{Vector{Float64}}})
      @ SparseGaussianProcesses ~/.julia/packages/SparseGaussianProcesses/emEpO/src/gp.jl:133
    [4] top-level scope
      @ ~/.julia/packages/SparseGaussianProcesses/emEpO/test/runtests.jl:154
    [5] top-level scope
      @ /workspace/srcdir/usr/share/julia/stdlib/v1.6/Test/src/Test.jl:1113
    [6] top-level scope
      @ ~/.julia/packages/SparseGaussianProcesses/emEpO/test/runtests.jl:141
    [7] top-level scope
      @ /workspace/srcdir/usr/share/julia/stdlib/v1.6/Test/src/Test.jl:1113
    [8] top-level scope
      @ ~/.julia/packages/SparseGaussianProcesses/emEpO/test/runtests.jl:13
    [9] include(fname::String)
      @ Base.MainInclude ./client.jl:444
   [10] top-level scope
      @ none:6
   [11] eval(m::Module, e::Any)
      @ Core ./boot.jl:345
   [12] exec_options(opts::Base.JLOptions)
      @ Base ./client.jl:261
   [13] _start()
      @ Base ./client.jl:485
loss: Error During Test at /home/pkgeval/.julia/packages/SparseGaussianProcesses/emEpO/test/runtests.jl:204
  Got exception outside of a @test
  DimensionMismatch("second dimension of D, 10, does not match length of V, 1")
  Stacktrace:
    [1] *(D::Diagonal{Bool, Vector{Bool}}, V::Vector{Float64})
      @ LinearAlgebra /workspace/srcdir/usr/share/julia/stdlib/v1.6/LinearAlgebra/src/diagonal.jl:189
    [2] MarginalInducingPoints(k::SquaredExponentialKernel{Vector{Float64}, NormalHyperprior{Vector{Float64}}}, num_inducing::Int64)
      @ SparseGaussianProcesses ~/.julia/packages/SparseGaussianProcesses/emEpO/src/inducing.jl:43
    [3] SparseGaussianProcess(k::SquaredExponentialKernel{Vector{Float64}, NormalHyperprior{Vector{Float64}}})
      @ SparseGaussianProcesses ~/.julia/packages/SparseGaussianProcesses/emEpO/src/gp.jl:133
    [4] top-level scope
      @ ~/.julia/packages/SparseGaussianProcesses/emEpO/test/runtests.jl:206
    [5] top-level scope
      @ /workspace/srcdir/usr/share/julia/stdlib/v1.6/Test/src/Test.jl:1113
    [6] top-level scope
      @ ~/.julia/packages/SparseGaussianProcesses/emEpO/test/runtests.jl:205
    [7] top-level scope
      @ /workspace/srcdir/usr/share/julia/stdlib/v1.6/Test/src/Test.jl:1113
    [8] top-level scope
      @ ~/.julia/packages/SparseGaussianProcesses/emEpO/test/runtests.jl:13
    [9] include(fname::String)
      @ Base.MainInclude ./client.jl:444
   [10] top-level scope
      @ none:6
   [11] eval(m::Module, e::Any)
      @ Core ./boot.jl:345
   [12] exec_options(opts::Base.JLOptions)
      @ Base ./client.jl:261
   [13] _start()
      @ Base ./client.jl:485
Test Summary:           | Pass  Error  Broken  Total
SparseGaussianProcesses |   58      3      35     96
  hyperprior            |    3                     3
  kernel                |   18                    18
  randomfeature         |   37             35     72
  inducing              |           1              1
  gp                    |           1              1
  loss                  |           1              1
  gpu                   |                      No tests
ERROR: LoadError: Some tests did not pass: 58 passed, 0 failed, 3 errored, 35 broken.
in expression starting at /home/pkgeval/.julia/packages/SparseGaussianProcesses/emEpO/test/runtests.jl:11
ERROR: Package SparseGaussianProcesses errored during testing
Stacktrace:
  [1] pkgerror(::String, ::Vararg{String, N} where N)
    @ Pkg.Types /workspace/srcdir/usr/share/julia/stdlib/v1.6/Pkg/src/Types.jl:52
  [2] test(ctx::Pkg.Types.Context, pkgs::Vector{Pkg.Types.PackageSpec}; coverage::Bool, julia_args::Cmd, test_args::Cmd, test_fn::Nothing)
    @ Pkg.Operations /workspace/srcdir/usr/share/julia/stdlib/v1.6/Pkg/src/Operations.jl:1580
  [3] test(ctx::Pkg.Types.Context, pkgs::Vector{Pkg.Types.PackageSpec}; coverage::Bool, test_fn::Nothing, julia_args::Cmd, test_args::Cmd, kwargs::Base.Iterators.Pairs{Union{}, Union{}, Tuple{}, NamedTuple{(), Tuple{}}})
    @ Pkg.API /workspace/srcdir/usr/share/julia/stdlib/v1.6/Pkg/src/API.jl:328
  [4] test(ctx::Pkg.Types.Context, pkgs::Vector{Pkg.Types.PackageSpec})
    @ Pkg.API /workspace/srcdir/usr/share/julia/stdlib/v1.6/Pkg/src/API.jl:315
  [5] #test#62
    @ /workspace/srcdir/usr/share/julia/stdlib/v1.6/Pkg/src/API.jl:67 [inlined]
  [6] test
    @ /workspace/srcdir/usr/share/julia/stdlib/v1.6/Pkg/src/API.jl:67 [inlined]
  [7] #test#61
    @ /workspace/srcdir/usr/share/julia/stdlib/v1.6/Pkg/src/API.jl:66 [inlined]
  [8] test
    @ /workspace/srcdir/usr/share/julia/stdlib/v1.6/Pkg/src/API.jl:66 [inlined]
  [9] test(pkg::String; kwargs::Base.Iterators.Pairs{Union{}, Union{}, Tuple{}, NamedTuple{(), Tuple{}}})
    @ Pkg.API /workspace/srcdir/usr/share/julia/stdlib/v1.6/Pkg/src/API.jl:65
 [10] test(pkg::String)
    @ Pkg.API /workspace/srcdir/usr/share/julia/stdlib/v1.6/Pkg/src/API.jl:65
 [11] top-level scope
    @ none:19
