Current time is 2020-10-24T18:36:11.219
Julia Version 1.6.0-DEV.1334
Commit be72f6beb0 (2020-10-24 16:40 UTC)
Platform Info:
  OS: Linux (x86_64-linux-gnu)
  CPU: AMD EPYC 7502 32-Core Processor
  WORD_SIZE: 64
  LIBM: libopenlibm
  LLVM: libLLVM-11.0.0 (ORCJIT, znver2)
Environment:
  JULIA_DEPOT_PATH = ::/usr/local/share/julia
  JULIA_NUM_THREADS = 2
  JULIA_MAX_NUM_PRECOMPILE_FILES = 9223372036854775807
  JULIA_PKG_SERVER = 

Starting installation at 2020-10-24T18:36:12.922
   Resolving package versions...
   Installed IniFile ───────────── v0.5.0
   Installed Zlib_jll ──────────── v1.2.11+18
   Installed CodecZlib ─────────── v0.7.0
   Installed JSON2 ─────────────── v0.3.2
   Installed PlotlyBase ────────── v0.4.1
   Installed JSON ──────────────── v0.21.1
   Installed DataStructures ────── v0.18.8
   Installed LaTeXStrings ──────── v1.2.0
   Installed Compat ────────────── v3.22.0
   Installed OrderedCollections ── v1.3.1
   Installed MD5 ───────────────── v0.2.1
   Installed Parsers ───────────── v1.0.11
   Installed Requires ──────────── v1.1.0
   Installed JLLWrappers ───────── v1.1.3
   Installed DashBase ──────────── v0.1.0
   Installed HTTP ──────────────── v0.8.19
   Installed TranscodingStreams ── v0.9.5
   Installed DocStringExtensions ─ v0.8.3
   Installed MbedTLS_jll ───────── v2.16.8+0
   Installed DashHtmlComponents ── v1.1.1
   Installed Dash ──────────────── v0.1.3
   Installed MbedTLS ───────────── v1.0.2
   Installed DashTable ─────────── v4.10.1
   Installed DashCoreComponents ── v1.12.0
Updating `~/.julia/environments/v1.6/Project.toml`
  [1b08a953] + Dash v0.1.3
Updating `~/.julia/environments/v1.6/Manifest.toml`
  [944b1d66] + CodecZlib v0.7.0
  [34da2185] + Compat v3.22.0
  [1b08a953] + Dash v0.1.3
  [03207cf0] + DashBase v0.1.0
  [1b08a953] + DashCoreComponents v1.12.0
  [1b08a953] + DashHtmlComponents v1.1.1
  [1b08a953] + DashTable v4.10.1
  [864edb3b] + DataStructures v0.18.8
  [ffbed154] + DocStringExtensions v0.8.3
  [cd3eb016] + HTTP v0.8.19
  [83e8ac13] + IniFile v0.5.0
  [692b3bcd] + JLLWrappers v1.1.3
  [682c06a0] + JSON v0.21.1
  [2535ab7d] + JSON2 v0.3.2
  [b964fa9f] + LaTeXStrings v1.2.0
  [6ac74813] + MD5 v0.2.1
  [739be429] + MbedTLS v1.0.2
  [bac558e1] + OrderedCollections v1.3.1
  [69de0a69] + Parsers v1.0.11
  [a03496cd] + PlotlyBase v0.4.1
  [ae029012] + Requires v1.1.0
  [3bb67fe8] + TranscodingStreams v0.9.5
  [c8ffd9c3] + MbedTLS_jll v2.16.8+0
  [83775a58] + Zlib_jll v1.2.11+18
  [0dad84c5] + ArgTools
  [56f22d72] + Artifacts
  [2a0f44e3] + Base64
  [ade2ca70] + Dates
  [8bb1440f] + DelimitedFiles
  [8ba89e20] + Distributed
  [f43a241f] + Downloads
  [b77e0a4c] + InteractiveUtils
  [b27032c2] + LibCURL
  [76f85450] + LibGit2
  [8f399da3] + Libdl
  [37e2e46d] + LinearAlgebra
  [56ddb016] + Logging
  [d6f4376e] + Markdown
  [a63ad114] + Mmap
  [44cfe95a] + Pkg
  [de0858da] + Printf
  [3fa0cd96] + REPL
  [9a3f8284] + Random
  [ea8e919c] + SHA
  [9e88b42a] + Serialization
  [1a1011a3] + SharedArrays
  [6462fe0b] + Sockets
  [2f01184e] + SparseArrays
  [10745b16] + Statistics
  [fa267f1f] + TOML
  [8dfed614] + Test
  [cf7118a7] + UUIDs
  [4ec0a83e] + Unicode
  [deac9b47] + LibCURL_jll
  [14a3606d] + MozillaCACerts_jll
Precompiling project... (tip: to disable auto-precompilation set ENV["JULIA_PKG_PRECOMPILE_AUTO"]=0)
[32m  ✓ [39m[90mLaTeXStrings[39m
[32m  ✓ [39m[90mIniFile[39m
[32m  ✓ [39m[90mRequires[39m
[32m  ✓ [39m[90mJLLWrappers[39m
[32m  ✓ [39m[90mDocStringExtensions[39m
[32m  ✓ [39m[90mOrderedCollections[39m
[32m  ✓ [39m[90mMD5[39m
[32m  ✓ [39m[90mCompat[39m
[32m  ✓ [39m[90mTranscodingStreams[39m
[32m  ✓ [39m[90mMbedTLS_jll[39m
[32m  ✓ [39m[90mZlib_jll[39m
[32m  ✓ [39m[90mMbedTLS[39m
[32m  ✓ [39m[90mParsers[39m
[32m  ✓ [39m[90mJSON[39m
[32m  ✓ [39m[90mJSON2[39m
[32m  ✓ [39m[90mDataStructures[39m
[32m  ✓ [39m[90mDashBase[39m
[32m  ✓ [39m[90mDashTable[39m
[32m  ✓ [39m[90mDashCoreComponents[39m
[32m  ✓ [39m[90mHTTP[39m
[32m  ✓ [39m[90mDashHtmlComponents[39m
[32m  ✓ [39m[90mPlotlyBase[39m
[91m  ✗ [39m[90mCodecZlib[39m
[91m  ✗ [39mDash
22 dependencies successfully precompiled, 2 errored
Starting tests at 2020-10-24T18:36:50.019
     Testing Dash
Status `/tmp/jl_0kMvSZ/Project.toml`
  [944b1d66] CodecZlib v0.7.0
  [1b08a953] Dash v0.1.3
  [03207cf0] DashBase v0.1.0
  [1b08a953] DashCoreComponents v1.12.0
  [1b08a953] DashHtmlComponents v1.1.1
  [1b08a953] DashTable v4.10.1
  [864edb3b] DataStructures v0.18.8
  [cd3eb016] HTTP v0.8.19
  [682c06a0] JSON v0.21.1
  [2535ab7d] JSON2 v0.3.2
  [6ac74813] MD5 v0.2.1
  [a03496cd] PlotlyBase v0.4.1
  [6462fe0b] Sockets
  [8dfed614] Test
  [cf7118a7] UUIDs
Status `/tmp/jl_0kMvSZ/Manifest.toml`
  [944b1d66] CodecZlib v0.7.0
  [34da2185] Compat v3.22.0
  [1b08a953] Dash v0.1.3
  [03207cf0] DashBase v0.1.0
  [1b08a953] DashCoreComponents v1.12.0
  [1b08a953] DashHtmlComponents v1.1.1
  [1b08a953] DashTable v4.10.1
  [864edb3b] DataStructures v0.18.8
  [ffbed154] DocStringExtensions v0.8.3
  [cd3eb016] HTTP v0.8.19
  [83e8ac13] IniFile v0.5.0
  [692b3bcd] JLLWrappers v1.1.3
  [682c06a0] JSON v0.21.1
  [2535ab7d] JSON2 v0.3.2
  [b964fa9f] LaTeXStrings v1.2.0
  [6ac74813] MD5 v0.2.1
  [739be429] MbedTLS v1.0.2
  [bac558e1] OrderedCollections v1.3.1
  [69de0a69] Parsers v1.0.11
  [a03496cd] PlotlyBase v0.4.1
  [ae029012] Requires v1.1.0
  [3bb67fe8] TranscodingStreams v0.9.5
  [c8ffd9c3] MbedTLS_jll v2.16.8+0
  [83775a58] Zlib_jll v1.2.11+18
  [0dad84c5] ArgTools
  [56f22d72] Artifacts
  [2a0f44e3] Base64
  [ade2ca70] Dates
  [8bb1440f] DelimitedFiles
  [8ba89e20] Distributed
  [f43a241f] Downloads
  [b77e0a4c] InteractiveUtils
  [b27032c2] LibCURL
  [76f85450] LibGit2
  [8f399da3] Libdl
  [37e2e46d] LinearAlgebra
  [56ddb016] Logging
  [d6f4376e] Markdown
  [a63ad114] Mmap
  [44cfe95a] Pkg
  [de0858da] Printf
  [3fa0cd96] REPL
  [9a3f8284] Random
  [ea8e919c] SHA
  [9e88b42a] Serialization
  [1a1011a3] SharedArrays
  [6462fe0b] Sockets
  [2f01184e] SparseArrays
  [10745b16] Statistics
  [fa267f1f] TOML
  [8dfed614] Test
  [cf7118a7] UUIDs
  [4ec0a83e] Unicode
  [deac9b47] LibCURL_jll
  [14a3606d] MozillaCACerts_jll
     Testing Running tests...
┌ Warning: Module JSON with build ID 417345212233650 is missing from the cache.
│ This may mean JSON [682c06a0-de6a-54ab-a142-c8b1cf79cde6] does not support precompilation but is imported by a module that does.
└ @ Base loading.jl:1020
┌ Warning: The call to compilecache failed to create a usable precompiled cache file for Dash [1b08a953-4be3-4667-9a23-3db579824955]
│   exception = Required dependency JSON [682c06a0-de6a-54ab-a142-c8b1cf79cde6] failed to load from a cache file.
└ @ Base loading.jl:1045
Test Summary: | Pass  Total
env           |   17     17
Test Summary:  | Pass  Total
lazy + dynamic |   13     13
Test Summary:                       | Pass  Total
application resources base registry |   57     57
Test Summary:                 | Pass  Total
application resources dynamic |   13     13
Test Summary:                    | Pass  Total
application resources components |   11     11
Test Summary:                  | Pass  Total
application resources external |   14     14
Test Summary:                | Pass  Total
application resources assets |   43     43
Test Summary:     | Pass  Total
DevTools creation |   37     37
Test Summary: | Pass  Total
DevTools end  |   10     10
Test Summary: | Pass  Total
default args  |   16     16
Test Summary: | Pass  Total
setted args   |   33     33
Test Summary: | Pass  Total
route         |   30     30
Test Summary: | Pass  Total
router        |   23     23
Test Summary: | Pass  Total
base_handler  |   21     21
Test Summary: | Pass  Total
compression   |   13     13
Test Summary:    | Pass  Total
resource handler |   14     14
Test Summary:        | Pass  Total
external_stylesheets |    4      4
Test Summary:    | Pass  Total
external_scripts |    3      3
Test Summary: |
url paths     | No tests
Test Summary: | Pass  Total
assets paths  |   13     13
Test Summary:                | Pass  Total
suppress_callback_exceptions |    4      4
Test Summary: | Pass  Total
meta_tags     |   10     10
Test Summary: | Pass  Total
index_string  |    1      1
Test Summary:  | Pass  Total
show_undo_redo |    2      2
Test Summary:      | Pass  Total
interpolate_string |    1      1
Test Summary: | Pass  Total
fingerprint   |    8      8
Test Summary:  | Pass  Total
parse_includes |    5      5
Test Summary: | Pass  Total
task context  |    7      7
Test Summary:          | Pass  Total
multiple tasks context |    5      5
Test Summary: | Pass  Total
Components    |   10     10
Test Summary: | Pass  Total
handler       |   16     16
Test Summary:      | Pass  Total
layout as function |    6      6
Test Summary: | Pass  Total
assets        |    3      3
Test Summary:               | Pass  Total
PreventUpdate and no_update |    7      7
Test Summary:     | Pass  Total
layout validation |    2      2
Test Summary: | Pass  Total
deps to json  |    4      4
Test Summary:    | Pass  Total
json keys sorted |    2      2
Test Summary: | Pass  Total
id equality   |   24     24
Test Summary:           | Pass  Total
callback! single output |   12     12
Test Summary:          | Pass  Total
callback! multi output |   13     13
Internal error: encountered unexpected error in runtime:
UndefRefError()
_limit_type_size at ./compiler/typelimits.jl:163
_limit_type_size at ./compiler/typelimits.jl:156
_limit_type_size at ./compiler/typelimits.jl:156
_limit_type_size at ./compiler/typelimits.jl:108
limit_type_size at ./compiler/typelimits.jl:22
jfptr_limit_type_size_9880.clone_1 at /opt/julia/lib/julia/sys.so (unknown line)
_jl_invoke at /workspace/srcdir/src/gf.c:2191 [inlined]
jl_apply_generic at /workspace/srcdir/src/gf.c:2373
abstract_call_method at ./compiler/abstractinterpretation.jl:420
abstract_call_gf_by_type at ./compiler/abstractinterpretation.jl:130
abstract_call_known at ./compiler/abstractinterpretation.jl:1003
abstract_call at ./compiler/abstractinterpretation.jl:1026
abstract_call at ./compiler/abstractinterpretation.jl:1010
abstract_eval_statement at ./compiler/abstractinterpretation.jl:1132
typeinf_local at ./compiler/abstractinterpretation.jl:1386
typeinf_nocycle at ./compiler/abstractinterpretation.jl:1442
_typeinf at ./compiler/typeinfer.jl:212
typeinf at ./compiler/typeinfer.jl:207
typeinf_edge at ./compiler/typeinfer.jl:741
abstract_call_method at ./compiler/abstractinterpretation.jl:466
abstract_call_gf_by_type at ./compiler/abstractinterpretation.jl:130
abstract_call_known at ./compiler/abstractinterpretation.jl:1003
abstract_call at ./compiler/abstractinterpretation.jl:1026
abstract_call at ./compiler/abstractinterpretation.jl:1010
abstract_eval_statement at ./compiler/abstractinterpretation.jl:1132
typeinf_local at ./compiler/abstractinterpretation.jl:1386
typeinf_nocycle at ./compiler/abstractinterpretation.jl:1442
_typeinf at ./compiler/typeinfer.jl:212
typeinf at ./compiler/typeinfer.jl:207
typeinf_edge at ./compiler/typeinfer.jl:741
abstract_call_method at ./compiler/abstractinterpretation.jl:466
abstract_call_gf_by_type at ./compiler/abstractinterpretation.jl:130
abstract_call_known at ./compiler/abstractinterpretation.jl:1003
abstract_call at ./compiler/abstractinterpretation.jl:1026
abstract_call at ./compiler/abstractinterpretation.jl:1010
abstract_eval_statement at ./compiler/abstractinterpretation.jl:1132
typeinf_local at ./compiler/abstractinterpretation.jl:1386
typeinf_nocycle at ./compiler/abstractinterpretation.jl:1442
_typeinf at ./compiler/typeinfer.jl:212
typeinf at ./compiler/typeinfer.jl:207
typeinf_edge at ./compiler/typeinfer.jl:741
abstract_call_method at ./compiler/abstractinterpretation.jl:466
abstract_call_gf_by_type at ./compiler/abstractinterpretation.jl:130
abstract_call_known at ./compiler/abstractinterpretation.jl:1003
abstract_call at ./compiler/abstractinterpretation.jl:1026
abstract_call at ./compiler/abstractinterpretation.jl:1010
abstract_eval_statement at ./compiler/abstractinterpretation.jl:1132
typeinf_local at ./compiler/abstractinterpretation.jl:1386
typeinf_nocycle at ./compiler/abstractinterpretation.jl:1442
_typeinf at ./compiler/typeinfer.jl:212
typeinf at ./compiler/typeinfer.jl:207
typeinf_edge at ./compiler/typeinfer.jl:741
abstract_call_method at ./compiler/abstractinterpretation.jl:466
abstract_call_gf_by_type at ./compiler/abstractinterpretation.jl:130
abstract_call_known at ./compiler/abstractinterpretation.jl:1003
abstract_call at ./compiler/abstractinterpretation.jl:1026
abstract_call at ./compiler/abstractinterpretation.jl:1010
abstract_eval_statement at ./compiler/abstractinterpretation.jl:1132
typeinf_local at ./compiler/abstractinterpretation.jl:1386
typeinf_nocycle at ./compiler/abstractinterpretation.jl:1442
_typeinf at ./compiler/typeinfer.jl:212
typeinf at ./compiler/typeinfer.jl:207
typeinf_edge at ./compiler/typeinfer.jl:741
abstract_call_method at ./compiler/abstractinterpretation.jl:466
abstract_call_gf_by_type at ./compiler/abstractinterpretation.jl:130
abstract_call_known at ./compiler/abstractinterpretation.jl:1003
abstract_call at ./compiler/abstractinterpretation.jl:1026
abstract_call at ./compiler/abstractinterpretation.jl:1010
abstract_eval_statement at ./compiler/abstractinterpretation.jl:1132
typeinf_local at ./compiler/abstractinterpretation.jl:1386
typeinf_nocycle at ./compiler/abstractinterpretation.jl:1442
_typeinf at ./compiler/typeinfer.jl:212
typeinf at ./compiler/typeinfer.jl:207
typeinf_edge at ./compiler/typeinfer.jl:741
abstract_call_method at ./compiler/abstractinterpretation.jl:466
abstract_call_gf_by_type at ./compiler/abstractinterpretation.jl:130
abstract_call_known at ./compiler/abstractinterpretation.jl:1003
abstract_call at ./compiler/abstractinterpretation.jl:1026
abstract_call at ./compiler/abstractinterpretation.jl:1010
abstract_eval_statement at ./compiler/abstractinterpretation.jl:1132
typeinf_local at ./compiler/abstractinterpretation.jl:1386
typeinf_nocycle at ./compiler/abstractinterpretation.jl:1442
_typeinf at ./compiler/typeinfer.jl:212
typeinf at ./compiler/typeinfer.jl:207
typeinf_ext at ./compiler/typeinfer.jl:831
typeinf_ext_toplevel at ./compiler/typeinfer.jl:864
typeinf_ext_toplevel at ./compiler/typeinfer.jl:860
jfptr_typeinf_ext_toplevel_12768.clone_1 at /opt/julia/lib/julia/sys.so (unknown line)
_jl_invoke at /workspace/srcdir/src/gf.c:2191 [inlined]
jl_apply_generic at /workspace/srcdir/src/gf.c:2373
jl_apply at /workspace/srcdir/src/julia.h:1695 [inlined]
jl_type_infer at /workspace/srcdir/src/gf.c:300
jl_generate_fptr at /workspace/srcdir/src/jitlayers.cpp:316
jl_compile_method_internal at /workspace/srcdir/src/gf.c:1924
jl_compile_method_internal at /workspace/srcdir/src/gf.c:2190 [inlined]
_jl_invoke at /workspace/srcdir/src/gf.c:2183 [inlined]
jl_apply_generic at /workspace/srcdir/src/gf.c:2373
jl_apply at /workspace/srcdir/src/julia.h:1695 [inlined]
do_call at /workspace/srcdir/src/interpreter.c:115
eval_value at /workspace/srcdir/src/interpreter.c:204
eval_stmt_value at /workspace/srcdir/src/interpreter.c:155 [inlined]
eval_body at /workspace/srcdir/src/interpreter.c:561
eval_body at /workspace/srcdir/src/interpreter.c:489
eval_body at /workspace/srcdir/src/interpreter.c:489
jl_interpret_toplevel_thunk at /workspace/srcdir/src/interpreter.c:669
macro expansion at /home/pkgeval/.julia/packages/Dash/UPrlv/test/callbacks.jl:100 [inlined]
macro expansion at /workspace/srcdir/usr/share/julia/stdlib/v1.6/Test/src/Test.jl:1144 [inlined]
top-level scope at /home/pkgeval/.julia/packages/Dash/UPrlv/test/callbacks.jl:93
jl_toplevel_eval_flex at /workspace/srcdir/src/toplevel.c:879
jl_toplevel_eval_flex at /workspace/srcdir/src/toplevel.c:827
jl_toplevel_eval_in at /workspace/srcdir/src/toplevel.c:931
eval at ./boot.jl:369 [inlined]
include_string at ./loading.jl:1106
_jl_invoke at /workspace/srcdir/src/gf.c:2191 [inlined]
jl_apply_generic at /workspace/srcdir/src/gf.c:2373
_include at ./loading.jl:1160
include at ./client.jl:444
_jl_invoke at /workspace/srcdir/src/gf.c:2191 [inlined]
jl_apply_generic at /workspace/srcdir/src/gf.c:2373
jl_apply at /workspace/srcdir/src/julia.h:1695 [inlined]
do_call at /workspace/srcdir/src/interpreter.c:115
eval_value at /workspace/srcdir/src/interpreter.c:204
eval_stmt_value at /workspace/srcdir/src/interpreter.c:155 [inlined]
eval_body at /workspace/srcdir/src/interpreter.c:561
jl_interpret_toplevel_thunk at /workspace/srcdir/src/interpreter.c:669
top-level scope at /home/pkgeval/.julia/packages/Dash/UPrlv/test/runtests.jl:13
jl_toplevel_eval_flex at /workspace/srcdir/src/toplevel.c:879
jl_toplevel_eval_flex at /workspace/srcdir/src/toplevel.c:827
jl_toplevel_eval_in at /workspace/srcdir/src/toplevel.c:931
eval at ./boot.jl:369 [inlined]
include_string at ./loading.jl:1106
_jl_invoke at /workspace/srcdir/src/gf.c:2191 [inlined]
jl_apply_generic at /workspace/srcdir/src/gf.c:2373
_include at ./loading.jl:1160
include at ./client.jl:444
_jl_invoke at /workspace/srcdir/src/gf.c:2191 [inlined]
jl_apply_generic at /workspace/srcdir/src/gf.c:2373
jl_apply at /workspace/srcdir/src/julia.h:1695 [inlined]
do_call at /workspace/srcdir/src/interpreter.c:115
eval_value at /workspace/srcdir/src/interpreter.c:204
eval_stmt_value at /workspace/srcdir/src/interpreter.c:155 [inlined]
eval_body at /workspace/srcdir/src/interpreter.c:561
jl_interpret_toplevel_thunk at /workspace/srcdir/src/interpreter.c:669
top-level scope at none:6
jl_toplevel_eval_flex at /workspace/srcdir/src/toplevel.c:879
jl_toplevel_eval_flex at /workspace/srcdir/src/toplevel.c:827
jl_toplevel_eval_in at /workspace/srcdir/src/toplevel.c:931
eval at ./boot.jl:369
_jl_invoke at /workspace/srcdir/src/gf.c:2191 [inlined]
jl_apply_generic at /workspace/srcdir/src/gf.c:2373
exec_options at ./client.jl:261
_start at ./client.jl:485
jfptr__start_39679.clone_1 at /opt/julia/lib/julia/sys.so (unknown line)
_jl_invoke at /workspace/srcdir/src/gf.c:2191 [inlined]
jl_apply_generic at /workspace/srcdir/src/gf.c:2373
jl_apply at /workspace/srcdir/src/julia.h:1695 [inlined]
true_main at /workspace/srcdir/src/jlapi.c:553
repl_entrypoint at /workspace/srcdir/src/jlapi.c:672
main at /workspace/srcdir/cli/loader_exe.c:46
__libc_start_main at /lib/x86_64-linux-gnu/libc.so.6 (unknown line)
unknown function (ip: 0x400bae)
Test Summary:               | Pass  Total
callback! multi output flat |    6      6
Test Summary:    | Pass  Total
callback! checks |   16     16
Test Summary: | Pass  Total
pattern-match |   10     10
Test Summary:     | Pass  Total
pattern-match ALL |   13     13
Test Summary:     | Pass  Total
invalid multi out |    4      4
Test Summary:                 | Pass  Total
clientside callbacks function |   12     12
Test Summary:               | Pass  Total
clientside callbacks string |   17     17
     Testing Dash tests passed 
Finished at 2020-10-24T18:38:13.831
