Julia Version 1.6.0-DEV.988
Commit fafc0a4ee3* (2020-09-19 22:55 UTC)
Platform Info:
  OS: Linux (x86_64-pc-linux-gnu)
  CPU: Intel(R) Xeon(R) Silver 4114 CPU @ 2.20GHz
  WORD_SIZE: 64
  LIBM: libopenlibm
  LLVM: libLLVM-9.0.1 (ORCJIT, skylake-avx512)
Environment:
  JULIA_DEPOT_PATH = ::/usr/local/share/julia
  JULIA_NUM_THREADS = 2

  Resolving package versions...
  Installed CompilerSupportLibraries_jll ─ v0.3.3+0
  Installed PooledArrays ───────────────── v0.5.3
  Installed DataValueInterfaces ────────── v1.0.0
  Installed OpenSpecFun_jll ────────────── v0.5.3+3
  Installed PDMats ─────────────────────── v0.10.1
  Installed SpecialFunctions ───────────── v0.10.3
  Installed Pathogen ───────────────────── v0.4.12
  Installed Distributions ──────────────── v0.23.12
  Installed StatsFuns ──────────────────── v0.9.5
  Installed TableTraits ────────────────── v1.0.0
  Installed ProgressMeter ──────────────── v1.3.3
  Installed OnlineStatsBase ────────────── v1.4.3
  Installed AbstractTrees ──────────────── v0.3.3
  Installed CategoricalArrays ──────────── v0.7.7
  Installed Compat ─────────────────────── v3.16.0
  Installed Parsers ────────────────────── v1.0.10
  Installed StaticArrays ───────────────── v0.12.4
  Installed RecipesBase ────────────────── v1.1.0
  Installed Rmath_jll ──────────────────── v0.2.2+1
  Installed Missings ───────────────────── v0.4.4
  Installed JSON ───────────────────────── v0.21.1
  Installed SweepOperator ──────────────── v0.3.0
  Installed DataStructures ─────────────── v0.18.6
  Installed Reexport ───────────────────── v0.2.0
  Installed FillArrays ─────────────────── v0.9.6
  Installed IteratorInterfaceExtensions ── v1.0.0
  Installed InvertedIndices ────────────── v1.0.0
  Installed Tables ─────────────────────── v1.0.5
  Installed OrderedCollections ─────────── v1.3.1
  Installed SortingAlgorithms ──────────── v0.3.1
  Installed QuadGK ─────────────────────── v2.4.1
  Installed DataAPI ────────────────────── v1.3.0
  Installed Rmath ──────────────────────── v0.6.1
  Installed OnlineStats ────────────────── v1.5.6
  Installed StatsBase ──────────────────── v0.33.1
  Installed DataFrames ─────────────────── v0.20.2
Updating `~/.julia/environments/v1.6/Project.toml`
  [c8189ad9] + Pathogen v0.4.12
Updating `~/.julia/environments/v1.6/Manifest.toml`
  [1520ce14] + AbstractTrees v0.3.3
  [324d7699] + CategoricalArrays v0.7.7
  [34da2185] + Compat v3.16.0
  [e66e0078] + CompilerSupportLibraries_jll v0.3.3+0
  [9a962f9c] + DataAPI v1.3.0
  [a93c6f00] + DataFrames v0.20.2
  [864edb3b] + DataStructures v0.18.6
  [e2d170a0] + DataValueInterfaces v1.0.0
  [31c24e10] + Distributions v0.23.12
  [1a297f60] + FillArrays v0.9.6
  [41ab1584] + InvertedIndices v1.0.0
  [82899510] + IteratorInterfaceExtensions v1.0.0
  [682c06a0] + JSON v0.21.1
  [e1d29d7a] + Missings v0.4.4
  [a15396b6] + OnlineStats v1.5.6
  [925886fa] + OnlineStatsBase v1.4.3
  [efe28fd5] + OpenSpecFun_jll v0.5.3+3
  [bac558e1] + OrderedCollections v1.3.1
  [90014a1f] + PDMats v0.10.1
  [69de0a69] + Parsers v1.0.10
  [c8189ad9] + Pathogen v0.4.12
  [2dfb63ee] + PooledArrays v0.5.3
  [92933f4c] + ProgressMeter v1.3.3
  [1fd47b50] + QuadGK v2.4.1
  [3cdcf5f2] + RecipesBase v1.1.0
  [189a3867] + Reexport v0.2.0
  [79098fc4] + Rmath v0.6.1
  [f50d1b31] + Rmath_jll v0.2.2+1
  [a2af1166] + SortingAlgorithms v0.3.1
  [276daf66] + SpecialFunctions v0.10.3
  [90137ffa] + StaticArrays v0.12.4
  [2913bbd2] + StatsBase v0.33.1
  [4c63d2b9] + StatsFuns v0.9.5
  [7522ee7d] + SweepOperator v0.3.0
  [3783bdb8] + TableTraits v1.0.0
  [bd369af6] + Tables v1.0.5
  [56f22d72] + Artifacts
  [2a0f44e3] + Base64
  [ade2ca70] + Dates
  [8bb1440f] + DelimitedFiles
  [8ba89e20] + Distributed
  [9fa8497b] + Future
  [b77e0a4c] + InteractiveUtils
  [76f85450] + LibGit2
  [8f399da3] + Libdl
  [37e2e46d] + LinearAlgebra
  [56ddb016] + Logging
  [d6f4376e] + Markdown
  [a63ad114] + Mmap
  [44cfe95a] + Pkg
  [de0858da] + Printf
  [3fa0cd96] + REPL
  [9a3f8284] + Random
  [ea8e919c] + SHA
  [9e88b42a] + Serialization
  [1a1011a3] + SharedArrays
  [6462fe0b] + Sockets
  [2f01184e] + SparseArrays
  [10745b16] + Statistics
  [4607b0f0] + SuiteSparse
  [fa267f1f] + TOML
  [8dfed614] + Test
  [cf7118a7] + UUIDs
  [4ec0a83e] + Unicode
    Testing Pathogen
Status `/tmp/jl_wKf7Bp/Project.toml`
  [a93c6f00] DataFrames v0.20.2
  [b4f34e82] Distances v0.9.0
  [31c24e10] Distributions v0.23.12
  [a15396b6] OnlineStats v1.5.6
  [c8189ad9] Pathogen v0.4.12
  [92933f4c] ProgressMeter v1.3.3
  [3cdcf5f2] RecipesBase v1.1.0
  [2913bbd2] StatsBase v0.33.1
  [8ba89e20] Distributed
  [37e2e46d] LinearAlgebra
  [56ddb016] Logging
  [9a3f8284] Random
  [10745b16] Statistics
  [8dfed614] Test
Status `/tmp/jl_wKf7Bp/Manifest.toml`
  [1520ce14] AbstractTrees v0.3.3
  [324d7699] CategoricalArrays v0.7.7
  [34da2185] Compat v3.16.0
  [e66e0078] CompilerSupportLibraries_jll v0.3.3+0
  [9a962f9c] DataAPI v1.3.0
  [a93c6f00] DataFrames v0.20.2
  [864edb3b] DataStructures v0.18.6
  [e2d170a0] DataValueInterfaces v1.0.0
  [b4f34e82] Distances v0.9.0
  [31c24e10] Distributions v0.23.12
  [1a297f60] FillArrays v0.9.6
  [41ab1584] InvertedIndices v1.0.0
  [82899510] IteratorInterfaceExtensions v1.0.0
  [682c06a0] JSON v0.21.1
  [e1d29d7a] Missings v0.4.4
  [a15396b6] OnlineStats v1.5.6
  [925886fa] OnlineStatsBase v1.4.3
  [efe28fd5] OpenSpecFun_jll v0.5.3+3
  [bac558e1] OrderedCollections v1.3.1
  [90014a1f] PDMats v0.10.1
  [69de0a69] Parsers v1.0.10
  [c8189ad9] Pathogen v0.4.12
  [2dfb63ee] PooledArrays v0.5.3
  [92933f4c] ProgressMeter v1.3.3
  [1fd47b50] QuadGK v2.4.1
  [3cdcf5f2] RecipesBase v1.1.0
  [189a3867] Reexport v0.2.0
  [79098fc4] Rmath v0.6.1
  [f50d1b31] Rmath_jll v0.2.2+1
  [a2af1166] SortingAlgorithms v0.3.1
  [276daf66] SpecialFunctions v0.10.3
  [90137ffa] StaticArrays v0.12.4
  [2913bbd2] StatsBase v0.33.1
  [4c63d2b9] StatsFuns v0.9.5
  [7522ee7d] SweepOperator v0.3.0
  [3783bdb8] TableTraits v1.0.0
  [bd369af6] Tables v1.0.5
  [56f22d72] Artifacts
  [2a0f44e3] Base64
  [ade2ca70] Dates
  [8bb1440f] DelimitedFiles
  [8ba89e20] Distributed
  [9fa8497b] Future
  [b77e0a4c] InteractiveUtils
  [76f85450] LibGit2
  [8f399da3] Libdl
  [37e2e46d] LinearAlgebra
  [56ddb016] Logging
  [d6f4376e] Markdown
  [a63ad114] Mmap
  [44cfe95a] Pkg
  [de0858da] Printf
  [3fa0cd96] REPL
  [9a3f8284] Random
  [ea8e919c] SHA
  [9e88b42a] Serialization
  [1a1011a3] SharedArrays
  [6462fe0b] Sockets
  [2f01184e] SparseArrays
  [10745b16] Statistics
  [4607b0f0] SuiteSparse
  [fa267f1f] TOML
  [8dfed614] Test
  [cf7118a7] UUIDs
  [4ec0a83e] Unicode
    Testing Running tests...
Initialization progress  0%%|▏                           |  ETA: 2:11:44[KInitialization progress100%%|████████████████████████████| Time: 0:00:29[K
MCMC progress  0%%|▏                                     |  ETA: 1:59:35[KMCMC progress  4%%|█▍                                    |  ETA: 0:10:33[KMCMC progress  7%%|██▊                                   |  ETA: 0:05:06[KMCMC progress 11%%|████                                  |  ETA: 0:03:24[KMCMC progress 15%%|█████▉                                |  ETA: 0:02:15[KMCMC progress 20%%|███████▋                              |  ETA: 0:01:38[KMCMC progress 25%%|█████████▌                            |  ETA: 0:01:14[KMCMC progress 29%%|███████████▏                          |  ETA: 0:01:00[KMCMC progress 34%%|████████████▊                         |  ETA: 0:00:49[KMCMC progress 38%%|██████████████▍                       |  ETA: 0:00:41[KMCMC progress 43%%|████████████████▌                     |  ETA: 0:00:33[KMCMC progress 49%%|██████████████████▋                   |  ETA: 0:00:26[KMCMC progress 52%%|███████████████████▉                  |  ETA: 0:00:23[KMCMC progress 58%%|██████████████████████                |  ETA: 0:00:18[KMCMC progress 62%%|███████████████████████▌              |  ETA: 0:00:16[KMCMC progress 65%%|████████████████████████▋             |  ETA: 0:00:14[KMCMC progress 71%%|███████████████████████████▏          |  ETA: 0:00:10[KMCMC progress 78%%|█████████████████████████████▊        |  ETA: 0:00:07[KMCMC progress 84%%|███████████████████████████████▉      |  ETA: 0:00:05[KMCMC progress 86%%|████████████████████████████████▊     |  ETA: 0:00:04[KMCMC progress 89%%|██████████████████████████████████    |  ETA: 0:00:03[KMCMC progress 93%%|███████████████████████████████████▌  |  ETA: 0:00:02[KMCMC progress 97%%|█████████████████████████████████████ |  ETA: 0:00:01[KMCMC progress100%%|██████████████████████████████████████| Time: 0:00:31[K
Initialization progress  2%%|▌                           |  ETA: 0:02:05[KInitialization progress100%%|████████████████████████████| Time: 0:00:02[K
MCMC progress  1%%|▍                                     |  ETA: 0:03:40[KMCMC progress 27%%|██████████▎                           |  ETA: 0:00:06[KMCMC progress 48%%|██████████████████▎                   |  ETA: 0:00:03[KMCMC progress 77%%|█████████████████████████████▎        |  ETA: 0:00:01[KMCMC progress100%%|██████████████████████████████████████| Time: 0:00:02[K
Test Summary: | Pass  Total
SEIR Model    |   82     82
Initialization progress  0%%|▏                           |  ETA: 0:54:02[KInitialization progress 19%%|█████▍                      |  ETA: 0:00:47[KInitialization progress 34%%|█████████▌                  |  ETA: 0:00:21[KInitialization progress 50%%|█████████████▉              |  ETA: 0:00:11[KInitialization progress 64%%|█████████████████▉          |  ETA: 0:00:06[KInitialization progress 84%%|███████████████████████▋    |  ETA: 0:00:02[KInitialization progress 90%%|█████████████████████████▎  |  ETA: 0:00:01[KInitialization progress 97%%|███████████████████████████▏|  ETA: 0:00:00[KInitialization progress100%%|████████████████████████████| Time: 0:00:11[K
MCMC progress  0%%|▏                                     |  ETA: 0:46:19[KMCMC progress  6%%|██▏                                   |  ETA: 0:02:37[KMCMC progress 12%%|████▍                                 |  ETA: 0:01:12[KMCMC progress 16%%|██████▏                               |  ETA: 0:00:50[KMCMC progress 23%%|████████▊                             |  ETA: 0:00:33[KMCMC progress 31%%|███████████▋                          |  ETA: 0:00:22[KMCMC progress 38%%|██████████████▍                       |  ETA: 0:00:16[KMCMC progress 46%%|█████████████████▍                    |  ETA: 0:00:12[KMCMC progress 51%%|███████████████████▎                  |  ETA: 0:00:10[KMCMC progress 57%%|█████████████████████▌                |  ETA: 0:00:08[KMCMC progress 67%%|█████████████████████████▋            |  ETA: 0:00:05[KMCMC progress 70%%|██████████████████████████▌           |  ETA: 0:00:05[KMCMC progress 71%%|███████████████████████████▏          |  ETA: 0:00:04[KMCMC progress 78%%|█████████████████████████████▊        |  ETA: 0:00:03[KMCMC progress 85%%|████████████████████████████████▍     |  ETA: 0:00:02[KMCMC progress 92%%|███████████████████████████████████   |  ETA: 0:00:01[KMCMC progress 96%%|████████████████████████████████████▋ |  ETA: 0:00:00[KMCMC progress 97%%|████████████████████████████████████▉ |  ETA: 0:00:00[KMCMC progress100%%|██████████████████████████████████████| Time: 0:00:11[K
Initialization progress  4%%|█▏                          |  ETA: 0:00:51[KInitialization progress100%%|████████████████████████████| Time: 0:00:02[K
MCMC progress  1%%|▍                                     |  ETA: 0:00:28[KMCMC progress 36%%|█████████████▋                        |  ETA: 0:00:01[KMCMC progress 46%%|█████████████████▌                    |  ETA: 0:00:01[KMCMC progress 86%%|████████████████████████████████▋     |  ETA: 0:00:00[KMCMC progress100%%|██████████████████████████████████████| Time: 0:00:00[K
Test Summary: | Pass  Total
SEI Model     |  163    163
Initialization progress  0%%|▏                           |  ETA: 1:09:43[KInitialization progress 13%%|███▋                        |  ETA: 0:01:34[KInitialization progress 30%%|████████▎                   |  ETA: 0:00:34[KInitialization progress 51%%|██████████████▏             |  ETA: 0:00:14[KInitialization progress 70%%|███████████████████▌        |  ETA: 0:00:06[KInitialization progress 89%%|█████████████████████████   |  ETA: 0:00:02[KInitialization progress 97%%|███████████████████████████▏|  ETA: 0:00:01[KInitialization progress 97%%|███████████████████████████▏|  ETA: 0:00:00[KInitialization progress100%%|████████████████████████████| Time: 0:00:14[K
MCMC progress  0%%|▏                                     |  ETA: 0:45:19[KMCMC progress  7%%|██▌                                   |  ETA: 0:02:09[KMCMC progress 13%%|█████                                 |  ETA: 0:01:02[KMCMC progress 17%%|██████▍                               |  ETA: 0:00:47[KMCMC progress 21%%|████████                              |  ETA: 0:00:36[KMCMC progress 28%%|██████████▌                           |  ETA: 0:00:25[KMCMC progress 32%%|████████████                          |  ETA: 0:00:21[KMCMC progress 35%%|█████████████▍                        |  ETA: 0:00:18[KMCMC progress 37%%|██████████████                        |  ETA: 0:00:17[KMCMC progress 40%%|███████████████▏                      |  ETA: 0:00:15[KMCMC progress 43%%|████████████████▌                     |  ETA: 0:00:13[KMCMC progress 50%%|███████████████████                   |  ETA: 0:00:10[KMCMC progress 56%%|█████████████████████▍                |  ETA: 0:00:08[KMCMC progress 61%%|███████████████████████▏              |  ETA: 0:00:07[KMCMC progress 66%%|█████████████████████████▏            |  ETA: 0:00:06[KMCMC progress 70%%|██████████████████████████▊           |  ETA: 0:00:05[KMCMC progress 77%%|█████████████████████████████▎        |  ETA: 0:00:03[KMCMC progress 82%%|███████████████████████████████▎      |  ETA: 0:00:02[KMCMC progress 87%%|█████████████████████████████████     |  ETA: 0:00:02[KMCMC progress 93%%|███████████████████████████████████▍  |  ETA: 0:00:01[KMCMC progress 94%%|███████████████████████████████████▉  |  ETA: 0:00:01[KMCMC progress 97%%|████████████████████████████████████▊ |  ETA: 0:00:00[KMCMC progress 97%%|████████████████████████████████████▉ |  ETA: 0:00:00[KMCMC progress100%%|██████████████████████████████████████| Time: 0:00:12[K
Initialization progress  4%%|█▏                          |  ETA: 0:00:41[KInitialization progress100%%|████████████████████████████| Time: 0:00:01[K
MCMC progress  1%%|▍                                     |  ETA: 0:00:25[KMCMC progress 31%%|███████████▊                          |  ETA: 0:00:01[KMCMC progress 62%%|███████████████████████▌              |  ETA: 0:00:00[KMCMC progress 67%%|█████████████████████████▌            |  ETA: 0:00:00[KMCMC progress 97%%|████████████████████████████████████▉ |  ETA: 0:00:00[KMCMC progress100%%|██████████████████████████████████████| Time: 0:00:00[K
Test Summary: | Pass  Total
SIR Model     |  168    168
Initialization progress  0%%|▏                           |  ETA: 1:03:55[KInitialization progress  3%%|▉                           |  ETA: 0:06:15[KInitialization progress 15%%|████▏                       |  ETA: 0:01:16[KInitialization progress 21%%|█████▉                      |  ETA: 0:00:50[KInitialization progress 29%%|████████▏                   |  ETA: 0:00:33[KInitialization progress 53%%|██████████████▊             |  ETA: 0:00:12[KInitialization progress 77%%|█████████████████████▋      |  ETA: 0:00:04[KInitialization progress 92%%|█████████████████████████▊  |  ETA: 0:00:01[KInitialization progress 97%%|███████████████████████████▏|  ETA: 0:00:00[KInitialization progress100%%|████████████████████████████| Time: 0:00:13[K
MCMC progress  0%%|▏                                     |  ETA: 0:44:53[KMCMC progress  2%%|▋                                     |  ETA: 0:09:00[KMCMC progress 10%%|███▉                                  |  ETA: 0:01:20[KMCMC progress 15%%|█████▊                                |  ETA: 0:00:53[KMCMC progress 18%%|██████▉                               |  ETA: 0:00:44[KMCMC progress 29%%|███████████                           |  ETA: 0:00:24[KMCMC progress 37%%|██████████████▏                       |  ETA: 0:00:17[KMCMC progress 43%%|████████████████▍                     |  ETA: 0:00:13[KMCMC progress 50%%|███████████████████                   |  ETA: 0:00:10[KMCMC progress 56%%|█████████████████████▏                |  ETA: 0:00:08[KMCMC progress 60%%|██████████████████████▋               |  ETA: 0:00:07[KMCMC progress 69%%|██████████████████████████▏           |  ETA: 0:00:05[KMCMC progress 76%%|████████████████████████████▊         |  ETA: 0:00:03[KMCMC progress 87%%|████████████████████████████████▉     |  ETA: 0:00:02[KMCMC progress 88%%|█████████████████████████████████▍    |  ETA: 0:00:02[KMCMC progress 92%%|███████████████████████████████████   |  ETA: 0:00:01[KMCMC progress 94%%|███████████████████████████████████▊  |  ETA: 0:00:01[KMCMC progress 97%%|█████████████████████████████████████ |  ETA: 0:00:00[KMCMC progress100%%|██████████████████████████████████████| Time: 0:00:11[K
Initialization progress  4%%|█▏                          |  ETA: 0:00:40[KInitialization progress100%%|████████████████████████████| Time: 0:00:01[K
MCMC progress  1%%|▍                                     |  ETA: 0:00:31[KMCMC progress 51%%|███████████████████▍                  |  ETA: 0:00:00[KMCMC progress100%%|██████████████████████████████████████| Time: 0:00:00[K
Test Summary: | Pass  Total
SI Model      |  110    110
    Testing Pathogen tests passed 
