Julia Version 1.5.0-DEV.45
Commit eb5410a703 (2020-01-10 02:37 UTC)
Platform Info:
  OS: Linux (x86_64-pc-linux-gnu)
  CPU: Intel(R) Xeon(R) Silver 4114 CPU @ 2.20GHz
  WORD_SIZE: 64
  LIBM: libopenlibm
  LLVM: libLLVM-8.0.1 (ORCJIT, skylake)
Environment:
  JULIA_DEPOT_PATH = ::/usr/local/share/julia

 Resolving package versions...
 Installed Blosc ──────────────── v0.5.1
 Installed Compat ─────────────── v2.2.0
 Installed PlotUtils ──────────── v0.6.1
 Installed Measures ───────────── v0.3.1
 Installed DiffRules ──────────── v0.1.0
 Installed PlotThemes ─────────── v1.0.1
 Installed GeometryTypes ──────── v0.7.7
 Installed Requires ───────────── v1.0.0
 Installed LaTeXStrings ───────── v1.0.3
 Installed RecipesBase ────────── v0.7.0
 Installed OrderedCollections ─── v1.1.0
 Installed Colors ─────────────── v0.11.2
 Installed PyCall ─────────────── v1.91.2
 Installed DiffResults ────────── v1.0.2
 Installed Missings ───────────── v0.4.3
 Installed ForwardDiff ────────── v0.10.8
 Installed LinearMaps ─────────── v2.5.2
 Installed StaticArrays ───────── v0.12.1
 Installed DocStringExtensions ── v0.8.1
 Installed CMakeWrapper ───────── v0.2.3
 Installed JSON ───────────────── v0.21.0
 Installed IterativeSolvers ───── v0.8.1
 Installed PyPlot ─────────────── v2.8.2
 Installed StatsBase ──────────── v0.32.0
 Installed ColorTypes ─────────── v0.9.0
 Installed DataAPI ────────────── v1.1.0
 Installed URIParser ──────────── v0.4.0
 Installed Parameters ─────────── v0.12.0
 Installed HDF5 ───────────────── v0.12.5
 Installed FFTW ───────────────── v0.3.0
 Installed ViscousFlow ────────── v0.1.9
 Installed Documenter ─────────── v0.24.3
 Installed FixedPointNumbers ──── v0.6.1
 Installed Showoff ────────────── v0.3.1
 Installed Reexport ───────────── v0.2.0
 Installed JLD ────────────────── v0.9.1
 Installed AbstractFFTs ───────── v0.4.1
 Installed DataStructures ─────── v0.17.7
 Installed FastGaussQuadrature ── v0.4.1
 Installed Contour ────────────── v0.5.1
 Installed BinaryProvider ─────── v0.5.8
 Installed NaNMath ────────────── v0.3.3
 Installed BinDeps ────────────── v1.0.0
 Installed SortingAlgorithms ──── v0.3.1
 Installed Conda ──────────────── v1.3.0
 Installed CommonSubexpressions ─ v0.2.0
 Installed ProgressMeter ──────── v1.2.0
 Installed FFMPEG ─────────────── v0.2.4
 Installed Parsers ────────────── v0.3.10
 Installed MacroTools ─────────── v0.5.3
 Installed OpenSpecFun_jll ────── v0.5.3+1
 Installed VersionParsing ─────── v1.2.0
 Installed CMake ──────────────── v1.1.2
 Installed LegacyStrings ──────── v0.4.1
 Installed GR ─────────────────── v0.44.0
 Installed FileIO ─────────────── v1.2.1
 Installed SpecialFunctions ───── v0.9.0
 Installed Plots ──────────────── v0.28.4
  Updating `~/.julia/environments/v1.5/Project.toml`
  [103da179] + ViscousFlow v0.1.9
  Updating `~/.julia/environments/v1.5/Manifest.toml`
  [621f4979] + AbstractFFTs v0.4.1
  [9e28174c] + BinDeps v1.0.0
  [b99e7846] + BinaryProvider v0.5.8
  [a74b3585] + Blosc v0.5.1
  [631607c0] + CMake v1.1.2
  [d5fb7624] + CMakeWrapper v0.2.3
  [3da002f7] + ColorTypes v0.9.0
  [5ae59095] + Colors v0.11.2
  [bbf7d656] + CommonSubexpressions v0.2.0
  [34da2185] + Compat v2.2.0
  [8f4d0f93] + Conda v1.3.0
  [d38c429a] + Contour v0.5.1
  [9a962f9c] + DataAPI v1.1.0
  [864edb3b] + DataStructures v0.17.7
  [163ba53b] + DiffResults v1.0.2
  [b552c78f] + DiffRules v0.1.0
  [ffbed154] + DocStringExtensions v0.8.1
  [e30172f5] + Documenter v0.24.3
  [c87230d0] + FFMPEG v0.2.4
  [7a1cc6ca] + FFTW v0.3.0
  [442a2c76] + FastGaussQuadrature v0.4.1
  [5789e2e9] + FileIO v1.2.1
  [53c48c17] + FixedPointNumbers v0.6.1
  [f6369f11] + ForwardDiff v0.10.8
  [28b8d3ca] + GR v0.44.0
  [4d00f742] + GeometryTypes v0.7.7
  [f67ccb44] + HDF5 v0.12.5
  [42fd0dbc] + IterativeSolvers v0.8.1
  [4138dd39] + JLD v0.9.1
  [682c06a0] + JSON v0.21.0
  [b964fa9f] + LaTeXStrings v1.0.3
  [1b4a561d] + LegacyStrings v0.4.1
  [7a12625a] + LinearMaps v2.5.2
  [1914dd2f] + MacroTools v0.5.3
  [442fdcdd] + Measures v0.3.1
  [e1d29d7a] + Missings v0.4.3
  [77ba4419] + NaNMath v0.3.3
  [efe28fd5] + OpenSpecFun_jll v0.5.3+1
  [bac558e1] + OrderedCollections v1.1.0
  [d96e819e] + Parameters v0.12.0
  [69de0a69] + Parsers v0.3.10
  [ccf2f8ad] + PlotThemes v1.0.1
  [995b91a9] + PlotUtils v0.6.1
  [91a5bcdd] + Plots v0.28.4
  [92933f4c] + ProgressMeter v1.2.0
  [438e738f] + PyCall v1.91.2
  [d330b81b] + PyPlot v2.8.2
  [3cdcf5f2] + RecipesBase v0.7.0
  [189a3867] + Reexport v0.2.0
  [ae029012] + Requires v1.0.0
  [992d4aef] + Showoff v0.3.1
  [a2af1166] + SortingAlgorithms v0.3.1
  [276daf66] + SpecialFunctions v0.9.0
  [90137ffa] + StaticArrays v0.12.1
  [2913bbd2] + StatsBase v0.32.0
  [30578b45] + URIParser v0.4.0
  [81def892] + VersionParsing v1.2.0
  [103da179] + ViscousFlow v0.1.9
  [2a0f44e3] + Base64 
  [ade2ca70] + Dates 
  [8bb1440f] + DelimitedFiles 
  [8ba89e20] + Distributed 
  [b77e0a4c] + InteractiveUtils 
  [76f85450] + LibGit2 
  [8f399da3] + Libdl 
  [37e2e46d] + LinearAlgebra 
  [56ddb016] + Logging 
  [d6f4376e] + Markdown 
  [a63ad114] + Mmap 
  [44cfe95a] + Pkg 
  [de0858da] + Printf 
  [9abbd945] + Profile 
  [3fa0cd96] + REPL 
  [9a3f8284] + Random 
  [ea8e919c] + SHA 
  [9e88b42a] + Serialization 
  [1a1011a3] + SharedArrays 
  [6462fe0b] + Sockets 
  [2f01184e] + SparseArrays 
  [10745b16] + Statistics 
  [8dfed614] + Test 
  [cf7118a7] + UUIDs 
  [4ec0a83e] + Unicode 
  Building CMake ─→ `~/.julia/packages/CMake/nSK2r/deps/build.log`
  Updating `/tmp/jl_OQvDUE/Project.toml`
 [no changes]
  Updating `/tmp/jl_OQvDUE/Manifest.toml`
 [no changes]
  Building Blosc ─→ `~/.julia/packages/Blosc/lzFr0/deps/build.log`
  Updating `/tmp/jl_fHH2Ew/Project.toml`
 [no changes]
  Updating `/tmp/jl_fHH2Ew/Manifest.toml`
 [no changes]
  Building Conda ─→ `~/.julia/packages/Conda/kLXeC/deps/build.log`
  Updating `/tmp/jl_OiOWhq/Project.toml`
 [no changes]
  Updating `/tmp/jl_OiOWhq/Manifest.toml`
 [no changes]
  Building PyCall → `~/.julia/packages/PyCall/ttONZ/deps/build.log`
  Updating `/tmp/jl_Xy4zel/Project.toml`
 [no changes]
  Updating `/tmp/jl_Xy4zel/Manifest.toml`
 [no changes]
  Building HDF5 ──→ `~/.julia/packages/HDF5/Zh9on/deps/build.log`
  Updating `/tmp/jl_ovLEOG/Project.toml`
 [no changes]
  Updating `/tmp/jl_ovLEOG/Manifest.toml`
 [no changes]
  Building FFTW ──→ `~/.julia/packages/FFTW/2okGQ/deps/build.log`
  Updating `/tmp/jl_XbUbgp/Project.toml`
 [no changes]
  Updating `/tmp/jl_XbUbgp/Manifest.toml`
 [no changes]
  Building GR ────→ `~/.julia/packages/GR/oiZD3/deps/build.log`
  Updating `/tmp/jl_kNX6Ap/Project.toml`
 [no changes]
  Updating `/tmp/jl_kNX6Ap/Manifest.toml`
 [no changes]
  Building FFMPEG → `~/.julia/packages/FFMPEG/guN1x/deps/build.log`
  Updating `/tmp/jl_jVEiXx/Project.toml`
 [no changes]
  Updating `/tmp/jl_jVEiXx/Manifest.toml`
 [no changes]
  Building Plots ─→ `~/.julia/packages/Plots/qZHsp/deps/build.log`
  Updating `/tmp/jl_QttqSr/Project.toml`
 [no changes]
  Updating `/tmp/jl_QttqSr/Manifest.toml`
 [no changes]
   Testing ViscousFlow
  Updating `/tmp/jl_fJHgIt/Project.toml`
 [no changes]
  Updating `/tmp/jl_fJHgIt/Manifest.toml`
 [no changes]
Running sandbox
Status `/tmp/jl_fJHgIt/Project.toml`
  [3da002f7] ColorTypes v0.9.0
  [b552c78f] DiffRules v0.1.0
  [ffbed154] DocStringExtensions v0.8.1
  [e30172f5] Documenter v0.24.3
  [7a1cc6ca] FFTW v0.3.0
  [442a2c76] FastGaussQuadrature v0.4.1
  [5789e2e9] FileIO v1.2.1
  [f6369f11] ForwardDiff v0.10.8
  [42fd0dbc] IterativeSolvers v0.8.1
  [4138dd39] JLD v0.9.1
  [b964fa9f] LaTeXStrings v1.0.3
  [7a12625a] LinearMaps v2.5.2
  [995b91a9] PlotUtils v0.6.1
  [91a5bcdd] Plots v0.28.4
  [92933f4c] ProgressMeter v1.2.0
  [438e738f] PyCall v1.91.2
  [d330b81b] PyPlot v2.8.2
  [3cdcf5f2] RecipesBase v0.7.0
  [189a3867] Reexport v0.2.0
  [276daf66] SpecialFunctions v0.9.0
  [90137ffa] StaticArrays v0.12.1
  [103da179] ViscousFlow v0.1.9
  [37e2e46d] LinearAlgebra 
  [9a3f8284] Random 
  [9e88b42a] Serialization 
  [2f01184e] SparseArrays 
  [10745b16] Statistics 
  [8dfed614] Test 
[ Info: Building and caching LGF table
Test Summary: | Pass  Total
Grid Routines |   75     75
[ Info: Building and caching Helmholtz LGF table for α = 0.07
[ Info: Switch to asymptotic formula at i = 79
[ Info: Support radius = 172
Progress:  69%|████████████████████████████▁            |  ETA: 0:00:00[KProgress: 100%|█████████████████████████████████████████| Time: 0:00:00[K
Test Summary:         | Pass  Total
Complex Grid Routines |   73     73
Test Summary: | Pass  Total
Fields        |   27     27
Test Summary:        | Pass  Total
Point-Field Routines |   58     58
Test Summary: | Pass  Total
Double Layer  |    2      2
Test Summary: | Pass  Total
Single Layer  |    2      2
Test Summary: | Pass  Total
Masks         |    1      1
Test Summary: | Pass  Total
Time Marching |    3      3
Test Summary:        | Pass  Total
Saddle-Point Systems |    9      9
Test Summary: | Pass  Total
Navier-Stokes |   27     27
   Testing ViscousFlow tests passed 
