Julia Version 1.3.0
Commit 46ce4d7933 (2019-11-26 06:09 UTC)
Platform Info:
  OS: Linux (x86_64-pc-linux-gnu)
  CPU: Intel(R) Xeon(R) Silver 4114 CPU @ 2.20GHz
  WORD_SIZE: 64
  LIBM: libopenlibm
  LLVM: libLLVM-6.0.1 (ORCJIT, skylake)

   Cloning default registries into `~/.julia`
   Cloning registry from "https://github.com/JuliaRegistries/General.git"
[?25l    Fetching: [>                                        ]  0.0 %    Fetching: [==============>                          ]  33.9 %    Fetching: [==================================>      ]  84.6 %[2K[?25h     Added registry `General` to `~/.julia/registries/General`
 Resolving package versions...
 Installed BinaryProvider ─ v0.5.8
  Updating `~/.julia/environments/v1.3/Project.toml`
  [b99e7846] + BinaryProvider v0.5.8
  Updating `~/.julia/environments/v1.3/Manifest.toml`
  [b99e7846] + BinaryProvider v0.5.8
  [8f399da3] + Libdl 
  [ea8e919c] + SHA 
   Testing BinaryProvider
 Resolving package versions...
[ Info: No changes
    Status `/tmp/jl_vJnCb1/Manifest.toml`
  [b99e7846] BinaryProvider v0.5.8
  [2a0f44e3] Base64  [`@stdlib/Base64`]
  [ade2ca70] Dates  [`@stdlib/Dates`]
  [8ba89e20] Distributed  [`@stdlib/Distributed`]
  [b77e0a4c] InteractiveUtils  [`@stdlib/InteractiveUtils`]
  [76f85450] LibGit2  [`@stdlib/LibGit2`]
  [8f399da3] Libdl  [`@stdlib/Libdl`]
  [56ddb016] Logging  [`@stdlib/Logging`]
  [d6f4376e] Markdown  [`@stdlib/Markdown`]
  [44cfe95a] Pkg  [`@stdlib/Pkg`]
  [de0858da] Printf  [`@stdlib/Printf`]
  [3fa0cd96] REPL  [`@stdlib/REPL`]
  [9a3f8284] Random  [`@stdlib/Random`]
  [ea8e919c] SHA  [`@stdlib/SHA`]
  [9e88b42a] Serialization  [`@stdlib/Serialization`]
  [6462fe0b] Sockets  [`@stdlib/Sockets`]
  [8dfed614] Test  [`@stdlib/Test`]
  [cf7118a7] UUIDs  [`@stdlib/UUIDs`]
  [4ec0a83e] Unicode  [`@stdlib/Unicode`]
[ Info: Symlinks allowed in /tmp: true
[ Info: Probing for download engine...
[ Info: Probing curl as a possibility...
[ Info:   Probe successful for curl
[ Info: Found download engine curl
[ Info: Probing for compression engine...
[ Info: Probing tar as a possibility...
[ Info:   Probe successful for tar
[ Info: Found compression engine tar
[ Info: Probing for sh engine...
[ Info: Probing sh as a possibility...
[ Info:   Probe successful for sh
[ Info: Found sh engine sh
1
2
1
2
Terminated
Test Summary:   | Pass  Total
OutputCollector |   30     30
┌ Warning: Platform `totally FREEFORM text!!1!!!1!` is not an officially supported platform
└ @ BinaryProvider ~/.julia/packages/BinaryProvider/kcGxO/src/PlatformNames.jl:450
┌ Warning: Platform `invalid-triplet-here` is not an officially supported platform
└ @ BinaryProvider ~/.julia/packages/BinaryProvider/kcGxO/src/PlatformNames.jl:450
┌ Warning: Platform `aarch64-linux-gnueabihf` is not an officially supported platform
└ @ BinaryProvider ~/.julia/packages/BinaryProvider/kcGxO/src/PlatformNames.jl:450
┌ Warning: Platform `armv7l-linux-gnu` is not an officially supported platform
└ @ BinaryProvider ~/.julia/packages/BinaryProvider/kcGxO/src/PlatformNames.jl:450
┌ Warning: Platform `x86_64-w32-mingw64` is not an officially supported platform
└ @ BinaryProvider ~/.julia/packages/BinaryProvider/kcGxO/src/PlatformNames.jl:450
┌ Warning: Unable to determine libgfortran version from 'blah.so'; returning :gcc_any
└ @ BinaryProvider ~/.julia/packages/BinaryProvider/kcGxO/src/PlatformNames.jl:557
Test Summary: | Pass  Total
PlatformNames |  129    129
Test Summary: | Pass  Total
Prefix        |   11     11
Test Summary:           | Pass  Total
Tarball listing parsing |    2      2
[ Info: /tmp/jl_hH6YIl/bin/fooifier does not exist, reporting unsatisfied
[ Info: FileProduct /tmp/jl_hH6YIl/bin/fooifier not found
[ Info: Directory /tmp/jl_hH6YIl/lib does not exist!
[ Info: Directory /tmp/jl_hH6YIl/lib does not exist!
[ Info: FileProduct /tmp/jl_hH6YIl/lib/libfoo.so not found
[ Info: FileProduct /tmp/jl_hH6YIl/bin/fooifier found at /tmp/jl_hH6YIl/bin/fooifier
[ Info: /tmp/jl_hH6YIl/bin/fooifier is not executable, reporting unsatisfied
[ Info: FileProduct /tmp/jl_hH6YIl/lib/libfoo.so found at /tmp/jl_hH6YIl/lib/libfoo.so
[ Info: Found a valid dl path libfoo.so while looking for libfoo
[ Info: /tmp/jl_hH6YIl/lib/libfoo.so matches our search criteria of libfoo
[ Info: /tmp/jl_hH6YIl/lib/libfoo.so cannot be dlopen'ed
[ Info: Could not locate libfoo inside /tmp/jl_hH6YIl/lib
[ Info: FileProduct /tmp/jl_hH6YIl/lib/libfoo.so found at /tmp/jl_hH6YIl/lib/libfoo.so
[ Info: Found a valid dl path libfoo.so while looking for libfoo
[ Info: /tmp/jl_hH6YIl/lib/libfoo.so matches our search criteria of libfoo
[ Info: /tmp/jl_hH6YIl/lib/libfoo.so cannot be dlopen'ed
[ Info: Could not locate libfoo inside /tmp/jl_hH6YIl/lib
[ Info: Found a valid dl path libfoo.dll while looking for libfoo
[ Info: /tmp/jl_hH6YIl/bin/libfoo.dll matches our search criteria of libfoo
[ Info: Found a valid dl path libfoo.dll while looking for libfoo
[ Info: /tmp/jl_hH6YIl/bin/libfoo.dll matches our search criteria of libfoo
[ Info: Found a valid dl path libfoo.dll while looking for libfoo
[ Info: /tmp/jl_hH6YIl/bin/libfoo.dll matches our search criteria of libfoo
[ Info: Found a valid dl path libfoo.dll while looking for libfoo
[ Info: /tmp/jl_hH6YIl/bin/libfoo.dll matches our search criteria of libfoo
[ Info: Found a valid dl path libfoo.1.so while looking for libfoo
[ Info: /tmp/jl_gStkNT/lib/libfoo.1.so matches our search criteria of libfoo
[ Info: Found a valid dl path libfoo.so while looking for libfoo
[ Info: /tmp/jl_jZxNRr/lib/libfoo.so matches our search criteria of libfoo
[ Info: Found a valid dl path libfoo.so.1 while looking for libfoo
[ Info: /tmp/jl_yEYlWZ/lib/libfoo.so.1 matches our search criteria of libfoo
[ Info: Found a valid dl path libfoo.so.1.2 while looking for libfoo
[ Info: /tmp/jl_NqW00x/lib/libfoo.so.1.2 matches our search criteria of libfoo
[ Info: Found a valid dl path libfoo.so.1.2.3 while looking for libfoo
[ Info: /tmp/jl_2nMK55/lib/libfoo.so.1.2.3 matches our search criteria of libfoo
[ Info: Could not locate libfoo inside /tmp/jl_dBjKtE/lib
[ Info: Could not locate libfoo inside /tmp/jl_cyzSRc/lib
[ Info: FileProduct /tmp/jl_oh7nQl/foo/$target/bar found at /tmp/jl_oh7nQl/foo/x86_64-linux-gnu-gcc7-cxx11/bar
[ Info: FileProduct /tmp/jl_oh7nQl/foo/${target}/bar found at /tmp/jl_oh7nQl/foo/x86_64-linux-gnu-gcc7-cxx11/bar
Test Summary: | Pass  Total
Products      |   32     32
[17:21:05] ./
[17:21:05] ./bin/
[17:21:05] ./bin/bar.sh
[17:21:05] ./lib/
[17:21:05] ./lib/baz.so
[17:21:05] ./etc/
[17:21:05] ./etc/qux.conf
[ Info: SHA256 of libfoo.v1.0.0.x86_64-linux-gnu-gcc7-cxx11.tar.gz: d62c1d71a9d027d704e4defa479eca313fb6fe46e65f7b9af740117a151b5640
[ Info: No hash cache found
[ Info: Calculated hash d62c1d71a9d027d704e4defa479eca313fb6fe46e65f7b9af740117a151b5640 for file ./libfoo.v1.0.0.x86_64-linux-gnu-gcc7-cxx11.tar.gz
[ Info: Installing ./libfoo.v1.0.0.x86_64-linux-gnu-gcc7-cxx11.tar.gz into /tmp/jl_GUH1ND
[ Info: Removing files installed by manifests/libfoo.v1.0.0.x86_64-linux-gnu-gcc7-cxx11.list
[ Info:   /tmp/jl_GUH1ND/bin/bar.sh does not exist, but ignoring
[ Info:   lib/baz.so removed
[ Info:   Culling empty directory lib
[ Info:   etc/qux.conf removed
[ Info:   Culling empty directory etc
[ Info:   manifests/libfoo.v1.0.0.x86_64-linux-gnu-gcc7-cxx11.list removed
┌ Warning: Platform `x86_64-juliaos-chartreuse` is not an officially supported platform
└ @ BinaryProvider ~/.julia/packages/BinaryProvider/kcGxO/src/PlatformNames.jl:450
[ Info: No hash cache found
[ Info: Calculated hash d62c1d71a9d027d704e4defa479eca313fb6fe46e65f7b9af740117a151b5640 for file libfoo.v1.0.0.x86_64-apple-darwin14.tar.gz
[ Info: Installing libfoo.v1.0.0.x86_64-apple-darwin14.tar.gz into /tmp/jl_xJIKBn
┌ Warning: Platform `not-a-triplet` is not an officially supported platform
└ @ BinaryProvider ~/.julia/packages/BinaryProvider/kcGxO/src/PlatformNames.jl:450
[ Info: No hash cache found
[ Info: Calculated hash d62c1d71a9d027d704e4defa479eca313fb6fe46e65f7b9af740117a151b5640 for file libfoo.v1.0.0.not-a-triplet.tar.gz
[ Info: Installing libfoo.v1.0.0.not-a-triplet.tar.gz into /tmp/jl_koGJV7
Test Summary: | Pass  Total
Packaging     |   32     32
[ Info: This should say; no hash cache found
[ Info: No hash cache found
[ Info: Calculated hash 9f86d081884c7d659a2feaa0c55ad015a3bf4f1b2b0b822cd15d6c15b0f00a08 for file /tmp/jl_RQthiU/foo
[ Info: This should say; hash cache is consistent
[ Info: Hash cache is consistent, returning true
[ Info: This should say; file has been modified
[ Info: File has been modified, hash cache invalidated
[ Info: Hash cache is consistent, returning true
[ Info: This should say; hash has changed
[ Info: Verification hash mismatch, hash cache invalidated
Test Summary: | Pass  Total
Verification  |   11     11
[ Info: Downloading https://github.com/staticfloat/small_bin/raw/f1a92f5eafbd30a0c6a8efb6947485b0f6d1bec3/socrates.tar.gz to /tmp/jl_J2amwF-download.gz...
[17:21:12] #=#=#                                                                         [17:21:12] ##O#- #                                                                       [17:21:12] [ Info: No hash cache found
[ Info: Calculated hash e65d2f13f2085f2c279830e863292312a72930fee5ba3c792b14c33ce5c5cc58 for file /tmp/jl_J2amwF-download.gz
[ Info: Unpacking /tmp/jl_J2amwF-download.gz into /tmp/jl_OU1iUM/target...
[17:21:12] ######################################################################## 100.0%[17:21:12] ######################################################################## 100.0%
[ Info: Downloading https://github.com/staticfloat/small_bin/raw/f1a92f5eafbd30a0c6a8efb6947485b0f6d1bec3/socrates.tar.bz2 to /tmp/jl_zu4uWt-download.bz2...
[17:21:13] #=#=#                                                                         [17:21:13] [17:21:13] ######################################################################## 100.0%##O#- #                                                                       [17:21:13] [17:21:13] ######################################################################## 100.0%
[ Info: No hash cache found
[ Info: Calculated hash 13fc17b97be41763b02cbb80e9d048302cec3bd3d446c2ed6e8210bddcd3ac76 for file /tmp/jl_zu4uWt-download.bz2
[ Info: Unpacking /tmp/jl_zu4uWt-download.bz2 into /tmp/jl_cNTpJz/target...
[ Info: Downloading https://github.com/staticfloat/small_bin/raw/f1a92f5eafbd30a0c6a8efb6947485b0f6d1bec3/socrates.tar.xz to /tmp/jl_VUpsxk-download.xz...
[17:21:13] #=#=#                                                                         [17:21:13] [17:21:13] ######################################################################## 100.0%[17:21:13] ######################################################################## 100.0%
[ Info: No hash cache found
[ Info: Calculated hash 61bcf109fcb749ee7b6a570a6057602c08c836b6f81091eab7aa5f5870ec6475 for file /tmp/jl_VUpsxk-download.xz
[ Info: Unpacking /tmp/jl_VUpsxk-download.xz into /tmp/jl_snmYep/target...
Test Summary: | Pass  Total
Downloading   |    6      6
[ Info: Downloading https://github.com/staticfloat/small_bin/raw/master/collapse_the_symlink/collapse_the_symlink.tar.gz to /tmp/jl_R0b1be-download.gz...
[17:21:14] #=#=#                                                                         [17:21:14] [17:21:14] ######################################################################## 100.0%[17:21:14] ######################################################################## 100.0%
[ Info: No hash cache found
[ Info: Calculated hash 956c1201405f64d3465cc28cb0dec9d63c11a08cad28c381e13bb22e1fc469d3 for file /tmp/jl_R0b1be-download.gz
[ Info: Unpacking /tmp/jl_R0b1be-download.gz into /tmp/jl_i6qImh/target...
┌ Warning: Could not copy /tmp/jl_g1vqLb/collapse_the_symlink/broken to /tmp/jl_i6qImh/target/collapse_the_symlink/broken
└ @ BinaryProvider ~/.julia/packages/BinaryProvider/kcGxO/src/PlatformEngines.jl:684
Test Summary:       | Pass  Total
Copyderef unpacking |    6      6
Test Summary:           | Pass  Total
Download GitHub API #88 |    1      1
Test Summary:   | Pass  Total
choose_download |   12     12
┌ Warning: Could not extract the platform key of https://github.com/staticfloat/small_bin/raw/51b13b44feb2a262e2e04690bfa54d03167533f2/libfoo/libfoo.x86_64-linux-gnu.tar.gz; continuing...
└ @ BinaryProvider ~/.julia/packages/BinaryProvider/kcGxO/src/Prefix.jl:185
[ Info: Downloading https://github.com/staticfloat/small_bin/raw/51b13b44feb2a262e2e04690bfa54d03167533f2/libfoo/libfoo.x86_64-linux-gnu.tar.gz to /tmp/jl_OCqygj/downloads/libfoo.x86_64-linux-gnu.tar.gz...
[17:21:19] #=#=#                                                                         [17:21:19] [17:21:19] ######################################################################## 100.0%[17:21:19] ###################                                                       27.2%[17:21:19] ######################################################################## 100.0%
[ Info: No hash cache found
[ Info: Calculated hash 5208c63a9d07e592c78f541fc13caa8cd191b11e7e77b31d407237c2b13ec391 for file /tmp/jl_OCqygj/downloads/libfoo.x86_64-linux-gnu.tar.gz
[ Info: Installing /tmp/jl_OCqygj/downloads/libfoo.x86_64-linux-gnu.tar.gz into /tmp/jl_OCqygj
[ Info: Found a valid dl path libfoo.so while looking for libfoo
[ Info: /tmp/jl_OCqygj/lib/libfoo.so matches our search criteria of libfoo
[ Info: Removing files installed by manifests/libfoo.x86_64-linux-gnu.list
[ Info:   logs/libfoo.log removed
[ Info:   Culling empty directory logs
[ Info:   lib/libfoo.so removed
[ Info:   Culling empty directory lib
[ Info:   bin/fooifier removed
[ Info:   Culling empty directory bin
[ Info:   manifests/libfoo.x86_64-linux-gnu.list removed
[ Info: Downloading https://github.com/staticfloat/small_bin/raw/51b13b44feb2a262e2e04690bfa54d03167533f2/libfoo/libfoo.x86_64-linux-gnu.tar.gz to /tmp/jl_h0kyVt-download.gz...
[17:21:20] #=#=#                                                                         [17:21:20] [17:21:20] ######################################################################## 100.0%[17:21:20] ######################################################################## 100.0%
[ Info: Found a valid dl path libfoo.so while looking for libfoo
[ Info: /tmp/jl_OCqygj/lib/libfoo.so matches our search criteria of libfoo
[ Info: Downloading https://github.com/staticfloat/small_bin/raw/51b13b44feb2a262e2e04690bfa54d03167533f2/libfoo/libfoo.x86_64-linux-gnu.tar.gz to /tmp/jl_MusgdF-download.gz...
[17:21:20] #=#=#                                                                         [17:21:20] [17:21:20] ######################################################################## 100.0%[17:21:20] ######################################################################## 100.0%
[ Info: Downloading https://github.com/staticfloat/small_bin/raw/51b13b44feb2a262e2e04690bfa54d03167533f2/libfoo/libfoo.x86_64-linux-gnu.tar.gz to /tmp/jl_OCqygj/libfoo.tar.gz...
[17:21:20] #=#=#                                                                         [17:21:20] [17:21:20] ######################################################################## 100.0%[17:21:20] ######################################################################## 100.0%
[ Info: No hash cache found
[ Info: Calculated hash 5208c63a9d07e592c78f541fc13caa8cd191b11e7e77b31d407237c2b13ec391 for file /tmp/jl_OCqygj/libfoo.tar.gz
[ Info: Destination file /tmp/jl_OCqygj/libfoo.tar.gz already exists, verifying...
[ Info: Hash cache is consistent, returning true
[ Info: File has been modified, hash cache invalidated
[ Info: Verification failed, re-downloading...
[ Info: Downloading https://github.com/staticfloat/small_bin/raw/51b13b44feb2a262e2e04690bfa54d03167533f2/libfoo/libfoo.x86_64-linux-gnu.tar.gz to /tmp/jl_OCqygj/libfoo.tar.gz...
[17:21:22] [17:21:22] ######################################################################## 100.0%[17:21:22] ######################################################################## 100.0%[17:21:22] ######################################################################## 100.0%[17:21:22] ######################################################################## 100.0%
[ Info: Continued download didn't work, restarting from scratch
[ Info: Downloading https://github.com/staticfloat/small_bin/raw/51b13b44feb2a262e2e04690bfa54d03167533f2/libfoo/libfoo.x86_64-linux-gnu.tar.gz to /tmp/jl_OCqygj/libfoo.tar.gz...
[17:21:22] [17:21:23] ######################################################################## 100.0%[17:21:23] ######################################################################## 100.0%
┌ Warning: Could not extract the platform key of https://github.com/staticfloat/small_bin/raw/51b13b44feb2a262e2e04690bfa54d03167533f2/libfoo/libfoo.x86_64-linux-gnu.tar.gz; continuing...
└ @ BinaryProvider ~/.julia/packages/BinaryProvider/kcGxO/src/Prefix.jl:185
[ Info: Destination file /tmp/jl_OCqygj/downloads/libfoo.x86_64-linux-gnu.tar.gz already exists, verifying...
┌ Warning: Could not extract the platform key of https://github.com/staticfloat/small_bin/raw/51b13b44feb2a262e2e04690bfa54d03167533f2/libfoo/libfoo.x86_64-linux-gnu.tar.gz; continuing...
└ @ BinaryProvider ~/.julia/packages/BinaryProvider/kcGxO/src/Prefix.jl:185
[ Info: Verification failed, re-downloading...
[ Info: Downloading https://github.com/staticfloat/small_bin/raw/51b13b44feb2a262e2e04690bfa54d03167533f2/libfoo/libfoo.x86_64-linux-gnu.tar.gz to /tmp/jl_OCqygj/downloads/libfoo.x86_64-linux-gnu.tar.gz...
[17:21:23] [17:21:23] ######################################################################## 100.0%[17:21:23] ######################################################################## 100.0%[17:21:23] ######################################################################## 100.0%[17:21:23] ######################################################################## 100.0%
[ Info: Continued download didn't work, restarting from scratch
[ Info: Downloading https://github.com/staticfloat/small_bin/raw/51b13b44feb2a262e2e04690bfa54d03167533f2/libfoo/libfoo.x86_64-linux-gnu.tar.gz to /tmp/jl_OCqygj/downloads/libfoo.x86_64-linux-gnu.tar.gz...
[17:21:23] #=#=#                                                                         [17:21:23] [17:21:23] ######################################################################## 100.0%[17:21:23] ######################################################################## 100.0%
[ Info: Installing /tmp/jl_OCqygj/downloads/libfoo.x86_64-linux-gnu.tar.gz into /tmp/jl_OCqygj
[ Info: logs/libfoo.log already exists, force-removing
[ Info: lib/libfoo.so already exists, force-removing
[ Info: bin/fooifier already exists, force-removing
[ Info: Found a valid dl path libfoo.so while looking for libfoo
[ Info: /tmp/jl_OCqygj/lib/libfoo.so matches our search criteria of libfoo
┌ Warning: Could not extract the platform key of https://github.com/staticfloat/small_bin/raw/51b13b44feb2a262e2e04690bfa54d03167533f2/libfoo/libfoo.x86_64-linux-gnu.tar.gz; continuing...
└ @ BinaryProvider ~/.julia/packages/BinaryProvider/kcGxO/src/Prefix.jl:185
[ Info: Downloading https://github.com/staticfloat/small_bin/raw/51b13b44feb2a262e2e04690bfa54d03167533f2/libfoo/libfoo.x86_64-linux-gnu.tar.gz to /tmp/jl_OCqygj/downloads2/tarball.tar.gz...
[17:21:23] [17:21:23] ######################################################################## 100.0%[17:21:23] ######################################################################## 100.0%
[ Info: No hash cache found
[ Info: Calculated hash 5208c63a9d07e592c78f541fc13caa8cd191b11e7e77b31d407237c2b13ec391 for file /tmp/jl_OCqygj/downloads2/tarball.tar.gz
[ Info: Installing /tmp/jl_OCqygj/downloads2/tarball.tar.gz into /tmp/jl_OCqygj
[ Info: Removing files installed by manifests/libfoo.x86_64-linux-gnu.list
[ Info:   logs/libfoo.log removed
[ Info:   Culling empty directory logs
[ Info:   lib/libfoo.so removed
[ Info:   Culling empty directory lib
[ Info:   bin/fooifier removed
[ Info:   Culling empty directory bin
[ Info:   manifests/libfoo.x86_64-linux-gnu.list removed
[ Info: Found a valid dl path libfoo.so while looking for libfoo
[ Info: /tmp/jl_OCqygj/lib/libfoo.so matches our search criteria of libfoo
[ Info: Downloading http://localhost:1/this_is_not_a_file.v1.0.0.x86_64-linux-gnu-gcc7-cxx11.tar.gz to /tmp/jl_OCqygj/downloads/this_is_not_a_file.v1.0.0.x86_64-linux-gnu-gcc7-cxx11.tar.gz...
[17:21:23] 
[17:21:23] curl: (7) Failed to connect to localhost port 1: Connection refused
Test Summary:      | Pass  Total
Libfoo Downloading |   32     32
┌ Warning: Could not extract the platform key of https://github.com/staticfloat/small_bin/raw/51b13b44feb2a262e2e04690bfa54d03167533f2/libfoo/libfoo.x86_64-linux-gnu.tar.gz; continuing...
└ @ BinaryProvider ~/.julia/packages/BinaryProvider/kcGxO/src/Prefix.jl:185
[ Info: Downloading https://github.com/staticfloat/small_bin/raw/51b13b44feb2a262e2e04690bfa54d03167533f2/libfoo/libfoo.x86_64-linux-gnu.tar.gz to /home/pkgeval/.julia/packages/BinaryProvider/kcGxO/test/LibFoo.jl/deps/usr/downloads/libfoo.x86_64-linux-gnu.tar.gz...
[17:21:32] #=#=#                                                                         [17:21:32] [17:21:32] ######################################################################## 100.0%[17:21:32] ###################                                                       27.2%[17:21:32] ######################################################################## 100.0%
[ Info: No hash cache found
[ Info: Calculated hash 5208c63a9d07e592c78f541fc13caa8cd191b11e7e77b31d407237c2b13ec391 for file /home/pkgeval/.julia/packages/BinaryProvider/kcGxO/test/LibFoo.jl/deps/usr/downloads/libfoo.x86_64-linux-gnu.tar.gz
[ Info: Installing /home/pkgeval/.julia/packages/BinaryProvider/kcGxO/test/LibFoo.jl/deps/usr/downloads/libfoo.x86_64-linux-gnu.tar.gz into /home/pkgeval/.julia/packages/BinaryProvider/kcGxO/test/LibFoo.jl/deps/usr
  Updating registry at `~/.julia/registries/General`
  Updating git-repo `https://github.com/JuliaRegistries/General.git`
[?25l[2K[?25h Resolving package versions...
 Installed Compat ─ v3.0.0
  Updating `~/.julia/packages/BinaryProvider/kcGxO/test/LibFoo.jl/Project.toml`
  [34da2185] + Compat v3.0.0
  [8f399da3] + Libdl 
  [8dfed614] + Test 
ERROR: SystemError: opening file "/home/pkgeval/.julia/packages/BinaryProvider/kcGxO/test/LibFoo.jl/Project.toml": Permission denied
Stacktrace:
 [1] #systemerror#44(::Nothing, ::typeof(systemerror), ::String, ::Bool) at ./error.jl:134
 [2] systemerror at ./error.jl:134 [inlined]
 [3] #open#512(::Nothing, ::Nothing, ::Nothing, ::Bool, ::Nothing, ::typeof(open), ::String) at ./iostream.jl:254
 [4] #open at ./none:0 [inlined]
 [5] #open#271(::Base.Iterators.Pairs{Symbol,Bool,Tuple{Symbol},NamedTuple{(:truncate,),Tuple{Bool}}}, ::typeof(open), ::Pkg.Types.var"#41#43"{Base.GenericIOBuffer{Array{UInt8,1}}}, ::String) at ./io.jl:296
 [6] #open at ./none:0 [inlined]
 [7] write_project at /buildworker/worker/package_linux64/build/usr/share/julia/stdlib/v1.3/Pkg/src/project.jl:176 [inlined]
 [8] #write_project#44(::Bool, ::typeof(Pkg.Types.write_project), ::Pkg.Types.Project, ::Pkg.Types.EnvCache, ::Pkg.Types.EnvCache, ::Pkg.Types.Context) at /buildworker/worker/package_linux64/build/usr/share/julia/stdlib/v1.3/Pkg/src/project.jl:187
 [9] #write_env#141 at ./none:0 [inlined]
 [10] write_env at /buildworker/worker/package_linux64/build/usr/share/julia/stdlib/v1.3/Pkg/src/Types.jl:1373 [inlined]
 [11] up(::Pkg.Types.Context, ::Array{Pkg.Types.PackageSpec,1}, ::Pkg.Types.UpgradeLevel) at /buildworker/worker/package_linux64/build/usr/share/julia/stdlib/v1.3/Pkg/src/Operations.jl:1104
 [12] #up#43(::Pkg.Types.UpgradeLevel, ::Pkg.Types.PackageMode, ::Bool, ::Base.Iterators.Pairs{Union{},Union{},Tuple{},NamedTuple{(),Tuple{}}}, ::typeof(Pkg.API.up), ::Pkg.Types.Context, ::Array{Pkg.Types.PackageSpec,1}) at /buildworker/worker/package_linux64/build/usr/share/julia/stdlib/v1.3/Pkg/src/API.jl:170
 [13] #up at ./none:0 [inlined]
 [14] #up#38 at /buildworker/worker/package_linux64/build/usr/share/julia/stdlib/v1.3/Pkg/src/API.jl:137 [inlined]
 [15] #up at ./none:0 [inlined]
 [16] #instantiate#114(::Nothing, ::Bool, ::Bool, ::Pkg.BinaryPlatforms.Linux, ::Base.Iterators.Pairs{Union{},Union{},Tuple{},NamedTuple{(),Tuple{}}}, ::typeof(Pkg.API.instantiate), ::Pkg.Types.Context) at /buildworker/worker/package_linux64/build/usr/share/julia/stdlib/v1.3/Pkg/src/API.jl:722
 [17] instantiate(::Pkg.Types.Context) at /buildworker/worker/package_linux64/build/usr/share/julia/stdlib/v1.3/Pkg/src/API.jl:720
 [18] #test#131(::Bool, ::Nothing, ::Cmd, ::Cmd, ::typeof(Pkg.Operations.test), ::Pkg.Types.Context, ::Array{Pkg.Types.PackageSpec,1}) at /buildworker/worker/package_linux64/build/usr/share/julia/stdlib/v1.3/Pkg/src/Operations.jl:1314
 [19] #test at ./none:0 [inlined]
 [20] #test#62(::Bool, ::Nothing, ::Cmd, ::Cmd, ::Base.Iterators.Pairs{Union{},Union{},Tuple{},NamedTuple{(),Tuple{}}}, ::typeof(Pkg.API.test), ::Pkg.Types.Context, ::Array{Pkg.Types.PackageSpec,1}) at /buildworker/worker/package_linux64/build/usr/share/julia/stdlib/v1.3/Pkg/src/API.jl:253
 [21] test(::Pkg.Types.Context, ::Array{Pkg.Types.PackageSpec,1}) at /buildworker/worker/package_linux64/build/usr/share/julia/stdlib/v1.3/Pkg/src/API.jl:239
 [22] #test#61 at /buildworker/worker/package_linux64/build/usr/share/julia/stdlib/v1.3/Pkg/src/API.jl:233 [inlined]
 [23] test at /buildworker/worker/package_linux64/build/usr/share/julia/stdlib/v1.3/Pkg/src/API.jl:233 [inlined]
 [24] #test#60 at /buildworker/worker/package_linux64/build/usr/share/julia/stdlib/v1.3/Pkg/src/API.jl:232 [inlined]
 [25] test at /buildworker/worker/package_linux64/build/usr/share/julia/stdlib/v1.3/Pkg/src/API.jl:232 [inlined]
 [26] #test#59(::Base.Iterators.Pairs{Union{},Union{},Tuple{},NamedTuple{(),Tuple{}}}, ::typeof(Pkg.API.test), ::String) at /buildworker/worker/package_linux64/build/usr/share/julia/stdlib/v1.3/Pkg/src/API.jl:231
 [27] test(::String) at /buildworker/worker/package_linux64/build/usr/share/julia/stdlib/v1.3/Pkg/src/API.jl:231
 [28] top-level scope at none:1
LibFoo.jl: Error During Test at /home/pkgeval/.julia/packages/BinaryProvider/kcGxO/test/runtests.jl:980
  Got exception outside of a @test
  failed process: Process(`/opt/julia/bin/julia -Cnative -J/opt/julia/lib/julia/sys.so --check-bounds=yes -g1 --project=/home/pkgeval/.julia/packages/BinaryProvider/kcGxO/test/LibFoo.jl --color=no -e 'using Pkg; Pkg.test("LibFoo")'`, ProcessExited(1)) [1]
  
  Stacktrace:
   [1] pipeline_error at ./process.jl:525 [inlined]
   [2] #run#565(::Bool, ::typeof(run), ::Cmd) at ./process.jl:440
   [3] run at ./process.jl:438 [inlined]
   [4] (::var"#85#90"{String})() at /home/pkgeval/.julia/packages/BinaryProvider/kcGxO/test/runtests.jl:1025
   [5] cd(::var"#85#90"{String}, ::String) at ./file.jl:104
   [6] top-level scope at /home/pkgeval/.julia/packages/BinaryProvider/kcGxO/test/runtests.jl:1023
   [7] top-level scope at /buildworker/worker/package_linux64/build/usr/share/julia/stdlib/v1.3/Test/src/Test.jl:1107
   [8] top-level scope at /home/pkgeval/.julia/packages/BinaryProvider/kcGxO/test/runtests.jl:981
   [9] include at ./boot.jl:328 [inlined]
   [10] include_relative(::Module, ::String) at ./loading.jl:1105
   [11] include(::Module, ::String) at ./Base.jl:31
   [12] include(::String) at ./client.jl:424
   [13] top-level scope at none:6
   [14] eval(::Module, ::Any) at ./boot.jl:330
   [15] exec_options(::Base.JLOptions) at ./client.jl:263
   [16] _start() at ./client.jl:460
  
Test Summary: | Pass  Error  Total
LibFoo.jl     |    4      1      5
ERROR: LoadError: Some tests did not pass: 4 passed, 0 failed, 1 errored, 0 broken.
in expression starting at /home/pkgeval/.julia/packages/BinaryProvider/kcGxO/test/runtests.jl:980
ERROR: Package BinaryProvider errored during testing
Stacktrace:
 [1] pkgerror(::String, ::Vararg{String,N} where N) at /buildworker/worker/package_linux64/build/usr/share/julia/stdlib/v1.3/Pkg/src/Types.jl:113
 [2] #test#131(::Bool, ::Nothing, ::Cmd, ::Cmd, ::typeof(Pkg.Operations.test), ::Pkg.Types.Context, ::Array{Pkg.Types.PackageSpec,1}) at /buildworker/worker/package_linux64/build/usr/share/julia/stdlib/v1.3/Pkg/src/Operations.jl:1370
 [3] #test at ./none:0 [inlined]
 [4] #test#62(::Bool, ::Nothing, ::Cmd, ::Cmd, ::Base.Iterators.Pairs{Union{},Union{},Tuple{},NamedTuple{(),Tuple{}}}, ::typeof(Pkg.API.test), ::Pkg.Types.Context, ::Array{Pkg.Types.PackageSpec,1}) at /buildworker/worker/package_linux64/build/usr/share/julia/stdlib/v1.3/Pkg/src/API.jl:253
 [5] test(::Pkg.Types.Context, ::Array{Pkg.Types.PackageSpec,1}) at /buildworker/worker/package_linux64/build/usr/share/julia/stdlib/v1.3/Pkg/src/API.jl:239
 [6] #test#61 at /buildworker/worker/package_linux64/build/usr/share/julia/stdlib/v1.3/Pkg/src/API.jl:233 [inlined]
 [7] test at /buildworker/worker/package_linux64/build/usr/share/julia/stdlib/v1.3/Pkg/src/API.jl:233 [inlined]
 [8] #test#60 at /buildworker/worker/package_linux64/build/usr/share/julia/stdlib/v1.3/Pkg/src/API.jl:232 [inlined]
 [9] test at /buildworker/worker/package_linux64/build/usr/share/julia/stdlib/v1.3/Pkg/src/API.jl:232 [inlined]
 [10] #test#59(::Base.Iterators.Pairs{Union{},Union{},Tuple{},NamedTuple{(),Tuple{}}}, ::typeof(Pkg.API.test), ::String) at /buildworker/worker/package_linux64/build/usr/share/julia/stdlib/v1.3/Pkg/src/API.jl:231
 [11] test(::String) at /buildworker/worker/package_linux64/build/usr/share/julia/stdlib/v1.3/Pkg/src/API.jl:231
 [12] top-level scope at none:12
