Julia Version 1.6.0-DEV.1276
Commit 2655a3ad5d (2020-10-18 19:49 UTC)
Platform Info:
  OS: Linux (x86_64-pc-linux-gnu)
  CPU: AMD EPYC 7502 32-Core Processor
  WORD_SIZE: 64
  LIBM: libopenlibm
  LLVM: libLLVM-11.0.0 (ORCJIT, znver2)
Environment:
  JULIA_DEPOT_PATH = ::/usr/local/share/julia
  JULIA_NUM_THREADS = 2
  JULIA_MAX_NUM_PRECOMPILE_FILES = 9223372036854775807

   Resolving package versions...
   Installed VersionParsing ───────── v1.2.0
   Installed IntervalSets ─────────── v0.5.1
   Installed SortingAlgorithms ────── v0.3.1
   Installed NLSolversBase ────────── v7.5.0
   Installed Dolo ─────────────────── v0.4.1
   Installed Reexport ─────────────── v0.2.0
   Installed DiffRules ────────────── v1.0.1
   Installed LineSearches ─────────── v7.1.0
   Installed Primes ───────────────── v0.5.0
   Installed LightGraphs ──────────── v1.3.0
   Installed Optim ────────────────── v0.22.0
   Installed QuadGK ───────────────── v2.4.1
   Installed FFTW ─────────────────── v1.0.1
   Installed PDMats ───────────────── v0.10.1
   Installed BinaryProvider ───────── v0.5.10
   Installed RecipesBase ──────────── v1.1.0

gzip: stdin: unexpected end of file
tar: Child returned status 1
tar: Error is not recoverable: exiting now
┌ Warning: failed to extract archive downloaded from https://pkg.julialang.org/package/2ce0c516-f11f-5db3-98ad-e0e1048fbd70/583d9bc863ad491571369212b9a8047219a0015d
└ @ Pkg.Operations /buildworker/worker/package_linux64/build/usr/share/julia/stdlib/v1.6/Pkg/src/Operations.jl:617
   Installed DataAPI ──────────────── v1.3.0
   Installed Inflate ──────────────── v0.1.2
   Installed MacroTools ───────────── v0.5.6
   Installed CodecBzip2 ───────────── v0.7.2
   Installed JSON ─────────────────── v0.21.1
   Installed MPC_jll ──────────────── v1.1.0+0
   Installed Zlib_jll ─────────────── v1.2.11+18
   Installed ForwardDiff ──────────── v0.10.12
   Installed RangeArrays ──────────── v0.3.2
   Installed BasisMatrices ────────── v0.6.0
   Installed StatsFuns ────────────── v0.9.5
   Installed BinDeps ──────────────── v1.0.1
   Installed OrderedCollections ───── v1.3.1
   Installed JLLWrappers ──────────── v1.1.2
   Installed MPFR_jll ─────────────── v4.1.0+1
   Installed Combinatorics ────────── v0.7.0
   Installed Distributions ────────── v0.23.8
   Installed JSONSchema ───────────── v0.3.2
   Installed MbedTLS_jll ──────────── v2.16.8+0
   Installed SimpleTraits ─────────── v0.9.3
   Installed Parsers ──────────────── v1.0.11
   Installed Parameters ───────────── v0.12.1
   Installed NLsolve ──────────────── v4.4.1
   Installed GMP_jll ──────────────── v6.2.0+3
   Installed PositiveFactorizations ─ v0.2.3
   Installed UnPack ───────────────── v1.0.2
   Installed IniFile ──────────────── v0.5.0
   Installed Bzip2_jll ────────────── v1.0.6+5
   Installed DiffResults ──────────── v1.0.2
   Installed DataStructures ───────── v0.18.7
   Installed Dolang ───────────────── v3.1.2
   Installed StringDistances ──────── v0.8.0
   Installed SymEngine_jll ────────── v0.6.0+1
   Installed StatsBase ────────────── v0.33.2
   Installed CodecZlib ────────────── v0.7.0
   Installed Requires ─────────────── v1.1.0
   Installed SpecialFunctions ─────── v0.8.0
   Installed Compat ───────────────── v3.21.0
   Installed AbstractFFTs ─────────── v0.4.1
   Installed Polynomials ──────────── v0.5.2
   Installed Rmath ────────────────── v0.6.1
   Installed CommonSubexpressions ─── v0.3.0
   Installed Missings ─────────────── v0.4.4
   Installed AxisArrays ───────────── v0.4.3
   Installed Calculus ─────────────── v0.5.1
   Installed MutableArithmetics ───── v0.2.10
   Installed Distances ────────────── v0.9.2
   Installed SymEngine ────────────── v0.8.2
   Installed MathProgBase ─────────── v0.7.8
   Installed ArnoldiMethod ────────── v0.0.4
   Installed NaNMath ──────────────── v0.3.4
   Installed DiffEqDiffTools ──────── v1.7.0
   Installed MbedTLS ──────────────── v1.0.2
   Installed ZipFile ──────────────── v0.9.3
   Installed TranscodingStreams ───── v0.9.5
   Installed IterativeSolvers ─────── v0.8.4
   Installed BenchmarkTools ───────── v0.5.0
   Installed EllipsisNotation ─────── v0.4.0
   Installed Conda ────────────────── v1.4.1
   Installed URIParser ────────────── v0.4.1
   Installed ArrayInterface ───────── v2.13.6
   Installed HTTP ─────────────────── v0.8.19
   Installed Rmath_jll ────────────── v0.2.2+1
   Installed IterTools ────────────── v1.3.0
   Installed NLopt_jll ────────────── v2.6.2+0
   Installed FillArrays ───────────── v0.8.14
   Installed MathOptInterface ─────── v0.9.17
   Installed StaticArrays ─────────── v0.12.4
   Installed NLopt ────────────────── v0.6.1
   Installed YAML ─────────────────── v0.4.2
   Installed DSP ──────────────────── v0.6.0
   Installed QuantEcon ────────────── v0.16.2
Updating `~/.julia/environments/v1.6/Project.toml`
  [9d24351c] + Dolo v0.4.1
Updating `~/.julia/environments/v1.6/Manifest.toml`
  [621f4979] + AbstractFFTs v0.4.1
  [ec485272] + ArnoldiMethod v0.0.4
  [4fba245c] + ArrayInterface v2.13.6
  [39de3d68] + AxisArrays v0.4.3
  [08854c51] + BasisMatrices v0.6.0
  [6e4b80f9] + BenchmarkTools v0.5.0
  [9e28174c] + BinDeps v1.0.1
  [b99e7846] + BinaryProvider v0.5.10
  [6e34b625] + Bzip2_jll v1.0.6+5
  [49dc2e85] + Calculus v0.5.1
  [523fee87] + CodecBzip2 v0.7.2
  [944b1d66] + CodecZlib v0.7.0
  [861a8166] + Combinatorics v0.7.0
  [bbf7d656] + CommonSubexpressions v0.3.0
  [34da2185] + Compat v3.21.0
  [8f4d0f93] + Conda v1.4.1
  [717857b8] + DSP v0.6.0
  [9a962f9c] + DataAPI v1.3.0
  [864edb3b] + DataStructures v0.18.7
  [01453d9d] + DiffEqDiffTools v1.7.0
  [163ba53b] + DiffResults v1.0.2
  [b552c78f] + DiffRules v1.0.1
  [b4f34e82] + Distances v0.9.2
  [31c24e10] + Distributions v0.23.8
  [e5c7262c] + Dolang v3.1.2
  [9d24351c] + Dolo v0.4.1
  [da5c29d0] + EllipsisNotation v0.4.0
  [7a1cc6ca] + FFTW v1.0.1
  [1a297f60] + FillArrays v0.8.14
  [f6369f11] + ForwardDiff v0.10.12
  [781609d7] + GMP_jll v6.2.0+3
  [cd3eb016] + HTTP v0.8.19
  [d25df0c9] + Inflate v0.1.2
  [83e8ac13] + IniFile v0.5.0
  [8197267c] + IntervalSets v0.5.1
  [c8e1da08] + IterTools v1.3.0
  [42fd0dbc] + IterativeSolvers v0.8.4
  [692b3bcd] + JLLWrappers v1.1.2
  [682c06a0] + JSON v0.21.1
  [7d188eb4] + JSONSchema v0.3.2
  [093fc24a] + LightGraphs v1.3.0
  [d3d80556] + LineSearches v7.1.0
  [2ce0c516] + MPC_jll v1.1.0+0
  [3a97d323] + MPFR_jll v4.1.0+1
  [1914dd2f] + MacroTools v0.5.6
  [b8f27783] + MathOptInterface v0.9.17
  [fdba3010] + MathProgBase v0.7.8
  [739be429] + MbedTLS v1.0.2
  [c8ffd9c3] + MbedTLS_jll v2.16.8+0
  [e1d29d7a] + Missings v0.4.4
  [d8a4904e] + MutableArithmetics v0.2.10
  [d41bc354] + NLSolversBase v7.5.0
  [76087f3c] + NLopt v0.6.1
  [079eb43e] + NLopt_jll v2.6.2+0
  [2774e3e8] + NLsolve v4.4.1
  [77ba4419] + NaNMath v0.3.4
  [429524aa] + Optim v0.22.0
  [bac558e1] + OrderedCollections v1.3.1
  [90014a1f] + PDMats v0.10.1
  [d96e819e] + Parameters v0.12.1
  [69de0a69] + Parsers v1.0.11
  [f27b6e38] + Polynomials v0.5.2
  [85a6dd25] + PositiveFactorizations v0.2.3
  [27ebfcd6] + Primes v0.5.0
  [1fd47b50] + QuadGK v2.4.1
  [fcd29c91] + QuantEcon v0.16.2
  [b3c3ace0] + RangeArrays v0.3.2
  [3cdcf5f2] + RecipesBase v1.1.0
  [189a3867] + Reexport v0.2.0
  [ae029012] + Requires v1.1.0
  [79098fc4] + Rmath v0.6.1
  [f50d1b31] + Rmath_jll v0.2.2+1
  [699a6c99] + SimpleTraits v0.9.3
  [a2af1166] + SortingAlgorithms v0.3.1
  [276daf66] + SpecialFunctions v0.8.0
  [90137ffa] + StaticArrays v0.12.4
  [2913bbd2] + StatsBase v0.33.2
  [4c63d2b9] + StatsFuns v0.9.5
  [88034a9c] + StringDistances v0.8.0
  [123dc426] + SymEngine v0.8.2
  [3428059b] + SymEngine_jll v0.6.0+1
  [3bb67fe8] + TranscodingStreams v0.9.5
  [30578b45] + URIParser v0.4.1
  [3a884ed6] + UnPack v1.0.2
  [81def892] + VersionParsing v1.2.0
  [ddb6d928] + YAML v0.4.2
  [a5390f91] + ZipFile v0.9.3
  [83775a58] + Zlib_jll v1.2.11+18
  [0dad84c5] + ArgTools
  [56f22d72] + Artifacts
  [2a0f44e3] + Base64
  [ade2ca70] + Dates
  [8bb1440f] + DelimitedFiles
  [8ba89e20] + Distributed
  [f43a241f] + Downloads
  [b77e0a4c] + InteractiveUtils
  [b27032c2] + LibCURL
  [deac9b47] + LibCURL_jll
  [76f85450] + LibGit2
  [8f399da3] + Libdl
  [37e2e46d] + LinearAlgebra
  [56ddb016] + Logging
  [d6f4376e] + Markdown
  [a63ad114] + Mmap
  [14a3606d] + MozillaCACerts_jll
  [44cfe95a] + Pkg
  [de0858da] + Printf
  [3fa0cd96] + REPL
  [9a3f8284] + Random
  [ea8e919c] + SHA
  [9e88b42a] + Serialization
  [1a1011a3] + SharedArrays
  [6462fe0b] + Sockets
  [2f01184e] + SparseArrays
  [10745b16] + Statistics
  [4607b0f0] + SuiteSparse
  [fa267f1f] + TOML
  [8dfed614] + Test
  [cf7118a7] + UUIDs
  [4ec0a83e] + Unicode
    Building Conda ───────────→ `~/.julia/scratchspaces/44cfe95a-1eb2-52ea-b672-e2afdf69b78f/7a58bb32ce5d85f8bf7559aa7c2842f9aecf52fc/build.log`
    Building FFTW ────────────→ `~/.julia/scratchspaces/44cfe95a-1eb2-52ea-b672-e2afdf69b78f/6c5b420da0b8c12098048561b8d58f81adea506f/build.log`
    Building SpecialFunctions → `~/.julia/scratchspaces/44cfe95a-1eb2-52ea-b672-e2afdf69b78f/3bdd374b6fd78faf0119b8c5d538788dbf910c6e/build.log`
Precompiling project... (tip: to disable auto-precompilation set ENV["JULIA_PKG_PRECOMPILE_AUTO"]=0)
[90m[32m  ✓ [39mReexport[39m
[90m[32m  ✓ [39mUnPack[39m
[90m[32m  ✓ [39mIniFile[39m
[90m[32m  ✓ [39mRangeArrays[39m
[90m[32m  ✓ [39mNaNMath[39m
[90m[32m  ✓ [39mVersionParsing[39m
[90m[32m  ✓ [39mRecipesBase[39m
[90m[32m  ✓ [39mEllipsisNotation[39m
[90m[32m  ✓ [39mAbstractFFTs[39m
[90m[32m  ✓ [39mPositiveFactorizations[39m
[90m[32m  ✓ [39mJLLWrappers[39m
[90m[32m  ✓ [39mDataAPI[39m
[90m[32m  ✓ [39mPolynomials[39m
[90m[32m  ✓ [39mOrderedCollections[39m
[90m[32m  ✓ [39mRequires[39m
[90m[32m  ✓ [39mIterTools[39m
[90m[32m  ✓ [39mPDMats[39m
[90m[32m  ✓ [39mInflate[39m
[90m[32m  ✓ [39mPrimes[39m
[90m[32m  ✓ [39mMathProgBase[39m
[90m[32m  ✓ [39mURIParser[39m
[90m[32m  ✓ [39mDistances[39m
[90m[32m  ✓ [39mCompat[39m
[90m[32m  ✓ [39mCalculus[39m
[90m[32m  ✓ [39mMissings[39m
[90m[32m  ✓ [39mFillArrays[39m
[90m[32m  ✓ [39mParameters[39m
[90m[32m  ✓ [39mIntervalSets[39m
[90m[32m  ✓ [39mTranscodingStreams[39m
[90m[32m  ✓ [39mRmath_jll[39m
[90m[32m  ✓ [39mStringDistances[39m
[90m[32m  ✓ [39mNLopt_jll[39m
[90m[32m  ✓ [39mYAML[39m
[90m[32m  ✓ [39mMbedTLS_jll[39m
[90m[32m  ✓ [39mCombinatorics[39m
[90m[32m  ✓ [39mBzip2_jll[39m
[90m[32m  ✓ [39mZlib_jll[39m
[90m[32m  ✓ [39mBinDeps[39m
[90m[32m  ✓ [39mGMP_jll[39m
[90m[32m  ✓ [39mCodecBzip2[39m
[90m[32m  ✓ [39mRmath[39m
[90m[32m  ✓ [39mAxisArrays[39m
[90m[32m  ✓ [39mCodecZlib[39m
[90m[32m  ✓ [39mIterativeSolvers[39m
[90m[32m  ✓ [39mZipFile[39m
[90m[32m  ✓ [39mArrayInterface[39m
[90m[32m  ✓ [39mMacroTools[39m
[90m[32m  ✓ [39mMbedTLS[39m
[90m[32m  ✓ [39mMPFR_jll[39m
[90m[32m  ✓ [39mParsers[39m
[90m[32m  ✓ [39mCommonSubexpressions[39m
[90m[32m  ✓ [39mDataStructures[39m
[90m[32m  ✓ [39mJSON[39m
[90m[32m  ✓ [39mSortingAlgorithms[39m
[90m[32m  ✓ [39mSimpleTraits[39m
[90m[32m  ✓ [39mMPC_jll[39m
[90m[32m  ✓ [39mSpecialFunctions[39m
[90m[32m  ✓ [39mConda[39m
[90m[32m  ✓ [39mQuadGK[39m
[90m[32m  ✓ [39mDiffRules[39m
[90m[32m  ✓ [39mBenchmarkTools[39m
[90m[32m  ✓ [39mSymEngine_jll[39m
[90m[32m  ✓ [39mStaticArrays[39m
[90m[32m  ✓ [39mFFTW[39m
[90m[32m  ✓ [39mHTTP[39m
[90m[32m  ✓ [39mStatsFuns[39m
[90m[32m  ✓ [39mStatsBase[39m
[90m[32m  ✓ [39mJSONSchema[39m
[90m[32m  ✓ [39mDiffResults[39m
[90m[32m  ✓ [39mMutableArithmetics[39m
[90m[32m  ✓ [39mSymEngine[39m
[90m[32m  ✓ [39mArnoldiMethod[39m
[90m[32m  ✓ [39mDiffEqDiffTools[39m
[90m[32m  ✓ [39mDSP[39m
[90m[32m  ✓ [39mForwardDiff[39m
[90m[32m  ✓ [39mDolang[39m
[90m[32m  ✓ [39mDistributions[39m
[90m[32m  ✓ [39mNLSolversBase[39m
[90m[32m  ✓ [39mLightGraphs[39m
[90m[32m  ✓ [39mLineSearches[39m
[90m[32m  ✓ [39mNLsolve[39m
[90m[32m  ✓ [39mOptim[39m
[90m[32m  ✓ [39mMathOptInterface[39m
[90m[32m  ✓ [39mNLopt[39m
[90m[32m  ✓ [39mQuantEcon[39m
[90m[32m  ✓ [39mBasisMatrices[39m
86 dependencies successfully precompiled (2 already precompiled)
     Testing Dolo
Status `/tmp/jl_dF3HcZ/Project.toml`
  [39de3d68] AxisArrays v0.4.3
  [08854c51] BasisMatrices v0.6.0
  [34da2185] Compat v3.21.0
  [864edb3b] DataStructures v0.18.7
  [31c24e10] Distributions v0.23.8
  [e5c7262c] Dolang v3.1.2
  [9d24351c] Dolo v0.4.1
  [cd3eb016] HTTP v0.8.19
  [c8e1da08] IterTools v1.3.0
  [42fd0dbc] IterativeSolvers v0.8.4
  [1914dd2f] MacroTools v0.5.6
  [2774e3e8] NLsolve v4.4.1
  [429524aa] Optim v0.22.0
  [fcd29c91] QuantEcon v0.16.2
  [90137ffa] StaticArrays v0.12.4
  [88034a9c] StringDistances v0.8.0
  [ddb6d928] YAML v0.4.2
  [37e2e46d] LinearAlgebra
  [de0858da] Printf
  [3fa0cd96] REPL
  [8dfed614] Test
Status `/tmp/jl_dF3HcZ/Manifest.toml`
  [621f4979] AbstractFFTs v0.4.1
  [ec485272] ArnoldiMethod v0.0.4
  [4fba245c] ArrayInterface v2.13.6
  [39de3d68] AxisArrays v0.4.3
  [08854c51] BasisMatrices v0.6.0
  [6e4b80f9] BenchmarkTools v0.5.0
  [9e28174c] BinDeps v1.0.1
  [b99e7846] BinaryProvider v0.5.10
  [6e34b625] Bzip2_jll v1.0.6+5
  [49dc2e85] Calculus v0.5.1
  [523fee87] CodecBzip2 v0.7.2
  [944b1d66] CodecZlib v0.7.0
  [861a8166] Combinatorics v0.7.0
  [bbf7d656] CommonSubexpressions v0.3.0
  [34da2185] Compat v3.21.0
  [8f4d0f93] Conda v1.4.1
  [717857b8] DSP v0.6.0
  [9a962f9c] DataAPI v1.3.0
  [864edb3b] DataStructures v0.18.7
  [01453d9d] DiffEqDiffTools v1.7.0
  [163ba53b] DiffResults v1.0.2
  [b552c78f] DiffRules v1.0.1
  [b4f34e82] Distances v0.9.2
  [31c24e10] Distributions v0.23.8
  [e5c7262c] Dolang v3.1.2
  [9d24351c] Dolo v0.4.1
  [da5c29d0] EllipsisNotation v0.4.0
  [7a1cc6ca] FFTW v1.0.1
  [1a297f60] FillArrays v0.8.14
  [f6369f11] ForwardDiff v0.10.12
  [781609d7] GMP_jll v6.2.0+3
  [cd3eb016] HTTP v0.8.19
  [d25df0c9] Inflate v0.1.2
  [83e8ac13] IniFile v0.5.0
  [8197267c] IntervalSets v0.5.1
  [c8e1da08] IterTools v1.3.0
  [42fd0dbc] IterativeSolvers v0.8.4
  [692b3bcd] JLLWrappers v1.1.2
  [682c06a0] JSON v0.21.1
  [7d188eb4] JSONSchema v0.3.2
  [093fc24a] LightGraphs v1.3.0
  [d3d80556] LineSearches v7.1.0
  [2ce0c516] MPC_jll v1.1.0+0
  [3a97d323] MPFR_jll v4.1.0+1
  [1914dd2f] MacroTools v0.5.6
  [b8f27783] MathOptInterface v0.9.17
  [fdba3010] MathProgBase v0.7.8
  [739be429] MbedTLS v1.0.2
  [c8ffd9c3] MbedTLS_jll v2.16.8+0
  [e1d29d7a] Missings v0.4.4
  [d8a4904e] MutableArithmetics v0.2.10
  [d41bc354] NLSolversBase v7.5.0
  [76087f3c] NLopt v0.6.1
  [079eb43e] NLopt_jll v2.6.2+0
  [2774e3e8] NLsolve v4.4.1
  [77ba4419] NaNMath v0.3.4
  [429524aa] Optim v0.22.0
  [bac558e1] OrderedCollections v1.3.1
  [90014a1f] PDMats v0.10.1
  [d96e819e] Parameters v0.12.1
  [69de0a69] Parsers v1.0.11
  [f27b6e38] Polynomials v0.5.2
  [85a6dd25] PositiveFactorizations v0.2.3
  [27ebfcd6] Primes v0.5.0
  [1fd47b50] QuadGK v2.4.1
  [fcd29c91] QuantEcon v0.16.2
  [b3c3ace0] RangeArrays v0.3.2
  [3cdcf5f2] RecipesBase v1.1.0
  [189a3867] Reexport v0.2.0
  [ae029012] Requires v1.1.0
  [79098fc4] Rmath v0.6.1
  [f50d1b31] Rmath_jll v0.2.2+1
  [699a6c99] SimpleTraits v0.9.3
  [a2af1166] SortingAlgorithms v0.3.1
  [276daf66] SpecialFunctions v0.8.0
  [90137ffa] StaticArrays v0.12.4
  [2913bbd2] StatsBase v0.33.2
  [4c63d2b9] StatsFuns v0.9.5
  [88034a9c] StringDistances v0.8.0
  [123dc426] SymEngine v0.8.2
  [3428059b] SymEngine_jll v0.6.0+1
  [3bb67fe8] TranscodingStreams v0.9.5
  [30578b45] URIParser v0.4.1
  [3a884ed6] UnPack v1.0.2
  [81def892] VersionParsing v1.2.0
  [ddb6d928] YAML v0.4.2
  [a5390f91] ZipFile v0.9.3
  [83775a58] Zlib_jll v1.2.11+18
  [0dad84c5] ArgTools
  [56f22d72] Artifacts
  [2a0f44e3] Base64
  [ade2ca70] Dates
  [8bb1440f] DelimitedFiles
  [8ba89e20] Distributed
  [f43a241f] Downloads
  [b77e0a4c] InteractiveUtils
  [b27032c2] LibCURL
  [deac9b47] LibCURL_jll
  [76f85450] LibGit2
  [8f399da3] Libdl
  [37e2e46d] LinearAlgebra
  [56ddb016] Logging
  [d6f4376e] Markdown
  [a63ad114] Mmap
  [14a3606d] MozillaCACerts_jll
  [44cfe95a] Pkg
  [de0858da] Printf
  [3fa0cd96] REPL
  [9a3f8284] Random
  [ea8e919c] SHA
  [9e88b42a] Serialization
  [1a1011a3] SharedArrays
  [6462fe0b] Sockets
  [2f01184e] SparseArrays
  [10745b16] Statistics
  [4607b0f0] SuiteSparse
  [fa267f1f] TOML
  [8dfed614] Test
  [cf7118a7] UUIDs
  [4ec0a83e] Unicode
     Testing Running tests...
Test Summary:       | Pass  Total
testing model_types |   82     82
Importing LAMP.yaml
Importing neoclassical.yaml
Importing rbc.yaml
Importing rbc_catastrophe.yaml
Importing rbc_catastrophe_newstyle.yaml
[0.001]
[0.0; 0.1]
[0.97 0.03; 0.1 0.9]
Importing rbc_iid.yaml
Importing rbc_mc.yaml
Importing rmt3_ch11.yaml
Importing sudden_stop.yaml
Importing sudden_stop_ar1.yaml
Test Summary:       | Pass  Total
Testing yaml_import |   10     10
Test Summary:             | Pass  Total
Testing model calibration |   13     13
┌ Warning: `a::StaticArray + b::Number` is deprecated, use `a .+ b` instead.
│   caller = (::Dolo.var"#196#197"{2, Dolo.CartesianGrid{1}})(#unused#::Int64) at none:0
└ @ Dolo ./none:0
------------------------------------------------------------------
It    ϵₙ              ηₙ=|xₙ-xₙ₋|    λₙ=ηₙ/ηₙ₋      Time            Newton steps
------------------------------------------------------------------
0     NaN             NaN             NaN             0.00e+00        NaN  
1     NaN             7.56e-01        NaN             1.93e+09        NaN  
2     NaN             4.12e-02        5.45e-02        3.38e+07        NaN  
3     NaN             3.10e-02        7.54e-01        2.93e+05        NaN  
4     NaN             2.51e-02        8.07e-01        2.71e+05        NaN  
5     NaN             2.21e-02        8.81e-01        2.74e+05        NaN  
6     NaN             1.92e-02        8.69e-01        2.72e+05        NaN  
7     NaN             1.71e-02        8.90e-01        2.69e+05        NaN  
8     NaN             1.51e-02        8.85e-01        2.69e+05        NaN  
9     NaN             1.34e-02        8.89e-01        2.65e+05        NaN  
10    NaN             1.20e-02        8.90e-01        2.67e+05        NaN  
11    NaN             1.07e-02        8.92e-01        2.66e+05        NaN  
12    NaN             9.54e-03        8.95e-01        2.68e+05        NaN  
13    NaN             8.56e-03        8.97e-01        2.66e+05        NaN  
14    NaN             7.69e-03        8.99e-01        2.64e+05        NaN  
15    NaN             6.92e-03        9.01e-01        2.64e+05        NaN  
16    NaN             6.25e-03        9.02e-01        2.66e+05        NaN  
17    NaN             5.65e-03        9.04e-01        2.70e+05        NaN  
18    NaN             5.12e-03        9.06e-01        2.77e+05        NaN  
19    NaN             4.64e-03        9.07e-01        3.07e+05        NaN  
20    NaN             4.21e-03        9.08e-01        2.71e+05        NaN  
------------------------------------------------------------------
 15.634383 seconds (24.71 M allocations: 1.247 GiB, 5.04% gc time, 99.25% compilation time)
  8.946983 seconds (9.45 M allocations: 566.779 MiB, 10.14% gc time, 98.99% compilation time)
 12.484287 seconds (22.28 M allocations: 1.168 GiB, 6.84% gc time, 99.29% compilation time)
┌ Warning: `a::StaticArray + b::Number` is deprecated, use `a .+ b` instead.
│   caller = (::Dolo.var"#196#197"{1, Dolo.CartesianGrid{1}})(#unused#::Int64) at none:0
└ @ Dolo ./none:0
  2.704384 seconds (3.14 M allocations: 185.005 MiB, 3.49% gc time, 98.82% compilation time)
  2.482588 seconds (2.63 M allocations: 157.021 MiB, 8.56% gc time, 99.99% compilation time)
┌ Warning: `a::StaticArray + b::Number` is deprecated, use `a .+ b` instead.
│   caller = Dolo.CubicDR(exo_grid::Dolo.EmptyGrid, endo_grid::Dolo.CartesianGrid{2}, i::Type{Val{2}}) at csplines.jl:14
└ @ Dolo ~/.julia/packages/Dolo/d0Rro/src/numeric/decision_rules/csplines.jl:14
------------------------------------------------------------------
It    ϵₙ              ηₙ=|xₙ-xₙ₋|    λₙ=ηₙ/ηₙ₋      Time            Newton steps
------------------------------------------------------------------
0     NaN             NaN             NaN             0.00e+00        NaN  
1     NaN             2.08e-01        NaN             1.08e+09        NaN  
2     NaN             5.93e-02        2.85e-01        2.83e+07        NaN  
3     NaN             4.15e-02        6.99e-01        1.64e+06        NaN  
4     NaN             2.95e-02        7.11e-01        1.72e+06        NaN  
5     NaN             2.14e-02        7.26e-01        1.72e+06        NaN  
6     NaN             1.59e-02        7.41e-01        1.64e+06        NaN  
7     NaN             1.20e-02        7.57e-01        1.70e+06        NaN  
8     NaN             9.25e-03        7.71e-01        1.66e+06        NaN  
9     NaN             7.26e-03        7.85e-01        1.66e+06        NaN  
10    NaN             5.79e-03        7.97e-01        1.60e+06        NaN  
11    NaN             4.69e-03        8.09e-01        1.54e+06        NaN  
12    NaN             3.85e-03        8.21e-01        1.66e+06        NaN  
13    NaN             3.20e-03        8.31e-01        1.56e+06        NaN  
14    NaN             2.69e-03        8.40e-01        1.58e+06        NaN  
15    NaN             2.28e-03        8.49e-01        1.59e+06        NaN  
16    NaN             1.95e-03        8.57e-01        1.36e+06        NaN  
17    NaN             1.69e-03        8.64e-01        1.38e+06        NaN  
18    NaN             1.47e-03        8.70e-01        1.34e+06        NaN  
19    NaN             1.28e-03        8.75e-01        1.31e+06        NaN  
20    NaN             1.13e-03        8.80e-01        3.17e+07        NaN  
------------------------------------------------------------------
  7.112973 seconds (7.49 M allocations: 434.137 MiB, 2.79% gc time, 98.39% compilation time)
  4.252650 seconds (3.37 M allocations: 253.884 MiB, 3.34% gc time, 87.00% compilation time)
  4.820072 seconds (3.78 M allocations: 322.929 MiB, 6.29% gc time, 78.06% compilation time)
  1.232992 seconds (1.02 M allocations: 62.442 MiB, 5.39% gc time, 97.72% compilation time)
┌ Warning: `a::StaticArray + b::Number` is deprecated, use `a .+ b` instead.
│   caller = Dolo.CubicDR(exo_grid::Dolo.CartesianGrid{1}, endo_grid::Dolo.CartesianGrid{1}, i::Type{Val{2}}) at csplines.jl:53
└ @ Dolo ~/.julia/packages/Dolo/d0Rro/src/numeric/decision_rules/csplines.jl:53
┌ Warning: `a::StaticArray + b::Number` is deprecated, use `a .+ b` instead.
│   caller = Dolo.CubicDR(exo_grid::Dolo.CartesianGrid{1}, endo_grid::Dolo.CartesianGrid{1}, i::Type{Val{2}}) at csplines.jl:53
└ @ Dolo ~/.julia/packages/Dolo/d0Rro/src/numeric/decision_rules/csplines.jl:53
------------------------------------------------------------------
It    ϵₙ              ηₙ=|xₙ-xₙ₋|    λₙ=ηₙ/ηₙ₋      Time            Newton steps
------------------------------------------------------------------
0     NaN             NaN             NaN             0.00e+00        NaN  
1     NaN             8.71e-01        NaN             1.32e+09        NaN  
2     NaN             7.09e-02        8.13e-02        1.65e+06        NaN  
3     NaN             5.71e-02        8.05e-01        1.45e+06        NaN  
4     NaN             4.61e-02        8.08e-01        1.46e+06        NaN  
5     NaN             3.76e-02        8.14e-01        1.41e+06        NaN  
6     NaN             3.08e-02        8.21e-01        1.39e+06        NaN  
7     NaN             2.56e-02        8.30e-01        1.73e+06        NaN  
8     NaN             2.15e-02        8.39e-01        2.02e+06        NaN  
9     NaN             1.82e-02        8.48e-01        2.18e+06        NaN  
10    NaN             1.56e-02        8.56e-01        2.12e+06        NaN  
11    NaN             1.35e-02        8.63e-01        2.17e+06        NaN  
12    NaN             1.17e-02        8.70e-01        2.15e+06        NaN  
13    NaN             1.03e-02        8.76e-01        2.17e+06        NaN  
14    NaN             9.05e-03        8.82e-01        2.22e+06        NaN  
15    NaN             8.02e-03        8.87e-01        2.07e+06        NaN  
16    NaN             7.15e-03        8.91e-01        2.16e+06        NaN  
17    NaN             6.39e-03        8.95e-01        2.21e+06        NaN  
18    NaN             5.74e-03        8.98e-01        2.38e+06        NaN  
19    NaN             5.17e-03        9.01e-01        2.13e+06        NaN  
20    NaN             4.67e-03        9.03e-01        2.19e+06        NaN  
------------------------------------------------------------------
  6.525044 seconds (5.26 M allocations: 315.913 MiB, 4.09% gc time, 97.93% compilation time)
  6.014382 seconds (5.69 M allocations: 367.748 MiB, 14.61% gc time, 84.01% compilation time)
  5.665494 seconds (5.80 M allocations: 399.304 MiB, 6.30% gc time, 55.55% compilation time)
Test Summary:       | Pass  Total
testing model algos |    6      6
Iter     f(x) inf-norm    Step 2-norm 
------   --------------   --------------
     0     2.336746e-01              NaN
     1     1.090389e+00     7.850462e-17
     2     1.090389e+00     0.000000e+00
     3     1.090389e+00     0.000000e+00
     4     1.090389e+00     0.000000e+00
     5     9.244591e-01     1.110223e-16
     6     7.565965e-01     6.206335e-17
     7     8.702654e-01     6.798700e-17
     8     1.968438e-01     6.542663e-02
     9     8.453575e-02     8.402554e-01
    10     9.037182e-03     1.237813e+00
    11     3.018357e-04     2.353474e-01
    12     1.222641e-07     1.087953e-03
    13     2.753353e-14     1.818750e-06
 26.736828 seconds (33.93 M allocations: 1.948 GiB, 4.86% gc time, 94.22% compilation time)
Test Summary:             | Pass  Total
testing perfect_foresight |    1      1
Iter     f(x) inf-norm    Step 2-norm 
------   --------------   --------------
     0     2.336746e-01              NaN
     1     1.090389e+00     7.850462e-17
     2     1.090389e+00     0.000000e+00
     3     1.090389e+00     0.000000e+00
     4     1.090389e+00     0.000000e+00
     5     9.244591e-01     1.110223e-16
     6     7.565965e-01     6.206335e-17
     7     8.702654e-01     6.798700e-17
     8     1.968438e-01     6.542663e-02
     9     8.453575e-02     8.402554e-01
    10     9.037182e-03     1.237813e+00
    11     3.018357e-04     2.353474e-01
    12     1.222641e-07     1.087953e-03
    13     2.753353e-14     1.818750e-06
  5.073692 seconds (6.66 M allocations: 339.018 MiB, 4.18% gc time, 71.96% compilation time)
Iter     f(x) inf-norm    Step 2-norm 
------   --------------   --------------
     0     2.336746e-01              NaN
     1     1.090389e+00     7.850462e-17
     2     1.090389e+00     0.000000e+00
     3     1.090389e+00     0.000000e+00
     4     1.090389e+00     0.000000e+00
     5     9.244591e-01     1.110223e-16
     6     7.565965e-01     6.206335e-17
     7     8.702654e-01     6.798700e-17
     8     1.968438e-01     6.542663e-02
     9     8.453575e-02     8.402554e-01
    10     9.037182e-03     1.237813e+00
    11     3.018357e-04     2.353474e-01
    12     1.222641e-07     1.087953e-03
    13     2.753353e-14     1.818750e-06
  1.867110 seconds (2.75 M allocations: 106.934 MiB, 5.17% gc time, 30.40% compilation time)
df is the same
Iter     f(x) inf-norm    Step 2-norm 
------   --------------   --------------
     0     2.336746e-01              NaN
     1     1.090389e+00     7.850462e-17
     2     1.090389e+00     0.000000e+00
     3     1.090389e+00     0.000000e+00
     4     1.090389e+00     0.000000e+00
     5     9.244591e-01     1.110223e-16
     6     7.565965e-01     6.206335e-17
     7     8.702654e-01     6.798700e-17
     8     1.968438e-01     6.542663e-02
     9     8.453575e-02     8.402554e-01
    10     9.037182e-03     1.237813e+00
    11     3.018357e-04     2.353474e-01
    12     1.222641e-07     1.087953e-03
    13     2.753353e-14     1.818750e-06
  5.230827 seconds (6.87 M allocations: 349.750 MiB, 4.59% gc time, 70.99% compilation time)
Iter     f(x) inf-norm    Step 2-norm 
------   --------------   --------------
     0     2.336746e-01              NaN
     1     1.090389e+00     7.850462e-17
     2     1.090389e+00     0.000000e+00
     3     1.090389e+00     0.000000e+00
     4     1.090389e+00     0.000000e+00
     5     9.244591e-01     1.110223e-16
     6     7.565965e-01     6.206335e-17
     7     8.702654e-01     6.798700e-17
     8     1.968438e-01     6.542663e-02
     9     8.453575e-02     8.402554e-01
    10     9.037182e-03     1.237813e+00
    11     3.018357e-04     2.353474e-01
    12     1.222641e-07     1.087953e-03
    13     2.753353e-14     1.818750e-06
  1.870256 seconds (2.34 M allocations: 82.741 MiB, 3.70% gc time, 17.42% compilation time)
df is the same
Iter     f(x) inf-norm    Step 2-norm 
------   --------------   --------------
     0     2.336746e-01              NaN
     1     1.090389e+00     7.850462e-17
     2     1.090389e+00     0.000000e+00
     3     1.090389e+00     0.000000e+00
     4     1.090389e+00     0.000000e+00
     5     9.244591e-01     1.110223e-16
     6     7.565965e-01     6.206335e-17
     7     8.702654e-01     6.798700e-17
     8     1.968438e-01     6.542663e-02
     9     8.453575e-02     8.402554e-01
    10     9.037182e-03     1.237813e+00
    11     3.018357e-04     2.353474e-01
    12     1.222641e-07     1.087953e-03
    13     2.753353e-14     1.818750e-06
  2.025407 seconds (2.21 M allocations: 76.499 MiB, 7.50% gc time)
df is the same
Iter     f(x) inf-norm    Step 2-norm 
------   --------------   --------------
     0     2.336746e-01              NaN
     1     1.090389e+00     7.850462e-17
     2     1.090389e+00     0.000000e+00
     3     1.090389e+00     0.000000e+00
     4     1.090389e+00     0.000000e+00
     5     9.244591e-01     1.110223e-16
     6     7.565965e-01     6.206335e-17
     7     8.702654e-01     6.798700e-17
     8     1.968438e-01     6.542663e-02
     9     8.453575e-02     8.402554e-01
    10     9.037182e-03     1.237813e+00
    11     3.018357e-04     2.353474e-01
    12     1.222641e-07     1.087953e-03
    13     2.753353e-14     1.818750e-06
  1.425674 seconds (2.21 M allocations: 76.500 MiB, 6.35% gc time)
df is the same
Iter     f(x) inf-norm    Step 2-norm 
------   --------------   --------------
     0     2.336746e-01              NaN
     1     1.090389e+00     7.850462e-17
     2     1.090389e+00     0.000000e+00
     3     1.090389e+00     0.000000e+00
     4     1.090389e+00     0.000000e+00
     5     9.244591e-01     1.110223e-16
     6     7.565965e-01     6.206335e-17
     7     8.702654e-01     6.798700e-17
     8     1.968438e-01     6.542663e-02
     9     8.453575e-02     8.402554e-01
    10     9.037182e-03     1.237813e+00
    11     3.018357e-04     2.353474e-01
    12     1.222641e-07     1.087953e-03
    13     2.753353e-14     1.818750e-06
  3.739861 seconds (2.66 M allocations: 101.383 MiB, 5.05% gc time, 54.96% compilation time)
df is the same
Test Summary: | Pass  Total
features      |   15     15
/home/pkgeval/.julia/packages/Dolo/d0Rro/examples/models/LAMP.yaml
/home/pkgeval/.julia/packages/Dolo/d0Rro/examples/models/neoclassical.yaml
/home/pkgeval/.julia/packages/Dolo/d0Rro/examples/models/rbc.yaml
/home/pkgeval/.julia/packages/Dolo/d0Rro/examples/models/rbc_catastrophe.yaml
/home/pkgeval/.julia/packages/Dolo/d0Rro/examples/models/rbc_catastrophe_newstyle.yaml
/home/pkgeval/.julia/packages/Dolo/d0Rro/examples/models/rbc_iid.yaml
/home/pkgeval/.julia/packages/Dolo/d0Rro/examples/models/rbc_mc.yaml
/home/pkgeval/.julia/packages/Dolo/d0Rro/examples/models/rmt3_ch11.yaml
/home/pkgeval/.julia/packages/Dolo/d0Rro/examples/models/sudden_stop.yaml
/home/pkgeval/.julia/packages/Dolo/d0Rro/examples/models/sudden_stop_ar1.yaml
error at line 1, column 5 : Invalid model name '' >> Model name should be non-empty string
error at line 8, column 17 : Invalid symbol 'i*$' >> symbol should be an 'alphanumeric' string
error at line 12, column 46 : Invalid symbol '_alpha' >> symbol should not start with a number or an underscore
error at line 12, column 16 : Invalid symbol 'beta' >> beta already declared as 'parameters at line 9, column 23
error at line 18, column 4 : Invalid definition 'rk%' >> symbol should be an 'alphanumeric' string
error at line 19, column 4 : Invalid definition '_w' >> symbol should not start with a number or an underscore
error at line 20, column 4 : Invalid definition 'c' >> c already declared in definitions section at line 17, column 4
error at line 21, column 4 : Invalid definition 'n' >> n  already declared in symbols section as 'controls' at line8, column 14
error at line 30, column 4 : Invalid number of equations 'transition' >> Number of transition equations should be equal to number of states
error at line 68, column 4 : Invalid calibration 'z' >> z already declared in calibration section at line 66, column 4
warning at line 9, colummn 3 : Unknown symbol type 'strange_params' 
warning at line 8, colummn 17 : Symbol not calibrated 'i*$' >> i*$ not found in calibration section
warning at line 10, colummn 18 : Symbol not calibrated '15b' >> 15b not found in calibration section
warning at line 12, colummn 46 : Symbol not calibrated '_alpha' >> _alpha not found in calibration section
warning at line 51, colummn 4 : Calibration not in symbols 'phi' >> phi is not declared in the symbols section 
warning at line 53, colummn 4 : Calibration not in symbols 'alpha' >> alpha is not declared in the symbols section 
warning at line 58, colummn 4 : Calibration not in symbols 'alpha' >> alpha is not declared in the symbols section 
warning at line 61, colummn 4 : Calibration not in symbols 'c_i' >> c_i is not declared in the symbols section 
warning at line 62, colummn 4 : Calibration not in symbols 'c_y' >> c_y is not declared in the symbols section 
warning at line 69, colummn 4 : Calibration not in symbols 'rk' >> rk is not declared in the symbols section 
warning at line 70, colummn 4 : Calibration not in symbols 'w' >> w is not declared in the symbols section 
warning at line 77, colummn 4 : Calibration not in symbols 'm' >> m is not declared in the symbols section 
Test Summary: |
linter        | No tests
Test Summary:     | Pass  Total
minilang.jl tests |    2      2
Test Summary: | Pass  Total
DR types      |  240    240
Test Summary:                  | Pass  Total
testing discretizing functions |    1      1
     Testing Dolo tests passed 
