Current time is 2020-10-27T03:49:18.808
Julia Version 1.6.0-DEV.1331
Commit bac321d949 (2020-10-25 22:53 UTC)
Platform Info:
  OS: Linux (x86_64-pc-linux-gnu)
  CPU: AMD EPYC 7502 32-Core Processor
  WORD_SIZE: 64
  LIBM: libopenlibm
  LLVM: libLLVM-11.0.0 (ORCJIT, znver2)
Environment:
  JULIA_DEPOT_PATH = ::/usr/local/share/julia
  JULIA_NUM_THREADS = 2
  JULIA_MAX_NUM_PRECOMPILE_FILES = 9223372036854775807
  JULIA_PKG_SERVER = 

Starting installation at 2020-10-27T03:49:20.128
   Resolving package versions...
   Installed ProgressMeterLogging ─ v0.1.0
   Installed LoggingExtras ──────── v0.3.0
     Cloning [92933f4c-e287-5a05-a399-4b506db050ca] ProgressMeter from https://github.com/timholy/ProgressMeter.jl.git
[?25l    Fetching: [>                                        ]  0.0 %[2K[?25h   Installed ProgressMeter ──────── v1.4.0
Updating `~/.julia/environments/v1.6/Project.toml`
  [b0e84e9e] + ProgressMeterLogging v0.1.0
Updating `~/.julia/environments/v1.6/Manifest.toml`
  [e6f89c97] + LoggingExtras v0.3.0
  [92933f4c] + ProgressMeter v1.4.0
  [b0e84e9e] + ProgressMeterLogging v0.1.0
  [8ba89e20] + Distributed
  [56ddb016] + Logging
  [de0858da] + Printf
  [9a3f8284] + Random
  [9e88b42a] + Serialization
  [6462fe0b] + Sockets
  [4ec0a83e] + Unicode
Precompiling project... (tip: to disable auto-precompilation set ENV["JULIA_PKG_PRECOMPILE_AUTO"]=0)
[32m  ✓ [39m[90mLoggingExtras[39m
[32m  ✓ [39m[90mProgressMeter[39m
[32m  ✓ [39mProgressMeterLogging
3 dependencies successfully precompiled
Starting tests at 2020-10-27T03:51:33.783
     Testing ProgressMeterLogging
Status `/tmp/jl_dTCCIX/Project.toml`
  [e6f89c97] LoggingExtras v0.3.0
  [92933f4c] ProgressMeter v1.4.0
  [b0e84e9e] ProgressMeterLogging v0.1.0
  [56ddb016] Logging
  [8dfed614] Test
Status `/tmp/jl_dTCCIX/Manifest.toml`
  [e6f89c97] LoggingExtras v0.3.0
  [92933f4c] ProgressMeter v1.4.0
  [b0e84e9e] ProgressMeterLogging v0.1.0
  [2a0f44e3] Base64
  [8ba89e20] Distributed
  [b77e0a4c] InteractiveUtils
  [56ddb016] Logging
  [d6f4376e] Markdown
  [de0858da] Printf
  [9a3f8284] Random
  [9e88b42a] Serialization
  [6462fe0b] Sockets
  [8dfed614] Test
  [4ec0a83e] Unicode
     Testing Running tests...
outer:   0%|                                            |  ETA: N/A[K
outer:  10%|████▍                                       |  ETA: 0:00:00[Kouter:  20%|████████▊                                   |  ETA: 0:00:00[Kouter:  30%|█████████████▎                              |  ETA: 0:00:00[Kouter:  40%|█████████████████▋                          |  ETA: 0:00:00[Kouter:  50%|██████████████████████                      |  ETA: 0:00:00[Kouter:  60%|██████████████████████████▍                 |  ETA: 0:00:00[Kouter:  70%|██████████████████████████████▊             |  ETA: 0:00:00[Kouter:  80%|███████████████████████████████████▎        |  ETA: 0:00:00[Kouter:  90%|███████████████████████████████████████▋    |  ETA: 0:00:00[Kouter: 100%|████████████████████████████████████████████| Time: 0:00:00[K
outer: 100%|████████████████████████████████████████████| Time: 0:00:00[K
outer:   0%|                                            |  ETA: N/A[K
inner:   0%|                                            |  ETA: N/A[K
inner:  10%|████▍                                       |  ETA: 0:00:00[Kinner:  10%|████▍                                       |  ETA: 0:00:00[Kinner:  10%|████▍                                       |  ETA: 0:00:00[Kinner:  10%|████▍                                       |  ETA: 0:00:00[Kinner:  10%|████▍                                       |  ETA: 0:00:00[Kinner:  10%|████▍                                       |  ETA: 0:00:00[Kinner:  10%|████▍                                       |  ETA: 0:00:00[Kinner:  10%|████▍                                       |  ETA: 0:00:00[Kinner:  10%|████▍                                       |  ETA: 0:00:00[Kinner:  10%|████▍                                       |  ETA: 0:00:00[Kinner:   0%|                                            |  ETA: 0:00:21[Kinner:  22%|█████████▌                                  |  ETA: 0:00:00[Kinner:  45%|███████████████████▊                        |  ETA: 0:00:00[Kinner:  65%|████████████████████████████▊               |  ETA: 0:00:00[Kinner:  87%|██████████████████████████████████████▍     |  ETA: 0:00:00[Kinner: 100%|████████████████████████████████████████████| Time: 0:00:00[K
inner:  20%|████████▊                                   |  ETA: 0:00:00[Kinner:  20%|████████▊                                   |  ETA: 0:00:00[Kinner:  20%|████████▊                                   |  ETA: 0:00:00[Kinner:  20%|████████▊                                   |  ETA: 0:00:00[Kinner:  20%|████████▊                                   |  ETA: 0:00:00[Kinner:  20%|████████▊                                   |  ETA: 0:00:00[Kinner:  20%|████████▊                                   |  ETA: 0:00:00[Kinner:  20%|████████▊                                   |  ETA: 0:00:00[Kinner:  20%|████████▊                                   |  ETA: 0:00:00[Kinner:  20%|████████▊                                   |  ETA: 0:00:00[Kinner:   0%|                                            |  ETA: 0:00:21[Kinner:  44%|███████████████████▍                        |  ETA: 0:00:00[Kinner:  67%|█████████████████████████████▍              |  ETA: 0:00:00[Kinner:  89%|███████████████████████████████████████▎    |  ETA: 0:00:00[Kinner: 100%|████████████████████████████████████████████| Time: 0:00:00[K
outer:  20%|████████▊                                   |  ETA: 0:00:00[K
inner:   0%|                                            |  ETA: N/A[K
inner:  30%|█████████████▎                              |  ETA: 0:00:00[Kinner:  30%|█████████████▎                              |  ETA: 0:00:00[Kinner:  30%|█████████████▎                              |  ETA: 0:00:00[Kinner:  30%|█████████████▎                              |  ETA: 0:00:00[Kinner:  30%|█████████████▎                              |  ETA: 0:00:00[Kinner:  30%|█████████████▎                              |  ETA: 0:00:00[Kinner:  30%|█████████████▎                              |  ETA: 0:00:00[Kinner:  30%|█████████████▎                              |  ETA: 0:00:00[Kinner:  30%|█████████████▎                              |  ETA: 0:00:00[Kinner:  30%|█████████████▎                              |  ETA: 0:00:00[Kinner:   0%|                                            |  ETA: 0:00:21[Kinner:  40%|█████████████████▍                          |  ETA: 0:00:00[Kinner:  68%|█████████████████████████████▊              |  ETA: 0:00:00[Kinner:  94%|█████████████████████████████████████████▌  |  ETA: 0:00:00[Kinner: 100%|████████████████████████████████████████████| Time: 0:00:00[K
outer:  30%|█████████████▎                              |  ETA: 0:00:00[K
inner:   0%|                                            |  ETA: N/A[K
inner:  40%|█████████████████▋                          |  ETA: 0:00:00[Kinner:  40%|█████████████████▋                          |  ETA: 0:00:00[Kinner:  40%|█████████████████▋                          |  ETA: 0:00:00[Kinner:  40%|█████████████████▋                          |  ETA: 0:00:00[Kinner:  40%|█████████████████▋                          |  ETA: 0:00:00[Kinner:  40%|█████████████████▋                          |  ETA: 0:00:00[Kinner:  40%|█████████████████▋                          |  ETA: 0:00:00[Kinner:  40%|█████████████████▋                          |  ETA: 0:00:00[Kinner:  40%|█████████████████▋                          |  ETA: 0:00:00[Kinner:  40%|█████████████████▋                          |  ETA: 0:00:00[Kinner:   0%|                                            |  ETA: 0:00:27[Kinner:  49%|█████████████████████▋                      |  ETA: 0:00:00[Kinner:  72%|███████████████████████████████▊            |  ETA: 0:00:00[Kinner:  96%|██████████████████████████████████████████▏ |  ETA: 0:00:00[Kinner: 100%|████████████████████████████████████████████| Time: 0:00:00[K
outer:  40%|█████████████████▋                          |  ETA: 0:00:00[K
inner:   0%|                                            |  ETA: N/A[K
inner:  50%|██████████████████████                      |  ETA: 0:00:00[Kinner:  50%|██████████████████████                      |  ETA: 0:00:00[Kinner:  50%|██████████████████████                      |  ETA: 0:00:00[Kinner:  50%|██████████████████████                      |  ETA: 0:00:00[Kinner:  50%|██████████████████████                      |  ETA: 0:00:00[Kinner:  50%|██████████████████████                      |  ETA: 0:00:00[Kinner:  50%|██████████████████████                      |  ETA: 0:00:00[Kinner:  50%|██████████████████████                      |  ETA: 0:00:00[Kinner:  50%|██████████████████████                      |  ETA: 0:00:00[Kinner:  50%|██████████████████████                      |  ETA: 0:00:00[Kinner:   0%|                                            |  ETA: 0:00:21[Kinner:  23%|██████████▎                                 |  ETA: 0:00:00[Kinner:  62%|███████████████████████████▏                |  ETA: 0:00:00[Kinner:  84%|█████████████████████████████████████       |  ETA: 0:00:00[Kinner: 100%|████████████████████████████████████████████| Time: 0:00:00[K
outer:  50%|██████████████████████                      |  ETA: 0:00:00[K
inner:   0%|                                            |  ETA: N/A[K
inner:  60%|██████████████████████████▍                 |  ETA: 0:00:00[Kinner:  60%|██████████████████████████▍                 |  ETA: 0:00:00[Kinner:  60%|██████████████████████████▍                 |  ETA: 0:00:00[Kinner:  60%|██████████████████████████▍                 |  ETA: 0:00:00[Kinner:  60%|██████████████████████████▍                 |  ETA: 0:00:00[Kinner:  60%|██████████████████████████▍                 |  ETA: 0:00:00[Kinner:  60%|██████████████████████████▍                 |  ETA: 0:00:00[Kinner:  60%|██████████████████████████▍                 |  ETA: 0:00:00[Kinner:  60%|██████████████████████████▍                 |  ETA: 0:00:00[Kinner:  60%|██████████████████████████▍                 |  ETA: 0:00:00[Kinner:   0%|                                            |  ETA: 0:00:21[Kinner:  34%|███████████████                             |  ETA: 0:00:00[Kinner:  58%|█████████████████████████▎                  |  ETA: 0:00:00[Kinner:  80%|███████████████████████████████████▍        |  ETA: 0:00:00[Kinner: 100%|████████████████████████████████████████████| Time: 0:00:00[K
outer:  60%|██████████████████████████▍                 |  ETA: 0:00:00[K
inner:   0%|                                            |  ETA: N/A[K
inner:  70%|██████████████████████████████▊             |  ETA: 0:00:00[Kinner:  70%|██████████████████████████████▊             |  ETA: 0:00:00[Kinner:  70%|██████████████████████████████▊             |  ETA: 0:00:00[Kinner:  70%|██████████████████████████████▊             |  ETA: 0:00:00[Kinner:  70%|██████████████████████████████▊             |  ETA: 0:00:00[Kinner:  70%|██████████████████████████████▊             |  ETA: 0:00:00[Kinner:  70%|██████████████████████████████▊             |  ETA: 0:00:00[Kinner:  70%|██████████████████████████████▊             |  ETA: 0:00:00[Kinner:  70%|██████████████████████████████▊             |  ETA: 0:00:00[Kinner:  70%|██████████████████████████████▊             |  ETA: 0:00:00[Kinner:   0%|                                            |  ETA: 0:00:21[Kinner:  42%|██████████████████▎                         |  ETA: 0:00:00[Kinner:  64%|████████████████████████████▎               |  ETA: 0:00:00[Kinner:  86%|█████████████████████████████████████▉      |  ETA: 0:00:00[Kinner: 100%|████████████████████████████████████████████| Time: 0:00:00[K
outer:  70%|██████████████████████████████▊             |  ETA: 0:00:00[K
inner:   0%|                                            |  ETA: N/A[K
inner:  80%|███████████████████████████████████▎        |  ETA: 0:00:00[Kinner:  80%|███████████████████████████████████▎        |  ETA: 0:00:00[Kinner:  80%|███████████████████████████████████▎        |  ETA: 0:00:00[Kinner:  80%|███████████████████████████████████▎        |  ETA: 0:00:00[Kinner:  80%|███████████████████████████████████▎        |  ETA: 0:00:00[Kinner:  80%|███████████████████████████████████▎        |  ETA: 0:00:00[Kinner:  80%|███████████████████████████████████▎        |  ETA: 0:00:00[Kinner:  80%|███████████████████████████████████▎        |  ETA: 0:00:00[Kinner:  80%|███████████████████████████████████▎        |  ETA: 0:00:00[Kinner:  80%|███████████████████████████████████▎        |  ETA: 0:00:00[Kinner:   0%|                                            |  ETA: 0:00:21[Kinner:  22%|█████████▋                                  |  ETA: 0:00:00[Kinner:  43%|███████████████████▏                        |  ETA: 0:00:00[Kinner:  68%|█████████████████████████████▉              |  ETA: 0:00:00[Kinner:  91%|████████████████████████████████████████    |  ETA: 0:00:00[Kinner: 100%|████████████████████████████████████████████| Time: 0:00:00[K
outer:  80%|███████████████████████████████████▎        |  ETA: 0:00:00[K
inner:   0%|                                            |  ETA: N/A[K
inner:  90%|███████████████████████████████████████▋    |  ETA: 0:00:00[Kinner:  90%|███████████████████████████████████████▋    |  ETA: 0:00:00[Kinner:  90%|███████████████████████████████████████▋    |  ETA: 0:00:00[Kinner:  90%|███████████████████████████████████████▋    |  ETA: 0:00:00[Kinner:  90%|███████████████████████████████████████▋    |  ETA: 0:00:00[Kinner:  90%|███████████████████████████████████████▋    |  ETA: 0:00:00[Kinner:  90%|███████████████████████████████████████▋    |  ETA: 0:00:00[Kinner:  90%|███████████████████████████████████████▋    |  ETA: 0:00:00[Kinner:  90%|███████████████████████████████████████▋    |  ETA: 0:00:00[Kinner:  90%|███████████████████████████████████████▋    |  ETA: 0:00:00[Kinner:   0%|                                            |  ETA: 0:00:21[Kinner:  21%|█████████▎                                  |  ETA: 0:00:00[Kinner:  64%|████████████████████████████▍               |  ETA: 0:00:00[Kinner:  95%|██████████████████████████████████████████  |  ETA: 0:00:00[Kinner: 100%|████████████████████████████████████████████| Time: 0:00:00[K
outer:  90%|███████████████████████████████████████▋    |  ETA: 0:00:00[K
inner:   0%|                                            |  ETA: N/A[K
inner: 100%|████████████████████████████████████████████| Time: 0:00:00[K
inner: 100%|████████████████████████████████████████████| Time: 0:00:00[K
inner: 100%|████████████████████████████████████████████| Time: 0:00:00[K
inner: 100%|████████████████████████████████████████████| Time: 0:00:00[K
inner: 100%|████████████████████████████████████████████| Time: 0:00:00[K
inner: 100%|████████████████████████████████████████████| Time: 0:00:00[K
inner: 100%|████████████████████████████████████████████| Time: 0:00:00[K
inner: 100%|████████████████████████████████████████████| Time: 0:00:00[K
inner: 100%|████████████████████████████████████████████| Time: 0:00:00[K
inner: 100%|████████████████████████████████████████████| Time: 0:00:00[K
inner:   0%|                                            |  ETA: 0:00:21[Kinner:  22%|█████████▊                                  |  ETA: 0:00:00[Kinner:  43%|███████████████████                         |  ETA: 0:00:00[Kinner:  86%|██████████████████████████████████████      |  ETA: 0:00:00[Kinner: 100%|████████████████████████████████████████████| Time: 0:00:00[K
outer: 100%|████████████████████████████████████████████| Time: 0:00:00[K
outer:   0%|                                            |  ETA: 0:03:43[Kouter:  20%|█████████                                   |  ETA: 0:00:01[Kouter:  58%|█████████████████████████▍                  |  ETA: 0:00:00[Kouter:  79%|██████████████████████████████████▉         |  ETA: 0:00:00[Kouter: 100%|████████████████████████████████████████████| Time: 0:00:00[K
Test Summary:       | Pass  Total
with_progresslogger |    2      2
inner:  50%|██████████████████████                      |  ETA: 0:00:00[Kouter:  60%|██████████████████████████▍                 |  ETA: 0:00:00[Kinner: 100%|████████████████████████████████████████████| Time: 0:00:00[K
inner: 100%|████████████████████████████████████████████| Time: 0:00:00[K
inner: 100%|████████████████████████████████████████████| Time: 0:00:00[K
inner: 100%|████████████████████████████████████████████| Time: 0:00:00[K
inner: 100%|████████████████████████████████████████████| Time: 0:00:00[K
inner: 100%|████████████████████████████████████████████| Time: 0:00:00[K
inner: 100%|████████████████████████████████████████████| Time: 0:00:00[K
inner: 100%|████████████████████████████████████████████| Time: 0:00:00[K
inner: 100%|████████████████████████████████████████████| Time: 0:00:00[K
inner: 100%|████████████████████████████████████████████| Time: 0:00:00[K
outer: 100%|████████████████████████████████████████████| Time: 0:00:00[K
outer:   0%|                                            |  ETA: 0:03:31[Kouter: 100%|████████████████████████████████████████████| Time: 0:00:00[K
Test Summary:      | Pass  Total
(un)install_logger |    4      4
     Testing ProgressMeterLogging tests passed 
Finished at 2020-10-27T03:51:40.716
