Julia Version 1.6.0-DEV.408
Commit b19a3578af (2020-07-08 17:48 UTC)
Platform Info:
  OS: Linux (x86_64-linux-gnu)
  CPU: Intel(R) Xeon(R) Silver 4114 CPU @ 2.20GHz
  WORD_SIZE: 64
  LIBM: libopenlibm
  LLVM: libLLVM-9.0.1 (ORCJIT, skylake-avx512)
Environment:
  JULIA_DEPOT_PATH = ::/usr/local/share/julia
  JULIA_NUM_THREADS = 2

  Resolving package versions...
  Installed Reexport ───────────────────── v0.2.0
  Installed DataValueInterfaces ────────── v1.0.0
  Installed Crayons ────────────────────── v4.0.3
  Installed DataAPI ────────────────────── v1.3.0
  Installed StaticPolynomials ──────────── v1.3.3
  Installed RecipesBase ────────────────── v1.0.1
  Installed MultivariatePolynomials ────── v0.3.9
  Installed HomotopyContinuation ───────── v1.4.4
  Installed TreeViews ──────────────────── v0.3.0
  Installed Zlib_jll ───────────────────── v1.2.11+14
  Installed MixedSubdivisions ──────────── v1.0.0
  Installed ElasticArrays ──────────────── v1.2.3
  Installed Adapt ──────────────────────── v2.0.2
  Installed Latexify ───────────────────── v0.13.5
  Installed FixedPolynomials ───────────── v0.4.0
  Installed ProgressMeter ──────────────── v1.3.1
  Installed Polynomials ────────────────── v1.1.3
  Installed Requires ───────────────────── v1.0.1
  Installed OpenSpecFun_jll ────────────── v0.5.3+3
  Installed Formatting ─────────────────── v0.4.1
  Installed GenericSVD ─────────────────── v0.3.0
  Installed Tables ─────────────────────── v1.0.4
  Installed IteratorInterfaceExtensions ── v1.0.0
  Installed MacroTools ─────────────────── v0.5.5
  Installed DataStructures ─────────────── v0.17.19
  Installed EzXML ──────────────────────── v1.1.0
  Installed DoubleFloats ───────────────── v1.1.12
  Installed GenericSchur ───────────────── v0.4.0
  Installed Libiconv_jll ───────────────── v1.16.0+5
  Installed ExprTools ──────────────────── v0.1.1
  Installed XML2_jll ───────────────────── v2.9.10+1
  Installed OrderedCollections ─────────── v1.3.0
  Installed CompilerSupportLibraries_jll ─ v0.3.3+0
  Installed UnPack ─────────────────────── v1.0.1
  Installed DynamicPolynomials ─────────── v0.3.10
  Installed LaTeXStrings ───────────────── v1.1.0
  Installed Parameters ─────────────────── v0.12.1
  Installed Intervals ──────────────────── v1.3.4
  Installed StaticArrays ───────────────── v0.12.4
  Installed PrettyTables ───────────────── v0.9.1
  Installed Mocking ────────────────────── v0.7.1
  Installed TableTraits ────────────────── v1.0.0
  Installed ProjectiveVectors ──────────── v1.1.2
  Installed Quadmath ───────────────────── v0.5.4
  Installed SpecialFunctions ───────────── v0.10.3
  Installed MutableArithmetics ─────────── v0.2.10
  Installed TimeZones ──────────────────── v1.2.0
Updating `~/.julia/environments/v1.6/Project.toml`
  [f213a82b] + HomotopyContinuation v1.4.4
Updating `~/.julia/environments/v1.6/Manifest.toml`
  [79e6a3ab] + Adapt v2.0.2
  [e66e0078] + CompilerSupportLibraries_jll v0.3.3+0
  [a8cc5b0e] + Crayons v4.0.3
  [9a962f9c] + DataAPI v1.3.0
  [864edb3b] + DataStructures v0.17.19
  [e2d170a0] + DataValueInterfaces v1.0.0
  [497a8b3b] + DoubleFloats v1.1.12
  [7c1d4256] + DynamicPolynomials v0.3.10
  [fdbdab4c] + ElasticArrays v1.2.3
  [e2ba6199] + ExprTools v0.1.1
  [8f5d6c58] + EzXML v1.1.0
  [3dd14ad9] + FixedPolynomials v0.4.0
  [59287772] + Formatting v0.4.1
  [01680d73] + GenericSVD v0.3.0
  [c145ed77] + GenericSchur v0.4.0
  [f213a82b] + HomotopyContinuation v1.4.4
  [d8418881] + Intervals v1.3.4
  [82899510] + IteratorInterfaceExtensions v1.0.0
  [b964fa9f] + LaTeXStrings v1.1.0
  [23fbe1c1] + Latexify v0.13.5
  [94ce4f54] + Libiconv_jll v1.16.0+5
  [1914dd2f] + MacroTools v0.5.5
  [291d046c] + MixedSubdivisions v1.0.0
  [78c3b35d] + Mocking v0.7.1
  [102ac46a] + MultivariatePolynomials v0.3.9
  [d8a4904e] + MutableArithmetics v0.2.10
  [efe28fd5] + OpenSpecFun_jll v0.5.3+3
  [bac558e1] + OrderedCollections v1.3.0
  [d96e819e] + Parameters v0.12.1
  [f27b6e38] + Polynomials v1.1.3
  [08abe8d2] + PrettyTables v0.9.1
  [92933f4c] + ProgressMeter v1.3.1
  [01f381cc] + ProjectiveVectors v1.1.2
  [be4d8f0f] + Quadmath v0.5.4
  [3cdcf5f2] + RecipesBase v1.0.1
  [189a3867] + Reexport v0.2.0
  [ae029012] + Requires v1.0.1
  [276daf66] + SpecialFunctions v0.10.3
  [90137ffa] + StaticArrays v0.12.4
  [62e018b1] + StaticPolynomials v1.3.3
  [3783bdb8] + TableTraits v1.0.0
  [bd369af6] + Tables v1.0.4
  [f269a46b] + TimeZones v1.2.0
  [a2a6695c] + TreeViews v0.3.0
  [3a884ed6] + UnPack v1.0.1
  [02c8fc9c] + XML2_jll v2.9.10+1
  [83775a58] + Zlib_jll v1.2.11+14
  [2a0f44e3] + Base64
  [ade2ca70] + Dates
  [8ba89e20] + Distributed
  [9fa8497b] + Future
  [b77e0a4c] + InteractiveUtils
  [76f85450] + LibGit2
  [8f399da3] + Libdl
  [37e2e46d] + LinearAlgebra
  [56ddb016] + Logging
  [d6f4376e] + Markdown
  [44cfe95a] + Pkg
  [de0858da] + Printf
  [3fa0cd96] + REPL
  [9a3f8284] + Random
  [ea8e919c] + SHA
  [9e88b42a] + Serialization
  [6462fe0b] + Sockets
  [2f01184e] + SparseArrays
  [10745b16] + Statistics
  [8dfed614] + Test
  [cf7118a7] + UUIDs
  [4ec0a83e] + Unicode
   Building TimeZones → `~/.julia/packages/TimeZones/OjMoF/deps/build.log`
    Testing HomotopyContinuation
Status `/tmp/jl_86SCId/Project.toml`
  [e30172f5] Documenter v0.24.11
  [497a8b3b] DoubleFloats v1.1.12
  [7c1d4256] DynamicPolynomials v0.3.10
  [fdbdab4c] ElasticArrays v1.2.3
  [26cc04aa] FiniteDifferences v0.10.4
  [3dd14ad9] FixedPolynomials v0.4.0
  [f213a82b] HomotopyContinuation v1.4.4
  [23fbe1c1] Latexify v0.13.5
  [291d046c] MixedSubdivisions v1.0.0
  [102ac46a] MultivariatePolynomials v0.3.9
  [bac558e1] OrderedCollections v1.3.0
  [d96e819e] Parameters v0.12.1
  [4c526841] PolynomialTestSystems v0.1.4
  [08abe8d2] PrettyTables v0.9.1
  [01f381cc] ProjectiveVectors v1.1.2
  [90137ffa] StaticArrays v0.12.4
  [62e018b1] StaticPolynomials v1.3.3
  [a2a6695c] TreeViews v0.3.0
  [37e2e46d] LinearAlgebra
  [de0858da] Printf
  [9a3f8284] Random
  [8dfed614] Test
Status `/tmp/jl_86SCId/Manifest.toml`
  [79e6a3ab] Adapt v2.0.2
  [e66e0078] CompilerSupportLibraries_jll v0.3.3+0
  [a8cc5b0e] Crayons v4.0.3
  [9a962f9c] DataAPI v1.3.0
  [864edb3b] DataStructures v0.17.19
  [e2d170a0] DataValueInterfaces v1.0.0
  [ffbed154] DocStringExtensions v0.8.2
  [e30172f5] Documenter v0.24.11
  [497a8b3b] DoubleFloats v1.1.12
  [7c1d4256] DynamicPolynomials v0.3.10
  [fdbdab4c] ElasticArrays v1.2.3
  [e2ba6199] ExprTools v0.1.1
  [8f5d6c58] EzXML v1.1.0
  [26cc04aa] FiniteDifferences v0.10.4
  [3dd14ad9] FixedPolynomials v0.4.0
  [59287772] Formatting v0.4.1
  [01680d73] GenericSVD v0.3.0
  [c145ed77] GenericSchur v0.4.0
  [f213a82b] HomotopyContinuation v1.4.4
  [d8418881] Intervals v1.3.4
  [82899510] IteratorInterfaceExtensions v1.0.0
  [682c06a0] JSON v0.21.0
  [b964fa9f] LaTeXStrings v1.1.0
  [23fbe1c1] Latexify v0.13.5
  [94ce4f54] Libiconv_jll v1.16.0+5
  [1914dd2f] MacroTools v0.5.5
  [291d046c] MixedSubdivisions v1.0.0
  [78c3b35d] Mocking v0.7.1
  [102ac46a] MultivariatePolynomials v0.3.9
  [d8a4904e] MutableArithmetics v0.2.10
  [efe28fd5] OpenSpecFun_jll v0.5.3+3
  [bac558e1] OrderedCollections v1.3.0
  [d96e819e] Parameters v0.12.1
  [69de0a69] Parsers v1.0.7
  [4c526841] PolynomialTestSystems v0.1.4
  [f27b6e38] Polynomials v1.1.3
  [08abe8d2] PrettyTables v0.9.1
  [92933f4c] ProgressMeter v1.3.1
  [01f381cc] ProjectiveVectors v1.1.2
  [be4d8f0f] Quadmath v0.5.4
  [3cdcf5f2] RecipesBase v1.0.1
  [189a3867] Reexport v0.2.0
  [ae029012] Requires v1.0.1
  [276daf66] SpecialFunctions v0.10.3
  [90137ffa] StaticArrays v0.12.4
  [62e018b1] StaticPolynomials v1.3.3
  [3783bdb8] TableTraits v1.0.0
  [bd369af6] Tables v1.0.4
  [f269a46b] TimeZones v1.2.0
  [a2a6695c] TreeViews v0.3.0
  [3a884ed6] UnPack v1.0.1
  [02c8fc9c] XML2_jll v2.9.10+1
  [83775a58] Zlib_jll v1.2.11+14
  [2a0f44e3] Base64
  [ade2ca70] Dates
  [8ba89e20] Distributed
  [9fa8497b] Future
  [b77e0a4c] InteractiveUtils
  [76f85450] LibGit2
  [8f399da3] Libdl
  [37e2e46d] LinearAlgebra
  [56ddb016] Logging
  [d6f4376e] Markdown
  [a63ad114] Mmap
  [44cfe95a] Pkg
  [de0858da] Printf
  [3fa0cd96] REPL
  [9a3f8284] Random
  [ea8e919c] SHA
  [9e88b42a] Serialization
  [6462fe0b] Sockets
  [2f01184e] SparseArrays
  [10745b16] Statistics
  [8dfed614] Test
  [cf7118a7] UUIDs
  [4ec0a83e] Unicode
UniquePoints: Test Failed at /home/pkgeval/.julia/packages/HomotopyContinuation/mJDHb/test/utilities_test.jl:69
  Expression: string(data) == "UniquePoints{Array{Complex{Float64},1},Float64,typeof(euclidean_distance),Nothing} with 2000 points"
   Evaluated: "UniquePoints{Vector{ComplexF64},Float64,typeof(euclidean_distance),Nothing} with 2000 points" == "UniquePoints{Array{Complex{Float64},1},Float64,typeof(euclidean_distance),Nothing} with 2000 points"
Stacktrace:
 [1] top-level scope
   @ ~/.julia/packages/HomotopyContinuation/mJDHb/test/utilities_test.jl:69
 [2] top-level scope
   @ /workspace/srcdir/usr/share/julia/stdlib/v1.6/Test/src/Test.jl:1115
 [3] top-level scope
   @ ~/.julia/packages/HomotopyContinuation/mJDHb/test/utilities_test.jl:63
 [4] top-level scope
   @ /workspace/srcdir/usr/share/julia/stdlib/v1.6/Test/src/Test.jl:1115
 [5] top-level scope
   @ ~/.julia/packages/HomotopyContinuation/mJDHb/test/utilities_test.jl:3
┌ Warning: `setup!(tracker::CoreTracker, x, t, t₀; kwargs...)` is deprecated, use `init!(tracker, x, t, t₀; kwargs...)` instead.
│   caller = top-level scope at core_tracker_test.jl:40
└ @ Core ~/.julia/packages/HomotopyContinuation/mJDHb/test/core_tracker_test.jl:40
┌ Warning: Solutions are now automatically refined to maximal achievable accuracy.
└ @ HomotopyContinuation ~/.julia/packages/HomotopyContinuation/mJDHb/src/core_tracker.jl:1410
┌ Warning: `set_refinement_accuracy!` is deprecated. Solutions are now automatically refined to maximal achievable accuracy.
└ @ HomotopyContinuation ~/.julia/packages/HomotopyContinuation/mJDHb/src/core_tracker.jl:1420
┌ Warning: `max_refinement_iters` is deprecated. Solutions are now automatically refined to the maximal achievable accuracy.
└ @ HomotopyContinuation ~/.julia/packages/HomotopyContinuation/mJDHb/src/core_tracker.jl:1429
┌ Warning: `set_max_refinement_iters` is deprecated. Solutions are now automatically refined to the maximal achievable accuracy.
└ @ HomotopyContinuation ~/.julia/packages/HomotopyContinuation/mJDHb/src/core_tracker.jl:1439
Univariate singular: 2,3,4,5,6,7,8,9,10,11,12,
Wilkinson: 1,2,3,4,5,6,7,8,9,10,11,12,13,14,15,16,17,18,
Computing mixed cells... 1 	 Time: 0:00:00[K
  mixed_volume:  5[K[AComputing mixed cells... 14 	 Time: 0:00:00[K
  mixed_volume:  70
Computing mixed cells... 1 	 Time: 0:00:00[K
  mixed_volume:  4[K[AComputing mixed cells... 26 	 Time: 0:00:00[K
  mixed_volume:  176[K[AComputing mixed cells... 324 	 Time: 0:00:00[K
  mixed_volume:  2854[K[AComputing mixed cells... 684 	 Time: 0:00:01[K
  mixed_volume:  5275[K[AComputing mixed cells... 964 	 Time: 0:00:01[K
  mixed_volume:  7125[K[AComputing mixed cells... 1536 	 Time: 0:00:01[K
  mixed_volume:  10994[K[AComputing mixed cells... 1822 	 Time: 0:00:01[K
  mixed_volume:  12192[K[AComputing mixed cells... 1881 	 Time: 0:00:02[K
  mixed_volume:  12636
Tracking 120 paths...  27%|██████████▋                             |  ETA: 0:00:01[K
  # paths tracked:                  32
  # non-singular solutions (real):  19 (4)
  # singular solutions (real):      0 (0)
  # total solutions (real):         19 (4)[A[A[A[A



[K[A[K[A[K[A[K[ATracking 120 paths... 100%|████████████████████████████████████████| Time: 0:00:00[K
  # paths tracked:                  120
  # non-singular solutions (real):  70 (10)
  # singular solutions (real):      0 (0)
  # total solutions (real):         70 (10)
Tracking 120 paths...  55%|██████████████████████                  |  ETA: 0:00:03[K
  # paths tracked:                  66
  # non-singular solutions (real):  40 (8)
  # singular solutions (real):      0 (0)
  # total solutions (real):         40 (8)[A[A[A[A



[K[A[K[A[K[A[K[ATracking 120 paths... 100%|████████████████████████████████████████| Time: 0:00:03[K
  # paths tracked:                  120
  # non-singular solutions (real):  70 (10)
  # singular solutions (real):      0 (0)
  # total solutions (real):         70 (10)
Tracking 216 paths...  30%|████████████                            |  ETA: 0:00:02[K
  # paths tracked:                  65
  # non-singular solutions (real):  24 (5)
  # singular solutions (real):      0 (0)
  # total solutions (real):         24 (5)[A[A[A[A



[K[A[K[A[K[A[K[ATracking 216 paths...  61%|████████████████████████▎               |  ETA: 0:00:01[K
  # paths tracked:                  131
  # non-singular solutions (real):  50 (7)
  # singular solutions (real):      0 (0)
  # total solutions (real):         50 (7)[A[A[A[A



[K[A[K[A[K[A[K[ATracking 216 paths...  91%|████████████████████████████████████▎   |  ETA: 0:00:00[K
  # paths tracked:                  196
  # non-singular solutions (real):  75 (8)
  # singular solutions (real):      0 (0)
  # total solutions (real):         75 (8)[A[A[A[A



[K[A[K[A[K[A[K[ATracking 216 paths... 100%|████████████████████████████████████████| Time: 0:00:01[K
  # paths tracked:                  216
  # non-singular solutions (real):  80 (8)
  # singular solutions (real):      0 (0)
  # total solutions (real):         80 (8)
Tracking 125 paths...   2%|▋                                       |  ETA: 0:00:29[K
  # paths tracked:                  2
  # non-singular solutions (real):  2 (2)
  # singular solutions (real):      0 (0)
  # total solutions (real):         2 (2)[A[A[A[ASolutions found: 36 	 Time: 0:00:00[K
  # paths tracked:                   864
  # loops generated:                 12
  # completed loops without change:  4
  # solutions in current loop:       0
  # real solutions:                  0[K[A[K[A[K[A[K[A[K[ASolutions found: 36 	 Time: 0:00:00[K
┌ Warning: None of the provided solutions is a valid start solution.
└ @ HomotopyContinuation ~/.julia/packages/HomotopyContinuation/mJDHb/src/monodromy.jl:878
[ Info: Compute additional witnesses for completeness...
[ Info: Found 2 additional witnesses
[ Info: Compute trace...
[ Info: Norm of trace: 4.47545209131181e-16
[ Info: Compute additional witnesses for completeness...
[ Info: Found 36 additional witnesses
[ Info: Compute trace...
[ Info: Norm of trace: 5.567314815027641e-9
Solutions found: 2 	 Time: 0:00:00[K
  # paths tracked:                   2
  # loops generated:                 1
  # completed loops without change:  0
  # solutions in current loop:       1
  # real solutions:                  0[K[A[K[A[K[A[K[A[K[ASolutions found: 25 	 Time: 0:00:00[K
  # paths tracked:                   48
  # loops generated:                 1
  # completed loops without change:  0
  # solutions in current loop:       24
  # real solutions:                  0[K[A[K[A[K[A[K[A[K[ASolutions found: 42 	 Time: 0:00:00[K
  # paths tracked:                   82
  # loops generated:                 1
  # completed loops without change:  0
  # solutions in current loop:       41
  # real solutions:                  0[K[A[K[A[K[A[K[A[K[ASolutions found: 50 	 Time: 0:00:01[K
Solutions found: 1 	 Time: 0:00:00[K
  # paths tracked:                   2
  # loops generated:                 1
  # completed loops without change:  0
  # solutions in current loop:       0
  # real solutions:                  0[K[A[K[A[K[A[K[A[K[ASolutions found: 2 	 Time: 0:00:00[K
Solutions found: 2 	 Time: 0:00:00[K
  # paths tracked:                   2
  # loops generated:                 1
  # completed loops without change:  0
  # solutions in current loop:       1
  # real solutions:                  2[K[A[K[A[K[A[K[A[K[ASolutions found: 2 	 Time: 0:00:00[K
Solutions found: 17 	 Time: 0:00:00[K
  # paths tracked:                   32
  # loops generated:                 1
  # completed loops without change:  0
  # solutions in current loop:       16
  # real solutions:                  0[K[A[K[A[K[A[K[A[K[ASolutions found: 28 	 Time: 0:00:00[K
  # paths tracked:                   54
  # loops generated:                 1
  # completed loops without change:  0
  # solutions in current loop:       27
  # real solutions:                  0[K[A[K[A[K[A[K[A[K[ASolutions found: 42 	 Time: 0:00:00[K
  # paths tracked:                   82
  # loops generated:                 1
  # completed loops without change:  0
  # solutions in current loop:       41
  # real solutions:                  0[K[A[K[A[K[A[K[A[K[ASolutions found: 62 	 Time: 0:00:00[K
  # paths tracked:                   122
  # loops generated:                 1
  # completed loops without change:  0
  # solutions in current loop:       61
  # real solutions:                  0[K[A[K[A[K[A[K[A[K[ASolutions found: 67 	 Time: 0:00:01[K
  # paths tracked:                   132
  # loops generated:                 1
  # completed loops without change:  0
  # solutions in current loop:       66
  # real solutions:                  0[K[A[K[A[K[A[K[A[K[ASolutions found: 90 	 Time: 0:00:01[K
  # paths tracked:                   178
  # loops generated:                 1
  # completed loops without change:  0
  # solutions in current loop:       89
  # real solutions:                  0[K[A[K[A[K[A[K[A[K[ASolutions found: 96 	 Time: 0:00:01[K
  # paths tracked:                   190
  # loops generated:                 1
  # completed loops without change:  0
  # solutions in current loop:       95
  # real solutions:                  0[K[A[K[A[K[A[K[A[K[ASolutions found: 105 	 Time: 0:00:01[K
  # paths tracked:                   208
  # loops generated:                 1
  # completed loops without change:  0
  # solutions in current loop:       104
  # real solutions:                  0[K[A[K[A[K[A[K[A[K[ASolutions found: 112 	 Time: 0:00:01[K
  # paths tracked:                   222
  # loops generated:                 1
  # completed loops without change:  0
  # solutions in current loop:       111
  # real solutions:                  0[K[A[K[A[K[A[K[A[K[ASolutions found: 132 	 Time: 0:00:01[K
  # paths tracked:                   262
  # loops generated:                 1
  # completed loops without change:  0
  # solutions in current loop:       131
  # real solutions:                  0[K[A[K[A[K[A[K[A[K[ASolutions found: 145 	 Time: 0:00:01[K
  # paths tracked:                   296
  # loops generated:                 2
  # completed loops without change:  0
  # solutions in current loop:       10
  # real solutions:                  0[K[A[K[A[K[A[K[A[K[ASolutions found: 163 	 Time: 0:00:01[K
  # paths tracked:                   340
  # loops generated:                 2
  # completed loops without change:  0
  # solutions in current loop:       28
  # real solutions:                  0[K[A[K[A[K[A[K[A[K[ASolutions found: 183 	 Time: 0:00:01[K
  # paths tracked:                   395
  # loops generated:                 2
  # completed loops without change:  0
  # solutions in current loop:       48
  # real solutions:                  0[K[A[K[A[K[A[K[A[K[ASolutions found: 205 	 Time: 0:00:02[K
  # paths tracked:                   444
  # loops generated:                 2
  # completed loops without change:  0
  # solutions in current loop:       70
  # real solutions:                  0[K[A[K[A[K[A[K[A[K[ASolutions found: 227 	 Time: 0:00:02[K
  # paths tracked:                   496
  # loops generated:                 2
  # completed loops without change:  0
  # solutions in current loop:       92
  # real solutions:                  0[K[A[K[A[K[A[K[A[K[ASolutions found: 244 	 Time: 0:00:02[K
  # paths tracked:                   535
  # loops generated:                 2
  # completed loops without change:  0
  # solutions in current loop:       109
  # real solutions:                  0[K[A[K[A[K[A[K[A[K[ASolutions found: 274 	 Time: 0:00:02[K
  # paths tracked:                   603
  # loops generated:                 2
  # completed loops without change:  0
  # solutions in current loop:       139
  # real solutions:                  0[K[A[K[A[K[A[K[A[K[ASolutions found: 300 	 Time: 0:00:02[K
  # paths tracked:                   667
  # loops generated:                 2
  # completed loops without change:  0
  # solutions in current loop:       165
  # real solutions:                  0[K[A[K[A[K[A[K[A[K[ASolutions found: 320 	 Time: 0:00:02[K
  # paths tracked:                   728
  # loops generated:                 2
  # completed loops without change:  0
  # solutions in current loop:       185
  # real solutions:                  0[K[A[K[A[K[A[K[A[K[ASolutions found: 341 	 Time: 0:00:02[K
  # paths tracked:                   793
  # loops generated:                 2
  # completed loops without change:  0
  # solutions in current loop:       206
  # real solutions:                  0[K[A[K[A[K[A[K[A[K[ASolutions found: 363 	 Time: 0:00:02[K
  # paths tracked:                   844
  # loops generated:                 2
  # completed loops without change:  0
  # solutions in current loop:       228
  # real solutions:                  0[K[A[K[A[K[A[K[A[K[ASolutions found: 381 	 Time: 0:00:02[K
  # paths tracked:                   903
  # loops generated:                 2
  # completed loops without change:  0
  # solutions in current loop:       246
  # real solutions:                  0[K[A[K[A[K[A[K[A[K[ASolutions found: 401 	 Time: 0:00:03[K
  # paths tracked:                   951
  # loops generated:                 2
  # completed loops without change:  0
  # solutions in current loop:       266
  # real solutions:                  0[K[A[K[A[K[A[K[A[K[ASolutions found: 416 	 Time: 0:00:03[K
  # paths tracked:                   992
  # loops generated:                 2
  # completed loops without change:  0
  # solutions in current loop:       281
  # real solutions:                  0[K[A[K[A[K[A[K[A[K[ASolutions found: 427 	 Time: 0:00:03[K
  # paths tracked:                   1036
  # loops generated:                 2
  # completed loops without change:  0
  # solutions in current loop:       292
  # real solutions:                  0[K[A[K[A[K[A[K[A[K[ASolutions found: 443 	 Time: 0:00:03[K
  # paths tracked:                   1099
  # loops generated:                 2
  # completed loops without change:  0
  # solutions in current loop:       308
  # real solutions:                  0[K[A[K[A[K[A[K[A[K[ASolutions found: 460 	 Time: 0:00:03[K
  # paths tracked:                   1147
  # loops generated:                 2
  # completed loops without change:  0
  # solutions in current loop:       325
  # real solutions:                  0[K[A[K[A[K[A[K[A[K[ASolutions found: 478 	 Time: 0:00:03[K
  # paths tracked:                   1203
  # loops generated:                 2
  # completed loops without change:  0
  # solutions in current loop:       343
  # real solutions:                  0[K[A[K[A[K[A[K[A[K[ASolutions found: 491 	 Time: 0:00:03[K
  # paths tracked:                   1254
  # loops generated:                 2
  # completed loops without change:  0
  # solutions in current loop:       356
  # real solutions:                  0[K[A[K[A[K[A[K[A[K[ASolutions found: 507 	 Time: 0:00:03[K
  # paths tracked:                   1309
  # loops generated:                 2
  # completed loops without change:  0
  # solutions in current loop:       372
  # real solutions:                  0[K[A[K[A[K[A[K[A[K[ASolutions found: 517 	 Time: 0:00:03[K
  # paths tracked:                   1349
  # loops generated:                 2
  # completed loops without change:  0
  # solutions in current loop:       382
  # real solutions:                  0[K[A[K[A[K[A[K[A[K[ASolutions found: 525 	 Time: 0:00:04[K
  # paths tracked:                   1384
  # loops generated:                 2
  # completed loops without change:  0
  # solutions in current loop:       390
  # real solutions:                  0[K[A[K[A[K[A[K[A[K[ASolutions found: 541 	 Time: 0:00:04[K
  # paths tracked:                   1456
  # loops generated:                 2
  # completed loops without change:  0
  # solutions in current loop:       406
  # real solutions:                  0[K[A[K[A[K[A[K[A[K[ASolutions found: 556 	 Time: 0:00:04[K
  # paths tracked:                   1521
  # loops generated:                 2
  # completed loops without change:  0
  # solutions in current loop:       421
  # real solutions:                  0[K[A[K[A[K[A[K[A[K[ASolutions found: 564 	 Time: 0:00:04[K
  # paths tracked:                   1553
  # loops generated:                 2
  # completed loops without change:  0
  # solutions in current loop:       429
  # real solutions:                  0[K[A[K[A[K[A[K[A[K[ASolutions found: 570 	 Time: 0:00:04[K
  # paths tracked:                   1579
  # loops generated:                 2
  # completed loops without change:  0
  # solutions in current loop:       435
  # real solutions:                  0[K[A[K[A[K[A[K[A[K[ASolutions found: 577 	 Time: 0:00:04[K
  # paths tracked:                   1609
  # loops generated:                 2
  # completed loops without change:  0
  # solutions in current loop:       442
  # real solutions:                  0[K[A[K[A[K[A[K[A[K[ASolutions found: 581 	 Time: 0:00:04[K
  # paths tracked:                   1639
  # loops generated:                 2
  # completed loops without change:  0
  # solutions in current loop:       446
  # real solutions:                  0[K[A[K[A[K[A[K[A[K[ASolutions found: 592 	 Time: 0:00:04[K
  # paths tracked:                   1684
  # loops generated:                 2
  # completed loops without change:  0
  # solutions in current loop:       457
  # real solutions:                  0[K[A[K[A[K[A[K[A[K[ASolutions found: 601 	 Time: 0:00:04[K
  # paths tracked:                   1724
  # loops generated:                 2
  # completed loops without change:  0
  # solutions in current loop:       466
  # real solutions:                  0[K[A[K[A[K[A[K[A[K[ASolutions found: 612 	 Time: 0:00:05[K
  # paths tracked:                   1764
  # loops generated:                 2
  # completed loops without change:  0
  # solutions in current loop:       477
  # real solutions:                  0[K[A[K[A[K[A[K[A[K[ASolutions found: 624 	 Time: 0:00:05[K
  # paths tracked:                   1829
  # loops generated:                 2
  # completed loops without change:  0
  # solutions in current loop:       489
  # real solutions:                  0[K[A[K[A[K[A[K[A[K[ASolutions found: 632 	 Time: 0:00:05[K
  # paths tracked:                   1877
  # loops generated:                 2
  # completed loops without change:  0
  # solutions in current loop:       497
  # real solutions:                  0[K[A[K[A[K[A[K[A[K[ASolutions found: 644 	 Time: 0:00:05[K
  # paths tracked:                   1946
  # loops generated:                 2
  # completed loops without change:  0
  # solutions in current loop:       509
  # real solutions:                  0[K[A[K[A[K[A[K[A[K[ASolutions found: 652 	 Time: 0:00:05[K
  # paths tracked:                   2007
  # loops generated:                 2
  # completed loops without change:  0
  # solutions in current loop:       517
  # real solutions:                  0[K[A[K[A[K[A[K[A[K[ASolutions found: 659 	 Time: 0:00:05[K
  # paths tracked:                   2067
  # loops generated:                 2
  # completed loops without change:  0
  # solutions in current loop:       524
  # real solutions:                  0[K[A[K[A[K[A[K[A[K[ASolutions found: 673 	 Time: 0:00:05[K
  # paths tracked:                   2133
  # loops generated:                 2
  # completed loops without change:  0
  # solutions in current loop:       538
  # real solutions:                  0[K[A[K[A[K[A[K[A[K[ASolutions found: 680 	 Time: 0:00:05[K
  # paths tracked:                   2179
  # loops generated:                 2
  # completed loops without change:  0
  # solutions in current loop:       545
  # real solutions:                  0[K[A[K[A[K[A[K[A[K[ASolutions found: 685 	 Time: 0:00:05[K
  # paths tracked:                   2225
  # loops generated:                 2
  # completed loops without change:  0
  # solutions in current loop:       550
  # real solutions:                  0[K[A[K[A[K[A[K[A[K[ASolutions found: 691 	 Time: 0:00:06[K
  # paths tracked:                   2273
  # loops generated:                 2
  # completed loops without change:  0
  # solutions in current loop:       556
  # real solutions:                  0[K[A[K[A[K[A[K[A[K[ASolutions found: 695 	 Time: 0:00:06[K
  # paths tracked:                   2315
  # loops generated:                 2
  # completed loops without change:  0
  # solutions in current loop:       560
  # real solutions:                  0[K[A[K[A[K[A[K[A[K[ASolutions found: 699 	 Time: 0:00:06[K
  # paths tracked:                   2365
  # loops generated:                 2
  # completed loops without change:  0
  # solutions in current loop:       564
  # real solutions:                  0[K[A[K[A[K[A[K[A[K[ASolutions found: 703 	 Time: 0:00:06[K
  # paths tracked:                   2427
  # loops generated:                 2
  # completed loops without change:  0
  # solutions in current loop:       568
  # real solutions:                  0[K[A[K[A[K[A[K[A[K[ASolutions found: 707 	 Time: 0:00:06[K
  # paths tracked:                   2485
  # loops generated:                 2
  # completed loops without change:  0
  # solutions in current loop:       572
  # real solutions:                  0[K[A[K[A[K[A[K[A[K[ASolutions found: 709 	 Time: 0:00:06[K
  # paths tracked:                   2541
  # loops generated:                 2
  # completed loops without change:  0
  # solutions in current loop:       574
  # real solutions:                  0[K[A[K[A[K[A[K[A[K[ASolutions found: 711 	 Time: 0:00:06[K
  # paths tracked:                   2585
  # loops generated:                 2
  # completed loops without change:  0
  # solutions in current loop:       576
  # real solutions:                  0[K[A[K[A[K[A[K[A[K[ASolutions found: 713 	 Time: 0:00:06[K
  # paths tracked:                   2640
  # loops generated:                 2
  # completed loops without change:  0
  # solutions in current loop:       578
  # real solutions:                  0[K[A[K[A[K[A[K[A[K[ASolutions found: 716 	 Time: 0:00:06[K
  # paths tracked:                   2717
  # loops generated:                 2
  # completed loops without change:  0
  # solutions in current loop:       581
  # real solutions:                  0[K[A[K[A[K[A[K[A[K[ASolutions found: 718 	 Time: 0:00:06[K
  # paths tracked:                   2764
  # loops generated:                 2
  # completed loops without change:  0
  # solutions in current loop:       583
  # real solutions:                  0[K[A[K[A[K[A[K[A[K[ASolutions found: 720 	 Time: 0:00:07[K
[ Info: SetupBuildDirectory: setting up build directory.
[ Info: Doctest: running doctests.
┌ Error: doctest failure in ~/.julia/packages/HomotopyContinuation/mJDHb/src/model_kit/expression.jl:634-643
│ 
│ ```jldoctest
│ julia> @var x y;
│ 
│ julia> F = System([x^2, y^2], [y, x]);
│ 
│ julia> F([2, 3])
│ 2-element Array{Int64,1}:
│  9
│  4
│ ```
│ 
│ Subexpression:
│ 
│ F([2, 3])
│ 
│ Evaluated output:
│ 
│ 2-element Vector{Int64}:
│  9
│  4
│ 
│ Expected output:
│ 
│ 2-element Array{Int64,1}:
│  9
│  4
│ 
│   diff =
│    Warning: Diff output requires color.
│    2-element Array{Int64,1}:
│     Vector{Int64}:
│     9
│     4
└ @ Documenter.DocTests ~/.julia/packages/Documenter/PLD7m/src/DocTests.jl:369
┌ Error: doctest failure in ~/.julia/packages/HomotopyContinuation/mJDHb/src/model_kit/expression.jl:646-655
│ 
│ ```jldoctest
│ julia> @var x y t a b;
│ 
│ julia> F = System([x^2 + a, y^2 + b^2], [x, y], [a, b]);
│ 
│ julia> F([2, 3], [5, 2])
│ 2-element Array{Int64,1}:
│   9
│  13
│ ```
│ 
│ Subexpression:
│ 
│ F([2, 3], [5, 2])
│ 
│ Evaluated output:
│ 
│ 2-element Vector{Int64}:
│   9
│  13
│ 
│ Expected output:
│ 
│ 2-element Array{Int64,1}:
│   9
│  13
│ 
│   diff =
│    Warning: Diff output requires color.
│    2-element Array{Int64,1}:
│      Vector{Int64}:
│      9
│     13
└ @ Documenter.DocTests ~/.julia/packages/Documenter/PLD7m/src/DocTests.jl:369
┌ Error: doctest failure in ~/.julia/packages/HomotopyContinuation/mJDHb/src/model_kit/expression.jl:742-756
│ 
│ ```jldoctest
│ julia> @var x y t;
│ 
│ julia> H = Homotopy([x + t, y + 2t], [y, x], t);
│ 
│ julia> H([2, 3], 0)
│ 2-element Array{Int64,1}:
│  3
│  2
│ 
│ julia> H([2, 3], 1)
│ 2-element Array{Int64,1}:
│  4
│  4
│ ```
│ 
│ Subexpression:
│ 
│ H([2, 3], 0)
│ 
│ Evaluated output:
│ 
│ 2-element Vector{Int64}:
│  3
│  2
│ 
│ Expected output:
│ 
│ 2-element Array{Int64,1}:
│  3
│  2
│ 
│   diff =
│    Warning: Diff output requires color.
│    2-element Array{Int64,1}:
│     Vector{Int64}:
│     3
│     2
└ @ Documenter.DocTests ~/.julia/packages/Documenter/PLD7m/src/DocTests.jl:369
┌ Error: doctest failure in ~/.julia/packages/HomotopyContinuation/mJDHb/src/model_kit/expression.jl:742-756
│ 
│ ```jldoctest
│ julia> @var x y t;
│ 
│ julia> H = Homotopy([x + t, y + 2t], [y, x], t);
│ 
│ julia> H([2, 3], 0)
│ 2-element Array{Int64,1}:
│  3
│  2
│ 
│ julia> H([2, 3], 1)
│ 2-element Array{Int64,1}:
│  4
│  4
│ ```
│ 
│ Subexpression:
│ 
│ H([2, 3], 1)
│ 
│ Evaluated output:
│ 
│ 2-element Vector{Int64}:
│  4
│  4
│ 
│ Expected output:
│ 
│ 2-element Array{Int64,1}:
│  4
│  4
│ 
│   diff =
│    Warning: Diff output requires color.
│    2-element Array{Int64,1}:
│     Vector{Int64}:
│     4
│     4
└ @ Documenter.DocTests ~/.julia/packages/Documenter/PLD7m/src/DocTests.jl:369
┌ Error: doctest failure in ~/.julia/packages/HomotopyContinuation/mJDHb/src/model_kit/expression.jl:759-768
│ 
│ ```jldoctest
│ julia> @var x y t a b;
│ 
│ julia> H = Homotopy([x^2 + t*a, y^2 + t*b], [x, y], t, [a, b]);
│ 
│ julia> H([2, 3], 1, [5, 2])
│ 2-element Array{Int64,1}:
│   9
│  11
│ ```
│ 
│ Subexpression:
│ 
│ H([2, 3], 1, [5, 2])
│ 
│ Evaluated output:
│ 
│ 2-element Vector{Int64}:
│   9
│  11
│ 
│ Expected output:
│ 
│ 2-element Array{Int64,1}:
│   9
│  11
│ 
│   diff =
│    Warning: Diff output requires color.
│    2-element Array{Int64,1}:
│      Vector{Int64}:
│      9
│     11
└ @ Documenter.DocTests ~/.julia/packages/Documenter/PLD7m/src/DocTests.jl:369
┌ Error: Doctesting failed
│   exception =
│    `makedocs` encountered a doctest error. Terminating build
│    Stacktrace:
│      [1] error(s::String)
│        @ Base ./error.jl:33
│      [2] runner(#unused#::Type{Documenter.Builder.Doctest}, doc::Documenter.Documents.Document)
│        @ Documenter.Builder ~/.julia/packages/Documenter/PLD7m/src/Builder.jl:204
│      [3] dispatch(#unused#::Type{Documenter.Builder.DocumentPipeline}, x::Documenter.Documents.Document)
│        @ Documenter.Utilities.Selectors ~/.julia/packages/Documenter/PLD7m/src/Utilities/Selectors.jl:167
│      [4] #2
│        @ ~/.julia/packages/Documenter/PLD7m/src/Documenter.jl:240 [inlined]
│      [5] cd(f::Documenter.var"#2#3"{Documenter.Documents.Document}, dir::String)
│        @ Base.Filesystem ./file.jl:104
│      [6] makedocs(; debug::Bool, format::Documenter.Writers.HTMLWriter.HTML, kwargs::Base.Iterators.Pairs{Symbol,Any,NTuple{5,Symbol},NamedTuple{(:root, :source, :sitename, :doctest, :modules),Tuple{String,String,String,Symbol,Vector{Module}}}})
│        @ Documenter ~/.julia/packages/Documenter/PLD7m/src/Documenter.jl:239
│      [7] (::Documenter.var"#all_doctests#30"{Bool,Vector{Module}})()
│        @ Documenter ~/.julia/packages/Documenter/PLD7m/src/Documenter.jl:728
│      [8] macro expansion
│        @ ~/.julia/packages/Documenter/PLD7m/src/Documenter.jl:744 [inlined]
│      [9] macro expansion
│        @ /workspace/srcdir/usr/share/julia/stdlib/v1.6/Test/src/Test.jl:1115 [inlined]
│     [10] doctest(source::String, modules::Vector{Module}; fix::Bool, testset::String)
│        @ Documenter ~/.julia/packages/Documenter/PLD7m/src/Documenter.jl:744
│     [11] doctest(package::Module; manual::Bool, testset::Nothing, kwargs::Base.Iterators.Pairs{Union{},Union{},Tuple{},NamedTuple{(),Tuple{}}})
│        @ Documenter ~/.julia/packages/Documenter/PLD7m/src/Documenter.jl:687
│     [12] doctest(package::Module)
│        @ Documenter ~/.julia/packages/Documenter/PLD7m/src/Documenter.jl:674
│     [13] top-level scope
│        @ ~/.julia/packages/HomotopyContinuation/mJDHb/test/runtests.jl:54
│     [14] top-level scope
│        @ /workspace/srcdir/usr/share/julia/stdlib/v1.6/Test/src/Test.jl:1115
│     [15] top-level scope
│        @ ~/.julia/packages/HomotopyContinuation/mJDHb/test/runtests.jl:27
│     [16] include(fname::String)
│        @ Base.MainInclude ./client.jl:444
│     [17] top-level scope
│        @ none:6
│     [18] eval(m::Module, e::Any)
│        @ Core ./boot.jl:340
│     [19] exec_options(opts::Base.JLOptions)
│        @ Base ./client.jl:260
│     [20] _start()
│        @ Base ./client.jl:485
└ @ Documenter ~/.julia/packages/Documenter/PLD7m/src/Documenter.jl:737
Doctests: HomotopyContinuation: Test Failed at /home/pkgeval/.julia/packages/Documenter/PLD7m/src/Documenter.jl:744
  Expression: all_doctests()
Stacktrace:
 [1] macro expansion
   @ ~/.julia/packages/Documenter/PLD7m/src/Documenter.jl:744 [inlined]
 [2] macro expansion
   @ /workspace/srcdir/usr/share/julia/stdlib/v1.6/Test/src/Test.jl:1115 [inlined]
 [3] doctest(source::String, modules::Vector{Module}; fix::Bool, testset::String)
   @ Documenter ~/.julia/packages/Documenter/PLD7m/src/Documenter.jl:744
Test Summary:                    | Pass  Fail  Total
HomotopyContinuation             | 1518     2   1520
  ModelKit                       |   82           82
  Utilities                      |  279     1    280
    Group actions                |    7            7
    UniquePoints                 |  216     1    217
    Multiplicities               |   10           10
    Polynomials                  |   34           34
    Multihomogeneous             |    4            4
    Misc                         |    8            8
  Norms                          |   18           18
  LinearAlgebra                  |   70           70
  AffinePatches                  |   22           22
  Problems                       |   59           59
  Systems                        |   59           59
  Homotopies                     |  123          123
  Predictors                     |   48           48
  NewtonCorrector                |   21           21
  CoreTracker                    |   76           76
  Valuation                      |   53           53
  Cauchy Endgame                 |   20           20
  PathTracker                    |  221          221
  Polyhedral                     |   18           18
  Overdetermined systems         |    5            5
  Solver                         |   84           84
  Result                         |  139          139
  Composition                    |    9            9
  ModelKit integration           |   19           19
  Monodromy                      |   68           68
  Root counts                    |   23           23
  path_info                      |    2            2
  Doctests: HomotopyContinuation |          1      1
ERROR: LoadError: Some tests did not pass: 1518 passed, 2 failed, 0 errored, 0 broken.
in expression starting at /home/pkgeval/.julia/packages/HomotopyContinuation/mJDHb/test/runtests.jl:26
ERROR: Package HomotopyContinuation errored during testing
Stacktrace:
  [1] pkgerror(msg::String)
    @ Pkg.Types /workspace/srcdir/usr/share/julia/stdlib/v1.6/Pkg/src/Types.jl:52
  [2] test(ctx::Pkg.Types.Context, pkgs::Vector{Pkg.Types.PackageSpec}; coverage::Bool, julia_args::Cmd, test_args::Cmd, test_fn::Nothing)
    @ Pkg.Operations /workspace/srcdir/usr/share/julia/stdlib/v1.6/Pkg/src/Operations.jl:1561
  [3] test(ctx::Pkg.Types.Context, pkgs::Vector{Pkg.Types.PackageSpec}; coverage::Bool, test_fn::Nothing, julia_args::Cmd, test_args::Cmd, kwargs::Base.Iterators.Pairs{Union{},Union{},Tuple{},NamedTuple{(),Tuple{}}})
    @ Pkg.API /workspace/srcdir/usr/share/julia/stdlib/v1.6/Pkg/src/API.jl:327
  [4] test(ctx::Pkg.Types.Context, pkgs::Vector{Pkg.Types.PackageSpec})
    @ Pkg.API /workspace/srcdir/usr/share/julia/stdlib/v1.6/Pkg/src/API.jl:314
  [5] #test#61
    @ /workspace/srcdir/usr/share/julia/stdlib/v1.6/Pkg/src/API.jl:67 [inlined]
  [6] test
    @ /workspace/srcdir/usr/share/julia/stdlib/v1.6/Pkg/src/API.jl:67 [inlined]
  [7] #test#60
    @ /workspace/srcdir/usr/share/julia/stdlib/v1.6/Pkg/src/API.jl:66 [inlined]
  [8] test
    @ /workspace/srcdir/usr/share/julia/stdlib/v1.6/Pkg/src/API.jl:66 [inlined]
  [9] test(pkg::String; kwargs::Base.Iterators.Pairs{Union{},Union{},Tuple{},NamedTuple{(),Tuple{}}})
    @ Pkg.API /workspace/srcdir/usr/share/julia/stdlib/v1.6/Pkg/src/API.jl:65
 [10] test(pkg::String)
    @ Pkg.API /workspace/srcdir/usr/share/julia/stdlib/v1.6/Pkg/src/API.jl:65
 [11] top-level scope
    @ none:16
