Julia Version 1.6.0-DEV.387
Commit e23635c619 (2020-07-07 16:42 UTC)
Platform Info:
  OS: Linux (x86_64-linux-gnu)
  CPU: Intel(R) Xeon(R) Silver 4114 CPU @ 2.20GHz
  WORD_SIZE: 64
  LIBM: libopenlibm
  LLVM: libLLVM-9.0.1 (ORCJIT, skylake)
Environment:
  JULIA_DEPOT_PATH = ::/usr/local/share/julia
  JULIA_NUM_THREADS = 2

  Resolving package versions...
  Installed Formatting ─────────────────── v0.4.1
  Installed ProgressMeter ──────────────── v1.3.1
  Installed GenericSVD ─────────────────── v0.3.0
  Installed ElasticArrays ──────────────── v1.2.3
  Installed OrderedCollections ─────────── v1.3.0
  Installed GenericSchur ───────────────── v0.4.0
  Installed Parameters ─────────────────── v0.12.1
  Installed HomotopyContinuation ───────── v1.4.4
  Installed LaTeXStrings ───────────────── v1.1.0
  Installed UnPack ─────────────────────── v1.0.1
  Installed XML2_jll ───────────────────── v2.9.10+1
  Installed TableTraits ────────────────── v1.0.0
  Installed RecipesBase ────────────────── v1.0.1
  Installed Zlib_jll ───────────────────── v1.2.11+14
  Installed ExprTools ──────────────────── v0.1.1
  Installed DataStructures ─────────────── v0.17.19
  Installed StaticPolynomials ──────────── v1.3.3
  Installed Libiconv_jll ───────────────── v1.16.0+5
  Installed DataValueInterfaces ────────── v1.0.0
  Installed ProjectiveVectors ──────────── v1.1.2
  Installed Requires ───────────────────── v1.0.1
  Installed MutableArithmetics ─────────── v0.2.10
  Installed Latexify ───────────────────── v0.13.5
  Installed OpenSpecFun_jll ────────────── v0.5.3+3
  Installed TreeViews ──────────────────── v0.3.0
  Installed Adapt ──────────────────────── v2.0.2
  Installed EzXML ──────────────────────── v1.1.0
  Installed SpecialFunctions ───────────── v0.10.3
  Installed Tables ─────────────────────── v1.0.4
  Installed PrettyTables ───────────────── v0.9.1
  Installed DoubleFloats ───────────────── v1.1.12
  Installed DataAPI ────────────────────── v1.3.0
  Installed DynamicPolynomials ─────────── v0.3.10
  Installed Reexport ───────────────────── v0.2.0
  Installed IteratorInterfaceExtensions ── v1.0.0
  Installed MultivariatePolynomials ────── v0.3.9
  Installed Intervals ──────────────────── v1.3.4
  Installed StaticArrays ───────────────── v0.12.4
  Installed Polynomials ────────────────── v1.1.3
  Installed MixedSubdivisions ──────────── v1.0.0
  Installed TimeZones ──────────────────── v1.2.0
  Installed MacroTools ─────────────────── v0.5.5
  Installed FixedPolynomials ───────────── v0.4.0
  Installed Crayons ────────────────────── v4.0.3
  Installed CompilerSupportLibraries_jll ─ v0.3.3+0
  Installed Mocking ────────────────────── v0.7.1
  Installed Quadmath ───────────────────── v0.5.4
Updating `~/.julia/environments/v1.6/Project.toml`
  [f213a82b] + HomotopyContinuation v1.4.4
Updating `~/.julia/environments/v1.6/Manifest.toml`
  [79e6a3ab] + Adapt v2.0.2
  [e66e0078] + CompilerSupportLibraries_jll v0.3.3+0
  [a8cc5b0e] + Crayons v4.0.3
  [9a962f9c] + DataAPI v1.3.0
  [864edb3b] + DataStructures v0.17.19
  [e2d170a0] + DataValueInterfaces v1.0.0
  [497a8b3b] + DoubleFloats v1.1.12
  [7c1d4256] + DynamicPolynomials v0.3.10
  [fdbdab4c] + ElasticArrays v1.2.3
  [e2ba6199] + ExprTools v0.1.1
  [8f5d6c58] + EzXML v1.1.0
  [3dd14ad9] + FixedPolynomials v0.4.0
  [59287772] + Formatting v0.4.1
  [01680d73] + GenericSVD v0.3.0
  [c145ed77] + GenericSchur v0.4.0
  [f213a82b] + HomotopyContinuation v1.4.4
  [d8418881] + Intervals v1.3.4
  [82899510] + IteratorInterfaceExtensions v1.0.0
  [b964fa9f] + LaTeXStrings v1.1.0
  [23fbe1c1] + Latexify v0.13.5
  [94ce4f54] + Libiconv_jll v1.16.0+5
  [1914dd2f] + MacroTools v0.5.5
  [291d046c] + MixedSubdivisions v1.0.0
  [78c3b35d] + Mocking v0.7.1
  [102ac46a] + MultivariatePolynomials v0.3.9
  [d8a4904e] + MutableArithmetics v0.2.10
  [efe28fd5] + OpenSpecFun_jll v0.5.3+3
  [bac558e1] + OrderedCollections v1.3.0
  [d96e819e] + Parameters v0.12.1
  [f27b6e38] + Polynomials v1.1.3
  [08abe8d2] + PrettyTables v0.9.1
  [92933f4c] + ProgressMeter v1.3.1
  [01f381cc] + ProjectiveVectors v1.1.2
  [be4d8f0f] + Quadmath v0.5.4
  [3cdcf5f2] + RecipesBase v1.0.1
  [189a3867] + Reexport v0.2.0
  [ae029012] + Requires v1.0.1
  [276daf66] + SpecialFunctions v0.10.3
  [90137ffa] + StaticArrays v0.12.4
  [62e018b1] + StaticPolynomials v1.3.3
  [3783bdb8] + TableTraits v1.0.0
  [bd369af6] + Tables v1.0.4
  [f269a46b] + TimeZones v1.2.0
  [a2a6695c] + TreeViews v0.3.0
  [3a884ed6] + UnPack v1.0.1
  [02c8fc9c] + XML2_jll v2.9.10+1
  [83775a58] + Zlib_jll v1.2.11+14
  [2a0f44e3] + Base64
  [ade2ca70] + Dates
  [8ba89e20] + Distributed
  [9fa8497b] + Future
  [b77e0a4c] + InteractiveUtils
  [76f85450] + LibGit2
  [8f399da3] + Libdl
  [37e2e46d] + LinearAlgebra
  [56ddb016] + Logging
  [d6f4376e] + Markdown
  [44cfe95a] + Pkg
  [de0858da] + Printf
  [3fa0cd96] + REPL
  [9a3f8284] + Random
  [ea8e919c] + SHA
  [9e88b42a] + Serialization
  [6462fe0b] + Sockets
  [2f01184e] + SparseArrays
  [10745b16] + Statistics
  [8dfed614] + Test
  [cf7118a7] + UUIDs
  [4ec0a83e] + Unicode
   Building TimeZones → `~/.julia/packages/TimeZones/OjMoF/deps/build.log`
    Testing HomotopyContinuation
Status `/tmp/jl_RQTvTn/Project.toml`
  [e30172f5] Documenter v0.24.11
  [497a8b3b] DoubleFloats v1.1.12
  [7c1d4256] DynamicPolynomials v0.3.10
  [fdbdab4c] ElasticArrays v1.2.3
  [26cc04aa] FiniteDifferences v0.10.4
  [3dd14ad9] FixedPolynomials v0.4.0
  [f213a82b] HomotopyContinuation v1.4.4
  [23fbe1c1] Latexify v0.13.5
  [291d046c] MixedSubdivisions v1.0.0
  [102ac46a] MultivariatePolynomials v0.3.9
  [bac558e1] OrderedCollections v1.3.0
  [d96e819e] Parameters v0.12.1
  [4c526841] PolynomialTestSystems v0.1.4
  [08abe8d2] PrettyTables v0.9.1
  [01f381cc] ProjectiveVectors v1.1.2
  [90137ffa] StaticArrays v0.12.4
  [62e018b1] StaticPolynomials v1.3.3
  [a2a6695c] TreeViews v0.3.0
  [37e2e46d] LinearAlgebra
  [de0858da] Printf
  [9a3f8284] Random
  [8dfed614] Test
Status `/tmp/jl_RQTvTn/Manifest.toml`
  [79e6a3ab] Adapt v2.0.2
  [e66e0078] CompilerSupportLibraries_jll v0.3.3+0
  [a8cc5b0e] Crayons v4.0.3
  [9a962f9c] DataAPI v1.3.0
  [864edb3b] DataStructures v0.17.19
  [e2d170a0] DataValueInterfaces v1.0.0
  [ffbed154] DocStringExtensions v0.8.2
  [e30172f5] Documenter v0.24.11
  [497a8b3b] DoubleFloats v1.1.12
  [7c1d4256] DynamicPolynomials v0.3.10
  [fdbdab4c] ElasticArrays v1.2.3
  [e2ba6199] ExprTools v0.1.1
  [8f5d6c58] EzXML v1.1.0
  [26cc04aa] FiniteDifferences v0.10.4
  [3dd14ad9] FixedPolynomials v0.4.0
  [59287772] Formatting v0.4.1
  [01680d73] GenericSVD v0.3.0
  [c145ed77] GenericSchur v0.4.0
  [f213a82b] HomotopyContinuation v1.4.4
  [d8418881] Intervals v1.3.4
  [82899510] IteratorInterfaceExtensions v1.0.0
  [682c06a0] JSON v0.21.0
  [b964fa9f] LaTeXStrings v1.1.0
  [23fbe1c1] Latexify v0.13.5
  [94ce4f54] Libiconv_jll v1.16.0+5
  [1914dd2f] MacroTools v0.5.5
  [291d046c] MixedSubdivisions v1.0.0
  [78c3b35d] Mocking v0.7.1
  [102ac46a] MultivariatePolynomials v0.3.9
  [d8a4904e] MutableArithmetics v0.2.10
  [efe28fd5] OpenSpecFun_jll v0.5.3+3
  [bac558e1] OrderedCollections v1.3.0
  [d96e819e] Parameters v0.12.1
  [69de0a69] Parsers v1.0.7
  [4c526841] PolynomialTestSystems v0.1.4
  [f27b6e38] Polynomials v1.1.3
  [08abe8d2] PrettyTables v0.9.1
  [92933f4c] ProgressMeter v1.3.1
  [01f381cc] ProjectiveVectors v1.1.2
  [be4d8f0f] Quadmath v0.5.4
  [3cdcf5f2] RecipesBase v1.0.1
  [189a3867] Reexport v0.2.0
  [ae029012] Requires v1.0.1
  [276daf66] SpecialFunctions v0.10.3
  [90137ffa] StaticArrays v0.12.4
  [62e018b1] StaticPolynomials v1.3.3
  [3783bdb8] TableTraits v1.0.0
  [bd369af6] Tables v1.0.4
  [f269a46b] TimeZones v1.2.0
  [a2a6695c] TreeViews v0.3.0
  [3a884ed6] UnPack v1.0.1
  [02c8fc9c] XML2_jll v2.9.10+1
  [83775a58] Zlib_jll v1.2.11+14
  [2a0f44e3] Base64
  [ade2ca70] Dates
  [8ba89e20] Distributed
  [9fa8497b] Future
  [b77e0a4c] InteractiveUtils
  [76f85450] LibGit2
  [8f399da3] Libdl
  [37e2e46d] LinearAlgebra
  [56ddb016] Logging
  [d6f4376e] Markdown
  [a63ad114] Mmap
  [44cfe95a] Pkg
  [de0858da] Printf
  [3fa0cd96] REPL
  [9a3f8284] Random
  [ea8e919c] SHA
  [9e88b42a] Serialization
  [6462fe0b] Sockets
  [2f01184e] SparseArrays
  [10745b16] Statistics
  [8dfed614] Test
  [cf7118a7] UUIDs
  [4ec0a83e] Unicode
UniquePoints: Test Failed at /home/pkgeval/.julia/packages/HomotopyContinuation/mJDHb/test/utilities_test.jl:69
  Expression: string(data) == "UniquePoints{Array{Complex{Float64},1},Float64,typeof(euclidean_distance),Nothing} with 2000 points"
   Evaluated: "UniquePoints{Vector{ComplexF64},Float64,typeof(euclidean_distance),Nothing} with 2000 points" == "UniquePoints{Array{Complex{Float64},1},Float64,typeof(euclidean_distance),Nothing} with 2000 points"
Stacktrace:
 [1] top-level scope
   @ ~/.julia/packages/HomotopyContinuation/mJDHb/test/utilities_test.jl:69
 [2] top-level scope
   @ /workspace/srcdir/usr/share/julia/stdlib/v1.6/Test/src/Test.jl:1115
 [3] top-level scope
   @ ~/.julia/packages/HomotopyContinuation/mJDHb/test/utilities_test.jl:63
 [4] top-level scope
   @ /workspace/srcdir/usr/share/julia/stdlib/v1.6/Test/src/Test.jl:1115
 [5] top-level scope
   @ ~/.julia/packages/HomotopyContinuation/mJDHb/test/utilities_test.jl:3
┌ Warning: `setup!(tracker::CoreTracker, x, t, t₀; kwargs...)` is deprecated, use `init!(tracker, x, t, t₀; kwargs...)` instead.
│   caller = top-level scope at core_tracker_test.jl:40
└ @ Core ~/.julia/packages/HomotopyContinuation/mJDHb/test/core_tracker_test.jl:40
┌ Warning: Solutions are now automatically refined to maximal achievable accuracy.
└ @ HomotopyContinuation ~/.julia/packages/HomotopyContinuation/mJDHb/src/core_tracker.jl:1410
┌ Warning: `set_refinement_accuracy!` is deprecated. Solutions are now automatically refined to maximal achievable accuracy.
└ @ HomotopyContinuation ~/.julia/packages/HomotopyContinuation/mJDHb/src/core_tracker.jl:1420
┌ Warning: `max_refinement_iters` is deprecated. Solutions are now automatically refined to the maximal achievable accuracy.
└ @ HomotopyContinuation ~/.julia/packages/HomotopyContinuation/mJDHb/src/core_tracker.jl:1429
┌ Warning: `set_max_refinement_iters` is deprecated. Solutions are now automatically refined to the maximal achievable accuracy.
└ @ HomotopyContinuation ~/.julia/packages/HomotopyContinuation/mJDHb/src/core_tracker.jl:1439
Univariate singular: 2,3,4,5,6,7,8,9,10,11,12,
Wilkinson: 1,2,3,4,5,6,7,8,9,10,11,12,13,14,15,16,17,18,
Computing mixed cells... 1 	 Time: 0:00:00[K
  mixed_volume:  5[K[AComputing mixed cells... 14 	 Time: 0:00:00[K
  mixed_volume:  70
Computing mixed cells... 1 	 Time: 0:00:00[K
  mixed_volume:  4[K[AComputing mixed cells... 62 	 Time: 0:00:00[K
  mixed_volume:  331[K[AComputing mixed cells... 297 	 Time: 0:00:01[K
  mixed_volume:  2696[K[AComputing mixed cells... 599 	 Time: 0:00:01[K
  mixed_volume:  4278[K[AComputing mixed cells... 872 	 Time: 0:00:01[K
  mixed_volume:  6264[K[AComputing mixed cells... 1298 	 Time: 0:00:01[K
  mixed_volume:  9439[K[AComputing mixed cells... 1700 	 Time: 0:00:02[K
  mixed_volume:  11686[K[AComputing mixed cells... 1881 	 Time: 0:00:02[K
  mixed_volume:  12636
Tracking 120 paths...  27%|██████████▋                             |  ETA: 0:00:01[K
  # paths tracked:                  32
  # non-singular solutions (real):  19 (4)
  # singular solutions (real):      0 (0)
  # total solutions (real):         19 (4)[A[A[A[A



[K[A[K[A[K[A[K[ATracking 120 paths... 100%|████████████████████████████████████████| Time: 0:00:00[K
  # paths tracked:                  120
  # non-singular solutions (real):  70 (10)
  # singular solutions (real):      0 (0)
  # total solutions (real):         70 (10)
Tracking 120 paths...  56%|██████████████████████▁                 |  ETA: 0:00:03[K
  # paths tracked:                  67
  # non-singular solutions (real):  38 (6)
  # singular solutions (real):      0 (0)
  # total solutions (real):         38 (6)[A[A[A[A



[K[A[K[A[K[A[K[ATracking 120 paths... 100%|████████████████████████████████████████| Time: 0:00:03[K
  # paths tracked:                  120
  # non-singular solutions (real):  70 (10)
  # singular solutions (real):      0 (0)
  # total solutions (real):         70 (10)
Tracking 216 paths...  30%|████████████                            |  ETA: 0:00:02[K
  # paths tracked:                  65
  # non-singular solutions (real):  24 (5)
  # singular solutions (real):      0 (0)
  # total solutions (real):         24 (5)[A[A[A[A



[K[A[K[A[K[A[K[ATracking 216 paths...  60%|████████████████████████▁               |  ETA: 0:00:01[K
  # paths tracked:                  130
  # non-singular solutions (real):  49 (7)
  # singular solutions (real):      0 (0)
  # total solutions (real):         49 (7)[A[A[A[A



[K[A[K[A[K[A[K[ATracking 216 paths...  91%|████████████████████████████████████▌   |  ETA: 0:00:00[K
  # paths tracked:                  197
  # non-singular solutions (real):  75 (8)
  # singular solutions (real):      0 (0)
  # total solutions (real):         75 (8)[A[A[A[A



[K[A[K[A[K[A[K[ATracking 216 paths... 100%|████████████████████████████████████████| Time: 0:00:02[K
  # paths tracked:                  216
  # non-singular solutions (real):  80 (8)
  # singular solutions (real):      0 (0)
  # total solutions (real):         80 (8)
Tracking 125 paths...   2%|▋                                       |  ETA: 0:00:28[K
  # paths tracked:                  2
  # non-singular solutions (real):  2 (2)
  # singular solutions (real):      0 (0)
  # total solutions (real):         2 (2)[A[A[A[ASolutions found: 34 	 Time: 0:00:00[K
  # paths tracked:                   270
  # loops generated:                 4
  # completed loops without change:  0
  # solutions in current loop:       2
  # real solutions:                  0[K[A[K[A[K[A[K[A[K[ASolutions found: 36 	 Time: 0:00:00[K
  # paths tracked:                   470
  # loops generated:                 7
  # completed loops without change:  1
  # solutions in current loop:       0
  # real solutions:                  0[K[A[K[A[K[A[K[A[K[ASolutions found: 36 	 Time: 0:00:00[K
  # paths tracked:                   850
  # loops generated:                 12
  # completed loops without change:  6
  # solutions in current loop:       0
  # real solutions:                  0[K[A[K[A[K[A[K[A[K[ASolutions found: 36 	 Time: 0:00:00[K
┌ Warning: None of the provided solutions is a valid start solution.
└ @ HomotopyContinuation ~/.julia/packages/HomotopyContinuation/mJDHb/src/monodromy.jl:878
[ Info: Compute additional witnesses for completeness...
[ Info: Found 2 additional witnesses
[ Info: Compute trace...
[ Info: Norm of trace: 6.315463934018336e-14
[ Info: Compute additional witnesses for completeness...
Solutions found: 29 	 Time: 0:00:00[K
  # paths tracked:                   672
  # loops generated:                 8
  # completed loops without change:  0
  # solutions in current loop:       1
  # real solutions:                  0[K[A[K[A[K[A[K[A[K[ASolutions found: 31 	 Time: 0:00:00[K
  # paths tracked:                   1243
  # loops generated:                 14
  # completed loops without change:  0
  # solutions in current loop:       0
  # real solutions:                  0[K[A[K[A[K[A[K[A[K[ASolutions found: 35 	 Time: 0:00:00[K
  # paths tracked:                   1938
  # loops generated:                 19
  # completed loops without change:  0
  # solutions in current loop:       1
  # real solutions:                  0[K[A[K[A[K[A[K[A[K[ASolutions found: 36 	 Time: 0:00:00[K
[ Info: Found 36 additional witnesses
[ Info: Compute trace...
[ Info: Norm of trace: 5.627389204338252e-9
Solutions found: 1 	 Time: 0:00:00[K
  # paths tracked:                   2
  # loops generated:                 1
  # completed loops without change:  0
  # solutions in current loop:       0
  # real solutions:                  0[K[A[K[A[K[A[K[A[K[ASolutions found: 7 	 Time: 0:00:00[K
  # paths tracked:                   24
  # loops generated:                 2
  # completed loops without change:  0
  # solutions in current loop:       6
  # real solutions:                  0[K[A[K[A[K[A[K[A[K[ASolutions found: 13 	 Time: 0:00:01[K
  # paths tracked:                   48
  # loops generated:                 2
  # completed loops without change:  0
  # solutions in current loop:       12
  # real solutions:                  0[K[A[K[A[K[A[K[A[K[ASolutions found: 26 	 Time: 0:00:01[K
  # paths tracked:                   88
  # loops generated:                 2
  # completed loops without change:  0
  # solutions in current loop:       25
  # real solutions:                  0[K[A[K[A[K[A[K[A[K[ASolutions found: 41 	 Time: 0:00:01[K
  # paths tracked:                   144
  # loops generated:                 2
  # completed loops without change:  0
  # solutions in current loop:       40
  # real solutions:                  0[K[A[K[A[K[A[K[A[K[ASolutions found: 51 	 Time: 0:00:01[K
Solutions found: 1 	 Time: 0:00:01[K
  # paths tracked:                   2
  # loops generated:                 1
  # completed loops without change:  0
  # solutions in current loop:       0
  # real solutions:                  0[K[A[K[A[K[A[K[A[K[ASolutions found: 2 	 Time: 0:00:01[K
  # paths tracked:                   36
  # loops generated:                 9
  # completed loops without change:  4
  # solutions in current loop:       0
  # real solutions:                  0[K[A[K[A[K[A[K[A[K[ASolutions found: 2 	 Time: 0:00:01[K
Solutions found: 1 	 Time: 0:00:00[K
  # paths tracked:                   2
  # loops generated:                 1
  # completed loops without change:  0
  # solutions in current loop:       0
  # real solutions:                  1[K[A[K[A[K[A[K[A[K[ASolutions found: 2 	 Time: 0:00:00[K
Solutions found: 2 	 Time: 0:00:00[K
  # paths tracked:                   2
  # loops generated:                 1
  # completed loops without change:  0
  # solutions in current loop:       1
  # real solutions:                  0[K[A[K[A[K[A[K[A[K[ASolutions found: 8 	 Time: 0:00:00[K
  # paths tracked:                   14
  # loops generated:                 1
  # completed loops without change:  0
  # solutions in current loop:       7
  # real solutions:                  0[K[A[K[A[K[A[K[A[K[ASolutions found: 17 	 Time: 0:00:01[K
  # paths tracked:                   32
  # loops generated:                 1
  # completed loops without change:  0
  # solutions in current loop:       16
  # real solutions:                  0[K[A[K[A[K[A[K[A[K[ASolutions found: 21 	 Time: 0:00:01[K
  # paths tracked:                   40
  # loops generated:                 1
  # completed loops without change:  0
  # solutions in current loop:       20
  # real solutions:                  0[K[A[K[A[K[A[K[A[K[ASolutions found: 24 	 Time: 0:00:01[K
  # paths tracked:                   46
  # loops generated:                 1
  # completed loops without change:  0
  # solutions in current loop:       23
  # real solutions:                  0[K[A[K[A[K[A[K[A[K[ASolutions found: 39 	 Time: 0:00:01[K
  # paths tracked:                   76
  # loops generated:                 1
  # completed loops without change:  0
  # solutions in current loop:       38
  # real solutions:                  0[K[A[K[A[K[A[K[A[K[ASolutions found: 47 	 Time: 0:00:01[K
  # paths tracked:                   93
  # loops generated:                 1
  # completed loops without change:  0
  # solutions in current loop:       46
  # real solutions:                  0[K[A[K[A[K[A[K[A[K[ASolutions found: 74 	 Time: 0:00:01[K
  # paths tracked:                   189
  # loops generated:                 2
  # completed loops without change:  0
  # solutions in current loop:       27
  # real solutions:                  0[K[A[K[A[K[A[K[A[K[ASolutions found: 95 	 Time: 0:00:01[K
  # paths tracked:                   251
  # loops generated:                 2
  # completed loops without change:  0
  # solutions in current loop:       48
  # real solutions:                  0[K[A[K[A[K[A[K[A[K[ASolutions found: 114 	 Time: 0:00:01[K
  # paths tracked:                   311
  # loops generated:                 2
  # completed loops without change:  0
  # solutions in current loop:       67
  # real solutions:                  0[K[A[K[A[K[A[K[A[K[ASolutions found: 125 	 Time: 0:00:02[K
  # paths tracked:                   350
  # loops generated:                 2
  # completed loops without change:  0
  # solutions in current loop:       78
  # real solutions:                  0[K[A[K[A[K[A[K[A[K[ASolutions found: 140 	 Time: 0:00:02[K
  # paths tracked:                   402
  # loops generated:                 2
  # completed loops without change:  0
  # solutions in current loop:       93
  # real solutions:                  0[K[A[K[A[K[A[K[A[K[ASolutions found: 151 	 Time: 0:00:02[K
  # paths tracked:                   431
  # loops generated:                 2
  # completed loops without change:  0
  # solutions in current loop:       104
  # real solutions:                  0[K[A[K[A[K[A[K[A[K[ASolutions found: 171 	 Time: 0:00:02[K
  # paths tracked:                   490
  # loops generated:                 2
  # completed loops without change:  0
  # solutions in current loop:       124
  # real solutions:                  0[K[A[K[A[K[A[K[A[K[ASolutions found: 190 	 Time: 0:00:02[K
  # paths tracked:                   563
  # loops generated:                 2
  # completed loops without change:  0
  # solutions in current loop:       143
  # real solutions:                  0[K[A[K[A[K[A[K[A[K[ASolutions found: 201 	 Time: 0:00:02[K
  # paths tracked:                   603
  # loops generated:                 2
  # completed loops without change:  0
  # solutions in current loop:       154
  # real solutions:                  0[K[A[K[A[K[A[K[A[K[ASolutions found: 216 	 Time: 0:00:02[K
  # paths tracked:                   677
  # loops generated:                 2
  # completed loops without change:  0
  # solutions in current loop:       169
  # real solutions:                  0[K[A[K[A[K[A[K[A[K[ASolutions found: 233 	 Time: 0:00:02[K
  # paths tracked:                   727
  # loops generated:                 2
  # completed loops without change:  0
  # solutions in current loop:       186
  # real solutions:                  0[K[A[K[A[K[A[K[A[K[ASolutions found: 249 	 Time: 0:00:02[K
  # paths tracked:                   782
  # loops generated:                 2
  # completed loops without change:  0
  # solutions in current loop:       202
  # real solutions:                  0[K[A[K[A[K[A[K[A[K[ASolutions found: 261 	 Time: 0:00:03[K
  # paths tracked:                   822
  # loops generated:                 2
  # completed loops without change:  0
  # solutions in current loop:       214
  # real solutions:                  0[K[A[K[A[K[A[K[A[K[ASolutions found: 277 	 Time: 0:00:03[K
  # paths tracked:                   889
  # loops generated:                 2
  # completed loops without change:  0
  # solutions in current loop:       230
  # real solutions:                  0[K[A[K[A[K[A[K[A[K[ASolutions found: 292 	 Time: 0:00:03[K
  # paths tracked:                   951
  # loops generated:                 2
  # completed loops without change:  0
  # solutions in current loop:       245
  # real solutions:                  0[K[A[K[A[K[A[K[A[K[ASolutions found: 305 	 Time: 0:00:03[K
  # paths tracked:                   1011
  # loops generated:                 2
  # completed loops without change:  0
  # solutions in current loop:       258
  # real solutions:                  0[K[A[K[A[K[A[K[A[K[ASolutions found: 320 	 Time: 0:00:03[K
  # paths tracked:                   1059
  # loops generated:                 2
  # completed loops without change:  0
  # solutions in current loop:       273
  # real solutions:                  0[K[A[K[A[K[A[K[A[K[ASolutions found: 342 	 Time: 0:00:03[K
  # paths tracked:                   1151
  # loops generated:                 2
  # completed loops without change:  0
  # solutions in current loop:       295
  # real solutions:                  0[K[A[K[A[K[A[K[A[K[ASolutions found: 360 	 Time: 0:00:03[K
  # paths tracked:                   1226
  # loops generated:                 2
  # completed loops without change:  0
  # solutions in current loop:       313
  # real solutions:                  0[K[A[K[A[K[A[K[A[K[ASolutions found: 374 	 Time: 0:00:03[K
  # paths tracked:                   1288
  # loops generated:                 2
  # completed loops without change:  0
  # solutions in current loop:       327
  # real solutions:                  0[K[A[K[A[K[A[K[A[K[ASolutions found: 393 	 Time: 0:00:03[K
  # paths tracked:                   1353
  # loops generated:                 2
  # completed loops without change:  0
  # solutions in current loop:       346
  # real solutions:                  0[K[A[K[A[K[A[K[A[K[ASolutions found: 400 	 Time: 0:00:04[K
  # paths tracked:                   1405
  # loops generated:                 2
  # completed loops without change:  0
  # solutions in current loop:       353
  # real solutions:                  0[K[A[K[A[K[A[K[A[K[ASolutions found: 411 	 Time: 0:00:04[K
  # paths tracked:                   1474
  # loops generated:                 2
  # completed loops without change:  0
  # solutions in current loop:       364
  # real solutions:                  0[K[A[K[A[K[A[K[A[K[ASolutions found: 430 	 Time: 0:00:04[K
  # paths tracked:                   1559
  # loops generated:                 2
  # completed loops without change:  0
  # solutions in current loop:       383
  # real solutions:                  0[K[A[K[A[K[A[K[A[K[ASolutions found: 455 	 Time: 0:00:04[K
  # paths tracked:                   1683
  # loops generated:                 2
  # completed loops without change:  0
  # solutions in current loop:       408
  # real solutions:                  0[K[A[K[A[K[A[K[A[K[ASolutions found: 468 	 Time: 0:00:04[K
  # paths tracked:                   1779
  # loops generated:                 2
  # completed loops without change:  0
  # solutions in current loop:       421
  # real solutions:                  0[K[A[K[A[K[A[K[A[K[ASolutions found: 479 	 Time: 0:00:04[K
  # paths tracked:                   1849
  # loops generated:                 2
  # completed loops without change:  0
  # solutions in current loop:       432
  # real solutions:                  0[K[A[K[A[K[A[K[A[K[ASolutions found: 493 	 Time: 0:00:04[K
  # paths tracked:                   1925
  # loops generated:                 2
  # completed loops without change:  0
  # solutions in current loop:       446
  # real solutions:                  0[K[A[K[A[K[A[K[A[K[ASolutions found: 499 	 Time: 0:00:04[K
  # paths tracked:                   1991
  # loops generated:                 3
  # completed loops without change:  0
  # solutions in current loop:       0
  # real solutions:                  0[K[A[K[A[K[A[K[A[K[ASolutions found: 506 	 Time: 0:00:05[K
  # paths tracked:                   2042
  # loops generated:                 3
  # completed loops without change:  0
  # solutions in current loop:       7
  # real solutions:                  0[K[A[K[A[K[A[K[A[K[ASolutions found: 515 	 Time: 0:00:05[K
  # paths tracked:                   2092
  # loops generated:                 3
  # completed loops without change:  0
  # solutions in current loop:       16
  # real solutions:                  0[K[A[K[A[K[A[K[A[K[ASolutions found: 522 	 Time: 0:00:05[K
  # paths tracked:                   2130
  # loops generated:                 3
  # completed loops without change:  0
  # solutions in current loop:       23
  # real solutions:                  0[K[A[K[A[K[A[K[A[K[ASolutions found: 526 	 Time: 0:00:05[K
  # paths tracked:                   2169
  # loops generated:                 3
  # completed loops without change:  0
  # solutions in current loop:       27
  # real solutions:                  0[K[A[K[A[K[A[K[A[K[ASolutions found: 533 	 Time: 0:00:05[K
  # paths tracked:                   2216
  # loops generated:                 3
  # completed loops without change:  0
  # solutions in current loop:       34
  # real solutions:                  0[K[A[K[A[K[A[K[A[K[ASolutions found: 537 	 Time: 0:00:05[K
  # paths tracked:                   2268
  # loops generated:                 3
  # completed loops without change:  0
  # solutions in current loop:       38
  # real solutions:                  0[K[A[K[A[K[A[K[A[K[ASolutions found: 546 	 Time: 0:00:05[K
  # paths tracked:                   2319
  # loops generated:                 3
  # completed loops without change:  0
  # solutions in current loop:       47
  # real solutions:                  0[K[A[K[A[K[A[K[A[K[ASolutions found: 553 	 Time: 0:00:05[K
  # paths tracked:                   2370
  # loops generated:                 3
  # completed loops without change:  0
  # solutions in current loop:       54
  # real solutions:                  0[K[A[K[A[K[A[K[A[K[ASolutions found: 558 	 Time: 0:00:05[K
  # paths tracked:                   2424
  # loops generated:                 3
  # completed loops without change:  0
  # solutions in current loop:       59
  # real solutions:                  0[K[A[K[A[K[A[K[A[K[ASolutions found: 566 	 Time: 0:00:06[K
  # paths tracked:                   2474
  # loops generated:                 3
  # completed loops without change:  0
  # solutions in current loop:       67
  # real solutions:                  0[K[A[K[A[K[A[K[A[K[ASolutions found: 575 	 Time: 0:00:06[K
  # paths tracked:                   2537
  # loops generated:                 3
  # completed loops without change:  0
  # solutions in current loop:       76
  # real solutions:                  0[K[A[K[A[K[A[K[A[K[ASolutions found: 582 	 Time: 0:00:06[K
  # paths tracked:                   2580
  # loops generated:                 3
  # completed loops without change:  0
  # solutions in current loop:       83
  # real solutions:                  0[K[A[K[A[K[A[K[A[K[ASolutions found: 591 	 Time: 0:00:06[K
  # paths tracked:                   2623
  # loops generated:                 3
  # completed loops without change:  0
  # solutions in current loop:       92
  # real solutions:                  0[K[A[K[A[K[A[K[A[K[ASolutions found: 597 	 Time: 0:00:06[K
  # paths tracked:                   2678
  # loops generated:                 3
  # completed loops without change:  0
  # solutions in current loop:       98
  # real solutions:                  0[K[A[K[A[K[A[K[A[K[ASolutions found: 604 	 Time: 0:00:06[K
  # paths tracked:                   2723
  # loops generated:                 3
  # completed loops without change:  0
  # solutions in current loop:       105
  # real solutions:                  0[K[A[K[A[K[A[K[A[K[ASolutions found: 617 	 Time: 0:00:06[K
  # paths tracked:                   2783
  # loops generated:                 3
  # completed loops without change:  0
  # solutions in current loop:       118
  # real solutions:                  0[K[A[K[A[K[A[K[A[K[ASolutions found: 624 	 Time: 0:00:06[K
  # paths tracked:                   2819
  # loops generated:                 3
  # completed loops without change:  0
  # solutions in current loop:       125
  # real solutions:                  0[K[A[K[A[K[A[K[A[K[ASolutions found: 639 	 Time: 0:00:06[K
  # paths tracked:                   2902
  # loops generated:                 3
  # completed loops without change:  0
  # solutions in current loop:       140
  # real solutions:                  0[K[A[K[A[K[A[K[A[K[ASolutions found: 643 	 Time: 0:00:07[K
  # paths tracked:                   2951
  # loops generated:                 3
  # completed loops without change:  0
  # solutions in current loop:       144
  # real solutions:                  0[K[A[K[A[K[A[K[A[K[ASolutions found: 648 	 Time: 0:00:07[K
  # paths tracked:                   2973
  # loops generated:                 3
  # completed loops without change:  0
  # solutions in current loop:       149
  # real solutions:                  0[K[A[K[A[K[A[K[A[K[ASolutions found: 652 	 Time: 0:00:07[K
  # paths tracked:                   3022
  # loops generated:                 3
  # completed loops without change:  0
  # solutions in current loop:       153
  # real solutions:                  0[K[A[K[A[K[A[K[A[K[ASolutions found: 655 	 Time: 0:00:07[K
  # paths tracked:                   3088
  # loops generated:                 3
  # completed loops without change:  0
  # solutions in current loop:       156
  # real solutions:                  0[K[A[K[A[K[A[K[A[K[ASolutions found: 661 	 Time: 0:00:07[K
  # paths tracked:                   3145
  # loops generated:                 3
  # completed loops without change:  0
  # solutions in current loop:       162
  # real solutions:                  0[K[A[K[A[K[A[K[A[K[ASolutions found: 668 	 Time: 0:00:07[K
  # paths tracked:                   3233
  # loops generated:                 3
  # completed loops without change:  0
  # solutions in current loop:       169
  # real solutions:                  0[K[A[K[A[K[A[K[A[K[ASolutions found: 670 	 Time: 0:00:07[K
  # paths tracked:                   3285
  # loops generated:                 3
  # completed loops without change:  0
  # solutions in current loop:       171
  # real solutions:                  0[K[A[K[A[K[A[K[A[K[ASolutions found: 673 	 Time: 0:00:07[K
  # paths tracked:                   3336
  # loops generated:                 3
  # completed loops without change:  0
  # solutions in current loop:       174
  # real solutions:                  0[K[A[K[A[K[A[K[A[K[ASolutions found: 677 	 Time: 0:00:07[K
  # paths tracked:                   3403
  # loops generated:                 3
  # completed loops without change:  0
  # solutions in current loop:       178
  # real solutions:                  0[K[A[K[A[K[A[K[A[K[ASolutions found: 682 	 Time: 0:00:08[K
  # paths tracked:                   3465
  # loops generated:                 3
  # completed loops without change:  0
  # solutions in current loop:       183
  # real solutions:                  0[K[A[K[A[K[A[K[A[K[ASolutions found: 685 	 Time: 0:00:08[K
  # paths tracked:                   3549
  # loops generated:                 3
  # completed loops without change:  0
  # solutions in current loop:       186
  # real solutions:                  0[K[A[K[A[K[A[K[A[K[ASolutions found: 688 	 Time: 0:00:08[K
  # paths tracked:                   3618
  # loops generated:                 3
  # completed loops without change:  0
  # solutions in current loop:       189
  # real solutions:                  0[K[A[K[A[K[A[K[A[K[ASolutions found: 692 	 Time: 0:00:08[K
  # paths tracked:                   3700
  # loops generated:                 3
  # completed loops without change:  0
  # solutions in current loop:       193
  # real solutions:                  0[K[A[K[A[K[A[K[A[K[ASolutions found: 697 	 Time: 0:00:08[K
  # paths tracked:                   3766
  # loops generated:                 3
  # completed loops without change:  0
  # solutions in current loop:       198
  # real solutions:                  0[K[A[K[A[K[A[K[A[K[ASolutions found: 701 	 Time: 0:00:08[K
  # paths tracked:                   3887
  # loops generated:                 3
  # completed loops without change:  0
  # solutions in current loop:       202
  # real solutions:                  0[K[A[K[A[K[A[K[A[K[ASolutions found: 705 	 Time: 0:00:08[K
  # paths tracked:                   3973
  # loops generated:                 3
  # completed loops without change:  0
  # solutions in current loop:       206
  # real solutions:                  0[K[A[K[A[K[A[K[A[K[ASolutions found: 711 	 Time: 0:00:08[K
  # paths tracked:                   4081
  # loops generated:                 3
  # completed loops without change:  0
  # solutions in current loop:       212
  # real solutions:                  0[K[A[K[A[K[A[K[A[K[ASolutions found: 715 	 Time: 0:00:08[K
  # paths tracked:                   4176
  # loops generated:                 3
  # completed loops without change:  0
  # solutions in current loop:       216
  # real solutions:                  0[K[A[K[A[K[A[K[A[K[ASolutions found: 717 	 Time: 0:00:09[K
  # paths tracked:                   4270
  # loops generated:                 3
  # completed loops without change:  0
  # solutions in current loop:       218
  # real solutions:                  0[K[A[K[A[K[A[K[A[K[ASolutions found: 718 	 Time: 0:00:09[K
  # paths tracked:                   4315
  # loops generated:                 4
  # completed loops without change:  0
  # solutions in current loop:       0
  # real solutions:                  0[K[A[K[A[K[A[K[A[K[ASolutions found: 718 	 Time: 0:00:09[K
  # paths tracked:                   4367
  # loops generated:                 4
  # completed loops without change:  0
  # solutions in current loop:       0
  # real solutions:                  0[K[A[K[A[K[A[K[A[K[ASolutions found: 719 	 Time: 0:00:09[K
  # paths tracked:                   4428
  # loops generated:                 4
  # completed loops without change:  0
  # solutions in current loop:       1
  # real solutions:                  0[K[A[K[A[K[A[K[A[K[ASolutions found: 719 	 Time: 0:00:09[K
  # paths tracked:                   4475
  # loops generated:                 4
  # completed loops without change:  0
  # solutions in current loop:       1
  # real solutions:                  0[K[A[K[A[K[A[K[A[K[ASolutions found: 720 	 Time: 0:00:09[K
Computing mixed cells... 1 	 Time: 0:00:00[K
  mixed_volume:  1[K[AComputing mixed cells... 47 	 Time: 0:00:00[K
  mixed_volume:  76
[ Info: SetupBuildDirectory: setting up build directory.
[ Info: Doctest: running doctests.
┌ Error: doctest failure in ~/.julia/packages/HomotopyContinuation/mJDHb/src/model_kit/expression.jl:742-756
│ 
│ ```jldoctest
│ julia> @var x y t;
│ 
│ julia> H = Homotopy([x + t, y + 2t], [y, x], t);
│ 
│ julia> H([2, 3], 0)
│ 2-element Array{Int64,1}:
│  3
│  2
│ 
│ julia> H([2, 3], 1)
│ 2-element Array{Int64,1}:
│  4
│  4
│ ```
│ 
│ Subexpression:
│ 
│ H([2, 3], 0)
│ 
│ Evaluated output:
│ 
│ 2-element Vector{Int64}:
│  3
│  2
│ 
│ Expected output:
│ 
│ 2-element Array{Int64,1}:
│  3
│  2
│ 
│   diff =
│    Warning: Diff output requires color.
│    2-element Array{Int64,1}:
│     Vector{Int64}:
│     3
│     2
└ @ Documenter.DocTests ~/.julia/packages/Documenter/PLD7m/src/DocTests.jl:369
┌ Error: doctest failure in ~/.julia/packages/HomotopyContinuation/mJDHb/src/model_kit/expression.jl:742-756
│ 
│ ```jldoctest
│ julia> @var x y t;
│ 
│ julia> H = Homotopy([x + t, y + 2t], [y, x], t);
│ 
│ julia> H([2, 3], 0)
│ 2-element Array{Int64,1}:
│  3
│  2
│ 
│ julia> H([2, 3], 1)
│ 2-element Array{Int64,1}:
│  4
│  4
│ ```
│ 
│ Subexpression:
│ 
│ H([2, 3], 1)
│ 
│ Evaluated output:
│ 
│ 2-element Vector{Int64}:
│  4
│  4
│ 
│ Expected output:
│ 
│ 2-element Array{Int64,1}:
│  4
│  4
│ 
│   diff =
│    Warning: Diff output requires color.
│    2-element Array{Int64,1}:
│     Vector{Int64}:
│     4
│     4
└ @ Documenter.DocTests ~/.julia/packages/Documenter/PLD7m/src/DocTests.jl:369
┌ Error: doctest failure in ~/.julia/packages/HomotopyContinuation/mJDHb/src/model_kit/expression.jl:759-768
│ 
│ ```jldoctest
│ julia> @var x y t a b;
│ 
│ julia> H = Homotopy([x^2 + t*a, y^2 + t*b], [x, y], t, [a, b]);
│ 
│ julia> H([2, 3], 1, [5, 2])
│ 2-element Array{Int64,1}:
│   9
│  11
│ ```
│ 
│ Subexpression:
│ 
│ H([2, 3], 1, [5, 2])
│ 
│ Evaluated output:
│ 
│ 2-element Vector{Int64}:
│   9
│  11
│ 
│ Expected output:
│ 
│ 2-element Array{Int64,1}:
│   9
│  11
│ 
│   diff =
│    Warning: Diff output requires color.
│    2-element Array{Int64,1}:
│      Vector{Int64}:
│      9
│     11
└ @ Documenter.DocTests ~/.julia/packages/Documenter/PLD7m/src/DocTests.jl:369
┌ Error: doctest failure in ~/.julia/packages/HomotopyContinuation/mJDHb/src/model_kit/expression.jl:634-643
│ 
│ ```jldoctest
│ julia> @var x y;
│ 
│ julia> F = System([x^2, y^2], [y, x]);
│ 
│ julia> F([2, 3])
│ 2-element Array{Int64,1}:
│  9
│  4
│ ```
│ 
│ Subexpression:
│ 
│ F([2, 3])
│ 
│ Evaluated output:
│ 
│ 2-element Vector{Int64}:
│  9
│  4
│ 
│ Expected output:
│ 
│ 2-element Array{Int64,1}:
│  9
│  4
│ 
│   diff =
│    Warning: Diff output requires color.
│    2-element Array{Int64,1}:
│     Vector{Int64}:
│     9
│     4
└ @ Documenter.DocTests ~/.julia/packages/Documenter/PLD7m/src/DocTests.jl:369
┌ Error: doctest failure in ~/.julia/packages/HomotopyContinuation/mJDHb/src/model_kit/expression.jl:646-655
│ 
│ ```jldoctest
│ julia> @var x y t a b;
│ 
│ julia> F = System([x^2 + a, y^2 + b^2], [x, y], [a, b]);
│ 
│ julia> F([2, 3], [5, 2])
│ 2-element Array{Int64,1}:
│   9
│  13
│ ```
│ 
│ Subexpression:
│ 
│ F([2, 3], [5, 2])
│ 
│ Evaluated output:
│ 
│ 2-element Vector{Int64}:
│   9
│  13
│ 
│ Expected output:
│ 
│ 2-element Array{Int64,1}:
│   9
│  13
│ 
│   diff =
│    Warning: Diff output requires color.
│    2-element Array{Int64,1}:
│      Vector{Int64}:
│      9
│     13
└ @ Documenter.DocTests ~/.julia/packages/Documenter/PLD7m/src/DocTests.jl:369
┌ Error: Doctesting failed
│   exception =
│    `makedocs` encountered a doctest error. Terminating build
│    Stacktrace:
│      [1] error(s::String)
│        @ Base ./error.jl:33
│      [2] runner(#unused#::Type{Documenter.Builder.Doctest}, doc::Documenter.Documents.Document)
│        @ Documenter.Builder ~/.julia/packages/Documenter/PLD7m/src/Builder.jl:204
│      [3] dispatch(#unused#::Type{Documenter.Builder.DocumentPipeline}, x::Documenter.Documents.Document)
│        @ Documenter.Utilities.Selectors ~/.julia/packages/Documenter/PLD7m/src/Utilities/Selectors.jl:167
│      [4] #2
│        @ ~/.julia/packages/Documenter/PLD7m/src/Documenter.jl:240 [inlined]
│      [5] cd(f::Documenter.var"#2#3"{Documenter.Documents.Document}, dir::String)
│        @ Base.Filesystem ./file.jl:104
│      [6] makedocs(; debug::Bool, format::Documenter.Writers.HTMLWriter.HTML, kwargs::Base.Iterators.Pairs{Symbol,Any,NTuple{5,Symbol},NamedTuple{(:root, :source, :sitename, :doctest, :modules),Tuple{String,String,String,Symbol,Vector{Module}}}})
│        @ Documenter ~/.julia/packages/Documenter/PLD7m/src/Documenter.jl:239
│      [7] (::Documenter.var"#all_doctests#30"{Bool,Vector{Module}})()
│        @ Documenter ~/.julia/packages/Documenter/PLD7m/src/Documenter.jl:728
│      [8] macro expansion
│        @ ~/.julia/packages/Documenter/PLD7m/src/Documenter.jl:744 [inlined]
│      [9] macro expansion
│        @ /workspace/srcdir/usr/share/julia/stdlib/v1.6/Test/src/Test.jl:1115 [inlined]
│     [10] doctest(source::String, modules::Vector{Module}; fix::Bool, testset::String)
│        @ Documenter ~/.julia/packages/Documenter/PLD7m/src/Documenter.jl:744
│     [11] doctest(package::Module; manual::Bool, testset::Nothing, kwargs::Base.Iterators.Pairs{Union{},Union{},Tuple{},NamedTuple{(),Tuple{}}})
│        @ Documenter ~/.julia/packages/Documenter/PLD7m/src/Documenter.jl:687
│     [12] doctest(package::Module)
│        @ Documenter ~/.julia/packages/Documenter/PLD7m/src/Documenter.jl:674
│     [13] top-level scope
│        @ ~/.julia/packages/HomotopyContinuation/mJDHb/test/runtests.jl:54
│     [14] top-level scope
│        @ /workspace/srcdir/usr/share/julia/stdlib/v1.6/Test/src/Test.jl:1115
│     [15] top-level scope
│        @ ~/.julia/packages/HomotopyContinuation/mJDHb/test/runtests.jl:27
│     [16] include(fname::String)
│        @ Base.MainInclude ./client.jl:444
│     [17] top-level scope
│        @ none:6
│     [18] eval(m::Module, e::Any)
│        @ Core ./boot.jl:340
│     [19] exec_options(opts::Base.JLOptions)
│        @ Base ./client.jl:260
│     [20] _start()
│        @ Base ./client.jl:485
└ @ Documenter ~/.julia/packages/Documenter/PLD7m/src/Documenter.jl:737
Doctests: HomotopyContinuation: Test Failed at /home/pkgeval/.julia/packages/Documenter/PLD7m/src/Documenter.jl:744
  Expression: all_doctests()
Stacktrace:
 [1] macro expansion
   @ ~/.julia/packages/Documenter/PLD7m/src/Documenter.jl:744 [inlined]
 [2] macro expansion
   @ /workspace/srcdir/usr/share/julia/stdlib/v1.6/Test/src/Test.jl:1115 [inlined]
 [3] doctest(source::String, modules::Vector{Module}; fix::Bool, testset::String)
   @ Documenter ~/.julia/packages/Documenter/PLD7m/src/Documenter.jl:744
Test Summary:                    | Pass  Fail  Total
HomotopyContinuation             | 1518     2   1520
  ModelKit                       |   82           82
  Utilities                      |  279     1    280
    Group actions                |    7            7
    UniquePoints                 |  216     1    217
    Multiplicities               |   10           10
    Polynomials                  |   34           34
    Multihomogeneous             |    4            4
    Misc                         |    8            8
  Norms                          |   18           18
  LinearAlgebra                  |   70           70
  AffinePatches                  |   22           22
  Problems                       |   59           59
  Systems                        |   59           59
  Homotopies                     |  123          123
  Predictors                     |   48           48
  NewtonCorrector                |   21           21
  CoreTracker                    |   76           76
  Valuation                      |   53           53
  Cauchy Endgame                 |   20           20
  PathTracker                    |  221          221
  Polyhedral                     |   18           18
  Overdetermined systems         |    5            5
  Solver                         |   84           84
  Result                         |  139          139
  Composition                    |    9            9
  ModelKit integration           |   19           19
  Monodromy                      |   68           68
  Root counts                    |   23           23
  path_info                      |    2            2
  Doctests: HomotopyContinuation |          1      1
ERROR: LoadError: Some tests did not pass: 1518 passed, 2 failed, 0 errored, 0 broken.
in expression starting at /home/pkgeval/.julia/packages/HomotopyContinuation/mJDHb/test/runtests.jl:26
ERROR: Package HomotopyContinuation errored during testing
Stacktrace:
  [1] pkgerror(msg::String)
    @ Pkg.Types /workspace/srcdir/usr/share/julia/stdlib/v1.6/Pkg/src/Types.jl:52
  [2] test(ctx::Pkg.Types.Context, pkgs::Vector{Pkg.Types.PackageSpec}; coverage::Bool, julia_args::Cmd, test_args::Cmd, test_fn::Nothing)
    @ Pkg.Operations /workspace/srcdir/usr/share/julia/stdlib/v1.6/Pkg/src/Operations.jl:1561
  [3] test(ctx::Pkg.Types.Context, pkgs::Vector{Pkg.Types.PackageSpec}; coverage::Bool, test_fn::Nothing, julia_args::Cmd, test_args::Cmd, kwargs::Base.Iterators.Pairs{Union{},Union{},Tuple{},NamedTuple{(),Tuple{}}})
    @ Pkg.API /workspace/srcdir/usr/share/julia/stdlib/v1.6/Pkg/src/API.jl:327
  [4] test(ctx::Pkg.Types.Context, pkgs::Vector{Pkg.Types.PackageSpec})
    @ Pkg.API /workspace/srcdir/usr/share/julia/stdlib/v1.6/Pkg/src/API.jl:314
  [5] #test#61
    @ /workspace/srcdir/usr/share/julia/stdlib/v1.6/Pkg/src/API.jl:67 [inlined]
  [6] test
    @ /workspace/srcdir/usr/share/julia/stdlib/v1.6/Pkg/src/API.jl:67 [inlined]
  [7] #test#60
    @ /workspace/srcdir/usr/share/julia/stdlib/v1.6/Pkg/src/API.jl:66 [inlined]
  [8] test
    @ /workspace/srcdir/usr/share/julia/stdlib/v1.6/Pkg/src/API.jl:66 [inlined]
  [9] test(pkg::String; kwargs::Base.Iterators.Pairs{Union{},Union{},Tuple{},NamedTuple{(),Tuple{}}})
    @ Pkg.API /workspace/srcdir/usr/share/julia/stdlib/v1.6/Pkg/src/API.jl:65
 [10] test(pkg::String)
    @ Pkg.API /workspace/srcdir/usr/share/julia/stdlib/v1.6/Pkg/src/API.jl:65
 [11] top-level scope
    @ none:16
