Running tests with Julia v1.3.1-pre.12
 Resolving package versions...
 Installed BinaryProvider ─ v0.5.8
  Updating `~/.julia/environments/v1.3/Project.toml`
  [b99e7846] + BinaryProvider v0.5.8
  Updating `~/.julia/environments/v1.3/Manifest.toml`
  [b99e7846] + BinaryProvider v0.5.8
  [8f399da3] + Libdl 
  [ea8e919c] + SHA 
   Testing BinaryProvider
 Resolving package versions...
[ Info: No changes
    Status `/tmp/jl_RugKFo/Manifest.toml`
  [b99e7846] BinaryProvider v0.5.8
  [2a0f44e3] Base64  [`@stdlib/Base64`]
  [ade2ca70] Dates  [`@stdlib/Dates`]
  [8ba89e20] Distributed  [`@stdlib/Distributed`]
  [b77e0a4c] InteractiveUtils  [`@stdlib/InteractiveUtils`]
  [76f85450] LibGit2  [`@stdlib/LibGit2`]
  [8f399da3] Libdl  [`@stdlib/Libdl`]
  [56ddb016] Logging  [`@stdlib/Logging`]
  [d6f4376e] Markdown  [`@stdlib/Markdown`]
  [44cfe95a] Pkg  [`@stdlib/Pkg`]
  [de0858da] Printf  [`@stdlib/Printf`]
  [3fa0cd96] REPL  [`@stdlib/REPL`]
  [9a3f8284] Random  [`@stdlib/Random`]
  [ea8e919c] SHA  [`@stdlib/SHA`]
  [9e88b42a] Serialization  [`@stdlib/Serialization`]
  [6462fe0b] Sockets  [`@stdlib/Sockets`]
  [8dfed614] Test  [`@stdlib/Test`]
  [cf7118a7] UUIDs  [`@stdlib/UUIDs`]
  [4ec0a83e] Unicode  [`@stdlib/Unicode`]
[ Info: Symlinks allowed in /tmp: true
[ Info: Probing for download engine...
[ Info: Probing curl as a possibility...
[ Info:   Probe successful for curl
[ Info: Found download engine curl
[ Info: Probing for compression engine...
[ Info: Probing tar as a possibility...
[ Info:   Probe successful for tar
[ Info: Found compression engine tar
[ Info: Probing for sh engine...
[ Info: Probing sh as a possibility...
[ Info:   Probe successful for sh
[ Info: Found sh engine sh
1
2
1
2
Terminated
Test Summary:   | Pass  Total
OutputCollector |   30     30
┌ Warning: Platform `totally FREEFORM text!!1!!!1!` is not an officially supported platform
└ @ BinaryProvider ~/.julia/packages/BinaryProvider/kcGxO/src/PlatformNames.jl:450
┌ Warning: Platform `invalid-triplet-here` is not an officially supported platform
└ @ BinaryProvider ~/.julia/packages/BinaryProvider/kcGxO/src/PlatformNames.jl:450
┌ Warning: Platform `aarch64-linux-gnueabihf` is not an officially supported platform
└ @ BinaryProvider ~/.julia/packages/BinaryProvider/kcGxO/src/PlatformNames.jl:450
┌ Warning: Platform `armv7l-linux-gnu` is not an officially supported platform
└ @ BinaryProvider ~/.julia/packages/BinaryProvider/kcGxO/src/PlatformNames.jl:450
┌ Warning: Platform `x86_64-w32-mingw64` is not an officially supported platform
└ @ BinaryProvider ~/.julia/packages/BinaryProvider/kcGxO/src/PlatformNames.jl:450
┌ Warning: Unable to determine libgfortran version from 'blah.so'; returning :gcc_any
└ @ BinaryProvider ~/.julia/packages/BinaryProvider/kcGxO/src/PlatformNames.jl:557
Test Summary: | Pass  Total
PlatformNames |  129    129
Test Summary: | Pass  Total
Prefix        |   11     11
Test Summary:           | Pass  Total
Tarball listing parsing |    2      2
[ Info: /tmp/jl_Lh3FTC/bin/fooifier does not exist, reporting unsatisfied
[ Info: FileProduct /tmp/jl_Lh3FTC/bin/fooifier not found
[ Info: Directory /tmp/jl_Lh3FTC/lib does not exist!
[ Info: Directory /tmp/jl_Lh3FTC/lib does not exist!
[ Info: FileProduct /tmp/jl_Lh3FTC/lib/libfoo.so not found
[ Info: FileProduct /tmp/jl_Lh3FTC/bin/fooifier found at /tmp/jl_Lh3FTC/bin/fooifier
[ Info: /tmp/jl_Lh3FTC/bin/fooifier is not executable, reporting unsatisfied
[ Info: FileProduct /tmp/jl_Lh3FTC/lib/libfoo.so found at /tmp/jl_Lh3FTC/lib/libfoo.so
[ Info: Found a valid dl path libfoo.so while looking for libfoo
[ Info: /tmp/jl_Lh3FTC/lib/libfoo.so matches our search criteria of libfoo
[ Info: /tmp/jl_Lh3FTC/lib/libfoo.so cannot be dlopen'ed
[ Info: Could not locate libfoo inside /tmp/jl_Lh3FTC/lib
[ Info: FileProduct /tmp/jl_Lh3FTC/lib/libfoo.so found at /tmp/jl_Lh3FTC/lib/libfoo.so
[ Info: Found a valid dl path libfoo.so while looking for libfoo
[ Info: /tmp/jl_Lh3FTC/lib/libfoo.so matches our search criteria of libfoo
[ Info: /tmp/jl_Lh3FTC/lib/libfoo.so cannot be dlopen'ed
[ Info: Could not locate libfoo inside /tmp/jl_Lh3FTC/lib
[ Info: Found a valid dl path libfoo.dll while looking for libfoo
[ Info: /tmp/jl_Lh3FTC/bin/libfoo.dll matches our search criteria of libfoo
[ Info: Found a valid dl path libfoo.dll while looking for libfoo
[ Info: /tmp/jl_Lh3FTC/bin/libfoo.dll matches our search criteria of libfoo
[ Info: Found a valid dl path libfoo.dll while looking for libfoo
[ Info: /tmp/jl_Lh3FTC/bin/libfoo.dll matches our search criteria of libfoo
[ Info: Found a valid dl path libfoo.dll while looking for libfoo
[ Info: /tmp/jl_Lh3FTC/bin/libfoo.dll matches our search criteria of libfoo
[ Info: Found a valid dl path libfoo.1.so while looking for libfoo
[ Info: /tmp/jl_bTUu0F/lib/libfoo.1.so matches our search criteria of libfoo
[ Info: Found a valid dl path libfoo.so while looking for libfoo
[ Info: /tmp/jl_T4Sp7I/lib/libfoo.so matches our search criteria of libfoo
[ Info: Found a valid dl path libfoo.so.1 while looking for libfoo
[ Info: /tmp/jl_7cGoeM/lib/libfoo.so.1 matches our search criteria of libfoo
[ Info: Found a valid dl path libfoo.so.1.2 while looking for libfoo
[ Info: /tmp/jl_T8lrlP/lib/libfoo.so.1.2 matches our search criteria of libfoo
[ Info: Found a valid dl path libfoo.so.1.2.3 while looking for libfoo
[ Info: /tmp/jl_ZwDxsS/lib/libfoo.so.1.2.3 matches our search criteria of libfoo
[ Info: Could not locate libfoo inside /tmp/jl_7b7pRV/lib
[ Info: Could not locate libfoo inside /tmp/jl_ZfJqgZ/lib
[ Info: FileProduct /tmp/jl_VZOQ47/foo/$target/bar found at /tmp/jl_VZOQ47/foo/x86_64-linux-gnu-gcc7-cxx11/bar
[ Info: FileProduct /tmp/jl_VZOQ47/foo/${target}/bar found at /tmp/jl_VZOQ47/foo/x86_64-linux-gnu-gcc7-cxx11/bar
Test Summary: | Pass  Total
Products      |   32     32
[21:46:44] ./
[21:46:44] ./bin/
[21:46:44] ./bin/bar.sh
[21:46:44] ./lib/
[21:46:44] ./lib/baz.so
[21:46:44] ./etc/
[21:46:44] ./etc/qux.conf
[ Info: SHA256 of libfoo.v1.0.0.x86_64-linux-gnu-gcc7-cxx11.tar.gz: df0ebdf52e583b3bdde454a0df2a83ccb2bd9c2b446ad398c647d63d289e3ea4
[ Info: No hash cache found
[ Info: Calculated hash df0ebdf52e583b3bdde454a0df2a83ccb2bd9c2b446ad398c647d63d289e3ea4 for file ./libfoo.v1.0.0.x86_64-linux-gnu-gcc7-cxx11.tar.gz
[ Info: Installing ./libfoo.v1.0.0.x86_64-linux-gnu-gcc7-cxx11.tar.gz into /tmp/jl_f1Oqgo
[ Info: Removing files installed by manifests/libfoo.v1.0.0.x86_64-linux-gnu-gcc7-cxx11.list
[ Info:   /tmp/jl_f1Oqgo/bin/bar.sh does not exist, but ignoring
[ Info:   lib/baz.so removed
[ Info:   Culling empty directory lib
[ Info:   etc/qux.conf removed
[ Info:   Culling empty directory etc
[ Info:   manifests/libfoo.v1.0.0.x86_64-linux-gnu-gcc7-cxx11.list removed
┌ Warning: Platform `x86_64-juliaos-chartreuse` is not an officially supported platform
└ @ BinaryProvider ~/.julia/packages/BinaryProvider/kcGxO/src/PlatformNames.jl:450
[ Info: No hash cache found
[ Info: Calculated hash df0ebdf52e583b3bdde454a0df2a83ccb2bd9c2b446ad398c647d63d289e3ea4 for file libfoo.v1.0.0.x86_64-apple-darwin14.tar.gz
[ Info: Installing libfoo.v1.0.0.x86_64-apple-darwin14.tar.gz into /tmp/jl_lpimlB
┌ Warning: Platform `not-a-triplet` is not an officially supported platform
└ @ BinaryProvider ~/.julia/packages/BinaryProvider/kcGxO/src/PlatformNames.jl:450
[ Info: No hash cache found
[ Info: Calculated hash df0ebdf52e583b3bdde454a0df2a83ccb2bd9c2b446ad398c647d63d289e3ea4 for file libfoo.v1.0.0.not-a-triplet.tar.gz
[ Info: Installing libfoo.v1.0.0.not-a-triplet.tar.gz into /tmp/jl_1WWUUO
Test Summary: | Pass  Total
Packaging     |   32     32
[ Info: This should say; no hash cache found
[ Info: No hash cache found
[ Info: Calculated hash 9f86d081884c7d659a2feaa0c55ad015a3bf4f1b2b0b822cd15d6c15b0f00a08 for file /tmp/jl_rTkXg4/foo
[ Info: This should say; hash cache is consistent
[ Info: Hash cache is consistent, returning true
[ Info: This should say; file has been modified
[ Info: File has been modified, hash cache invalidated
[ Info: Hash cache is consistent, returning true
[ Info: This should say; hash has changed
[ Info: Verification hash mismatch, hash cache invalidated
Test Summary: | Pass  Total
Verification  |   11     11
[ Info: Downloading https://github.com/staticfloat/small_bin/raw/f1a92f5eafbd30a0c6a8efb6947485b0f6d1bec3/socrates.tar.gz to /tmp/jl_r3b6FK-download.gz...
[21:46:50] #=#=#                                                                         [21:46:50] [21:46:51] ######################################################################## 100.0%[21:46:51] ######################################################################## 100.0%
[ Info: No hash cache found
[ Info: Calculated hash e65d2f13f2085f2c279830e863292312a72930fee5ba3c792b14c33ce5c5cc58 for file /tmp/jl_r3b6FK-download.gz
[ Info: Unpacking /tmp/jl_r3b6FK-download.gz into /tmp/jl_HC3vtp/target...
[ Info: Downloading https://github.com/staticfloat/small_bin/raw/f1a92f5eafbd30a0c6a8efb6947485b0f6d1bec3/socrates.tar.bz2 to /tmp/jl_lVD55t-download.bz2...
[21:46:51] #=#=#                                                                         [21:46:51] ##O#- #                                                                       [21:46:51] [21:46:51] ######################################################################## 100.0%##O=#  #                                                                      [21:46:51] [21:46:51] ######################################################################## 100.0%
[ Info: No hash cache found
[ Info: Calculated hash 13fc17b97be41763b02cbb80e9d048302cec3bd3d446c2ed6e8210bddcd3ac76 for file /tmp/jl_lVD55t-download.bz2
[ Info: Unpacking /tmp/jl_lVD55t-download.bz2 into /tmp/jl_30c5n7/target...
[ Info: Downloading https://github.com/staticfloat/small_bin/raw/f1a92f5eafbd30a0c6a8efb6947485b0f6d1bec3/socrates.tar.xz to /tmp/jl_HnBgDg-download.xz...
[21:46:51] #=#=#                                                                         [21:46:51] [21:46:52] ######################################################################## 100.0%##O#- #                                                                       [21:46:52] [21:46:52] ######################################################################## 100.0%
[ Info: No hash cache found
[ Info: Calculated hash 61bcf109fcb749ee7b6a570a6057602c08c836b6f81091eab7aa5f5870ec6475 for file /tmp/jl_HnBgDg-download.xz
[ Info: Unpacking /tmp/jl_HnBgDg-download.xz into /tmp/jl_DNJFmS/target...
Test Summary: | Pass  Total
Downloading   |    6      6
[ Info: Downloading https://github.com/staticfloat/small_bin/raw/master/collapse_the_symlink/collapse_the_symlink.tar.gz to /tmp/jl_x8IkB6-download.gz...
[21:46:52] #=#=#                                                                         [21:46:52] [21:46:52] ######################################################################## 100.0%[21:46:52] ######################################################################## 100.0%
[ Info: No hash cache found
[ Info: Calculated hash 956c1201405f64d3465cc28cb0dec9d63c11a08cad28c381e13bb22e1fc469d3 for file /tmp/jl_x8IkB6-download.gz
[ Info: Unpacking /tmp/jl_x8IkB6-download.gz into /tmp/jl_bDPhCG/target...
┌ Warning: Could not copy /tmp/jl_XYXbrx/collapse_the_symlink/broken to /tmp/jl_bDPhCG/target/collapse_the_symlink/broken
└ @ BinaryProvider ~/.julia/packages/BinaryProvider/kcGxO/src/PlatformEngines.jl:684
Test Summary:       | Pass  Total
Copyderef unpacking |    6      6
Test Summary:           | Pass  Total
Download GitHub API #88 |    1      1
Test Summary:   | Pass  Total
choose_download |   12     12
┌ Warning: Could not extract the platform key of https://github.com/staticfloat/small_bin/raw/51b13b44feb2a262e2e04690bfa54d03167533f2/libfoo/libfoo.x86_64-linux-gnu.tar.gz; continuing...
└ @ BinaryProvider ~/.julia/packages/BinaryProvider/kcGxO/src/Prefix.jl:185
[ Info: Downloading https://github.com/staticfloat/small_bin/raw/51b13b44feb2a262e2e04690bfa54d03167533f2/libfoo/libfoo.x86_64-linux-gnu.tar.gz to /tmp/jl_1rWngB/downloads/libfoo.x86_64-linux-gnu.tar.gz...
[21:46:57] #=#=#                                                                         [21:46:57] [21:46:58] ######################################################################## 100.0%[21:46:58] ###################                                                       27.2%[21:46:58] ######################################################################## 100.0%
[ Info: No hash cache found
[ Info: Calculated hash 5208c63a9d07e592c78f541fc13caa8cd191b11e7e77b31d407237c2b13ec391 for file /tmp/jl_1rWngB/downloads/libfoo.x86_64-linux-gnu.tar.gz
[ Info: Installing /tmp/jl_1rWngB/downloads/libfoo.x86_64-linux-gnu.tar.gz into /tmp/jl_1rWngB
[ Info: Found a valid dl path libfoo.so while looking for libfoo
[ Info: /tmp/jl_1rWngB/lib/libfoo.so matches our search criteria of libfoo
[ Info: Removing files installed by manifests/libfoo.x86_64-linux-gnu.list
[ Info:   logs/libfoo.log removed
[ Info:   Culling empty directory logs
[ Info:   lib/libfoo.so removed
[ Info:   Culling empty directory lib
[ Info:   bin/fooifier removed
[ Info:   Culling empty directory bin
[ Info:   manifests/libfoo.x86_64-linux-gnu.list removed
[ Info: Downloading https://github.com/staticfloat/small_bin/raw/51b13b44feb2a262e2e04690bfa54d03167533f2/libfoo/libfoo.x86_64-linux-gnu.tar.gz to /tmp/jl_3ICMQe-download.gz...
[21:46:58] #=#=#                                                                         [21:46:58] ##O#- #                                                                       [21:46:58] [21:46:58] ######################################################################## 100.0%
[ Info: Found a valid dl path libfoo.so while looking for libfoo
[ Info: /tmp/jl_1rWngB/lib/libfoo.so matches our search criteria of libfoo
[ Info: Downloading https://github.com/staticfloat/small_bin/raw/51b13b44feb2a262e2e04690bfa54d03167533f2/libfoo/libfoo.x86_64-linux-gnu.tar.gz to /tmp/jl_1l3E3S-download.gz...
[21:46:58] [21:46:58] ######################################################################## 100.0%[21:46:58] ######################################################################## 100.0%
[ Info: Downloading https://github.com/staticfloat/small_bin/raw/51b13b44feb2a262e2e04690bfa54d03167533f2/libfoo/libfoo.x86_64-linux-gnu.tar.gz to /tmp/jl_1rWngB/libfoo.tar.gz...
[21:46:58] #=#=#                                                                         [21:46:58] [21:46:58] ######################################################################## 100.0%[21:46:58] ######################################################################## 100.0%
[ Info: No hash cache found
[ Info: Calculated hash 5208c63a9d07e592c78f541fc13caa8cd191b11e7e77b31d407237c2b13ec391 for file /tmp/jl_1rWngB/libfoo.tar.gz
[ Info: Destination file /tmp/jl_1rWngB/libfoo.tar.gz already exists, verifying...
[ Info: Hash cache is consistent, returning true
[ Info: File has been modified, hash cache invalidated
[ Info: Verification failed, re-downloading...
[ Info: Downloading https://github.com/staticfloat/small_bin/raw/51b13b44feb2a262e2e04690bfa54d03167533f2/libfoo/libfoo.x86_64-linux-gnu.tar.gz to /tmp/jl_1rWngB/libfoo.tar.gz...
[21:47:00] [21:47:00] ######################################################################## 100.0%[21:47:00] ######################################################################## 100.0%[21:47:00] ######################################################################## 100.0%[21:47:00] ######################################################################## 100.0%
[ Info: Continued download didn't work, restarting from scratch
[ Info: Downloading https://github.com/staticfloat/small_bin/raw/51b13b44feb2a262e2e04690bfa54d03167533f2/libfoo/libfoo.x86_64-linux-gnu.tar.gz to /tmp/jl_1rWngB/libfoo.tar.gz...
[21:47:01] #=#=#                                                                         [21:47:01] [21:47:01] ######################################################################## 100.0%
┌ Warning: Could not extract the platform key of https://github.com/staticfloat/small_bin/raw/51b13b44feb2a262e2e04690bfa54d03167533f2/libfoo/libfoo.x86_64-linux-gnu.tar.gz; continuing...
└ @ BinaryProvider ~/.julia/packages/BinaryProvider/kcGxO/src/Prefix.jl:185
[ Info: Destination file /tmp/jl_1rWngB/downloads/libfoo.x86_64-linux-gnu.tar.gz already exists, verifying...
┌ Warning: Could not extract the platform key of https://github.com/staticfloat/small_bin/raw/51b13b44feb2a262e2e04690bfa54d03167533f2/libfoo/libfoo.x86_64-linux-gnu.tar.gz; continuing...
└ @ BinaryProvider ~/.julia/packages/BinaryProvider/kcGxO/src/Prefix.jl:185
[ Info: Verification failed, re-downloading...
[ Info: Downloading https://github.com/staticfloat/small_bin/raw/51b13b44feb2a262e2e04690bfa54d03167533f2/libfoo/libfoo.x86_64-linux-gnu.tar.gz to /tmp/jl_1rWngB/downloads/libfoo.x86_64-linux-gnu.tar.gz...
[21:47:01] [21:47:01] ######################################################################## 100.0%[21:47:01] ######################################################################## 100.0%[21:47:01] ######################################################################## 100.0%[21:47:01] ######################################################################## 100.0%
[ Info: Continued download didn't work, restarting from scratch
[ Info: Downloading https://github.com/staticfloat/small_bin/raw/51b13b44feb2a262e2e04690bfa54d03167533f2/libfoo/libfoo.x86_64-linux-gnu.tar.gz to /tmp/jl_1rWngB/downloads/libfoo.x86_64-linux-gnu.tar.gz...
[21:47:01] [21:47:01] ######################################################################## 100.0%[21:47:01] ######################################################################## 100.0%
[ Info: Installing /tmp/jl_1rWngB/downloads/libfoo.x86_64-linux-gnu.tar.gz into /tmp/jl_1rWngB
[ Info: logs/libfoo.log already exists, force-removing
[ Info: lib/libfoo.so already exists, force-removing
[ Info: bin/fooifier already exists, force-removing
[ Info: Found a valid dl path libfoo.so while looking for libfoo
[ Info: /tmp/jl_1rWngB/lib/libfoo.so matches our search criteria of libfoo
┌ Warning: Could not extract the platform key of https://github.com/staticfloat/small_bin/raw/51b13b44feb2a262e2e04690bfa54d03167533f2/libfoo/libfoo.x86_64-linux-gnu.tar.gz; continuing...
└ @ BinaryProvider ~/.julia/packages/BinaryProvider/kcGxO/src/Prefix.jl:185
[ Info: Downloading https://github.com/staticfloat/small_bin/raw/51b13b44feb2a262e2e04690bfa54d03167533f2/libfoo/libfoo.x86_64-linux-gnu.tar.gz to /tmp/jl_1rWngB/downloads2/tarball.tar.gz...
[21:47:01] #=#=#                                                                         [21:47:01] [21:47:01] ######################################################################## 100.0%[21:47:01] ######################################################################## 100.0%
[ Info: No hash cache found
[ Info: Calculated hash 5208c63a9d07e592c78f541fc13caa8cd191b11e7e77b31d407237c2b13ec391 for file /tmp/jl_1rWngB/downloads2/tarball.tar.gz
[ Info: Installing /tmp/jl_1rWngB/downloads2/tarball.tar.gz into /tmp/jl_1rWngB
[ Info: Removing files installed by manifests/libfoo.x86_64-linux-gnu.list
[ Info:   logs/libfoo.log removed
[ Info:   Culling empty directory logs
[ Info:   lib/libfoo.so removed
[ Info:   Culling empty directory lib
[ Info:   bin/fooifier removed
[ Info:   Culling empty directory bin
[ Info:   manifests/libfoo.x86_64-linux-gnu.list removed
[ Info: Found a valid dl path libfoo.so while looking for libfoo
[ Info: /tmp/jl_1rWngB/lib/libfoo.so matches our search criteria of libfoo
[ Info: Downloading http://localhost:1/this_is_not_a_file.v1.0.0.x86_64-linux-gnu-gcc7-cxx11.tar.gz to /tmp/jl_1rWngB/downloads/this_is_not_a_file.v1.0.0.x86_64-linux-gnu-gcc7-cxx11.tar.gz...
[21:47:02] 
[21:47:02] curl: (7) Failed to connect to localhost port 1: Connection refused
Test Summary:      | Pass  Total
Libfoo Downloading |   32     32
┌ Warning: Could not extract the platform key of https://github.com/staticfloat/small_bin/raw/51b13b44feb2a262e2e04690bfa54d03167533f2/libfoo/libfoo.x86_64-linux-gnu.tar.gz; continuing...
└ @ BinaryProvider ~/.julia/packages/BinaryProvider/kcGxO/src/Prefix.jl:185
[ Info: Downloading https://github.com/staticfloat/small_bin/raw/51b13b44feb2a262e2e04690bfa54d03167533f2/libfoo/libfoo.x86_64-linux-gnu.tar.gz to /root/.julia/packages/BinaryProvider/kcGxO/test/LibFoo.jl/deps/usr/downloads/libfoo.x86_64-linux-gnu.tar.gz...
[21:47:10] [21:47:10] ######################################################################## 100.0%[21:47:10] ######################################################################## 100.0%
[ Info: No hash cache found
[ Info: Calculated hash 5208c63a9d07e592c78f541fc13caa8cd191b11e7e77b31d407237c2b13ec391 for file /root/.julia/packages/BinaryProvider/kcGxO/test/LibFoo.jl/deps/usr/downloads/libfoo.x86_64-linux-gnu.tar.gz
[ Info: Installing /root/.julia/packages/BinaryProvider/kcGxO/test/LibFoo.jl/deps/usr/downloads/libfoo.x86_64-linux-gnu.tar.gz into /root/.julia/packages/BinaryProvider/kcGxO/test/LibFoo.jl/deps/usr
  Updating registry at `~/.julia/registries/General`
  Updating git-repo `https://github.com/JuliaRegistries/General.git`
[?25l[2K[?25h┌ Warning: Some registries failed to update:
│     — /root/.julia/registries/General — failed to fetch from repo
└ @ Pkg.Types /workspace/srcdir/julia/usr/share/julia/stdlib/v1.3/Pkg/src/Types.jl:1199
 Resolving package versions...
 Installed Compat ─ v3.0.0
  Updating `~/.julia/packages/BinaryProvider/kcGxO/test/LibFoo.jl/Project.toml`
  [34da2185] + Compat v3.0.0
  [8f399da3] + Libdl 
  [8dfed614] + Test 
  Updating `~/.julia/packages/BinaryProvider/kcGxO/test/LibFoo.jl/Manifest.toml`
  [34da2185] + Compat v3.0.0
  [2a0f44e3] + Base64 
  [ade2ca70] + Dates 
  [8bb1440f] + DelimitedFiles 
  [8ba89e20] + Distributed 
  [b77e0a4c] + InteractiveUtils 
  [76f85450] + LibGit2 
  [8f399da3] + Libdl 
  [37e2e46d] + LinearAlgebra 
  [56ddb016] + Logging 
  [d6f4376e] + Markdown 
  [a63ad114] + Mmap 
  [44cfe95a] + Pkg 
  [de0858da] + Printf 
  [3fa0cd96] + REPL 
  [9a3f8284] + Random 
  [ea8e919c] + SHA 
  [9e88b42a] + Serialization 
  [1a1011a3] + SharedArrays 
  [6462fe0b] + Sockets 
  [2f01184e] + SparseArrays 
  [10745b16] + Statistics 
  [8dfed614] + Test 
  [cf7118a7] + UUIDs 
  [4ec0a83e] + Unicode 
   Testing LibFoo
 Resolving package versions...
   Testing LibFoo tests passed 
Test Summary: | Pass  Total
LibFoo.jl     |    4      4
   Testing BinaryProvider tests passed 
