Julia Version 1.5.0-beta1.22
Commit c594048585 (2020-06-05 13:32 UTC)
Platform Info:
  OS: Linux (x86_64-linux-gnu)
  CPU: Intel(R) Xeon(R) Silver 4114 CPU @ 2.20GHz
  WORD_SIZE: 64
  LIBM: libopenlibm
  LLVM: libLLVM-9.0.1 (ORCJIT, skylake)
Environment:
  JULIA_DEPOT_PATH = ::/usr/local/share/julia
  JULIA_NUM_THREADS = 2

  Resolving package versions...
  Installed OpenSpecFun_jll ────────────── v0.5.3+3
  Installed LaTeXStrings ───────────────── v1.1.0
  Installed ProjectiveVectors ──────────── v1.1.2
  Installed MixedSubdivisions ──────────── v1.0.0
  Installed StaticPolynomials ──────────── v1.3.3
  Installed RecipesBase ────────────────── v1.0.1
  Installed GenericSchur ───────────────── v0.4.0
  Installed HomotopyContinuation ───────── v1.4.4
  Installed CompilerSupportLibraries_jll ─ v0.3.3+0
  Installed Mocking ────────────────────── v0.7.1
  Installed Formatting ─────────────────── v0.4.1
  Installed ElasticArrays ──────────────── v1.2.1
  Installed Quadmath ───────────────────── v0.5.4
  Installed MacroTools ─────────────────── v0.5.5
  Installed SpecialFunctions ───────────── v0.10.3
  Installed MutableArithmetics ─────────── v0.2.9
  Installed Libiconv_jll ───────────────── v1.16.0+2
  Installed DataAPI ────────────────────── v1.3.0
  Installed FixedPolynomials ───────────── v0.4.0
  Installed EzXML ──────────────────────── v1.1.0
  Installed OrderedCollections ─────────── v1.2.0
  Installed StaticArrays ───────────────── v0.12.3
  Installed DoubleFloats ───────────────── v1.1.10
  Installed Crayons ────────────────────── v4.0.2
  Installed Requires ───────────────────── v1.0.1
  Installed XML2_jll ───────────────────── v2.9.9+4
  Installed TableTraits ────────────────── v1.0.0
  Installed ExprTools ──────────────────── v0.1.1
  Installed Tables ─────────────────────── v1.0.4
  Installed Polynomials ────────────────── v1.1.1
  Installed Parameters ─────────────────── v0.12.1
  Installed PrettyTables ───────────────── v0.9.0
  Installed Reexport ───────────────────── v0.2.0
  Installed Zlib_jll ───────────────────── v1.2.11+10
  Installed DataValueInterfaces ────────── v1.0.0
  Installed GenericSVD ─────────────────── v0.3.0
  Installed DynamicPolynomials ─────────── v0.3.10
  Installed ProgressMeter ──────────────── v1.3.0
  Installed IteratorInterfaceExtensions ── v1.0.0
  Installed MultivariatePolynomials ────── v0.3.9
  Installed Latexify ───────────────────── v0.13.3
  Installed UnPack ─────────────────────── v1.0.1
  Installed Adapt ──────────────────────── v1.1.0
  Installed TreeViews ──────────────────── v0.3.0
  Installed Intervals ──────────────────── v1.2.0
  Installed DataStructures ─────────────── v0.17.17
  Installed TimeZones ──────────────────── v1.2.0
Updating `~/.julia/environments/v1.5/Project.toml`
  [f213a82b] + HomotopyContinuation v1.4.4
Updating `~/.julia/environments/v1.5/Manifest.toml`
  [79e6a3ab] + Adapt v1.1.0
  [e66e0078] + CompilerSupportLibraries_jll v0.3.3+0
  [a8cc5b0e] + Crayons v4.0.2
  [9a962f9c] + DataAPI v1.3.0
  [864edb3b] + DataStructures v0.17.17
  [e2d170a0] + DataValueInterfaces v1.0.0
  [497a8b3b] + DoubleFloats v1.1.10
  [7c1d4256] + DynamicPolynomials v0.3.10
  [fdbdab4c] + ElasticArrays v1.2.1
  [e2ba6199] + ExprTools v0.1.1
  [8f5d6c58] + EzXML v1.1.0
  [3dd14ad9] + FixedPolynomials v0.4.0
  [59287772] + Formatting v0.4.1
  [01680d73] + GenericSVD v0.3.0
  [c145ed77] + GenericSchur v0.4.0
  [f213a82b] + HomotopyContinuation v1.4.4
  [d8418881] + Intervals v1.2.0
  [82899510] + IteratorInterfaceExtensions v1.0.0
  [b964fa9f] + LaTeXStrings v1.1.0
  [23fbe1c1] + Latexify v0.13.3
  [94ce4f54] + Libiconv_jll v1.16.0+2
  [1914dd2f] + MacroTools v0.5.5
  [291d046c] + MixedSubdivisions v1.0.0
  [78c3b35d] + Mocking v0.7.1
  [102ac46a] + MultivariatePolynomials v0.3.9
  [d8a4904e] + MutableArithmetics v0.2.9
  [efe28fd5] + OpenSpecFun_jll v0.5.3+3
  [bac558e1] + OrderedCollections v1.2.0
  [d96e819e] + Parameters v0.12.1
  [f27b6e38] + Polynomials v1.1.1
  [08abe8d2] + PrettyTables v0.9.0
  [92933f4c] + ProgressMeter v1.3.0
  [01f381cc] + ProjectiveVectors v1.1.2
  [be4d8f0f] + Quadmath v0.5.4
  [3cdcf5f2] + RecipesBase v1.0.1
  [189a3867] + Reexport v0.2.0
  [ae029012] + Requires v1.0.1
  [276daf66] + SpecialFunctions v0.10.3
  [90137ffa] + StaticArrays v0.12.3
  [62e018b1] + StaticPolynomials v1.3.3
  [3783bdb8] + TableTraits v1.0.0
  [bd369af6] + Tables v1.0.4
  [f269a46b] + TimeZones v1.2.0
  [a2a6695c] + TreeViews v0.3.0
  [3a884ed6] + UnPack v1.0.1
  [02c8fc9c] + XML2_jll v2.9.9+4
  [83775a58] + Zlib_jll v1.2.11+10
  [2a0f44e3] + Base64
  [ade2ca70] + Dates
  [8ba89e20] + Distributed
  [9fa8497b] + Future
  [b77e0a4c] + InteractiveUtils
  [76f85450] + LibGit2
  [8f399da3] + Libdl
  [37e2e46d] + LinearAlgebra
  [56ddb016] + Logging
  [d6f4376e] + Markdown
  [44cfe95a] + Pkg
  [de0858da] + Printf
  [3fa0cd96] + REPL
  [9a3f8284] + Random
  [ea8e919c] + SHA
  [9e88b42a] + Serialization
  [6462fe0b] + Sockets
  [2f01184e] + SparseArrays
  [10745b16] + Statistics
  [8dfed614] + Test
  [cf7118a7] + UUIDs
  [4ec0a83e] + Unicode
   Building TimeZones → `~/.julia/packages/TimeZones/OjMoF/deps/build.log`
    Testing HomotopyContinuation
Status `/tmp/jl_HEL2Ec/Project.toml`
  [e30172f5] Documenter v0.24.11
  [497a8b3b] DoubleFloats v1.1.10
  [7c1d4256] DynamicPolynomials v0.3.10
  [fdbdab4c] ElasticArrays v1.2.1
  [26cc04aa] FiniteDifferences v0.10.2
  [3dd14ad9] FixedPolynomials v0.4.0
  [f213a82b] HomotopyContinuation v1.4.4
  [23fbe1c1] Latexify v0.13.3
  [291d046c] MixedSubdivisions v1.0.0
  [102ac46a] MultivariatePolynomials v0.3.9
  [bac558e1] OrderedCollections v1.2.0
  [d96e819e] Parameters v0.12.1
  [4c526841] PolynomialTestSystems v0.1.4
  [08abe8d2] PrettyTables v0.9.0
  [01f381cc] ProjectiveVectors v1.1.2
  [90137ffa] StaticArrays v0.12.3
  [62e018b1] StaticPolynomials v1.3.3
  [a2a6695c] TreeViews v0.3.0
  [37e2e46d] LinearAlgebra
  [de0858da] Printf
  [9a3f8284] Random
  [8dfed614] Test
Status `/tmp/jl_HEL2Ec/Manifest.toml`
  [79e6a3ab] Adapt v1.1.0
  [e66e0078] CompilerSupportLibraries_jll v0.3.3+0
  [a8cc5b0e] Crayons v4.0.2
  [9a962f9c] DataAPI v1.3.0
  [864edb3b] DataStructures v0.17.17
  [e2d170a0] DataValueInterfaces v1.0.0
  [ffbed154] DocStringExtensions v0.8.1
  [e30172f5] Documenter v0.24.11
  [497a8b3b] DoubleFloats v1.1.10
  [7c1d4256] DynamicPolynomials v0.3.10
  [fdbdab4c] ElasticArrays v1.2.1
  [e2ba6199] ExprTools v0.1.1
  [8f5d6c58] EzXML v1.1.0
  [26cc04aa] FiniteDifferences v0.10.2
  [3dd14ad9] FixedPolynomials v0.4.0
  [59287772] Formatting v0.4.1
  [01680d73] GenericSVD v0.3.0
  [c145ed77] GenericSchur v0.4.0
  [f213a82b] HomotopyContinuation v1.4.4
  [d8418881] Intervals v1.2.0
  [82899510] IteratorInterfaceExtensions v1.0.0
  [682c06a0] JSON v0.21.0
  [b964fa9f] LaTeXStrings v1.1.0
  [23fbe1c1] Latexify v0.13.3
  [94ce4f54] Libiconv_jll v1.16.0+2
  [1914dd2f] MacroTools v0.5.5
  [291d046c] MixedSubdivisions v1.0.0
  [78c3b35d] Mocking v0.7.1
  [102ac46a] MultivariatePolynomials v0.3.9
  [d8a4904e] MutableArithmetics v0.2.9
  [efe28fd5] OpenSpecFun_jll v0.5.3+3
  [bac558e1] OrderedCollections v1.2.0
  [d96e819e] Parameters v0.12.1
  [69de0a69] Parsers v1.0.4
  [4c526841] PolynomialTestSystems v0.1.4
  [f27b6e38] Polynomials v1.1.1
  [08abe8d2] PrettyTables v0.9.0
  [92933f4c] ProgressMeter v1.3.0
  [01f381cc] ProjectiveVectors v1.1.2
  [be4d8f0f] Quadmath v0.5.4
  [3cdcf5f2] RecipesBase v1.0.1
  [189a3867] Reexport v0.2.0
  [ae029012] Requires v1.0.1
  [276daf66] SpecialFunctions v0.10.3
  [90137ffa] StaticArrays v0.12.3
  [62e018b1] StaticPolynomials v1.3.3
  [3783bdb8] TableTraits v1.0.0
  [bd369af6] Tables v1.0.4
  [f269a46b] TimeZones v1.2.0
  [a2a6695c] TreeViews v0.3.0
  [3a884ed6] UnPack v1.0.1
  [02c8fc9c] XML2_jll v2.9.9+4
  [83775a58] Zlib_jll v1.2.11+10
  [2a0f44e3] Base64
  [ade2ca70] Dates
  [8ba89e20] Distributed
  [9fa8497b] Future
  [b77e0a4c] InteractiveUtils
  [76f85450] LibGit2
  [8f399da3] Libdl
  [37e2e46d] LinearAlgebra
  [56ddb016] Logging
  [d6f4376e] Markdown
  [a63ad114] Mmap
  [44cfe95a] Pkg
  [de0858da] Printf
  [3fa0cd96] REPL
  [9a3f8284] Random
  [ea8e919c] SHA
  [9e88b42a] Serialization
  [6462fe0b] Sockets
  [2f01184e] SparseArrays
  [10745b16] Statistics
  [8dfed614] Test
  [cf7118a7] UUIDs
  [4ec0a83e] Unicode
┌ Warning: `setup!(tracker::CoreTracker, x, t, t₀; kwargs...)` is deprecated, use `init!(tracker, x, t, t₀; kwargs...)` instead.
│   caller = top-level scope at core_tracker_test.jl:40
└ @ Core ~/.julia/packages/HomotopyContinuation/mJDHb/test/core_tracker_test.jl:40
┌ Warning: Solutions are now automatically refined to maximal achievable accuracy.
└ @ HomotopyContinuation ~/.julia/packages/HomotopyContinuation/mJDHb/src/core_tracker.jl:1410
┌ Warning: `set_refinement_accuracy!` is deprecated. Solutions are now automatically refined to maximal achievable accuracy.
└ @ HomotopyContinuation ~/.julia/packages/HomotopyContinuation/mJDHb/src/core_tracker.jl:1420
┌ Warning: `max_refinement_iters` is deprecated. Solutions are now automatically refined to the maximal achievable accuracy.
└ @ HomotopyContinuation ~/.julia/packages/HomotopyContinuation/mJDHb/src/core_tracker.jl:1429
┌ Warning: `set_max_refinement_iters` is deprecated. Solutions are now automatically refined to the maximal achievable accuracy.
└ @ HomotopyContinuation ~/.julia/packages/HomotopyContinuation/mJDHb/src/core_tracker.jl:1439
Univariate singular: 2,3,4,5,6,7,8,9,10,11,12,
Wilkinson: 1,2,3,4,5,6,7,8,9,10,11,12,13,14,15,16,17,18,
Computing mixed cells... 1 	 Time: 0:00:00[K
  mixed_volume:  10[K[AComputing mixed cells... 13 	 Time: 0:00:00[K
  mixed_volume:  70
Computing mixed cells... 1 	 Time: 0:00:00[K
  mixed_volume:  4[K[AComputing mixed cells... 74 	 Time: 0:00:00[K
  mixed_volume:  424[K[AComputing mixed cells... 503 	 Time: 0:00:00[K
  mixed_volume:  3802[K[AComputing mixed cells... 888 	 Time: 0:00:01[K
  mixed_volume:  6340[K[AComputing mixed cells... 1484 	 Time: 0:00:01[K
  mixed_volume:  10744[K[AComputing mixed cells... 1835 	 Time: 0:00:01[K
  mixed_volume:  12287[K[AComputing mixed cells... 1881 	 Time: 0:00:01[K
  mixed_volume:  12636
Tracking 120 paths...  27%|██████████▋                             |  ETA: 0:00:01[K
  # paths tracked:                  32
  # non-singular solutions (real):  16 (4)
  # singular solutions (real):      0 (0)
  # total solutions (real):         16 (4)[A[A[A[A



[K[A[K[A[K[A[K[ATracking 120 paths... 100%|████████████████████████████████████████| Time: 0:00:00[K
  # paths tracked:                  120
  # non-singular solutions (real):  70 (10)
  # singular solutions (real):      0 (0)
  # total solutions (real):         70 (10)
Tracking 120 paths...  54%|█████████████████████▋                  |  ETA: 0:00:03[K
  # paths tracked:                  65
  # non-singular solutions (real):  40 (7)
  # singular solutions (real):      0 (0)
  # total solutions (real):         40 (7)[A[A[A[A



[K[A[K[A[K[A[K[ATracking 120 paths... 100%|████████████████████████████████████████| Time: 0:00:03[K
  # paths tracked:                  120
  # non-singular solutions (real):  70 (10)
  # singular solutions (real):      0 (0)
  # total solutions (real):         70 (10)
Tracking 216 paths...  31%|████████████▁                           |  ETA: 0:00:01[K
  # paths tracked:                  66
  # non-singular solutions (real):  25 (5)
  # singular solutions (real):      0 (0)
  # total solutions (real):         25 (5)[A[A[A[A



[K[A[K[A[K[A[K[ATracking 216 paths...  61%|████████████████████████▁               |  ETA: 0:00:01[K
  # paths tracked:                  131
  # non-singular solutions (real):  50 (7)
  # singular solutions (real):      0 (0)
  # total solutions (real):         50 (7)[A[A[A[A



[K[A[K[A[K[A[K[ATracking 216 paths...  91%|████████████████████████████████████▌   |  ETA: 0:00:00[K
  # paths tracked:                  197
  # non-singular solutions (real):  75 (8)
  # singular solutions (real):      0 (0)
  # total solutions (real):         75 (8)[A[A[A[A



[K[A[K[A[K[A[K[ATracking 216 paths... 100%|████████████████████████████████████████| Time: 0:00:01[K
  # paths tracked:                  216
  # non-singular solutions (real):  80 (8)
  # singular solutions (real):      0 (0)
  # total solutions (real):         80 (8)
Tracking 125 paths...   2%|▋                                       |  ETA: 0:00:30[K
  # paths tracked:                  2
  # non-singular solutions (real):  2 (2)
  # singular solutions (real):      0 (0)
  # total solutions (real):         2 (2)[A[A[A[ASolutions found: 36 	 Time: 0:00:00[K
  # paths tracked:                   1072
  # loops generated:                 15
  # completed loops without change:  0
  # solutions in current loop:       0
  # real solutions:                  0[K[A[K[A[K[A[K[A[K[ASolutions found: 36 	 Time: 0:00:00[K
┌ Warning: None of the provided solutions is a valid start solution.
└ @ HomotopyContinuation ~/.julia/packages/HomotopyContinuation/mJDHb/src/monodromy.jl:878
[ Info: Compute additional witnesses for completeness...
[ Info: Found 2 additional witnesses
[ Info: Compute trace...
[ Info: Norm of trace: 1.076401158743041e-15
[ Info: Compute additional witnesses for completeness...
[ Info: Found 36 additional witnesses
[ Info: Compute trace...
[ Info: Norm of trace: 5.552282114230487e-9
Solutions found: 2 	 Time: 0:00:00[K
  # paths tracked:                   2
  # loops generated:                 1
  # completed loops without change:  0
  # solutions in current loop:       1
  # real solutions:                  0[K[A[K[A[K[A[K[A[K[ASolutions found: 10 	 Time: 0:00:00[K
  # paths tracked:                   18
  # loops generated:                 1
  # completed loops without change:  0
  # solutions in current loop:       9
  # real solutions:                  0[K[A[K[A[K[A[K[A[K[ASolutions found: 20 	 Time: 0:00:01[K
  # paths tracked:                   38
  # loops generated:                 1
  # completed loops without change:  0
  # solutions in current loop:       19
  # real solutions:                  0[K[A[K[A[K[A[K[A[K[ASolutions found: 31 	 Time: 0:00:01[K
  # paths tracked:                   60
  # loops generated:                 1
  # completed loops without change:  0
  # solutions in current loop:       30
  # real solutions:                  0[K[A[K[A[K[A[K[A[K[ASolutions found: 38 	 Time: 0:00:01[K
  # paths tracked:                   74
  # loops generated:                 1
  # completed loops without change:  0
  # solutions in current loop:       37
  # real solutions:                  0[K[A[K[A[K[A[K[A[K[ASolutions found: 44 	 Time: 0:00:01[K
  # paths tracked:                   86
  # loops generated:                 1
  # completed loops without change:  0
  # solutions in current loop:       43
  # real solutions:                  0[K[A[K[A[K[A[K[A[K[ASolutions found: 50 	 Time: 0:00:01[K
monodromy group: Test Failed at /home/pkgeval/.julia/packages/HomotopyContinuation/mJDHb/test/monodromy_test.jl:500
  Expression: size(A) == (2, 2)
   Evaluated: (2, 3) == (2, 2)
Stacktrace:
 [1] top-level scope at /home/pkgeval/.julia/packages/HomotopyContinuation/mJDHb/test/monodromy_test.jl:500
 [2] top-level scope at /workspace/srcdir/usr/share/julia/stdlib/v1.5/Test/src/Test.jl:1115
 [3] top-level scope at /home/pkgeval/.julia/packages/HomotopyContinuation/mJDHb/test/monodromy_test.jl:489
 [4] top-level scope at /workspace/srcdir/usr/share/julia/stdlib/v1.5/Test/src/Test.jl:1115
 [5] top-level scope at /home/pkgeval/.julia/packages/HomotopyContinuation/mJDHb/test/monodromy_test.jl:2
monodromy group: Test Failed at /home/pkgeval/.julia/packages/HomotopyContinuation/mJDHb/test/monodromy_test.jl:501
  Expression: A == [1 2; 2 1] || A == [2 1; 1 2]
Stacktrace:
 [1] top-level scope at /home/pkgeval/.julia/packages/HomotopyContinuation/mJDHb/test/monodromy_test.jl:501
 [2] top-level scope at /workspace/srcdir/usr/share/julia/stdlib/v1.5/Test/src/Test.jl:1115
 [3] top-level scope at /home/pkgeval/.julia/packages/HomotopyContinuation/mJDHb/test/monodromy_test.jl:489
 [4] top-level scope at /workspace/srcdir/usr/share/julia/stdlib/v1.5/Test/src/Test.jl:1115
 [5] top-level scope at /home/pkgeval/.julia/packages/HomotopyContinuation/mJDHb/test/monodromy_test.jl:2
Solutions found: 2 	 Time: 0:00:00[K
  # paths tracked:                   2
  # loops generated:                 1
  # completed loops without change:  0
  # solutions in current loop:       1
  # real solutions:                  0[K[A[K[A[K[A[K[A[K[ASolutions found: 7 	 Time: 0:00:00[K
  # paths tracked:                   12
  # loops generated:                 1
  # completed loops without change:  0
  # solutions in current loop:       6
  # real solutions:                  0[K[A[K[A[K[A[K[A[K[ASolutions found: 11 	 Time: 0:00:00[K
  # paths tracked:                   20
  # loops generated:                 1
  # completed loops without change:  0
  # solutions in current loop:       10
  # real solutions:                  0[K[A[K[A[K[A[K[A[K[ASolutions found: 16 	 Time: 0:00:01[K
  # paths tracked:                   30
  # loops generated:                 1
  # completed loops without change:  0
  # solutions in current loop:       15
  # real solutions:                  0[K[A[K[A[K[A[K[A[K[ASolutions found: 23 	 Time: 0:00:01[K
  # paths tracked:                   44
  # loops generated:                 1
  # completed loops without change:  0
  # solutions in current loop:       22
  # real solutions:                  0[K[A[K[A[K[A[K[A[K[ASolutions found: 35 	 Time: 0:00:01[K
  # paths tracked:                   68
  # loops generated:                 1
  # completed loops without change:  0
  # solutions in current loop:       34
  # real solutions:                  0[K[A[K[A[K[A[K[A[K[ASolutions found: 46 	 Time: 0:00:01[K
  # paths tracked:                   90
  # loops generated:                 1
  # completed loops without change:  0
  # solutions in current loop:       45
  # real solutions:                  0[K[A[K[A[K[A[K[A[K[ASolutions found: 58 	 Time: 0:00:01[K
  # paths tracked:                   114
  # loops generated:                 1
  # completed loops without change:  0
  # solutions in current loop:       57
  # real solutions:                  0[K[A[K[A[K[A[K[A[K[ASolutions found: 69 	 Time: 0:00:01[K
  # paths tracked:                   136
  # loops generated:                 1
  # completed loops without change:  0
  # solutions in current loop:       68
  # real solutions:                  0[K[A[K[A[K[A[K[A[K[ASolutions found: 76 	 Time: 0:00:01[K
  # paths tracked:                   150
  # loops generated:                 1
  # completed loops without change:  0
  # solutions in current loop:       75
  # real solutions:                  0[K[A[K[A[K[A[K[A[K[ASolutions found: 85 	 Time: 0:00:01[K
  # paths tracked:                   168
  # loops generated:                 1
  # completed loops without change:  0
  # solutions in current loop:       84
  # real solutions:                  0[K[A[K[A[K[A[K[A[K[ASolutions found: 90 	 Time: 0:00:01[K
  # paths tracked:                   178
  # loops generated:                 1
  # completed loops without change:  0
  # solutions in current loop:       89
  # real solutions:                  0[K[A[K[A[K[A[K[A[K[ASolutions found: 94 	 Time: 0:00:02[K
  # paths tracked:                   186
  # loops generated:                 1
  # completed loops without change:  0
  # solutions in current loop:       93
  # real solutions:                  0[K[A[K[A[K[A[K[A[K[ASolutions found: 98 	 Time: 0:00:02[K
  # paths tracked:                   194
  # loops generated:                 1
  # completed loops without change:  0
  # solutions in current loop:       97
  # real solutions:                  0[K[A[K[A[K[A[K[A[K[ASolutions found: 107 	 Time: 0:00:02[K
  # paths tracked:                   213
  # loops generated:                 1
  # completed loops without change:  0
  # solutions in current loop:       106
  # real solutions:                  0[K[A[K[A[K[A[K[A[K[ASolutions found: 120 	 Time: 0:00:02[K
  # paths tracked:                   254
  # loops generated:                 2
  # completed loops without change:  0
  # solutions in current loop:       13
  # real solutions:                  0[K[A[K[A[K[A[K[A[K[ASolutions found: 136 	 Time: 0:00:02[K
  # paths tracked:                   292
  # loops generated:                 2
  # completed loops without change:  0
  # solutions in current loop:       29
  # real solutions:                  0[K[A[K[A[K[A[K[A[K[ASolutions found: 154 	 Time: 0:00:02[K
  # paths tracked:                   333
  # loops generated:                 2
  # completed loops without change:  0
  # solutions in current loop:       47
  # real solutions:                  0[K[A[K[A[K[A[K[A[K[ASolutions found: 166 	 Time: 0:00:02[K
  # paths tracked:                   368
  # loops generated:                 2
  # completed loops without change:  0
  # solutions in current loop:       59
  # real solutions:                  0[K[A[K[A[K[A[K[A[K[ASolutions found: 179 	 Time: 0:00:02[K
  # paths tracked:                   402
  # loops generated:                 2
  # completed loops without change:  0
  # solutions in current loop:       72
  # real solutions:                  0[K[A[K[A[K[A[K[A[K[ASolutions found: 188 	 Time: 0:00:03[K
  # paths tracked:                   425
  # loops generated:                 2
  # completed loops without change:  0
  # solutions in current loop:       81
  # real solutions:                  0[K[A[K[A[K[A[K[A[K[ASolutions found: 203 	 Time: 0:00:03[K
  # paths tracked:                   458
  # loops generated:                 2
  # completed loops without change:  0
  # solutions in current loop:       96
  # real solutions:                  0[K[A[K[A[K[A[K[A[K[ASolutions found: 215 	 Time: 0:00:03[K
  # paths tracked:                   487
  # loops generated:                 2
  # completed loops without change:  0
  # solutions in current loop:       108
  # real solutions:                  0[K[A[K[A[K[A[K[A[K[ASolutions found: 232 	 Time: 0:00:03[K
  # paths tracked:                   522
  # loops generated:                 2
  # completed loops without change:  0
  # solutions in current loop:       125
  # real solutions:                  0[K[A[K[A[K[A[K[A[K[ASolutions found: 251 	 Time: 0:00:03[K
  # paths tracked:                   561
  # loops generated:                 2
  # completed loops without change:  0
  # solutions in current loop:       144
  # real solutions:                  0[K[A[K[A[K[A[K[A[K[ASolutions found: 268 	 Time: 0:00:03[K
  # paths tracked:                   600
  # loops generated:                 2
  # completed loops without change:  0
  # solutions in current loop:       161
  # real solutions:                  0[K[A[K[A[K[A[K[A[K[ASolutions found: 283 	 Time: 0:00:03[K
  # paths tracked:                   637
  # loops generated:                 2
  # completed loops without change:  0
  # solutions in current loop:       176
  # real solutions:                  0[K[A[K[A[K[A[K[A[K[ASolutions found: 295 	 Time: 0:00:03[K
  # paths tracked:                   665
  # loops generated:                 2
  # completed loops without change:  0
  # solutions in current loop:       188
  # real solutions:                  0[K[A[K[A[K[A[K[A[K[ASolutions found: 307 	 Time: 0:00:03[K
  # paths tracked:                   693
  # loops generated:                 2
  # completed loops without change:  0
  # solutions in current loop:       200
  # real solutions:                  0[K[A[K[A[K[A[K[A[K[ASolutions found: 322 	 Time: 0:00:04[K
  # paths tracked:                   729
  # loops generated:                 2
  # completed loops without change:  0
  # solutions in current loop:       215
  # real solutions:                  0[K[A[K[A[K[A[K[A[K[ASolutions found: 330 	 Time: 0:00:04[K
  # paths tracked:                   751
  # loops generated:                 2
  # completed loops without change:  0
  # solutions in current loop:       223
  # real solutions:                  0[K[A[K[A[K[A[K[A[K[ASolutions found: 342 	 Time: 0:00:04[K
  # paths tracked:                   783
  # loops generated:                 2
  # completed loops without change:  0
  # solutions in current loop:       235
  # real solutions:                  0[K[A[K[A[K[A[K[A[K[ASolutions found: 352 	 Time: 0:00:04[K
  # paths tracked:                   809
  # loops generated:                 2
  # completed loops without change:  0
  # solutions in current loop:       245
  # real solutions:                  0[K[A[K[A[K[A[K[A[K[ASolutions found: 362 	 Time: 0:00:04[K
  # paths tracked:                   839
  # loops generated:                 2
  # completed loops without change:  0
  # solutions in current loop:       255
  # real solutions:                  0[K[A[K[A[K[A[K[A[K[ASolutions found: 373 	 Time: 0:00:04[K
  # paths tracked:                   872
  # loops generated:                 2
  # completed loops without change:  0
  # solutions in current loop:       266
  # real solutions:                  0[K[A[K[A[K[A[K[A[K[ASolutions found: 386 	 Time: 0:00:04[K
  # paths tracked:                   900
  # loops generated:                 2
  # completed loops without change:  0
  # solutions in current loop:       279
  # real solutions:                  0[K[A[K[A[K[A[K[A[K[ASolutions found: 405 	 Time: 0:00:04[K
  # paths tracked:                   943
  # loops generated:                 2
  # completed loops without change:  0
  # solutions in current loop:       298
  # real solutions:                  0[K[A[K[A[K[A[K[A[K[ASolutions found: 419 	 Time: 0:00:04[K
  # paths tracked:                   993
  # loops generated:                 2
  # completed loops without change:  0
  # solutions in current loop:       312
  # real solutions:                  0[K[A[K[A[K[A[K[A[K[ASolutions found: 434 	 Time: 0:00:05[K
  # paths tracked:                   1036
  # loops generated:                 2
  # completed loops without change:  0
  # solutions in current loop:       327
  # real solutions:                  0[K[A[K[A[K[A[K[A[K[ASolutions found: 440 	 Time: 0:00:05[K
  # paths tracked:                   1067
  # loops generated:                 2
  # completed loops without change:  0
  # solutions in current loop:       333
  # real solutions:                  0[K[A[K[A[K[A[K[A[K[ASolutions found: 453 	 Time: 0:00:05[K
  # paths tracked:                   1105
  # loops generated:                 2
  # completed loops without change:  0
  # solutions in current loop:       346
  # real solutions:                  0[K[A[K[A[K[A[K[A[K[ASolutions found: 462 	 Time: 0:00:05[K
  # paths tracked:                   1131
  # loops generated:                 2
  # completed loops without change:  0
  # solutions in current loop:       355
  # real solutions:                  0[K[A[K[A[K[A[K[A[K[ASolutions found: 475 	 Time: 0:00:05[K
  # paths tracked:                   1165
  # loops generated:                 2
  # completed loops without change:  0
  # solutions in current loop:       368
  # real solutions:                  0[K[A[K[A[K[A[K[A[K[ASolutions found: 483 	 Time: 0:00:05[K
  # paths tracked:                   1196
  # loops generated:                 2
  # completed loops without change:  0
  # solutions in current loop:       376
  # real solutions:                  0[K[A[K[A[K[A[K[A[K[ASolutions found: 492 	 Time: 0:00:05[K
  # paths tracked:                   1227
  # loops generated:                 2
  # completed loops without change:  0
  # solutions in current loop:       385
  # real solutions:                  0[K[A[K[A[K[A[K[A[K[ASolutions found: 501 	 Time: 0:00:05[K
  # paths tracked:                   1261
  # loops generated:                 2
  # completed loops without change:  0
  # solutions in current loop:       394
  # real solutions:                  0[K[A[K[A[K[A[K[A[K[ASolutions found: 513 	 Time: 0:00:05[K
  # paths tracked:                   1292
  # loops generated:                 2
  # completed loops without change:  0
  # solutions in current loop:       406
  # real solutions:                  0[K[A[K[A[K[A[K[A[K[ASolutions found: 523 	 Time: 0:00:06[K
  # paths tracked:                   1323
  # loops generated:                 2
  # completed loops without change:  0
  # solutions in current loop:       416
  # real solutions:                  0[K[A[K[A[K[A[K[A[K[ASolutions found: 532 	 Time: 0:00:06[K
  # paths tracked:                   1361
  # loops generated:                 2
  # completed loops without change:  0
  # solutions in current loop:       425
  # real solutions:                  0[K[A[K[A[K[A[K[A[K[ASolutions found: 542 	 Time: 0:00:06[K
  # paths tracked:                   1407
  # loops generated:                 2
  # completed loops without change:  0
  # solutions in current loop:       435
  # real solutions:                  0[K[A[K[A[K[A[K[A[K[ASolutions found: 551 	 Time: 0:00:06[K
  # paths tracked:                   1452
  # loops generated:                 2
  # completed loops without change:  0
  # solutions in current loop:       444
  # real solutions:                  0[K[A[K[A[K[A[K[A[K[ASolutions found: 567 	 Time: 0:00:06[K
  # paths tracked:                   1501
  # loops generated:                 2
  # completed loops without change:  0
  # solutions in current loop:       460
  # real solutions:                  0[K[A[K[A[K[A[K[A[K[ASolutions found: 577 	 Time: 0:00:06[K
  # paths tracked:                   1547
  # loops generated:                 2
  # completed loops without change:  0
  # solutions in current loop:       470
  # real solutions:                  0[K[A[K[A[K[A[K[A[K[ASolutions found: 587 	 Time: 0:00:06[K
  # paths tracked:                   1586
  # loops generated:                 2
  # completed loops without change:  0
  # solutions in current loop:       480
  # real solutions:                  0[K[A[K[A[K[A[K[A[K[ASolutions found: 595 	 Time: 0:00:06[K
  # paths tracked:                   1630
  # loops generated:                 2
  # completed loops without change:  0
  # solutions in current loop:       488
  # real solutions:                  0[K[A[K[A[K[A[K[A[K[ASolutions found: 607 	 Time: 0:00:06[K
  # paths tracked:                   1676
  # loops generated:                 2
  # completed loops without change:  0
  # solutions in current loop:       500
  # real solutions:                  0[K[A[K[A[K[A[K[A[K[ASolutions found: 616 	 Time: 0:00:07[K
  # paths tracked:                   1721
  # loops generated:                 2
  # completed loops without change:  0
  # solutions in current loop:       509
  # real solutions:                  0[K[A[K[A[K[A[K[A[K[ASolutions found: 621 	 Time: 0:00:07[K
  # paths tracked:                   1766
  # loops generated:                 2
  # completed loops without change:  0
  # solutions in current loop:       514
  # real solutions:                  0[K[A[K[A[K[A[K[A[K[ASolutions found: 628 	 Time: 0:00:07[K
  # paths tracked:                   1812
  # loops generated:                 2
  # completed loops without change:  0
  # solutions in current loop:       521
  # real solutions:                  0[K[A[K[A[K[A[K[A[K[ASolutions found: 638 	 Time: 0:00:07[K
  # paths tracked:                   1847
  # loops generated:                 2
  # completed loops without change:  0
  # solutions in current loop:       531
  # real solutions:                  0[K[A[K[A[K[A[K[A[K[ASolutions found: 647 	 Time: 0:00:07[K
  # paths tracked:                   1889
  # loops generated:                 2
  # completed loops without change:  0
  # solutions in current loop:       540
  # real solutions:                  0[K[A[K[A[K[A[K[A[K[ASolutions found: 652 	 Time: 0:00:07[K
  # paths tracked:                   1934
  # loops generated:                 2
  # completed loops without change:  0
  # solutions in current loop:       545
  # real solutions:                  0[K[A[K[A[K[A[K[A[K[ASolutions found: 654 	 Time: 0:00:07[K
  # paths tracked:                   1974
  # loops generated:                 2
  # completed loops without change:  0
  # solutions in current loop:       547
  # real solutions:                  0[K[A[K[A[K[A[K[A[K[ASolutions found: 671 	 Time: 0:00:08[K
  # paths tracked:                   2063
  # loops generated:                 2
  # completed loops without change:  0
  # solutions in current loop:       564
  # real solutions:                  0[K[A[K[A[K[A[K[A[K[ASolutions found: 674 	 Time: 0:00:08[K
  # paths tracked:                   2098
  # loops generated:                 2
  # completed loops without change:  0
  # solutions in current loop:       567
  # real solutions:                  0[K[A[K[A[K[A[K[A[K[ASolutions found: 680 	 Time: 0:00:08[K
  # paths tracked:                   2139
  # loops generated:                 2
  # completed loops without change:  0
  # solutions in current loop:       573
  # real solutions:                  0[K[A[K[A[K[A[K[A[K[ASolutions found: 685 	 Time: 0:00:08[K
  # paths tracked:                   2178
  # loops generated:                 2
  # completed loops without change:  0
  # solutions in current loop:       578
  # real solutions:                  0[K[A[K[A[K[A[K[A[K[ASolutions found: 687 	 Time: 0:00:08[K
  # paths tracked:                   2223
  # loops generated:                 2
  # completed loops without change:  0
  # solutions in current loop:       580
  # real solutions:                  0[K[A[K[A[K[A[K[A[K[ASolutions found: 689 	 Time: 0:00:08[K
  # paths tracked:                   2263
  # loops generated:                 2
  # completed loops without change:  0
  # solutions in current loop:       582
  # real solutions:                  0[K[A[K[A[K[A[K[A[K[ASolutions found: 695 	 Time: 0:00:08[K
  # paths tracked:                   2307
  # loops generated:                 2
  # completed loops without change:  0
  # solutions in current loop:       588
  # real solutions:                  0[K[A[K[A[K[A[K[A[K[ASolutions found: 698 	 Time: 0:00:08[K
  # paths tracked:                   2352
  # loops generated:                 2
  # completed loops without change:  0
  # solutions in current loop:       591
  # real solutions:                  0[K[A[K[A[K[A[K[A[K[ASolutions found: 703 	 Time: 0:00:09[K
  # paths tracked:                   2403
  # loops generated:                 2
  # completed loops without change:  0
  # solutions in current loop:       596
  # real solutions:                  0[K[A[K[A[K[A[K[A[K[ASolutions found: 705 	 Time: 0:00:09[K
  # paths tracked:                   2456
  # loops generated:                 2
  # completed loops without change:  0
  # solutions in current loop:       598
  # real solutions:                  0[K[A[K[A[K[A[K[A[K[ASolutions found: 706 	 Time: 0:00:09[K
  # paths tracked:                   2511
  # loops generated:                 2
  # completed loops without change:  0
  # solutions in current loop:       599
  # real solutions:                  0[K[A[K[A[K[A[K[A[K[ASolutions found: 710 	 Time: 0:00:09[K
  # paths tracked:                   2554
  # loops generated:                 2
  # completed loops without change:  0
  # solutions in current loop:       603
  # real solutions:                  0[K[A[K[A[K[A[K[A[K[ASolutions found: 711 	 Time: 0:00:09[K
  # paths tracked:                   2593
  # loops generated:                 2
  # completed loops without change:  0
  # solutions in current loop:       604
  # real solutions:                  0[K[A[K[A[K[A[K[A[K[ASolutions found: 711 	 Time: 0:00:09[K
  # paths tracked:                   2609
  # loops generated:                 2
  # completed loops without change:  0
  # solutions in current loop:       604
  # real solutions:                  0[K[A[K[A[K[A[K[A[K[ASolutions found: 713 	 Time: 0:00:09[K
  # paths tracked:                   2631
  # loops generated:                 2
  # completed loops without change:  0
  # solutions in current loop:       606
  # real solutions:                  0[K[A[K[A[K[A[K[A[K[ASolutions found: 714 	 Time: 0:00:09[K
  # paths tracked:                   2660
  # loops generated:                 2
  # completed loops without change:  0
  # solutions in current loop:       607
  # real solutions:                  0[K[A[K[A[K[A[K[A[K[ASolutions found: 715 	 Time: 0:00:09[K
  # paths tracked:                   2690
  # loops generated:                 2
  # completed loops without change:  0
  # solutions in current loop:       608
  # real solutions:                  0[K[A[K[A[K[A[K[A[K[ASolutions found: 717 	 Time: 0:00:09[K
  # paths tracked:                   2719
  # loops generated:                 2
  # completed loops without change:  0
  # solutions in current loop:       610
  # real solutions:                  0[K[A[K[A[K[A[K[A[K[ASolutions found: 718 	 Time: 0:00:10[K
  # paths tracked:                   2748
  # loops generated:                 2
  # completed loops without change:  0
  # solutions in current loop:       611
  # real solutions:                  0[K[A[K[A[K[A[K[A[K[ASolutions found: 718 	 Time: 0:00:10[K
  # paths tracked:                   2775
  # loops generated:                 2
  # completed loops without change:  0
  # solutions in current loop:       611
  # real solutions:                  0[K[A[K[A[K[A[K[A[K[ASolutions found: 718 	 Time: 0:00:10[K
  # paths tracked:                   2802
  # loops generated:                 2
  # completed loops without change:  0
  # solutions in current loop:       611
  # real solutions:                  0[K[A[K[A[K[A[K[A[K[ASolutions found: 720 	 Time: 0:00:10[K
  # paths tracked:                   2826
  # loops generated:                 2
  # completed loops without change:  0
  # solutions in current loop:       613
  # real solutions:                  0[K[A[K[A[K[A[K[A[K[ASolutions found: 720 	 Time: 0:00:10[K
[ Info: SetupBuildDirectory: setting up build directory.
[ Info: Doctest: running doctests.
[ Info: Skipped ExpandTemplates step (doctest only).
[ Info: Skipped CrossReferences step (doctest only).
[ Info: Skipped CheckDocument step (doctest only).
[ Info: Skipped Populate step (doctest only).
[ Info: Skipped RenderDocument step (doctest only).
Test Summary:                        | Pass  Fail  Total
HomotopyContinuation                 | 1518     2   1520
  ModelKit                           |   82           82
  Utilities                          |  280          280
  Norms                              |   18           18
  LinearAlgebra                      |   70           70
  AffinePatches                      |   22           22
  Problems                           |   59           59
  Systems                            |   59           59
  Homotopies                         |  123          123
  Predictors                         |   48           48
  NewtonCorrector                    |   21           21
  CoreTracker                        |   76           76
  Valuation                          |   53           53
  Cauchy Endgame                     |   20           20
  PathTracker                        |  221          221
  Polyhedral                         |   18           18
  Overdetermined systems             |    5            5
  Solver                             |   84           84
  Result                             |  139          139
  Composition                        |    9            9
  ModelKit integration               |   19           19
  Monodromy                          |   66     2     68
    monodromy_solve                  |   46           46
    Method of Moments                |    2            2
    Trace Test                       |    2            2
    monodromy - automatic start pair |    5            5
    projective                       |    7            7
    monodromy group                  |    3     2      5
    monodromy group Fano problem     |    1            1
  Root counts                        |   23           23
  path_info                          |    2            2
  Doctests: HomotopyContinuation     |    1            1
ERROR: LoadError: Some tests did not pass: 1518 passed, 2 failed, 0 errored, 0 broken.
in expression starting at /home/pkgeval/.julia/packages/HomotopyContinuation/mJDHb/test/runtests.jl:26
ERROR: Package HomotopyContinuation errored during testing
Stacktrace:
 [1] pkgerror(::String) at /workspace/srcdir/usr/share/julia/stdlib/v1.5/Pkg/src/Types.jl:52
 [2] test(::Pkg.Types.Context, ::Array{Pkg.Types.PackageSpec,1}; coverage::Bool, julia_args::Cmd, test_args::Cmd, test_fn::Nothing) at /workspace/srcdir/usr/share/julia/stdlib/v1.5/Pkg/src/Operations.jl:1561
 [3] test(::Pkg.Types.Context, ::Array{Pkg.Types.PackageSpec,1}; coverage::Bool, test_fn::Nothing, julia_args::Cmd, test_args::Cmd, kwargs::Base.Iterators.Pairs{Union{},Union{},Tuple{},NamedTuple{(),Tuple{}}}) at /workspace/srcdir/usr/share/julia/stdlib/v1.5/Pkg/src/API.jl:327
 [4] test(::Pkg.Types.Context, ::Array{Pkg.Types.PackageSpec,1}) at /workspace/srcdir/usr/share/julia/stdlib/v1.5/Pkg/src/API.jl:314
 [5] #test#61 at /workspace/srcdir/usr/share/julia/stdlib/v1.5/Pkg/src/API.jl:67 [inlined]
 [6] test at /workspace/srcdir/usr/share/julia/stdlib/v1.5/Pkg/src/API.jl:67 [inlined]
 [7] #test#60 at /workspace/srcdir/usr/share/julia/stdlib/v1.5/Pkg/src/API.jl:66 [inlined]
 [8] test at /workspace/srcdir/usr/share/julia/stdlib/v1.5/Pkg/src/API.jl:66 [inlined]
 [9] test(::String; kwargs::Base.Iterators.Pairs{Union{},Union{},Tuple{},NamedTuple{(),Tuple{}}}) at /workspace/srcdir/usr/share/julia/stdlib/v1.5/Pkg/src/API.jl:65
 [10] test(::String) at /workspace/srcdir/usr/share/julia/stdlib/v1.5/Pkg/src/API.jl:65
 [11] top-level scope at none:16
