Julia Version 1.6.0-DEV.142
Commit 6f059bf1ae (2020-06-01 16:19 UTC)
Platform Info:
  OS: Linux (x86_64-linux-gnu)
  CPU: Intel(R) Xeon(R) Silver 4114 CPU @ 2.20GHz
  WORD_SIZE: 64
  LIBM: libopenlibm
  LLVM: libLLVM-9.0.1 (ORCJIT, skylake)
Environment:
  JULIA_DEPOT_PATH = ::/usr/local/share/julia
  JULIA_NUM_THREADS = 2

  Resolving package versions...
  Installed Rmath_jll ──────────────────── v0.2.2+0
  Installed Reexport ───────────────────── v0.2.0
  Installed ProgressMeter ──────────────── v1.3.0
  Installed DataAPI ────────────────────── v1.3.0
  Installed TableTraits ────────────────── v1.0.0
  Installed StatsBase ──────────────────── v0.33.0
  Installed DataFrames ─────────────────── v0.20.2
  Installed Pathogen ───────────────────── v0.4.12
  Installed InvertedIndices ────────────── v1.0.0
  Installed SweepOperator ──────────────── v0.3.0
  Installed OpenSpecFun_jll ────────────── v0.5.3+3
  Installed CompilerSupportLibraries_jll ─ v0.3.3+0
  Installed Missings ───────────────────── v0.4.3
  Installed OpenBLAS_jll ───────────────── v0.3.9+4
  Installed AbstractTrees ──────────────── v0.3.3
  Installed Rmath ──────────────────────── v0.6.1
  Installed CategoricalArrays ──────────── v0.7.7
  Installed OnlineStatsBase ────────────── v1.4.1
  Installed StatsFuns ──────────────────── v0.9.5
  Installed OrderedCollections ─────────── v1.2.0
  Installed Arpack_jll ─────────────────── v3.5.0+3
  Installed IteratorInterfaceExtensions ── v1.0.0
  Installed Compat ─────────────────────── v3.10.0
  Installed Tables ─────────────────────── v1.0.4
  Installed Distributions ──────────────── v0.23.3
  Installed OnlineStats ────────────────── v1.5.3
  Installed SortingAlgorithms ──────────── v0.3.1
  Installed QuadGK ─────────────────────── v2.3.1
  Installed FillArrays ─────────────────── v0.8.10
  Installed DataValueInterfaces ────────── v1.0.0
  Installed PooledArrays ───────────────── v0.5.3
  Installed SpecialFunctions ───────────── v0.10.3
  Installed RecipesBase ────────────────── v1.0.1
  Installed Parsers ────────────────────── v1.0.4
  Installed DataStructures ─────────────── v0.17.17
  Installed PDMats ─────────────────────── v0.9.12
  Installed Arpack ─────────────────────── v0.4.0
  Installed JSON ───────────────────────── v0.21.0
Updating `~/.julia/environments/v1.6/Project.toml`
  [c8189ad9] + Pathogen v0.4.12
Updating `~/.julia/environments/v1.6/Manifest.toml`
  [1520ce14] + AbstractTrees v0.3.3
  [7d9fca2a] + Arpack v0.4.0
  [68821587] + Arpack_jll v3.5.0+3
  [324d7699] + CategoricalArrays v0.7.7
  [34da2185] + Compat v3.10.0
  [e66e0078] + CompilerSupportLibraries_jll v0.3.3+0
  [9a962f9c] + DataAPI v1.3.0
  [a93c6f00] + DataFrames v0.20.2
  [864edb3b] + DataStructures v0.17.17
  [e2d170a0] + DataValueInterfaces v1.0.0
  [31c24e10] + Distributions v0.23.3
  [1a297f60] + FillArrays v0.8.10
  [41ab1584] + InvertedIndices v1.0.0
  [82899510] + IteratorInterfaceExtensions v1.0.0
  [682c06a0] + JSON v0.21.0
  [e1d29d7a] + Missings v0.4.3
  [a15396b6] + OnlineStats v1.5.3
  [925886fa] + OnlineStatsBase v1.4.1
  [4536629a] + OpenBLAS_jll v0.3.9+4
  [efe28fd5] + OpenSpecFun_jll v0.5.3+3
  [bac558e1] + OrderedCollections v1.2.0
  [90014a1f] + PDMats v0.9.12
  [69de0a69] + Parsers v1.0.4
  [c8189ad9] + Pathogen v0.4.12
  [2dfb63ee] + PooledArrays v0.5.3
  [92933f4c] + ProgressMeter v1.3.0
  [1fd47b50] + QuadGK v2.3.1
  [3cdcf5f2] + RecipesBase v1.0.1
  [189a3867] + Reexport v0.2.0
  [79098fc4] + Rmath v0.6.1
  [f50d1b31] + Rmath_jll v0.2.2+0
  [a2af1166] + SortingAlgorithms v0.3.1
  [276daf66] + SpecialFunctions v0.10.3
  [2913bbd2] + StatsBase v0.33.0
  [4c63d2b9] + StatsFuns v0.9.5
  [7522ee7d] + SweepOperator v0.3.0
  [3783bdb8] + TableTraits v1.0.0
  [bd369af6] + Tables v1.0.4
  [2a0f44e3] + Base64
  [ade2ca70] + Dates
  [8bb1440f] + DelimitedFiles
  [8ba89e20] + Distributed
  [9fa8497b] + Future
  [b77e0a4c] + InteractiveUtils
  [76f85450] + LibGit2
  [8f399da3] + Libdl
  [37e2e46d] + LinearAlgebra
  [56ddb016] + Logging
  [d6f4376e] + Markdown
  [a63ad114] + Mmap
  [44cfe95a] + Pkg
  [de0858da] + Printf
  [3fa0cd96] + REPL
  [9a3f8284] + Random
  [ea8e919c] + SHA
  [9e88b42a] + Serialization
  [1a1011a3] + SharedArrays
  [6462fe0b] + Sockets
  [2f01184e] + SparseArrays
  [10745b16] + Statistics
  [4607b0f0] + SuiteSparse
  [8dfed614] + Test
  [cf7118a7] + UUIDs
  [4ec0a83e] + Unicode
    Testing Pathogen
Status `/tmp/jl_Q6YPAR/Project.toml`
  [a93c6f00] DataFrames v0.20.2
  [b4f34e82] Distances v0.9.0
  [31c24e10] Distributions v0.23.3
  [a15396b6] OnlineStats v1.5.3
  [c8189ad9] Pathogen v0.4.12
  [92933f4c] ProgressMeter v1.3.0
  [3cdcf5f2] RecipesBase v1.0.1
  [2913bbd2] StatsBase v0.33.0
  [8ba89e20] Distributed
  [37e2e46d] LinearAlgebra
  [56ddb016] Logging
  [9a3f8284] Random
  [10745b16] Statistics
  [8dfed614] Test
Status `/tmp/jl_Q6YPAR/Manifest.toml`
  [1520ce14] AbstractTrees v0.3.3
  [7d9fca2a] Arpack v0.4.0
  [68821587] Arpack_jll v3.5.0+3
  [324d7699] CategoricalArrays v0.7.7
  [34da2185] Compat v3.10.0
  [e66e0078] CompilerSupportLibraries_jll v0.3.3+0
  [9a962f9c] DataAPI v1.3.0
  [a93c6f00] DataFrames v0.20.2
  [864edb3b] DataStructures v0.17.17
  [e2d170a0] DataValueInterfaces v1.0.0
  [b4f34e82] Distances v0.9.0
  [31c24e10] Distributions v0.23.3
  [1a297f60] FillArrays v0.8.10
  [41ab1584] InvertedIndices v1.0.0
  [82899510] IteratorInterfaceExtensions v1.0.0
  [682c06a0] JSON v0.21.0
  [e1d29d7a] Missings v0.4.3
  [a15396b6] OnlineStats v1.5.3
  [925886fa] OnlineStatsBase v1.4.1
  [4536629a] OpenBLAS_jll v0.3.9+4
  [efe28fd5] OpenSpecFun_jll v0.5.3+3
  [bac558e1] OrderedCollections v1.2.0
  [90014a1f] PDMats v0.9.12
  [69de0a69] Parsers v1.0.4
  [c8189ad9] Pathogen v0.4.12
  [2dfb63ee] PooledArrays v0.5.3
  [92933f4c] ProgressMeter v1.3.0
  [1fd47b50] QuadGK v2.3.1
  [3cdcf5f2] RecipesBase v1.0.1
  [189a3867] Reexport v0.2.0
  [79098fc4] Rmath v0.6.1
  [f50d1b31] Rmath_jll v0.2.2+0
  [a2af1166] SortingAlgorithms v0.3.1
  [276daf66] SpecialFunctions v0.10.3
  [2913bbd2] StatsBase v0.33.0
  [4c63d2b9] StatsFuns v0.9.5
  [7522ee7d] SweepOperator v0.3.0
  [3783bdb8] TableTraits v1.0.0
  [bd369af6] Tables v1.0.4
  [2a0f44e3] Base64
  [ade2ca70] Dates
  [8bb1440f] DelimitedFiles
  [8ba89e20] Distributed
  [9fa8497b] Future
  [b77e0a4c] InteractiveUtils
  [76f85450] LibGit2
  [8f399da3] Libdl
  [37e2e46d] LinearAlgebra
  [56ddb016] Logging
  [d6f4376e] Markdown
  [a63ad114] Mmap
  [44cfe95a] Pkg
  [de0858da] Printf
  [3fa0cd96] REPL
  [9a3f8284] Random
  [ea8e919c] SHA
  [9e88b42a] Serialization
  [1a1011a3] SharedArrays
  [6462fe0b] Sockets
  [2f01184e] SparseArrays
  [10745b16] Statistics
  [4607b0f0] SuiteSparse
  [8dfed614] Test
  [cf7118a7] UUIDs
  [4ec0a83e] Unicode
Initialization progress  0%|▁                           |  ETA: 3:18:33[KInitialization progress 44%|████████████▁               |  ETA: 0:00:52[KInitialization progress 60%|████████████████▊           |  ETA: 0:00:27[KInitialization progress 75%|████████████████████▉       |  ETA: 0:00:14[KInitialization progress 88%|████████████████████████▋   |  ETA: 0:00:06[KInitialization progress 95%|██████████████████████████▊ |  ETA: 0:00:02[KInitialization progress 97%|███████████████████████████▁|  ETA: 0:00:01[KInitialization progress100%|████████████████████████████| Time: 0:00:41[K
MCMC progress  0%|▁                                     |  ETA: 2:08:01[KMCMC progress  6%|██▁                                   |  ETA: 0:06:21[KMCMC progress 11%|████▁                                 |  ETA: 0:03:23[KMCMC progress 17%|██████▋                               |  ETA: 0:02:04[KMCMC progress 20%|███████▋                              |  ETA: 0:01:44[KMCMC progress 27%|██████████▁                           |  ETA: 0:01:11[KMCMC progress 34%|████████████▉                         |  ETA: 0:00:51[KMCMC progress 41%|███████████████▋                      |  ETA: 0:00:38[KMCMC progress 48%|██████████████████▁                   |  ETA: 0:00:29[KMCMC progress 55%|████████████████████▊                 |  ETA: 0:00:22[KMCMC progress 62%|███████████████████████▁              |  ETA: 0:00:17[KMCMC progress 67%|█████████████████████████▋            |  ETA: 0:00:13[KMCMC progress 71%|███████████████████████████▁          |  ETA: 0:00:11[KMCMC progress 78%|█████████████████████████████▊        |  ETA: 0:00:07[KMCMC progress 85%|████████████████████████████████▁     |  ETA: 0:00:05[KMCMC progress 92%|██████████████████████████████████▉   |  ETA: 0:00:02[KMCMC progress 92%|███████████████████████████████████   |  ETA: 0:00:03[KMCMC progress 97%|████████████████████████████████████▊ |  ETA: 0:00:01[KMCMC progress 97%|████████████████████████████████████▉ |  ETA: 0:00:01[KMCMC progress100%|██████████████████████████████████████| Time: 0:00:32[K
Initialization progress  2%|▌                           |  ETA: 0:04:29[KInitialization progress100%|████████████████████████████| Time: 0:00:05[K
MCMC progress  1%|▁                                     |  ETA: 0:02:48[KMCMC progress 27%|██████████▁                           |  ETA: 0:00:05[KMCMC progress 61%|███████████████████████▁              |  ETA: 0:00:01[KMCMC progress 99%|█████████████████████████████████████▋|  ETA: 0:00:00[KMCMC progress100%|██████████████████████████████████████| Time: 0:00:02[K
Test Summary: | Pass  Total
SEIR Model    |   84     84
Initialization progress  0%|▁                           |  ETA: 0:56:32[KInitialization progress 16%|████▋                       |  ETA: 0:00:59[KInitialization progress 36%|██████████▁                 |  ETA: 0:00:21[KInitialization progress 58%|████████████████▁           |  ETA: 0:00:08[KInitialization progress 68%|███████████████████▁        |  ETA: 0:00:05[KInitialization progress 81%|██████████████████████▋     |  ETA: 0:00:03[KInitialization progress 89%|████████████████████████▉   |  ETA: 0:00:02[KInitialization progress 97%|███████████████████████████▁|  ETA: 0:00:00[KInitialization progress 97%|███████████████████████████▁|  ETA: 0:00:00[KInitialization progress100%|████████████████████████████| Time: 0:00:12[K
MCMC progress  0%|▁                                     |  ETA: 0:53:01[KMCMC progress  5%|██                                    |  ETA: 0:03:11[KMCMC progress  9%|███▌                                  |  ETA: 0:01:45[KMCMC progress 18%|███████                               |  ETA: 0:00:49[KMCMC progress 28%|██████████▊                           |  ETA: 0:00:28[KMCMC progress 37%|█████████████▉                        |  ETA: 0:00:19[KMCMC progress 43%|████████████████▁                     |  ETA: 0:00:15[KMCMC progress 51%|███████████████████▌                  |  ETA: 0:00:11[KMCMC progress 61%|███████████████████████▁              |  ETA: 0:00:07[KMCMC progress 70%|██████████████████████████▋           |  ETA: 0:00:05[KMCMC progress 81%|██████████████████████████████▊       |  ETA: 0:00:03[KMCMC progress 89%|█████████████████████████████████▊    |  ETA: 0:00:02[KMCMC progress 93%|███████████████████████████████████▁  |  ETA: 0:00:01[KMCMC progress 96%|████████████████████████████████████▋ |  ETA: 0:00:00[KMCMC progress 97%|████████████████████████████████████▉ |  ETA: 0:00:00[KMCMC progress100%|██████████████████████████████████████| Time: 0:00:12[K
Initialization progress  4%|█▁                          |  ETA: 0:00:49[KInitialization progress100%|████████████████████████████| Time: 0:00:02[K
MCMC progress  1%|▁                                     |  ETA: 0:00:21[KMCMC progress 53%|████████████████████▁                 |  ETA: 0:00:00[KMCMC progress 91%|██████████████████████████████████▋   |  ETA: 0:00:00[KMCMC progress100%|██████████████████████████████████████| Time: 0:00:00[K
Test Summary: | Pass  Total
SEI Model     |  162    162
Initialization progress  0%|▁                           |  ETA: 0:55:00[KInitialization progress 24%|██████▊                     |  ETA: 0:00:35[KInitialization progress 50%|██████████████              |  ETA: 0:00:11[KInitialization progress 72%|████████████████████▁       |  ETA: 0:00:04[KInitialization progress 87%|████████████████████████▁   |  ETA: 0:00:02[KInitialization progress 90%|█████████████████████████▁  |  ETA: 0:00:01[KInitialization progress 97%|███████████████████████████▁|  ETA: 0:00:00[KInitialization progress 97%|███████████████████████████▁|  ETA: 0:00:00[KInitialization progress100%|████████████████████████████| Time: 0:00:11[K
MCMC progress  0%|▁                                     |  ETA: 0:50:38[KMCMC progress  9%|███▌                                  |  ETA: 0:01:40[KMCMC progress 18%|██████▊                               |  ETA: 0:00:48[KMCMC progress 24%|█████████▁                            |  ETA: 0:00:33[KMCMC progress 32%|████████████▁                         |  ETA: 0:00:22[KMCMC progress 39%|███████████████                       |  ETA: 0:00:16[KMCMC progress 46%|█████████████████▁                    |  ETA: 0:00:13[KMCMC progress 50%|███████████████████▁                  |  ETA: 0:00:11[KMCMC progress 52%|███████████████████▉                  |  ETA: 0:00:10[KMCMC progress 61%|███████████████████████▁              |  ETA: 0:00:07[KMCMC progress 65%|████████████████████████▊             |  ETA: 0:00:06[KMCMC progress 73%|███████████████████████████▊          |  ETA: 0:00:04[KMCMC progress 81%|██████████████████████████████▊       |  ETA: 0:00:03[KMCMC progress 89%|█████████████████████████████████▉    |  ETA: 0:00:01[KMCMC progress 96%|████████████████████████████████████▁ |  ETA: 0:00:01[KMCMC progress 97%|█████████████████████████████████████ |  ETA: 0:00:00[KMCMC progress100%|██████████████████████████████████████| Time: 0:00:12[K
Initialization progress  4%|█▁                          |  ETA: 0:00:49[KInitialization progress100%|████████████████████████████| Time: 0:00:02[K
MCMC progress  1%|▁                                     |  ETA: 0:00:14[KMCMC progress 35%|█████████████▁                        |  ETA: 0:00:00[K┌ Error: All transmission rates = 0.0, No transmission generated
│   external_or_internal =
│    2-element StatsBase.Weights{Float64,Float64,Array{Float64,1}}:
│     0.0
│     0.0
└ @ Pathogen ~/.julia/packages/Pathogen/39xDw/src/inference/generate.jl:28
MCMC progress 50%|███████████████████                   |  ETA: 0:00:01[K┌ Error: All transmission rates = 0.0, No transmission generated
│   external_or_internal =
│    2-element StatsBase.Weights{Float64,Float64,Array{Float64,1}}:
│     0.0
│     0.0
└ @ Pathogen ~/.julia/packages/Pathogen/39xDw/src/inference/generate.jl:28
┌ Error: All transmission rates = 0.0, No transmission generated
│   external_or_internal =
│    2-element StatsBase.Weights{Float64,Float64,Array{Float64,1}}:
│     0.0
│     0.0
└ @ Pathogen ~/.julia/packages/Pathogen/39xDw/src/inference/generate.jl:28
┌ Error: All transmission rates = 0.0, No transmission generated
│   external_or_internal =
│    2-element StatsBase.Weights{Float64,Float64,Array{Float64,1}}:
│     0.0
│     0.0
└ @ Pathogen ~/.julia/packages/Pathogen/39xDw/src/inference/generate.jl:28
┌ Error: All transmission rates = 0.0, No transmission generated
│   external_or_internal =
│    2-element StatsBase.Weights{Float64,Float64,Array{Float64,1}}:
│     0.0
│     0.0
└ @ Pathogen ~/.julia/packages/Pathogen/39xDw/src/inference/generate.jl:28
┌ Error: All transmission rates = 0.0, No transmission generated
│   external_or_internal =
│    2-element StatsBase.Weights{Float64,Float64,Array{Float64,1}}:
│     0.0
│     0.0
└ @ Pathogen ~/.julia/packages/Pathogen/39xDw/src/inference/generate.jl:28
┌ Error: All transmission rates = 0.0, No transmission generated
│   external_or_internal =
│    2-element StatsBase.Weights{Float64,Float64,Array{Float64,1}}:
│     0.0
│     0.0
└ @ Pathogen ~/.julia/packages/Pathogen/39xDw/src/inference/generate.jl:28
┌ Error: All transmission rates = 0.0, No transmission generated
│   external_or_internal =
│    2-element StatsBase.Weights{Float64,Float64,Array{Float64,1}}:
│     0.0
│     0.0
└ @ Pathogen ~/.julia/packages/Pathogen/39xDw/src/inference/generate.jl:28
┌ Error: All transmission rates = 0.0, No transmission generated
│   external_or_internal =
│    2-element StatsBase.Weights{Float64,Float64,Array{Float64,1}}:
│     0.0
│     0.0
└ @ Pathogen ~/.julia/packages/Pathogen/39xDw/src/inference/generate.jl:28
┌ Error: All transmission rates = 0.0, No transmission generated
│   external_or_internal =
│    2-element StatsBase.Weights{Float64,Float64,Array{Float64,1}}:
│     0.0
│     0.0
└ @ Pathogen ~/.julia/packages/Pathogen/39xDw/src/inference/generate.jl:28
┌ Error: All transmission rates = 0.0, No transmission generated
│   external_or_internal =
│    2-element StatsBase.Weights{Float64,Float64,Array{Float64,1}}:
│     0.0
│     0.0
└ @ Pathogen ~/.julia/packages/Pathogen/39xDw/src/inference/generate.jl:28
┌ Error: All transmission rates = 0.0, No transmission generated
│   external_or_internal =
│    2-element StatsBase.Weights{Float64,Float64,Array{Float64,1}}:
│     0.0
│     0.0
└ @ Pathogen ~/.julia/packages/Pathogen/39xDw/src/inference/generate.jl:28
┌ Error: All transmission rates = 0.0, No transmission generated
│   external_or_internal =
│    2-element StatsBase.Weights{Float64,Float64,Array{Float64,1}}:
│     0.0
│     0.0
└ @ Pathogen ~/.julia/packages/Pathogen/39xDw/src/inference/generate.jl:28
┌ Error: All transmission rates = 0.0, No transmission generated
│   external_or_internal =
│    2-element StatsBase.Weights{Float64,Float64,Array{Float64,1}}:
│     0.0
│     0.0
└ @ Pathogen ~/.julia/packages/Pathogen/39xDw/src/inference/generate.jl:28
┌ Error: All transmission rates = 0.0, No transmission generated
│   external_or_internal =
│    2-element StatsBase.Weights{Float64,Float64,Array{Float64,1}}:
│     0.0
│     0.0
└ @ Pathogen ~/.julia/packages/Pathogen/39xDw/src/inference/generate.jl:28
┌ Error: All transmission rates = 0.0, No transmission generated
│   external_or_internal =
│    2-element StatsBase.Weights{Float64,Float64,Array{Float64,1}}:
│     0.0
│     0.0
└ @ Pathogen ~/.julia/packages/Pathogen/39xDw/src/inference/generate.jl:28
┌ Error: All transmission rates = 0.0, No transmission generated
│   external_or_internal =
│    2-element StatsBase.Weights{Float64,Float64,Array{Float64,1}}:
│     0.0
│     0.0
└ @ Pathogen ~/.julia/packages/Pathogen/39xDw/src/inference/generate.jl:28
┌ Error: All transmission rates = 0.0, No transmission generated
│   external_or_internal =
│    2-element StatsBase.Weights{Float64,Float64,Array{Float64,1}}:
│     0.0
│     0.0
└ @ Pathogen ~/.julia/packages/Pathogen/39xDw/src/inference/generate.jl:28
┌ Error: All transmission rates = 0.0, No transmission generated
│   external_or_internal =
│    2-element StatsBase.Weights{Float64,Float64,Array{Float64,1}}:
│     0.0
│     0.0
└ @ Pathogen ~/.julia/packages/Pathogen/39xDw/src/inference/generate.jl:28
┌ Error: All transmission rates = 0.0, No transmission generated
│   external_or_internal =
│    2-element StatsBase.Weights{Float64,Float64,Array{Float64,1}}:
│     0.0
│     0.0
└ @ Pathogen ~/.julia/packages/Pathogen/39xDw/src/inference/generate.jl:28
┌ Error: All transmission rates = 0.0, No transmission generated
│   external_or_internal =
│    2-element StatsBase.Weights{Float64,Float64,Array{Float64,1}}:
│     0.0
│     0.0
└ @ Pathogen ~/.julia/packages/Pathogen/39xDw/src/inference/generate.jl:28
┌ Error: All transmission rates = 0.0, No transmission generated
│   external_or_internal =
│    2-element StatsBase.Weights{Float64,Float64,Array{Float64,1}}:
│     0.0
│     0.0
└ @ Pathogen ~/.julia/packages/Pathogen/39xDw/src/inference/generate.jl:28
┌ Error: All transmission rates = 0.0, No transmission generated
│   external_or_internal =
│    2-element StatsBase.Weights{Float64,Float64,Array{Float64,1}}:
│     0.0
│     0.0
└ @ Pathogen ~/.julia/packages/Pathogen/39xDw/src/inference/generate.jl:28
┌ Error: All transmission rates = 0.0, No transmission generated
│   external_or_internal =
│    2-element StatsBase.Weights{Float64,Float64,Array{Float64,1}}:
│     0.0
│     0.0
└ @ Pathogen ~/.julia/packages/Pathogen/39xDw/src/inference/generate.jl:28
┌ Error: All transmission rates = 0.0, No transmission generated
│   external_or_internal =
│    2-element StatsBase.Weights{Float64,Float64,Array{Float64,1}}:
│     0.0
│     0.0
└ @ Pathogen ~/.julia/packages/Pathogen/39xDw/src/inference/generate.jl:28
┌ Error: All transmission rates = 0.0, No transmission generated
│   external_or_internal =
│    2-element StatsBase.Weights{Float64,Float64,Array{Float64,1}}:
│     0.0
│     0.0
└ @ Pathogen ~/.julia/packages/Pathogen/39xDw/src/inference/generate.jl:28
┌ Error: All transmission rates = 0.0, No transmission generated
│   external_or_internal =
│    2-element StatsBase.Weights{Float64,Float64,Array{Float64,1}}:
│     0.0
│     0.0
└ @ Pathogen ~/.julia/packages/Pathogen/39xDw/src/inference/generate.jl:28
┌ Error: All transmission rates = 0.0, No transmission generated
│   external_or_internal =
│    2-element StatsBase.Weights{Float64,Float64,Array{Float64,1}}:
│     0.0
│     0.0
└ @ Pathogen ~/.julia/packages/Pathogen/39xDw/src/inference/generate.jl:28
┌ Error: All transmission rates = 0.0, No transmission generated
│   external_or_internal =
│    2-element StatsBase.Weights{Float64,Float64,Array{Float64,1}}:
│     0.0
│     0.0
└ @ Pathogen ~/.julia/packages/Pathogen/39xDw/src/inference/generate.jl:28
┌ Error: All transmission rates = 0.0, No transmission generated
│   external_or_internal =
│    2-element StatsBase.Weights{Float64,Float64,Array{Float64,1}}:
│     0.0
│     0.0
└ @ Pathogen ~/.julia/packages/Pathogen/39xDw/src/inference/generate.jl:28
┌ Error: All transmission rates = 0.0, No transmission generated
│   external_or_internal =
│    2-element StatsBase.Weights{Float64,Float64,Array{Float64,1}}:
│     0.0
│     0.0
└ @ Pathogen ~/.julia/packages/Pathogen/39xDw/src/inference/generate.jl:28
┌ Error: All transmission rates = 0.0, No transmission generated
│   external_or_internal =
│    2-element StatsBase.Weights{Float64,Float64,Array{Float64,1}}:
│     0.0
│     0.0
└ @ Pathogen ~/.julia/packages/Pathogen/39xDw/src/inference/generate.jl:28
┌ Error: All transmission rates = 0.0, No transmission generated
│   external_or_internal =
│    2-element StatsBase.Weights{Float64,Float64,Array{Float64,1}}:
│     0.0
│     0.0
└ @ Pathogen ~/.julia/packages/Pathogen/39xDw/src/inference/generate.jl:28
┌ Error: All transmission rates = 0.0, No transmission generated
│   external_or_internal =
│    2-element StatsBase.Weights{Float64,Float64,Array{Float64,1}}:
│     0.0
│     0.0
└ @ Pathogen ~/.julia/packages/Pathogen/39xDw/src/inference/generate.jl:28
┌ Error: All transmission rates = 0.0, No transmission generated
│   external_or_internal =
│    2-element StatsBase.Weights{Float64,Float64,Array{Float64,1}}:
│     0.0
│     0.0
└ @ Pathogen ~/.julia/packages/Pathogen/39xDw/src/inference/generate.jl:28
┌ Error: All transmission rates = 0.0, No transmission generated
│   external_or_internal =
│    2-element StatsBase.Weights{Float64,Float64,Array{Float64,1}}:
│     0.0
│     0.0
└ @ Pathogen ~/.julia/packages/Pathogen/39xDw/src/inference/generate.jl:28
┌ Error: All transmission rates = 0.0, No transmission generated
│   external_or_internal =
│    2-element StatsBase.Weights{Float64,Float64,Array{Float64,1}}:
│     0.0
│     0.0
└ @ Pathogen ~/.julia/packages/Pathogen/39xDw/src/inference/generate.jl:28
MCMC progress 86%|████████████████████████████████▋     |  ETA: 0:00:00[K┌ Error: All transmission rates = 0.0, No transmission generated
│   external_or_internal =
│    2-element StatsBase.Weights{Float64,Float64,Array{Float64,1}}:
│     0.0
│     0.0
└ @ Pathogen ~/.julia/packages/Pathogen/39xDw/src/inference/generate.jl:28
┌ Error: All transmission rates = 0.0, No transmission generated
│   external_or_internal =
│    2-element StatsBase.Weights{Float64,Float64,Array{Float64,1}}:
│     0.0
│     0.0
└ @ Pathogen ~/.julia/packages/Pathogen/39xDw/src/inference/generate.jl:28
┌ Error: All transmission rates = 0.0, No transmission generated
│   external_or_internal =
│    2-element StatsBase.Weights{Float64,Float64,Array{Float64,1}}:
│     0.0
│     0.0
└ @ Pathogen ~/.julia/packages/Pathogen/39xDw/src/inference/generate.jl:28
┌ Error: All transmission rates = 0.0, No transmission generated
│   external_or_internal =
│    2-element StatsBase.Weights{Float64,Float64,Array{Float64,1}}:
│     0.0
│     0.0
└ @ Pathogen ~/.julia/packages/Pathogen/39xDw/src/inference/generate.jl:28
┌ Error: All transmission rates = 0.0, No transmission generated
│   external_or_internal =
│    2-element StatsBase.Weights{Float64,Float64,Array{Float64,1}}:
│     0.0
│     0.0
└ @ Pathogen ~/.julia/packages/Pathogen/39xDw/src/inference/generate.jl:28
┌ Error: All transmission rates = 0.0, No transmission generated
│   external_or_internal =
│    2-element StatsBase.Weights{Float64,Float64,Array{Float64,1}}:
│     0.0
│     0.0
└ @ Pathogen ~/.julia/packages/Pathogen/39xDw/src/inference/generate.jl:28
┌ Error: All transmission rates = 0.0, No transmission generated
│   external_or_internal =
│    2-element StatsBase.Weights{Float64,Float64,Array{Float64,1}}:
│     0.0
│     0.0
└ @ Pathogen ~/.julia/packages/Pathogen/39xDw/src/inference/generate.jl:28
┌ Error: All transmission rates = 0.0, No transmission generated
│   external_or_internal =
│    2-element StatsBase.Weights{Float64,Float64,Array{Float64,1}}:
│     0.0
│     0.0
└ @ Pathogen ~/.julia/packages/Pathogen/39xDw/src/inference/generate.jl:28
┌ Error: All transmission rates = 0.0, No transmission generated
│   external_or_internal =
│    2-element StatsBase.Weights{Float64,Float64,Array{Float64,1}}:
│     0.0
│     0.0
└ @ Pathogen ~/.julia/packages/Pathogen/39xDw/src/inference/generate.jl:28
┌ Error: All transmission rates = 0.0, No transmission generated
│   external_or_internal =
│    2-element StatsBase.Weights{Float64,Float64,Array{Float64,1}}:
│     0.0
│     0.0
└ @ Pathogen ~/.julia/packages/Pathogen/39xDw/src/inference/generate.jl:28
┌ Error: All transmission rates = 0.0, No transmission generated
│   external_or_internal =
│    2-element StatsBase.Weights{Float64,Float64,Array{Float64,1}}:
│     0.0
│     0.0
└ @ Pathogen ~/.julia/packages/Pathogen/39xDw/src/inference/generate.jl:28
┌ Error: All transmission rates = 0.0, No transmission generated
│   external_or_internal =
│    2-element StatsBase.Weights{Float64,Float64,Array{Float64,1}}:
│     0.0
│     0.0
└ @ Pathogen ~/.julia/packages/Pathogen/39xDw/src/inference/generate.jl:28
┌ Error: All transmission rates = 0.0, No transmission generated
│   external_or_internal =
│    2-element StatsBase.Weights{Float64,Float64,Array{Float64,1}}:
│     0.0
│     0.0
└ @ Pathogen ~/.julia/packages/Pathogen/39xDw/src/inference/generate.jl:28
┌ Error: All transmission rates = 0.0, No transmission generated
│   external_or_internal =
│    2-element StatsBase.Weights{Float64,Float64,Array{Float64,1}}:
│     0.0
│     0.0
└ @ Pathogen ~/.julia/packages/Pathogen/39xDw/src/inference/generate.jl:28
MCMC progress100%|██████████████████████████████████████| Time: 0:00:01[K
Test Summary: | Pass  Total
SIR Model     |  172    172
Initialization progress  0%|▁                           |  ETA: 0:53:35[KInitialization progress 19%|█████▁                      |  ETA: 0:00:46[KInitialization progress 33%|█████████▁                  |  ETA: 0:00:22[KInitialization progress 54%|███████████████             |  ETA: 0:00:10[KInitialization progress 73%|████████████████████▌       |  ETA: 0:00:04[KInitialization progress 89%|████████████████████████▉   |  ETA: 0:00:01[KInitialization progress 96%|███████████████████████████ |  ETA: 0:00:00[KInitialization progress 97%|███████████████████████████▁|  ETA: 0:00:00[KInitialization progress100%|████████████████████████████| Time: 0:00:11[K
MCMC progress  0%|▁                                     |  ETA: 0:47:54[KMCMC progress 11%|████▁                                 |  ETA: 0:01:16[KMCMC progress 21%|███████▉                              |  ETA: 0:00:38[KMCMC progress 28%|██████████▌                           |  ETA: 0:00:26[KMCMC progress 33%|████████████▋                         |  ETA: 0:00:20[KMCMC progress 39%|███████████████                       |  ETA: 0:00:16[KMCMC progress 46%|█████████████████▌                    |  ETA: 0:00:12[KMCMC progress 53%|████████████████████▁                 |  ETA: 0:00:09[KMCMC progress 61%|███████████████████████               |  ETA: 0:00:07[KMCMC progress 72%|███████████████████████████▁          |  ETA: 0:00:04[KMCMC progress 84%|███████████████████████████████▉      |  ETA: 0:00:02[KMCMC progress 88%|█████████████████████████████████▁    |  ETA: 0:00:02[KMCMC progress 94%|███████████████████████████████████▉  |  ETA: 0:00:01[KMCMC progress 97%|█████████████████████████████████████ |  ETA: 0:00:00[KMCMC progress100%|██████████████████████████████████████| Time: 0:00:11[K
Initialization progress  4%|█▁                          |  ETA: 0:00:47[KInitialization progress100%|████████████████████████████| Time: 0:00:01[K
MCMC progress  1%|▁                                     |  ETA: 0:00:17[KMCMC progress 72%|███████████████████████████▁          |  ETA: 0:00:00[KMCMC progress100%|██████████████████████████████████████| Time: 0:00:00[K
Test Summary: | Pass  Total
SI Model      |  101    101
    Testing Pathogen tests passed 
