Julia Version 1.4.0-DEV.660
Commit 27eb582279 (2019-12-23 19:29 UTC)
Platform Info:
  OS: Linux (x86_64-pc-linux-gnu)
  CPU: Intel(R) Xeon(R) Silver 4114 CPU @ 2.20GHz
  WORD_SIZE: 64
  LIBM: libopenlibm
  LLVM: libLLVM-8.0.1 (ORCJIT, skylake)
Environment:
  JULIA_DEPOT_PATH = ::/usr/local/share/julia

 Resolving package versions...
 Installed OpenSpecFun_jll ──── v0.5.3+1
 Installed FFTW_jll ─────────── v3.3.9+3
 Installed MetaArrays ───────── v0.2.7
 Installed FillArrays ───────── v0.8.2
 Installed SignalOperators ──── v0.2.2
 Installed PrettyPrinting ───── v0.2.0
 Installed AbstractFFTs ─────── v0.5.0
 Installed Unitful ──────────── v0.18.0
 Installed DataStructures ───── v0.17.6
 Installed OrderedCollections ─ v1.1.0
 Installed Requires ─────────── v0.5.2
 Installed Compat ───────────── v2.2.0
 Installed DSP ──────────────── v0.6.2
 Installed FFTW ─────────────── v1.2.0
 Installed IntelOpenMP_jll ──── v2018.0.3+0
 Installed FileIO ───────────── v1.2.0
 Installed MacroTools ───────── v0.5.3
 Installed Reexport ─────────── v0.2.0
 Installed SpecialFunctions ─── v0.9.0
 Installed RangeArrays ──────── v0.3.1
 Installed RecipesBase ──────── v0.7.0
 Installed MKL_jll ──────────── v2019.0.117+0
 Installed IterTools ────────── v1.3.0
 Installed ConstructionBase ─── v1.0.0
 Installed IntervalSets ─────── v0.3.2
 Installed LambdaFn ─────────── v0.3.0
 Installed AxisArrays ───────── v0.3.3
 Installed Polynomials ──────── v0.6.0
  Updating `~/.julia/environments/v1.4/Project.toml`
  [4d633899] + SignalOperators v0.2.2
  Updating `~/.julia/environments/v1.4/Manifest.toml`
  [621f4979] + AbstractFFTs v0.5.0
  [39de3d68] + AxisArrays v0.3.3
  [34da2185] + Compat v2.2.0
  [187b0558] + ConstructionBase v1.0.0
  [717857b8] + DSP v0.6.2
  [864edb3b] + DataStructures v0.17.6
  [7a1cc6ca] + FFTW v1.2.0
  [f5851436] + FFTW_jll v3.3.9+3
  [5789e2e9] + FileIO v1.2.0
  [1a297f60] + FillArrays v0.8.2
  [1d5cc7b8] + IntelOpenMP_jll v2018.0.3+0
  [8197267c] + IntervalSets v0.3.2
  [c8e1da08] + IterTools v1.3.0
  [fcefd6c4] + LambdaFn v0.3.0
  [856f044c] + MKL_jll v2019.0.117+0
  [1914dd2f] + MacroTools v0.5.3
  [36b8f3f0] + MetaArrays v0.2.7
  [efe28fd5] + OpenSpecFun_jll v0.5.3+1
  [bac558e1] + OrderedCollections v1.1.0
  [f27b6e38] + Polynomials v0.6.0
  [54e16d92] + PrettyPrinting v0.2.0
  [b3c3ace0] + RangeArrays v0.3.1
  [3cdcf5f2] + RecipesBase v0.7.0
  [189a3867] + Reexport v0.2.0
  [ae029012] + Requires v0.5.2
  [4d633899] + SignalOperators v0.2.2
  [276daf66] + SpecialFunctions v0.9.0
  [1986cc42] + Unitful v0.18.0
  [2a0f44e3] + Base64 
  [ade2ca70] + Dates 
  [8bb1440f] + DelimitedFiles 
  [8ba89e20] + Distributed 
  [b77e0a4c] + InteractiveUtils 
  [76f85450] + LibGit2 
  [8f399da3] + Libdl 
  [37e2e46d] + LinearAlgebra 
  [56ddb016] + Logging 
  [d6f4376e] + Markdown 
  [a63ad114] + Mmap 
  [44cfe95a] + Pkg 
  [de0858da] + Printf 
  [3fa0cd96] + REPL 
  [9a3f8284] + Random 
  [ea8e919c] + SHA 
  [9e88b42a] + Serialization 
  [1a1011a3] + SharedArrays 
  [6462fe0b] + Sockets 
  [2f01184e] + SparseArrays 
  [10745b16] + Statistics 
  [8dfed614] + Test 
  [cf7118a7] + UUIDs 
  [4ec0a83e] + Unicode 
  Building FFTW → `~/.julia/packages/FFTW/qqcBj/deps/build.log`
  Updating `/tmp/jl_0HH84c/Project.toml`
 [no changes]
  Updating `/tmp/jl_0HH84c/Manifest.toml`
 [no changes]
   Testing SignalOperators
 Installed ProgressMeter ───── v1.2.0
 Installed WAV ─────────────── v1.0.3
 Installed Parsers ─────────── v0.3.10
 Installed FixedPointNumbers ─ v0.7.0
 Installed BenchmarkTools ──── v0.4.3
 Installed JSON ────────────── v0.21.0
  Updating `/tmp/jl_DqHmp5/Project.toml`
  [6e4b80f9] + BenchmarkTools v0.4.3
  [53c48c17] + FixedPointNumbers v0.7.0
  [92933f4c] + ProgressMeter v1.2.0
  [8149f6b0] + WAV v1.0.3
  Updating `/tmp/jl_DqHmp5/Manifest.toml`
  [6e4b80f9] + BenchmarkTools v0.4.3
  [53c48c17] + FixedPointNumbers v0.7.0
  [682c06a0] + JSON v0.21.0
  [69de0a69] + Parsers v0.3.10
  [92933f4c] + ProgressMeter v1.2.0
  [8149f6b0] + WAV v1.0.3
Running sandbox
Status `/tmp/jl_DqHmp5/Project.toml`
  [39de3d68] AxisArrays v0.3.3
  [6e4b80f9] BenchmarkTools v0.4.3
  [34da2185] Compat v2.2.0
  [717857b8] DSP v0.6.2
  [5789e2e9] FileIO v1.2.0
  [1a297f60] FillArrays v0.8.2
  [53c48c17] FixedPointNumbers v0.7.0
  [fcefd6c4] LambdaFn v0.3.0
  [36b8f3f0] MetaArrays v0.2.7
  [54e16d92] PrettyPrinting v0.2.0
  [92933f4c] ProgressMeter v1.2.0
  [ae029012] Requires v0.5.2
  [4d633899] SignalOperators v0.2.2
  [1986cc42] Unitful v0.18.0
  [8149f6b0] WAV v1.0.3
  [44cfe95a] Pkg 
  [9a3f8284] Random 
  [10745b16] Statistics 
  [8dfed614] Test 
Running tests...  3%|█▁                                 |  ETA: 0:07:27[K┌ Warning: No sample rate was specified, defaulting to 44.1 kHz.
└ @ SignalOperators ~/.julia/packages/SignalOperators/96YI9/src/sink.jl:111
Running tests... 10%|███▌                               |  ETA: 0:04:11[KRunning tests... 13%|████▋                              |  ETA: 0:03:38[KRunning tests... 17%|█████▉                             |  ETA: 0:02:51[KRunning tests... 20%|███████                            |  ETA: 0:02:49[KRunning tests... 23%|████████▁                          |  ETA: 0:02:49[KRunning tests... 27%|█████████▁                         |  ETA: 0:02:46[KRunning tests... 30%|██████████▌                        |  ETA: 0:03:19[KRunning tests... 33%|███████████▋                       |  ETA: 0:03:40[KRunning tests... 37%|████████████▉                      |  ETA: 0:03:26[KRunning tests... 40%|██████████████                     |  ETA: 0:03:26[KRunning tests... 43%|███████████████▁                   |  ETA: 0:03:43[KRunning tests... 47%|████████████████▁                  |  ETA: 0:04:30[KRunning tests... 50%|█████████████████▌                 |  ETA: 0:04:06[KRunning tests... 53%|██████████████████▋                |  ETA: 0:03:41[KRunning tests... 57%|███████████████████▉               |  ETA: 0:03:21[KRunning tests... 60%|█████████████████████              |  ETA: 0:02:57[KRunning tests... 63%|██████████████████████▁            |  ETA: 0:02:40[KRunning tests... 67%|███████████████████████▁           |  ETA: 0:02:35[KRunning tests... 70%|████████████████████████▌          |  ETA: 0:02:16[KRunning tests... 73%|█████████████████████████▋         |  ETA: 0:01:56[KRunning tests... 77%|██████████████████████████▉        |  ETA: 0:01:43[KRunning tests... 80%|████████████████████████████       |  ETA: 0:01:28[KRunning tests... 83%|█████████████████████████████▁     |  ETA: 0:01:20[KRunning tests... 87%|██████████████████████████████▁    |  ETA: 0:01:08[KRunning tests... 90%|███████████████████████████████▌   |  ETA: 0:00:52[KRunning tests... 93%|████████████████████████████████▋  |  ETA: 0:00:40[KRunning tests... 97%|█████████████████████████████████▉ |  ETA: 0:00:22[KActivating new environment at `~/.julia/packages/SignalOperators/96YI9/test/jl_xRiSBQ/Project.toml`
 Resolving package versions...
 Installed LibSndFile ──────── v2.2.0
 Installed libvorbis_jll ───── v1.3.6+2
 Installed Ogg_jll ─────────── v1.3.3+0
 Installed TreeViews ───────── v0.3.0
 Installed FLAC_jll ────────── v1.3.3+1
 Installed FixedPointNumbers ─ v0.6.1
 Installed Unitful ─────────── v0.17.0
 Installed SampledSignals ──── v2.1.0
 Installed libsndfile_jll ──── v1.0.28+0
  Updating `~/.julia/packages/SignalOperators/96YI9/test/jl_xRiSBQ/Project.toml`
  [b13ce0c6] + LibSndFile v2.2.0
  Updating `~/.julia/packages/SignalOperators/96YI9/test/jl_xRiSBQ/Manifest.toml`
  [621f4979] + AbstractFFTs v0.5.0
  [34da2185] + Compat v2.2.0
  [717857b8] + DSP v0.6.2
  [7a1cc6ca] + FFTW v1.2.0
  [f5851436] + FFTW_jll v3.3.9+3
  [1d38b3a6] + FLAC_jll v1.3.3+1
  [5789e2e9] + FileIO v1.2.0
  [53c48c17] + FixedPointNumbers v0.6.1
  [1d5cc7b8] + IntelOpenMP_jll v2018.0.3+0
  [8197267c] + IntervalSets v0.3.2
  [b13ce0c6] + LibSndFile v2.2.0
  [856f044c] + MKL_jll v2019.0.117+0
  [e7412a2a] + Ogg_jll v1.3.3+0
  [efe28fd5] + OpenSpecFun_jll v0.5.3+1
  [f27b6e38] + Polynomials v0.6.0
  [3cdcf5f2] + RecipesBase v0.7.0
  [189a3867] + Reexport v0.2.0
  [bd7594eb] + SampledSignals v2.1.0
  [276daf66] + SpecialFunctions v0.9.0
  [a2a6695c] + TreeViews v0.3.0
  [1986cc42] + Unitful v0.17.0
  [5bf562c0] + libsndfile_jll v1.0.28+0
  [f27f6e37] + libvorbis_jll v1.3.6+2
  [2a0f44e3] + Base64 
  [ade2ca70] + Dates 
  [8bb1440f] + DelimitedFiles 
  [8ba89e20] + Distributed 
  [b77e0a4c] + InteractiveUtils 
  [76f85450] + LibGit2 
  [8f399da3] + Libdl 
  [37e2e46d] + LinearAlgebra 
  [56ddb016] + Logging 
  [d6f4376e] + Markdown 
  [a63ad114] + Mmap 
  [44cfe95a] + Pkg 
  [de0858da] + Printf 
  [3fa0cd96] + REPL 
  [9a3f8284] + Random 
  [ea8e919c] + SHA 
  [9e88b42a] + Serialization 
  [1a1011a3] + SharedArrays 
  [6462fe0b] + Sockets 
  [2f01184e] + SparseArrays 
  [10745b16] + Statistics 
  [8dfed614] + Test 
  [cf7118a7] + UUIDs 
  [4ec0a83e] + Unicode 
 Resolving package versions...
  Updating `~/.julia/packages/SignalOperators/96YI9/test/jl_xRiSBQ/Project.toml`
  [bd7594eb] + SampledSignals v2.1.0
  Updating `~/.julia/packages/SignalOperators/96YI9/test/jl_xRiSBQ/Manifest.toml`
 [no changes]
[ Info: Loading LibSndFile backend for SignalOperators.
WARNING: using SampledSignals.mix in module Main conflicts with an existing identifier.
WARNING: using SampledSignals.nchannels in module Main conflicts with an existing identifier.
WARNING: using SampledSignals.samplerate in module Main conflicts with an existing identifier.
Running tests...100%|███████████████████████████████████| Time: 0:12:10[K
Test Summary:      | Pass  Total
SignalOperators.jl |  422    422
   Testing SignalOperators tests passed 
