Julia Version 1.6.0-DEV.1284
Commit 8c11d3c89e (2020-10-19 22:38 UTC)
Platform Info:
  OS: Linux (x86_64-pc-linux-gnu)
  CPU: AMD EPYC 7502 32-Core Processor
  WORD_SIZE: 64
  LIBM: libopenlibm
  LLVM: libLLVM-11.0.0 (ORCJIT, znver2)
Environment:
  JULIA_DEPOT_PATH = ::/usr/local/share/julia
  JULIA_NUM_THREADS = 2
  JULIA_MAX_NUM_PRECOMPILE_FILES = 9223372036854775807

   Resolving package versions...
   Installed StrTables ────────── v1.0.1
   Installed AutoHashEquals ───── v0.2.0
   Installed HTML_Entities ────── v1.0.0
   Installed MbedTLS ──────────── v1.0.2
   Installed OrderedCollections ─ v1.3.1
   Installed TSVD ─────────────── v0.4.1
   Installed DataDeps ─────────── v0.7.2
   Installed StringAnalysis ───── v0.4.0
   Installed Reexport ─────────── v0.2.0
   Installed MbedTLS_jll ──────── v2.16.8+0
   Installed BinaryProvider ───── v0.5.10
   Installed WordTokenizers ───── v0.5.6
   Installed HTTP ─────────────── v0.8.19
   Installed JSON ─────────────── v0.21.1
   Installed Languages ────────── v0.4.3
   Installed Adapt ────────────── v2.3.0
   Installed Parsers ──────────── v1.0.11
   Installed IniFile ──────────── v0.5.0
   Installed DataStructures ───── v0.17.20
Updating `~/.julia/environments/v1.6/Project.toml`
  [b66b7d2f] + StringAnalysis v0.4.0
Updating `~/.julia/environments/v1.6/Manifest.toml`
  [79e6a3ab] + Adapt v2.3.0
  [15f4f7f2] + AutoHashEquals v0.2.0
  [b99e7846] + BinaryProvider v0.5.10
  [124859b0] + DataDeps v0.7.2
  [864edb3b] + DataStructures v0.17.20
  [7693890a] + HTML_Entities v1.0.0
  [cd3eb016] + HTTP v0.8.19
  [83e8ac13] + IniFile v0.5.0
  [682c06a0] + JSON v0.21.1
  [8ef0a80b] + Languages v0.4.3
  [739be429] + MbedTLS v1.0.2
  [c8ffd9c3] + MbedTLS_jll v2.16.8+0
  [bac558e1] + OrderedCollections v1.3.1
  [69de0a69] + Parsers v1.0.11
  [189a3867] + Reexport v0.2.0
  [9700d1a9] + StrTables v1.0.1
  [b66b7d2f] + StringAnalysis v0.4.0
  [9449cd9e] + TSVD v0.4.1
  [796a5d58] + WordTokenizers v0.5.6
  [0dad84c5] + ArgTools
  [56f22d72] + Artifacts
  [2a0f44e3] + Base64
  [ade2ca70] + Dates
  [8bb1440f] + DelimitedFiles
  [f43a241f] + Downloads
  [b77e0a4c] + InteractiveUtils
  [b27032c2] + LibCURL
  [deac9b47] + LibCURL_jll
  [76f85450] + LibGit2
  [8f399da3] + Libdl
  [37e2e46d] + LinearAlgebra
  [56ddb016] + Logging
  [d6f4376e] + Markdown
  [a63ad114] + Mmap
  [14a3606d] + MozillaCACerts_jll
  [44cfe95a] + Pkg
  [de0858da] + Printf
  [3fa0cd96] + REPL
  [9a3f8284] + Random
  [ea8e919c] + SHA
  [9e88b42a] + Serialization
  [6462fe0b] + Sockets
  [2f01184e] + SparseArrays
  [10745b16] + Statistics
  [fa267f1f] + TOML
  [8dfed614] + Test
  [cf7118a7] + UUIDs
  [4ec0a83e] + Unicode
    Building HTML_Entities ─→ `~/.julia/scratchspaces/44cfe95a-1eb2-52ea-b672-e2afdf69b78f/aa19515d6ebe7f91a39cfc1dc6341f38fcac1282/build.log`
    Building StringAnalysis → `~/.julia/scratchspaces/44cfe95a-1eb2-52ea-b672-e2afdf69b78f/51d38d46e69eb200a08c0dd26561bafec3525e0a/build.log`
Precompiling project... (tip: to disable auto-precompilation set ENV["JULIA_PKG_PRECOMPILE_AUTO"]=0)
[90m[32m  ✓ [39mIniFile[39m
[90m[32m  ✓ [39mReexport[39m
[90m[32m  ✓ [39mAutoHashEquals[39m
[90m[32m  ✓ [39mAdapt[39m
[90m[32m  ✓ [39mHTML_Entities[39m
[90m[32m  ✓ [39mOrderedCollections[39m
[90m[32m  ✓ [39mTSVD[39m
[90m[32m  ✓ [39mMbedTLS_jll[39m
[90m[32m  ✓ [39mMbedTLS[39m
[90m[32m  ✓ [39mParsers[39m
[90m[32m  ✓ [39mDataStructures[39m
[90m[32m  ✓ [39mJSON[39m
[90m[32m  ✓ [39mHTTP[39m
[90m[32m  ✓ [39mLanguages[39m
[90m[32m  ✓ [39mDataDeps[39m
[90m[32m  ✓ [39mWordTokenizers[39m
[32m  ✓ [39mStringAnalysis
17 dependencies successfully precompiled (2 already precompiled)
     Testing StringAnalysis
Status `/tmp/jl_ixgGHZ/Project.toml`
  [15f4f7f2] AutoHashEquals v0.2.0
  [b99e7846] BinaryProvider v0.5.10
  [864edb3b] DataStructures v0.17.20
  [8ef0a80b] Languages v0.4.3
  [b66b7d2f] StringAnalysis v0.4.0
  [9449cd9e] TSVD v0.4.1
  [796a5d58] WordTokenizers v0.5.6
  [ade2ca70] Dates
  [8bb1440f] DelimitedFiles
  [8f399da3] Libdl
  [37e2e46d] LinearAlgebra
  [56ddb016] Logging
  [2f01184e] SparseArrays
  [10745b16] Statistics
  [8dfed614] Test
  [4ec0a83e] Unicode
Status `/tmp/jl_ixgGHZ/Manifest.toml`
  [79e6a3ab] Adapt v2.3.0
  [15f4f7f2] AutoHashEquals v0.2.0
  [b99e7846] BinaryProvider v0.5.10
  [124859b0] DataDeps v0.7.2
  [864edb3b] DataStructures v0.17.20
  [7693890a] HTML_Entities v1.0.0
  [cd3eb016] HTTP v0.8.19
  [83e8ac13] IniFile v0.5.0
  [682c06a0] JSON v0.21.1
  [8ef0a80b] Languages v0.4.3
  [739be429] MbedTLS v1.0.2
  [c8ffd9c3] MbedTLS_jll v2.16.8+0
  [bac558e1] OrderedCollections v1.3.1
  [69de0a69] Parsers v1.0.11
  [189a3867] Reexport v0.2.0
  [9700d1a9] StrTables v1.0.1
  [b66b7d2f] StringAnalysis v0.4.0
  [9449cd9e] TSVD v0.4.1
  [796a5d58] WordTokenizers v0.5.6
  [0dad84c5] ArgTools
  [56f22d72] Artifacts
  [2a0f44e3] Base64
  [ade2ca70] Dates
  [8bb1440f] DelimitedFiles
  [f43a241f] Downloads
  [b77e0a4c] InteractiveUtils
  [b27032c2] LibCURL
  [deac9b47] LibCURL_jll
  [76f85450] LibGit2
  [8f399da3] Libdl
  [37e2e46d] LinearAlgebra
  [56ddb016] Logging
  [d6f4376e] Markdown
  [a63ad114] Mmap
  [14a3606d] MozillaCACerts_jll
  [44cfe95a] Pkg
  [de0858da] Printf
  [3fa0cd96] REPL
  [9a3f8284] Random
  [ea8e919c] SHA
  [9e88b42a] Serialization
  [6462fe0b] Sockets
  [2f01184e] SparseArrays
  [10745b16] Statistics
  [fa267f1f] TOML
  [8dfed614] Test
  [cf7118a7] UUIDs
  [4ec0a83e] Unicode
     Testing Running tests...
Running tests:
Test Summary: | Pass  Total
Hash equality |    6      6
Test Summary:        | Pass  Total
Tokenizer (to words) |    5      5
Test Summary:            | Pass  Total
Tokenizer (to sentences) |    6      6
Test Summary: | Pass  Total
NGramizer     |    2      2
Test Summary: | Pass  Total
Document      |   25     25
Test Summary: | Pass  Total
Metadata      |   50     50
Test Summary: | Pass  Total
Corpus        |   40     40
Test Summary:         | Pass  Total
Preprocessing (newer) |    9      9
Test Summary:         | Pass  Total
Preprocessing (older) |   28     28
Test Summary:         | Pass  Total
DTM: TextHashFunction |    5      5
Test Summary: | Pass  Total
DTM: Generics |   33     33
Test Summary:            | Pass  Total
DTM: Iteration, Indexing |   28     28
Test Summary:              | Pass  Total
COOM (Co-occurence Matrix) |   27     27
Test Summary: | Pass  Total
Stemmer       |   17     17
Test Summary:          | Pass  Total
Stats (TF,TF-IDF,BM25) |   42     42
Test Summary: | Pass  Total
LDA           |    3      3
Test Summary: | Pass  Total
LSA           |  103    103
Test Summary:      | Pass  Total
Random Projections |  250    250
Test Summary:     | Pass  Total
Base.show methods |   12     12
     Testing StringAnalysis tests passed 
