Julia Version 1.6.0-DEV.1117
Commit 36effbe10a (2020-10-02 17:38 UTC)
Platform Info:
  OS: Linux (x86_64-linux-gnu)
  CPU: AMD EPYC 7502 32-Core Processor
  WORD_SIZE: 64
  LIBM: libopenlibm
  LLVM: libLLVM-10.0.1 (ORCJIT, znver2)
Environment:
  JULIA_DEPOT_PATH = ::/usr/local/share/julia
  JULIA_NUM_THREADS = 2

  Resolving package versions...
  Installed SweepOperator ──────────────── v0.3.0
  Installed CategoricalArrays ──────────── v0.7.7
  Installed SpecialFunctions ───────────── v0.10.3
  Installed AbstractTrees ──────────────── v0.3.3
  Installed DataStructures ─────────────── v0.18.6
  Installed StatsBase ──────────────────── v0.33.1
  Installed Pathogen ───────────────────── v0.4.12
  Installed Distributions ──────────────── v0.23.12
  Installed Tables ─────────────────────── v1.1.0
  Installed CompilerSupportLibraries_jll ─ v0.3.3+0
  Installed ProgressMeter ──────────────── v1.4.0
  Installed Reexport ───────────────────── v0.2.0
  Installed Rmath ──────────────────────── v0.6.1
  Installed JSON ───────────────────────── v0.21.1
  Installed RecipesBase ────────────────── v1.1.0
  Installed OnlineStats ────────────────── v1.5.6
  Installed DataFrames ─────────────────── v0.20.2
  Installed InvertedIndices ────────────── v1.0.0
  Installed OpenSpecFun_jll ────────────── v0.5.3+3
  Installed IteratorInterfaceExtensions ── v1.0.0
  Installed Missings ───────────────────── v0.4.4
  Installed PooledArrays ───────────────── v0.5.3
  Installed DataAPI ────────────────────── v1.3.0
  Installed QuadGK ─────────────────────── v2.4.1
  Installed TableTraits ────────────────── v1.0.0
  Installed StatsFuns ──────────────────── v0.9.5
  Installed PDMats ─────────────────────── v0.10.1
  Installed OnlineStatsBase ────────────── v1.4.4
  Installed FillArrays ─────────────────── v0.9.6
  Installed Parsers ────────────────────── v1.0.10
  Installed SortingAlgorithms ──────────── v0.3.1
  Installed Compat ─────────────────────── v3.18.0
  Installed DataValueInterfaces ────────── v1.0.0
  Installed OrderedCollections ─────────── v1.3.1
  Installed StaticArrays ───────────────── v0.12.4
  Installed Rmath_jll ──────────────────── v0.2.2+1
Updating `~/.julia/environments/v1.6/Project.toml`
  [c8189ad9] + Pathogen v0.4.12
Updating `~/.julia/environments/v1.6/Manifest.toml`
  [1520ce14] + AbstractTrees v0.3.3
  [324d7699] + CategoricalArrays v0.7.7
  [34da2185] + Compat v3.18.0
  [e66e0078] + CompilerSupportLibraries_jll v0.3.3+0
  [9a962f9c] + DataAPI v1.3.0
  [a93c6f00] + DataFrames v0.20.2
  [864edb3b] + DataStructures v0.18.6
  [e2d170a0] + DataValueInterfaces v1.0.0
  [31c24e10] + Distributions v0.23.12
  [1a297f60] + FillArrays v0.9.6
  [41ab1584] + InvertedIndices v1.0.0
  [82899510] + IteratorInterfaceExtensions v1.0.0
  [682c06a0] + JSON v0.21.1
  [e1d29d7a] + Missings v0.4.4
  [a15396b6] + OnlineStats v1.5.6
  [925886fa] + OnlineStatsBase v1.4.4
  [efe28fd5] + OpenSpecFun_jll v0.5.3+3
  [bac558e1] + OrderedCollections v1.3.1
  [90014a1f] + PDMats v0.10.1
  [69de0a69] + Parsers v1.0.10
  [c8189ad9] + Pathogen v0.4.12
  [2dfb63ee] + PooledArrays v0.5.3
  [92933f4c] + ProgressMeter v1.4.0
  [1fd47b50] + QuadGK v2.4.1
  [3cdcf5f2] + RecipesBase v1.1.0
  [189a3867] + Reexport v0.2.0
  [79098fc4] + Rmath v0.6.1
  [f50d1b31] + Rmath_jll v0.2.2+1
  [a2af1166] + SortingAlgorithms v0.3.1
  [276daf66] + SpecialFunctions v0.10.3
  [90137ffa] + StaticArrays v0.12.4
  [2913bbd2] + StatsBase v0.33.1
  [4c63d2b9] + StatsFuns v0.9.5
  [7522ee7d] + SweepOperator v0.3.0
  [3783bdb8] + TableTraits v1.0.0
  [bd369af6] + Tables v1.1.0
  [56f22d72] + Artifacts
  [2a0f44e3] + Base64
  [ade2ca70] + Dates
  [8bb1440f] + DelimitedFiles
  [8ba89e20] + Distributed
  [9fa8497b] + Future
  [b77e0a4c] + InteractiveUtils
  [76f85450] + LibGit2
  [8f399da3] + Libdl
  [37e2e46d] + LinearAlgebra
  [56ddb016] + Logging
  [d6f4376e] + Markdown
  [a63ad114] + Mmap
  [44cfe95a] + Pkg
  [de0858da] + Printf
  [3fa0cd96] + REPL
  [9a3f8284] + Random
  [ea8e919c] + SHA
  [9e88b42a] + Serialization
  [1a1011a3] + SharedArrays
  [6462fe0b] + Sockets
  [2f01184e] + SparseArrays
  [10745b16] + Statistics
  [4607b0f0] + SuiteSparse
  [fa267f1f] + TOML
  [8dfed614] + Test
  [cf7118a7] + UUIDs
  [4ec0a83e] + Unicode
    Testing Pathogen
Status `/tmp/jl_8jv4R1/Project.toml`
  [a93c6f00] DataFrames v0.20.2
  [b4f34e82] Distances v0.9.1
  [31c24e10] Distributions v0.23.12
  [a15396b6] OnlineStats v1.5.6
  [c8189ad9] Pathogen v0.4.12
  [92933f4c] ProgressMeter v1.4.0
  [3cdcf5f2] RecipesBase v1.1.0
  [2913bbd2] StatsBase v0.33.1
  [8ba89e20] Distributed
  [37e2e46d] LinearAlgebra
  [56ddb016] Logging
  [9a3f8284] Random
  [10745b16] Statistics
  [8dfed614] Test
Status `/tmp/jl_8jv4R1/Manifest.toml`
  [1520ce14] AbstractTrees v0.3.3
  [324d7699] CategoricalArrays v0.7.7
  [34da2185] Compat v3.18.0
  [e66e0078] CompilerSupportLibraries_jll v0.3.3+0
  [9a962f9c] DataAPI v1.3.0
  [a93c6f00] DataFrames v0.20.2
  [864edb3b] DataStructures v0.18.6
  [e2d170a0] DataValueInterfaces v1.0.0
  [b4f34e82] Distances v0.9.1
  [31c24e10] Distributions v0.23.12
  [1a297f60] FillArrays v0.9.6
  [41ab1584] InvertedIndices v1.0.0
  [82899510] IteratorInterfaceExtensions v1.0.0
  [682c06a0] JSON v0.21.1
  [e1d29d7a] Missings v0.4.4
  [a15396b6] OnlineStats v1.5.6
  [925886fa] OnlineStatsBase v1.4.4
  [efe28fd5] OpenSpecFun_jll v0.5.3+3
  [bac558e1] OrderedCollections v1.3.1
  [90014a1f] PDMats v0.10.1
  [69de0a69] Parsers v1.0.10
  [c8189ad9] Pathogen v0.4.12
  [2dfb63ee] PooledArrays v0.5.3
  [92933f4c] ProgressMeter v1.4.0
  [1fd47b50] QuadGK v2.4.1
  [3cdcf5f2] RecipesBase v1.1.0
  [189a3867] Reexport v0.2.0
  [79098fc4] Rmath v0.6.1
  [f50d1b31] Rmath_jll v0.2.2+1
  [a2af1166] SortingAlgorithms v0.3.1
  [276daf66] SpecialFunctions v0.10.3
  [90137ffa] StaticArrays v0.12.4
  [2913bbd2] StatsBase v0.33.1
  [4c63d2b9] StatsFuns v0.9.5
  [7522ee7d] SweepOperator v0.3.0
  [3783bdb8] TableTraits v1.0.0
  [bd369af6] Tables v1.1.0
  [56f22d72] Artifacts
  [2a0f44e3] Base64
  [ade2ca70] Dates
  [8bb1440f] DelimitedFiles
  [8ba89e20] Distributed
  [9fa8497b] Future
  [b77e0a4c] InteractiveUtils
  [76f85450] LibGit2
  [8f399da3] Libdl
  [37e2e46d] LinearAlgebra
  [56ddb016] Logging
  [d6f4376e] Markdown
  [a63ad114] Mmap
  [44cfe95a] Pkg
  [de0858da] Printf
  [3fa0cd96] REPL
  [9a3f8284] Random
  [ea8e919c] SHA
  [9e88b42a] Serialization
  [1a1011a3] SharedArrays
  [6462fe0b] Sockets
  [2f01184e] SparseArrays
  [10745b16] Statistics
  [4607b0f0] SuiteSparse
  [fa267f1f] TOML
  [8dfed614] Test
  [cf7118a7] UUIDs
  [4ec0a83e] Unicode
    Testing Running tests...
Initialization progress  0%%|▁                           |  ETA: 1:17:27[KInitialization progress100%%|████████████████████████████| Time: 0:00:17[K
MCMC progress  0%%|▁                                     |  ETA: 1:38:46[KMCMC progress  7%%|██▋                                   |  ETA: 0:04:25[KMCMC progress  8%%|███▁                                  |  ETA: 0:03:40[KMCMC progress 17%%|██████▋                               |  ETA: 0:01:36[KMCMC progress 28%%|██████████▌                           |  ETA: 0:00:53[KMCMC progress 36%%|█████████████▊                        |  ETA: 0:00:36[KMCMC progress 47%%|█████████████████▊                    |  ETA: 0:00:23[KMCMC progress 55%%|████████████████████▊                 |  ETA: 0:00:17[KMCMC progress 66%%|█████████████████████████▁            |  ETA: 0:00:11[KMCMC progress 76%%|█████████████████████████████         |  ETA: 0:00:06[KMCMC progress 86%%|████████████████████████████████▌     |  ETA: 0:00:04[KMCMC progress 91%%|██████████████████████████████████▊   |  ETA: 0:00:02[KMCMC progress 97%%|█████████████████████████████████████ |  ETA: 0:00:01[KMCMC progress100%%|██████████████████████████████████████| Time: 0:00:25[K
Initialization progress  2%%|▌                           |  ETA: 0:02:09[KInitialization progress100%%|████████████████████████████| Time: 0:00:02[K
MCMC progress  1%%|▁                                     |  ETA: 0:02:58[KMCMC progress 40%%|███████████████▁                      |  ETA: 0:00:03[KMCMC progress 78%%|█████████████████████████████▋        |  ETA: 0:00:01[KMCMC progress100%%|██████████████████████████████████████| Time: 0:00:02[K
Test Summary: | Pass  Total
SEIR Model    |   83     83
Initialization progress  0%%|▁                           |  ETA: 0:36:54[KInitialization progress 28%%|███████▉                    |  ETA: 0:00:19[KInitialization progress 48%%|█████████████▌              |  ETA: 0:00:08[KInitialization progress 64%%|██████████████████          |  ETA: 0:00:04[KInitialization progress 89%%|█████████████████████████   |  ETA: 0:00:01[KInitialization progress 96%%|███████████████████████████ |  ETA: 0:00:00[KInitialization progress100%%|████████████████████████████| Time: 0:00:08[K
MCMC progress  0%%|▁                                     |  ETA: 0:33:39[KMCMC progress 19%%|███████▁                              |  ETA: 0:00:29[KMCMC progress 33%%|████████████▁                         |  ETA: 0:00:14[KMCMC progress 46%%|█████████████████▁                    |  ETA: 0:00:08[KMCMC progress 59%%|██████████████████████▁               |  ETA: 0:00:05[KMCMC progress 65%%|████████████████████████▉             |  ETA: 0:00:04[KMCMC progress 80%%|██████████████████████████████▁       |  ETA: 0:00:02[KMCMC progress 86%%|████████████████████████████████▊     |  ETA: 0:00:01[KMCMC progress 92%%|██████████████████████████████████▉   |  ETA: 0:00:01[KMCMC progress 97%%|█████████████████████████████████████ |  ETA: 0:00:00[KMCMC progress100%%|██████████████████████████████████████| Time: 0:00:08[K
Initialization progress  4%%|█▁                          |  ETA: 0:00:42[KInitialization progress100%%|████████████████████████████| Time: 0:00:01[K
MCMC progress  1%%|▁                                     |  ETA: 0:00:19[KMCMC progress 15%%|█████▊                                |  ETA: 0:00:02[KMCMC progress 81%%|██████████████████████████████▊       |  ETA: 0:00:00[KMCMC progress 94%%|███████████████████████████████████▊  |  ETA: 0:00:00[KMCMC progress100%%|██████████████████████████████████████| Time: 0:00:00[K
Test Summary: | Pass  Total
SEI Model     |  164    164
Initialization progress  0%%|▁                           |  ETA: 0:36:53[KInitialization progress 62%%|█████████████████▁          |  ETA: 0:00:05[KInitialization progress 67%%|██████████████████▋         |  ETA: 0:00:04[KInitialization progress 93%%|██████████████████████████  |  ETA: 0:00:01[KInitialization progress 97%%|███████████████████████████▁|  ETA: 0:00:00[KInitialization progress 97%%|███████████████████████████▁|  ETA: 0:00:00[KInitialization progress100%%|████████████████████████████| Time: 0:00:08[K
MCMC progress  0%%|▁                                     |  ETA: 0:28:45[KMCMC progress  8%%|███                                   |  ETA: 0:01:08[KMCMC progress 13%%|█████                                 |  ETA: 0:00:40[KMCMC progress 22%%|████████▁                             |  ETA: 0:00:22[KMCMC progress 33%%|████████████▁                         |  ETA: 0:00:13[KMCMC progress 41%%|███████████████▋                      |  ETA: 0:00:09[KMCMC progress 45%%|█████████████████                     |  ETA: 0:00:08[KMCMC progress 53%%|████████████████████▁                 |  ETA: 0:00:06[KMCMC progress 59%%|██████████████████████▁               |  ETA: 0:00:05[KMCMC progress 70%%|██████████████████████████▊           |  ETA: 0:00:03[KMCMC progress 82%%|███████████████████████████████▁      |  ETA: 0:00:02[KMCMC progress 87%%|█████████████████████████████████     |  ETA: 0:00:01[KMCMC progress 94%%|███████████████████████████████████▊  |  ETA: 0:00:00[KMCMC progress 97%%|█████████████████████████████████████ |  ETA: 0:00:00[KMCMC progress100%%|██████████████████████████████████████| Time: 0:00:07[K
Initialization progress  4%%|█▁                          |  ETA: 0:00:41[KInitialization progress100%%|████████████████████████████| Time: 0:00:01[K
MCMC progress  1%%|▁                                     |  ETA: 0:00:54[KMCMC progress 26%%|█████████▉                            |  ETA: 0:00:02[KMCMC progress 94%%|███████████████████████████████████▊  |  ETA: 0:00:00[KMCMC progress100%%|██████████████████████████████████████| Time: 0:00:00[K
Test Summary: | Pass  Total
SIR Model     |  170    170
Initialization progress  0%%|▁                           |  ETA: 0:38:39[KInitialization progress 52%%|██████████████▌             |  ETA: 0:00:07[KInitialization progress 83%%|███████████████████████▁    |  ETA: 0:00:02[KInitialization progress 92%%|█████████████████████████▊  |  ETA: 0:00:01[KInitialization progress 96%%|██████████████████████████▉ |  ETA: 0:00:00[KInitialization progress100%%|████████████████████████████| Time: 0:00:08[K
MCMC progress  0%%|▁                                     |  ETA: 0:29:19[KMCMC progress 10%%|███▋                                  |  ETA: 0:00:56[KMCMC progress 21%%|████████▁                             |  ETA: 0:00:22[KMCMC progress 31%%|███████████▊                          |  ETA: 0:00:14[KMCMC progress 41%%|███████████████▌                      |  ETA: 0:00:09[KMCMC progress 47%%|█████████████████▊                    |  ETA: 0:00:07[KMCMC progress 53%%|████████████████████                  |  ETA: 0:00:06[KMCMC progress 71%%|██████████████████████████▉           |  ETA: 0:00:03[KMCMC progress 84%%|███████████████████████████████▉      |  ETA: 0:00:01[KMCMC progress 88%%|█████████████████████████████████▁    |  ETA: 0:00:01[KMCMC progress 94%%|███████████████████████████████████▊  |  ETA: 0:00:00[KMCMC progress 97%%|█████████████████████████████████████ |  ETA: 0:00:00[KMCMC progress100%%|██████████████████████████████████████| Time: 0:00:07[K
Initialization progress  4%%|█▁                          |  ETA: 0:00:36[KInitialization progress100%%|████████████████████████████| Time: 0:00:01[K
MCMC progress  1%%|▁                                     |  ETA: 0:00:23[KMCMC progress 75%%|████████████████████████████▌         |  ETA: 0:00:00[K┌ Error: All transmission rates = 0.0, No transmission generated
│   external_or_internal =
│    2-element StatsBase.Weights{Float64, Float64, Vector{Float64}}:
│     0.0
│     0.0
└ @ Pathogen ~/.julia/packages/Pathogen/39xDw/src/inference/generate.jl:28
MCMC progress 89%%|█████████████████████████████████▉    |  ETA: 0:00:01[K┌ Error: All transmission rates = 0.0, No transmission generated
│   external_or_internal =
│    2-element StatsBase.Weights{Float64, Float64, Vector{Float64}}:
│     0.0
│     0.0
└ @ Pathogen ~/.julia/packages/Pathogen/39xDw/src/inference/generate.jl:28
┌ Error: All transmission rates = 0.0, No transmission generated
│   external_or_internal =
│    2-element StatsBase.Weights{Float64, Float64, Vector{Float64}}:
│     0.0
│     0.0
└ @ Pathogen ~/.julia/packages/Pathogen/39xDw/src/inference/generate.jl:28
┌ Error: All transmission rates = 0.0, No transmission generated
│   external_or_internal =
│    2-element StatsBase.Weights{Float64, Float64, Vector{Float64}}:
│     0.0
│     0.0
└ @ Pathogen ~/.julia/packages/Pathogen/39xDw/src/inference/generate.jl:28
┌ Error: All transmission rates = 0.0, No transmission generated
│   external_or_internal =
│    2-element StatsBase.Weights{Float64, Float64, Vector{Float64}}:
│     0.0
│     0.0
└ @ Pathogen ~/.julia/packages/Pathogen/39xDw/src/inference/generate.jl:28
┌ Error: All transmission rates = 0.0, No transmission generated
│   external_or_internal =
│    2-element StatsBase.Weights{Float64, Float64, Vector{Float64}}:
│     0.0
│     0.0
└ @ Pathogen ~/.julia/packages/Pathogen/39xDw/src/inference/generate.jl:28
┌ Error: All transmission rates = 0.0, No transmission generated
│   external_or_internal =
│    2-element StatsBase.Weights{Float64, Float64, Vector{Float64}}:
│     0.0
│     0.0
└ @ Pathogen ~/.julia/packages/Pathogen/39xDw/src/inference/generate.jl:28
┌ Error: All transmission rates = 0.0, No transmission generated
│   external_or_internal =
│    2-element StatsBase.Weights{Float64, Float64, Vector{Float64}}:
│     0.0
│     0.0
└ @ Pathogen ~/.julia/packages/Pathogen/39xDw/src/inference/generate.jl:28
┌ Error: All transmission rates = 0.0, No transmission generated
│   external_or_internal =
│    2-element StatsBase.Weights{Float64, Float64, Vector{Float64}}:
│     0.0
│     0.0
└ @ Pathogen ~/.julia/packages/Pathogen/39xDw/src/inference/generate.jl:28
┌ Error: All transmission rates = 0.0, No transmission generated
│   external_or_internal =
│    2-element StatsBase.Weights{Float64, Float64, Vector{Float64}}:
│     0.0
│     0.0
└ @ Pathogen ~/.julia/packages/Pathogen/39xDw/src/inference/generate.jl:28
┌ Error: All transmission rates = 0.0, No transmission generated
│   external_or_internal =
│    2-element StatsBase.Weights{Float64, Float64, Vector{Float64}}:
│     0.0
│     0.0
└ @ Pathogen ~/.julia/packages/Pathogen/39xDw/src/inference/generate.jl:28
┌ Error: All transmission rates = 0.0, No transmission generated
│   external_or_internal =
│    2-element StatsBase.Weights{Float64, Float64, Vector{Float64}}:
│     0.0
│     0.0
└ @ Pathogen ~/.julia/packages/Pathogen/39xDw/src/inference/generate.jl:28
MCMC progress100%%|██████████████████████████████████████| Time: 0:00:04[K
SI Model: Test Failed at /home/pkgeval/.julia/packages/Pathogen/39xDw/test/runtests.jl:318
  Expression: i in Pathogen._pathway_from(pt[2], tn, depth = 1)
   Evaluated: 3 in Int64[]
Stacktrace:
 [1] top-level scope
   @ ~/.julia/packages/Pathogen/39xDw/test/runtests.jl:318
 [2] top-level scope
   @ /workspace/srcdir/usr/share/julia/stdlib/v1.6/Test/src/Test.jl:1113
 [3] top-level scope
   @ ~/.julia/packages/Pathogen/39xDw/test/runtests.jl:258
Test Summary: | Pass  Fail  Total
SI Model      |  107     1    108
ERROR: LoadError: Some tests did not pass: 107 passed, 1 failed, 0 errored, 0 broken.
in expression starting at /home/pkgeval/.julia/packages/Pathogen/39xDw/test/runtests.jl:257
ERROR: Package Pathogen errored during testing
Stacktrace:
  [1] pkgerror(msg::String)
    @ Pkg.Types /workspace/srcdir/usr/share/julia/stdlib/v1.6/Pkg/src/Types.jl:52
  [2] test(ctx::Pkg.Types.Context, pkgs::Vector{Pkg.Types.PackageSpec}; coverage::Bool, julia_args::Cmd, test_args::Cmd, test_fn::Nothing)
    @ Pkg.Operations /workspace/srcdir/usr/share/julia/stdlib/v1.6/Pkg/src/Operations.jl:1609
  [3] test(ctx::Pkg.Types.Context, pkgs::Vector{Pkg.Types.PackageSpec}; coverage::Bool, test_fn::Nothing, julia_args::Cmd, test_args::Cmd, kwargs::Base.Iterators.Pairs{Union{}, Union{}, Tuple{}, NamedTuple{(), Tuple{}}})
    @ Pkg.API /workspace/srcdir/usr/share/julia/stdlib/v1.6/Pkg/src/API.jl:331
  [4] test(ctx::Pkg.Types.Context, pkgs::Vector{Pkg.Types.PackageSpec})
    @ Pkg.API /workspace/srcdir/usr/share/julia/stdlib/v1.6/Pkg/src/API.jl:318
  [5] #test#62
    @ /workspace/srcdir/usr/share/julia/stdlib/v1.6/Pkg/src/API.jl:68 [inlined]
  [6] test
    @ /workspace/srcdir/usr/share/julia/stdlib/v1.6/Pkg/src/API.jl:68 [inlined]
  [7] #test#61
    @ /workspace/srcdir/usr/share/julia/stdlib/v1.6/Pkg/src/API.jl:66 [inlined]
  [8] test
    @ /workspace/srcdir/usr/share/julia/stdlib/v1.6/Pkg/src/API.jl:66 [inlined]
  [9] test(pkg::String; kwargs::Base.Iterators.Pairs{Union{}, Union{}, Tuple{}, NamedTuple{(), Tuple{}}})
    @ Pkg.API /workspace/srcdir/usr/share/julia/stdlib/v1.6/Pkg/src/API.jl:65
 [10] test(pkg::String)
    @ Pkg.API /workspace/srcdir/usr/share/julia/stdlib/v1.6/Pkg/src/API.jl:65
 [11] top-level scope
    @ none:19
