Julia Version 1.6.0-DEV.929
Commit a7ce2a2de7 (2020-09-16 16:46 UTC)
Platform Info:
  OS: Linux (x86_64-pc-linux-gnu)
  CPU: Intel(R) Xeon(R) Silver 4114 CPU @ 2.20GHz
  WORD_SIZE: 64
  LIBM: libopenlibm
  LLVM: libLLVM-9.0.1 (ORCJIT, skylake-avx512)
Environment:
  JULIA_DEPOT_PATH = ::/usr/local/share/julia
  JULIA_NUM_THREADS = 2

  Resolving package versions...
[ Info: LEGAL NOTICE: package operations send anonymous data about your system to https://pkg.julialang.org (your current package server), including the operating system and Julia versions you are using, and a random client UUID. Running `Pkg.telemetryinfo()` will show exactly what data is sent. See https://julialang.org/legal/data/ for more details about what this data is used for, how long it is retained, and how to opt out of sending it.
  Installed OpenSpecFun_jll ────────────── v0.5.3+3
  Installed InvertedIndices ────────────── v1.0.0
  Installed QuadGK ─────────────────────── v2.4.1
  Installed OrderedCollections ─────────── v1.3.1
  Installed AbstractTrees ──────────────── v0.3.3
  Installed DataFrames ─────────────────── v0.20.2
  Installed Pathogen ───────────────────── v0.4.12
  Installed Distributions ──────────────── v0.23.11
  Installed JSON ───────────────────────── v0.21.1
  Installed TableTraits ────────────────── v1.0.0
  Installed CompilerSupportLibraries_jll ─ v0.3.3+0
  Installed Compat ─────────────────────── v3.16.0
  Installed ProgressMeter ──────────────── v1.3.3
  Installed CategoricalArrays ──────────── v0.7.7
  Installed StatsBase ──────────────────── v0.33.1
  Installed OnlineStats ────────────────── v1.5.6
  Installed SpecialFunctions ───────────── v0.10.3
  Installed OnlineStatsBase ────────────── v1.4.3
  Installed IteratorInterfaceExtensions ── v1.0.0
  Installed Tables ─────────────────────── v1.0.5
  Installed StatsFuns ──────────────────── v0.9.5
  Installed FillArrays ─────────────────── v0.9.6
  Installed PooledArrays ───────────────── v0.5.3
  Installed DataValueInterfaces ────────── v1.0.0
  Installed SortingAlgorithms ──────────── v0.3.1
  Installed SweepOperator ──────────────── v0.3.0
  Installed Reexport ───────────────────── v0.2.0
  Installed Parsers ────────────────────── v1.0.10
  Installed Rmath_jll ──────────────────── v0.2.2+1
  Installed PDMats ─────────────────────── v0.10.1
  Installed RecipesBase ────────────────── v1.1.0
  Installed DataAPI ────────────────────── v1.3.0
  Installed Rmath ──────────────────────── v0.6.1
  Installed Missings ───────────────────── v0.4.4
  Installed DataStructures ─────────────── v0.18.6
Updating `~/.julia/environments/v1.6/Project.toml`
  [c8189ad9] + Pathogen v0.4.12
Updating `~/.julia/environments/v1.6/Manifest.toml`
  [1520ce14] + AbstractTrees v0.3.3
  [324d7699] + CategoricalArrays v0.7.7
  [34da2185] + Compat v3.16.0
  [e66e0078] + CompilerSupportLibraries_jll v0.3.3+0
  [9a962f9c] + DataAPI v1.3.0
  [a93c6f00] + DataFrames v0.20.2
  [864edb3b] + DataStructures v0.18.6
  [e2d170a0] + DataValueInterfaces v1.0.0
  [31c24e10] + Distributions v0.23.11
  [1a297f60] + FillArrays v0.9.6
  [41ab1584] + InvertedIndices v1.0.0
  [82899510] + IteratorInterfaceExtensions v1.0.0
  [682c06a0] + JSON v0.21.1
  [e1d29d7a] + Missings v0.4.4
  [a15396b6] + OnlineStats v1.5.6
  [925886fa] + OnlineStatsBase v1.4.3
  [efe28fd5] + OpenSpecFun_jll v0.5.3+3
  [bac558e1] + OrderedCollections v1.3.1
  [90014a1f] + PDMats v0.10.1
  [69de0a69] + Parsers v1.0.10
  [c8189ad9] + Pathogen v0.4.12
  [2dfb63ee] + PooledArrays v0.5.3
  [92933f4c] + ProgressMeter v1.3.3
  [1fd47b50] + QuadGK v2.4.1
  [3cdcf5f2] + RecipesBase v1.1.0
  [189a3867] + Reexport v0.2.0
  [79098fc4] + Rmath v0.6.1
  [f50d1b31] + Rmath_jll v0.2.2+1
  [a2af1166] + SortingAlgorithms v0.3.1
  [276daf66] + SpecialFunctions v0.10.3
  [2913bbd2] + StatsBase v0.33.1
  [4c63d2b9] + StatsFuns v0.9.5
  [7522ee7d] + SweepOperator v0.3.0
  [3783bdb8] + TableTraits v1.0.0
  [bd369af6] + Tables v1.0.5
  [2a0f44e3] + Base64
  [ade2ca70] + Dates
  [8bb1440f] + DelimitedFiles
  [8ba89e20] + Distributed
  [9fa8497b] + Future
  [b77e0a4c] + InteractiveUtils
  [76f85450] + LibGit2
  [8f399da3] + Libdl
  [37e2e46d] + LinearAlgebra
  [56ddb016] + Logging
  [d6f4376e] + Markdown
  [a63ad114] + Mmap
  [44cfe95a] + Pkg
  [de0858da] + Printf
  [3fa0cd96] + REPL
  [9a3f8284] + Random
  [ea8e919c] + SHA
  [9e88b42a] + Serialization
  [1a1011a3] + SharedArrays
  [6462fe0b] + Sockets
  [2f01184e] + SparseArrays
  [10745b16] + Statistics
  [4607b0f0] + SuiteSparse
  [fa267f1f] + TOML
  [8dfed614] + Test
  [cf7118a7] + UUIDs
  [4ec0a83e] + Unicode
    Testing Pathogen
Status `/tmp/jl_qlSo21/Project.toml`
  [a93c6f00] DataFrames v0.20.2
  [b4f34e82] Distances v0.9.0
  [31c24e10] Distributions v0.23.11
  [a15396b6] OnlineStats v1.5.6
  [c8189ad9] Pathogen v0.4.12
  [92933f4c] ProgressMeter v1.3.3
  [3cdcf5f2] RecipesBase v1.1.0
  [2913bbd2] StatsBase v0.33.1
  [8ba89e20] Distributed
  [37e2e46d] LinearAlgebra
  [56ddb016] Logging
  [9a3f8284] Random
  [10745b16] Statistics
  [8dfed614] Test
Status `/tmp/jl_qlSo21/Manifest.toml`
  [1520ce14] AbstractTrees v0.3.3
  [324d7699] CategoricalArrays v0.7.7
  [34da2185] Compat v3.16.0
  [e66e0078] CompilerSupportLibraries_jll v0.3.3+0
  [9a962f9c] DataAPI v1.3.0
  [a93c6f00] DataFrames v0.20.2
  [864edb3b] DataStructures v0.18.6
  [e2d170a0] DataValueInterfaces v1.0.0
  [b4f34e82] Distances v0.9.0
  [31c24e10] Distributions v0.23.11
  [1a297f60] FillArrays v0.9.6
  [41ab1584] InvertedIndices v1.0.0
  [82899510] IteratorInterfaceExtensions v1.0.0
  [682c06a0] JSON v0.21.1
  [e1d29d7a] Missings v0.4.4
  [a15396b6] OnlineStats v1.5.6
  [925886fa] OnlineStatsBase v1.4.3
  [efe28fd5] OpenSpecFun_jll v0.5.3+3
  [bac558e1] OrderedCollections v1.3.1
  [90014a1f] PDMats v0.10.1
  [69de0a69] Parsers v1.0.10
  [c8189ad9] Pathogen v0.4.12
  [2dfb63ee] PooledArrays v0.5.3
  [92933f4c] ProgressMeter v1.3.3
  [1fd47b50] QuadGK v2.4.1
  [3cdcf5f2] RecipesBase v1.1.0
  [189a3867] Reexport v0.2.0
  [79098fc4] Rmath v0.6.1
  [f50d1b31] Rmath_jll v0.2.2+1
  [a2af1166] SortingAlgorithms v0.3.1
  [276daf66] SpecialFunctions v0.10.3
  [2913bbd2] StatsBase v0.33.1
  [4c63d2b9] StatsFuns v0.9.5
  [7522ee7d] SweepOperator v0.3.0
  [3783bdb8] TableTraits v1.0.0
  [bd369af6] Tables v1.0.5
  [2a0f44e3] Base64
  [ade2ca70] Dates
  [8bb1440f] DelimitedFiles
  [8ba89e20] Distributed
  [9fa8497b] Future
  [b77e0a4c] InteractiveUtils
  [76f85450] LibGit2
  [8f399da3] Libdl
  [37e2e46d] LinearAlgebra
  [56ddb016] Logging
  [d6f4376e] Markdown
  [a63ad114] Mmap
  [44cfe95a] Pkg
  [de0858da] Printf
  [3fa0cd96] REPL
  [9a3f8284] Random
  [ea8e919c] SHA
  [9e88b42a] Serialization
  [1a1011a3] SharedArrays
  [6462fe0b] Sockets
  [2f01184e] SparseArrays
  [10745b16] Statistics
  [4607b0f0] SuiteSparse
  [fa267f1f] TOML
  [8dfed614] Test
  [cf7118a7] UUIDs
  [4ec0a83e] Unicode
    Testing Running tests...
Initialization progress  0%%|▏                           |  ETA: 1:34:01[KInitialization progress100%%|████████████████████████████| Time: 0:00:20[K
MCMC progress  0%%|▏                                     |  ETA: 1:42:12[KMCMC progress  5%%|██                                    |  ETA: 0:06:06[KMCMC progress 10%%|███▊                                  |  ETA: 0:03:06[KMCMC progress 13%%|█████▏                                |  ETA: 0:02:15[KMCMC progress 17%%|██████▋                               |  ETA: 0:01:40[KMCMC progress 21%%|████████▏                             |  ETA: 0:01:18[KMCMC progress 25%%|█████████▍                            |  ETA: 0:01:05[KMCMC progress 30%%|███████████▍                          |  ETA: 0:00:50[KMCMC progress 36%%|█████████████▊                        |  ETA: 0:00:37[KMCMC progress 44%%|████████████████▊                     |  ETA: 0:00:27[KMCMC progress 49%%|██████████████████▊                   |  ETA: 0:00:22[KMCMC progress 55%%|█████████████████████                 |  ETA: 0:00:18[KMCMC progress 62%%|███████████████████████▍              |  ETA: 0:00:14[KMCMC progress 69%%|██████████████████████████▏           |  ETA: 0:00:10[KMCMC progress 73%%|███████████████████████████▉          |  ETA: 0:00:08[KMCMC progress 78%%|█████████████████████████████▋        |  ETA: 0:00:06[KMCMC progress 83%%|███████████████████████████████▍      |  ETA: 0:00:05[KMCMC progress 87%%|████████████████████████████████▉     |  ETA: 0:00:03[KMCMC progress 88%%|█████████████████████████████████▌    |  ETA: 0:00:03[KMCMC progress 94%%|███████████████████████████████████▉  |  ETA: 0:00:01[KMCMC progress 95%%|████████████████████████████████████▏ |  ETA: 0:00:01[KMCMC progress 97%%|█████████████████████████████████████ |  ETA: 0:00:01[KMCMC progress100%%|██████████████████████████████████████| Time: 0:00:27[K
Initialization progress  2%%|▌                           |  ETA: 0:02:05[KInitialization progress100%%|████████████████████████████| Time: 0:00:02[K
MCMC progress  1%%|▍                                     |  ETA: 0:03:35[KMCMC progress 17%%|██████▌                               |  ETA: 0:00:11[KMCMC progress 42%%|████████████████                      |  ETA: 0:00:03[KMCMC progress 65%%|████████████████████████▊             |  ETA: 0:00:01[KMCMC progress 84%%|███████████████████████████████▉      |  ETA: 0:00:00[KMCMC progress100%%|██████████████████████████████████████| Time: 0:00:02[K
Test Summary: | Pass  Total
SEIR Model    |   82     82
Initialization progress  0%%|▏                           |  ETA: 0:44:50[KInitialization progress 22%%|██████▏                     |  ETA: 0:00:33[KInitialization progress 38%%|██████████▊                 |  ETA: 0:00:15[KInitialization progress 56%%|███████████████▋            |  ETA: 0:00:07[KInitialization progress 76%%|█████████████████████▏      |  ETA: 0:00:03[KInitialization progress 86%%|████████████████████████▏   |  ETA: 0:00:02[KInitialization progress 90%%|█████████████████████████▎  |  ETA: 0:00:01[KInitialization progress 97%%|███████████████████████████▏|  ETA: 0:00:00[KInitialization progress100%%|████████████████████████████| Time: 0:00:09[K
MCMC progress  0%%|▏                                     |  ETA: 0:34:25[KMCMC progress  2%%|▋                                     |  ETA: 0:06:55[KMCMC progress  6%%|██▍                                   |  ETA: 0:01:46[KMCMC progress 11%%|████▏                                 |  ETA: 0:00:59[KMCMC progress 17%%|██████▋                               |  ETA: 0:00:35[KMCMC progress 22%%|████████▎                             |  ETA: 0:00:27[KMCMC progress 29%%|███████████▏                          |  ETA: 0:00:18[KMCMC progress 37%%|█████████████▉                        |  ETA: 0:00:13[KMCMC progress 47%%|█████████████████▊                    |  ETA: 0:00:09[KMCMC progress 57%%|█████████████████████▊                |  ETA: 0:00:06[KMCMC progress 62%%|███████████████████████▌              |  ETA: 0:00:05[KMCMC progress 69%%|██████████████████████████▎           |  ETA: 0:00:04[KMCMC progress 75%%|████████████████████████████▋         |  ETA: 0:00:03[KMCMC progress 81%%|██████████████████████████████▊       |  ETA: 0:00:02[KMCMC progress 84%%|███████████████████████████████▉      |  ETA: 0:00:02[KMCMC progress 88%%|█████████████████████████████████▋    |  ETA: 0:00:01[KMCMC progress 94%%|███████████████████████████████████▋  |  ETA: 0:00:01[KMCMC progress 95%%|████████████████████████████████████▏ |  ETA: 0:00:00[KMCMC progress 97%%|█████████████████████████████████████ |  ETA: 0:00:00[KMCMC progress100%%|██████████████████████████████████████| Time: 0:00:09[K
Initialization progress  4%%|█▏                          |  ETA: 0:00:42[KInitialization progress100%%|████████████████████████████| Time: 0:00:01[K
MCMC progress  1%%|▍                                     |  ETA: 0:00:28[KMCMC progress 15%%|█████▊                                |  ETA: 0:00:02[KMCMC progress 53%%|████████████████████▏                 |  ETA: 0:00:00[KMCMC progress 94%%|███████████████████████████████████▊  |  ETA: 0:00:00[KMCMC progress100%%|██████████████████████████████████████| Time: 0:00:00[K
Test Summary: | Pass  Total
SEI Model     |  163    163
Initialization progress  0%%|▏                           |  ETA: 0:51:45[KInitialization progress 14%%|███▉                        |  ETA: 0:01:04[KInitialization progress 38%%|██████████▌                 |  ETA: 0:00:18[KInitialization progress 62%%|█████████████████▍          |  ETA: 0:00:07[KInitialization progress 87%%|████████████████████████▌   |  ETA: 0:00:02[KInitialization progress 95%%|██████████████████████████▊ |  ETA: 0:00:01[KInitialization progress 97%%|███████████████████████████▏|  ETA: 0:00:00[KInitialization progress100%%|████████████████████████████| Time: 0:00:11[K
MCMC progress  0%%|▏                                     |  ETA: 0:34:30[KMCMC progress  4%%|█▋                                    |  ETA: 0:02:35[KMCMC progress  9%%|███▍                                  |  ETA: 0:01:12[KMCMC progress 14%%|█████▍                                |  ETA: 0:00:44[KMCMC progress 20%%|███████▌                              |  ETA: 0:00:30[KMCMC progress 27%%|██████████▏                           |  ETA: 0:00:20[KMCMC progress 33%%|████████████▍                         |  ETA: 0:00:16[KMCMC progress 39%%|███████████████                       |  ETA: 0:00:12[KMCMC progress 44%%|████████████████▉                     |  ETA: 0:00:10[KMCMC progress 48%%|██████████████████▎                   |  ETA: 0:00:09[KMCMC progress 55%%|████████████████████▉                 |  ETA: 0:00:07[KMCMC progress 57%%|█████████████████████▋                |  ETA: 0:00:06[KMCMC progress 62%%|███████████████████████▋              |  ETA: 0:00:05[KMCMC progress 68%%|█████████████████████████▊            |  ETA: 0:00:04[KMCMC progress 73%%|███████████████████████████▉          |  ETA: 0:00:03[KMCMC progress 74%%|████████████████████████████▎         |  ETA: 0:00:03[KMCMC progress 77%%|█████████████████████████████▍        |  ETA: 0:00:03[KMCMC progress 82%%|███████████████████████████████▏      |  ETA: 0:00:02[KMCMC progress 87%%|█████████████████████████████████▏    |  ETA: 0:00:01[KMCMC progress 93%%|███████████████████████████████████▌  |  ETA: 0:00:01[KMCMC progress 97%%|█████████████████████████████████████ |  ETA: 0:00:00[KMCMC progress100%%|██████████████████████████████████████| Time: 0:00:09[K
Initialization progress  4%%|█▏                          |  ETA: 0:00:41[KInitialization progress100%%|████████████████████████████| Time: 0:00:01[K
MCMC progress  1%%|▍                                     |  ETA: 0:00:29[KMCMC progress 24%%|█████████▏                            |  ETA: 0:00:01[KMCMC progress 39%%|██████████████▉                       |  ETA: 0:00:01[KMCMC progress 71%%|███████████████████████████           |  ETA: 0:00:00[KMCMC progress100%%|██████████████████████████████████████| Time: 0:00:00[K
Test Summary: | Pass  Total
SIR Model     |  175    175
Initialization progress  0%%|▏                           |  ETA: 0:50:25[KInitialization progress 20%%|█████▌                      |  ETA: 0:00:42[KInitialization progress 41%%|███████████▌                |  ETA: 0:00:15[KInitialization progress 62%%|█████████████████▎          |  ETA: 0:00:06[KInitialization progress 72%%|████████████████████▎       |  ETA: 0:00:04[KInitialization progress 88%%|████████████████████████▌   |  ETA: 0:00:01[KInitialization progress 93%%|██████████████████████████  |  ETA: 0:00:01[KInitialization progress 97%%|███████████████████████████▏|  ETA: 0:00:00[KInitialization progress100%%|████████████████████████████| Time: 0:00:10[K
MCMC progress  0%%|▏                                     |  ETA: 0:36:33[KMCMC progress  9%%|███▌                                  |  ETA: 0:01:12[KMCMC progress 18%%|███████                               |  ETA: 0:00:34[KMCMC progress 26%%|█████████▉                            |  ETA: 0:00:22[KMCMC progress 35%%|█████████████▎                        |  ETA: 0:00:14[KMCMC progress 41%%|███████████████▌                      |  ETA: 0:00:11[KMCMC progress 42%%|████████████████▏                     |  ETA: 0:00:11[KMCMC progress 51%%|███████████████████▌                  |  ETA: 0:00:08[KMCMC progress 55%%|████████████████████▊                 |  ETA: 0:00:07[KMCMC progress 67%%|█████████████████████████▍            |  ETA: 0:00:04[KMCMC progress 77%%|█████████████████████████████▎        |  ETA: 0:00:03[KMCMC progress 79%%|█████████████████████████████▉        |  ETA: 0:00:02[KMCMC progress 85%%|████████████████████████████████▏     |  ETA: 0:00:02[KMCMC progress 87%%|█████████████████████████████████▏    |  ETA: 0:00:01[KMCMC progress 94%%|███████████████████████████████████▋  |  ETA: 0:00:01[KMCMC progress 97%%|█████████████████████████████████████ |  ETA: 0:00:00[KMCMC progress100%%|██████████████████████████████████████| Time: 0:00:09[K
Initialization progress  4%%|█▏                          |  ETA: 0:00:43[KInitialization progress100%%|████████████████████████████| Time: 0:00:01[K
MCMC progress  1%%|▍                                     |  ETA: 0:00:23[KMCMC progress 52%%|███████████████████▊                  |  ETA: 0:00:00[KMCMC progress 94%%|███████████████████████████████████▊  |  ETA: 0:00:00[KMCMC progress100%%|██████████████████████████████████████| Time: 0:00:00[K
Test Summary: | Pass  Total
SI Model      |  104    104
    Testing Pathogen tests passed 
