Julia Version 1.5.0-DEV.162
Commit fba188c5ea (2020-01-28 03:57 UTC)
Platform Info:
  OS: Linux (x86_64-pc-linux-gnu)
  CPU: Intel(R) Xeon(R) Silver 4114 CPU @ 2.20GHz
  WORD_SIZE: 64
  LIBM: libopenlibm
  LLVM: libLLVM-8.0.1 (ORCJIT, skylake)
Environment:
  JULIA_DEPOT_PATH = ::/usr/local/share/julia
  JULIA_NUM_THREADS = 2

 Resolving package versions...
 Installed Requires ────────────── v1.0.0
 Installed FixedPointNumbers ───── v0.7.1
 Installed FunctionalCollections ─ v0.5.0
 Installed Parsers ─────────────── v0.3.10
 Installed ColorTypes ──────────── v0.9.1
 Installed WebSockets ──────────── v1.5.2
 Installed Colors ──────────────── v0.11.2
 Installed WebIO ───────────────── v0.8.13
 Installed AssetRegistry ───────── v0.1.0
 Installed OrderedCollections ──── v1.1.0
 Installed Observables ─────────── v0.2.3
 Installed HTTP ────────────────── v0.8.8
 Installed Widgets ─────────────── v0.6.2
 Installed IniFile ─────────────── v0.5.0
 Installed JSON ────────────────── v0.21.0
 Installed BinaryProvider ──────── v0.5.8
 Installed Pidfile ─────────────── v1.1.0
 Installed Reexport ────────────── v0.2.0
 Installed MbedTLS ─────────────── v0.7.0
  Updating `~/.julia/environments/v1.5/Project.toml`
  [0f1e0344] + WebIO v0.8.13
  Updating `~/.julia/environments/v1.5/Manifest.toml`
  [bf4720bc] + AssetRegistry v0.1.0
  [b99e7846] + BinaryProvider v0.5.8
  [3da002f7] + ColorTypes v0.9.1
  [5ae59095] + Colors v0.11.2
  [53c48c17] + FixedPointNumbers v0.7.1
  [de31a74c] + FunctionalCollections v0.5.0
  [cd3eb016] + HTTP v0.8.8
  [83e8ac13] + IniFile v0.5.0
  [682c06a0] + JSON v0.21.0
  [739be429] + MbedTLS v0.7.0
  [510215fc] + Observables v0.2.3
  [bac558e1] + OrderedCollections v1.1.0
  [69de0a69] + Parsers v0.3.10
  [fa939f87] + Pidfile v1.1.0
  [189a3867] + Reexport v0.2.0
  [ae029012] + Requires v1.0.0
  [0f1e0344] + WebIO v0.8.13
  [104b5d7c] + WebSockets v1.5.2
  [cc8bc4a8] + Widgets v0.6.2
  [2a0f44e3] + Base64 
  [ade2ca70] + Dates 
  [8ba89e20] + Distributed 
  [7b1f6079] + FileWatching 
  [b77e0a4c] + InteractiveUtils 
  [76f85450] + LibGit2 
  [8f399da3] + Libdl 
  [56ddb016] + Logging 
  [d6f4376e] + Markdown 
  [a63ad114] + Mmap 
  [44cfe95a] + Pkg 
  [de0858da] + Printf 
  [3fa0cd96] + REPL 
  [9a3f8284] + Random 
  [ea8e919c] + SHA 
  [9e88b42a] + Serialization 
  [6462fe0b] + Sockets 
  [8dfed614] + Test 
  [cf7118a7] + UUIDs 
  [4ec0a83e] + Unicode 
  Building MbedTLS → `~/.julia/packages/MbedTLS/a1JFn/deps/build.log`
  Updating `/tmp/jl_XiiiwE/Project.toml`
 [no changes]
  Updating `/tmp/jl_XiiiwE/Manifest.toml`
 [no changes]
  Building WebIO ──→ `~/.julia/packages/WebIO/2nnB1/deps/build.log`
  Updating `/tmp/jl_z0ZTiy/Project.toml`
 [no changes]
  Updating `/tmp/jl_z0ZTiy/Manifest.toml`
 [no changes]
   Testing WebIO
 Installed IJulia ────────────────────── v1.20.2
 Installed Conda ─────────────────────── v1.3.0
 Installed JSExpr ────────────────────── v0.5.1
 Installed Mux ───────────────────────── v0.7.1
 Installed DataStructures ────────────── v0.17.9
 Installed NodeJS ────────────────────── v1.1.1
 Installed NBInclude ─────────────────── v2.1.0
 Installed Blink ─────────────────────── v0.12.1
 Installed TableTraits ───────────────── v1.0.0
 Installed ZeroMQ_jll ────────────────── v4.3.1+0
 Installed Mustache ──────────────────── v1.0.0
 Installed Compat ────────────────────── v2.2.0
 Installed VersionParsing ────────────── v1.2.0
 Installed DataValueInterfaces ───────── v1.0.0
 Installed DataAPI ───────────────────── v1.1.0
 Installed Hiccup ────────────────────── v0.2.2
 Installed Lazy ──────────────────────── v0.14.0
 Installed SoftGlobalScope ───────────── v1.0.10
 Installed MacroTools ────────────────── v0.5.3
 Installed Tables ────────────────────── v0.2.11
 Installed BinDeps ───────────────────── v1.0.0
 Installed IteratorInterfaceExtensions ─ v1.0.0
 Installed URIParser ─────────────────── v0.4.0
 Installed ZMQ ───────────────────────── v1.2.0
  Updating `/tmp/jl_90Z7cT/Project.toml`
  [ad839575] + Blink v0.12.1
  [8f4d0f93] + Conda v1.3.0
  [864edb3b] + DataStructures v0.17.9
  [7073ff75] + IJulia v1.20.2
  [97c1335a] + JSExpr v0.5.1
  [a975b10e] + Mux v0.7.1
  [0db19996] + NBInclude v2.1.0
  [2bd173c7] + NodeJS v1.1.1
  Updating `/tmp/jl_90Z7cT/Manifest.toml`
  [9e28174c] + BinDeps v1.0.0
  [ad839575] + Blink v0.12.1
  [34da2185] + Compat v2.2.0
  [8f4d0f93] + Conda v1.3.0
  [9a962f9c] + DataAPI v1.1.0
  [864edb3b] + DataStructures v0.17.9
  [e2d170a0] + DataValueInterfaces v1.0.0
  [9fb69e20] + Hiccup v0.2.2
  [7073ff75] + IJulia v1.20.2
  [82899510] + IteratorInterfaceExtensions v1.0.0
  [97c1335a] + JSExpr v0.5.1
  [50d2b5c4] + Lazy v0.14.0
  [1914dd2f] + MacroTools v0.5.3
  [ffc61752] + Mustache v1.0.0
  [a975b10e] + Mux v0.7.1
  [0db19996] + NBInclude v2.1.0
  [2bd173c7] + NodeJS v1.1.1
  [b85f4697] + SoftGlobalScope v1.0.10
  [3783bdb8] + TableTraits v1.0.0
  [bd369af6] + Tables v0.2.11
  [30578b45] + URIParser v0.4.0
  [81def892] + VersionParsing v1.2.0
  [c2297ded] + ZMQ v1.2.0
  [8f1865be] + ZeroMQ_jll v4.3.1+0
  [8bb1440f] + DelimitedFiles 
  [37e2e46d] + LinearAlgebra 
  [1a1011a3] + SharedArrays 
  [2f01184e] + SparseArrays 
  [10745b16] + Statistics 
  Building Conda ─→ `~/.julia/packages/Conda/kLXeC/deps/build.log`
  Updating `/tmp/jl_9k8Itp/Project.toml`
 [no changes]
  Updating `/tmp/jl_9k8Itp/Manifest.toml`
 [no changes]
  Building IJulia → `~/.julia/packages/IJulia/F1GUo/deps/build.log`
  Updating `/tmp/jl_pj7gVb/Project.toml`
 [no changes]
  Updating `/tmp/jl_pj7gVb/Manifest.toml`
 [no changes]
  Building Blink ─→ `~/.julia/packages/Blink/4FM8Y/deps/build.log`
  Updating `/tmp/jl_Refgza/Project.toml`
 [no changes]
  Updating `/tmp/jl_Refgza/Manifest.toml`
 [no changes]
Running sandbox
Status `/tmp/jl_90Z7cT/Project.toml`
  [bf4720bc] AssetRegistry v0.1.0
  [ad839575] Blink v0.12.1
  [8f4d0f93] Conda v1.3.0
  [864edb3b] DataStructures v0.17.9
  [de31a74c] FunctionalCollections v0.5.0
  [7073ff75] IJulia v1.20.2
  [97c1335a] JSExpr v0.5.1
  [682c06a0] JSON v0.21.0
  [a975b10e] Mux v0.7.1
  [0db19996] NBInclude v2.1.0
  [2bd173c7] NodeJS v1.1.1
  [510215fc] Observables v0.2.3
  [ae029012] Requires v1.0.0
  [0f1e0344] WebIO v0.8.13
  [104b5d7c] WebSockets v1.5.2
  [cc8bc4a8] Widgets v0.6.2
  [2a0f44e3] Base64 
  [ade2ca70] Dates 
  [8ba89e20] Distributed 
  [56ddb016] Logging 
  [44cfe95a] Pkg 
  [9a3f8284] Random 
  [6462fe0b] Sockets 
  [8dfed614] Test 
  [cf7118a7] UUIDs 
┌ Warning: Can't build WebIO JS when not checked out for development. Run `Pkg.dev("WebIO")` if you want to build JS.
└ @ WebIO ~/.julia/packages/WebIO/2nnB1/deps/_bundlejs.jl:22
Test Summary:    |
Build JavaScript | No tests
Test Summary: | Pass  Total
node          |   12     12
Test Summary:              | Pass  Total
syntax for extending Nodes |    4      4
Test Summary:      | Pass  Total
plaintext printing |    5      5
Test Summary: | Pass  Total
@js_str       |    4      4
Test Summary: | Pass  Total
Issue 156     |    3      3
Test Summary:                   | Pass  Total
Constructing Nodes from Strings |    1      1
Test Summary:       | Pass  Total
Setting node fields |   11     11
Test Summary: | Pass  Total
HTTP provider |    5      5
Test Summary: | Pass  Total
Mux sanity    |    1      1
Test Summary: | Pass  Total
Blink mocks   |    8      8
Test Summary:  | Pass  Total
SVG/Namespaces |    1      1
┌ Warning: `WebIO.register_renderable(Type)` is deprecated; use the `@WebIO.register_renderable Type` macro instead.
│   caller = ip:0x0
└ @ Core :-1
Test Summary:       | Pass  Total
register_renderable |    1      1
Test Summary:     | Pass  Total
kebabs and camels |    2      2
Test Summary:         | Pass  Total
IJulia initialization |    1      1
[ Info: Downloading miniconda installer ...
[ Info: Installing miniconda ...
PREFIX=/home/pkgeval/.julia/conda/3
Unpacking payload ...
  0%|          | 0/35 [00:00<?, ?it/s]Extracting : requests-2.22.0-py37_0.conda:   0%|          | 0/35 [00:00<?, ?it/s]Extracting : requests-2.22.0-py37_0.conda:   3%|▎         | 1/35 [00:00<00:06,  5.04it/s]Extracting : urllib3-1.24.2-py37_0.conda:   3%|▎         | 1/35 [00:00<00:06,  5.04it/s] Extracting : pyopenssl-19.0.0-py37_0.conda:   6%|▌         | 2/35 [00:00<00:06,  5.04it/s]Extracting : conda-package-handling-1.6.0-py37h7b6447c_0.conda:   9%|▊         | 3/35 [00:00<00:06,  5.04it/s]Extracting : conda-package-handling-1.6.0-py37h7b6447c_0.conda:  11%|█▁        | 4/35 [00:00<00:05,  5.97it/s]Extracting : tqdm-4.36.1-py_0.conda:  11%|█▁        | 4/35 [00:00<00:05,  5.97it/s]                           Extracting : tqdm-4.36.1-py_0.conda:  14%|█▁        | 5/35 [00:00<00:05,  5.70it/s]Extracting : six-1.12.0-py37_0.conda:  14%|█▁        | 5/35 [00:00<00:05,  5.70it/s]Extracting : ruamel_yaml-0.15.46-py37h14c3975_0.conda:  17%|█▋        | 6/35 [00:00<00:05,  5.70it/s]Extracting : pycparser-2.19-py37_0.conda:  20%|██        | 7/35 [00:00<00:04,  5.70it/s]             Extracting : pycosat-0.6.3-py37h14c3975_0.conda:  23%|██▎       | 8/35 [00:00<00:04,  5.70it/s]Extracting : idna-2.8-py37_0.conda:  26%|██▌       | 9/35 [00:00<00:04,  5.70it/s]             Extracting : chardet-3.0.4-py37_1003.conda:  29%|██▊       | 10/35 [00:00<00:04,  5.70it/s]Extracting : tk-8.6.8-hbc83047_0.conda:  31%|███▁      | 11/35 [00:01<00:04,  5.70it/s]    Extracting : tk-8.6.8-hbc83047_0.conda:  34%|███▁      | 12/35 [00:01<00:03,  6.66it/s]Extracting : readline-7.0-h7b6447c_5.conda:  34%|███▁      | 12/35 [00:01<00:03,  6.66it/s]Extracting : libedit-3.1.20181209-hc058e9b_0.conda:  37%|███▋      | 13/35 [00:01<00:03,  6.66it/s]Extracting : zlib-1.2.11-h7b6447c_3.conda:  40%|████      | 14/35 [00:01<00:03,  6.66it/s]         Extracting : yaml-0.1.7-had09818_2.conda:  43%|████▎     | 15/35 [00:01<00:03,  6.66it/s] Extracting : xz-5.2.4-h14c3975_4.conda:  46%|████▌     | 16/35 [00:01<00:02,  6.66it/s]  Extracting : ncurses-6.1-he6710b0_1.conda:  49%|████▊     | 17/35 [00:01<00:02,  6.66it/s]Extracting : ncurses-6.1-he6710b0_1.conda:  51%|█████▁    | 18/35 [00:01<00:01,  8.57it/s]Extracting : libffi-3.2.1-hd88cf55_4.conda:  51%|█████▁    | 18/35 [00:01<00:01,  8.57it/s]Extracting : libgcc-ng-9.1.0-hdf63c60_0.conda:  54%|█████▁    | 19/35 [00:01<00:01,  8.57it/s]Extracting : libstdcxx-ng-9.1.0-hdf63c60_0.conda:  57%|█████▋    | 20/35 [00:01<00:01,  8.57it/s]Extracting : _libgcc_mutex-0.1-main.conda:  60%|██████    | 21/35 [00:01<00:01,  8.57it/s]       Extracting : python-3.7.4-h265db76_1.conda:  63%|██████▎   | 22/35 [00:03<00:01,  8.57it/s]Extracting : python-3.7.4-h265db76_1.conda:  66%|██████▌   | 23/35 [00:03<00:02,  5.09it/s]Extracting : conda-4.7.12-py37_0.tar.bz2:  66%|██████▌   | 23/35 [00:04<00:02,  5.09it/s]  Extracting : conda-4.7.12-py37_0.tar.bz2:  69%|██████▊   | 24/35 [00:04<00:03,  3.17it/s]Extracting : pip-19.3.1-py37_0.tar.bz2:  69%|██████▊   | 24/35 [00:04<00:03,  3.17it/s]  Extracting : wheel-0.33.6-py37_0.tar.bz2:  71%|███████▁  | 25/35 [00:04<00:03,  3.17it/s]Extracting : cryptography-2.8-py37h1ba5d50_0.tar.bz2:  74%|███████▁  | 26/35 [00:04<00:02,  3.17it/s]Extracting : setuptools-41.4.0-py37_0.tar.bz2:  77%|███████▋  | 27/35 [00:04<00:02,  3.17it/s]       Extracting : cffi-1.13.0-py37h2e261b9_0.tar.bz2:  80%|████████  | 28/35 [00:04<00:02,  3.17it/s]Extracting : pysocks-1.7.1-py37_0.tar.bz2:  83%|████████▎ | 29/35 [00:04<00:01,  3.17it/s]      Extracting : certifi-2019.9.11-py37_0.tar.bz2:  86%|████████▌ | 30/35 [00:04<00:01,  3.17it/s]Extracting : asn1crypto-1.2.0-py37_0.tar.bz2:  89%|████████▊ | 31/35 [00:04<00:01,  3.17it/s] Extracting : sqlite-3.30.0-h7b6447c_0.tar.bz2:  91%|█████████▁| 32/35 [00:04<00:00,  3.17it/s]Extracting : openssl-1.1.1d-h7b6447c_3.tar.bz2:  94%|█████████▁| 33/35 [00:04<00:00,  3.17it/s]Extracting : ca-certificates-2019.10.16-0.tar.bz2:  97%|█████████▋| 34/35 [00:04<00:00,  3.17it/s]                                                                                                  Collecting package metadata (current_repodata.json): ...working... done
Solving environment: ...working... done

## Package Plan ##

  environment location: /home/pkgeval/.julia/conda/3

  added / updated specs:
    - _libgcc_mutex==0.1=main
    - asn1crypto==1.2.0=py37_0
    - ca-certificates==2019.10.16=0
    - certifi==2019.9.11=py37_0
    - cffi==1.13.0=py37h2e261b9_0
    - chardet==3.0.4=py37_1003
    - conda-package-handling==1.6.0=py37h7b6447c_0
    - conda==4.7.12=py37_0
    - cryptography==2.8=py37h1ba5d50_0
    - idna==2.8=py37_0
    - libedit==3.1.20181209=hc058e9b_0
    - libffi==3.2.1=hd88cf55_4
    - libgcc-ng==9.1.0=hdf63c60_0
    - libstdcxx-ng==9.1.0=hdf63c60_0
    - ncurses==6.1=he6710b0_1
    - openssl==1.1.1d=h7b6447c_3
    - pip==19.3.1=py37_0
    - pycosat==0.6.3=py37h14c3975_0
    - pycparser==2.19=py37_0
    - pyopenssl==19.0.0=py37_0
    - pysocks==1.7.1=py37_0
    - python==3.7.4=h265db76_1
    - readline==7.0=h7b6447c_5
    - requests==2.22.0=py37_0
    - ruamel_yaml==0.15.46=py37h14c3975_0
    - setuptools==41.4.0=py37_0
    - six==1.12.0=py37_0
    - sqlite==3.30.0=h7b6447c_0
    - tk==8.6.8=hbc83047_0
    - tqdm==4.36.1=py_0
    - urllib3==1.24.2=py37_0
    - wheel==0.33.6=py37_0
    - xz==5.2.4=h14c3975_4
    - yaml==0.1.7=had09818_2
    - zlib==1.2.11=h7b6447c_3


The following NEW packages will be INSTALLED:

  _libgcc_mutex      pkgs/main/linux-64::_libgcc_mutex-0.1-main
  asn1crypto         pkgs/main/linux-64::asn1crypto-1.2.0-py37_0
  ca-certificates    pkgs/main/linux-64::ca-certificates-2019.10.16-0
  certifi            pkgs/main/linux-64::certifi-2019.9.11-py37_0
  cffi               pkgs/main/linux-64::cffi-1.13.0-py37h2e261b9_0
  chardet            pkgs/main/linux-64::chardet-3.0.4-py37_1003
  conda              pkgs/main/linux-64::conda-4.7.12-py37_0
  conda-package-han~ pkgs/main/linux-64::conda-package-handling-1.6.0-py37h7b6447c_0
  cryptography       pkgs/main/linux-64::cryptography-2.8-py37h1ba5d50_0
  idna               pkgs/main/linux-64::idna-2.8-py37_0
  libedit            pkgs/main/linux-64::libedit-3.1.20181209-hc058e9b_0
  libffi             pkgs/main/linux-64::libffi-3.2.1-hd88cf55_4
  libgcc-ng          pkgs/main/linux-64::libgcc-ng-9.1.0-hdf63c60_0
  libstdcxx-ng       pkgs/main/linux-64::libstdcxx-ng-9.1.0-hdf63c60_0
  ncurses            pkgs/main/linux-64::ncurses-6.1-he6710b0_1
  openssl            pkgs/main/linux-64::openssl-1.1.1d-h7b6447c_3
  pip                pkgs/main/linux-64::pip-19.3.1-py37_0
  pycosat            pkgs/main/linux-64::pycosat-0.6.3-py37h14c3975_0
  pycparser          pkgs/main/linux-64::pycparser-2.19-py37_0
  pyopenssl          pkgs/main/linux-64::pyopenssl-19.0.0-py37_0
  pysocks            pkgs/main/linux-64::pysocks-1.7.1-py37_0
  python             pkgs/main/linux-64::python-3.7.4-h265db76_1
  readline           pkgs/main/linux-64::readline-7.0-h7b6447c_5
  requests           pkgs/main/linux-64::requests-2.22.0-py37_0
  ruamel_yaml        pkgs/main/linux-64::ruamel_yaml-0.15.46-py37h14c3975_0
  setuptools         pkgs/main/linux-64::setuptools-41.4.0-py37_0
  six                pkgs/main/linux-64::six-1.12.0-py37_0
  sqlite             pkgs/main/linux-64::sqlite-3.30.0-h7b6447c_0
  tk                 pkgs/main/linux-64::tk-8.6.8-hbc83047_0
  tqdm               pkgs/main/noarch::tqdm-4.36.1-py_0
  urllib3            pkgs/main/linux-64::urllib3-1.24.2-py37_0
  wheel              pkgs/main/linux-64::wheel-0.33.6-py37_0
  xz                 pkgs/main/linux-64::xz-5.2.4-h14c3975_4
  yaml               pkgs/main/linux-64::yaml-0.1.7-had09818_2
  zlib               pkgs/main/linux-64::zlib-1.2.11-h7b6447c_3


Preparing transaction: ...working... done
Executing transaction: ...working... done
installation finished.
[ Info: Running `conda config --add channels defaults --file /home/pkgeval/.julia/conda/3/condarc-julia.yml --force` in root environment
Warning: 'defaults' already in 'channels' list, moving to the top
[ Info: Running `conda update -q -y conda` in root environment
Collecting package metadata (current_repodata.json): ...working... done
Solving environment: ...working... done

## Package Plan ##

  environment location: /home/pkgeval/.julia/conda/3

  added / updated specs:
    - conda


The following packages will be downloaded:

    package                    |            build
    ---------------------------|-----------------
    asn1crypto-1.3.0           |           py37_0         164 KB
    ca-certificates-2019.11.27 |                0         124 KB
    certifi-2019.11.28         |           py37_0         153 KB
    cffi-1.13.2                |   py37h2e261b9_0         224 KB
    conda-4.8.1                |           py37_0         2.8 MB
    pip-20.0.2                 |           py37_0         1.7 MB
    pycosat-0.6.3              |   py37h7b6447c_0          82 KB
    pyopenssl-19.1.0           |           py37_0          87 KB
    requests-2.22.0            |           py37_1          92 KB
    ruamel_yaml-0.15.87        |   py37h7b6447c_0         256 KB
    setuptools-45.1.0          |           py37_0         511 KB
    six-1.14.0                 |           py37_0          27 KB
    sqlite-3.30.1              |       h7b6447c_0         1.1 MB
    tqdm-4.42.0                |             py_0          55 KB
    urllib3-1.25.8             |           py37_0         169 KB
    ------------------------------------------------------------
                                           Total:         7.5 MB

The following packages will be UPDATED:

  asn1crypto                                   1.2.0-py37_0 --> 1.3.0-py37_0
  ca-certificates                              2019.10.16-0 --> 2019.11.27-0
  certifi                                  2019.9.11-py37_0 --> 2019.11.28-py37_0
  cffi                                1.13.0-py37h2e261b9_0 --> 1.13.2-py37h2e261b9_0
  conda                                       4.7.12-py37_0 --> 4.8.1-py37_0
  pip                                         19.3.1-py37_0 --> 20.0.2-py37_0
  pyopenssl                                   19.0.0-py37_0 --> 19.1.0-py37_0
  requests                                    2.22.0-py37_0 --> 2.22.0-py37_1
  ruamel_yaml                        0.15.46-py37h14c3975_0 --> 0.15.87-py37h7b6447c_0
  setuptools                                  41.4.0-py37_0 --> 45.1.0-py37_0
  six                                         1.12.0-py37_0 --> 1.14.0-py37_0
  sqlite                                  3.30.0-h7b6447c_0 --> 3.30.1-h7b6447c_0
  tqdm                                          4.36.1-py_0 --> 4.42.0-py_0
  urllib3                                     1.24.2-py37_0 --> 1.25.8-py37_0

The following packages will be DOWNGRADED:

  pycosat                              0.6.3-py37h14c3975_0 --> 0.6.3-py37h7b6447c_0


Preparing transaction: ...working... done
Verifying transaction: ...working... done
Executing transaction: ...working... done
[ Info: Running `conda config --add channels conda-forge --file /home/pkgeval/.julia/conda/3/condarc-julia.yml --force` in root environment
[ Info: Running `conda install -q -y jupyterlab` in root environment
Collecting package metadata (current_repodata.json): ...working... done
Solving environment: ...working... done

## Package Plan ##

  environment location: /home/pkgeval/.julia/conda/3

  added / updated specs:
    - jupyterlab


The following packages will be downloaded:

    package                    |            build
    ---------------------------|-----------------
    attrs-19.3.0               |             py_0          35 KB  conda-forge
    backcall-0.1.0             |             py_0          13 KB  conda-forge
    bleach-3.1.0               |             py_0         110 KB  conda-forge
    ca-certificates-2019.11.28 |       hecc5488_0         145 KB  conda-forge
    certifi-2019.11.28         |           py37_0         148 KB  conda-forge
    conda-4.8.2                |           py37_0         3.0 MB  conda-forge
    decorator-4.4.1            |             py_0          11 KB  conda-forge
    defusedxml-0.6.0           |             py_0          22 KB  conda-forge
    entrypoints-0.3            |        py37_1000          11 KB  conda-forge
    importlib_metadata-1.4.0   |           py37_0          41 KB  conda-forge
    inflect-4.0.0              |           py37_1          56 KB  conda-forge
    ipykernel-5.1.4            |   py37h5ca1d4c_0         160 KB  conda-forge
    ipython-7.11.1             |   py37h5ca1d4c_0         1.1 MB  conda-forge
    ipython_genutils-0.2.0     |             py_1          21 KB  conda-forge
    jaraco.itertools-5.0.0     |             py_0          14 KB  conda-forge
    jedi-0.16.0                |           py37_0         781 KB  conda-forge
    jinja2-2.10.3              |             py_0          91 KB  conda-forge
    json5-0.8.5                |             py_0          24 KB  conda-forge
    jsonschema-3.2.0           |           py37_0          89 KB  conda-forge
    jupyter_client-5.3.4       |           py37_1         131 KB  conda-forge
    jupyter_core-4.6.1         |           py37_0          70 KB  conda-forge
    jupyterlab-1.2.6           |             py_0         4.8 MB  conda-forge
    jupyterlab_server-1.0.6    |             py_0          23 KB  conda-forge
    libsodium-1.0.17           |       h516909a_0         330 KB  conda-forge
    markupsafe-1.1.1           |   py37h516909a_0          26 KB  conda-forge
    mistune-0.8.4              |py37h516909a_1000          53 KB  conda-forge
    more-itertools-8.1.0       |             py_0          34 KB  conda-forge
    nbconvert-5.6.1            |           py37_0         487 KB  conda-forge
    nbformat-5.0.4             |             py_0          98 KB  conda-forge
    notebook-6.0.3             |           py37_0         6.2 MB  conda-forge
    openssl-1.1.1d             |       h516909a_0         2.1 MB  conda-forge
    pandoc-2.9.1.1             |                0        16.6 MB  conda-forge
    pandocfilters-1.4.2        |             py_1           9 KB  conda-forge
    parso-0.6.0                |             py_0          66 KB  conda-forge
    pexpect-4.8.0              |           py37_0          79 KB  conda-forge
    pickleshare-0.7.5          |        py37_1000          12 KB  conda-forge
    prometheus_client-0.7.1    |             py_0          38 KB  conda-forge
    prompt_toolkit-3.0.2       |             py_0         226 KB  conda-forge
    ptyprocess-0.6.0           |          py_1001          15 KB  conda-forge
    pygments-2.5.2             |             py_0         669 KB  conda-forge
    pyrsistent-0.15.7          |   py37h516909a_0          89 KB  conda-forge
    python-dateutil-2.8.1      |             py_0         220 KB  conda-forge
    pyzmq-18.1.1               |   py37h1768529_0         517 KB  conda-forge
    send2trash-1.5.0           |             py_0          12 KB  conda-forge
    terminado-0.8.3            |           py37_0          23 KB  conda-forge
    testpath-0.4.4             |             py_0          85 KB  conda-forge
    tornado-6.0.3              |   py37h516909a_0         637 KB  conda-forge
    traitlets-4.3.3            |           py37_0         133 KB  conda-forge
    wcwidth-0.1.8              |             py_0          19 KB  conda-forge
    webencodings-0.5.1         |             py_1          12 KB  conda-forge
    zeromq-4.3.2               |       he1b5a44_2         668 KB  conda-forge
    zipp-2.1.0                 |             py_0           9 KB  conda-forge
    ------------------------------------------------------------
                                           Total:        40.2 MB

The following NEW packages will be INSTALLED:

  attrs              conda-forge/noarch::attrs-19.3.0-py_0
  backcall           conda-forge/noarch::backcall-0.1.0-py_0
  bleach             conda-forge/noarch::bleach-3.1.0-py_0
  decorator          conda-forge/noarch::decorator-4.4.1-py_0
  defusedxml         conda-forge/noarch::defusedxml-0.6.0-py_0
  entrypoints        conda-forge/linux-64::entrypoints-0.3-py37_1000
  importlib_metadata conda-forge/linux-64::importlib_metadata-1.4.0-py37_0
  inflect            conda-forge/linux-64::inflect-4.0.0-py37_1
  ipykernel          conda-forge/linux-64::ipykernel-5.1.4-py37h5ca1d4c_0
  ipython            conda-forge/linux-64::ipython-7.11.1-py37h5ca1d4c_0
  ipython_genutils   conda-forge/noarch::ipython_genutils-0.2.0-py_1
  jaraco.itertools   conda-forge/noarch::jaraco.itertools-5.0.0-py_0
  jedi               conda-forge/linux-64::jedi-0.16.0-py37_0
  jinja2             conda-forge/noarch::jinja2-2.10.3-py_0
  json5              conda-forge/noarch::json5-0.8.5-py_0
  jsonschema         conda-forge/linux-64::jsonschema-3.2.0-py37_0
  jupyter_client     conda-forge/linux-64::jupyter_client-5.3.4-py37_1
  jupyter_core       conda-forge/linux-64::jupyter_core-4.6.1-py37_0
  jupyterlab         conda-forge/noarch::jupyterlab-1.2.6-py_0
  jupyterlab_server  conda-forge/noarch::jupyterlab_server-1.0.6-py_0
  libsodium          conda-forge/linux-64::libsodium-1.0.17-h516909a_0
  markupsafe         conda-forge/linux-64::markupsafe-1.1.1-py37h516909a_0
  mistune            conda-forge/linux-64::mistune-0.8.4-py37h516909a_1000
  more-itertools     conda-forge/noarch::more-itertools-8.1.0-py_0
  nbconvert          conda-forge/linux-64::nbconvert-5.6.1-py37_0
  nbformat           conda-forge/noarch::nbformat-5.0.4-py_0
  notebook           conda-forge/linux-64::notebook-6.0.3-py37_0
  pandoc             conda-forge/linux-64::pandoc-2.9.1.1-0
  pandocfilters      conda-forge/noarch::pandocfilters-1.4.2-py_1
  parso              conda-forge/noarch::parso-0.6.0-py_0
  pexpect            conda-forge/linux-64::pexpect-4.8.0-py37_0
  pickleshare        conda-forge/linux-64::pickleshare-0.7.5-py37_1000
  prometheus_client  conda-forge/noarch::prometheus_client-0.7.1-py_0
  prompt_toolkit     conda-forge/noarch::prompt_toolkit-3.0.2-py_0
  ptyprocess         conda-forge/noarch::ptyprocess-0.6.0-py_1001
  pygments           conda-forge/noarch::pygments-2.5.2-py_0
  pyrsistent         conda-forge/linux-64::pyrsistent-0.15.7-py37h516909a_0
  python-dateutil    conda-forge/noarch::python-dateutil-2.8.1-py_0
  pyzmq              conda-forge/linux-64::pyzmq-18.1.1-py37h1768529_0
  send2trash         conda-forge/noarch::send2trash-1.5.0-py_0
  terminado          conda-forge/linux-64::terminado-0.8.3-py37_0
  testpath           conda-forge/noarch::testpath-0.4.4-py_0
  tornado            conda-forge/linux-64::tornado-6.0.3-py37h516909a_0
  traitlets          conda-forge/linux-64::traitlets-4.3.3-py37_0
  wcwidth            conda-forge/noarch::wcwidth-0.1.8-py_0
  webencodings       conda-forge/noarch::webencodings-0.5.1-py_1
  zeromq             conda-forge/linux-64::zeromq-4.3.2-he1b5a44_2
  zipp               conda-forge/noarch::zipp-2.1.0-py_0

The following packages will be UPDATED:

  ca-certificates    pkgs/main::ca-certificates-2019.11.27~ --> conda-forge::ca-certificates-2019.11.28-hecc5488_0
  conda                       pkgs/main::conda-4.8.1-py37_0 --> conda-forge::conda-4.8.2-py37_0

The following packages will be SUPERSEDED by a higher-priority channel:

  certifi                                         pkgs/main --> conda-forge
  openssl              pkgs/main::openssl-1.1.1d-h7b6447c_3 --> conda-forge::openssl-1.1.1d-h516909a_0


Preparing transaction: ...working... done
Verifying transaction: ...working... done
Executing transaction: ...working... done
[ Info: Running `conda install -q -y nodejs` in root environment
Collecting package metadata (current_repodata.json): ...working... done
Solving environment: ...working... done

## Package Plan ##

  environment location: /home/pkgeval/.julia/conda/3

  added / updated specs:
    - nodejs


The following packages will be downloaded:

    package                    |            build
    ---------------------------|-----------------
    icu-64.2                   |       he1b5a44_1        12.6 MB  conda-forge
    libuv-1.34.0               |       h516909a_0         922 KB  conda-forge
    nodejs-13.7.0              |       h10a4023_0        13.6 MB  conda-forge
    ------------------------------------------------------------
                                           Total:        27.1 MB

The following NEW packages will be INSTALLED:

  icu                conda-forge/linux-64::icu-64.2-he1b5a44_1
  libuv              conda-forge/linux-64::libuv-1.34.0-h516909a_0
  nodejs             conda-forge/linux-64::nodejs-13.7.0-h10a4023_0


Preparing transaction: ...working... done
Verifying transaction: ...working... done
Executing transaction: ...working... done
No labextension named "@webio/jupyter-lab-provider" installed
An error occured.
ValueError: No linked package for @webio/webio
See the log file for details:  /tmp/jupyterlab-debug-ij9mszuh.log
No labextension named "@webio/jupyter-lab-provider" installed
-\|/-\|/-\|/-\|/-\|/-\|/-\|/[LabBuildApp] JupyterLab 1.2.6
[LabBuildApp] Building in /home/pkgeval/.julia/conda/3/share/jupyter/lab
[LabBuildApp] Building jupyterlab assets (build:prod:minimize)
-\|/-\|/-\|/-\|/-\|/-\|/-\|/-\|/-\|/-\|/-\|/-\|/-\|/-\|/-\|/-\|/-\|/-\|/-\|/-\|/-\|/-\|/-\|/-\|/-\|/-\|/-\|/-\|/-\|/-\|/-\|/-\|/-\|/-\|/-\|/-\|/-\|/-\|/-\|/-\|/-\|/-\|/-\|/-\|/-\|/-\|/-\|/-\|/-\|/-\|/-\|/-\|/-\|/-\|/-\|/-\|/-\|/-\|/-\|/-\|/-\|/-\|/-\|/-\|/-\|/-\|/-\|/-\|/-\|/-\|/-\|/-\|/-\|/-\|/-\|/-\|/-\|/-\|/-\|/-\|/-\|/-\|/-\|/-\|/-\|/-\|/-\|/-\|/-\|/-\|/-\|/-\|/-\|/-\|/-\|/-\|/-\|/-\|/-\|/-\|/-\|/-\|/-\|/-\|/-\|/-\|/-\|/-\|/-\|/-\|/-\|/-\|/-\|/-\|/-\|/-\|/-\|/-\|/-\|/-\|/-\|/-\|/-\|/-\|/-\|/-\|/-\|/-\|/-\-\|/-\|/-\|/-\|/-\|/-\|/-\|/-\|/-\|/-\|/-\|/-\|/-\|/-\|/-\|/-\|/-\|/-\|/-\|/-\|/-\|/-\|/-\|/-\|/-\|/-\|/-\|/-\|/-\|/-\|/-\|/-\|/-\|/-\|/-\|/-\|/-\|/-\|/-\|/-\|/-\|/-\|/-\|/-\|/-\|/-\|/-\|/-\|/-\|/-\|/-\|/-\|/-\|/-\|/-\|/-\|/-\|/-\|/-\|/-\|/-\|/-\|/-\|/-\|/-\|/-\|/-\|/-\|/-\|/-\|/-\|/-\|/-\|/-\|/-\|/-\|/-\|/-\|/-\|/-\|/-\|/-\|/-\|/-\|/-\|/-\|/-\|/-\|/-\|/-\|/-\|/-\|/-\|/-\|/-\|/-\|/-\|/-\|/-\|/-\|/-\|/-\|/-\|/-\|/-\|/-\|/-\|/-\|/-\|/-\|/-\|/-\|/-\|/-\|/-\|/-\|/-\|/-\|/-\|/-\|/-\|/-\|/-\|/-\|/-\|/-\|/-\|/-\|/-\|/-\|/-\|/-\|/-\|/-\|/-\|/-\|/-\|/-\|/-\|/-\|/-\|/-\|/-\|/-\|/-\|/-\|/-\|/-\|/-\|/-\|/-\|/-\|/-\|/-\|/-\|/-\|/-\|/-\|/-\|/-\|/-\|/-\|/-\|/-\|/-\|/-\|/-\|/-\|/-\|/-\|/-\|/-\|/-\|/-\|/-\|/-\|/-\|/-\|/-\|/-\|/-\|/-\|/-\|/-\|/-\|/-\|/-\|/-\|/-\|/-\|/-\|/-\|/-\|/-\|/-\|/-\|/-\|/-\|/-\|/-\|/-\|/-\|/-\|/-\|/-\|/-\|/-\|/-\|/-\|/-\|/-\|/-\|/-\|/-\|/-\|/-\|/-\|/-\|/-\|/-\|/-\|/-\|/-\|/-\|/-\|/-\|/-\|/-\|/-\|/-\|/-\|/-\|/-\|/-\|/-\|/-\|/-\|/-\|/-\|/-\|/-\|/-\|/-\|/-\|/-\|/-\|/-\|/-\|/-\|/-\|/-\|/-\|/-\|/-\|/-\|/-\|/-\|/-\|/-\|/-\|/-\|/-\|/-\|/-\|/-\|/-\|/-\|/-\|/-\|/-\|/-\|/-\|/-\|/-\|/-\|/-\|/-\|/-\|/-\|/-\|/-\|/-\|/-\|/-\|/-\|/-\|/-\|/-\|/-\|/-\|/-\|/-\|/-\|/-\|/-\|/-\|/-\|/-\|/-\|/-\|/-\|/-\|/-\|/-\|/-\|/-\|/-\|/-\|/-\|/-\|/-\|/-\|/-\|/-\|/-\|/-\|/-\|/-\|/-\|/-\|/-\|/-\|/-\|/-\|/-\|/-\|/-\|/-\|/-\|/-\|/-\|/-\|/-\|/-\|/-\|/-\|/-\|/-\|/-\|/-\|/-\|/-\|/-\|/-\|/-\|/-\|/-\|/-\|/-\|/-\|/-\|/-\|/-\|/-\|/-\|/-\|/-\|/-\|/-\|/-\|/-\|/-\|/-\|/-\|/-\|/-\|/-\|/-\|/-\|/-\|/-\|/-\|/-\|/-\|/-\|/JupyterLab v1.2.6
Known labextensions:
┌ Info: Installing Jupyter WebIO extension...
└   cmd = `/home/pkgeval/.julia/conda/3/bin/jupyter nbextension install --user /home/pkgeval/.julia/packages/WebIO/2nnB1/deps/bundles/webio-jupyter-notebook.js`
Copying: /home/pkgeval/.julia/packages/WebIO/2nnB1/deps/bundles/webio-jupyter-notebook.js -> /home/pkgeval/.local/share/jupyter/nbextensions/webio-jupyter-notebook.js

    To initialize this nbextension in the browser every time the notebook (or other app) loads:
    
          jupyter nbextension enable <the entry point> --user
    
┌ Info: Enabling Jupyter WebIO extension...
└   cmd = `/home/pkgeval/.julia/conda/3/bin/jupyter nbextension enable --user webio-jupyter-notebook`
Enabling notebook extension webio-jupyter-notebook...
      - Validating: [32mOK[0m
      - Validating: [32mOK[0m
    - Validating...
Error loading server extension jlstaticserve
     [31m X[0m is jlstaticserve importable?
    - Validating...
      jupyterlab 1.2.6 [32mOK[0m
Test Summary: | Pass  Total
Jupyter setup |    3      3
Scope(Node{DOM}(DOM(:html, :div), Any[], Dict{Symbol,Any}(:id => "container")), Dict{String,Tuple{Observables.AbstractObservable,Union{Nothing, Bool}}}("inbox" => (Observable{Any} with 1 listeners. Value:
nothing, nothing)), Set(String[]), nothing, Asset[Asset("js", nothing, "//people.csail.mit.edu/rdeits/webio_tests/trivial_import.js")], Dict{Any,Any}(), WebIO.ConnectionPool(Channel{Any}(sz_max:32,sz_curr:0), Set(AbstractConnection[]), Base.GenericCondition{Base.AlwaysLockedST}(Base.InvasiveLinkedList{Task}(Task (runnable) @0x00007fdff2c8e710, Task (runnable) @0x00007fdff2c8e710), Base.AlwaysLockedST(1))), WebIO.JSString[WebIO.JSString("function () {\n    var handler = (function (dependency) {\n    console.log(dependency);\n    console.log(_webIOScope);\n    _webIOScope.setObservableValue(\"inbox\", dependency.x);\n}\n);\n    (WebIO.importBlock({\"data\":[{\"name\":null,\"type\":\"js\",\"url\":\"//people.csail.mit.edu/rdeits/webio_tests/trivial_import.js\"}],\"type\":\"async_block\"})).then((imports) => handler.apply(this, imports));\n}\n")])Test Summary: |
Demo notebook | No tests
Test Summary:           | Pass  Total
JSString Interpolations |   13     13
Test Summary:         | Pass  Total
Scope id deprecations |    3      3
Test Summary:                            | Pass  Total
register_renderable function deprecation |    2      2
Test Summary:              | Pass  Total
WebIO.@register_renderable |    9      9
Test Summary: | ┌ Warning: Failed!
└ @ Main ~/.julia/packages/WebIO/2nnB1/test/assets/jupyter-test.ipynb:In[19]:27
Pass  Total
Asset         |   34     34
   Testing WebIO tests passed 
