Running tests with Julia v1.3.1-pre.12
   Cloning default registries into `~/.julia`
   Cloning registry from "https://github.com/JuliaRegistries/General.git"
[?25l    Fetching: [>                                        ]  0.0 %    Fetching: [============>                            ]  28.0 %    Fetching: [=======================>                 ]  55.2 %[2K[?25h     Added registry `General` to `~/.julia/registries/General`
 Resolving package versions...
 Installed NaNMath ─────────────── v0.3.3
 Installed Compat ──────────────── v2.2.0
 Installed OrderedCollections ──── v1.1.0
 Installed BinDeps ─────────────── v0.8.10
 Installed QuadGK ──────────────── v2.1.1
 Installed SpecialFunctions ────── v0.8.0
 Installed StochasticBlockModel ── v0.1.0
 Installed ForwardDiff ─────────── v0.10.7
 Installed OpenBLAS_jll ────────── v0.3.7+1
 Installed DiffResults ─────────── v0.0.4
 Installed DataAPI ─────────────── v1.1.0
 Installed URIParser ───────────── v0.4.0
 Installed StatsFuns ───────────── v0.9.2
 Installed GLPKMathProgInterface ─ v0.4.4
 Installed Missings ────────────── v0.4.3
 Installed Arpack ──────────────── v0.4.0
 Installed GLPK ────────────────── v0.12.0
 Installed JSON ────────────────── v0.21.0
 Installed MathProgBase ────────── v0.7.7
 Installed StaticArrays ────────── v0.12.1
 Installed Arpack_jll ──────────── v3.5.0+2
 Installed BenchmarkTools ──────── v0.4.3
 Installed FillArrays ──────────── v0.8.2
 Installed JuMP ────────────────── v0.18.6
 Installed DiffRules ───────────── v0.1.0
 Installed CommonSubexpressions ── v0.2.0
 Installed Distributions ───────── v0.21.10
 Installed DataStructures ──────── v0.17.6
 Installed StatsBase ───────────── v0.32.0
 Installed ReverseDiffSparse ───── v0.8.6
 Installed MathOptInterface ────── v0.9.7
 Installed PDMats ──────────────── v0.9.10
 Installed Rmath ───────────────── v0.6.0
 Installed SortingAlgorithms ───── v0.3.1
 Installed Parsers ─────────────── v0.3.10
 Installed Calculus ────────────── v0.5.1
 Installed BinaryProvider ──────── v0.5.8
  Updating `~/.julia/environments/v1.3/Project.toml`
  [e022115e] + StochasticBlockModel v0.1.0
  Updating `~/.julia/environments/v1.3/Manifest.toml`
  [7d9fca2a] + Arpack v0.4.0
  [68821587] + Arpack_jll v3.5.0+2
  [6e4b80f9] + BenchmarkTools v0.4.3
  [9e28174c] + BinDeps v0.8.10
  [b99e7846] + BinaryProvider v0.5.8
  [49dc2e85] + Calculus v0.5.1
  [bbf7d656] + CommonSubexpressions v0.2.0
  [34da2185] + Compat v2.2.0
  [9a962f9c] + DataAPI v1.1.0
  [864edb3b] + DataStructures v0.17.6
  [163ba53b] + DiffResults v0.0.4
  [b552c78f] + DiffRules v0.1.0
  [31c24e10] + Distributions v0.21.10
  [1a297f60] + FillArrays v0.8.2
  [f6369f11] + ForwardDiff v0.10.7
  [60bf3e95] + GLPK v0.12.0
  [3c7084bd] + GLPKMathProgInterface v0.4.4
  [682c06a0] + JSON v0.21.0
  [4076af6c] + JuMP v0.18.6
  [b8f27783] + MathOptInterface v0.9.7
  [fdba3010] + MathProgBase v0.7.7
  [e1d29d7a] + Missings v0.4.3
  [77ba4419] + NaNMath v0.3.3
  [4536629a] + OpenBLAS_jll v0.3.7+1
  [bac558e1] + OrderedCollections v1.1.0
  [90014a1f] + PDMats v0.9.10
  [69de0a69] + Parsers v0.3.10
  [1fd47b50] + QuadGK v2.1.1
  [89212889] + ReverseDiffSparse v0.8.6
  [79098fc4] + Rmath v0.6.0
  [a2af1166] + SortingAlgorithms v0.3.1
  [276daf66] + SpecialFunctions v0.8.0
  [90137ffa] + StaticArrays v0.12.1
  [2913bbd2] + StatsBase v0.32.0
  [4c63d2b9] + StatsFuns v0.9.2
  [e022115e] + StochasticBlockModel v0.1.0
  [30578b45] + URIParser v0.4.0
  [2a0f44e3] + Base64 
  [ade2ca70] + Dates 
  [8bb1440f] + DelimitedFiles 
  [8ba89e20] + Distributed 
  [b77e0a4c] + InteractiveUtils 
  [76f85450] + LibGit2 
  [8f399da3] + Libdl 
  [37e2e46d] + LinearAlgebra 
  [56ddb016] + Logging 
  [d6f4376e] + Markdown 
  [a63ad114] + Mmap 
  [44cfe95a] + Pkg 
  [de0858da] + Printf 
  [3fa0cd96] + REPL 
  [9a3f8284] + Random 
  [ea8e919c] + SHA 
  [9e88b42a] + Serialization 
  [1a1011a3] + SharedArrays 
  [6462fe0b] + Sockets 
  [2f01184e] + SparseArrays 
  [10745b16] + Statistics 
  [4607b0f0] + SuiteSparse 
  [8dfed614] + Test 
  [cf7118a7] + UUIDs 
  [4ec0a83e] + Unicode 
  Building SpecialFunctions → `~/.julia/packages/SpecialFunctions/ne2iw/deps/build.log`
  Building GLPK ────────────→ `~/.julia/packages/GLPK/J1b5G/deps/build.log`
  Building Rmath ───────────→ `~/.julia/packages/Rmath/BoBag/deps/build.log`
   Testing StochasticBlockModel
 Resolving package versions...
 Installed SafeTestsets ─ v0.0.1
    Status `/tmp/jl_s5opjT/Manifest.toml`
  [7d9fca2a] Arpack v0.4.0
  [68821587] Arpack_jll v3.5.0+2
  [6e4b80f9] BenchmarkTools v0.4.3
  [9e28174c] BinDeps v0.8.10
  [b99e7846] BinaryProvider v0.5.8
  [49dc2e85] Calculus v0.5.1
  [bbf7d656] CommonSubexpressions v0.2.0
  [34da2185] Compat v2.2.0
  [9a962f9c] DataAPI v1.1.0
  [864edb3b] DataStructures v0.17.6
  [163ba53b] DiffResults v0.0.4
  [b552c78f] DiffRules v0.1.0
  [31c24e10] Distributions v0.21.10
  [1a297f60] FillArrays v0.8.2
  [f6369f11] ForwardDiff v0.10.7
  [60bf3e95] GLPK v0.12.0
  [3c7084bd] GLPKMathProgInterface v0.4.4
  [682c06a0] JSON v0.21.0
  [4076af6c] JuMP v0.18.6
  [b8f27783] MathOptInterface v0.9.7
  [fdba3010] MathProgBase v0.7.7
  [e1d29d7a] Missings v0.4.3
  [77ba4419] NaNMath v0.3.3
  [4536629a] OpenBLAS_jll v0.3.7+1
  [bac558e1] OrderedCollections v1.1.0
  [90014a1f] PDMats v0.9.10
  [69de0a69] Parsers v0.3.10
  [1fd47b50] QuadGK v2.1.1
  [89212889] ReverseDiffSparse v0.8.6
  [79098fc4] Rmath v0.6.0
  [1bc83da4] SafeTestsets v0.0.1
  [a2af1166] SortingAlgorithms v0.3.1
  [276daf66] SpecialFunctions v0.8.0
  [90137ffa] StaticArrays v0.12.1
  [2913bbd2] StatsBase v0.32.0
  [4c63d2b9] StatsFuns v0.9.2
  [e022115e] StochasticBlockModel v0.1.0
  [30578b45] URIParser v0.4.0
  [2a0f44e3] Base64  [`@stdlib/Base64`]
  [ade2ca70] Dates  [`@stdlib/Dates`]
  [8bb1440f] DelimitedFiles  [`@stdlib/DelimitedFiles`]
  [8ba89e20] Distributed  [`@stdlib/Distributed`]
  [b77e0a4c] InteractiveUtils  [`@stdlib/InteractiveUtils`]
  [76f85450] LibGit2  [`@stdlib/LibGit2`]
  [8f399da3] Libdl  [`@stdlib/Libdl`]
  [37e2e46d] LinearAlgebra  [`@stdlib/LinearAlgebra`]
  [56ddb016] Logging  [`@stdlib/Logging`]
  [d6f4376e] Markdown  [`@stdlib/Markdown`]
  [a63ad114] Mmap  [`@stdlib/Mmap`]
  [44cfe95a] Pkg  [`@stdlib/Pkg`]
  [de0858da] Printf  [`@stdlib/Printf`]
  [3fa0cd96] REPL  [`@stdlib/REPL`]
  [9a3f8284] Random  [`@stdlib/Random`]
  [ea8e919c] SHA  [`@stdlib/SHA`]
  [9e88b42a] Serialization  [`@stdlib/Serialization`]
  [1a1011a3] SharedArrays  [`@stdlib/SharedArrays`]
  [6462fe0b] Sockets  [`@stdlib/Sockets`]
  [2f01184e] SparseArrays  [`@stdlib/SparseArrays`]
  [10745b16] Statistics  [`@stdlib/Statistics`]
  [4607b0f0] SuiteSparse  [`@stdlib/SuiteSparse`]
  [8dfed614] Test  [`@stdlib/Test`]
  [cf7118a7] UUIDs  [`@stdlib/UUIDs`]
  [4ec0a83e] Unicode  [`@stdlib/Unicode`]
Test Summary: | Pass  Total
SBM tests     |   19     19
Test Summary: | Pass  Total
Dataset tests |   17     17
Test Summary:     | Pass  Total
Opt Methods tests |   27     27
Test Summary:     | Pass  Total
Opt Results tests |    6      6
Test Summary:    | Pass  Total
Heuristics tests |   18     18
q = 2 groups
n = 8 nodes
m = 8 edges
w=
[1.3 0.2; 0.2 0.8]
Time limit: 400.0 seconds

--------------- Opt Results ---------------
Obj. LB = 4.84312
Obj. UB = 4.84312
Status: Optimal
Solve time: 0.01537 seconds
q = 2 groups
n = 8 nodes
m = 8 edges
w=
[1.3 0.2; 0.2 0.8]
Time limit: 400.0 seconds

--------------- Opt Results ---------------
Obj. LB = 4.84312
Obj. UB = 4.84312
Status: Optimal
Solve time: 0.0152 seconds
Test Summary: | Pass  Total
Exact tests   |    5      5
   Testing StochasticBlockModel tests passed 
