Current time is 2020-10-25T09:29:50.065
Julia Version 1.6.0-DEV.1324
Commit ae789ca1df (2020-10-24 01:55 UTC)
Platform Info:
  OS: Linux (x86_64-linux-gnu)
  CPU: AMD EPYC 7502 32-Core Processor
  WORD_SIZE: 64
  LIBM: libopenlibm
  LLVM: libLLVM-11.0.0 (ORCJIT, znver2)
Environment:
  JULIA_DEPOT_PATH = ::/usr/local/share/julia
  JULIA_NUM_THREADS = 2
  JULIA_MAX_NUM_PRECOMPILE_FILES = 9223372036854775807
  JULIA_PKG_SERVER = 

Starting installation at 2020-10-25T09:29:52.949
   Resolving package versions...
   Installed OpenSpecFun_jll ────────────── v0.5.3+4
   Installed Rmath_jll ──────────────────── v0.2.2+1
   Installed DataAPI ────────────────────── v1.3.0
   Installed OrderedCollections ─────────── v1.3.1
   Installed Requires ───────────────────── v1.1.0
   Installed Functors ───────────────────── v0.1.0
   Installed StatsFuns ──────────────────── v0.9.5
   Installed CalibrationErrors ──────────── v0.5.8
   Installed Reexport ───────────────────── v0.2.0
   Installed Missings ───────────────────── v0.4.4
   Installed MacroTools ─────────────────── v0.5.6
   Installed UnPack ─────────────────────── v1.0.2
   Installed Compat ─────────────────────── v3.22.0
   Installed SpecialFunctions ───────────── v0.10.3
   Installed DataStructures ─────────────── v0.18.8
   Installed KernelFunctions ────────────── v0.8.7
   Installed CompilerSupportLibraries_jll ─ v0.3.4+0
   Installed Rmath ──────────────────────── v0.6.1
   Installed SortingAlgorithms ──────────── v0.3.1
     Cloning [b4f34e82-e78d-54a5-968a-f98e89d6e8f7] Distances from https://github.com/JuliaStats/Distances.jl.git
[?25l    Fetching: [>                                        ]  0.0 %[2K[?25h   Installed Distances ──────────────────── v0.10.0
     Cloning [692b3bcd-3c85-4b1f-b108-f13ce0eb3210] JLLWrappers from https://github.com/JuliaPackaging/JLLWrappers.jl.git
[?25l    Fetching: [>                                        ]  0.0 %[2K[?25h   Installed JLLWrappers ────────────────── v1.1.3
     Cloning [700de1a5-db45-46bc-99cf-38207098b444] ZygoteRules from https://github.com/FluxML/ZygoteRules.jl.git
[?25l    Fetching: [>                                        ]  0.0 %[2K[?25h   Installed ZygoteRules ────────────────── v0.2.0
     Cloning [2913bbd2-ae8a-5f71-8c99-4fb6c76f3a91] StatsBase from https://github.com/JuliaStats/StatsBase.jl.git
[?25l    Fetching: [>                                        ]  0.0 %[2K[?25h   Installed StatsBase ──────────────────── v0.33.2
Updating `~/.julia/environments/v1.6/Project.toml`
  [33913031] + CalibrationErrors v0.5.8
Updating `~/.julia/environments/v1.6/Manifest.toml`
  [33913031] + CalibrationErrors v0.5.8
  [34da2185] + Compat v3.22.0
  [9a962f9c] + DataAPI v1.3.0
  [864edb3b] + DataStructures v0.18.8
  [b4f34e82] + Distances v0.10.0
  [d9f16b24] + Functors v0.1.0
  [692b3bcd] + JLLWrappers v1.1.3
  [ec8451be] + KernelFunctions v0.8.7
  [1914dd2f] + MacroTools v0.5.6
  [e1d29d7a] + Missings v0.4.4
  [bac558e1] + OrderedCollections v1.3.1
  [189a3867] + Reexport v0.2.0
  [ae029012] + Requires v1.1.0
  [79098fc4] + Rmath v0.6.1
  [a2af1166] + SortingAlgorithms v0.3.1
  [276daf66] + SpecialFunctions v0.10.3
  [2913bbd2] + StatsBase v0.33.2
  [4c63d2b9] + StatsFuns v0.9.5
  [3a884ed6] + UnPack v1.0.2
  [700de1a5] + ZygoteRules v0.2.0
  [e66e0078] + CompilerSupportLibraries_jll v0.3.4+0
  [efe28fd5] + OpenSpecFun_jll v0.5.3+4
  [f50d1b31] + Rmath_jll v0.2.2+1
  [0dad84c5] + ArgTools
  [56f22d72] + Artifacts
  [2a0f44e3] + Base64
  [ade2ca70] + Dates
  [8bb1440f] + DelimitedFiles
  [8ba89e20] + Distributed
  [f43a241f] + Downloads
  [b77e0a4c] + InteractiveUtils
  [b27032c2] + LibCURL
  [76f85450] + LibGit2
  [8f399da3] + Libdl
  [37e2e46d] + LinearAlgebra
  [56ddb016] + Logging
  [d6f4376e] + Markdown
  [a63ad114] + Mmap
  [44cfe95a] + Pkg
  [de0858da] + Printf
  [3fa0cd96] + REPL
  [9a3f8284] + Random
  [ea8e919c] + SHA
  [9e88b42a] + Serialization
  [1a1011a3] + SharedArrays
  [6462fe0b] + Sockets
  [2f01184e] + SparseArrays
  [10745b16] + Statistics
  [fa267f1f] + TOML
  [8dfed614] + Test
  [cf7118a7] + UUIDs
  [4ec0a83e] + Unicode
  [deac9b47] + LibCURL_jll
  [14a3606d] + MozillaCACerts_jll
Precompiling project... (tip: to disable auto-precompilation set ENV["JULIA_PKG_PRECOMPILE_AUTO"]=0)
[32m  ✓ [39m[90mReexport[39m
[32m  ✓ [39m[90mUnPack[39m
[32m  ✓ [39m[90mDataAPI[39m
[32m  ✓ [39m[90mOrderedCollections[39m
[32m  ✓ [39m[90mJLLWrappers[39m
[32m  ✓ [39m[90mRequires[39m
[32m  ✓ [39m[90mDistances[39m
[32m  ✓ [39m[90mCompat[39m
[32m  ✓ [39m[90mMissings[39m
[32m  ✓ [39m[90mRmath_jll[39m
[32m  ✓ [39m[90mCompilerSupportLibraries_jll[39m
[32m  ✓ [39m[90mMacroTools[39m
[32m  ✓ [39m[90mFunctors[39m
[32m  ✓ [39m[90mRmath[39m
[32m  ✓ [39m[90mZygoteRules[39m
[32m  ✓ [39m[90mDataStructures[39m
[32m  ✓ [39m[90mOpenSpecFun_jll[39m
[32m  ✓ [39m[90mSpecialFunctions[39m
[32m  ✓ [39m[90mSortingAlgorithms[39m
[32m  ✓ [39m[90mStatsBase[39m
[32m  ✓ [39m[90mStatsFuns[39m
[32m  ✓ [39m[90mKernelFunctions[39m
[32m  ✓ [39mCalibrationErrors
23 dependencies successfully precompiled
Starting tests at 2020-10-25T09:36:39.476
     Testing CalibrationErrors
Status `/tmp/jl_bzv3v0/Project.toml`
  [33913031] CalibrationErrors v0.5.8
  [b4f34e82] Distances v0.10.0
  [31c24e10] Distributions v0.24.1
  [ec8451be] KernelFunctions v0.8.7
  [1bc83da4] SafeTestsets v0.0.1
  [2913bbd2] StatsBase v0.33.2
  [37e2e46d] LinearAlgebra
  [9a3f8284] Random
  [10745b16] Statistics
  [8dfed614] Test
Status `/tmp/jl_bzv3v0/Manifest.toml`
  [33913031] CalibrationErrors v0.5.8
  [34da2185] Compat v3.22.0
  [9a962f9c] DataAPI v1.3.0
  [864edb3b] DataStructures v0.18.8
  [b4f34e82] Distances v0.10.0
  [31c24e10] Distributions v0.24.1
  [1a297f60] FillArrays v0.9.7
  [d9f16b24] Functors v0.1.0
  [692b3bcd] JLLWrappers v1.1.3
  [ec8451be] KernelFunctions v0.8.7
  [1914dd2f] MacroTools v0.5.6
  [e1d29d7a] Missings v0.4.4
  [bac558e1] OrderedCollections v1.3.1
  [90014a1f] PDMats v0.10.1
  [1fd47b50] QuadGK v2.4.1
  [189a3867] Reexport v0.2.0
  [ae029012] Requires v1.1.0
  [79098fc4] Rmath v0.6.1
  [1bc83da4] SafeTestsets v0.0.1
  [a2af1166] SortingAlgorithms v0.3.1
  [276daf66] SpecialFunctions v0.10.3
  [90137ffa] StaticArrays v0.12.4
  [2913bbd2] StatsBase v0.33.2
  [4c63d2b9] StatsFuns v0.9.5
  [3a884ed6] UnPack v1.0.2
  [700de1a5] ZygoteRules v0.2.0
  [e66e0078] CompilerSupportLibraries_jll v0.3.4+0
  [efe28fd5] OpenSpecFun_jll v0.5.3+4
  [f50d1b31] Rmath_jll v0.2.2+1
  [0dad84c5] ArgTools
  [56f22d72] Artifacts
  [2a0f44e3] Base64
  [ade2ca70] Dates
  [8bb1440f] DelimitedFiles
  [8ba89e20] Distributed
  [f43a241f] Downloads
  [b77e0a4c] InteractiveUtils
  [b27032c2] LibCURL
  [76f85450] LibGit2
  [8f399da3] Libdl
  [37e2e46d] LinearAlgebra
  [56ddb016] Logging
  [d6f4376e] Markdown
  [a63ad114] Mmap
  [44cfe95a] Pkg
  [de0858da] Printf
  [3fa0cd96] REPL
  [9a3f8284] Random
  [ea8e919c] SHA
  [9e88b42a] Serialization
  [1a1011a3] SharedArrays
  [6462fe0b] Sockets
  [2f01184e] SparseArrays
  [10745b16] Statistics
  [4607b0f0] SuiteSparse
  [fa267f1f] TOML
  [8dfed614] Test
  [cf7118a7] UUIDs
  [4ec0a83e] Unicode
  [deac9b47] LibCURL_jll
  [14a3606d] MozillaCACerts_jll
     Testing Running tests...
Test Summary: | Pass  Total
Binning       |   36     36
Test Summary:   |  Pass  Total
Uniform binning | 24445  24445
Test Summary:           | Pass  Total
Median variance binning |  236    236
Test Summary: | Pass  Total
ECE           |    8      8
Test Summary: | Pass  Total
Kernels       |    9      9
Test Summary: | Pass  Total
Biased SKCE   |    7      7
Test Summary: | Pass  Total
Unbiased SKCE |   30     30
Test Summary: | Pass  Total
UCME          |   13     13
     Testing CalibrationErrors tests passed 
Finished at 2020-10-25T09:39:26.483
