Julia Version 1.6.0-DEV.1316
Commit 3e7c8f3e36 (2020-10-22 18:54 UTC)
Platform Info:
  OS: Linux (x86_64-pc-linux-gnu)
  CPU: AMD EPYC 7502 32-Core Processor
  WORD_SIZE: 64
  LIBM: libopenlibm
  LLVM: libLLVM-11.0.0 (ORCJIT, znver2)
Environment:
  JULIA_DEPOT_PATH = ::/usr/local/share/julia
  JULIA_NUM_THREADS = 2
  JULIA_MAX_NUM_PRECOMPILE_FILES = 9223372036854775807

   Resolving package versions...
   Installed Arpack_jll ─────────────────── v3.5.0+3
   Installed CompilerSupportLibraries_jll ─ v0.3.4+0
   Installed Combinatorics ──────────────── v0.7.0
   Installed UniqueVectors ──────────────── v0.7.0
   Installed RecipesBase ────────────────── v1.1.0
   Installed AdmittanceModels ───────────── v0.2.0
   Installed IterativeSolvers ───────────── v0.8.4
   Installed MatrixNetworks ─────────────── v1.0.1
   Installed OpenBLAS_jll ───────────────── v0.3.10+0
   Installed Compat ─────────────────────── v2.2.1
   Installed Polynomials ────────────────── v0.5.2
   Installed Arpack ─────────────────────── v0.4.0
   Installed KahanSummation ─────────────── v0.1.0
   Installed OrderedCollections ─────────── v1.3.1
   Installed IterTools ──────────────────── v1.3.0
   Installed JLLWrappers ────────────────── v1.1.2
   Installed DataStructures ─────────────── v0.17.20
Updating `~/.julia/environments/v1.6/Project.toml`
  [5eda1363] + AdmittanceModels v0.2.0
Updating `~/.julia/environments/v1.6/Manifest.toml`
  [5eda1363] + AdmittanceModels v0.2.0
  [7d9fca2a] + Arpack v0.4.0
  [861a8166] + Combinatorics v0.7.0
  [34da2185] + Compat v2.2.1
  [864edb3b] + DataStructures v0.17.20
  [c8e1da08] + IterTools v1.3.0
  [42fd0dbc] + IterativeSolvers v0.8.4
  [692b3bcd] + JLLWrappers v1.1.2
  [8e2b3108] + KahanSummation v0.1.0
  [4f449596] + MatrixNetworks v1.0.1
  [bac558e1] + OrderedCollections v1.3.1
  [f27b6e38] + Polynomials v0.5.2
  [3cdcf5f2] + RecipesBase v1.1.0
  [2fbcfb34] + UniqueVectors v0.7.0
  [68821587] + Arpack_jll v3.5.0+3
  [e66e0078] + CompilerSupportLibraries_jll v0.3.4+0
  [4536629a] + OpenBLAS_jll v0.3.10+0
  [0dad84c5] + ArgTools
  [56f22d72] + Artifacts
  [2a0f44e3] + Base64
  [ade2ca70] + Dates
  [8bb1440f] + DelimitedFiles
  [8ba89e20] + Distributed
  [f43a241f] + Downloads
  [b77e0a4c] + InteractiveUtils
  [b27032c2] + LibCURL
  [76f85450] + LibGit2
  [8f399da3] + Libdl
  [37e2e46d] + LinearAlgebra
  [56ddb016] + Logging
  [d6f4376e] + Markdown
  [a63ad114] + Mmap
  [44cfe95a] + Pkg
  [de0858da] + Printf
  [3fa0cd96] + REPL
  [9a3f8284] + Random
  [ea8e919c] + SHA
  [9e88b42a] + Serialization
  [1a1011a3] + SharedArrays
  [6462fe0b] + Sockets
  [2f01184e] + SparseArrays
  [10745b16] + Statistics
  [fa267f1f] + TOML
  [8dfed614] + Test
  [cf7118a7] + UUIDs
  [4ec0a83e] + Unicode
  [deac9b47] + LibCURL_jll
  [14a3606d] + MozillaCACerts_jll
Precompiling project... (tip: to disable auto-precompilation set ENV["JULIA_PKG_PRECOMPILE_AUTO"]=0)
[32m  ✓ [39m[90mRecipesBase[39m
[32m  ✓ [39m[90mKahanSummation[39m
[32m  ✓ [39m[90mUniqueVectors[39m
[32m  ✓ [39m[90mJLLWrappers[39m
[32m  ✓ [39m[90mIterTools[39m
[32m  ✓ [39m[90mPolynomials[39m
[32m  ✓ [39m[90mOrderedCollections[39m
[32m  ✓ [39m[90mCompat[39m
[32m  ✓ [39m[90mCombinatorics[39m
[32m  ✓ [39m[90mCompilerSupportLibraries_jll[39m
[32m  ✓ [39m[90mIterativeSolvers[39m
[32m  ✓ [39m[90mDataStructures[39m
[32m  ✓ [39m[90mOpenBLAS_jll[39m
[32m  ✓ [39m[90mArpack_jll[39m
[32m  ✓ [39m[90mArpack[39m
[32m  ✓ [39m[90mMatrixNetworks[39m
[32m  ✓ [39mAdmittanceModels
17 dependencies successfully precompiled
     Testing AdmittanceModels
Status `/tmp/jl_c7vHdY/Project.toml`
  [5eda1363] AdmittanceModels v0.2.0
  [861a8166] Combinatorics v0.7.0
  [34da2185] Compat v2.2.1
  [42fd0dbc] IterativeSolvers v0.8.4
  [4f449596] MatrixNetworks v1.0.1
  [92933f4c] ProgressMeter v1.4.0
  [2fbcfb34] UniqueVectors v0.7.0
  [37e2e46d] LinearAlgebra
  [2f01184e] SparseArrays
  [8dfed614] Test
Status `/tmp/jl_c7vHdY/Manifest.toml`
  [5eda1363] AdmittanceModels v0.2.0
  [7d9fca2a] Arpack v0.4.0
  [861a8166] Combinatorics v0.7.0
  [34da2185] Compat v2.2.1
  [864edb3b] DataStructures v0.17.20
  [c8e1da08] IterTools v1.3.0
  [42fd0dbc] IterativeSolvers v0.8.4
  [692b3bcd] JLLWrappers v1.1.2
  [8e2b3108] KahanSummation v0.1.0
  [4f449596] MatrixNetworks v1.0.1
  [bac558e1] OrderedCollections v1.3.1
  [f27b6e38] Polynomials v0.5.2
  [92933f4c] ProgressMeter v1.4.0
  [3cdcf5f2] RecipesBase v1.1.0
  [2fbcfb34] UniqueVectors v0.7.0
  [68821587] Arpack_jll v3.5.0+3
  [e66e0078] CompilerSupportLibraries_jll v0.3.4+0
  [4536629a] OpenBLAS_jll v0.3.10+0
  [0dad84c5] ArgTools
  [56f22d72] Artifacts
  [2a0f44e3] Base64
  [ade2ca70] Dates
  [8bb1440f] DelimitedFiles
  [8ba89e20] Distributed
  [f43a241f] Downloads
  [b77e0a4c] InteractiveUtils
  [b27032c2] LibCURL
  [76f85450] LibGit2
  [8f399da3] Libdl
  [37e2e46d] LinearAlgebra
  [56ddb016] Logging
  [d6f4376e] Markdown
  [a63ad114] Mmap
  [44cfe95a] Pkg
  [de0858da] Printf
  [3fa0cd96] REPL
  [9a3f8284] Random
  [ea8e919c] SHA
  [9e88b42a] Serialization
  [1a1011a3] SharedArrays
  [6462fe0b] Sockets
  [2f01184e] SparseArrays
  [10745b16] Statistics
  [fa267f1f] TOML
  [8dfed614] Test
  [cf7118a7] UUIDs
  [4ec0a83e] Unicode
  [deac9b47] LibCURL_jll
  [14a3606d] MozillaCACerts_jll
     Testing Running tests...
Test Summary:       | Pass  Total
closest_permutation |    2      2
Test Summary:   | Pass  Total
inv_power_eigen |    9      9
Test Summary:    | Pass  Total
row_column_graph |    1      1
Test Summary:                  | Pass  Total
sparse_nullbasis and nullbasis |   11     11
Test Summary: | Pass  Total
Circuit       |   13     13
Test Summary:     | Pass  Total
coordinate_matrix |    3      3
Test Summary:              | Pass  Total
cascade and unite_vertices |    8      8
Test Summary: | Pass  Total
PSOModel      |    9      9
Test Summary:        | Pass  Total
coordinate_transform |    3      3
Test Summary:       | Pass  Total
Circuit to PSOModel |    1      1
Test Summary:                                 | Pass  Total
cascade, unite_ports, open_ports, short_ports |    3      3
Test Summary:                              | Pass  Total
lossy_modes_dense and lossless_modes_dense |    8      8
Test Summary:                                   | Pass  Total
lossless_modes_sparse and tline resonator modes |   11     11
Test Summary:   | Pass  Total
canonical_gauge |    4      4
Test Summary:        | Pass  Total
PSOModel to Blackbox |    7      7
Test Summary:                                 | Pass  Total
cascade, unite_ports, open_ports, short_ports |    8      8
Test Summary:                 | Pass  Total
transfer function conversions |    5      5
Test Summary:                      | Pass  Total
TransmissionLine with terminations |    6      6
Test Summary:            | Pass  Total
reflection λ/4 resonator |    3      3
Test Summary:          | Pass  Total
Q3D plain text parsing |   11     11
Progress:   1%|▋                                        |  ETA: 0:05:58[KProgress:  39%|███████████████▉                         |  ETA: 0:00:15[KProgress:  41%|█████████████████                        |  ETA: 0:00:13[KProgress:  44%|██████████████████▏                      |  ETA: 0:00:12[KProgress:  46%|██████████████████▊                      |  ETA: 0:00:11[KProgress:  49%|███████████████████▉                     |  ETA: 0:00:10[KProgress:  50%|████████████████████▌                    |  ETA: 0:00:10[KProgress:  51%|█████████████████████▏                   |  ETA: 0:00:10[KProgress:  57%|███████████████████████▍                 |  ETA: 0:00:08[KProgress:  60%|████████████████████████▋                |  ETA: 0:00:07[KProgress:  63%|█████████████████████████▊               |  ETA: 0:00:06[KProgress:  66%|███████████████████████████              |  ETA: 0:00:06[KProgress:  70%|████████████████████████████▊            |  ETA: 0:00:05[KProgress:  71%|█████████████████████████████▎           |  ETA: 0:00:04[KProgress:  73%|█████████████████████████████▉           |  ETA: 0:00:04[KProgress:  76%|███████████████████████████████          |  ETA: 0:00:04[KProgress:  81%|█████████████████████████████████▍       |  ETA: 0:00:03[KProgress:  83%|██████████████████████████████████       |  ETA: 0:00:02[KProgress:  86%|███████████████████████████████████▏     |  ETA: 0:00:02[KProgress:  89%|████████████████████████████████████▍    |  ETA: 0:00:02[KProgress:  90%|████████████████████████████████████▉    |  ETA: 0:00:01[KProgress:  91%|█████████████████████████████████████▌   |  ETA: 0:00:01[KProgress:  94%|██████████████████████████████████████▋  |  ETA: 0:00:01[KProgress:  97%|███████████████████████████████████████▉ |  ETA: 0:00:00[KProgress:  99%|████████████████████████████████████████▍|  ETA: 0:00:00[KProgress: 100%|█████████████████████████████████████████| Time: 0:00:13[K
Progress:   1%|▋                                        |  ETA: 0:00:26[KProgress:   3%|█▏                                       |  ETA: 0:00:37[KProgress:   4%|█▊                                       |  ETA: 0:00:33[KProgress:   6%|██▍                                      |  ETA: 0:00:36[KProgress:   7%|██▉                                      |  ETA: 0:00:44[KProgress:   9%|███▌                                     |  ETA: 0:00:42[KProgress:  10%|████▏                                    |  ETA: 0:00:44[KProgress:  11%|████▋                                    |  ETA: 0:00:47[KProgress:  13%|█████▎                                   |  ETA: 0:00:48[KProgress:  14%|█████▉                                   |  ETA: 0:00:48[KProgress:  16%|██████▌                                  |  ETA: 0:00:47[KProgress:  17%|███████                                  |  ETA: 0:00:48[KProgress:  19%|███████▋                                 |  ETA: 0:00:48[KProgress:  20%|████████▎                                |  ETA: 0:00:47[KProgress:  21%|████████▊                                |  ETA: 0:00:47[KProgress:  23%|█████████▍                               |  ETA: 0:00:46[KProgress:  24%|██████████                               |  ETA: 0:00:44[KProgress:  26%|██████████▌                              |  ETA: 0:00:44[KProgress:  27%|███████████▏                             |  ETA: 0:00:42[KProgress:  29%|███████████▊                             |  ETA: 0:00:41[KProgress:  30%|████████████▎                            |  ETA: 0:00:41[KProgress:  31%|████████████▉                            |  ETA: 0:00:40[KProgress:  33%|█████████████▌                           |  ETA: 0:00:38[KProgress:  34%|██████████████                           |  ETA: 0:00:38[KProgress:  36%|██████████████▋                          |  ETA: 0:00:37[KProgress:  37%|███████████████▎                         |  ETA: 0:00:37[KProgress:  39%|███████████████▉                         |  ETA: 0:00:36[KProgress:  40%|████████████████▍                        |  ETA: 0:00:34[KProgress:  41%|█████████████████                        |  ETA: 0:00:33[KProgress:  43%|█████████████████▋                       |  ETA: 0:00:32[KProgress:  44%|██████████████████▏                      |  ETA: 0:00:30[KProgress:  46%|██████████████████▊                      |  ETA: 0:00:29[KProgress:  47%|███████████████████▍                     |  ETA: 0:00:29[KProgress:  49%|███████████████████▉                     |  ETA: 0:00:28[KProgress:  50%|████████████████████▌                    |  ETA: 0:00:27[KProgress:  51%|█████████████████████▏                   |  ETA: 0:00:27[KProgress:  53%|█████████████████████▋                   |  ETA: 0:00:26[KProgress:  54%|██████████████████████▎                  |  ETA: 0:00:25[KProgress:  56%|██████████████████████▉                  |  ETA: 0:00:24[KProgress:  57%|███████████████████████▍                 |  ETA: 0:00:23[KProgress:  59%|████████████████████████                 |  ETA: 0:00:23[KProgress:  60%|████████████████████████▋                |  ETA: 0:00:22[KProgress:  61%|█████████████████████████▏               |  ETA: 0:00:21[KProgress:  63%|█████████████████████████▊               |  ETA: 0:00:20[KProgress:  64%|██████████████████████████▍              |  ETA: 0:00:20[KProgress:  66%|███████████████████████████              |  ETA: 0:00:19[KProgress:  67%|███████████████████████████▌             |  ETA: 0:00:18[KProgress:  69%|████████████████████████████▏            |  ETA: 0:00:18[KProgress:  70%|████████████████████████████▊            |  ETA: 0:00:17[KProgress:  71%|█████████████████████████████▎           |  ETA: 0:00:16[KProgress:  73%|█████████████████████████████▉           |  ETA: 0:00:15[KProgress:  74%|██████████████████████████████▌          |  ETA: 0:00:14[KProgress:  76%|███████████████████████████████          |  ETA: 0:00:13[KProgress:  77%|███████████████████████████████▋         |  ETA: 0:00:13[KProgress:  79%|████████████████████████████████▎        |  ETA: 0:00:12[KProgress:  80%|████████████████████████████████▊        |  ETA: 0:00:11[KProgress:  81%|█████████████████████████████████▍       |  ETA: 0:00:10[KProgress:  83%|██████████████████████████████████       |  ETA: 0:00:10[KProgress:  84%|██████████████████████████████████▌      |  ETA: 0:00:09[KProgress:  86%|███████████████████████████████████▏     |  ETA: 0:00:08[KProgress:  87%|███████████████████████████████████▊     |  ETA: 0:00:07[KProgress:  89%|████████████████████████████████████▍    |  ETA: 0:00:06[KProgress:  90%|████████████████████████████████████▉    |  ETA: 0:00:06[KProgress:  91%|█████████████████████████████████████▌   |  ETA: 0:00:05[KProgress:  93%|██████████████████████████████████████▏  |  ETA: 0:00:04[KProgress:  94%|██████████████████████████████████████▋  |  ETA: 0:00:03[KProgress:  96%|███████████████████████████████████████▎ |  ETA: 0:00:02[KProgress:  97%|███████████████████████████████████████▉ |  ETA: 0:00:02[KProgress:  99%|████████████████████████████████████████▍|  ETA: 0:00:01[KProgress: 100%|█████████████████████████████████████████| Time: 0:00:56[K
Test Summary:  | Pass  Total
radiative loss |    1      1
Progress:  17%|██████▉                                  |  ETA: 0:01:40[KProgress:  33%|█████████████▋                           |  ETA: 0:01:15[KProgress:  50%|████████████████████▌                    |  ETA: 0:00:55[KProgress:  67%|███████████████████████████▍             |  ETA: 0:00:36[KProgress:  83%|██████████████████████████████████▏      |  ETA: 0:00:18[KProgress: 100%|█████████████████████████████████████████| Time: 0:01:47[K
Test Summary: | Pass  Total
hybridization |    1      1
     Testing AdmittanceModels tests passed 
