Julia Version 1.4.2-pre.0
Commit ef4fe83698 (2020-04-15 16:24 UTC)
Platform Info:
  OS: Linux (x86_64-linux-gnu)
  CPU: Intel(R) Xeon(R) Silver 4114 CPU @ 2.20GHz
  WORD_SIZE: 64
  LIBM: libopenlibm
  LLVM: libLLVM-8.0.1 (ORCJIT, skylake)
Environment:
  JULIA_DEPOT_PATH = ::/usr/local/share/julia
  JULIA_NUM_THREADS = 2

  Resolving package versions...
  Installed CompilerSupportLibraries_jll ─ v0.3.3+0
  Installed Requires ───────────────────── v0.5.2
  Installed SignalOperators ────────────── v0.4.0
  Installed Unitful ────────────────────── v0.18.0
  Installed FillArrays ─────────────────── v0.8.9
  Installed EzXML ──────────────────────── v1.1.0
  Installed RecipesBase ────────────────── v1.0.1
  Installed DSP ────────────────────────── v0.6.6
  Installed Reexport ───────────────────── v0.2.0
  Installed MKL_jll ────────────────────── v2019.0.117+2
  Installed ConstructionBase ───────────── v1.0.0
  Installed ExprTools ──────────────────── v0.1.1
  Installed Intervals ──────────────────── v1.1.0
  Installed AbstractFFTs ───────────────── v0.5.0
  Installed PrettyPrinting ─────────────── v0.2.0
  Installed FFTW_jll ───────────────────── v3.3.9+5
  Installed Zlib_jll ───────────────────── v1.2.11+9
  Installed MacroTools ─────────────────── v0.5.5
  Installed SignalBase ─────────────────── v0.1.1
  Installed SpecialFunctions ───────────── v0.10.0
  Installed Polynomials ────────────────── v0.8.0
  Installed IterTools ──────────────────── v1.3.0
  Installed LambdaFn ───────────────────── v0.3.0
  Installed OpenSpecFun_jll ────────────── v0.5.3+3
  Installed Mocking ────────────────────── v0.7.1
  Installed IntelOpenMP_jll ────────────── v2018.0.3+0
  Installed TimeZones ──────────────────── v1.2.0
  Installed Libiconv_jll ───────────────── v1.16.0+2
  Installed FileIO ─────────────────────── v1.3.0
  Installed XML2_jll ───────────────────── v2.9.9+4
  Installed FFTW ───────────────────────── v1.2.1
  Installed Compat ─────────────────────── v2.2.0
  Installed MetaArrays ─────────────────── v0.2.7
   Updating `~/.julia/environments/v1.4/Project.toml`
  [4d633899] + SignalOperators v0.4.0
   Updating `~/.julia/environments/v1.4/Manifest.toml`
  [621f4979] + AbstractFFTs v0.5.0
  [34da2185] + Compat v2.2.0
  [e66e0078] + CompilerSupportLibraries_jll v0.3.3+0
  [187b0558] + ConstructionBase v1.0.0
  [717857b8] + DSP v0.6.6
  [e2ba6199] + ExprTools v0.1.1
  [8f5d6c58] + EzXML v1.1.0
  [7a1cc6ca] + FFTW v1.2.1
  [f5851436] + FFTW_jll v3.3.9+5
  [5789e2e9] + FileIO v1.3.0
  [1a297f60] + FillArrays v0.8.9
  [1d5cc7b8] + IntelOpenMP_jll v2018.0.3+0
  [d8418881] + Intervals v1.1.0
  [c8e1da08] + IterTools v1.3.0
  [fcefd6c4] + LambdaFn v0.3.0
  [94ce4f54] + Libiconv_jll v1.16.0+2
  [856f044c] + MKL_jll v2019.0.117+2
  [1914dd2f] + MacroTools v0.5.5
  [36b8f3f0] + MetaArrays v0.2.7
  [78c3b35d] + Mocking v0.7.1
  [efe28fd5] + OpenSpecFun_jll v0.5.3+3
  [f27b6e38] + Polynomials v0.8.0
  [54e16d92] + PrettyPrinting v0.2.0
  [3cdcf5f2] + RecipesBase v1.0.1
  [189a3867] + Reexport v0.2.0
  [ae029012] + Requires v0.5.2
  [00c44e92] + SignalBase v0.1.1
  [4d633899] + SignalOperators v0.4.0
  [276daf66] + SpecialFunctions v0.10.0
  [f269a46b] + TimeZones v1.2.0
  [1986cc42] + Unitful v0.18.0
  [02c8fc9c] + XML2_jll v2.9.9+4
  [83775a58] + Zlib_jll v1.2.11+9
  [2a0f44e3] + Base64 
  [ade2ca70] + Dates 
  [8bb1440f] + DelimitedFiles 
  [8ba89e20] + Distributed 
  [b77e0a4c] + InteractiveUtils 
  [76f85450] + LibGit2 
  [8f399da3] + Libdl 
  [37e2e46d] + LinearAlgebra 
  [56ddb016] + Logging 
  [d6f4376e] + Markdown 
  [a63ad114] + Mmap 
  [44cfe95a] + Pkg 
  [de0858da] + Printf 
  [3fa0cd96] + REPL 
  [9a3f8284] + Random 
  [ea8e919c] + SHA 
  [9e88b42a] + Serialization 
  [1a1011a3] + SharedArrays 
  [6462fe0b] + Sockets 
  [2f01184e] + SparseArrays 
  [10745b16] + Statistics 
  [8dfed614] + Test 
  [cf7118a7] + UUIDs 
  [4ec0a83e] + Unicode 
   Building TimeZones → `~/.julia/packages/TimeZones/OjMoF/deps/build.log`
   Building FFTW ─────→ `~/.julia/packages/FFTW/5DZuu/deps/build.log`
    Testing SignalOperators
Status `/tmp/jl_p1a75N/Manifest.toml`
  [621f4979] AbstractFFTs v0.5.0
  [39de3d68] AxisArrays v0.4.3
  [6e4b80f9] BenchmarkTools v0.5.0
  [34da2185] Compat v2.2.0
  [e66e0078] CompilerSupportLibraries_jll v0.3.3+0
  [187b0558] ConstructionBase v1.0.0
  [717857b8] DSP v0.6.6
  [0703355e] DimensionalData v0.10.9
  [da5c29d0] EllipsisNotation v0.4.0
  [e2ba6199] ExprTools v0.1.1
  [8f5d6c58] EzXML v1.1.0
  [7a1cc6ca] FFTW v1.2.1
  [f5851436] FFTW_jll v3.3.9+5
  [5789e2e9] FileIO v1.3.0
  [1a297f60] FillArrays v0.8.9
  [53c48c17] FixedPointNumbers v0.8.0
  [1d5cc7b8] IntelOpenMP_jll v2018.0.3+0
  [8197267c] IntervalSets v0.5.0
  [d8418881] Intervals v1.1.0
  [c8e1da08] IterTools v1.3.0
  [682c06a0] JSON v0.21.0
  [fcefd6c4] LambdaFn v0.3.0
  [94ce4f54] Libiconv_jll v1.16.0+2
  [856f044c] MKL_jll v2019.0.117+2
  [1914dd2f] MacroTools v0.5.5
  [36b8f3f0] MetaArrays v0.2.7
  [78c3b35d] Mocking v0.7.1
  [efe28fd5] OpenSpecFun_jll v0.5.3+3
  [69de0a69] Parsers v1.0.3
  [f27b6e38] Polynomials v0.8.0
  [54e16d92] PrettyPrinting v0.2.0
  [92933f4c] ProgressMeter v1.2.0
  [b3c3ace0] RangeArrays v0.3.2
  [3cdcf5f2] RecipesBase v1.0.1
  [189a3867] Reexport v0.2.0
  [ae029012] Requires v0.5.2
  [00c44e92] SignalBase v0.1.1
  [4d633899] SignalOperators v0.4.0
  [276daf66] SpecialFunctions v0.10.0
  [f269a46b] TimeZones v1.2.0
  [1986cc42] Unitful v0.18.0
  [8149f6b0] WAV v1.0.3
  [02c8fc9c] XML2_jll v2.9.9+4
  [83775a58] Zlib_jll v1.2.11+9
  [2a0f44e3] Base64 
  [ade2ca70] Dates 
  [8bb1440f] DelimitedFiles 
  [8ba89e20] Distributed 
  [b77e0a4c] InteractiveUtils 
  [76f85450] LibGit2 
  [8f399da3] Libdl 
  [37e2e46d] LinearAlgebra 
  [56ddb016] Logging 
  [d6f4376e] Markdown 
  [a63ad114] Mmap 
  [44cfe95a] Pkg 
  [de0858da] Printf 
  [3fa0cd96] REPL 
  [9a3f8284] Random 
  [ea8e919c] SHA 
  [9e88b42a] Serialization 
  [1a1011a3] SharedArrays 
  [6462fe0b] Sockets 
  [2f01184e] SparseArrays 
  [10745b16] Statistics 
  [8dfed614] Test 
  [cf7118a7] UUIDs 
  [4ec0a83e] Unicode 
Running tests...  3%|█                                  |  ETA: 0:05:19[KRunning tests...  6%|██▁                                |  ETA: 0:04:21[KRunning tests...  9%|███▁                               |  ETA: 0:03:57[KRunning tests... 12%|████▁                              |  ETA: 0:03:51[KRunning tests... 15%|█████▁                             |  ETA: 0:03:00[KRunning tests... 18%|██████▁                            |  ETA: 0:02:50[KRunning tests... 21%|███████▁                           |  ETA: 0:02:41[KRunning tests... 24%|████████▌                          |  ETA: 0:03:07[KRunning tests... 27%|█████████▌                         |  ETA: 0:04:02[KRunning tests... 30%|██████████▋                        |  ETA: 0:04:15[KRunning tests... 33%|███████████▋                       |  ETA: 0:03:55[KRunning tests... 36%|████████████▊                      |  ETA: 0:03:54[K┌ Warning: Use of `Poly` from v1.0 forward will require `using Polynomials.PolyCompat`
│   caller = fromroots(::Type{Polynomials.PolyCompat.Poly}, ::Array{Complex{Float64},1}; var::Symbol) at Poly.jl:64
└ @ Polynomials.PolyCompat ~/.julia/packages/Polynomials/ghqdF/src/polynomials/Poly.jl:64
┌ Warning: Use of `Poly` from v1.0 forward will require `using Polynomials.PolyCompat`
│   caller = Polynomials.PolyCompat.Poly{Complex{Float64}}(::Array{Complex{Float64},1}, ::Symbol) at abstract.jl:45
└ @ Polynomials.PolyCompat ~/.julia/packages/Polynomials/ghqdF/src/abstract.jl:45
┌ Warning: Use of `Poly` from v1.0 forward will require `using Polynomials.PolyCompat`
│   caller = Poly at Poly.jl:26 [inlined]
└ @ Core ~/.julia/packages/Polynomials/ghqdF/src/polynomials/Poly.jl:26
┌ Warning: Use of `Poly` from v1.0 forward will require `using Polynomials.PolyCompat`
│   caller = Poly at Poly.jl:26 [inlined]
└ @ Core ~/.julia/packages/Polynomials/ghqdF/src/polynomials/Poly.jl:26
┌ Warning: Use of `Poly` from v1.0 forward will require `using Polynomials.PolyCompat`
│   caller = Polynomials.PolyCompat.Poly{Float64}(::Array{Float64,1}, ::Symbol) at abstract.jl:45
└ @ Polynomials.PolyCompat ~/.julia/packages/Polynomials/ghqdF/src/abstract.jl:45
Running tests... 39%|█████████████▊                     |  ETA: 0:04:28[KRunning tests... 42%|██████████████▉                    |  ETA: 0:05:31[KRunning tests... 45%|███████████████▉                   |  ETA: 0:05:05[KRunning tests... 48%|█████████████████                  |  ETA: 0:04:39[KRunning tests... 52%|██████████████████                 |  ETA: 0:04:19[KRunning tests... 55%|███████████████████▁               |  ETA: 0:03:52[KRunning tests... 58%|████████████████████▁              |  ETA: 0:03:33[KRunning tests... 61%|█████████████████████▁             |  ETA: 0:03:28[KRunning tests... 64%|██████████████████████▁            |  ETA: 0:03:06[KRunning tests... 67%|███████████████████████▁           |  ETA: 0:02:43[KRunning tests... 70%|████████████████████████▁          |  ETA: 0:02:31[KRunning tests... 73%|█████████████████████████▌         |  ETA: 0:02:16[KRunning tests... 76%|██████████████████████████▌        |  ETA: 0:02:11[KRunning tests... 79%|███████████████████████████▋       |  ETA: 0:02:02[KRunning tests... 82%|████████████████████████████▋      |  ETA: 0:01:51[KRunning tests... 85%|█████████████████████████████▊     |  ETA: 0:01:33[KRunning tests... 88%|██████████████████████████████▊    |  ETA: 0:01:25[KRunning tests... 91%|███████████████████████████████▉   |  ETA: 0:01:10[KRunning tests... 94%|████████████████████████████████▉  |  ETA: 0:00:46[K Activating new environment at `~/.julia/packages/SignalOperators/VmWyE/test/jl_BBOnq4/Project.toml`
  Resolving package versions...
  Installed libvorbis_jll ───── v1.3.6+4
  Installed libsndfile_jll ──── v1.0.28+1
  Installed IntervalSets ────── v0.3.2
  Installed FLAC_jll ────────── v1.3.3+2
  Installed Ogg_jll ─────────── v1.3.4+0
  Installed LibSndFile ──────── v2.3.0
  Installed Unitful ─────────── v0.17.0
  Installed SampledSignals ──── v2.1.0
  Installed FixedPointNumbers ─ v0.6.1
  Installed TreeViews ───────── v0.3.0
   Updating `~/.julia/packages/SignalOperators/VmWyE/test/jl_BBOnq4/Project.toml`
  [b13ce0c6] + LibSndFile v2.3.0
   Updating `~/.julia/packages/SignalOperators/VmWyE/test/jl_BBOnq4/Manifest.toml`
  [621f4979] + AbstractFFTs v0.5.0
  [34da2185] + Compat v2.2.0
  [e66e0078] + CompilerSupportLibraries_jll v0.3.3+0
  [717857b8] + DSP v0.6.6
  [e2ba6199] + ExprTools v0.1.1
  [8f5d6c58] + EzXML v1.1.0
  [7a1cc6ca] + FFTW v1.2.1
  [f5851436] + FFTW_jll v3.3.9+5
  [1d38b3a6] + FLAC_jll v1.3.3+2
  [5789e2e9] + FileIO v1.3.0
  [53c48c17] + FixedPointNumbers v0.6.1
  [1d5cc7b8] + IntelOpenMP_jll v2018.0.3+0
  [8197267c] + IntervalSets v0.3.2
  [d8418881] + Intervals v1.1.0
  [c8e1da08] + IterTools v1.3.0
  [b13ce0c6] + LibSndFile v2.3.0
  [94ce4f54] + Libiconv_jll v1.16.0+2
  [856f044c] + MKL_jll v2019.0.117+2
  [78c3b35d] + Mocking v0.7.1
  [e7412a2a] + Ogg_jll v1.3.4+0
  [efe28fd5] + OpenSpecFun_jll v0.5.3+3
  [f27b6e38] + Polynomials v0.8.0
  [3cdcf5f2] + RecipesBase v1.0.1
  [189a3867] + Reexport v0.2.0
  [bd7594eb] + SampledSignals v2.1.0
  [276daf66] + SpecialFunctions v0.10.0
  [f269a46b] + TimeZones v1.2.0
  [a2a6695c] + TreeViews v0.3.0
  [1986cc42] + Unitful v0.17.0
  [02c8fc9c] + XML2_jll v2.9.9+4
  [83775a58] + Zlib_jll v1.2.11+9
  [5bf562c0] + libsndfile_jll v1.0.28+1
  [f27f6e37] + libvorbis_jll v1.3.6+4
  [2a0f44e3] + Base64 
  [ade2ca70] + Dates 
  [8bb1440f] + DelimitedFiles 
  [8ba89e20] + Distributed 
  [b77e0a4c] + InteractiveUtils 
  [76f85450] + LibGit2 
  [8f399da3] + Libdl 
  [37e2e46d] + LinearAlgebra 
  [56ddb016] + Logging 
  [d6f4376e] + Markdown 
  [a63ad114] + Mmap 
  [44cfe95a] + Pkg 
  [de0858da] + Printf 
  [3fa0cd96] + REPL 
  [9a3f8284] + Random 
  [ea8e919c] + SHA 
  [9e88b42a] + Serialization 
  [1a1011a3] + SharedArrays 
  [6462fe0b] + Sockets 
  [2f01184e] + SparseArrays 
  [10745b16] + Statistics 
  [8dfed614] + Test 
  [cf7118a7] + UUIDs 
  [4ec0a83e] + Unicode 
  Resolving package versions...
   Updating `~/.julia/packages/SignalOperators/VmWyE/test/jl_BBOnq4/Project.toml`
  [bd7594eb] + SampledSignals v2.1.0
   Updating `~/.julia/packages/SignalOperators/VmWyE/test/jl_BBOnq4/Manifest.toml`
 [no changes]
[ Info: Loading LibSndFile backend for SignalOperators.
Running tests... 97%|██████████████████████████████████ |  ETA: 0:00:25[KRunning tests...100%|███████████████████████████████████| Time: 0:13:37[K
Test Summary:      | Pass  Total
SignalOperators.jl |  483    483
    Testing SignalOperators tests passed 
