Julia Version 1.5.0-DEV.875
Commit f7de6d242f (2020-05-07 14:36 UTC)
Platform Info:
  OS: Linux (x86_64-pc-linux-gnu)
  CPU: Intel(R) Xeon(R) Silver 4114 CPU @ 2.20GHz
  WORD_SIZE: 64
  LIBM: libopenlibm
  LLVM: libLLVM-9.0.1 (ORCJIT, skylake)
Environment:
  JULIA_DEPOT_PATH = ::/usr/local/share/julia
  JULIA_NUM_THREADS = 2

  Resolving package versions...
  Installed Media ──────────────────────── v0.5.0
  Installed CodecZlib ──────────────────── v0.7.0
  Installed DataAPI ────────────────────── v1.3.0
  Installed CodeTracking ───────────────── v0.5.11
  Installed TranscodingStreams ─────────── v0.9.5
  Installed LazyArrays ─────────────────── v0.16.8
  Installed SparseGaussianProcesses ────── v0.1.0
  Installed IRTools ────────────────────── v0.3.2
  Installed OrderedCollections ─────────── v1.2.0
  Installed TensorCast ─────────────────── v0.2.2
  Installed ZipFile ────────────────────── v0.9.1
  Installed NaNMath ────────────────────── v0.3.3
  Installed LazyStack ──────────────────── v0.0.7
  Installed ArrayLayouts ───────────────── v0.2.6
  Installed DiffRules ──────────────────── v1.0.1
  Installed AbstractTrees ──────────────── v0.3.3
  Installed CUDAdrv ────────────────────── v6.3.0
  Installed StaticArrays ───────────────── v0.12.3
  Installed Adapt ──────────────────────── v1.0.1
  Installed Zlib_jll ───────────────────── v1.2.11+9
  Installed Requires ───────────────────── v1.0.1
  Installed SpecialFunctions ───────────── v0.10.0
  Installed GPUArrays ──────────────────── v3.2.0
  Installed Flux ───────────────────────── v0.10.4
  Installed Compat ─────────────────────── v3.9.0
  Installed Missings ───────────────────── v0.4.3
  Installed StatsBase ──────────────────── v0.33.0
  Installed LLVM ───────────────────────── v1.4.1
  Installed SortingAlgorithms ──────────── v0.3.1
  Installed Reexport ───────────────────── v0.2.0
  Installed Zygote ─────────────────────── v0.4.20
  Installed ColorTypes ─────────────────── v0.10.3
  Installed MacroTools ─────────────────── v0.5.5
  Installed TimerOutputs ───────────────── v0.5.5
  Installed MatrixFactorizations ───────── v0.4.0
  Installed OpenSpecFun_jll ────────────── v0.5.3+3
  Installed Juno ───────────────────────── v0.8.1
  Installed NamedDims ──────────────────── v0.2.21
  Installed DiffResults ────────────────── v1.0.2
  Installed ExprTools ──────────────────── v0.1.1
  Installed CuArrays ───────────────────── v2.1.0
  Installed AbstractFFTs ───────────────── v0.5.0
  Installed NNlib ──────────────────────── v0.6.6
  Installed CUDAapi ────────────────────── v4.0.0
  Installed CommonSubexpressions ───────── v0.2.0
  Installed FixedPointNumbers ──────────── v0.8.0
  Installed FillArrays ─────────────────── v0.8.8
  Installed CUDAnative ─────────────────── v3.0.4
  Installed CEnum ──────────────────────── v0.2.0
  Installed OffsetArrays ───────────────── v1.0.4
  Installed ForwardDiff ────────────────── v0.10.10
  Installed CompilerSupportLibraries_jll ─ v0.3.3+0
  Installed ZygoteRules ────────────────── v0.2.0
  Installed Colors ─────────────────────── v0.12.0
  Installed Cthulhu ────────────────────── v1.0.2
  Installed DataStructures ─────────────── v0.17.15
  Installed BinaryProvider ─────────────── v0.5.9
Updating `~/.julia/environments/v1.5/Project.toml`
  [48e2ed6f] + SparseGaussianProcesses v0.1.0
Updating `~/.julia/environments/v1.5/Manifest.toml`
  [621f4979] + AbstractFFTs v0.5.0
  [1520ce14] + AbstractTrees v0.3.3
  [79e6a3ab] + Adapt v1.0.1
  [4c555306] + ArrayLayouts v0.2.6
  [b99e7846] + BinaryProvider v0.5.9
  [fa961155] + CEnum v0.2.0
  [3895d2a7] + CUDAapi v4.0.0
  [c5f51814] + CUDAdrv v6.3.0
  [be33ccc6] + CUDAnative v3.0.4
  [da1fd8a2] + CodeTracking v0.5.11
  [944b1d66] + CodecZlib v0.7.0
  [3da002f7] + ColorTypes v0.10.3
  [5ae59095] + Colors v0.12.0
  [bbf7d656] + CommonSubexpressions v0.2.0
  [34da2185] + Compat v3.9.0
  [e66e0078] + CompilerSupportLibraries_jll v0.3.3+0
  [f68482b8] + Cthulhu v1.0.2
  [3a865a2d] + CuArrays v2.1.0
  [9a962f9c] + DataAPI v1.3.0
  [864edb3b] + DataStructures v0.17.15
  [163ba53b] + DiffResults v1.0.2
  [b552c78f] + DiffRules v1.0.1
  [e2ba6199] + ExprTools v0.1.1
  [1a297f60] + FillArrays v0.8.8
  [53c48c17] + FixedPointNumbers v0.8.0
  [587475ba] + Flux v0.10.4
  [f6369f11] + ForwardDiff v0.10.10
  [0c68f7d7] + GPUArrays v3.2.0
  [7869d1d1] + IRTools v0.3.2
  [e5e0dc1b] + Juno v0.8.1
  [929cbde3] + LLVM v1.4.1
  [5078a376] + LazyArrays v0.16.8
  [1fad7336] + LazyStack v0.0.7
  [1914dd2f] + MacroTools v0.5.5
  [a3b82374] + MatrixFactorizations v0.4.0
  [e89f7d12] + Media v0.5.0
  [e1d29d7a] + Missings v0.4.3
  [872c559c] + NNlib v0.6.6
  [77ba4419] + NaNMath v0.3.3
  [356022a1] + NamedDims v0.2.21
  [6fe1bfb0] + OffsetArrays v1.0.4
  [efe28fd5] + OpenSpecFun_jll v0.5.3+3
  [bac558e1] + OrderedCollections v1.2.0
  [189a3867] + Reexport v0.2.0
  [ae029012] + Requires v1.0.1
  [a2af1166] + SortingAlgorithms v0.3.1
  [48e2ed6f] + SparseGaussianProcesses v0.1.0
  [276daf66] + SpecialFunctions v0.10.0
  [90137ffa] + StaticArrays v0.12.3
  [2913bbd2] + StatsBase v0.33.0
  [02d47bb6] + TensorCast v0.2.2
  [a759f4b9] + TimerOutputs v0.5.5
  [3bb67fe8] + TranscodingStreams v0.9.5
  [a5390f91] + ZipFile v0.9.1
  [83775a58] + Zlib_jll v1.2.11+9
  [e88e6eb3] + Zygote v0.4.20
  [700de1a5] + ZygoteRules v0.2.0
  [2a0f44e3] + Base64
  [ade2ca70] + Dates
  [8bb1440f] + DelimitedFiles
  [8ba89e20] + Distributed
  [9fa8497b] + Future
  [b77e0a4c] + InteractiveUtils
  [76f85450] + LibGit2
  [8f399da3] + Libdl
  [37e2e46d] + LinearAlgebra
  [56ddb016] + Logging
  [d6f4376e] + Markdown
  [a63ad114] + Mmap
  [44cfe95a] + Pkg
  [de0858da] + Printf
  [9abbd945] + Profile
  [3fa0cd96] + REPL
  [9a3f8284] + Random
  [ea8e919c] + SHA
  [9e88b42a] + Serialization
  [1a1011a3] + SharedArrays
  [6462fe0b] + Sockets
  [2f01184e] + SparseArrays
  [10745b16] + Statistics
  [8dfed614] + Test
  [cf7118a7] + UUIDs
  [4ec0a83e] + Unicode
   Building NNlib → `~/.julia/packages/NNlib/FAI3o/deps/build.log`
    Testing SparseGaussianProcesses
Status `/tmp/jl_KajL1C/Project.toml`
  [587475ba] Flux v0.10.4
  [92933f4c] ProgressMeter v1.2.0
  [ae029012] Requires v1.0.1
  [48e2ed6f] SparseGaussianProcesses v0.1.0
  [02d47bb6] TensorCast v0.2.2
  [37e2e46d] LinearAlgebra
  [9a3f8284] Random
  [10745b16] Statistics
  [8dfed614] Test
Status `/tmp/jl_KajL1C/Manifest.toml`
  [621f4979] AbstractFFTs v0.5.0
  [1520ce14] AbstractTrees v0.3.3
  [79e6a3ab] Adapt v1.0.1
  [4c555306] ArrayLayouts v0.2.6
  [b99e7846] BinaryProvider v0.5.9
  [fa961155] CEnum v0.2.0
  [3895d2a7] CUDAapi v4.0.0
  [c5f51814] CUDAdrv v6.3.0
  [be33ccc6] CUDAnative v3.0.4
  [da1fd8a2] CodeTracking v0.5.11
  [944b1d66] CodecZlib v0.7.0
  [3da002f7] ColorTypes v0.10.3
  [5ae59095] Colors v0.12.0
  [bbf7d656] CommonSubexpressions v0.2.0
  [34da2185] Compat v3.9.0
  [e66e0078] CompilerSupportLibraries_jll v0.3.3+0
  [f68482b8] Cthulhu v1.0.2
  [3a865a2d] CuArrays v2.1.0
  [9a962f9c] DataAPI v1.3.0
  [864edb3b] DataStructures v0.17.15
  [163ba53b] DiffResults v1.0.2
  [b552c78f] DiffRules v1.0.1
  [e2ba6199] ExprTools v0.1.1
  [1a297f60] FillArrays v0.8.8
  [53c48c17] FixedPointNumbers v0.8.0
  [587475ba] Flux v0.10.4
  [f6369f11] ForwardDiff v0.10.10
  [0c68f7d7] GPUArrays v3.2.0
  [7869d1d1] IRTools v0.3.2
  [e5e0dc1b] Juno v0.8.1
  [929cbde3] LLVM v1.4.1
  [5078a376] LazyArrays v0.16.8
  [1fad7336] LazyStack v0.0.7
  [1914dd2f] MacroTools v0.5.5
  [a3b82374] MatrixFactorizations v0.4.0
  [e89f7d12] Media v0.5.0
  [e1d29d7a] Missings v0.4.3
  [872c559c] NNlib v0.6.6
  [77ba4419] NaNMath v0.3.3
  [356022a1] NamedDims v0.2.21
  [6fe1bfb0] OffsetArrays v1.0.4
  [efe28fd5] OpenSpecFun_jll v0.5.3+3
  [bac558e1] OrderedCollections v1.2.0
  [92933f4c] ProgressMeter v1.2.0
  [189a3867] Reexport v0.2.0
  [ae029012] Requires v1.0.1
  [a2af1166] SortingAlgorithms v0.3.1
  [48e2ed6f] SparseGaussianProcesses v0.1.0
  [276daf66] SpecialFunctions v0.10.0
  [90137ffa] StaticArrays v0.12.3
  [2913bbd2] StatsBase v0.33.0
  [02d47bb6] TensorCast v0.2.2
  [a759f4b9] TimerOutputs v0.5.5
  [3bb67fe8] TranscodingStreams v0.9.5
  [a5390f91] ZipFile v0.9.1
  [83775a58] Zlib_jll v1.2.11+9
  [e88e6eb3] Zygote v0.4.20
  [700de1a5] ZygoteRules v0.2.0
  [2a0f44e3] Base64
  [ade2ca70] Dates
  [8bb1440f] DelimitedFiles
  [8ba89e20] Distributed
  [9fa8497b] Future
  [b77e0a4c] InteractiveUtils
  [76f85450] LibGit2
  [8f399da3] Libdl
  [37e2e46d] LinearAlgebra
  [56ddb016] Logging
  [d6f4376e] Markdown
  [a63ad114] Mmap
  [44cfe95a] Pkg
  [de0858da] Printf
  [9abbd945] Profile
  [3fa0cd96] REPL
  [9a3f8284] Random
  [ea8e919c] SHA
  [9e88b42a] Serialization
  [1a1011a3] SharedArrays
  [6462fe0b] Sockets
  [2f01184e] SparseArrays
  [10745b16] Statistics
  [8dfed614] Test
  [cf7118a7] UUIDs
  [4ec0a83e] Unicode
WARNING: could not import Compiler.just_construct_ssa into Wrap
WARNING: Method definition _pullback(Zygote.Context, typeof(Random.randn!), Any...) in module Zygote at /home/pkgeval/.julia/packages/Zygote/YeCEW/src/lib/grad.jl:14 overwritten in module SparseGaussianProcesses at /home/pkgeval/.julia/packages/Zygote/YeCEW/src/lib/grad.jl:14.
  ** incremental compilation may be fatally broken for this module **

Progress:   1%|▁                                        |  ETA: 0:04:26[KProgress:   4%|█▋                                       |  ETA: 0:01:17[KProgress:   5%|██                                       |  ETA: 0:01:04[KProgress:   6%|██▌                                      |  ETA: 0:00:56[KProgress:   8%|███▁                                     |  ETA: 0:00:44[KProgress:   9%|███▊                                     |  ETA: 0:00:40[KProgress:  11%|████▌                                    |  ETA: 0:00:34[KProgress:  13%|█████▁                                   |  ETA: 0:00:30[KProgress:  14%|█████▊                                   |  ETA: 0:00:29[KProgress:  15%|██████▁                                  |  ETA: 0:00:28[KProgress:  16%|██████▌                                  |  ETA: 0:00:27[KProgress:  17%|███████                                  |  ETA: 0:00:26[KProgress:  18%|███████▁                                 |  ETA: 0:00:25[KProgress:  19%|███████▊                                 |  ETA: 0:00:24[KProgress:  20%|████████▁                                |  ETA: 0:00:23[KProgress:  21%|████████▋                                |  ETA: 0:00:22[KProgress:  22%|█████████                                |  ETA: 0:00:22[KProgress:  23%|█████████▁                               |  ETA: 0:00:21[KProgress:  25%|██████████▁                              |  ETA: 0:00:20[KProgress:  27%|███████████▁                             |  ETA: 0:00:18[KProgress:  29%|███████████▉                             |  ETA: 0:00:17[KProgress:  32%|█████████████▁                           |  ETA: 0:00:15[KProgress:  33%|█████████████▌                           |  ETA: 0:00:15[KProgress:  34%|██████████████                           |  ETA: 0:00:14[KProgress:  35%|██████████████▁                          |  ETA: 0:00:14[KProgress:  37%|███████████████▁                         |  ETA: 0:00:13[KProgress:  38%|███████████████▋                         |  ETA: 0:00:13[KProgress:  39%|████████████████                         |  ETA: 0:00:12[KProgress:  41%|████████████████▊                        |  ETA: 0:00:12[KProgress:  43%|█████████████████▋                       |  ETA: 0:00:11[KProgress:  45%|██████████████████▌                      |  ETA: 0:00:11[KProgress:  47%|███████████████████▁                     |  ETA: 0:00:10[KProgress:  49%|████████████████████▁                    |  ETA: 0:00:10[KProgress:  50%|████████████████████▌                    |  ETA: 0:00:09[KProgress:  51%|████████████████████▉                    |  ETA: 0:00:09[KProgress:  52%|█████████████████████▁                   |  ETA: 0:00:09[KProgress:  53%|█████████████████████▊                   |  ETA: 0:00:09[KProgress:  55%|██████████████████████▌                  |  ETA: 0:00:08[KProgress:  56%|███████████████████████                  |  ETA: 0:00:08[KProgress:  57%|███████████████████████▁                 |  ETA: 0:00:08[KProgress:  58%|███████████████████████▊                 |  ETA: 0:00:08[KProgress:  59%|████████████████████████▁                |  ETA: 0:00:07[KProgress:  60%|████████████████████████▋                |  ETA: 0:00:07[KProgress:  61%|█████████████████████████                |  ETA: 0:00:07[KProgress:  62%|█████████████████████████▁               |  ETA: 0:00:07[KProgress:  63%|█████████████████████████▉               |  ETA: 0:00:07[KProgress:  64%|██████████████████████████▁              |  ETA: 0:00:06[KProgress:  65%|██████████████████████████▋              |  ETA: 0:00:06[KProgress:  66%|███████████████████████████              |  ETA: 0:00:06[KProgress:  67%|███████████████████████████▌             |  ETA: 0:00:06[KProgress:  68%|███████████████████████████▉             |  ETA: 0:00:06[KProgress:  70%|████████████████████████████▊            |  ETA: 0:00:05[KProgress:  72%|█████████████████████████████▌           |  ETA: 0:00:05[KProgress:  73%|█████████████████████████████▉           |  ETA: 0:00:05[KProgress:  74%|██████████████████████████████▁          |  ETA: 0:00:04[KProgress:  76%|███████████████████████████████▁         |  ETA: 0:00:04[KProgress:  78%|████████████████████████████████         |  ETA: 0:00:04[KProgress:  80%|████████████████████████████████▊        |  ETA: 0:00:03[KProgress:  81%|█████████████████████████████████▁       |  ETA: 0:00:03[KProgress:  82%|█████████████████████████████████▋       |  ETA: 0:00:03[KProgress:  83%|██████████████████████████████████       |  ETA: 0:00:03[KProgress:  84%|██████████████████████████████████▌      |  ETA: 0:00:03[KProgress:  86%|███████████████████████████████████▁     |  ETA: 0:00:02[KProgress:  87%|███████████████████████████████████▋     |  ETA: 0:00:02[KProgress:  89%|████████████████████████████████████▌    |  ETA: 0:00:02[KProgress:  91%|█████████████████████████████████████▁   |  ETA: 0:00:01[KProgress:  93%|██████████████████████████████████████▁  |  ETA: 0:00:01[KProgress:  95%|███████████████████████████████████████  |  ETA: 0:00:01[KProgress:  97%|███████████████████████████████████████▊ |  ETA: 0:00:00[KProgress:  99%|████████████████████████████████████████▋|  ETA: 0:00:00[KProgress: 100%|█████████████████████████████████████████| Time: 0:00:15[K
[ Info: Skipping slow RFF test
[ Info: Skipping slow RFF test
[ Info: Skipping slow RFF test
[ Info: Skipping slow RFF test
[ Info: Skipping slow RFF test
[ Info: Skipping slow RFF test
[ Info: Skipping slow RFF test
[ Info: Skipping slow RFF test
[ Info: Skipping slow RFF test
[ Info: Skipping slow RFF test
[ Info: Skipping slow RFF test
[ Info: Skipping slow RFF test
[ Info: Skipping slow RFF test
[ Info: Skipping slow RFF test
[ Info: Skipping slow RFF test
[ Info: Skipping slow RFF test
[ Info: Skipping slow RFF test
[ Info: Skipping slow RFF test
[ Info: Skipping slow RFF test
[ Info: Skipping slow RFF test
[ Info: Skipping slow RFF test
[ Info: Skipping slow RFF test
[ Info: Skipping slow RFF test
[ Info: Skipping slow RFF test
[ Info: Skipping slow RFF test
[ Info: Skipping slow RFF test
[ Info: Skipping slow RFF test
[ Info: Skipping slow RFF test
[ Info: Skipping slow RFF test
[ Info: Skipping slow RFF test
[ Info: Skipping slow RFF test
[ Info: Skipping slow RFF test
[ Info: Skipping slow RFF test
[ Info: Skipping slow RFF test
[ Info: Skipping slow RFF test
gp: Test Failed at /home/pkgeval/.julia/packages/SparseGaussianProcesses/emEpO/test/runtests.jl:183
  Expression: (abs.(mu_f .- mu_x) .< 0.025) |> all
Stacktrace:
 [1] top-level scope at /home/pkgeval/.julia/packages/SparseGaussianProcesses/emEpO/test/runtests.jl:183
 [2] top-level scope at /buildworker/worker/package_linux64/build/usr/share/julia/stdlib/v1.5/Test/src/Test.jl:1114
 [3] top-level scope at /home/pkgeval/.julia/packages/SparseGaussianProcesses/emEpO/test/runtests.jl:141
 [4] top-level scope at /buildworker/worker/package_linux64/build/usr/share/julia/stdlib/v1.5/Test/src/Test.jl:1114
 [5] top-level scope at /home/pkgeval/.julia/packages/SparseGaussianProcesses/emEpO/test/runtests.jl:13
od = 1
id = 1
var = 1.5
ls = (0.5,)
zd = 8
z = [-0.3492268684531274 -0.8016553316202342 0.11660420854141827 1.1002644298824358 -1.5917465437307226 0.48901759433993375 -0.568160689857933 -0.44458930180749767]
u = [-0.3421714463686715 -0.71850838819719 0.11634015245872661 0.891327273271081 -0.9997805522318611 0.4697588524108086 -0.5380826198008312 -0.43008714343920684]
1×128 Adjoint{Float64,Array{Float64,2}}:
 -0.367002  0.635908  -0.997474  0.15485  0.454165  0.786561  0.493833  -0.772919  -0.00391737  -0.901306  -0.262212  0.459205  0.149004  -0.784272  -0.593039  -0.0230173  0.870976  -0.409001  -0.291095  -0.961822  -0.00148745  -0.000799464  0.397112  0.259557  0.267178  -0.242116  0.0129034  -0.727215  -0.0223567  -0.0125043  -0.387852  -0.988704  -0.155837  -0.363984  -0.247716  -0.0524011  -0.606945  -1.0087  0.204821  0.869251  0.0298169  0.879165  0.300144  -0.87535  -0.899891  -0.00563756  0.890948  -0.0204223  -0.00251211  0.741106  -0.740011  0.894554  -0.0138716  0.190432  -1.00279  0.46708  -0.0134916  -0.996333  -0.652919  0.0207154  0.378127  0.864894  -0.7208  0.0282443  -0.407924  -0.295528  -0.75188  -0.0182516  0.342532  0.884917  -0.00413405  -0.278061  -0.0086106  0.810633  0.594163  -0.0142423  -0.279649  -0.00694495  0.00554309  -0.403036  0.0308155  -0.638762  0.741905  0.542583  0.889929  -0.00680189  0.766279  0.634238  0.0040512  0.479143  0.709451  0.543974  0.8465  -0.00881153  0.554473  0.865069  0.0419863  0.851185  0.00878958  -0.975556  0.10819  0.894654  -0.787978  -0.807722  0.0693054  -0.778336  0.337807  0.806919  0.802675  -0.00351041  0.0976623  -0.712769  -0.0244104  0.63395  -0.00963642  -1.0059  0.862185  0.323946  -0.00151179  0.759579  -0.170011  0.0505825  0.56023  0.698966  0.518028  0.307517  -0.587282  -0.886496

1×128 Adjoint{Float64,Array{Float64,1}}:
 -0.370202  0.634717  -0.993608  0.155474  0.453908  0.784754  0.493365  -0.773403  -5.30495e-5  -0.905309  -0.262339  0.472206  0.16745  -0.784476  -0.592311  0.000543767  0.872168  -0.408338  -0.293101  -0.956896  -4.16102e-11  -0.000472751  0.411331  0.260136  0.26774  -0.243281  0.0367951  -0.727819  0.00596575  2.65682e-5  -0.391352  -0.989388  -0.15614  -0.363573  -0.248979  -0.0524555  -0.606311  -1.00683  0.222285  0.870529  0.0523623  0.879922  0.316066  -0.87161  -0.895459  -0.00460739  0.889753  0.000258962  -1.58623e-18  0.739447  -0.740693  0.893955  -8.28697e-8  0.19108  -0.999348  0.466754  -1.08926e-6  -0.99642  -0.652705  0.0209496  0.378266  0.863162  -0.726682  0.0285082  -0.407266  -0.295505  -0.752574  0.000145474  0.342836  0.883489  5.96871e-12  -0.278121  4.28547e-6  0.814281  0.604118  4.70336e-5  -0.279702  4.33116e-9  0.00571644  -0.402404  0.0532934  -0.638402  0.747806  0.541859  0.889956  5.9408e-7  0.76453  0.633056  2.30067e-14  0.478752  0.71632  0.555128  0.844669  4.8933e-6  0.553687  0.866547  0.0423032  0.853278  0.00897601  -0.977032  0.108722  0.893906  -0.788062  -0.806985  0.0898469  -0.778703  0.338132  0.805071  0.800834  -5.68266e-14  0.0981661  -0.713239  0.00389967  0.642894  -0.00814611  -1.00484  0.860431  0.339469  3.82708e-27  0.757853  -0.17032  0.0719298  0.571005  0.697482  0.517432  0.30796  -0.58652  -0.88241

maximum(abs.(mu_f .- mu_x)) = 0.028322422450825818
Test Summary:           | Pass  Fail  Broken  Total
SparseGaussianProcesses |  139     1      35    175
  hyperprior            |    3                    3
  kernel                |   18                   18
  randomfeature         |   37            35     72
  inducing              |   44                   44
  gp                    |   26     1             27
  loss                  |   11                   11
  gpu                   |                     No tests
ERROR: LoadError: Some tests did not pass: 139 passed, 1 failed, 0 errored, 35 broken.
in expression starting at /home/pkgeval/.julia/packages/SparseGaussianProcesses/emEpO/test/runtests.jl:11
ERROR: Package SparseGaussianProcesses errored during testing
Stacktrace:
 [1] pkgerror(::String) at /buildworker/worker/package_linux64/build/usr/share/julia/stdlib/v1.5/Pkg/src/Types.jl:52
 [2] test(::Pkg.Types.Context, ::Array{Pkg.Types.PackageSpec,1}; coverage::Bool, julia_args::Cmd, test_args::Cmd, test_fn::Nothing) at /buildworker/worker/package_linux64/build/usr/share/julia/stdlib/v1.5/Pkg/src/Operations.jl:1557
 [3] test(::Pkg.Types.Context, ::Array{Pkg.Types.PackageSpec,1}; coverage::Bool, test_fn::Nothing, julia_args::Cmd, test_args::Cmd, kwargs::Base.Iterators.Pairs{Union{},Union{},Tuple{},NamedTuple{(),Tuple{}}}) at /buildworker/worker/package_linux64/build/usr/share/julia/stdlib/v1.5/Pkg/src/API.jl:327
 [4] test(::Pkg.Types.Context, ::Array{Pkg.Types.PackageSpec,1}) at /buildworker/worker/package_linux64/build/usr/share/julia/stdlib/v1.5/Pkg/src/API.jl:314
 [5] #test#61 at /buildworker/worker/package_linux64/build/usr/share/julia/stdlib/v1.5/Pkg/src/API.jl:67 [inlined]
 [6] test at /buildworker/worker/package_linux64/build/usr/share/julia/stdlib/v1.5/Pkg/src/API.jl:67 [inlined]
 [7] #test#60 at /buildworker/worker/package_linux64/build/usr/share/julia/stdlib/v1.5/Pkg/src/API.jl:66 [inlined]
 [8] test at /buildworker/worker/package_linux64/build/usr/share/julia/stdlib/v1.5/Pkg/src/API.jl:66 [inlined]
 [9] test(::String; kwargs::Base.Iterators.Pairs{Union{},Union{},Tuple{},NamedTuple{(),Tuple{}}}) at /buildworker/worker/package_linux64/build/usr/share/julia/stdlib/v1.5/Pkg/src/API.jl:65
 [10] test(::String) at /buildworker/worker/package_linux64/build/usr/share/julia/stdlib/v1.5/Pkg/src/API.jl:65
 [11] top-level scope at none:16
