Current time is 2020-10-25T20:16:43.039
Julia Version 1.5.3-pre.13
Commit 3de1115e9c (2020-10-23 21:58 UTC)
Platform Info:
  OS: Linux (x86_64-linux-gnu)
  CPU: AMD EPYC 7502 32-Core Processor
  WORD_SIZE: 64
  LIBM: libopenlibm
  LLVM: libLLVM-9.0.1 (ORCJIT, znver2)
Environment:
  JULIA_DEPOT_PATH = ::/usr/local/share/julia
  JULIA_NUM_THREADS = 2
  JULIA_MAX_NUM_PRECOMPILE_FILES = 9223372036854775807
  JULIA_PKG_SERVER = 

Starting installation at 2020-10-25T20:16:46.04
  Resolving package versions...
  Installed Rmath_jll ──────────────────── v0.2.2+1
  Installed PooledArrays ───────────────── v0.5.3
  Installed GroupedTemporalTerms ───────── v0.1.0
  Installed Compat ─────────────────────── v3.22.0
  Installed Parsers ────────────────────── v1.0.11
  Installed StatsFuns ──────────────────── v0.9.5
  Installed StructTypes ────────────────── v1.1.0
  Installed JLLWrappers ────────────────── v1.1.3
  Installed OpenSpecFun_jll ────────────── v0.5.3+4
  Installed SortingAlgorithms ──────────── v0.3.1
  Installed CompilerSupportLibraries_jll ─ v0.3.4+0
  Installed InvertedIndices ────────────── v1.0.0
  Installed Rmath ──────────────────────── v0.6.1
  Installed OrderedCollections ─────────── v1.3.1
  Installed SpecialFunctions ───────────── v0.10.3
  Installed DataFrames ─────────────────── v0.21.8
  Installed CategoricalArrays ──────────── v0.8.3
  Installed IteratorInterfaceExtensions ── v1.0.0
  Installed DataStructures ─────────────── v0.18.8
  Installed DataValueInterfaces ────────── v1.0.0
  Installed Tables ─────────────────────── v1.1.0
  Installed Reexport ───────────────────── v0.2.0
  Installed TableTraits ────────────────── v1.0.0
  Installed ShiftedArrays ──────────────── v1.0.0
  Installed StatsModels ────────────────── v0.6.15
  Installed Missings ───────────────────── v0.4.4
  Installed JSON ───────────────────────── v0.21.1
  Installed Underscores ────────────────── v2.0.0
  Installed Artifacts ──────────────────── v1.3.0
  Installed DataAPI ────────────────────── v1.3.0
  Installed StatsBase ──────────────────── v0.33.2
Updating `~/.julia/environments/v1.5/Project.toml`
  [e3df3e69] + GroupedTemporalTerms v0.1.0
Updating `~/.julia/environments/v1.5/Manifest.toml`
  [56f22d72] + Artifacts v1.3.0
  [324d7699] + CategoricalArrays v0.8.3
  [34da2185] + Compat v3.22.0
  [e66e0078] + CompilerSupportLibraries_jll v0.3.4+0
  [9a962f9c] + DataAPI v1.3.0
  [a93c6f00] + DataFrames v0.21.8
  [864edb3b] + DataStructures v0.18.8
  [e2d170a0] + DataValueInterfaces v1.0.0
  [e3df3e69] + GroupedTemporalTerms v0.1.0
  [41ab1584] + InvertedIndices v1.0.0
  [82899510] + IteratorInterfaceExtensions v1.0.0
  [692b3bcd] + JLLWrappers v1.1.3
  [682c06a0] + JSON v0.21.1
  [e1d29d7a] + Missings v0.4.4
  [efe28fd5] + OpenSpecFun_jll v0.5.3+4
  [bac558e1] + OrderedCollections v1.3.1
  [69de0a69] + Parsers v1.0.11
  [2dfb63ee] + PooledArrays v0.5.3
  [189a3867] + Reexport v0.2.0
  [79098fc4] + Rmath v0.6.1
  [f50d1b31] + Rmath_jll v0.2.2+1
  [1277b4bf] + ShiftedArrays v1.0.0
  [a2af1166] + SortingAlgorithms v0.3.1
  [276daf66] + SpecialFunctions v0.10.3
  [2913bbd2] + StatsBase v0.33.2
  [4c63d2b9] + StatsFuns v0.9.5
  [3eaba693] + StatsModels v0.6.15
  [856f2bd8] + StructTypes v1.1.0
  [3783bdb8] + TableTraits v1.0.0
  [bd369af6] + Tables v1.1.0
  [d9a01c3f] + Underscores v2.0.0
  [2a0f44e3] + Base64
  [ade2ca70] + Dates
  [8bb1440f] + DelimitedFiles
  [8ba89e20] + Distributed
  [9fa8497b] + Future
  [b77e0a4c] + InteractiveUtils
  [76f85450] + LibGit2
  [8f399da3] + Libdl
  [37e2e46d] + LinearAlgebra
  [56ddb016] + Logging
  [d6f4376e] + Markdown
  [a63ad114] + Mmap
  [44cfe95a] + Pkg
  [de0858da] + Printf
  [3fa0cd96] + REPL
  [9a3f8284] + Random
  [ea8e919c] + SHA
  [9e88b42a] + Serialization
  [1a1011a3] + SharedArrays
  [6462fe0b] + Sockets
  [2f01184e] + SparseArrays
  [10745b16] + Statistics
  [8dfed614] + Test
  [cf7118a7] + UUIDs
  [4ec0a83e] + Unicode
Starting tests at 2020-10-25T20:16:52.175
    Testing GroupedTemporalTerms
Status `/tmp/jl_TYCdK4/Project.toml`
  [a93c6f00] DataFrames v0.21.8
  [e3df3e69] GroupedTemporalTerms v0.1.0
  [1277b4bf] ShiftedArrays v1.0.0
  [3eaba693] StatsModels v0.6.15
  [d9a01c3f] Underscores v2.0.0
  [44cfe95a] Pkg
  [8dfed614] Test
Status `/tmp/jl_TYCdK4/Manifest.toml`
  [56f22d72] Artifacts v1.3.0
  [324d7699] CategoricalArrays v0.8.3
  [34da2185] Compat v3.22.0
  [e66e0078] CompilerSupportLibraries_jll v0.3.4+0
  [9a962f9c] DataAPI v1.3.0
  [a93c6f00] DataFrames v0.21.8
  [864edb3b] DataStructures v0.18.8
  [e2d170a0] DataValueInterfaces v1.0.0
  [e3df3e69] GroupedTemporalTerms v0.1.0
  [41ab1584] InvertedIndices v1.0.0
  [82899510] IteratorInterfaceExtensions v1.0.0
  [692b3bcd] JLLWrappers v1.1.3
  [682c06a0] JSON v0.21.1
  [e1d29d7a] Missings v0.4.4
  [efe28fd5] OpenSpecFun_jll v0.5.3+4
  [bac558e1] OrderedCollections v1.3.1
  [69de0a69] Parsers v1.0.11
  [2dfb63ee] PooledArrays v0.5.3
  [189a3867] Reexport v0.2.0
  [79098fc4] Rmath v0.6.1
  [f50d1b31] Rmath_jll v0.2.2+1
  [1277b4bf] ShiftedArrays v1.0.0
  [a2af1166] SortingAlgorithms v0.3.1
  [276daf66] SpecialFunctions v0.10.3
  [2913bbd2] StatsBase v0.33.2
  [4c63d2b9] StatsFuns v0.9.5
  [3eaba693] StatsModels v0.6.15
  [856f2bd8] StructTypes v1.1.0
  [3783bdb8] TableTraits v1.0.0
  [bd369af6] Tables v1.1.0
  [d9a01c3f] Underscores v2.0.0
  [2a0f44e3] Base64
  [ade2ca70] Dates
  [8bb1440f] DelimitedFiles
  [8ba89e20] Distributed
  [9fa8497b] Future
  [b77e0a4c] InteractiveUtils
  [76f85450] LibGit2
  [8f399da3] Libdl
  [37e2e46d] LinearAlgebra
  [56ddb016] Logging
  [d6f4376e] Markdown
  [a63ad114] Mmap
  [44cfe95a] Pkg
  [de0858da] Printf
  [3fa0cd96] REPL
  [9a3f8284] Random
  [ea8e919c] SHA
  [9e88b42a] Serialization
  [1a1011a3] SharedArrays
  [6462fe0b] Sockets
  [2f01184e] SparseArrays
  [10745b16] Statistics
  [8dfed614] Test
  [cf7118a7] UUIDs
  [4ec0a83e] Unicode
    Cloning git-repo `https://github.com/greimel/FixedEffectModels.jl`
[?25l    Fetching: [>                                        ]  0.0 %[2K[?25h   Updating git-repo `https://github.com/greimel/FixedEffectModels.jl`
[?25l[2K[?25h  Resolving package versions...
  Installed PDMats ──────── v0.10.1
  Installed Combinatorics ─ v1.0.2
  Installed FillArrays ──── v0.9.7
  Installed FixedEffects ── v0.7.4
  Installed QuadGK ──────── v2.4.1
  Installed Requires ────── v1.1.0
  Installed StaticArrays ── v0.12.4
  Installed Distributions ─ v0.24.1
Updating `/tmp/jl_TYCdK4/Project.toml`
  [9d5cd8c9] + FixedEffectModels v0.10.8 `https://github.com/greimel/FixedEffectModels.jl#missings`
Updating `/tmp/jl_TYCdK4/Manifest.toml`
  [861a8166] + Combinatorics v1.0.2
  [31c24e10] + Distributions v0.24.1
  [1a297f60] + FillArrays v0.9.7
  [9d5cd8c9] + FixedEffectModels v0.10.8 `https://github.com/greimel/FixedEffectModels.jl#missings`
  [c8885935] + FixedEffects v0.7.4
  [90014a1f] + PDMats v0.10.1
  [1fd47b50] + QuadGK v2.4.1
  [ae029012] + Requires v1.1.0
  [90137ffa] + StaticArrays v0.12.4
  [4607b0f0] + SuiteSparse
Test Summary:           | Pass  Total
GroupedTemporalTerms.jl |    2      2
    Testing GroupedTemporalTerms tests passed 
Finished at 2020-10-25T20:20:20.802
