Julia Version 1.4.0-DEV.660
Commit 27eb582279 (2019-12-23 19:29 UTC)
Platform Info:
  OS: Linux (x86_64-pc-linux-gnu)
  CPU: Intel(R) Xeon(R) Silver 4114 CPU @ 2.20GHz
  WORD_SIZE: 64
  LIBM: libopenlibm
  LLVM: libLLVM-8.0.1 (ORCJIT, skylake)
Environment:
  JULIA_DEPOT_PATH = ::/usr/local/share/julia

 Resolving package versions...
 Installed LoggingExtras ──────── v0.3.0
 Installed ProgressMeter ──────── v1.2.0
 Installed ProgressMeterLogging ─ v0.1.0
  Updating `~/.julia/environments/v1.4/Project.toml`
  [b0e84e9e] + ProgressMeterLogging v0.1.0
  Updating `~/.julia/environments/v1.4/Manifest.toml`
  [e6f89c97] + LoggingExtras v0.3.0
  [92933f4c] + ProgressMeter v1.2.0
  [b0e84e9e] + ProgressMeterLogging v0.1.0
  [8ba89e20] + Distributed 
  [56ddb016] + Logging 
  [de0858da] + Printf 
  [9a3f8284] + Random 
  [9e88b42a] + Serialization 
  [6462fe0b] + Sockets 
  [4ec0a83e] + Unicode 
   Testing ProgressMeterLogging
  Updating `/tmp/jl_X0QNON/Project.toml`
  [8dfed614] + Test 
  Updating `/tmp/jl_X0QNON/Manifest.toml`
  [2a0f44e3] + Base64 
  [b77e0a4c] + InteractiveUtils 
  [d6f4376e] + Markdown 
  [8dfed614] + Test 
Running sandbox
Status `/tmp/jl_X0QNON/Project.toml`
  [e6f89c97] LoggingExtras v0.3.0
  [92933f4c] ProgressMeter v1.2.0
  [b0e84e9e] ProgressMeterLogging v0.1.0
  [56ddb016] Logging 
  [8dfed614] Test 
outer:   0%|                                         |  ETA: N/A[K
outer:  10%|████▏                                    |  ETA: 0:00:00[Kouter:  20%|████████▎                                |  ETA: 0:00:00[Kouter:  30%|████████████▎                            |  ETA: 0:00:00[Kouter:  40%|████████████████▍                        |  ETA: 0:00:00[Kouter:  50%|████████████████████▌                    |  ETA: 0:00:00[Kouter:  60%|████████████████████████▋                |  ETA: 0:00:00[Kouter:  70%|████████████████████████████▊            |  ETA: 0:00:00[Kouter:  80%|████████████████████████████████▊        |  ETA: 0:00:00[Kouter:  90%|████████████████████████████████████▉    |  ETA: 0:00:00[Kouter: 100%|█████████████████████████████████████████| Time: 0:00:00[K
outer: 100%|█████████████████████████████████████████| Time: 0:00:00[K
outer:   0%|                                         |  ETA: N/A[K
inner:   0%|                                         |  ETA: N/A[K
inner:  10%|████▏                                    |  ETA: 0:00:00[Kinner:  10%|████▏                                    |  ETA: 0:00:00[Kinner:  10%|████▏                                    |  ETA: 0:00:00[Kinner:  10%|████▏                                    |  ETA: 0:00:00[Kinner:  10%|████▏                                    |  ETA: 0:00:00[Kinner:  10%|████▏                                    |  ETA: 0:00:00[Kinner:  10%|████▏                                    |  ETA: 0:00:00[Kinner:  10%|████▏                                    |  ETA: 0:00:00[Kinner:  10%|████▏                                    |  ETA: 0:00:00[Kinner:  10%|████▏                                    |  ETA: 0:00:00[Kinner:   0%|                                         |  ETA: 0:00:26[Kinner:  18%|███████▍                                 |  ETA: 0:00:00[Kinner:  35%|██████████████▍                          |  ETA: 0:00:00[Kinner:  52%|█████████████████████▌                   |  ETA: 0:00:00[Kinner:  70%|████████████████████████████▉            |  ETA: 0:00:00[Kinner:  89%|████████████████████████████████████▌    |  ETA: 0:00:00[Kinner: 100%|█████████████████████████████████████████| Time: 0:00:00[K
outer:  10%|████▏                                    |  ETA: 0:00:00[K
inner:   0%|                                         |  ETA: N/A[K
inner:  20%|████████▎                                |  ETA: 0:00:00[Kinner:  20%|████████▎                                |  ETA: 0:00:00[Kinner:  20%|████████▎                                |  ETA: 0:00:00[Kinner:  20%|████████▎                                |  ETA: 0:00:00[Kinner:  20%|████████▎                                |  ETA: 0:00:00[Kinner:  20%|████████▎                                |  ETA: 0:00:00[Kinner:  20%|████████▎                                |  ETA: 0:00:00[Kinner:  20%|████████▎                                |  ETA: 0:00:00[Kinner:  20%|████████▎                                |  ETA: 0:00:00[Kinner:  20%|████████▎                                |  ETA: 0:00:00[Kinner:   0%|                                         |  ETA: 0:00:22[Kinner:  18%|███████▍                                 |  ETA: 0:00:00[Kinner:  36%|███████████████                          |  ETA: 0:00:00[Kinner:  56%|██████████████████████▉                  |  ETA: 0:00:00[Kinner:  75%|██████████████████████████████▋          |  ETA: 0:00:00[Kinner:  93%|██████████████████████████████████████▏  |  ETA: 0:00:00[Kinner: 100%|█████████████████████████████████████████| Time: 0:00:00[K
outer:  20%|████████▎                                |  ETA: 0:00:00[K
inner:   0%|                                         |  ETA: N/A[K
inner:  30%|████████████▎                            |  ETA: 0:00:00[Kinner:  30%|████████████▎                            |  ETA: 0:00:00[Kinner:  30%|████████████▎                            |  ETA: 0:00:00[Kinner:  30%|████████████▎                            |  ETA: 0:00:00[Kinner:  30%|████████████▎                            |  ETA: 0:00:00[Kinner:  30%|████████████▎                            |  ETA: 0:00:00[Kinner:  30%|████████████▎                            |  ETA: 0:00:00[Kinner:  30%|████████████▎                            |  ETA: 0:00:00[Kinner:  30%|████████████▎                            |  ETA: 0:00:00[Kinner:  30%|████████████▎                            |  ETA: 0:00:00[Kinner:   0%|                                         |  ETA: 0:00:22[Kinner:  18%|███████▍                                 |  ETA: 0:00:00[Kinner:  36%|██████████████▋                          |  ETA: 0:00:00[Kinner:  53%|█████████████████████▊                   |  ETA: 0:00:00[Kinner:  71%|█████████████████████████████            |  ETA: 0:00:00[Kinner:  88%|████████████████████████████████████▎    |  ETA: 0:00:00[Kinner: 100%|█████████████████████████████████████████| Time: 0:00:00[K
outer:  30%|████████████▎                            |  ETA: 0:00:00[K
inner:   0%|                                         |  ETA: N/A[K
inner:  40%|████████████████▍                        |  ETA: 0:00:00[Kinner:  40%|████████████████▍                        |  ETA: 0:00:00[Kinner:  40%|████████████████▍                        |  ETA: 0:00:00[Kinner:  40%|████████████████▍                        |  ETA: 0:00:00[Kinner:  40%|████████████████▍                        |  ETA: 0:00:00[Kinner:  40%|████████████████▍                        |  ETA: 0:00:00[Kinner:  40%|████████████████▍                        |  ETA: 0:00:00[Kinner:  40%|████████████████▍                        |  ETA: 0:00:00[Kinner:  40%|████████████████▍                        |  ETA: 0:00:00[Kinner:  40%|████████████████▍                        |  ETA: 0:00:00[Kinner:   0%|                                         |  ETA: 0:00:22[Kinner:  16%|██████▋                                  |  ETA: 0:00:00[Kinner:  33%|█████████████▍                           |  ETA: 0:00:00[Kinner:  49%|████████████████████▏                    |  ETA: 0:00:00[Kinner:  66%|███████████████████████████              |  ETA: 0:00:00[Kinner:  82%|█████████████████████████████████▋       |  ETA: 0:00:00[Kinner:  99%|████████████████████████████████████████▋|  ETA: 0:00:00[Kinner: 100%|█████████████████████████████████████████| Time: 0:00:00[K
outer:  40%|████████████████▍                        |  ETA: 0:00:00[K
inner:   0%|                                         |  ETA: N/A[K
inner:  50%|████████████████████▌                    |  ETA: 0:00:00[Kinner:  50%|████████████████████▌                    |  ETA: 0:00:00[Kinner:  50%|████████████████████▌                    |  ETA: 0:00:00[Kinner:  50%|████████████████████▌                    |  ETA: 0:00:00[Kinner:  50%|████████████████████▌                    |  ETA: 0:00:00[Kinner:  50%|████████████████████▌                    |  ETA: 0:00:00[Kinner:  50%|████████████████████▌                    |  ETA: 0:00:00[Kinner:  50%|████████████████████▌                    |  ETA: 0:00:00[Kinner:  50%|████████████████████▌                    |  ETA: 0:00:00[Kinner:  50%|████████████████████▌                    |  ETA: 0:00:00[Kinner:   0%|                                         |  ETA: 0:00:29[Kinner:  20%|████████▏                                |  ETA: 0:00:00[Kinner:  39%|████████████████                         |  ETA: 0:00:00[Kinner:  53%|█████████████████████▋                   |  ETA: 0:00:00[Kinner:  72%|█████████████████████████████▋           |  ETA: 0:00:00[Kinner:  91%|█████████████████████████████████████▍   |  ETA: 0:00:00[Kinner: 100%|█████████████████████████████████████████| Time: 0:00:00[K
outer:  50%|████████████████████▌                    |  ETA: 0:00:00[K
inner:   0%|                                         |  ETA: N/A[K
inner:  60%|████████████████████████▋                |  ETA: 0:00:00[Kinner:  60%|████████████████████████▋                |  ETA: 0:00:00[Kinner:  60%|████████████████████████▋                |  ETA: 0:00:00[Kinner:  60%|████████████████████████▋                |  ETA: 0:00:00[Kinner:  60%|████████████████████████▋                |  ETA: 0:00:00[Kinner:  60%|████████████████████████▋                |  ETA: 0:00:00[Kinner:  60%|████████████████████████▋                |  ETA: 0:00:00[Kinner:  60%|████████████████████████▋                |  ETA: 0:00:00[Kinner:  60%|████████████████████████▋                |  ETA: 0:00:00[Kinner:  60%|████████████████████████▋                |  ETA: 0:00:00[Kinner:   0%|                                         |  ETA: 0:00:31[Kinner:  20%|████████▏                                |  ETA: 0:00:00[Kinner:  38%|███████████████▋                         |  ETA: 0:00:00[Kinner: 100%|█████████████████████████████████████████| Time: 0:00:00[K
outer:  60%|████████████████████████▋                |  ETA: 0:00:00[K
inner:   0%|                                         |  ETA: N/A[K
inner:  70%|████████████████████████████▊            |  ETA: 0:00:00[Kinner:  70%|████████████████████████████▊            |  ETA: 0:00:00[Kinner:  70%|████████████████████████████▊            |  ETA: 0:00:00[Kinner:  70%|████████████████████████████▊            |  ETA: 0:00:00[Kinner:  70%|████████████████████████████▊            |  ETA: 0:00:00[Kinner:  70%|████████████████████████████▊            |  ETA: 0:00:00[Kinner:  70%|████████████████████████████▊            |  ETA: 0:00:00[Kinner:  70%|████████████████████████████▊            |  ETA: 0:00:00[Kinner:  70%|████████████████████████████▊            |  ETA: 0:00:00[Kinner:  70%|████████████████████████████▊            |  ETA: 0:00:00[Kinner:   0%|                                         |  ETA: 0:00:22[Kinner:  22%|████████▉                                |  ETA: 0:00:00[Kinner:  41%|████████████████▋                        |  ETA: 0:00:00[Kinner:  60%|████████████████████████▌                |  ETA: 0:00:00[Kinner:  81%|█████████████████████████████████▏       |  ETA: 0:00:00[Kinner: 100%|█████████████████████████████████████████| Time: 0:00:00[K
outer:  70%|████████████████████████████▊            |  ETA: 0:00:00[K
inner:   0%|                                         |  ETA: N/A[K
inner:  80%|████████████████████████████████▊        |  ETA: 0:00:00[Kinner:  80%|████████████████████████████████▊        |  ETA: 0:00:00[Kinner:  80%|████████████████████████████████▊        |  ETA: 0:00:00[Kinner:  80%|████████████████████████████████▊        |  ETA: 0:00:00[Kinner:  80%|████████████████████████████████▊        |  ETA: 0:00:00[Kinner:  80%|████████████████████████████████▊        |  ETA: 0:00:00[Kinner:  80%|████████████████████████████████▊        |  ETA: 0:00:00[Kinner:  80%|████████████████████████████████▊        |  ETA: 0:00:00[Kinner:  80%|████████████████████████████████▊        |  ETA: 0:00:00[Kinner:  80%|████████████████████████████████▊        |  ETA: 0:00:00[Kinner:   0%|                                         |  ETA: 0:00:22[Kinner:  20%|████████▎                                |  ETA: 0:00:00[Kinner:  43%|█████████████████▌                       |  ETA: 0:00:00[Kinner:  62%|█████████████████████████▋               |  ETA: 0:00:00[Kinner:  81%|█████████████████████████████████▎       |  ETA: 0:00:00[Kinner: 100%|█████████████████████████████████████████| Time: 0:00:00[K
outer:  80%|████████████████████████████████▊        |  ETA: 0:00:00[K
inner:   0%|                                         |  ETA: N/A[K
inner:  90%|████████████████████████████████████▉    |  ETA: 0:00:00[Kinner:  90%|████████████████████████████████████▉    |  ETA: 0:00:00[Kinner:  90%|████████████████████████████████████▉    |  ETA: 0:00:00[Kinner:  90%|████████████████████████████████████▉    |  ETA: 0:00:00[Kinner:  90%|████████████████████████████████████▉    |  ETA: 0:00:00[Kinner:  90%|████████████████████████████████████▉    |  ETA: 0:00:00[Kinner:  90%|████████████████████████████████████▉    |  ETA: 0:00:00[Kinner:  90%|████████████████████████████████████▉    |  ETA: 0:00:00[Kinner:  90%|████████████████████████████████████▉    |  ETA: 0:00:00[Kinner:  90%|████████████████████████████████████▉    |  ETA: 0:00:00[Kinner:   0%|                                         |  ETA: 0:00:28[Kinner:  20%|████████▏                                |  ETA: 0:00:00[Kinner:  40%|████████████████▎                        |  ETA: 0:00:00[Kinner:  58%|███████████████████████▉                 |  ETA: 0:00:00[Kinner: 100%|█████████████████████████████████████████| Time: 0:00:00[K
outer:  90%|████████████████████████████████████▉    |  ETA: 0:00:00[K
inner:   0%|                                         |  ETA: N/A[K
inner: 100%|█████████████████████████████████████████| Time: 0:00:00[K
inner: 100%|█████████████████████████████████████████| Time: 0:00:00[K
inner: 100%|█████████████████████████████████████████| Time: 0:00:00[K
inner: 100%|█████████████████████████████████████████| Time: 0:00:00[K
inner: 100%|█████████████████████████████████████████| Time: 0:00:00[K
inner: 100%|█████████████████████████████████████████| Time: 0:00:00[K
inner: 100%|█████████████████████████████████████████| Time: 0:00:00[K
inner: 100%|█████████████████████████████████████████| Time: 0:00:00[K
inner: 100%|█████████████████████████████████████████| Time: 0:00:00[K
inner: 100%|█████████████████████████████████████████| Time: 0:00:00[K
inner:   0%|                                         |  ETA: 0:00:22[Kinner:  12%|█████                                    |  ETA: 0:00:00[Kinner:  32%|████████████▉                            |  ETA: 0:00:00[Kinner:  50%|████████████████████▍                    |  ETA: 0:00:00[Kinner:  68%|███████████████████████████▋             |  ETA: 0:00:00[Kinner:  85%|███████████████████████████████████      |  ETA: 0:00:00[Kinner: 100%|█████████████████████████████████████████| Time: 0:00:00[K
outer: 100%|█████████████████████████████████████████| Time: 0:00:00[K
outer:   0%|                                         |  ETA: 0:04:17[Kouter:  16%|██████▋                                  |  ETA: 0:00:01[Kouter:  41%|████████████████▉                        |  ETA: 0:00:00[Kouter:  92%|█████████████████████████████████████▉   |  ETA: 0:00:00[Kouter: 100%|█████████████████████████████████████████| Time: 0:00:00[K
Test Summary:       | Pass  Total
with_progresslogger |    2      2
outer:   0%|                                         |  ETA: 0:02:24[Kouter: 100%|█████████████████████████████████████████| Time: 0:00:00[K
inner:  50%|████████████████████▌                    |  ETA: 0:00:00[Kouter:  60%|████████████████████████▋                |  ETA: 0:00:00[Kinner:  90%|████████████████████████████████████▉    |  ETA: 0:00:00[Kinner: 100%|█████████████████████████████████████████| Time: 0:00:00[K
inner: 100%|█████████████████████████████████████████| Time: 0:00:00[K
inner: 100%|█████████████████████████████████████████| Time: 0:00:00[K
inner: 100%|█████████████████████████████████████████| Time: 0:00:00[K
inner: 100%|█████████████████████████████████████████| Time: 0:00:00[K
inner: 100%|█████████████████████████████████████████| Time: 0:00:00[K
inner: 100%|█████████████████████████████████████████| Time: 0:00:00[K
inner: 100%|█████████████████████████████████████████| Time: 0:00:00[K
inner: 100%|█████████████████████████████████████████| Time: 0:00:00[K
inner: 100%|█████████████████████████████████████████| Time: 0:00:00[K
outer: 100%|█████████████████████████████████████████| Time: 0:00:00[K
outer:   0%|                                         |  ETA: 0:04:09[KTest Summary:      | Pass  Total
(un)install_logger |    4      4
outer: 100%|█████████████████████████████████████████| Time: 0:00:00[K
   Testing ProgressMeterLogging tests passed 
