Julia Version 1.5.0-DEV.335
Commit 6f3c5ce0f5 (2020-02-24 18:44 UTC)
Platform Info:
  OS: Linux (x86_64-linux-gnu)
  CPU: Intel(R) Xeon(R) Silver 4114 CPU @ 2.20GHz
  WORD_SIZE: 64
  LIBM: libopenlibm
  LLVM: libLLVM-9.0.1 (ORCJIT, skylake)
Environment:
  JULIA_DEPOT_PATH = ::/usr/local/share/julia
  JULIA_NUM_THREADS = 2

  Resolving package versions...
  Installed LambdaFn ─────────── v0.3.0
  Installed MKL_jll ──────────── v2019.0.117+2
  Installed IntelOpenMP_jll ──── v2018.0.3+0
  Installed SignalOperators ──── v0.4.0
  Installed AbstractFFTs ─────── v0.5.0
  Installed SignalBase ───────── v0.1.1
  Installed FillArrays ───────── v0.8.5
  Installed FFTW ─────────────── v1.2.0
  Installed OpenSpecFun_jll ──── v0.5.3+1
  Installed RecipesBase ──────── v0.7.0
  Installed ConstructionBase ─── v1.0.0
  Installed Unitful ──────────── v0.18.0
  Installed SpecialFunctions ─── v0.10.0
  Installed OrderedCollections ─ v1.1.0
  Installed IterTools ────────── v1.3.0
  Installed Requires ─────────── v0.5.2
  Installed MetaArrays ───────── v0.2.7
  Installed PrettyPrinting ───── v0.2.0
  Installed Reexport ─────────── v0.2.0
  Installed MacroTools ───────── v0.5.4
  Installed Polynomials ──────── v0.6.0
  Installed DataStructures ───── v0.17.9
  Installed Compat ───────────── v2.2.0
  Installed FFTW_jll ─────────── v3.3.9+4
  Installed DSP ──────────────── v0.6.3
  Installed FileIO ───────────── v1.2.2
#=#=#                                                                         ###################################################################       94.4%######################################################################## 100.0%
#=#=#                                                                         ######################################################################## 100.0%
#=#=#                                                                         ################################################################          89.5%######################################################################## 100.0%
   Updating `~/.julia/environments/v1.5/Project.toml`
  [4d633899] + SignalOperators v0.4.0
   Updating `~/.julia/environments/v1.5/Manifest.toml`
  [621f4979] + AbstractFFTs v0.5.0
  [34da2185] + Compat v2.2.0
  [187b0558] + ConstructionBase v1.0.0
  [717857b8] + DSP v0.6.3
  [864edb3b] + DataStructures v0.17.9
  [7a1cc6ca] + FFTW v1.2.0
  [f5851436] + FFTW_jll v3.3.9+4
  [5789e2e9] + FileIO v1.2.2
  [1a297f60] + FillArrays v0.8.5
  [1d5cc7b8] + IntelOpenMP_jll v2018.0.3+0
  [c8e1da08] + IterTools v1.3.0
  [fcefd6c4] + LambdaFn v0.3.0
  [856f044c] + MKL_jll v2019.0.117+2
  [1914dd2f] + MacroTools v0.5.4
  [36b8f3f0] + MetaArrays v0.2.7
  [efe28fd5] + OpenSpecFun_jll v0.5.3+1
  [bac558e1] + OrderedCollections v1.1.0
  [f27b6e38] + Polynomials v0.6.0
  [54e16d92] + PrettyPrinting v0.2.0
  [3cdcf5f2] + RecipesBase v0.7.0
  [189a3867] + Reexport v0.2.0
  [ae029012] + Requires v0.5.2
  [00c44e92] + SignalBase v0.1.1
  [4d633899] + SignalOperators v0.4.0
  [276daf66] + SpecialFunctions v0.10.0
  [1986cc42] + Unitful v0.18.0
  [2a0f44e3] + Base64 
  [ade2ca70] + Dates 
  [8bb1440f] + DelimitedFiles 
  [8ba89e20] + Distributed 
  [b77e0a4c] + InteractiveUtils 
  [76f85450] + LibGit2 
  [8f399da3] + Libdl 
  [37e2e46d] + LinearAlgebra 
  [56ddb016] + Logging 
  [d6f4376e] + Markdown 
  [a63ad114] + Mmap 
  [44cfe95a] + Pkg 
  [de0858da] + Printf 
  [3fa0cd96] + REPL 
  [9a3f8284] + Random 
  [ea8e919c] + SHA 
  [9e88b42a] + Serialization 
  [1a1011a3] + SharedArrays 
  [6462fe0b] + Sockets 
  [2f01184e] + SparseArrays 
  [10745b16] + Statistics 
  [8dfed614] + Test 
  [cf7118a7] + UUIDs 
  [4ec0a83e] + Unicode 
   Building FFTW → `~/.julia/packages/FFTW/qqcBj/deps/build.log`
    Testing SignalOperators
Status `/tmp/jl_Fm0gU3/Manifest.toml`
  [621f4979] AbstractFFTs v0.5.0
  [39de3d68] AxisArrays v0.4.2
  [6e4b80f9] BenchmarkTools v0.5.0
  [34da2185] Compat v2.2.0
  [187b0558] ConstructionBase v1.0.0
  [717857b8] DSP v0.6.3
  [864edb3b] DataStructures v0.17.9
  [0703355e] DimensionalData v0.7.1
  [da5c29d0] EllipsisNotation v0.4.0
  [7a1cc6ca] FFTW v1.2.0
  [f5851436] FFTW_jll v3.3.9+4
  [5789e2e9] FileIO v1.2.2
  [1a297f60] FillArrays v0.8.5
  [53c48c17] FixedPointNumbers v0.8.0
  [1d5cc7b8] IntelOpenMP_jll v2018.0.3+0
  [8197267c] IntervalSets v0.4.0
  [c8e1da08] IterTools v1.3.0
  [682c06a0] JSON v0.21.0
  [fcefd6c4] LambdaFn v0.3.0
  [856f044c] MKL_jll v2019.0.117+2
  [1914dd2f] MacroTools v0.5.4
  [36b8f3f0] MetaArrays v0.2.7
  [efe28fd5] OpenSpecFun_jll v0.5.3+1
  [bac558e1] OrderedCollections v1.1.0
  [69de0a69] Parsers v0.3.11
  [f27b6e38] Polynomials v0.6.0
  [54e16d92] PrettyPrinting v0.2.0
  [92933f4c] ProgressMeter v1.2.0
  [b3c3ace0] RangeArrays v0.3.2
  [3cdcf5f2] RecipesBase v0.7.0
  [189a3867] Reexport v0.2.0
  [ae029012] Requires v0.5.2
  [00c44e92] SignalBase v0.1.1
  [4d633899] SignalOperators v0.4.0
  [276daf66] SpecialFunctions v0.10.0
  [1986cc42] Unitful v0.18.0
  [8149f6b0] WAV v1.0.3
  [2a0f44e3] Base64 
  [ade2ca70] Dates 
  [8bb1440f] DelimitedFiles 
  [8ba89e20] Distributed 
  [b77e0a4c] InteractiveUtils 
  [76f85450] LibGit2 
  [8f399da3] Libdl 
  [37e2e46d] LinearAlgebra 
  [56ddb016] Logging 
  [d6f4376e] Markdown 
  [a63ad114] Mmap 
  [44cfe95a] Pkg 
  [de0858da] Printf 
  [3fa0cd96] REPL 
  [9a3f8284] Random 
  [ea8e919c] SHA 
  [9e88b42a] Serialization 
  [1a1011a3] SharedArrays 
  [6462fe0b] Sockets 
  [2f01184e] SparseArrays 
  [10745b16] Statistics 
  [8dfed614] Test 
  [cf7118a7] UUIDs 
  [4ec0a83e] Unicode 
┌ Warning: `@get!(dict, key, default)` at /home/pkgeval/.julia/packages/Requires/9Jse8/src/require.jl:11 is deprecated, use `get!(()->default, dict, key)` instead.
│   caller = include(::Function, ::Module, ::String) at Base.jl:380
└ @ Base ./Base.jl:380
WARNING: Method definition permutedims(Tuple{#s16, Vararg{DimensionalData.AbstractDimension{T, G, M} where M where G where T, N}} where #s16<:(DimensionalData.AbstractDimension{T, G, M} where M where G where T) where N, Tuple{#s16, Vararg{DimensionalData.AbstractDimension{T, G, M} where M where G where T, N}} where #s16<:(DimensionalData.AbstractDimension{T, G, M} where M where G where T) where N) in module DimensionalData at /home/pkgeval/.julia/packages/DimensionalData/MI5jg/src/primitives.jl:25 overwritten at /home/pkgeval/.julia/packages/DimensionalData/MI5jg/src/primitives.jl:28.
  ** incremental compilation may be fatally broken for this module **

Running tests...  3%|█                                  |  ETA: 0:05:19[KRunning tests...  6%|██▁                                |  ETA: 0:04:37[KRunning tests...  9%|███▁                               |  ETA: 0:04:13[KRunning tests... 12%|████▎                              |  ETA: 0:04:11[KRunning tests... 15%|█████▎                             |  ETA: 0:03:16[KRunning tests... 18%|██████▁                            |  ETA: 0:03:04[KRunning tests... 21%|███████▁                           |  ETA: 0:02:52[KRunning tests... 24%|████████▌                          |  ETA: 0:03:14[KRunning tests... 27%|█████████▌                         |  ETA: 0:04:05[KRunning tests... 30%|██████████▋                        |  ETA: 0:04:20[KRunning tests... 33%|███████████▋                       |  ETA: 0:03:58[KRunning tests... 36%|████████████▊                      |  ETA: 0:03:57[KRunning tests... 39%|█████████████▊                     |  ETA: 0:04:22[KRunning tests... 42%|██████████████▉                    |  ETA: 0:05:24[KRunning tests... 45%|███████████████▉                   |  ETA: 0:04:59[KRunning tests... 48%|█████████████████                  |  ETA: 0:04:33[KRunning tests... 52%|██████████████████                 |  ETA: 0:04:13[KRunning tests... 55%|███████████████████▁               |  ETA: 0:03:46[KRunning tests... 58%|████████████████████▁              |  ETA: 0:03:28[KRunning tests... 61%|█████████████████████▎             |  ETA: 0:03:23[KRunning tests... 64%|██████████████████████▎            |  ETA: 0:03:01[KRunning tests... 67%|███████████████████████▁           |  ETA: 0:02:39[KRunning tests... 70%|████████████████████████▁          |  ETA: 0:02:28[KRunning tests... 73%|█████████████████████████▌         |  ETA: 0:02:13[KRunning tests... 76%|██████████████████████████▌        |  ETA: 0:02:07[KRunning tests... 79%|███████████████████████████▋       |  ETA: 0:01:59[KRunning tests... 82%|████████████████████████████▋      |  ETA: 0:01:49[KRunning tests... 85%|█████████████████████████████▊     |  ETA: 0:01:32[KRunning tests... 88%|██████████████████████████████▊    |  ETA: 0:01:26[KRunning tests... 91%|███████████████████████████████▉   |  ETA: 0:01:11[KRunning tests... 94%|████████████████████████████████▉  |  ETA: 0:00:46[K Activating new environment at `~/.julia/packages/SignalOperators/VmWyE/test/jl_7wwlho/Project.toml`
  Resolving package versions...
  Installed TreeViews ───────── v0.3.0
  Installed LibSndFile ──────── v2.2.0
  Installed libsndfile_jll ──── v1.0.28+0
  Installed libvorbis_jll ───── v1.3.6+2
  Installed IntervalSets ────── v0.3.2
  Installed FLAC_jll ────────── v1.3.3+1
  Installed FixedPointNumbers ─ v0.6.1
  Installed Unitful ─────────── v0.17.0
  Installed Ogg_jll ─────────── v1.3.3+0
  Installed SampledSignals ──── v2.1.0
#=#=#                                                                         ######################################################################## 100.0%
#=#=#                                                                         ######################################################################## 100.0%
#=#=#                                                                         #####################################                                     51.7%######################################################################## 100.0%
#=#=#                                                                         ######################################################################## 100.0%
   Updating `~/.julia/packages/SignalOperators/VmWyE/test/jl_7wwlho/Project.toml`
  [b13ce0c6] + LibSndFile v2.2.0
   Updating `~/.julia/packages/SignalOperators/VmWyE/test/jl_7wwlho/Manifest.toml`
  [621f4979] + AbstractFFTs v0.5.0
  [34da2185] + Compat v2.2.0
  [717857b8] + DSP v0.6.3
  [7a1cc6ca] + FFTW v1.2.0
  [f5851436] + FFTW_jll v3.3.9+4
  [1d38b3a6] + FLAC_jll v1.3.3+1
  [5789e2e9] + FileIO v1.2.2
  [53c48c17] + FixedPointNumbers v0.6.1
  [1d5cc7b8] + IntelOpenMP_jll v2018.0.3+0
  [8197267c] + IntervalSets v0.3.2
  [c8e1da08] + IterTools v1.3.0
  [b13ce0c6] + LibSndFile v2.2.0
  [856f044c] + MKL_jll v2019.0.117+2
  [e7412a2a] + Ogg_jll v1.3.3+0
  [efe28fd5] + OpenSpecFun_jll v0.5.3+1
  [f27b6e38] + Polynomials v0.6.0
  [3cdcf5f2] + RecipesBase v0.7.0
  [189a3867] + Reexport v0.2.0
  [bd7594eb] + SampledSignals v2.1.0
  [276daf66] + SpecialFunctions v0.10.0
  [a2a6695c] + TreeViews v0.3.0
  [1986cc42] + Unitful v0.17.0
  [5bf562c0] + libsndfile_jll v1.0.28+0
  [f27f6e37] + libvorbis_jll v1.3.6+2
  [2a0f44e3] + Base64 
  [ade2ca70] + Dates 
  [8bb1440f] + DelimitedFiles 
  [8ba89e20] + Distributed 
  [b77e0a4c] + InteractiveUtils 
  [76f85450] + LibGit2 
  [8f399da3] + Libdl 
  [37e2e46d] + LinearAlgebra 
  [56ddb016] + Logging 
  [d6f4376e] + Markdown 
  [a63ad114] + Mmap 
  [44cfe95a] + Pkg 
  [de0858da] + Printf 
  [3fa0cd96] + REPL 
  [9a3f8284] + Random 
  [ea8e919c] + SHA 
  [9e88b42a] + Serialization 
  [1a1011a3] + SharedArrays 
  [6462fe0b] + Sockets 
  [2f01184e] + SparseArrays 
  [10745b16] + Statistics 
  [8dfed614] + Test 
  [cf7118a7] + UUIDs 
  [4ec0a83e] + Unicode 
  Resolving package versions...
   Updating `~/.julia/packages/SignalOperators/VmWyE/test/jl_7wwlho/Project.toml`
  [bd7594eb] + SampledSignals v2.1.0
   Updating `~/.julia/packages/SignalOperators/VmWyE/test/jl_7wwlho/Manifest.toml`
 [no changes]
[ Info: Loading LibSndFile backend for SignalOperators.
Running tests... 97%|██████████████████████████████████ |  ETA: 0:00:25[KRunning tests...100%|███████████████████████████████████| Time: 0:13:32[K
Test Summary:      | Pass  Total
SignalOperators.jl |  483    483
    Testing SignalOperators tests passed 
