Julia Version 1.6.0-DEV.968
Commit 0805aef9a9* (2020-09-18 09:12 UTC)
Platform Info:
  OS: Linux (x86_64-linux-gnu)
  CPU: Intel(R) Xeon(R) Silver 4114 CPU @ 2.20GHz
  WORD_SIZE: 64
  LIBM: libopenlibm
  LLVM: libLLVM-9.0.1 (ORCJIT, skylake-avx512)
Environment:
  JULIA_DEPOT_PATH = ::/usr/local/share/julia
  JULIA_NUM_THREADS = 2

  Resolving package versions...
  Installed DefineSingletons ──────────── v0.1.0
  Installed Compat ────────────────────── v3.16.0
  Installed JuliaVariables ────────────── v0.2.3
  Installed Requires ──────────────────── v1.0.3
  Installed Setfield ──────────────────── v0.7.0
  Installed FLoops ────────────────────── v0.1.4
  Installed Transducers ───────────────── v0.4.51
  Installed MLStyle ───────────────────── v0.4.6
  Installed CompositionsBase ──────────── v0.1.0
  Installed ArgCheck ──────────────────── v2.1.0
  Installed TableTraits ───────────────── v1.0.0
  Installed IteratorInterfaceExtensions ─ v1.0.0
  Installed DataValueInterfaces ───────── v1.0.0
  Installed NameResolution ────────────── v0.1.5
  Installed InitialValues ─────────────── v0.2.10
  Installed Tables ────────────────────── v1.0.5
  Installed DataAPI ───────────────────── v1.3.0
  Installed SplittablesBase ───────────── v0.1.10
  Installed FLoopsBase ────────────────── v0.1.0
  Installed ZygoteRules ───────────────── v0.2.0
  Installed ContextVariablesX ─────────── v0.1.0
  Installed PrettyPrint ───────────────── v0.2.0
  Installed ConstructionBase ──────────── v1.0.0
  Installed MacroTools ────────────────── v0.5.5
  Installed BangBang ──────────────────── v0.3.29
Updating `~/.julia/environments/v1.6/Project.toml`
  [cc61a311] + FLoops v0.1.4
Updating `~/.julia/environments/v1.6/Manifest.toml`
  [dce04be8] + ArgCheck v2.1.0
  [198e06fe] + BangBang v0.3.29
  [34da2185] + Compat v3.16.0
  [a33af91c] + CompositionsBase v0.1.0
  [187b0558] + ConstructionBase v1.0.0
  [6add18c4] + ContextVariablesX v0.1.0
  [9a962f9c] + DataAPI v1.3.0
  [e2d170a0] + DataValueInterfaces v1.0.0
  [244e2a9f] + DefineSingletons v0.1.0
  [cc61a311] + FLoops v0.1.4
  [b9860ae5] + FLoopsBase v0.1.0
  [22cec73e] + InitialValues v0.2.10
  [82899510] + IteratorInterfaceExtensions v1.0.0
  [b14d175d] + JuliaVariables v0.2.3
  [d8e11817] + MLStyle v0.4.6
  [1914dd2f] + MacroTools v0.5.5
  [71a1bf82] + NameResolution v0.1.5
  [8162dcfd] + PrettyPrint v0.2.0
  [ae029012] + Requires v1.0.3
  [efcf1570] + Setfield v0.7.0
  [171d559e] + SplittablesBase v0.1.10
  [3783bdb8] + TableTraits v1.0.0
  [bd369af6] + Tables v1.0.5
  [28d57a85] + Transducers v0.4.51
  [700de1a5] + ZygoteRules v0.2.0
  [56f22d72] + Artifacts
  [2a0f44e3] + Base64
  [ade2ca70] + Dates
  [8bb1440f] + DelimitedFiles
  [8ba89e20] + Distributed
  [9fa8497b] + Future
  [b77e0a4c] + InteractiveUtils
  [76f85450] + LibGit2
  [8f399da3] + Libdl
  [37e2e46d] + LinearAlgebra
  [56ddb016] + Logging
  [d6f4376e] + Markdown
  [a63ad114] + Mmap
  [44cfe95a] + Pkg
  [de0858da] + Printf
  [3fa0cd96] + REPL
  [9a3f8284] + Random
  [ea8e919c] + SHA
  [9e88b42a] + Serialization
  [1a1011a3] + SharedArrays
  [6462fe0b] + Sockets
  [2f01184e] + SparseArrays
  [10745b16] + Statistics
  [fa267f1f] + TOML
  [8dfed614] + Test
  [cf7118a7] + UUIDs
  [4ec0a83e] + Unicode
    Testing FLoops
Status `/tmp/jl_tOuGZC/Project.toml`
  [198e06fe] BangBang v0.3.29
  [34da2185] Compat v3.16.0
  [e30172f5] Documenter v0.25.2
  [cc61a311] FLoops v0.1.4
  [b9860ae5] FLoopsBase v0.1.0
  [b14d175d] JuliaVariables v0.2.3
  [d77d25b0] LiterateTest v0.1.4
  [d8e11817] MLStyle v0.4.6
  [128add7d] MicroCollections v0.1.0
  [efcf1570] Setfield v0.7.0
  [28d57a85] Transducers v0.4.51
  [8dfed614] Test
Status `/tmp/jl_tOuGZC/Manifest.toml`
  [dce04be8] ArgCheck v2.1.0
  [198e06fe] BangBang v0.3.29
  [34da2185] Compat v3.16.0
  [a33af91c] CompositionsBase v0.1.0
  [187b0558] ConstructionBase v1.0.0
  [6add18c4] ContextVariablesX v0.1.0
  [9a962f9c] DataAPI v1.3.0
  [e2d170a0] DataValueInterfaces v1.0.0
  [244e2a9f] DefineSingletons v0.1.0
  [ffbed154] DocStringExtensions v0.8.3
  [e30172f5] Documenter v0.25.2
  [cc61a311] FLoops v0.1.4
  [b9860ae5] FLoopsBase v0.1.0
  [22cec73e] InitialValues v0.2.10
  [82899510] IteratorInterfaceExtensions v1.0.0
  [682c06a0] JSON v0.21.1
  [b14d175d] JuliaVariables v0.2.3
  [d77d25b0] LiterateTest v0.1.4
  [d8e11817] MLStyle v0.4.6
  [1914dd2f] MacroTools v0.5.5
  [128add7d] MicroCollections v0.1.0
  [71a1bf82] NameResolution v0.1.5
  [69de0a69] Parsers v1.0.10
  [8162dcfd] PrettyPrint v0.2.0
  [ae029012] Requires v1.0.3
  [efcf1570] Setfield v0.7.0
  [171d559e] SplittablesBase v0.1.10
  [3783bdb8] TableTraits v1.0.0
  [bd369af6] Tables v1.0.5
  [28d57a85] Transducers v0.4.51
  [700de1a5] ZygoteRules v0.2.0
  [56f22d72] Artifacts
  [2a0f44e3] Base64
  [ade2ca70] Dates
  [8bb1440f] DelimitedFiles
  [8ba89e20] Distributed
  [9fa8497b] Future
  [b77e0a4c] InteractiveUtils
  [76f85450] LibGit2
  [8f399da3] Libdl
  [37e2e46d] LinearAlgebra
  [56ddb016] Logging
  [d6f4376e] Markdown
  [a63ad114] Mmap
  [44cfe95a] Pkg
  [de0858da] Printf
  [3fa0cd96] REPL
  [9a3f8284] Random
  [ea8e919c] SHA
  [9e88b42a] Serialization
  [1a1011a3] SharedArrays
  [6462fe0b] Sockets
  [2f01184e] SparseArrays
  [10745b16] Statistics
  [fa267f1f] TOML
  [8dfed614] Test
  [cf7118a7] UUIDs
  [4ec0a83e] Unicode
    Testing Running tests...
Test Summary:      | Pass  Total
test_checkboxes.jl |   10     10
Test Summary: | Pass  Total
test_core.jl  |   20     20
[ Info: SetupBuildDirectory: setting up build directory.
[ Info: Doctest: running doctests.
[ Info: Skipped ExpandTemplates step (doctest only).
[ Info: Skipped CrossReferences step (doctest only).
[ Info: Skipped CheckDocument step (doctest only).
[ Info: Skipped Populate step (doctest only).
[ Info: Skipped RenderDocument step (doctest only).
Test Summary:   | Pass  Total
test_doctest.jl |    1      1
Test Summary:    | Pass  Total
test_examples.jl |    5      5
Test Summary:          | Pass  Total
test_executor_types.jl |    9      9
Test Summary:     | Pass  Total
test_executors.jl |  288    288
Test Summary:  | Pass  Total
test_reduce.jl |   12     12
Test Summary: | Pass  Total
test_simd.jl  |    8      8
    Testing FLoops tests passed 
