Current time is 2020-10-27T05:04:54.502
Julia Version 1.6.0-DEV.1331
Commit bac321d949 (2020-10-25 22:53 UTC)
Platform Info:
  OS: Linux (x86_64-pc-linux-gnu)
  CPU: AMD EPYC 7502 32-Core Processor
  WORD_SIZE: 64
  LIBM: libopenlibm
  LLVM: libLLVM-11.0.0 (ORCJIT, znver2)
Environment:
  JULIA_DEPOT_PATH = ::/usr/local/share/julia
  JULIA_NUM_THREADS = 2
  JULIA_MAX_NUM_PRECOMPILE_FILES = 9223372036854775807
  JULIA_PKG_SERVER = 

Starting installation at 2020-10-27T05:04:55.782
   Resolving package versions...
   Installed OpenSpecFun_jll ────────────── v0.5.3+4
   Installed DiffRules ──────────────────── v1.0.1
   Installed CommonSubexpressions ───────── v0.3.0
   Installed ForwardDiff ────────────────── v0.10.12
   Installed RootSolvers ────────────────── v0.2.0
   Installed DocStringExtensions ────────── v0.8.3
   Installed CompilerSupportLibraries_jll ─ v0.3.4+0
   Installed DiffResults ────────────────── v1.0.2
   Installed SpecialFunctions ───────────── v0.10.3
     Cloning [692b3bcd-3c85-4b1f-b108-f13ce0eb3210] JLLWrappers from https://github.com/JuliaPackaging/JLLWrappers.jl.git
[?25l    Fetching: [>                                        ]  0.0 %[2K[?25h   Installed JLLWrappers ────────────────── v1.1.3
     Cloning [77ba4419-2d1f-58cd-9bb1-8ffee604a2e3] NaNMath from https://github.com/mlubin/NaNMath.jl.git
[?25l    Fetching: [>                                        ]  0.0 %[2K[?25h   Installed NaNMath ────────────────────── v0.3.4
     Cloning [90137ffa-7385-5640-81b9-e52037218182] StaticArrays from https://github.com/JuliaArrays/StaticArrays.jl.git
[?25l    Fetching: [>                                        ]  0.0 %[2K[?25h   Installed StaticArrays ───────────────── v0.12.4
     Cloning [1914dd2f-81c6-5fcd-8719-6d5c9610ff09] MacroTools from https://github.com/FluxML/MacroTools.jl.git
[?25l    Fetching: [>                                        ]  0.0 %[2K[?25h   Installed MacroTools ─────────────────── v0.5.6
Updating `~/.julia/environments/v1.6/Project.toml`
  [7181ea78] + RootSolvers v0.2.0
Updating `~/.julia/environments/v1.6/Manifest.toml`
  [bbf7d656] + CommonSubexpressions v0.3.0
  [163ba53b] + DiffResults v1.0.2
  [b552c78f] + DiffRules v1.0.1
  [ffbed154] + DocStringExtensions v0.8.3
  [f6369f11] + ForwardDiff v0.10.12
  [692b3bcd] + JLLWrappers v1.1.3
  [1914dd2f] + MacroTools v0.5.6
  [77ba4419] + NaNMath v0.3.4
  [7181ea78] + RootSolvers v0.2.0
  [276daf66] + SpecialFunctions v0.10.3
  [90137ffa] + StaticArrays v0.12.4
  [e66e0078] + CompilerSupportLibraries_jll v0.3.4+0
  [efe28fd5] + OpenSpecFun_jll v0.5.3+4
  [0dad84c5] + ArgTools
  [56f22d72] + Artifacts
  [2a0f44e3] + Base64
  [ade2ca70] + Dates
  [f43a241f] + Downloads
  [b77e0a4c] + InteractiveUtils
  [b27032c2] + LibCURL
  [76f85450] + LibGit2
  [8f399da3] + Libdl
  [37e2e46d] + LinearAlgebra
  [56ddb016] + Logging
  [d6f4376e] + Markdown
  [44cfe95a] + Pkg
  [de0858da] + Printf
  [3fa0cd96] + REPL
  [9a3f8284] + Random
  [ea8e919c] + SHA
  [9e88b42a] + Serialization
  [6462fe0b] + Sockets
  [2f01184e] + SparseArrays
  [10745b16] + Statistics
  [fa267f1f] + TOML
  [8dfed614] + Test
  [cf7118a7] + UUIDs
  [4ec0a83e] + Unicode
  [deac9b47] + LibCURL_jll
  [14a3606d] + MozillaCACerts_jll
Precompiling project... (tip: to disable auto-precompilation set ENV["JULIA_PKG_PRECOMPILE_AUTO"]=0)
[32m  ✓ [39m[90mNaNMath[39m
[32m  ✓ [39m[90mJLLWrappers[39m
[32m  ✓ [39m[90mDocStringExtensions[39m
[32m  ✓ [39m[90mCompilerSupportLibraries_jll[39m
[32m  ✓ [39m[90mMacroTools[39m
[32m  ✓ [39m[90mOpenSpecFun_jll[39m
[32m  ✓ [39m[90mCommonSubexpressions[39m
[32m  ✓ [39m[90mStaticArrays[39m
[32m  ✓ [39m[90mSpecialFunctions[39m
[32m  ✓ [39m[90mDiffRules[39m
[32m  ✓ [39m[90mDiffResults[39m
[32m  ✓ [39m[90mForwardDiff[39m
[32m  ✓ [39mRootSolvers
13 dependencies successfully precompiled
Starting tests at 2020-10-27T05:07:24.780
     Testing RootSolvers
Status `/tmp/jl_kyyuoY/Project.toml`
  [ffbed154] DocStringExtensions v0.8.3
  [f6369f11] ForwardDiff v0.10.12
  [7181ea78] RootSolvers v0.2.0
  [8dfed614] Test
Status `/tmp/jl_kyyuoY/Manifest.toml`
  [bbf7d656] CommonSubexpressions v0.3.0
  [163ba53b] DiffResults v1.0.2
  [b552c78f] DiffRules v1.0.1
  [ffbed154] DocStringExtensions v0.8.3
  [f6369f11] ForwardDiff v0.10.12
  [692b3bcd] JLLWrappers v1.1.3
  [1914dd2f] MacroTools v0.5.6
  [77ba4419] NaNMath v0.3.4
  [7181ea78] RootSolvers v0.2.0
  [276daf66] SpecialFunctions v0.10.3
  [90137ffa] StaticArrays v0.12.4
  [e66e0078] CompilerSupportLibraries_jll v0.3.4+0
  [efe28fd5] OpenSpecFun_jll v0.5.3+4
  [0dad84c5] ArgTools
  [56f22d72] Artifacts
  [2a0f44e3] Base64
  [ade2ca70] Dates
  [f43a241f] Downloads
  [b77e0a4c] InteractiveUtils
  [b27032c2] LibCURL
  [76f85450] LibGit2
  [8f399da3] Libdl
  [37e2e46d] LinearAlgebra
  [56ddb016] Logging
  [d6f4376e] Markdown
  [44cfe95a] Pkg
  [de0858da] Printf
  [3fa0cd96] REPL
  [9a3f8284] Random
  [ea8e919c] SHA
  [9e88b42a] Serialization
  [6462fe0b] Sockets
  [2f01184e] SparseArrays
  [10745b16] Statistics
  [fa267f1f] TOML
  [8dfed614] Test
  [cf7118a7] UUIDs
  [4ec0a83e] Unicode
  [deac9b47] LibCURL_jll
  [14a3606d] MozillaCACerts_jll
     Testing Running tests...
Test Summary:                                 | Pass  Total
Scalar correctness test with compact solution |   96     96
Test Summary: | Pass  Total
CPU Broadcast |   24     24
Test Summary:        | Pass  Total
CPU isbits Broadcast |   32     32
Test Summary:                                      | Pass  Total
RootSolvers - compact solution non-converged cases |   48     48
Test Summary:                              | Pass  Total
RootSolvers - verbose solution correctness |   48     48
     Testing RootSolvers tests passed 
Finished at 2020-10-27T05:07:42.150
