Julia Version 1.5.0-DEV.719
Commit 5a71af311a (2020-04-29 17:39 UTC)
Platform Info:
  OS: Linux (x86_64-linux-gnu)
  CPU: Intel(R) Xeon(R) Silver 4114 CPU @ 2.20GHz
  WORD_SIZE: 64
  LIBM: libopenlibm
  LLVM: libLLVM-9.0.1 (ORCJIT, skylake)
Environment:
  JULIA_DEPOT_PATH = ::/usr/local/share/julia
  JULIA_NUM_THREADS = 2

  Resolving package versions...
  Installed OpenBLAS_jll ───────────────── v0.3.9+2
  Installed SweepOperator ──────────────── v0.3.0
  Installed Compat ─────────────────────── v3.9.0
  Installed Arpack ─────────────────────── v0.4.0
  Installed StatsFuns ──────────────────── v0.9.4
  Installed FillArrays ─────────────────── v0.8.8
  Installed StatsBase ──────────────────── v0.33.0
  Installed Pathogen ───────────────────── v0.4.12
  Installed OpenSpecFun_jll ────────────── v0.5.3+3
  Installed Arpack_jll ─────────────────── v3.5.0+3
  Installed IteratorInterfaceExtensions ── v1.0.0
  Installed OnlineStatsBase ────────────── v1.3.0
  Installed SpecialFunctions ───────────── v0.10.0
  Installed DataStructures ─────────────── v0.17.15
  Installed JSON ───────────────────────── v0.21.0
  Installed DataFrames ─────────────────── v0.20.2
  Installed PDMats ─────────────────────── v0.9.12
  Installed Rmath_jll ──────────────────── v0.2.2+0
  Installed CompilerSupportLibraries_jll ─ v0.3.3+0
  Installed Distributions ──────────────── v0.23.2
  Installed PenaltyFunctions ───────────── v0.2.2
  Installed Parsers ────────────────────── v1.0.2
  Installed QuadGK ─────────────────────── v2.3.1
  Installed AbstractTrees ──────────────── v0.3.3
  Installed InvertedIndices ────────────── v1.0.0
  Installed Rmath ──────────────────────── v0.6.1
  Installed LearnBase ──────────────────── v0.3.0
  Installed Tables ─────────────────────── v1.0.4
  Installed LossFunctions ──────────────── v0.6.0
  Installed SortingAlgorithms ──────────── v0.3.1
  Installed ProgressMeter ──────────────── v1.2.0
  Installed PooledArrays ───────────────── v0.5.3
  Installed CategoricalArrays ──────────── v0.7.7
  Installed TableTraits ────────────────── v1.0.0
  Installed OrderedCollections ─────────── v1.1.0
  Installed RecipesBase ────────────────── v1.0.1
  Installed DataValueInterfaces ────────── v1.0.0
  Installed DataAPI ────────────────────── v1.3.0
  Installed Missings ───────────────────── v0.4.3
  Installed Reexport ───────────────────── v0.2.0
  Installed OnlineStats ────────────────── v1.3.1
Updating `~/.julia/environments/v1.5/Project.toml`
  [c8189ad9] + Pathogen v0.4.12
Updating `~/.julia/environments/v1.5/Manifest.toml`
  [1520ce14] + AbstractTrees v0.3.3
  [7d9fca2a] + Arpack v0.4.0
  [68821587] + Arpack_jll v3.5.0+3
  [324d7699] + CategoricalArrays v0.7.7
  [34da2185] + Compat v3.9.0
  [e66e0078] + CompilerSupportLibraries_jll v0.3.3+0
  [9a962f9c] + DataAPI v1.3.0
  [a93c6f00] + DataFrames v0.20.2
  [864edb3b] + DataStructures v0.17.15
  [e2d170a0] + DataValueInterfaces v1.0.0
  [31c24e10] + Distributions v0.23.2
  [1a297f60] + FillArrays v0.8.8
  [41ab1584] + InvertedIndices v1.0.0
  [82899510] + IteratorInterfaceExtensions v1.0.0
  [682c06a0] + JSON v0.21.0
  [7f8f8fb0] + LearnBase v0.3.0
  [30fc2ffe] + LossFunctions v0.6.0
  [e1d29d7a] + Missings v0.4.3
  [a15396b6] + OnlineStats v1.3.1
  [925886fa] + OnlineStatsBase v1.3.0
  [4536629a] + OpenBLAS_jll v0.3.9+2
  [efe28fd5] + OpenSpecFun_jll v0.5.3+3
  [bac558e1] + OrderedCollections v1.1.0
  [90014a1f] + PDMats v0.9.12
  [69de0a69] + Parsers v1.0.2
  [c8189ad9] + Pathogen v0.4.12
  [06bb1623] + PenaltyFunctions v0.2.2
  [2dfb63ee] + PooledArrays v0.5.3
  [92933f4c] + ProgressMeter v1.2.0
  [1fd47b50] + QuadGK v2.3.1
  [3cdcf5f2] + RecipesBase v1.0.1
  [189a3867] + Reexport v0.2.0
  [79098fc4] + Rmath v0.6.1
  [f50d1b31] + Rmath_jll v0.2.2+0
  [a2af1166] + SortingAlgorithms v0.3.1
  [276daf66] + SpecialFunctions v0.10.0
  [2913bbd2] + StatsBase v0.33.0
  [4c63d2b9] + StatsFuns v0.9.4
  [7522ee7d] + SweepOperator v0.3.0
  [3783bdb8] + TableTraits v1.0.0
  [bd369af6] + Tables v1.0.4
  [2a0f44e3] + Base64
  [ade2ca70] + Dates
  [8bb1440f] + DelimitedFiles
  [8ba89e20] + Distributed
  [9fa8497b] + Future
  [b77e0a4c] + InteractiveUtils
  [76f85450] + LibGit2
  [8f399da3] + Libdl
  [37e2e46d] + LinearAlgebra
  [56ddb016] + Logging
  [d6f4376e] + Markdown
  [a63ad114] + Mmap
  [44cfe95a] + Pkg
  [de0858da] + Printf
  [3fa0cd96] + REPL
  [9a3f8284] + Random
  [ea8e919c] + SHA
  [9e88b42a] + Serialization
  [1a1011a3] + SharedArrays
  [6462fe0b] + Sockets
  [2f01184e] + SparseArrays
  [10745b16] + Statistics
  [4607b0f0] + SuiteSparse
  [8dfed614] + Test
  [cf7118a7] + UUIDs
  [4ec0a83e] + Unicode
    Testing Pathogen
Status `/tmp/jl_m5YkTX/Project.toml`
  [a93c6f00] DataFrames v0.20.2
  [b4f34e82] Distances v0.8.2
  [31c24e10] Distributions v0.23.2
  [a15396b6] OnlineStats v1.3.1
  [c8189ad9] Pathogen v0.4.12
  [92933f4c] ProgressMeter v1.2.0
  [3cdcf5f2] RecipesBase v1.0.1
  [2913bbd2] StatsBase v0.33.0
  [8ba89e20] Distributed
  [37e2e46d] LinearAlgebra
  [56ddb016] Logging
  [9a3f8284] Random
  [10745b16] Statistics
  [8dfed614] Test
Status `/tmp/jl_m5YkTX/Manifest.toml`
  [1520ce14] AbstractTrees v0.3.3
  [7d9fca2a] Arpack v0.4.0
  [68821587] Arpack_jll v3.5.0+3
  [324d7699] CategoricalArrays v0.7.7
  [34da2185] Compat v3.9.0
  [e66e0078] CompilerSupportLibraries_jll v0.3.3+0
  [9a962f9c] DataAPI v1.3.0
  [a93c6f00] DataFrames v0.20.2
  [864edb3b] DataStructures v0.17.15
  [e2d170a0] DataValueInterfaces v1.0.0
  [b4f34e82] Distances v0.8.2
  [31c24e10] Distributions v0.23.2
  [1a297f60] FillArrays v0.8.8
  [41ab1584] InvertedIndices v1.0.0
  [82899510] IteratorInterfaceExtensions v1.0.0
  [682c06a0] JSON v0.21.0
  [7f8f8fb0] LearnBase v0.3.0
  [30fc2ffe] LossFunctions v0.6.0
  [e1d29d7a] Missings v0.4.3
  [a15396b6] OnlineStats v1.3.1
  [925886fa] OnlineStatsBase v1.3.0
  [4536629a] OpenBLAS_jll v0.3.9+2
  [efe28fd5] OpenSpecFun_jll v0.5.3+3
  [bac558e1] OrderedCollections v1.1.0
  [90014a1f] PDMats v0.9.12
  [69de0a69] Parsers v1.0.2
  [c8189ad9] Pathogen v0.4.12
  [06bb1623] PenaltyFunctions v0.2.2
  [2dfb63ee] PooledArrays v0.5.3
  [92933f4c] ProgressMeter v1.2.0
  [1fd47b50] QuadGK v2.3.1
  [3cdcf5f2] RecipesBase v1.0.1
  [189a3867] Reexport v0.2.0
  [79098fc4] Rmath v0.6.1
  [f50d1b31] Rmath_jll v0.2.2+0
  [a2af1166] SortingAlgorithms v0.3.1
  [276daf66] SpecialFunctions v0.10.0
  [2913bbd2] StatsBase v0.33.0
  [4c63d2b9] StatsFuns v0.9.4
  [7522ee7d] SweepOperator v0.3.0
  [3783bdb8] TableTraits v1.0.0
  [bd369af6] Tables v1.0.4
  [2a0f44e3] Base64
  [ade2ca70] Dates
  [8bb1440f] DelimitedFiles
  [8ba89e20] Distributed
  [9fa8497b] Future
  [b77e0a4c] InteractiveUtils
  [76f85450] LibGit2
  [8f399da3] Libdl
  [37e2e46d] LinearAlgebra
  [56ddb016] Logging
  [d6f4376e] Markdown
  [a63ad114] Mmap
  [44cfe95a] Pkg
  [de0858da] Printf
  [3fa0cd96] REPL
  [9a3f8284] Random
  [ea8e919c] SHA
  [9e88b42a] Serialization
  [1a1011a3] SharedArrays
  [6462fe0b] Sockets
  [2f01184e] SparseArrays
  [10745b16] Statistics
  [4607b0f0] SuiteSparse
  [8dfed614] Test
  [cf7118a7] UUIDs
  [4ec0a83e] Unicode
Initialization progress  0%|▏                           |  ETA: 2:39:13[KInitialization progress 38%|██████████▊                 |  ETA: 0:00:52[KInitialization progress 57%|███████████████▉            |  ETA: 0:00:25[KInitialization progress 72%|████████████████████▎       |  ETA: 0:00:12[KInitialization progress 81%|██████████████████████▋     |  ETA: 0:00:08[KInitialization progress 89%|████████████████████████▉   |  ETA: 0:00:04[KInitialization progress 97%|███████████████████████████▏|  ETA: 0:00:01[KInitialization progress 97%|███████████████████████████▏|  ETA: 0:00:01[KInitialization progress100%|████████████████████████████| Time: 0:00:33[K
MCMC progress  0%|▏                                     |  ETA: 1:56:47[KMCMC progress  5%|█▉                                    |  ETA: 0:07:27[KMCMC progress  9%|███▌                                  |  ETA: 0:03:50[KMCMC progress 15%|█████▊                                |  ETA: 0:02:15[KMCMC progress 20%|███████▊                              |  ETA: 0:01:33[KMCMC progress 22%|████████▌                             |  ETA: 0:01:23[KMCMC progress 25%|█████████▋                            |  ETA: 0:01:11[KMCMC progress 32%|████████████▏                         |  ETA: 0:00:51[KMCMC progress 36%|█████████████▌                        |  ETA: 0:00:44[KMCMC progress 41%|███████████████▋                      |  ETA: 0:00:35[KMCMC progress 47%|█████████████████▉                    |  ETA: 0:00:28[KMCMC progress 54%|████████████████████▌                 |  ETA: 0:00:21[KMCMC progress 61%|███████████████████████▏              |  ETA: 0:00:16[KMCMC progress 69%|██████████████████████████▏           |  ETA: 0:00:11[KMCMC progress 73%|███████████████████████████▊          |  ETA: 0:00:09[KMCMC progress 78%|█████████████████████████████▊        |  ETA: 0:00:07[KMCMC progress 84%|███████████████████████████████▉      |  ETA: 0:00:05[KMCMC progress 88%|█████████████████████████████████▍    |  ETA: 0:00:04[KMCMC progress 90%|██████████████████████████████████▏   |  ETA: 0:00:03[KMCMC progress 92%|██████████████████████████████████▉   |  ETA: 0:00:02[KMCMC progress 95%|████████████████████████████████████  |  ETA: 0:00:02[KMCMC progress 97%|█████████████████████████████████████ |  ETA: 0:00:01[KMCMC progress100%|██████████████████████████████████████| Time: 0:00:30[K
Initialization progress  2%|▌                           |  ETA: 0:04:32[KInitialization progress100%|████████████████████████████| Time: 0:00:05[K
MCMC progress  1%|▍                                     |  ETA: 0:03:16[KMCMC progress 23%|████████▊                             |  ETA: 0:00:07[KMCMC progress 55%|████████████████████▉                 |  ETA: 0:00:02[KMCMC progress 87%|█████████████████████████████████     |  ETA: 0:00:00[KMCMC progress100%|██████████████████████████████████████| Time: 0:00:02[K
Test Summary: | Pass  Total
SEIR Model    |   83     83
Initialization progress  0%|▏                           |  ETA: 0:54:02[KInitialization progress 23%|██████▌                     |  ETA: 0:00:37[KInitialization progress 37%|██████████▍                 |  ETA: 0:00:19[KInitialization progress 48%|█████████████▌              |  ETA: 0:00:12[KInitialization progress 64%|█████████████████▉          |  ETA: 0:00:06[KInitialization progress 76%|█████████████████████▎      |  ETA: 0:00:04[KInitialization progress 89%|████████████████████████▉   |  ETA: 0:00:01[KInitialization progress 92%|█████████████████████████▋  |  ETA: 0:00:01[KInitialization progress 97%|███████████████████████████▏|  ETA: 0:00:00[KInitialization progress 97%|███████████████████████████▏|  ETA: 0:00:00[KInitialization progress100%|████████████████████████████| Time: 0:00:12[K
MCMC progress  0%|▏                                     |  ETA: 0:52:24[KMCMC progress  5%|██                                    |  ETA: 0:03:09[KMCMC progress 12%|████▋                                 |  ETA: 0:01:16[KMCMC progress 19%|███████▎                              |  ETA: 0:00:46[KMCMC progress 23%|████████▋                             |  ETA: 0:00:37[KMCMC progress 25%|█████████▌                            |  ETA: 0:00:33[KMCMC progress 30%|███████████▌                          |  ETA: 0:00:26[KMCMC progress 34%|█████████████                         |  ETA: 0:00:22[KMCMC progress 39%|██████████████▊                       |  ETA: 0:00:18[KMCMC progress 44%|████████████████▉                     |  ETA: 0:00:15[KMCMC progress 50%|███████████████████                   |  ETA: 0:00:12[KMCMC progress 55%|████████████████████▉                 |  ETA: 0:00:10[KMCMC progress 60%|██████████████████████▋               |  ETA: 0:00:08[KMCMC progress 66%|█████████████████████████             |  ETA: 0:00:06[KMCMC progress 72%|███████████████████████████▎          |  ETA: 0:00:05[KMCMC progress 79%|█████████████████████████████▉        |  ETA: 0:00:03[KMCMC progress 88%|█████████████████████████████████▌    |  ETA: 0:00:02[KMCMC progress 95%|████████████████████████████████████  |  ETA: 0:00:01[KMCMC progress 97%|█████████████████████████████████████ |  ETA: 0:00:00[KMCMC progress100%|██████████████████████████████████████| Time: 0:00:13[K
Initialization progress  4%|█▏                          |  ETA: 0:00:53[KInitialization progress100%|████████████████████████████| Time: 0:00:02[K
MCMC progress  1%|▍                                     |  ETA: 0:00:16[KMCMC progress 11%|████▏                                 |  ETA: 0:00:02[KMCMC progress 58%|██████████████████████                |  ETA: 0:00:00[KMCMC progress 96%|████████████████████████████████████▌ |  ETA: 0:00:00[KMCMC progress100%|██████████████████████████████████████| Time: 0:00:00[K
Test Summary: | Pass  Total
SEI Model     |  165    165
Initialization progress  0%|▏                           |  ETA: 1:05:29[KInitialization progress  5%|█▍                          |  ETA: 0:04:12[KInitialization progress 13%|███▊                        |  ETA: 0:01:27[KInitialization progress 24%|██████▋                     |  ETA: 0:00:43[KInitialization progress 34%|█████████▋                  |  ETA: 0:00:26[KInitialization progress 55%|███████████████▌            |  ETA: 0:00:11[KInitialization progress 73%|████████████████████▌       |  ETA: 0:00:05[KInitialization progress 84%|███████████████████████▌    |  ETA: 0:00:03[KInitialization progress 91%|█████████████████████████▌  |  ETA: 0:00:01[KInitialization progress 97%|███████████████████████████▏|  ETA: 0:00:00[KInitialization progress100%|████████████████████████████| Time: 0:00:14[K
MCMC progress  0%|▏                                     |  ETA: 0:50:02[KMCMC progress  7%|██▌                                   |  ETA: 0:02:22[KMCMC progress 13%|█████                                 |  ETA: 0:01:09[KMCMC progress 20%|███████▌                              |  ETA: 0:00:43[KMCMC progress 26%|█████████▊                            |  ETA: 0:00:31[KMCMC progress 27%|██████████▎                           |  ETA: 0:00:29[KMCMC progress 31%|███████████▊                          |  ETA: 0:00:24[KMCMC progress 38%|██████████████▍                       |  ETA: 0:00:18[KMCMC progress 42%|███████████████▉                      |  ETA: 0:00:16[KMCMC progress 49%|██████████████████▊                   |  ETA: 0:00:12[KMCMC progress 55%|████████████████████▉                 |  ETA: 0:00:09[KMCMC progress 59%|██████████████████████▍               |  ETA: 0:00:08[KMCMC progress 65%|████████████████████████▊             |  ETA: 0:00:06[KMCMC progress 68%|█████████████████████████▊            |  ETA: 0:00:06[KMCMC progress 73%|███████████████████████████▉          |  ETA: 0:00:04[KMCMC progress 77%|█████████████████████████████▍        |  ETA: 0:00:03[KMCMC progress 82%|███████████████████████████████       |  ETA: 0:00:03[KMCMC progress 85%|████████████████████████████████▎     |  ETA: 0:00:02[KMCMC progress 86%|████████████████████████████████▌     |  ETA: 0:00:02[KMCMC progress 90%|██████████████████████████████████▏   |  ETA: 0:00:01[KMCMC progress 91%|██████████████████████████████████▊   |  ETA: 0:00:01[KMCMC progress 93%|███████████████████████████████████▌  |  ETA: 0:00:01[KMCMC progress 97%|█████████████████████████████████████ |  ETA: 0:00:00[KMCMC progress100%|██████████████████████████████████████| Time: 0:00:13[K
Initialization progress  4%|█▏                          |  ETA: 0:00:58[KInitialization progress100%|████████████████████████████| Time: 0:00:02[K
MCMC progress  1%|▍                                     |  ETA: 0:00:15[KMCMC progress 40%|███████████████▎                      |  ETA: 0:00:00[KMCMC progress 60%|██████████████████████▊               |  ETA: 0:00:00[KMCMC progress100%|██████████████████████████████████████| Time: 0:00:00[K
Test Summary: | Pass  Total
SIR Model     |  171    171
Initialization progress  0%|▏                           |  ETA: 0:58:50[KInitialization progress 14%|███▉                        |  ETA: 0:01:15[KInitialization progress 35%|█████████▉                  |  ETA: 0:00:22[KInitialization progress 52%|██████████████▌             |  ETA: 0:00:11[KInitialization progress 61%|█████████████████▏          |  ETA: 0:00:08[KInitialization progress 69%|███████████████████▍        |  ETA: 0:00:06[KInitialization progress 82%|███████████████████████     |  ETA: 0:00:03[KInitialization progress 89%|█████████████████████████   |  ETA: 0:00:02[KInitialization progress 96%|███████████████████████████ |  ETA: 0:00:00[KInitialization progress100%|████████████████████████████| Time: 0:00:12[K
MCMC progress  0%|▏                                     |  ETA: 0:44:46[KMCMC progress  6%|██▍                                   |  ETA: 0:02:14[KMCMC progress 15%|█████▊                                |  ETA: 0:00:52[KMCMC progress 22%|████████▌                             |  ETA: 0:00:33[KMCMC progress 28%|██████████▊                           |  ETA: 0:00:24[KMCMC progress 37%|██████████████▏                       |  ETA: 0:00:16[KMCMC progress 45%|█████████████████▎                    |  ETA: 0:00:12[KMCMC progress 52%|███████████████████▊                  |  ETA: 0:00:09[KMCMC progress 63%|████████████████████████▏             |  ETA: 0:00:06[KMCMC progress 73%|███████████████████████████▋          |  ETA: 0:00:04[KMCMC progress 81%|██████████████████████████████▉       |  ETA: 0:00:02[KMCMC progress 87%|█████████████████████████████████▏    |  ETA: 0:00:01[KMCMC progress 94%|███████████████████████████████████▉  |  ETA: 0:00:01[KMCMC progress 97%|█████████████████████████████████████ |  ETA: 0:00:00[KMCMC progress100%|██████████████████████████████████████| Time: 0:00:10[K
Initialization progress  4%|█▏                          |  ETA: 0:00:57[KInitialization progress100%|████████████████████████████| Time: 0:00:02[K
MCMC progress  1%|▍                                     |  ETA: 0:00:18[KMCMC progress 39%|██████████████▉                       |  ETA: 0:00:00[KMCMC progress100%|██████████████████████████████████████| Time: 0:00:00[K
Test Summary: | Pass  Total
SI Model      |  106    106
    Testing Pathogen tests passed 
