Julia Version 1.5.0-DEV.462
Commit b0619303e4 (2020-03-15 15:46 UTC)
Platform Info:
  OS: Linux (x86_64-pc-linux-gnu)
  CPU: Intel(R) Xeon(R) Silver 4114 CPU @ 2.20GHz
  WORD_SIZE: 64
  LIBM: libopenlibm
  LLVM: libLLVM-9.0.1 (ORCJIT, skylake)
Environment:
  JULIA_DEPOT_PATH = ::/usr/local/share/julia
  JULIA_NUM_THREADS = 2

  Resolving package versions...
  Installed SortingAlgorithms ──────────── v0.3.1
  Installed ProgressMeter ──────────────── v1.2.0
  Installed Compat ─────────────────────── v3.8.0
  Installed QuadGK ─────────────────────── v2.3.1
  Installed Syslogs ────────────────────── v0.3.0
  Installed JLSO ───────────────────────── v2.1.0
  Installed DataStructures ─────────────── v0.17.10
  Installed MLJBase ────────────────────── v0.12.1
  Installed FixedPointNumbers ──────────── v0.7.1
  Installed IniFile ────────────────────── v0.5.0
  Installed BinaryProvider ─────────────── v0.5.8
  Installed OpenSpecFun_jll ────────────── v0.5.3+3
  Installed ScientificTypes ────────────── v0.7.2
  Installed Reexport ───────────────────── v0.2.0
  Installed Parameters ─────────────────── v0.12.0
  Installed MLJModelInterface ──────────── v0.2.0
  Installed CategoricalArrays ──────────── v0.7.7
  Installed StatsFuns ──────────────────── v0.9.4
  Installed OpenBLAS_jll ───────────────── v0.3.7+7
  Installed TableTraits ────────────────── v1.0.0
  Installed MbedTLS_jll ────────────────── v2.16.0+1
  Installed Parsers ────────────────────── v0.3.12
  Installed RecipesBase ────────────────── v0.8.0
  Installed Tables ─────────────────────── v1.0.3
  Installed HTTP ───────────────────────── v0.8.12
  Installed DataValueInterfaces ────────── v1.0.0
  Installed Arpack ─────────────────────── v0.4.0
  Installed OrderedCollections ─────────── v1.1.0
  Installed TranscodingStreams ─────────── v0.9.5
  Installed Arpack_jll ─────────────────── v3.5.0+2
  Installed Rmath ──────────────────────── v0.6.1
  Installed JSON ───────────────────────── v0.21.0
  Installed SpecialFunctions ───────────── v0.10.0
  Installed Libiconv_jll ───────────────── v1.16.0+1
  Installed InvertedIndices ────────────── v1.0.0
  Installed Missings ───────────────────── v0.4.3
  Installed Crayons ────────────────────── v4.0.1
  Installed XML2_jll ───────────────────── v2.9.9+1
  Installed IteratorInterfaceExtensions ── v1.0.0
  Installed ExprTools ──────────────────── v0.1.0
  Installed ComputationalResources ─────── v0.3.1
  Installed PrettyTables ───────────────── v0.8.4
  Installed Distributions ──────────────── v0.22.5
  Installed LearnBase ──────────────────── v0.2.2
  Installed Mocking ────────────────────── v0.7.1
  Installed FillArrays ─────────────────── v0.8.5
  Installed MbedTLS ────────────────────── v1.0.1
  Installed Rmath_jll ──────────────────── v0.2.2+0
  Installed StatsBase ──────────────────── v0.32.2
  Installed LossFunctions ──────────────── v0.5.1
  Installed TimeZones ──────────────────── v1.0.1
  Installed CodecZlib ──────────────────── v0.6.0
  Installed Memento ────────────────────── v0.12.1
  Installed CompilerSupportLibraries_jll ─ v0.2.0+1
  Installed Zlib_jll ───────────────────── v1.2.11+8
  Installed DataAPI ────────────────────── v1.1.0
  Installed Formatting ─────────────────── v0.4.1
  Installed EzXML ──────────────────────── v1.1.0
  Installed ColorTypes ─────────────────── v0.9.1
  Installed MLJScientificTypes ─────────── v0.2.1
  Installed PDMats ─────────────────────── v0.9.12
  Installed BSON ───────────────────────── v0.2.5
#=#=#                                                                         ######################################################################## 100.0%
#=#=#                                                                         ##                                                                         3.0%#####                                                                      7.8%##########                                                                14.1%###############                                                           21.1%#####################                                                     30.1%#############################                                             41.1%########################################                                  55.7%####################################################                      73.4%######################################################################    98.3%######################################################################## 100.0%
#=#=#                                                                         #######################                                                   33.0%######################################################################## 100.0%
#=#=#                                                                         ######################################################################## 100.0%
#=#=#                                                                         ############################################################              84.4%######################################################################## 100.0%
#=#=#                                                                         ##########                                                                14.1%#####################################                                     52.1%######################################################################## 100.0%
#=#=#                                                                         ######################################################################## 100.0%
#=#=#                                                                         ######################################################################## 100.0%
#=#=#                                                                         ####                                                                       6.1%###############                                                           22.0%############################                                              40.3%##################################################                        69.7%######################################################################## 100.0%
   Updating `~/.julia/environments/v1.5/Project.toml`
   a7f614a8 + MLJBase v0.12.1
   Updating `~/.julia/environments/v1.5/Manifest.toml`
   7d9fca2a + Arpack v0.4.0
   68821587 + Arpack_jll v3.5.0+2
   fbb218c0 + BSON v0.2.5
   b99e7846 + BinaryProvider v0.5.8
   324d7699 + CategoricalArrays v0.7.7
   944b1d66 + CodecZlib v0.6.0
   3da002f7 + ColorTypes v0.9.1
   34da2185 + Compat v3.8.0
   e66e0078 + CompilerSupportLibraries_jll v0.2.0+1
   ed09eef8 + ComputationalResources v0.3.1
   a8cc5b0e + Crayons v4.0.1
   9a962f9c + DataAPI v1.1.0
   864edb3b + DataStructures v0.17.10
   e2d170a0 + DataValueInterfaces v1.0.0
   31c24e10 + Distributions v0.22.5
   e2ba6199 + ExprTools v0.1.0
   8f5d6c58 + EzXML v1.1.0
   1a297f60 + FillArrays v0.8.5
   53c48c17 + FixedPointNumbers v0.7.1
   59287772 + Formatting v0.4.1
   cd3eb016 + HTTP v0.8.12
   83e8ac13 + IniFile v0.5.0
   41ab1584 + InvertedIndices v1.0.0
   82899510 + IteratorInterfaceExtensions v1.0.0
   9da8a3cd + JLSO v2.1.0
   682c06a0 + JSON v0.21.0
   7f8f8fb0 + LearnBase v0.2.2
   94ce4f54 + Libiconv_jll v1.16.0+1
   30fc2ffe + LossFunctions v0.5.1
   a7f614a8 + MLJBase v0.12.1
   e80e1ace + MLJModelInterface v0.2.0
   2e2323e0 + MLJScientificTypes v0.2.1
   739be429 + MbedTLS v1.0.1
   c8ffd9c3 + MbedTLS_jll v2.16.0+1
   f28f55f0 + Memento v0.12.1
   e1d29d7a + Missings v0.4.3
   78c3b35d + Mocking v0.7.1
   4536629a + OpenBLAS_jll v0.3.7+7
   efe28fd5 + OpenSpecFun_jll v0.5.3+3
   bac558e1 + OrderedCollections v1.1.0
   90014a1f + PDMats v0.9.12
   d96e819e + Parameters v0.12.0
   69de0a69 + Parsers v0.3.12
   08abe8d2 + PrettyTables v0.8.4
   92933f4c + ProgressMeter v1.2.0
   1fd47b50 + QuadGK v2.3.1
   3cdcf5f2 + RecipesBase v0.8.0
   189a3867 + Reexport v0.2.0
   79098fc4 + Rmath v0.6.1
   f50d1b31 + Rmath_jll v0.2.2+0
   321657f4 + ScientificTypes v0.7.2
   a2af1166 + SortingAlgorithms v0.3.1
   276daf66 + SpecialFunctions v0.10.0
   2913bbd2 + StatsBase v0.32.2
   4c63d2b9 + StatsFuns v0.9.4
   cea106d9 + Syslogs v0.3.0
   3783bdb8 + TableTraits v1.0.0
   bd369af6 + Tables v1.0.3
   f269a46b + TimeZones v1.0.1
   3bb67fe8 + TranscodingStreams v0.9.5
   02c8fc9c + XML2_jll v2.9.9+1
   83775a58 + Zlib_jll v1.2.11+8
   2a0f44e3 + Base64
   ade2ca70 + Dates
   8bb1440f + DelimitedFiles
   8ba89e20 + Distributed
   9fa8497b + Future
   b77e0a4c + InteractiveUtils
   76f85450 + LibGit2
   8f399da3 + Libdl
   37e2e46d + LinearAlgebra
   56ddb016 + Logging
   d6f4376e + Markdown
   a63ad114 + Mmap
   44cfe95a + Pkg
   de0858da + Printf
   3fa0cd96 + REPL
   9a3f8284 + Random
   ea8e919c + SHA
   9e88b42a + Serialization
   1a1011a3 + SharedArrays
   6462fe0b + Sockets
   2f01184e + SparseArrays
   10745b16 + Statistics
   4607b0f0 + SuiteSparse
   8dfed614 + Test
   cf7118a7 + UUIDs
   4ec0a83e + Unicode
   Building TimeZones → `~/.julia/packages/TimeZones/zymSN/deps/build.log`
   Building CodecZlib → `~/.julia/packages/CodecZlib/5t9zO/deps/build.log`
    Testing MLJBase
     Status `/tmp/jl_gYP1Cg/Project.toml`
   336ed68f CSV v0.5.26
   324d7699 CategoricalArrays v0.7.7
   ed09eef8 ComputationalResources v0.3.1
   a93c6f00 DataFrames v0.20.2
   7806a523 DecisionTree v0.10.1
   b4f34e82 Distances v0.8.2
   31c24e10 Distributions v0.22.5
   cd3eb016 HTTP v0.8.12
   41ab1584 InvertedIndices v1.0.0
   9da8a3cd JLSO v2.1.0
   682c06a0 JSON v0.21.0
   30fc2ffe LossFunctions v0.5.1
   a7f614a8 MLJBase v0.12.1
   e80e1ace MLJModelInterface v0.2.0
   2e2323e0 MLJScientificTypes v0.2.1
   e1d29d7a Missings v0.4.3
   6f286f6a MultivariateStats v0.7.0
   b8a86587 NearestNeighbors v0.4.4
   bac558e1 OrderedCollections v1.1.0
   d96e819e Parameters v0.12.0
   08abe8d2 PrettyTables v0.8.4
   92933f4c ProgressMeter v1.2.0
   321657f4 ScientificTypes v0.7.2
   2913bbd2 StatsBase v0.32.2
   bd369af6 Tables v1.0.3
   9d95f2ec TypedTables v1.2.0
   8bb1440f DelimitedFiles
   8ba89e20 Distributed
   b77e0a4c InteractiveUtils
   37e2e46d LinearAlgebra
   56ddb016 Logging
   9a3f8284 Random
   10745b16 Statistics
   8dfed614 Test
     Status `/tmp/jl_gYP1Cg/Manifest.toml`
   7d9fca2a Arpack v0.4.0
   68821587 Arpack_jll v3.5.0+2
   fbb218c0 BSON v0.2.5
   b99e7846 BinaryProvider v0.5.8
   336ed68f CSV v0.5.26
   324d7699 CategoricalArrays v0.7.7
   944b1d66 CodecZlib v0.6.0
   3da002f7 ColorTypes v0.9.1
   34da2185 Compat v3.8.0
   e66e0078 CompilerSupportLibraries_jll v0.2.0+1
   ed09eef8 ComputationalResources v0.3.1
   a8cc5b0e Crayons v4.0.1
   9a962f9c DataAPI v1.1.0
   a93c6f00 DataFrames v0.20.2
   864edb3b DataStructures v0.17.10
   e2d170a0 DataValueInterfaces v1.0.0
   7806a523 DecisionTree v0.10.1
   85a47980 Dictionaries v0.2.1
   b4f34e82 Distances v0.8.2
   31c24e10 Distributions v0.22.5
   e2ba6199 ExprTools v0.1.0
   8f5d6c58 EzXML v1.1.0
   48062228 FilePathsBase v0.7.0
   1a297f60 FillArrays v0.8.5
   53c48c17 FixedPointNumbers v0.7.1
   59287772 Formatting v0.4.1
   cd3eb016 HTTP v0.8.12
   313cdc1a Indexing v1.1.0
   83e8ac13 IniFile v0.5.0
   41ab1584 InvertedIndices v1.0.0
   82899510 IteratorInterfaceExtensions v1.0.0
   9da8a3cd JLSO v2.1.0
   682c06a0 JSON v0.21.0
   7f8f8fb0 LearnBase v0.2.2
   94ce4f54 Libiconv_jll v1.16.0+1
   30fc2ffe LossFunctions v0.5.1
   a7f614a8 MLJBase v0.12.1
   e80e1ace MLJModelInterface v0.2.0
   2e2323e0 MLJScientificTypes v0.2.1
   739be429 MbedTLS v1.0.1
   c8ffd9c3 MbedTLS_jll v2.16.0+1
   f28f55f0 Memento v0.12.1
   e1d29d7a Missings v0.4.3
   78c3b35d Mocking v0.7.1
   6f286f6a MultivariateStats v0.7.0
   b8a86587 NearestNeighbors v0.4.4
   4536629a OpenBLAS_jll v0.3.7+7
   efe28fd5 OpenSpecFun_jll v0.5.3+3
   bac558e1 OrderedCollections v1.1.0
   90014a1f PDMats v0.9.12
   d96e819e Parameters v0.12.0
   69de0a69 Parsers v0.3.12
   2dfb63ee PooledArrays v0.5.3
   08abe8d2 PrettyTables v0.8.4
   92933f4c ProgressMeter v1.2.0
   1fd47b50 QuadGK v2.3.1
   3cdcf5f2 RecipesBase v0.8.0
   189a3867 Reexport v0.2.0
   79098fc4 Rmath v0.6.1
   f50d1b31 Rmath_jll v0.2.2+0
   321657f4 ScientificTypes v0.7.2
   6e75b9c4 ScikitLearnBase v0.5.0
   a2af1166 SortingAlgorithms v0.3.1
   276daf66 SpecialFunctions v0.10.0
   03a91e81 SplitApplyCombine v1.0.0
   90137ffa StaticArrays v0.12.1
   2913bbd2 StatsBase v0.32.2
   4c63d2b9 StatsFuns v0.9.4
   cea106d9 Syslogs v0.3.0
   3783bdb8 TableTraits v1.0.0
   bd369af6 Tables v1.0.3
   f269a46b TimeZones v1.0.1
   3bb67fe8 TranscodingStreams v0.9.5
   9d95f2ec TypedTables v1.2.0
   ea10d353 WeakRefStrings v0.6.2
   02c8fc9c XML2_jll v2.9.9+1
   83775a58 Zlib_jll v1.2.11+8
   2a0f44e3 Base64
   ade2ca70 Dates
   8bb1440f DelimitedFiles
   8ba89e20 Distributed
   9fa8497b Future
   b77e0a4c InteractiveUtils
   76f85450 LibGit2
   8f399da3 Libdl
   37e2e46d LinearAlgebra
   56ddb016 Logging
   d6f4376e Markdown
   a63ad114 Mmap
   44cfe95a Pkg
   de0858da Printf
   3fa0cd96 REPL
   9a3f8284 Random
   ea8e919c SHA
   9e88b42a Serialization
   1a1011a3 SharedArrays
   6462fe0b Sockets
   2f01184e SparseArrays
   10745b16 Statistics
   4607b0f0 SuiteSparse
   8dfed614 Test
   cf7118a7 UUIDs
   4ec0a83e Unicode
[ Info: nprocs() = 41
[ Info: nthreads() = 2
Loading some models for testing...                                           Test Summary: | Pass  Total
misc          |   94     94
Test Summary: | Pass  Total
interface     |   78     78
Test Summary: | Pass  Total
measures      |  211    211
Progress:  17%|██████▉                                  |  ETA: 0:00:07[KProgress: 100%|█████████████████████████████████████████| Time: 0:00:01[K
Progress:  17%|██████▉                                  |  ETA: 0:00:18[KProgress:  67%|███████████████████████████▁             |  ETA: 0:00:02[KProgress:  83%|██████████████████████████████████▁      |  ETA: 0:00:01[KProgress: 100%|█████████████████████████████████████████| Time: 0:00:04[K
Progress:  17%|██████▉                                  |  ETA: 0:00:02[KProgress:  83%|██████████████████████████████████▁      |  ETA: 0:00:00[KProgress: 100%|█████████████████████████████████████████| Time: 0:00:00[K
[ Info: Updating [34mMachine{Resampler{Holdout,…}} @ 6…60[39m.
[ Info: Updating [34mMachine{Resampler{Holdout,…}} @ 6…63[39m.
[ Info: Updating [34mMachine{Resampler{Holdout,…}} @ 2…10[39m.
[ Info: Distributing evaluations among 40 workers.
[ Info: Creating subsamples from a subset of all rows. 
[ Info: Training [34mMachine{Resampler{CV,…}} @ 6…17[39m.
[ Info: Passing machine sample weights to any supported measures. 
[ Info: Training [34mMachine{Resampler{CV,…}} @ 1…71[39m.
[ Info: Creating subsamples from a subset of all rows. 
[ Info: Training [34mMachine{Resampler{CV,…}} @ 1…48[39m.
[ Info: Passing machine sample weights to any supported measures. 
[ Info: Training [34mMachine{Resampler{CV,…}} @ 2…36[39m.
[ Info: Creating subsamples from a subset of all rows. 
[ Info: Training [34mMachine{Resampler{CV,…}} @ 1…72[39m.
[ Info: Passing machine sample weights to any supported measures. 
[ Info: Training [34mMachine{Resampler{CV,…}} @ 1…22[39m.
Test Summary: | Pass  Total
resampling    |  125    125
Test Summary: | Pass  Total
data          |  119    119
[ Info: Training [34mMachine{ConstantClassifier} @ 1…96[39m.
[ Info: Training [34mMachine{ConstantClassifier} @ 4…66[39m.
[ Info: Training [34mNodalMachine{Scale} @ 1…47[39m.
[ Info: Training [34mMachine{DecisionTreeRegressor} @ 7…25[39m.
[ Info: Training [34mMachine{DecisionTreeRegressor} @ 1…71[39m.
[ Info: Training [34mMachine{DecisionTreeRegressor} @ 1…00[39m.
[ Info: Training [34mNodalMachine{FeatureSelector} @ 1…89[39m.
[ Info: Training [34mNodalMachine{FooBarRegressor} @ 1…73[39m.
[ Info: Training [34mNodalMachine{SimpleDeterministicCompositeModel{FooBarRegressor,…}} @ 5…26[39m.
[ Info: Training [34mNodalMachine{FeatureSelector} @ 2…23[39m.
[ Info: Training [34mNodalMachine{FooBarRegressor} @ 1…97[39m.
[ Info: Updating [34mNodalMachine{SimpleDeterministicCompositeModel{FooBarRegressor,…}} @ 5…26[39m.
[ Info: Updating [34mNodalMachine{FeatureSelector} @ 2…23[39m.
[ Info: Training [34mNodalMachine{FooBarRegressor} @ 1…97[39m.
[ Info: Training [34mNodalMachine{SimpleDeterministicCompositeModel{FooBarRegressor,…}} @ 5…26[39m.
[ Info: Training [34mNodalMachine{FeatureSelector} @ 1…64[39m.
[ Info: Training [34mNodalMachine{FooBarRegressor} @ 1…74[39m.
[ Info: Training [34mMachine{WrappedRidge} @ 4…90[39m.
[ Info: Training [34mNodalMachine{Standardizer} @ 7…79[39m.
[ Info: Training [34mNodalMachine{UnivariateBoxCoxTransformer} @ 1…60[39m.
[ Info: Training [34mNodalMachine{FooBarRegressor} @ 6…95[39m.
[ Info: Updating [34mMachine{WrappedRidge} @ 4…90[39m.
┌ Info: Not retraining [34mNodalMachine{Standardizer} @ 7…79[39m.
└  It appears up-to-date. Use `force=true` to force retraining.
┌ Info: Not retraining [34mNodalMachine{UnivariateBoxCoxTransformer} @ 1…60[39m.
└  It appears up-to-date. Use `force=true` to force retraining.
[ Info: Updating [34mNodalMachine{FooBarRegressor} @ 6…95[39m.
[ Info: Training [34mNodalMachine{OneHotEncoder} @ 8…14[39m.
[ Info: Spawning 3 sub-features to one-hot encode feature :x1.
[ Info: Training [34mNodalMachine{UnivariateStandardizer} @ 4…04[39m.
[ Info: Training [34mNodalMachine{KNNRegressor} @ 1…27[39m.
[ Info: Training [34mNodalMachine{DecisionTreeRegressor} @ 1…19[39m.
train_args = Source{:input}[[34mSource{:input} @ 1…47[39m]
mach.model = [34mOneHotEncoder @ 7…72[39m
train_args = Node{Nothing}[[34mNode{Nothing} @ 9…31[39m]
mach.model = UnivariateStandardizer @ 1…32
train_args = Node[[34mNode{NodalMachine{OneHotEncoder}} @ 7…38[39m, [34mNode{NodalMachine{UnivariateStandardizer}} @ 1…21[39m]
mach.model = [34mKNNRegressor @ 8…85[39m
train_args = Node[[34mNode{NodalMachine{OneHotEncoder}} @ 7…38[39m, [34mNode{NodalMachine{UnivariateStandardizer}} @ 1…21[39m]
mach.model = [34mDecisionTreeRegressor @ 5…23[39m
train_args = Source{:input}[[34mSource{:input} @ 1…37[39m]
mach.model = [34mOneHotEncoder @ 7…72[39m
train_args = Node{Nothing}[[34mNode{Nothing} @ 7…77[39m]
mach.model = UnivariateStandardizer @ 4…87
train_args = Node[[34mNode{NodalMachine{OneHotEncoder}} @ 1…40[39m, [34mNode{NodalMachine{UnivariateStandardizer}} @ 1…15[39m]
mach.model = [34mKNNRegressor @ 8…85[39m
train_args = Node[[34mNode{NodalMachine{OneHotEncoder}} @ 1…40[39m, [34mNode{NodalMachine{UnivariateStandardizer}} @ 1…15[39m]
mach.model = [34mDecisionTreeRegressor @ 8…94[39m
train_args = Source{:input}[[34mSource{:input} @ 1…02[39m]
mach.model = [34mOneHotEncoder @ 1…88[39m
train_args = Node{Nothing}[[34mNode{Nothing} @ 4…13[39m]
mach.model = UnivariateStandardizer @ 2…53
train_args = Node[[34mNode{NodalMachine{OneHotEncoder}} @ 5…26[39m, [34mNode{NodalMachine{UnivariateStandardizer}} @ 2…11[39m]
mach.model = [34mKNNRegressor @ 8…61[39m
train_args = Node[[34mNode{NodalMachine{OneHotEncoder}} @ 5…26[39m, [34mNode{NodalMachine{UnivariateStandardizer}} @ 2…11[39m]
mach.model = [34mDecisionTreeRegressor @ 1…55[39m
train_args = Source{:input}[[34mSource{:input} @ 1…95[39m]
mach.model = [34mOneHotEncoder @ 6…28[39m
train_args = Node{NodalMachine{OneHotEncoder}}[[34mNode{NodalMachine{OneHotEncoder}} @ 9…66[39m]
mach.model = [34mStandardizer @ 1…29[39m
[ Info: Training [34mNodalMachine{Standardizer} @ 9…18[39m.
[ Info: Training [34mNodalMachine{ConstantClassifier} @ 5…52[39m.
[ Info: Training [34mNodalMachine{Standardizer} @ 9…18[39m.
[ Info: Training [34mNodalMachine{ConstantClassifier} @ 5…52[39m.
[ Info: Training [34mMachine{Composite3} @ 7…51[39m.
train_args = Source{:input}[[34mSource{:input} @ 3…78[39m]
mach.model = [34mStandardizer @ 6…68[39m
train_args = AbstractNode[[34mNode{NodalMachine{Standardizer}} @ 1…85[39m, [34mSource{:target} @ 1…24[39m, [34mSource{:weights} @ 1…23[39m]
mach.model = ConstantClassifier @ 1…08
[ Info: Training [34mNodalMachine{Standardizer} @ 5…74[39m.
[ Info: Training [34mNodalMachine{ConstantClassifier} @ 4…52[39m.
[ Info: Training [34mMachine{Composite3} @ 1…84[39m.
train_args = Source{:input}[[34mSource{:input} @ 1…01[39m]
mach.model = [34mStandardizer @ 1…49[39m
train_args = AbstractNode[[34mNode{NodalMachine{Standardizer}} @ 3…69[39m, [34mSource{:target} @ 4…30[39m, [34mSource{:weights} @ 2…23[39m]
mach.model = ConstantClassifier @ 1…08
[ Info: Training [34mNodalMachine{Standardizer} @ 1…88[39m.
[ Info: Training [34mNodalMachine{ConstantClassifier} @ 1…99[39m.
[ Info: Training [34mMachine{CompositeWithNoFields} @ 1…63[39m.
train_args = Source{:input}[[34mSource{:input} @ 1…41[39m]
mach.model = [34mStandardizer @ 4…92[39m
train_args = AbstractNode[[34mNode{NodalMachine{Standardizer}} @ 1…46[39m, [34mSource{:target} @ 1…63[39m, [34mSource{:weights} @ 1…34[39m]
mach.model = ConstantClassifier @ 1…08
[ Info: Training [34mNodalMachine{Standardizer} @ 8…89[39m.
[ Info: Training [34mNodalMachine{ConstantClassifier} @ 1…85[39m.
[ Info: Training [34mNodalMachine{FeatureSelector} @ 5…88[39m.
[ Info: Training [34mNodalMachine{UnivariateStandardizer} @ 2…17[39m.
[ Info: Training [34mNodalMachine{KNNRegressor} @ 1…35[39m.
[ Info: Training [34mNodalMachine{FeatureSelector} @ 1…15[39m.
[ Info: Training [34mNodalMachine{UnivariateStandardizer} @ 1…54[39m.
[ Info: Training [34mNodalMachine{KNNRegressor} @ 4…74[39m.
[ Info: Updating [34mNodalMachine{FeatureSelector} @ 5…88[39m.
┌ Info: Not retraining [34mNodalMachine{UnivariateStandardizer} @ 2…17[39m.
└  It appears up-to-date. Use `force=true` to force retraining.
[ Info: Training [34mNodalMachine{KNNRegressor} @ 1…35[39m.
[ Info: Updating [34mNodalMachine{FeatureSelector} @ 1…15[39m.
┌ Info: Not retraining [34mNodalMachine{UnivariateStandardizer} @ 1…54[39m.
└  It appears up-to-date. Use `force=true` to force retraining.
[ Info: Training [34mNodalMachine{KNNRegressor} @ 4…74[39m.
[ Info: Training [34mMachine{Pipe} @ 1…06[39m.
train_args = Source{:input}[[34mSource{:input} @ 1…59[39m]
mach.model = [34mFeatureSelector @ 6…17[39m
train_args = Source{:target}[[34mSource{:target} @ 1…25[39m]
mach.model = UnivariateStandardizer @ 1…37
train_args = AbstractNode[[34mNode{NodalMachine{FeatureSelector}} @ 1…59[39m, [34mNode{NodalMachine{UnivariateStandardizer}} @ 3…59[39m, [34mSource{:weights} @ 1…07[39m]
mach.model = [34mKNNRegressor @ 1…40[39m
[ Info: Training [34mNodalMachine{FeatureSelector} @ 9…14[39m.
[ Info: Training [34mNodalMachine{UnivariateStandardizer} @ 1…57[39m.
[ Info: Training [34mNodalMachine{KNNRegressor} @ 1…60[39m.
[ Info: Training [34mMachine{Pipe21} @ 1…01[39m.
train_args = Source{:input}[[34mSource{:input} @ 4…79[39m]
mach.model = [34mOneHotEncoder @ 5…71[39m
train_args = AbstractNode[[34mNode{NodalMachine{OneHotEncoder}} @ 6…74[39m, [34mSource{:target} @ 8…98[39m, [34mSource{:weights} @ 1…23[39m]
mach.model = ConstantClassifier @ 1…08
[ Info: Training [34mNodalMachine{OneHotEncoder} @ 1…16[39m.
[ Info: Training [34mNodalMachine{ConstantClassifier} @ 1…41[39m.
[ Info: Training [34mMachine{Piper3} @ 1…75[39m.
train_args = Source{:input}[[34mSource{:input} @ 3…14[39m]
mach.model = [34mOneHotEncoder @ 2…51[39m
train_args = AbstractNode[[34mNode{NodalMachine{OneHotEncoder}} @ 1…93[39m, [34mSource{:target} @ 1…59[39m, [34mSource{:weights} @ 4…95[39m]
mach.model = ConstantClassifier @ 1…08
[ Info: Training [34mNodalMachine{OneHotEncoder} @ 1…74[39m.
[ Info: Training [34mNodalMachine{ConstantClassifier} @ 1…84[39m.
[ Info: Training [34mMachine{Piper3} @ 7…30[39m.
train_args = Source{:input}[[34mSource{:input} @ 8…92[39m]
mach.model = [34mOneHotEncoder @ 2…51[39m
train_args = AbstractNode[[34mNode{NodalMachine{OneHotEncoder}} @ 2…29[39m, [34mSource{:target} @ 1…87[39m, [34mSource{:weights} @ 1…33[39m]
mach.model = ConstantClassifier @ 1…08
[ Info: Training [34mNodalMachine{OneHotEncoder} @ 4…64[39m.
[ Info: Training [34mNodalMachine{ConstantClassifier} @ 6…19[39m.
[ Info: Training [34mNodalMachine{OneHotEncoder} @ 1…54[39m.
[ Info: Spawning 3 sub-features to one-hot encode feature :x3.
[ Info: Training [34mNodalMachine{FeatureSelector} @ 9…73[39m.
[ Info: Training [34mNodalMachine{KNNRegressor} @ 7…60[39m.
[ Info: Training [34mMachine{Pipe4} @ 2…17[39m.
train_args = Source{:input}[[34mSource{:input} @ 8…38[39m]
mach.model = [34mOneHotEncoder @ 1…35[39m
train_args = Node{NodalMachine{OneHotEncoder}}[[34mNode{NodalMachine{OneHotEncoder}} @ 1…88[39m]
mach.model = [34mFeatureSelector @ 1…67[39m
train_args = Source{:target}[[34mSource{:target} @ 1…42[39m]
mach.model = [34mStaticTransformer @ 9…27[39m
train_args = AbstractNode[[34mNode{NodalMachine{FeatureSelector}} @ 4…65[39m, [34mNode{NodalMachine{StaticTransformer}} @ 6…44[39m, [34mSource{:weights} @ 1…28[39m]
mach.model = [34mKNNRegressor @ 1…22[39m
train_args = Node{NodalMachine{KNNRegressor}}[[34mNode{NodalMachine{KNNRegressor}} @ 5…18[39m]
mach.model = [34mStaticTransformer @ 1…28[39m
[ Info: Training [34mNodalMachine{OneHotEncoder} @ 1…04[39m.
[ Info: Spawning 3 sub-features to one-hot encode feature :x3.
[ Info: Training [34mNodalMachine{FeatureSelector} @ 8…91[39m.
[ Info: Training [34mNodalMachine{StaticTransformer} @ 1…23[39m.
[ Info: Training [34mNodalMachine{KNNRegressor} @ 1…99[39m.
[ Info: Training [34mNodalMachine{StaticTransformer} @ 4…44[39m.
[ Info: Training [34mMachine{Pipe9} @ 7…40[39m.
train_args = Node{Nothing}[[34mNode{Nothing} @ 4…75[39m]
mach.model = [34mOneHotEncoder @ 7…13[39m
train_args = Source{:target}[[34mSource{:target} @ 1…41[39m]
mach.model = UnivariateStandardizer @ 2…41
train_args = AbstractNode[[34mNode{NodalMachine{OneHotEncoder}} @ 1…09[39m, [34mNode{NodalMachine{UnivariateStandardizer}} @ 2…15[39m, [34mSource{:weights} @ 9…24[39m]
mach.model = [34mKNNRegressor @ 1…40[39m
[ Info: Training [34mNodalMachine{OneHotEncoder} @ 1…14[39m.
[ Info: Spawning 2 sub-features to one-hot encode feature :gender.
[ Info: Training [34mNodalMachine{UnivariateStandardizer} @ 1…93[39m.
[ Info: Training [34mNodalMachine{KNNRegressor} @ 4…71[39m.
[ Info: Training [34mMachine{Pipe99} @ 1…08[39m.
train_args = Node{Nothing}[[34mNode{Nothing} @ 1…88[39m]
mach.model = [34mOneHotEncoder @ 1…21[39m
train_args = Node{NodalMachine{OneHotEncoder}}[[34mNode{NodalMachine{OneHotEncoder}} @ 1…32[39m]
mach.model = [34mMyTransformer @ 1…12[39m
[ Info: Training [34mNodalMachine{OneHotEncoder} @ 1…07[39m.
[ Info: Spawning 2 sub-features to one-hot encode feature :gender.
[ Info: Training [34mNodalMachine{MyTransformer} @ 1…23[39m.
┌ Info: Not retraining [34mNodalMachine{KNNRegressor} @ 7…99[39m.
└  It appears up-to-date. Use `force=true` to force retraining.
[ Info: Training [34mMachine{KNNRegressor} @ 3…36[39m.
[ Info: Training [34mNodalMachine{MyTransformer1} @ 8…99[39m.
train_args = Node{Nothing}[[34mNode{Nothing} @ 8…71[39m]
mach.model = [34mStandardizer @ 7…51[39m
train_args = Source{:target}[[34mSource{:target} @ 5…59[39m]
mach.model = [34mUnivariateBoxCoxTransformer @ 1…44[39m
train_args = AbstractNode[[34mNode{NodalMachine{Standardizer}} @ 7…97[39m, [34mNode{NodalMachine{UnivariateBoxCoxTransformer}} @ 1…69[39m, [34mSource{:weights} @ 8…51[39m]
mach.model = [34mKNNRegressor @ 1…28[39m
train_args = Source{:input}[[34mSource{:input} @ 7…36[39m]
mach.model = [34mMyTransformer @ 1…24[39m
train_args = Node{NodalMachine{Main.TestLearningNetworks.MyTransformer}}[[34mNode{NodalMachine{MyTransformer}} @ 1…35[39m]
mach.model = [34mStandardizer @ 1…79[39m
train_args = Source{:target}[[34mSource{:target} @ 9…85[39m]
mach.model = [34mUnivariateBoxCoxTransformer @ 1…30[39m
train_args = AbstractNode[[34mNode{NodalMachine{Standardizer}} @ 1…86[39m, [34mNode{NodalMachine{UnivariateBoxCoxTransformer}} @ 1…77[39m, [34mSource{:weights} @ 1…40[39m]
mach.model = [34mKNNRegressor @ 1…22[39m
train_args = Node{Nothing}[[34mNode{Nothing} @ 1…81[39m]
mach.model = [34mStandardizer @ 8…08[39m
train_args = Source{:target}[[34mSource{:target} @ 7…08[39m]
mach.model = [34mUnivariateBoxCoxTransformer @ 1…86[39m
train_args = Node[[34mNode{NodalMachine{Standardizer}} @ 1…05[39m, [34mNode{NodalMachine{UnivariateBoxCoxTransformer}} @ 1…92[39m]
mach.model = [34mKNNRegressor @ 1…60[39m
train_args = Union{}[]
mach.model = [34mMyTransformer @ 1…66[39m
train_args = Node{NodalMachine{Main.TestLearningNetworks.MyTransformer}}[[34mNode{NodalMachine{MyTransformer}} @ 4…28[39m]
mach.model = [34mStandardizer @ 2…19[39m
train_args = Source{:target}[[34mSource{:target} @ 8…29[39m]
mach.model = [34mUnivariateBoxCoxTransformer @ 1…64[39m
train_args = Node[[34mNode{NodalMachine{Standardizer}} @ 5…04[39m, [34mNode{NodalMachine{UnivariateBoxCoxTransformer}} @ 4…02[39m]
mach.model = [34mKNNRegressor @ 1…93[39m
[ Info: Training [34mNodalMachine{KNNRegressor} @ 4…91[39m.
[ Info: Training [34mNodalMachine{Standardizer} @ 1…08[39m.
[ Info: Training [34mNodalMachine{UnivariateBoxCoxTransformer} @ 2…58[39m.
[ Info: Training [34mNodalMachine{RidgeRegressor} @ 1…75[39m.
┌ Info: Not retraining [34mNodalMachine{Standardizer} @ 1…08[39m.
└  It appears up-to-date. Use `force=true` to force retraining.
┌ Info: Not retraining [34mNodalMachine{UnivariateBoxCoxTransformer} @ 2…58[39m.
└  It appears up-to-date. Use `force=true` to force retraining.
[ Info: Updating [34mNodalMachine{RidgeRegressor} @ 1…75[39m.
[ Info: Training [34mNodalMachine{Standardizer} @ 7…59[39m.
[ Info: Training [34mNodalMachine{PCA} @ 3…82[39m.
┌ Info: Not retraining [34mNodalMachine{Standardizer} @ 7…59[39m.
└  It appears up-to-date. Use `force=true` to force retraining.
┌ Info: Not retraining [34mNodalMachine{PCA} @ 3…82[39m.
└  It appears up-to-date. Use `force=true` to force retraining.
[ Info: Training [34mNodalMachine{RidgeRegressor} @ 1…22[39m.
[ Info: Training [34mNodalMachine{Standardizer} @ 1…77[39m.
[ Info: Training [34mNodalMachine{PCA} @ 1…22[39m.
[ Info: Training [34mNodalMachine{RidgeRegressor} @ 8…45[39m.
[ Info: Training [34mNodalMachine{Standardizer} @ 1…16[39m.
[ Info: Training [34mNodalMachine{PCA} @ 1…67[39m.
[ Info: Training [34mNodalMachine{UnivariateBoxCoxTransformer} @ 6…62[39m.
[ Info: Training [34mNodalMachine{RidgeRegressor} @ 1…92[39m.
[ Info: Training [34mNodalMachine{DecisionTreeRegressor} @ 8…50[39m.
[ Info: Training [34mNodalMachine{DecisionTreeRegressor} @ 6…96[39m.
[ Info: Training [34mNodalMachine{Standardizer} @ 8…33[39m.
[ Info: Training [34mNodalMachine{UnivariateBoxCoxTransformer} @ 7…57[39m.
[ Info: Training [34mNodalMachine{KNNRegressor} @ 1…08[39m.
[ Info: Training [34mNodalMachine{MyTransformer} @ 3…82[39m.
[ Info: Training [34mNodalMachine{Standardizer} @ 3…08[39m.
[ Info: Training [34mNodalMachine{UnivariateBoxCoxTransformer} @ 6…41[39m.
[ Info: Training [34mNodalMachine{KNNRegressor} @ 8…11[39m.
Test Summary:        | Pass  Total
machines+composition |  293    293
Test Summary: | Pass  Total
hyperparam    |  114    114
Test Summary: | Pass  Total
openml        |   15     15
┌ Warning: Forcibly interrupting busy workers
│   exception = rmprocs: pids [2, 3, 4, 5, 7, 8, 9, 10, 11, 12, 13, 14, 15, 16, 17, 18, 19, 20, 21, 22, 23, 24, 25, 26, 27, 28, 29, 30, 31, 32, 33, 34, 35, 36, 37, 38, 39, 40, 41] not terminated after 5.0 seconds.
└ @ Distributed /buildworker/worker/package_linux64/build/usr/share/julia/stdlib/v1.5/Distributed/src/cluster.jl:1234
┌ Warning: rmprocs: process 1 not removed
└ @ Distributed /buildworker/worker/package_linux64/build/usr/share/julia/stdlib/v1.5/Distributed/src/cluster.jl:1030
    Testing MLJBase tests passed 
