Julia Version 1.4.0-DEV.596
Commit 1c87f695be (2019-12-12 22:34 UTC)
Platform Info:
  OS: Linux (x86_64-pc-linux-gnu)
  CPU: Intel(R) Xeon(R) Silver 4114 CPU @ 2.20GHz
  WORD_SIZE: 64
  LIBM: libopenlibm
  LLVM: libLLVM-8.0.1 (ORCJIT, skylake)
Environment:
  JULIA_DEPOT_PATH = ::/usr/local/share/julia

 Resolving package versions...
 Installed Calculus РћђРћђРћђРћђРћђРћђРћђРћђРћђРћђРћђРћђРћђРћђРћђ v0.5.1
 Installed OpenSpecFun_jll РћђРћђРћђРћђРћђРћђРћђРћђ v0.5.3+1
 Installed Compat РћђРћђРћђРћђРћђРћђРћђРћђРћђРћђРћђРћђРћђРћђРћђРћђРћђ v2.2.0
 Installed DiffRules РћђРћђРћђРћђРћђРћђРћђРћђРћђРћђРћђРћђРћђРћђ v0.1.0
 Installed TravelingSalesmanExact Рћђ v0.3.2
 Installed BenchmarkTools РћђРћђРћђРћђРћђРћђРћђРћђРћђ v0.4.3
 Installed SpecialFunctions РћђРћђРћђРћђРћђРћђРћђ v0.9.0
 Installed StatsBase РћђРћђРћђРћђРћђРћђРћђРћђРћђРћђРћђРћђРћђРћђ v0.32.0
 Installed JSON РћђРћђРћђРћђРћђРћђРћђРћђРћђРћђРћђРћђРћђРћђРћђРћђРћђРћђРћђ v0.21.0
 Installed DiffResults РћђРћђРћђРћђРћђРћђРћђРћђРћђРћђРћђРћђ v0.0.4
 Installed Missings РћђРћђРћђРћђРћђРћђРћђРћђРћђРћђРћђРћђРћђРћђРћђ v0.4.3
 Installed StaticArrays РћђРћђРћђРћђРћђРћђРћђРћђРћђРћђРћђ v0.12.1
 Installed CommonSubexpressions РћђРћђРћђ v0.2.0
 Installed SortingAlgorithms РћђРћђРћђРћђРћђРћђ v0.3.1
 Installed DataStructures РћђРћђРћђРћђРћђРћђРћђРћђРћђ v0.17.6
 Installed DataAPI РћђРћђРћђРћђРћђРћђРћђРћђРћђРћђРћђРћђРћђРћђРћђРћђ v1.1.0
 Installed NaNMath РћђРћђРћђРћђРћђРћђРћђРћђРћђРћђРћђРћђРћђРћђРћђРћђ v0.3.3
 Installed Parsers РћђРћђРћђРћђРћђРћђРћђРћђРћђРћђРћђРћђРћђРћђРћђРћђ v0.3.10
 Installed OrderedCollections РћђРћђРћђРћђРћђ v1.1.0
 Installed ForwardDiff РћђРћђРћђРћђРћђРћђРћђРћђРћђРћђРћђРћђ v0.10.7
 Installed JuMP РћђРћђРћђРћђРћђРћђРћђРћђРћђРћђРћђРћђРћђРћђРћђРћђРћђРћђРћђ v0.20.1
 Installed UnicodePlots РћђРћђРћђРћђРћђРћђРћђРћђРћђРћђРћђ v1.1.0
 Installed MathOptInterface РћђРћђРћђРћђРћђРћђРћђ v0.9.7
  Updating `~/.julia/environments/v1.4/Project.toml`
  [737fac7d] + TravelingSalesmanExact v0.3.2
  Updating `~/.julia/environments/v1.4/Manifest.toml`
  [6e4b80f9] + BenchmarkTools v0.4.3
  [49dc2e85] + Calculus v0.5.1
  [bbf7d656] + CommonSubexpressions v0.2.0
  [34da2185] + Compat v2.2.0
  [9a962f9c] + DataAPI v1.1.0
  [864edb3b] + DataStructures v0.17.6
  [163ba53b] + DiffResults v0.0.4
  [b552c78f] + DiffRules v0.1.0
  [f6369f11] + ForwardDiff v0.10.7
  [682c06a0] + JSON v0.21.0
  [4076af6c] + JuMP v0.20.1
  [b8f27783] + MathOptInterface v0.9.7
  [e1d29d7a] + Missings v0.4.3
  [77ba4419] + NaNMath v0.3.3
  [efe28fd5] + OpenSpecFun_jll v0.5.3+1
  [bac558e1] + OrderedCollections v1.1.0
  [69de0a69] + Parsers v0.3.10
  [a2af1166] + SortingAlgorithms v0.3.1
  [276daf66] + SpecialFunctions v0.9.0
  [90137ffa] + StaticArrays v0.12.1
  [2913bbd2] + StatsBase v0.32.0
  [737fac7d] + TravelingSalesmanExact v0.3.2
  [b8865327] + UnicodePlots v1.1.0
  [2a0f44e3] + Base64 
  [ade2ca70] + Dates 
  [8bb1440f] + DelimitedFiles 
  [8ba89e20] + Distributed 
  [b77e0a4c] + InteractiveUtils 
  [76f85450] + LibGit2 
  [8f399da3] + Libdl 
  [37e2e46d] + LinearAlgebra 
  [56ddb016] + Logging 
  [d6f4376e] + Markdown 
  [a63ad114] + Mmap 
  [44cfe95a] + Pkg 
  [de0858da] + Printf 
  [3fa0cd96] + REPL 
  [9a3f8284] + Random 
  [ea8e919c] + SHA 
  [9e88b42a] + Serialization 
  [1a1011a3] + SharedArrays 
  [6462fe0b] + Sockets 
  [2f01184e] + SparseArrays 
  [10745b16] + Statistics 
  [8dfed614] + Test 
  [cf7118a7] + UUIDs 
  [4ec0a83e] + Unicode 
   Testing TravelingSalesmanExact
 Resolving package versions...

gzip: stdin: not in gzip format
tar: Child returned status 1
tar: Error is not recoverable: exiting now
Рћї Warning: failed to extract archive downloaded from https://github.com/JuliaPackaging/BinaryProvider.jl.git
Рћћ @ Pkg.Operations /buildworker/worker/package_linux64/build/usr/share/julia/stdlib/v1.4/Pkg/src/Operations.jl:481

gzip: stdin: not in gzip format
tar: Child returned status 1
tar: Error is not recoverable: exiting now
Рћї Warning: failed to extract archive downloaded from https://github.com/JuliaOpt/GLPK.jl.git
Рћћ @ Pkg.Operations /buildworker/worker/package_linux64/build/usr/share/julia/stdlib/v1.4/Pkg/src/Operations.jl:481
   Cloning [b99e7846-7c00-51b0-8f62-c81ae34c0232] BinaryProvider from https://github.com/JuliaPackaging/BinaryProvider.jl.git
[?25l    Fetching: [>                                        ]  0.0 %[2K[?25h[?25l Installed BinaryProvider Рћђ v0.5.8
   Cloning [60bf3e95-4087-53dc-ae20-288a0d20c6a6] GLPK from https://github.com/JuliaOpt/GLPK.jl.git
    Fetching: [>                                        ]  0.0 %[2K[?25h Installed GLPK РћђРћђРћђРћђРћђРћђРћђРћђРћђРћђРћђ v0.12.0
  Building GLPK Рєњ `~/.julia/packages/GLPK/J1b5G/deps/build.log`
Status `/tmp/jl_06WyzS/Manifest.toml`
  [6e4b80f9] BenchmarkTools v0.4.3
  [b99e7846] BinaryProvider v0.5.8
  [49dc2e85] Calculus v0.5.1
  [bbf7d656] CommonSubexpressions v0.2.0
  [34da2185] Compat v2.2.0
  [9a962f9c] DataAPI v1.1.0
  [864edb3b] DataStructures v0.17.6
  [163ba53b] DiffResults v0.0.4
  [b552c78f] DiffRules v0.1.0
  [f6369f11] ForwardDiff v0.10.7
  [60bf3e95] GLPK v0.12.0
  [682c06a0] JSON v0.21.0
  [4076af6c] JuMP v0.20.1
  [b8f27783] MathOptInterface v0.9.7
  [e1d29d7a] Missings v0.4.3
  [77ba4419] NaNMath v0.3.3
  [efe28fd5] OpenSpecFun_jll v0.5.3+1
  [bac558e1] OrderedCollections v1.1.0
  [69de0a69] Parsers v0.3.10
  [a2af1166] SortingAlgorithms v0.3.1
  [276daf66] SpecialFunctions v0.9.0
  [90137ffa] StaticArrays v0.12.1
  [2913bbd2] StatsBase v0.32.0
  [737fac7d] TravelingSalesmanExact v0.3.2
  [b8865327] UnicodePlots v1.1.0
  [2a0f44e3] Base64  [`@stdlib/Base64`]
  [ade2ca70] Dates  [`@stdlib/Dates`]
  [8bb1440f] DelimitedFiles  [`@stdlib/DelimitedFiles`]
  [8ba89e20] Distributed  [`@stdlib/Distributed`]
  [b77e0a4c] InteractiveUtils  [`@stdlib/InteractiveUtils`]
  [76f85450] LibGit2  [`@stdlib/LibGit2`]
  [8f399da3] Libdl  [`@stdlib/Libdl`]
  [37e2e46d] LinearAlgebra  [`@stdlib/LinearAlgebra`]
  [56ddb016] Logging  [`@stdlib/Logging`]
  [d6f4376e] Markdown  [`@stdlib/Markdown`]
  [a63ad114] Mmap  [`@stdlib/Mmap`]
  [44cfe95a] Pkg  [`@stdlib/Pkg`]
  [de0858da] Printf  [`@stdlib/Printf`]
  [3fa0cd96] REPL  [`@stdlib/REPL`]
  [9a3f8284] Random  [`@stdlib/Random`]
  [ea8e919c] SHA  [`@stdlib/SHA`]
  [9e88b42a] Serialization  [`@stdlib/Serialization`]
  [1a1011a3] SharedArrays  [`@stdlib/SharedArrays`]
  [6462fe0b] Sockets  [`@stdlib/Sockets`]
  [2f01184e] SparseArrays  [`@stdlib/SparseArrays`]
  [10745b16] Statistics  [`@stdlib/Statistics`]
  [8dfed614] Test  [`@stdlib/Test`]
  [cf7118a7] UUIDs  [`@stdlib/UUIDs`]
  [4ec0a83e] Unicode  [`@stdlib/Unicode`]
NAME : att48
COMMENT : 48 capitals of the US (Padberg/Rinaldi)
TYPE : TSP
DIMENSION : 48
EDGE_WEIGHT_TYPE : ATT
NODE_COORD_SECTION
EOF
Рћї Info: Starting optimization.
Рћѓ   plot_cities(cities) =
Рћѓ            РћїРћђРћђРћђРћђРћђРћђРћђРћђРћђРћђРћђРћђРћђРћђРћђРћђРћђРћђРћђРћђРћђРћђРћђРћђРћђРћђРћђРћђРћђРћђРћђРћђРћђРћђРћђРћђРћђРћђРћђРћђРћљ 
Рћѓ       6000 РћѓРађРађРађРађРађРађРађРађРађРађРађРађРађРађРађРађРађРађРађРађРађРађРађРађРађРађРађРађРађРађРађРађРађРађРађРађРађРађРађРађРћѓ 
Рћѓ            РћѓРађРађРађРађРађРађРађРађРађРађРађРађРађРађРађРађРађРађРађРађРађРађРађРађРађРађРађРађРађРађРађРађРађРађРађРађРађРађРађРађРћѓ 
Рћѓ            РћѓРађРађРађРађРађРађРађРађРађРађРађРађРађРађРађРађРађРађРађРађРађРађРађРађРађРађРађРађРађРађРађРађРађРађРађРађРАђРб░РаЃРађРћѓ 
Рћѓ            РћѓРађРађРађРађРађРађРађРађРађРађРађРађРађРађРађРађРађРађРађРађРађРађРађРађРађРађРађРађРађРађРађРађРбђРАаРБњРаЮРБ╗Рб┐РБ║РађРћѓ 
Рћѓ            РћѓРађРађРађРађРађРађРађРађРађРађРађРађРађРађРађРађРађРађРађРађРађРађРађРађРађРађРађРађРађРбђРбцРа«РаЊРБЅРБ┤Ра«РБЙРБйРАЪРађРћѓ 
Рћѓ            РћѓРађРађРађРађРађРађРађРађРађРађРађРађРађРађРађРађРађРађРађРађРађРађРађРађРађРађРБђРА┤РаъРаІРААРБћРБъРБіРАаРБ┤РаЮРБ┐РАЄРађРћѓ 
Рћѓ            РћѓРађРађРађРађРађРађРађРађРађРађРађРађРађРађРађРађРбцРБђРБђРБђРБђРБђРБцРБцРБХРБ║РБиРБъРБ╗РбЪРаЮРаЅРбђРацРбіРБЄРБђРБ┐РаЂРађРћѓ 
Рћѓ            РћѓРађРађРађРађРађРађРађРађРБђРБђРБђРБђРБђРБђРБђРБцРБцРБцРБ┤РБХРБ«РБ┐РБЏРБ┐РБ╗РАиРаХРБ┐РБ┐РБ»РБГРа┐Ра┐Рб┐РБЮРБђРБђРБ┐РађРађРћѓ 
Рћѓ            РћѓРањРањРаЏРаЅРбЅРБЅРБЅРаГРаГРаЏРаЏРаЏРаЏРаЊРацРацРБцРБ┤РБЏРБЕРБЪРБЏРБХРАЙРБ┐РБГРа»РАиРБЮРБйРБЦРБ▓РађРб░РаЂРађРађРАЄРађРађРћѓ 
Рћѓ            РћѓРа▓РаХРаГРБЅРБЂРбђРБђРБаРБцРБцРБцРБћРБњРБХРаХРбІРаГРбЏРБЕРайРаЏРаІРбЉРБиРбЙРа╝Рб┐РА╣РаЊРањРацРАјРбЅРаЈРаЅРањРб║РаЃРађРађРћѓ 
Рћѓ            РћѓРађРађРађРађРађРаЅРаЅРаЉРбњРАбРБ┤РаЙРБіРБцРаЮРА╗РаЮРаЏРаЏРаЏРбФРбйРАГРа»РбЇРБЕРБІРБ╣РБЇРбЅРаЈРАЌРАъРањРа▓РАђРбИРађРађРађРћѓ 
Рћѓ            РћѓРађРађРађРађРађРБђРбцРАфРБЦРБџРаЙРайРбќРАіРаЅРаЅРаЉРањРБбРБ┤РБхРБЂРБаРАцРа«РБцРА┤РаќРАЕРбФРБЕРБ╗РаиРањРађРаЉРАЄРађРађРађРћѓ 
Рћѓ            РћѓРађРађРБђРБХРА┐Ра┐Ра»РаГРацРањРањРањРањРаіРаЎРаФРБГРАЪРаіРађРбђРАаРацРбЊРБЅРацРаћРАќРаЅРаЅРб╣РаЄРађРађРађРађРађРађРађРађРћѓ 
Рћѓ            РћѓРађРађРађРађРађРађРађРађРађРађРађРађРађРађРађРаѕРБђРбгРБЊРаЙРахРБњРаЅРаЂРађРбђРаюРађРађРађРаўРађРађРађРађРађРађРађРађРађРћѓ 
Рћѓ          0 РћѓРађРађРађРађРађРађРађРађРађРађРађРБђРАаРа┤РаџРаЏРаЅРаЂРађРађРађРађРаЅРањРацРаіРађРађРађРађРађРађРађРађРађРађРађРађРађРађРћѓ 
Рћѓ            РћћРћђРћђРћђРћђРћђРћђРћђРћђРћђРћђРћђРћђРћђРћђРћђРћђРћђРћђРћђРћђРћђРћђРћђРћђРћђРћђРћђРћђРћђРћђРћђРћђРћђРћђРћђРћђРћђРћђРћђРћђРћў 
Рћћ            0                                     8000
Рћї Info: Iteration 1 took 31.305s, disallowed 5 cycles.
Рћѓ   plot_tour(cities, value.(tour_matrix)) =
Рћѓ            РћїРћђРћђРћђРћђРћђРћђРћђРћђРћђРћђРћђРћђРћђРћђРћђРћђРћђРћђРћђРћђРћђРћђРћђРћђРћђРћђРћђРћђРћђРћђРћђРћђРћђРћђРћђРћђРћђРћђРћђРћђРћљ 
Рћѓ       6000 РћѓРађРађРађРађРађРађРађРађРађРађРађРађРађРађРађРађРађРађРађРађРађРађРађРађРађРађРађРађРађРађРађРађРађРађРађРађРађРађРађРађРћѓ 
Рћѓ            РћѓРађРађРађРађРађРађРађРађРађРађРађРађРађРађРађРађРађРађРађРађРађРађРађРађРађРађРађРађРађРађРађРађРађРађРађРађРађРађРађРађРћѓ 
Рћѓ            РћѓРађРађРађРађРађРађРађРађРађРађРађРађРађРађРађРађРађРађРађРађРађРађРађРађРађРађРађРађРађРађРађРађРађРађРађРађРАђРб░РаЂРађРћѓ 
Рћѓ            РћѓРађРађРађРађРађРађРађРађРађРађРађРађРађРађРађРађРађРађРађРађРађРађРађРађРађРађРађРађРађРађРађРађРађРађРбђРаћРа╣РБјРАйРађРћѓ 
Рћѓ            РћѓРађРађРађРађРађРађРађРађРађРађРађРађРађРађРађРађРађРађРађРађРађРађРађРађРађРађРађРађРађРађРађРађРађРбаРаіРађРб░РаЂРађРађРћѓ 
Рћѓ            РћѓРађРађРађРађРађРађРађРађРађРађРађРађРађРађРађРађРађРађРађРађРађРађРађРађРађРађРађРађРађРађРађРађРАћРаЂРађРађРаЌРб╣РађРађРћѓ 
Рћѓ            РћѓРађРађРађРађРађРађРађРађРађРађРађРађРађРађРбђРБђРАёРађРађРађРађРађРбцРацРбёРБђРАаРацРањРаЅРббРбјРађРађРАаРаћРаіРБЂРађРађРћѓ 
Рћѓ            РћѓРађРађРађРађРађРађРађРађРБђРАаРацРаћРањРаЅРаЂРађРаўРАёРађРађРађРађРаўРАёРађРађРађРађРађРБ░РБЂРАаРаЮРаЏРаћРањРаЅРбИРађРађРћѓ 
Рћѓ            РћѓРАќРацРАђРађРађРађРбђРајРађРађРађРађРађРађРађРађРА░РаЂРађРађРађРађРБђРаЋРБђРАаРацРбќРА»РањРаЅРб▒РађРађРађРађРађРАюРађРађРћѓ 
Рћѓ            РћѓРАЄРађРаѕРаЉРабРбцРаЃРађРађРађРађРађРађРађРађРА░РаЂРБђРБђРацРаћРаџРафРБЅРАаРацРАфРаЃРађРађРађРбјРБђРађРађРађРб░РаЂРађРађРћѓ 
Рћѓ            РћѓРбИРађРађРађРађРађРађРађРађРађРбђРБђРацРаћРањРАЈРаЅРађРађРађРађРађРађРађРбђРаюРађРађРађРађРађРађРађРаЅРАєРађРбИРађРађРађРћѓ 
Рћѓ            РћѓРађРАЄРађРађРађРбђРАаРаћРаіРаЅРаЂРађРађРађРађРб▒РађРађРађРађРађРађРађРБаРБЃРАаРацРаћРацРБђРађРађРађРаўРабРацРАјРађРађРађРћѓ 
Рћѓ            РћѓРађРаИРАаРаќРаіРаЂРађРађРађРађРађРађРађРађРађРбИРађРађРађРађРађРађРађРаЂРађРађРађРађРађРађРб╣РађРађРађРађРађРађРађРађРађРћѓ 
Рћѓ            РћѓРађРађРађРађРађРађРађРађРађРађРађРађРађРбђРАаРаіРађРађРађРађРађРађРађРађРађРађРађРађРБђРацРаџРађРађРађРађРађРађРађРађРађРћѓ 
Рћѓ          0 РћѓРађРађРађРађРађРађРађРађРађРађРађРБђРБћРБЂРБђРБђРБђРБђРБђРБђРАаРацРацРацРацРацРањРаЅРађРађРађРађРађРађРађРађРађРађРађРађРћѓ 
Рћѓ            РћћРћђРћђРћђРћђРћђРћђРћђРћђРћђРћђРћђРћђРћђРћђРћђРћђРћђРћђРћђРћђРћђРћђРћђРћђРћђРћђРћђРћђРћђРћђРћђРћђРћђРћђРћђРћђРћђРћђРћђРћђРћў 
Рћћ            0                                     8000
Рћї Info: Iteration 2 took 0.007s, disallowed 6 cycles.
Рћѓ   plot_tour(cities, value.(tour_matrix)) =
Рћѓ            РћїРћђРћђРћђРћђРћђРћђРћђРћђРћђРћђРћђРћђРћђРћђРћђРћђРћђРћђРћђРћђРћђРћђРћђРћђРћђРћђРћђРћђРћђРћђРћђРћђРћђРћђРћђРћђРћђРћђРћђРћђРћљ 
Рћѓ       6000 РћѓРађРађРађРађРађРађРађРађРађРађРађРађРађРађРађРађРађРађРађРађРађРађРађРађРађРађРађРађРађРађРађРађРађРађРађРађРађРађРађРађРћѓ 
Рћѓ            РћѓРађРађРађРађРађРађРађРађРађРађРађРађРађРађРађРађРађРађРађРађРађРађРађРађРађРађРађРађРађРађРађРађРађРађРађРађРађРађРађРађРћѓ 
Рћѓ            РћѓРађРађРађРађРађРађРађРађРађРађРађРађРађРађРађРађРађРађРађРађРађРађРађРађРађРађРађРађРађРађРађРађРађРађРбђРБаРАћРб║РаЂРађРћѓ 
Рћѓ            РћѓРађРађРађРађРађРађРађРађРађРађРађРађРађРађРађРађРађРађРађРађРађРађРађРађРађРађРађРађРађРађРБђРацРањРбЅРаЋРаЂРбИРађРАйРађРћѓ 
Рћѓ            РћѓРађРађРађРађРађРађРађРађРађРађРађРађРађРађРађРађРађРађРађРађРађРађРађРађРађРађРБђРацРањРаЅРађРбђРаћРаЂРађРађРаѕРбЙРађРађРћѓ 
Рћѓ            РћѓРађРађРађРађРађРађРађРађРађРађРађРађРађРађРађРађРађРађРађРађРађРађРБђРацРањРаЅРађРађРађРбђРаћРаЂРађРађРБђРАаРацРбгРађРађРћѓ 
Рћѓ            РћѓРађРађРађРађРађРађРађРађРађРађРађРађРађРађРађРађРацРбцРАцРацРбХРАГРацРаћРањРбњРА▓РбХРаќРбЏРАфРбГРаЏРаЅРаЅРаЅРаЅРБЂРађРађРћѓ 
Рћѓ            РћѓРађРађРађРађРађРађРађРађРАђРађРађРађРађРбђРАаРаћРаіРБЂРацРањРаЂРађРађРађРБаРБіРа┤РаЊРаЅРБЂРАђРађРаЅРањРаћРањРаЅРбИРађРађРћѓ 
Рћѓ            РћѓРАќРаіРаЅРаЅРаЅРаЅРбЅРаЈРађРбђРАаРаћРаіРаЂРађРађРађРаѕРаЅРањРБцРбцРБћРбъРБЋРААРацРаќРаЅРађРаѕРб▒РађРађРађРађРађРАюРађРађРћѓ 
Рћѓ            РћѓРАЄРађРађРађРађРбаРАБРаћРаіРаЂРађРађРађРађРађРБђРАаРБћРБіРаГРаћРбџРаЙРАЅРањРабРАёРађРађРађРађРбјРБђРађРађРађРб░РаЂРађРађРћѓ 
Рћѓ            РћѓРб▒РађРађРађРађРађРађРађРађРађРБђРБаРацРаќРаЏРАЈРаЅРађРађРАаРаћРаЂРађРАЄРађРађРаИРАђРађРађРађРађРађРаЅРАєРађРбИРађРађРађРћѓ 
Рћѓ            РћѓРађРАЄРађРађРађРбђРБђРацРањРаЅРаЂРађРађРађРађРб▒РађРАаРаіРађРађРађРађРАЄРађРађРађРаЉРацРБђРађРађРађРаўРабРацРАјРађРађРађРћѓ 
Рћѓ            РћѓРађРаИРАаРањРаіРаЂРађРађРађРађРађРађРађРађРађРБИРаіРађРађРађРађРађРађРбЄРађРађРађРађРађРађРб╣РађРађРађРађРађРађРађРађРађРћѓ 
Рћѓ            РћѓРађРађРађРађРађРађРађРађРађРађРађРађРађРБаРАфРаіРађРађРађРађРађРађРађРаўРАёРађРађРбђРАаРаћРаџРађРађРађРађРађРађРађРађРађРћѓ 
Рћѓ          0 РћѓРађРађРађРађРађРађРађРађРађРађРађРБаРаъРаЂРађРађРађРађРађРађРађРађРађРађРа▒РаћРаіРаЂРађРађРађРађРађРађРађРађРађРађРађРађРћѓ 
Рћѓ            РћћРћђРћђРћђРћђРћђРћђРћђРћђРћђРћђРћђРћђРћђРћђРћђРћђРћђРћђРћђРћђРћђРћђРћђРћђРћђРћђРћђРћђРћђРћђРћђРћђРћђРћђРћђРћђРћђРћђРћђРћђРћў 
Рћћ            0                                     8000
Рћї Info: Iteration 3 took 0.011s, disallowed 3 cycles.
Рћѓ   plot_tour(cities, value.(tour_matrix)) =
Рћѓ            РћїРћђРћђРћђРћђРћђРћђРћђРћђРћђРћђРћђРћђРћђРћђРћђРћђРћђРћђРћђРћђРћђРћђРћђРћђРћђРћђРћђРћђРћђРћђРћђРћђРћђРћђРћђРћђРћђРћђРћђРћђРћљ 
Рћѓ       6000 РћѓРађРађРађРађРађРађРађРађРађРађРађРађРађРађРађРађРађРађРађРађРађРађРађРађРађРађРађРађРађРађРађРађРађРађРађРађРађРађРађРађРћѓ 
Рћѓ            РћѓРађРађРађРађРађРађРађРађРађРађРађРађРађРађРађРађРађРађРађРађРађРађРађРађРађРађРађРађРађРађРађРађРађРађРађРађРађРађРађРађРћѓ 
Рћѓ            РћѓРађРађРађРађРађРађРађРађРађРађРађРађРађРађРађРађРађРађРађРађРађРађРађРађРађРађРађРађРађРађРађРађРађРађРађРађРАаРб▓РаЂРађРћѓ 
Рћѓ            РћѓРађРађРађРађРађРађРађРађРађРађРађРађРађРађРађРађРађРађРађРађРађРађРађРађРађРађРађРађРађРађРађРађРађРађРађРађРб▒РађРА╣РађРћѓ 
Рћѓ            РћѓРађРађРађРађРађРађРађРађРађРађРађРађРађРађРађРађРађРађРађРађРађРађРађРађРађРађРађРађРађРађРађРађРађРађРађРађРАюРбИРађРађРћѓ 
Рћѓ            РћѓРађРађРађРађРађРађРађРађРађРађРађРађРађРађРађРађРађРађРађРађРађРађРађРађРађРађРађРађРађРађРађРађРађРађРађРАаРаЄРбИРађРађРћѓ 
Рћѓ            РћѓРађРађРађРађРађРађРађРађРађРађРађРађРађРађРађРађРАцРацРацРацРацРацРацРацРбёРБђРАаРацРањРаЅРабРбёРбђРаћРАфРаћРаіРБЂРађРађРћѓ 
Рћѓ            РћѓРађРађРађРађРађРађРађРађРАђРађРађРађРађРађРађРађРаўРАёРађРађРађРађРађРађРађРађРађРађРађРБђРБаРАфРаЮРаЏРаћРањРаЅРбИРађРађРћѓ 
Рћѓ            РћѓРАќРацРАђРађРађРађРбђРаюРбБРађРађРађРађРађРађРађРађРаѕРаЉРацРАђРађРБђРАћРађРађРАаРБ▓РАйРаЊРаЅРб▒РађРађРађРађРађРАюРађРађРћѓ 
Рћѓ            РћѓРАЄРађРаѕРаЉРабРбцРаіРађРаИРАђРађРађРађРађРађРађРађРађРађРађРаѕРаЅРађРБЄРбћРаЙРАјРаЂРађРађРађРбјРБђРађРађРађРб░РаЂРађРађРћѓ 
Рћѓ            РћѓРб▒РађРађРађРађРађРађРађРађРбЄРБђРАаРацРањРаіРАЄРађРађРађРађРађРАаРА▓РАЈРаЂРађРаИРАђРађРађРађРађРађРаЅРАєРађРбИРађРађРађРћѓ 
Рћѓ            РћѓРађРАЄРађРађРађРађРађРађРађРаѕРађРађРађРађРађРб▒РађРађРбђРБћРаъРаЅРађРАЄРађРађРађРаЉРацРБђРађРађРађРаўРабРацРАјРађРађРађРћѓ 
Рћѓ            РћѓРађРаИРАаРабРбёРађРађРађРађРађРађРађРађРађРађРбИРБаРа┤РаІРађРађРађРађРбЄРађРађРађРађРађРађРб╣РађРађРађРађРађРађРађРађРађРћѓ 
Рћѓ            РћѓРађРађРађРађРађРаЅРабРбёРађРађРађРађРађРађРАаРаџРаЂРађРађРађРађРађРађРаўРАёРађРађРбђРАаРаћРаџРађРађРађРађРађРађРађРађРађРћѓ 
Рћѓ          0 РћѓРађРађРађРађРађРађРађРађРаЅРањРбёРБђРаћРаЅРађРађРађРађРађРађРађРађРађРађРа▒РаћРаіРаЂРађРађРађРађРађРађРађРађРађРађРађРађРћѓ 
Рћѓ            РћћРћђРћђРћђРћђРћђРћђРћђРћђРћђРћђРћђРћђРћђРћђРћђРћђРћђРћђРћђРћђРћђРћђРћђРћђРћђРћђРћђРћђРћђРћђРћђРћђРћђРћђРћђРћђРћђРћђРћђРћђРћў 
Рћћ            0                                     8000
Рћї Info: Iteration 4 took 0.015s, disallowed 4 cycles.
Рћѓ   plot_tour(cities, value.(tour_matrix)) =
Рћѓ            РћїРћђРћђРћђРћђРћђРћђРћђРћђРћђРћђРћђРћђРћђРћђРћђРћђРћђРћђРћђРћђРћђРћђРћђРћђРћђРћђРћђРћђРћђРћђРћђРћђРћђРћђРћђРћђРћђРћђРћђРћђРћљ 
Рћѓ       6000 РћѓРађРађРађРађРађРађРађРађРађРађРађРађРађРађРађРађРађРађРађРађРађРађРађРађРађРађРађРађРађРађРађРађРађРађРађРађРађРађРађРађРћѓ 
Рћѓ            РћѓРађРађРађРађРађРађРађРађРађРађРађРађРађРађРађРађРађРађРађРађРађРађРађРађРађРађРађРађРађРађРађРађРађРађРађРађРађРађРађРађРћѓ 
Рћѓ            РћѓРађРађРађРађРађРађРађРађРађРађРађРађРађРађРађРађРађРађРађРађРађРађРађРађРађРађРађРађРађРађРађРађРађРађРађРбђРАђРб░РаЃРађРћѓ 
Рћѓ            РћѓРађРађРађРађРађРађРађРађРађРађРађРађРађРађРађРађРађРађРађРађРађРађРађРађРађРађРађРађРађРађРађРађРађРбђРаћРаЂРбИРбИРАйРађРћѓ 
Рћѓ            РћѓРађРађРађРађРађРађРађРађРађРађРађРађРађРађРађРађРађРађРађРађРађРађРађРађРађРађРађРађРађРађРађРбђРаћРаЂРађРађРАИРбИРађРађРћѓ 
Рћѓ            РћѓРађРађРађРађРађРађРађРађРађРађРађРађРађРађРађРађРађРађРађРађРађРађРађРађРађРађРађРађРађРбђРаћРаЂРађРађРађРађРаЌРб╣РађРађРћѓ 
Рћѓ            РћѓРађРађРађРађРађРађРађРађРађРађРађРађРађРађРађРађРАцРацРацРацРацРацРацРацРбёРБђРацРбћРаъРаЅРањРбёРађРађРБђРацРаіРб╣РађРађРћѓ 
Рћѓ            РћѓРађРађРађРађРађРађРађРађРАђРађРађРађРађРађРађРађРаўРАёРађРађРађРађРађРађРађРбђРаћРаЂРађРБђРБђРацРаЏРаЏРацРацРБђРБђРађРађРћѓ 
Рћѓ            РћѓРАќРацРАђРађРађРађРбђРаюРбБРађРађРађРађРађРађРађРА░РаЂРађРађРађРађРБђРБћРаћРаЂРбђРАХРаЮРаіРаЅРб▒РађРађРађРађРађРАјРађРађРћѓ 
Рћѓ            РћѓРАЄРађРаѕРаЉРабРбцРаіРађРаИРАђРађРађРађРађРађРА░РаЂРађРађРађРбаРбіРаћРБЄРацРафРАЃРађРађРађРађРбЄРБђРађРађРађРб░РаЂРађРађРћѓ 
Рћѓ            РћѓРб▒РађРађРађРађРађРађРађРађРбЄРађРађРБђРБђРБђРАЄРађРађРађРА┤РаЋРаЂРађРађРађРађРа▒РАђРађРађРађРађРађРаЅРАєРађРбИРађРађРађРћѓ 
Рћѓ            РћѓРађРАЄРађРађРађРађРађРађРађРаѕРаЅРаЅРађРађРађРађРађРБаРајРађРађРађРађРађРађРађРађРаЉРацРБђРађРађРађРаўРабРацРАјРађРађРађРћѓ 
Рћѓ            РћѓРађРаИРАаРабРбёРађРађРађРађРађРађРађРађРађРађРАаРА║РБЂРАаРацРањРаіРаЅРбЄРађРађРађРађРађРађРб╣РађРађРађРађРађРађРађРађРађРћѓ 
Рћѓ            РћѓРађРађРађРађРађРаЅРабРбёРађРађРађРађРађРАаРаіРаѕРаЅРађРађРађРађРађРађРаѕРАєРађРађРађРБђРацРаџРађРађРађРађРађРађРађРађРађРћѓ 
Рћѓ          0 РћѓРађРађРађРађРађРађРађРађРаЅРањРбёРАаРаіРађРађРађРађРађРађРађРађРађРађРађРаИРацРањРаЅРађРађРађРађРађРађРађРађРађРађРађРађРћѓ 
Рћѓ            РћћРћђРћђРћђРћђРћђРћђРћђРћђРћђРћђРћђРћђРћђРћђРћђРћђРћђРћђРћђРћђРћђРћђРћђРћђРћђРћђРћђРћђРћђРћђРћђРћђРћђРћђРћђРћђРћђРћђРћђРћђРћў 
Рћћ            0                                     8000
Рћї Info: Iteration 5 took 0.053s, disallowed 2 cycles.
Рћѓ   plot_tour(cities, value.(tour_matrix)) =
Рћѓ            РћїРћђРћђРћђРћђРћђРћђРћђРћђРћђРћђРћђРћђРћђРћђРћђРћђРћђРћђРћђРћђРћђРћђРћђРћђРћђРћђРћђРћђРћђРћђРћђРћђРћђРћђРћђРћђРћђРћђРћђРћђРћљ 
Рћѓ       6000 РћѓРађРађРађРађРађРађРађРађРађРађРађРађРађРађРађРађРађРађРађРађРађРађРађРађРађРађРађРађРађРађРађРађРађРађРађРађРађРађРађРађРћѓ 
Рћѓ            РћѓРађРађРађРађРађРађРађРађРађРађРађРађРађРађРађРађРађРађРађРађРађРађРађРађРађРађРађРађРађРађРађРађРађРађРађРађРађРађРађРађРћѓ 
Рћѓ            РћѓРађРађРађРађРађРађРађРађРађРађРађРађРађРађРађРађРађРађРађРађРађРађРађРађРађРађРађРађРађРађРађРађРађРађРађРађРАаРб║РаЂРађРћѓ 
Рћѓ            РћѓРађРађРађРађРађРађРађРађРађРађРађРађРађРађРађРађРађРађРађРађРађРађРађРађРађРађРађРађРађРађРађРађРађРађРађРађРбИРађРАйРађРћѓ 
Рћѓ            РћѓРађРађРађРађРађРађРађРађРађРађРађРађРађРађРађРађРађРађРађРађРађРађРађРађРађРађРађРађРађРађРађРађРађРађРађРађРАИРбИРађРађРћѓ 
Рћѓ            РћѓРађРађРађРађРађРађРађРађРађРађРађРађРађРађРађРађРађРађРађРађРађРађРађРађРађРађРађРађРађРађРађРађРађРађРађРбђРаЄРАИРађРађРћѓ 
Рћѓ            РћѓРађРађРађРађРађРађРађРађРађРађРађРађРађРађРађРађРАцРацРацРацРацРацРацРацРбёРБђРацРаћРаіРаЅРањРбёРађРађРбђРајРађРбЄРађРађРћѓ 
Рћѓ            РћѓРађРађРађРађРађРађРађРађРАђРађРађРађРађРађРађРађРаўРАёРађРађРађРађРађРађРађРађРађРађРађРБђРАђРађРаЅРањРајРађРађРбИРађРађРћѓ 
Рћѓ            РћѓРАќРацРАђРађРађРађРбђРаюРбБРађРађРађРађРађРађРађРА░РаЂРађРађРађРађРБђРа┤РАђРађРбђРаќРаЅРађРаѕРб▒РађРађРађРађРађРАјРађРађРћѓ 
Рћѓ            РћѓРАЄРађРаѕРаЉРабРбцРаіРађРаИРАђРађРађРађРађРађРА░РаЂРађРађРађРађРаѕРабРАђРаѕРабРаЃРађРађРађРађРбЄРБђРађРађРађРб░РаЂРађРађРћѓ 
Рћѓ            РћѓРб▒РађРађРађРађРађРађРађРађРбЄРађРађРБђРБђРБђРАЄРађРађРађРађРађРађРађРАЄРађРађРађРађРађРађРађРађРађРаЅРАєРађРбИРађРађРађРћѓ 
Рћѓ            РћѓРађРАЄРађРађРађРађРађРађРађРаѕРаЅРаЅРађРађРађРађРађРађРађРађРађРађРађРБЄРБђРАаРацРањРАёРађРађРађРађРаўРабРацРАјРађРађРађРћѓ 
Рћѓ            РћѓРађРаИРАаРабРбёРађРађРађРађРађРађРађРађРађРађРађРбђРБђРАаРацРањРањРаЅРбЄРађРбђРБђРацРагРб▓Рб║РађРађРађРађРађРађРађРађРађРћѓ 
Рћѓ            РћѓРађРађРађРађРађРаЅРабРбёРађРађРађРађРађРађРађРаѕРаЉРањРбцРБёРБцРацРањРаџРАЇРаЂРађРађРађРађРаЎРађРађРађРађРађРађРађРађРађРћѓ 
Рћѓ          0 РћѓРађРађРађРађРађРађРађРађРаЅРањРбёРБђРБђРацРацРањРаіРаЅРаЂРађРађРаЅРаЉРањРахРађРађРађРађРађРађРађРађРађРађРађРађРађРађРађРћѓ 
Рћѓ            РћћРћђРћђРћђРћђРћђРћђРћђРћђРћђРћђРћђРћђРћђРћђРћђРћђРћђРћђРћђРћђРћђРћђРћђРћђРћђРћђРћђРћђРћђРћђРћђРћђРћђРћђРћђРћђРћђРћђРћђРћђРћў 
Рћћ            0                                     8000
Рћї Info: Iteration 6 took 0.057s, disallowed 2 cycles.
Рћѓ   plot_tour(cities, value.(tour_matrix)) =
Рћѓ            РћїРћђРћђРћђРћђРћђРћђРћђРћђРћђРћђРћђРћђРћђРћђРћђРћђРћђРћђРћђРћђРћђРћђРћђРћђРћђРћђРћђРћђРћђРћђРћђРћђРћђРћђРћђРћђРћђРћђРћђРћђРћљ 
Рћѓ       6000 РћѓРађРађРађРађРађРађРађРађРађРађРађРађРађРађРађРађРађРађРађРађРађРађРађРађРађРађРађРађРађРађРађРађРађРађРађРађРађРађРађРађРћѓ 
Рћѓ            РћѓРађРађРађРађРађРађРађРађРађРађРађРађРађРађРађРађРађРађРађРађРађРађРађРађРађРађРађРађРађРађРађРађРађРађРађРађРађРађРађРађРћѓ 
Рћѓ            РћѓРађРађРађРађРађРађРађРађРађРађРађРађРађРађРађРађРађРађРађРађРађРађРађРађРађРађРађРађРађРађРађРађРађРађРађРађРАаРб▓РаЂРађРћѓ 
Рћѓ            РћѓРађРађРађРађРађРађРађРађРађРађРађРађРађРађРађРађРађРађРађРађРађРађРађРађРађРађРађРађРађРађРађРађРађРађРађРађРб▒РађРА╣РађРћѓ 
Рћѓ            РћѓРађРађРађРађРађРађРађРађРађРађРађРађРађРађРађРађРађРађРађРађРађРађРађРађРађРађРађРађРађРађРађРађРађРађРађРађРАюРбИРађРађРћѓ 
Рћѓ            РћѓРађРађРађРађРађРађРађРађРађРађРађРађРађРађРађРађРађРађРађРађРађРађРађРађРађРађРађРађРађРађРађРађРађРађРађРбђРаЄРбИРађРађРћѓ 
Рћѓ            РћѓРађРађРађРађРађРађРађРађРађРађРађРађРађРађРађРађРАцРацРацРацРацРацРбёРађРађРбђРАаРацРањРаЅРабРбёРађРађРбђРајРађРбЄРађРађРћѓ 
Рћѓ            РћѓРађРађРађРађРађРађРађРађРАђРађРађРађРађРађРађРађРаўРАёРађРађРађРађРаўРАёРАаРаЃРађРађРађРБђРАђРађРаЅРањРајРађРађРбИРађРађРћѓ 
Рћѓ            РћѓРАќРацРАђРађРађРађРбђРаюРбБРађРађРађРађРађРађРађРА░РаЂРађРађРађРађРБаРаЪРађРађРАаРањРаЅРађРаѕРб▒РађРађРађРађРађРАюРађРађРћѓ 
Рћѓ            РћѓРАЄРађРаѕРаЉРабРбцРаіРађРаИРАђРађРађРађРађРађРА░РаЂРађРађРађРАаРаіРабРБђРА┤Ра«РАђРађРађРађРађРбјРБђРађРађРађРб░РаЂРађРађРћѓ 
Рћѓ            РћѓРб▒РађРађРађРађРађРађРађРађРбЄРађРађРБђРБђРБђРАЄРађРађРбђРаћРаЂРАаРањРаЂРађРађРа▒РАђРађРађРађРађРађРаЅРАєРађРбИРађРађРађРћѓ 
Рћѓ            РћѓРађРАЄРађРађРађРађРађРађРађРаѕРаЅРаЅРађРађРађРађРбђРаћРбЂРаћРаіРађРађРађРађРађРађРаЉРацРБђРађРађРађРаўРабРацРАјРађРађРађРћѓ 
Рћѓ            РћѓРађРаИРАаРабРбёРађРађРађРађРађРађРађРађРађРађРАћРААРБћРААРацРањРаіРаЅРбЄРађРађРађРађРађРађРб╣РађРађРађРађРађРађРађРађРађРћѓ 
Рћѓ            РћѓРађРађРађРађРађРаЅРабРбёРађРађРађРађРађРАаРаіРаѕРаЅРађРађРађРађРађРађРаѕРАєРађРађРађРБђРацРаџРађРађРађРађРађРађРађРађРађРћѓ 
Рћѓ          0 РћѓРађРађРађРађРађРађРађРађРаЅРањРбёРАаРаіРађРађРађРађРађРађРађРађРађРађРађРаИРацРањРаЅРађРађРађРађРађРађРађРађРађРађРађРађРћѓ 
Рћѓ            РћћРћђРћђРћђРћђРћђРћђРћђРћђРћђРћђРћђРћђРћђРћђРћђРћђРћђРћђРћђРћђРћђРћђРћђРћђРћђРћђРћђРћђРћђРћђРћђРћђРћђРћђРћђРћђРћђРћђРћђРћђРћў 
Рћћ            0                                     8000
Рћї Info: Iteration 7 took 0.067s, disallowed 1 cycles.
Рћѓ   plot_tour(cities, value.(tour_matrix)) =
Рћѓ            РћїРћђРћђРћђРћђРћђРћђРћђРћђРћђРћђРћђРћђРћђРћђРћђРћђРћђРћђРћђРћђРћђРћђРћђРћђРћђРћђРћђРћђРћђРћђРћђРћђРћђРћђРћђРћђРћђРћђРћђРћђРћљ 
Рћѓ       6000 РћѓРађРађРађРађРађРађРађРађРађРађРађРађРађРађРађРађРађРађРађРађРађРађРађРађРађРађРађРађРађРађРађРађРађРађРађРађРађРађРађРађРћѓ 
Рћѓ            РћѓРађРађРађРађРађРађРађРађРађРађРађРађРађРађРађРађРађРађРађРађРађРађРађРађРађРађРађРађРађРађРађРађРађРађРађРађРађРађРађРађРћѓ 
Рћѓ            РћѓРађРађРађРађРађРађРађРађРађРађРађРађРађРађРађРађРађРађРађРађРађРађРађРађРађРађРађРађРађРађРађРађРађРађРађРађРАаРб║РаЂРађРћѓ 
Рћѓ            РћѓРађРађРађРађРађРађРађРађРађРађРађРађРађРађРађРађРађРађРађРађРађРађРађРађРађРађРађРађРађРађРађРађРађРађРађРађРбИРађРАйРађРћѓ 
Рћѓ            РћѓРађРађРађРађРађРађРађРађРађРађРађРађРађРађРађРађРађРађРађРађРађРађРађРађРађРађРађРађРађРађРађРађРађРађРађРађРАИРбИРађРађРћѓ 
Рћѓ            РћѓРађРађРађРађРађРађРађРађРађРађРађРађРађРађРађРађРађРађРађРађРађРађРађРађРађРађРађРађРађРађРађРађРађРађРађРбђРаЄРАИРађРађРћѓ 
Рћѓ            РћѓРађРађРађРађРађРађРађРађРађРађРађРађРађРађРађРађРАцРацРацРацРацРацРацРацРбёРБђРацРаћРаіРаЅРањРбёРађРађРбђРајРађРбЄРађРађРћѓ 
Рћѓ            РћѓРађРађРађРађРађРађРађРађРАђРађРађРађРађРађРађРађРаўРАёРађРађРађРађРађРађРађРађРађРађРађРБђРАђРађРаЅРањРајРађРађРбИРађРађРћѓ 
Рћѓ            РћѓРАќРацРАђРађРађРађРбђРаюРбБРађРађРађРађРађРађРађРА░РаЂРађРађРађРађРБђРаћРањРањРањРањРаЅРађРаѕРб▒РађРађРађРађРађРАјРађРађРћѓ 
Рћѓ            РћѓРАЄРађРаѕРаЉРабРбцРаіРађРаИРАђРађРађРађРађРађРА░РаЂРађРађРађРађРаѕРабРБђРАаРацРАђРађРађРађРађРбЄРБђРађРађРађРб░РаЂРађРађРћѓ 
Рћѓ            РћѓРб▒РађРађРађРађРађРађРађРађРбЄРађРађРБђРБђРБђРАЄРађРађРађРађРађРађРађРађРађРађРа▒РАђРађРађРађРађРађРаЅРАєРађРбИРађРађРађРћѓ 
Рћѓ            РћѓРађРАЄРађРађРађРађРађРађРађРаѕРаЅРаЅРађРађРађРађРађРађРађРађРађРађРађРађРађРађРађРаЉРацРБђРађРађРађРаўРабРацРАјРађРађРађРћѓ 
Рћѓ            РћѓРађРаИРАаРабРбёРађРађРађРађРађРађРађРађРађРађРађРађРБђРАаРацРањРаіРаЅРбЄРађРађРађРађРађРађРб╣РађРађРађРађРађРађРађРађРађРћѓ 
Рћѓ            РћѓРађРађРађРађРађРаЅРабРбёРађРађРађРађРађРбђРацРаіРаЅРађРађРађРађРађРађРаѕРАєРађРађРађРБђРацРаџРађРађРађРађРађРађРађРађРађРћѓ 
Рћѓ          0 РћѓРађРађРађРађРађРађРађРађРаЅРањРбёРАаРањРаЂРађРађРађРађРађРађРађРађРађРађРаИРацРањРаЅРађРађРађРађРађРађРађРађРађРађРађРађРћѓ 
Рћѓ            РћћРћђРћђРћђРћђРћђРћђРћђРћђРћђРћђРћђРћђРћђРћђРћђРћђРћђРћђРћђРћђРћђРћђРћђРћђРћђРћђРћђРћђРћђРћђРћђРћђРћђРћђРћђРћђРћђРћђРћђРћђРћў 
Рћћ            0                                     8000
[ Info: Optimization finished; adaptively disallowed 22 cycles.
[ Info: Final path has length 10628.0.
Рћї Error: Exception while generating log record in module TravelingSalesmanExact at /home/pkgeval/.julia/packages/TravelingSalesmanExact/7TcDo/src/TravelingSalesmanExact.jl:235
Рћѓ   exception =
Рћѓ    type Model has no field variable_to_zero_one
Рћѓ    Stacktrace:
Рћѓ     [1] getproperty(::JuMP.Model, ::Symbol) at ./Base.jl:33
Рћѓ     [2] macro expansion at ./logging.jl:320 [inlined]
Рћѓ     [3] _get_optimal_tour(::Array{Int64,2}, ::JuMP.OptimizerFactory, ::Bool, ::Bool, ::Array{Any,1}) at /home/pkgeval/.julia/packages/TravelingSalesmanExact/7TcDo/src/TravelingSalesmanExact.jl:235
Рћѓ     [4] get_optimal_tour(::Array{Any,1}, ::JuMP.OptimizerFactory; verbose::Bool, distance::typeof(TravelingSalesmanExact.ATT), symmetric::Bool) at /home/pkgeval/.julia/packages/TravelingSalesmanExact/7TcDo/src/TravelingSalesmanExact.jl:153
Рћѓ     [5] test_tour(::Array{Any,1}, ::JuMP.OptimizerFactory; kwargs::Base.Iterators.Pairs{Symbol,Any,Tuple{Symbol,Symbol},NamedTuple{(:distance, :verbose),Tuple{typeof(TravelingSalesmanExact.ATT),Bool}}}) at /home/pkgeval/.julia/packages/TravelingSalesmanExact/7TcDo/test/runtests.jl:28
Рћѓ     [6] macro expansion at /home/pkgeval/.julia/packages/TravelingSalesmanExact/7TcDo/test/runtests.jl:40 [inlined]
Рћѓ     [7] macro expansion at /buildworker/worker/package_linux64/build/usr/share/julia/stdlib/v1.4/Test/src/Test.jl:1116 [inlined]
Рћѓ     [8] top-level scope at /home/pkgeval/.julia/packages/TravelingSalesmanExact/7TcDo/test/runtests.jl:39
Рћѓ     [9] include(::String) at ./client.jl:439
Рћѓ     [10] top-level scope at none:6
Рћѓ     [11] eval(::Module, ::Any) at ./boot.jl:331
Рћѓ     [12] exec_options(::Base.JLOptions) at ./client.jl:264
Рћѓ     [13] _start() at ./client.jl:484
Рћћ @ TravelingSalesmanExact ~/.julia/packages/TravelingSalesmanExact/7TcDo/src/TravelingSalesmanExact.jl:235
Test Summary: | Pass  Total
att48.tsp     |   10     10
[ Info: Starting optimization.
[ Info: Iteration 1 took 0.002s, disallowed 1 cycles.
[ Info: Optimization finished; adaptively disallowed 0 cycles.
[ Info: Final path has length 20.986832.
Рћї Error: Exception while generating log record in module TravelingSalesmanExact at /home/pkgeval/.julia/packages/TravelingSalesmanExact/7TcDo/src/TravelingSalesmanExact.jl:235
Рћѓ   exception =
Рћѓ    type Model has no field variable_to_zero_one
Рћѓ    Stacktrace:
Рћѓ     [1] getproperty(::JuMP.Model, ::Symbol) at ./Base.jl:33
Рћѓ     [2] macro expansion at ./logging.jl:320 [inlined]
Рћѓ     [3] _get_optimal_tour(::Array{Float64,2}, ::JuMP.OptimizerFactory, ::Bool, ::Bool, ::Nothing) at /home/pkgeval/.julia/packages/TravelingSalesmanExact/7TcDo/src/TravelingSalesmanExact.jl:235
Рћѓ     [4] _get_optimal_tour at /home/pkgeval/.julia/packages/TravelingSalesmanExact/7TcDo/src/TravelingSalesmanExact.jl:175 [inlined]
Рћѓ     [5] #get_optimal_tour#10 at /home/pkgeval/.julia/packages/TravelingSalesmanExact/7TcDo/src/TravelingSalesmanExact.jl:171 [inlined]
Рћѓ     [6] test_tour(::Array{Float64,2}, ::JuMP.OptimizerFactory; kwargs::Base.Iterators.Pairs{Symbol,Bool,Tuple{Symbol},NamedTuple{(:verbose,),Tuple{Bool}}}) at /home/pkgeval/.julia/packages/TravelingSalesmanExact/7TcDo/test/runtests.jl:28
Рћѓ     [7] macro expansion at /home/pkgeval/.julia/packages/TravelingSalesmanExact/7TcDo/test/runtests.jl:50 [inlined]
Рћѓ     [8] macro expansion at /buildworker/worker/package_linux64/build/usr/share/julia/stdlib/v1.4/Test/src/Test.jl:1116 [inlined]
Рћѓ     [9] top-level scope at /home/pkgeval/.julia/packages/TravelingSalesmanExact/7TcDo/test/runtests.jl:49
Рћѓ     [10] include(::String) at ./client.jl:439
Рћѓ     [11] top-level scope at none:6
Рћѓ     [12] eval(::Module, ::Any) at ./boot.jl:331
Рћѓ     [13] exec_options(::Base.JLOptions) at ./client.jl:264
Рћѓ     [14] _start() at ./client.jl:484
Рћћ @ TravelingSalesmanExact ~/.julia/packages/TravelingSalesmanExact/7TcDo/src/TravelingSalesmanExact.jl:235
Test Summary:           | Pass  Total
Small random asymmetric |   14     14
Test Summary:          | Pass  Total
Small random symmetric |   14     14
Test Summary:       | Pass  Total
Small random cities |   20     20
Test Summary: | Pass  Total
Exceptions    |    2      2
   Testing TravelingSalesmanExact tests passed 
