Julia Version 1.4.0
Commit b8e9a9ecc6 (2020-03-21 16:36 UTC)
Platform Info:
  OS: Linux (x86_64-linux-gnu)
  CPU: Intel(R) Xeon(R) Silver 4114 CPU @ 2.20GHz
  WORD_SIZE: 64
  LIBM: libopenlibm
  LLVM: libLLVM-8.0.1 (ORCJIT, skylake)
Environment:
  JULIA_DEPOT_PATH = ::/usr/local/share/julia
  JULIA_NUM_THREADS = 2

  Resolving package versions...
  Installed CompilerSupportLibraries_jll ─ v0.3.3+0
  Installed SortingAlgorithms ──────────── v0.3.1
  Installed DataValueInterfaces ────────── v1.0.0
  Installed Syslogs ────────────────────── v0.3.0
  Installed CategoricalArrays ──────────── v0.7.7
  Installed MLJScientificTypes ─────────── v0.2.3
  Installed PrettyTables ───────────────── v0.8.4
  Installed MLJBase ────────────────────── v0.12.6
  Installed Libiconv_jll ───────────────── v1.16.0+2
  Installed ComputationalResources ─────── v0.3.2
  Installed MLJModelInterface ──────────── v0.2.1
  Installed ExprTools ──────────────────── v0.1.0
  Installed IniFile ────────────────────── v0.5.0
  Installed Parameters ─────────────────── v0.12.0
  Installed Compat ─────────────────────── v3.8.0
  Installed Tables ─────────────────────── v1.0.3
  Installed FillArrays ─────────────────── v0.8.7
  Installed PDMats ─────────────────────── v0.9.12
  Installed LossFunctions ──────────────── v0.5.1
  Installed InvertedIndices ────────────── v1.0.0
  Installed Rmath ──────────────────────── v0.6.1
  Installed Mocking ────────────────────── v0.7.1
  Installed Crayons ────────────────────── v4.0.1
  Installed DataAPI ────────────────────── v1.1.0
  Installed QuadGK ─────────────────────── v2.3.1
  Installed Distributions ──────────────── v0.23.2
  Installed MbedTLS ────────────────────── v1.0.1
  Installed Memento ────────────────────── v1.0.0
  Installed JSON ───────────────────────── v0.21.0
  Installed ScientificTypes ────────────── v0.7.2
  Installed Rmath_jll ──────────────────── v0.2.2+0
  Installed RecipesBase ────────────────── v0.8.0
  Installed Missings ───────────────────── v0.4.3
  Installed OrderedCollections ─────────── v1.1.0
  Installed Zlib_jll ───────────────────── v1.2.11+9
  Installed SpecialFunctions ───────────── v0.10.0
  Installed ColorTypes ─────────────────── v0.10.0
  Installed TimeZones ──────────────────── v1.0.1
  Installed Reexport ───────────────────── v0.2.0
  Installed DataStructures ─────────────── v0.17.11
  Installed StatsBase ──────────────────── v0.33.0
  Installed Arpack ─────────────────────── v0.4.0
  Installed StatsFuns ──────────────────── v0.9.4
  Installed FilePathsBase ──────────────── v0.8.0
  Installed ProgressMeter ──────────────── v1.2.0
  Installed EzXML ──────────────────────── v1.1.0
  Installed IteratorInterfaceExtensions ── v1.0.0
  Installed HTTP ───────────────────────── v0.8.13
  Installed OpenBLAS_jll ───────────────── v0.3.9+2
  Installed Arpack_jll ─────────────────── v3.5.0+3
  Installed LearnBase ──────────────────── v0.3.0
  Installed JLSO ───────────────────────── v2.3.1
  Installed OpenSpecFun_jll ────────────── v0.5.3+3
  Installed Formatting ─────────────────── v0.4.1
  Installed FixedPointNumbers ──────────── v0.8.0
  Installed CodecZlib ──────────────────── v0.7.0
  Installed TranscodingStreams ─────────── v0.9.5
  Installed XML2_jll ───────────────────── v2.9.9+2
  Installed MbedTLS_jll ────────────────── v2.16.0+1
  Installed TableTraits ────────────────── v1.0.0
  Installed Parsers ────────────────────── v1.0.1
  Installed BSON ───────────────────────── v0.2.5
   Updating `~/.julia/environments/v1.4/Project.toml`
  [a7f614a8] + MLJBase v0.12.6
   Updating `~/.julia/environments/v1.4/Manifest.toml`
  [7d9fca2a] + Arpack v0.4.0
  [68821587] + Arpack_jll v3.5.0+3
  [fbb218c0] + BSON v0.2.5
  [324d7699] + CategoricalArrays v0.7.7
  [944b1d66] + CodecZlib v0.7.0
  [3da002f7] + ColorTypes v0.10.0
  [34da2185] + Compat v3.8.0
  [e66e0078] + CompilerSupportLibraries_jll v0.3.3+0
  [ed09eef8] + ComputationalResources v0.3.2
  [a8cc5b0e] + Crayons v4.0.1
  [9a962f9c] + DataAPI v1.1.0
  [864edb3b] + DataStructures v0.17.11
  [e2d170a0] + DataValueInterfaces v1.0.0
  [31c24e10] + Distributions v0.23.2
  [e2ba6199] + ExprTools v0.1.0
  [8f5d6c58] + EzXML v1.1.0
  [48062228] + FilePathsBase v0.8.0
  [1a297f60] + FillArrays v0.8.7
  [53c48c17] + FixedPointNumbers v0.8.0
  [59287772] + Formatting v0.4.1
  [cd3eb016] + HTTP v0.8.13
  [83e8ac13] + IniFile v0.5.0
  [41ab1584] + InvertedIndices v1.0.0
  [82899510] + IteratorInterfaceExtensions v1.0.0
  [9da8a3cd] + JLSO v2.3.1
  [682c06a0] + JSON v0.21.0
  [7f8f8fb0] + LearnBase v0.3.0
  [94ce4f54] + Libiconv_jll v1.16.0+2
  [30fc2ffe] + LossFunctions v0.5.1
  [a7f614a8] + MLJBase v0.12.6
  [e80e1ace] + MLJModelInterface v0.2.1
  [2e2323e0] + MLJScientificTypes v0.2.3
  [739be429] + MbedTLS v1.0.1
  [c8ffd9c3] + MbedTLS_jll v2.16.0+1
  [f28f55f0] + Memento v1.0.0
  [e1d29d7a] + Missings v0.4.3
  [78c3b35d] + Mocking v0.7.1
  [4536629a] + OpenBLAS_jll v0.3.9+2
  [efe28fd5] + OpenSpecFun_jll v0.5.3+3
  [bac558e1] + OrderedCollections v1.1.0
  [90014a1f] + PDMats v0.9.12
  [d96e819e] + Parameters v0.12.0
  [69de0a69] + Parsers v1.0.1
  [08abe8d2] + PrettyTables v0.8.4
  [92933f4c] + ProgressMeter v1.2.0
  [1fd47b50] + QuadGK v2.3.1
  [3cdcf5f2] + RecipesBase v0.8.0
  [189a3867] + Reexport v0.2.0
  [79098fc4] + Rmath v0.6.1
  [f50d1b31] + Rmath_jll v0.2.2+0
  [321657f4] + ScientificTypes v0.7.2
  [a2af1166] + SortingAlgorithms v0.3.1
  [276daf66] + SpecialFunctions v0.10.0
  [2913bbd2] + StatsBase v0.33.0
  [4c63d2b9] + StatsFuns v0.9.4
  [cea106d9] + Syslogs v0.3.0
  [3783bdb8] + TableTraits v1.0.0
  [bd369af6] + Tables v1.0.3
  [f269a46b] + TimeZones v1.0.1
  [3bb67fe8] + TranscodingStreams v0.9.5
  [02c8fc9c] + XML2_jll v2.9.9+2
  [83775a58] + Zlib_jll v1.2.11+9
  [2a0f44e3] + Base64 
  [ade2ca70] + Dates 
  [8bb1440f] + DelimitedFiles 
  [8ba89e20] + Distributed 
  [9fa8497b] + Future 
  [b77e0a4c] + InteractiveUtils 
  [76f85450] + LibGit2 
  [8f399da3] + Libdl 
  [37e2e46d] + LinearAlgebra 
  [56ddb016] + Logging 
  [d6f4376e] + Markdown 
  [a63ad114] + Mmap 
  [44cfe95a] + Pkg 
  [de0858da] + Printf 
  [3fa0cd96] + REPL 
  [9a3f8284] + Random 
  [ea8e919c] + SHA 
  [9e88b42a] + Serialization 
  [1a1011a3] + SharedArrays 
  [6462fe0b] + Sockets 
  [2f01184e] + SparseArrays 
  [10745b16] + Statistics 
  [4607b0f0] + SuiteSparse 
  [8dfed614] + Test 
  [cf7118a7] + UUIDs 
  [4ec0a83e] + Unicode 
   Building TimeZones → `~/.julia/packages/TimeZones/zymSN/deps/build.log`
    Testing MLJBase
Status `/tmp/jl_1JHnTy/Manifest.toml`
  [7d9fca2a] Arpack v0.4.0
  [68821587] Arpack_jll v3.5.0+3
  [fbb218c0] BSON v0.2.5
  [336ed68f] CSV v0.3.1
  [324d7699] CategoricalArrays v0.7.7
  [944b1d66] CodecZlib v0.7.0
  [3da002f7] ColorTypes v0.10.0
  [34da2185] Compat v3.8.0
  [e66e0078] CompilerSupportLibraries_jll v0.3.3+0
  [ed09eef8] ComputationalResources v0.3.2
  [a8cc5b0e] Crayons v4.0.1
  [9a962f9c] DataAPI v1.1.0
  [a93c6f00] DataFrames v0.20.2
  [9a8bc11e] DataStreams v0.4.2
  [864edb3b] DataStructures v0.17.11
  [e2d170a0] DataValueInterfaces v1.0.0
  [7806a523] DecisionTree v0.10.1
  [85a47980] Dictionaries v0.2.1
  [b4f34e82] Distances v0.8.2
  [31c24e10] Distributions v0.23.2
  [e2ba6199] ExprTools v0.1.0
  [8f5d6c58] EzXML v1.1.0
  [48062228] FilePathsBase v0.8.0
  [1a297f60] FillArrays v0.8.7
  [53c48c17] FixedPointNumbers v0.8.0
  [59287772] Formatting v0.4.1
  [cd3eb016] HTTP v0.8.13
  [313cdc1a] Indexing v1.1.0
  [83e8ac13] IniFile v0.5.0
  [7d512f48] InternedStrings v0.7.0
  [41ab1584] InvertedIndices v1.0.0
  [82899510] IteratorInterfaceExtensions v1.0.0
  [9da8a3cd] JLSO v2.3.1
  [682c06a0] JSON v0.21.0
  [7f8f8fb0] LearnBase v0.3.0
  [94ce4f54] Libiconv_jll v1.16.0+2
  [30fc2ffe] LossFunctions v0.5.1
  [a7f614a8] MLJBase v0.12.6
  [e80e1ace] MLJModelInterface v0.2.1
  [2e2323e0] MLJScientificTypes v0.2.3
  [739be429] MbedTLS v1.0.1
  [c8ffd9c3] MbedTLS_jll v2.16.0+1
  [f28f55f0] Memento v1.0.0
  [e1d29d7a] Missings v0.4.3
  [78c3b35d] Mocking v0.7.1
  [6f286f6a] MultivariateStats v0.7.0
  [b8a86587] NearestNeighbors v0.4.4
  [4536629a] OpenBLAS_jll v0.3.9+2
  [efe28fd5] OpenSpecFun_jll v0.5.3+3
  [bac558e1] OrderedCollections v1.1.0
  [90014a1f] PDMats v0.9.12
  [d96e819e] Parameters v0.12.0
  [69de0a69] Parsers v1.0.1
  [2dfb63ee] PooledArrays v0.5.3
  [08abe8d2] PrettyTables v0.8.4
  [92933f4c] ProgressMeter v1.2.0
  [1fd47b50] QuadGK v2.3.1
  [3cdcf5f2] RecipesBase v0.8.0
  [189a3867] Reexport v0.2.0
  [79098fc4] Rmath v0.6.1
  [f50d1b31] Rmath_jll v0.2.2+0
  [321657f4] ScientificTypes v0.7.2
  [6e75b9c4] ScikitLearnBase v0.5.0
  [a2af1166] SortingAlgorithms v0.3.1
  [276daf66] SpecialFunctions v0.10.0
  [03a91e81] SplitApplyCombine v1.0.0
  [90137ffa] StaticArrays v0.12.1
  [2913bbd2] StatsBase v0.33.0
  [4c63d2b9] StatsFuns v0.9.4
  [cea106d9] Syslogs v0.3.0
  [3783bdb8] TableTraits v1.0.0
  [bd369af6] Tables v1.0.3
  [f269a46b] TimeZones v1.0.1
  [3bb67fe8] TranscodingStreams v0.9.5
  [9d95f2ec] TypedTables v1.2.0
  [ea10d353] WeakRefStrings v0.5.8
  [02c8fc9c] XML2_jll v2.9.9+2
  [83775a58] Zlib_jll v1.2.11+9
  [2a0f44e3] Base64 
  [ade2ca70] Dates 
  [8bb1440f] DelimitedFiles 
  [8ba89e20] Distributed 
  [9fa8497b] Future 
  [b77e0a4c] InteractiveUtils 
  [76f85450] LibGit2 
  [8f399da3] Libdl 
  [37e2e46d] LinearAlgebra 
  [56ddb016] Logging 
  [d6f4376e] Markdown 
  [a63ad114] Mmap 
  [44cfe95a] Pkg 
  [de0858da] Printf 
  [3fa0cd96] REPL 
  [9a3f8284] Random 
  [ea8e919c] SHA 
  [9e88b42a] Serialization 
  [1a1011a3] SharedArrays 
  [6462fe0b] Sockets 
  [2f01184e] SparseArrays 
  [10745b16] Statistics 
  [4607b0f0] SuiteSparse 
  [8dfed614] Test 
  [cf7118a7] UUIDs 
  [4ec0a83e] Unicode 
[ Info: nprocs() = 41
[ Info: nthreads() = 2
Loading some models for testing...                                           Test Summary: | Pass  Total
misc          |   94     94
Test Summary: | Pass  Total
interface     |   78     78
Test Summary: | Pass  Total
measures      |  211    211
Progress:  17%|██████▉                                  |  ETA: 0:00:07[KProgress: 100%|█████████████████████████████████████████| Time: 0:00:01[K
Progress:  17%|██████▉                                  |  ETA: 0:00:20[KProgress:  50%|████████████████████▌                    |  ETA: 0:00:04[KProgress:  67%|███████████████████████████▁             |  ETA: 0:00:02[KProgress:  83%|██████████████████████████████████▁      |  ETA: 0:00:01[KProgress: 100%|█████████████████████████████████████████| Time: 0:00:04[K
Progress:  17%|██████▉                                  |  ETA: 0:00:02[KProgress:  50%|████████████████████▌                    |  ETA: 0:00:00[KProgress:  83%|██████████████████████████████████▁      |  ETA: 0:00:00[KProgress: 100%|█████████████████████████████████████████| Time: 0:00:00[K
[ Info: Updating [34mMachine{Resampler{Holdout,…}} @ 1…07[39m.
[ Info: Updating [34mMachine{Resampler{Holdout,…}} @ 8…56[39m.
[ Info: Updating [34mMachine{Resampler{Holdout,…}} @ 7…97[39m.
[ Info: Distributing evaluations among 40 workers.
[ Info: Creating subsamples from a subset of all rows. 
[ Info: Training [34mMachine{Resampler{CV,…}} @ 8…22[39m.
[ Info: Passing machine sample weights to any supported measures. 
[ Info: Training [34mMachine{Resampler{CV,…}} @ 9…72[39m.
[ Info: Creating subsamples from a subset of all rows. 
[ Info: Training [34mMachine{Resampler{CV,…}} @ 8…00[39m.
[ Info: Passing machine sample weights to any supported measures. 
[ Info: Training [34mMachine{Resampler{CV,…}} @ 1…73[39m.
[ Info: Creating subsamples from a subset of all rows. 
[ Info: Training [34mMachine{Resampler{CV,…}} @ 1…71[39m.
[ Info: Passing machine sample weights to any supported measures. 
[ Info: Training [34mMachine{Resampler{CV,…}} @ 6…05[39m.
Test Summary: | Pass  Total
resampling    |  125    125
Test Summary: | Pass  Total
data          |  121    121
[ Info: Training [34mMachine{ConstantClassifier} @ 1…89[39m.
[ Info: Training [34mMachine{ConstantClassifier} @ 8…30[39m.
[ Info: Training [34mNodalMachine{Scale} @ 3…01[39m.
[ Info: Training [34mMachine{DecisionTreeRegressor} @ 1…70[39m.
[ Info: Training [34mMachine{DecisionTreeRegressor} @ 1…55[39m.
[ Info: Training [34mMachine{DecisionTreeRegressor} @ 1…68[39m.
[ Info: Training [34mNodalMachine{FeatureSelector} @ 1…39[39m.
[ Info: Training [34mNodalMachine{FooBarRegressor} @ 7…91[39m.
[ Info: Training [34mNodalMachine{SimpleDeterministicCompositeModel{FooBarRegressor,…}} @ 3…24[39m.
[ Info: Training [34mNodalMachine{FeatureSelector} @ 1…78[39m.
[ Info: Training [34mNodalMachine{FooBarRegressor} @ 3…54[39m.
[ Info: Updating [34mNodalMachine{SimpleDeterministicCompositeModel{FooBarRegressor,…}} @ 3…24[39m.
[ Info: Updating [34mNodalMachine{FeatureSelector} @ 1…78[39m.
[ Info: Training [34mNodalMachine{FooBarRegressor} @ 3…54[39m.
[ Info: Training [34mNodalMachine{SimpleDeterministicCompositeModel{FooBarRegressor,…}} @ 3…24[39m.
[ Info: Training [34mNodalMachine{FeatureSelector} @ 5…25[39m.
[ Info: Training [34mNodalMachine{FooBarRegressor} @ 3…23[39m.
[ Info: Training [34mMachine{WrappedRidge} @ 1…40[39m.
[ Info: Training [34mNodalMachine{Standardizer} @ 9…45[39m.
[ Info: Training [34mNodalMachine{UnivariateBoxCoxTransformer} @ 1…62[39m.
[ Info: Training [34mNodalMachine{FooBarRegressor} @ 9…12[39m.
[ Info: Updating [34mMachine{WrappedRidge} @ 1…40[39m.
┌ Info: Not retraining [34mNodalMachine{Standardizer} @ 9…45[39m.
└  It appears up-to-date. Use `force=true` to force retraining.
┌ Info: Not retraining [34mNodalMachine{UnivariateBoxCoxTransformer} @ 1…62[39m.
└  It appears up-to-date. Use `force=true` to force retraining.
[ Info: Updating [34mNodalMachine{FooBarRegressor} @ 9…12[39m.
[ Info: Training [34mNodalMachine{OneHotEncoder} @ 1…00[39m.
[ Info: Spawning 3 sub-features to one-hot encode feature :x1.
[ Info: Training [34mNodalMachine{UnivariateStandardizer} @ 1…91[39m.
[ Info: Training [34mNodalMachine{KNNRegressor} @ 8…27[39m.
[ Info: Training [34mNodalMachine{DecisionTreeRegressor} @ 1…43[39m.
train_args = Source{:input}[[34mSource{:input} @ 3…85[39m]
mach.model = [34mOneHotEncoder @ 4…87[39m
train_args = Node{Nothing}[[34mNode{Nothing} @ 6…54[39m]
mach.model = UnivariateStandardizer @ 2…60
train_args = Node[[34mNode{NodalMachine{OneHotEncoder}} @ 8…20[39m, [34mNode{NodalMachine{UnivariateStandardizer}} @ 6…84[39m]
mach.model = [34mKNNRegressor @ 1…46[39m
train_args = Node[[34mNode{NodalMachine{OneHotEncoder}} @ 8…20[39m, [34mNode{NodalMachine{UnivariateStandardizer}} @ 6…84[39m]
mach.model = [34mDecisionTreeRegressor @ 1…74[39m
train_args = Source{:input}[[34mSource{:input} @ 1…22[39m]
mach.model = [34mOneHotEncoder @ 4…87[39m
train_args = Node{Nothing}[[34mNode{Nothing} @ 1…88[39m]
mach.model = UnivariateStandardizer @ 1…18
train_args = Node[[34mNode{NodalMachine{OneHotEncoder}} @ 1…85[39m, [34mNode{NodalMachine{UnivariateStandardizer}} @ 4…39[39m]
mach.model = [34mKNNRegressor @ 1…46[39m
train_args = Node[[34mNode{NodalMachine{OneHotEncoder}} @ 1…85[39m, [34mNode{NodalMachine{UnivariateStandardizer}} @ 4…39[39m]
mach.model = [34mDecisionTreeRegressor @ 2…13[39m
train_args = Source{:input}[[34mSource{:input} @ 1…14[39m]
mach.model = [34mOneHotEncoder @ 7…42[39m
train_args = Node{Nothing}[[34mNode{Nothing} @ 1…56[39m]
mach.model = UnivariateStandardizer @ 1…05
train_args = Node[[34mNode{NodalMachine{OneHotEncoder}} @ 1…51[39m, [34mNode{NodalMachine{UnivariateStandardizer}} @ 1…62[39m]
mach.model = [34mKNNRegressor @ 1…30[39m
train_args = Node[[34mNode{NodalMachine{OneHotEncoder}} @ 1…51[39m, [34mNode{NodalMachine{UnivariateStandardizer}} @ 1…62[39m]
mach.model = [34mDecisionTreeRegressor @ 4…32[39m
train_args = Source{:input}[[34mSource{:input} @ 1…56[39m]
mach.model = [34mOneHotEncoder @ 8…61[39m
train_args = Node{NodalMachine{OneHotEncoder}}[[34mNode{NodalMachine{OneHotEncoder}} @ 7…46[39m]
mach.model = [34mStandardizer @ 2…08[39m
[ Info: Training [34mNodalMachine{Standardizer} @ 1…18[39m.
[ Info: Training [34mNodalMachine{ConstantClassifier} @ 5…56[39m.
[ Info: Training [34mNodalMachine{Standardizer} @ 1…18[39m.
[ Info: Training [34mNodalMachine{ConstantClassifier} @ 5…56[39m.
[ Info: Training [34mMachine{Composite3} @ 2…73[39m.
train_args = Source{:input}[[34mSource{:input} @ 1…65[39m]
mach.model = [34mStandardizer @ 5…31[39m
train_args = AbstractNode[[34mNode{NodalMachine{Standardizer}} @ 1…44[39m, [34mSource{:target} @ 1…39[39m, [34mSource{:weights} @ 9…32[39m]
mach.model = ConstantClassifier @ 3…26
[ Info: Training [34mNodalMachine{Standardizer} @ 6…93[39m.
[ Info: Training [34mNodalMachine{ConstantClassifier} @ 5…40[39m.
[ Info: Training [34mMachine{Composite3} @ 9…50[39m.
train_args = Source{:input}[[34mSource{:input} @ 6…42[39m]
mach.model = [34mStandardizer @ 3…39[39m
train_args = AbstractNode[[34mNode{NodalMachine{Standardizer}} @ 8…86[39m, [34mSource{:target} @ 4…82[39m, [34mSource{:weights} @ 1…58[39m]
mach.model = ConstantClassifier @ 3…26
[ Info: Training [34mNodalMachine{Standardizer} @ 6…54[39m.
[ Info: Training [34mNodalMachine{ConstantClassifier} @ 7…64[39m.
[ Info: Training [34mMachine{CompositeWithNoFields} @ 1…00[39m.
train_args = Source{:input}[[34mSource{:input} @ 1…11[39m]
mach.model = [34mStandardizer @ 6…89[39m
train_args = AbstractNode[[34mNode{NodalMachine{Standardizer}} @ 1…04[39m, [34mSource{:target} @ 1…71[39m, [34mSource{:weights} @ 1…83[39m]
mach.model = ConstantClassifier @ 3…26
[ Info: Training [34mNodalMachine{Standardizer} @ 4…85[39m.
[ Info: Training [34mNodalMachine{ConstantClassifier} @ 1…27[39m.
[ Info: Training [34mNodalMachine{FeatureSelector} @ 1…86[39m.
[ Info: Training [34mNodalMachine{UnivariateStandardizer} @ 5…66[39m.
[ Info: Training [34mNodalMachine{KNNRegressor} @ 8…19[39m.
[ Info: Training [34mNodalMachine{FeatureSelector} @ 1…99[39m.
[ Info: Training [34mNodalMachine{UnivariateStandardizer} @ 4…58[39m.
[ Info: Training [34mNodalMachine{KNNRegressor} @ 7…86[39m.
[ Info: Updating [34mNodalMachine{FeatureSelector} @ 1…86[39m.
┌ Info: Not retraining [34mNodalMachine{UnivariateStandardizer} @ 5…66[39m.
└  It appears up-to-date. Use `force=true` to force retraining.
[ Info: Training [34mNodalMachine{KNNRegressor} @ 8…19[39m.
[ Info: Updating [34mNodalMachine{FeatureSelector} @ 1…99[39m.
┌ Info: Not retraining [34mNodalMachine{UnivariateStandardizer} @ 4…58[39m.
└  It appears up-to-date. Use `force=true` to force retraining.
[ Info: Training [34mNodalMachine{KNNRegressor} @ 7…86[39m.
[ Info: Training [34mMachine{Pipe} @ 9…21[39m.
train_args = Source{:input}[[34mSource{:input} @ 9…40[39m]
mach.model = [34mFeatureSelector @ 6…80[39m
train_args = Source{:target}[[34mSource{:target} @ 8…55[39m]
mach.model = UnivariateStandardizer @ 1…51
train_args = AbstractNode[[34mNode{NodalMachine{FeatureSelector}} @ 2…78[39m, [34mNode{NodalMachine{UnivariateStandardizer}} @ 1…15[39m, [34mSource{:weights} @ 9…76[39m]
mach.model = [34mKNNRegressor @ 1…98[39m
[ Info: Training [34mNodalMachine{FeatureSelector} @ 1…10[39m.
[ Info: Training [34mNodalMachine{UnivariateStandardizer} @ 1…47[39m.
[ Info: Training [34mNodalMachine{KNNRegressor} @ 1…67[39m.
[ Info: Training [34mMachine{Pipe21} @ 1…58[39m.
train_args = Source{:input}[[34mSource{:input} @ 7…28[39m]
mach.model = [34mOneHotEncoder @ 1…35[39m
train_args = AbstractNode[[34mNode{NodalMachine{OneHotEncoder}} @ 1…96[39m, [34mSource{:target} @ 1…16[39m, [34mSource{:weights} @ 5…98[39m]
mach.model = ConstantClassifier @ 3…26
[ Info: Training [34mNodalMachine{OneHotEncoder} @ 7…25[39m.
[ Info: Training [34mNodalMachine{ConstantClassifier} @ 5…27[39m.
[ Info: Training [34mMachine{Piper3} @ 2…59[39m.
train_args = Source{:input}[[34mSource{:input} @ 1…54[39m]
mach.model = [34mOneHotEncoder @ 1…12[39m
train_args = AbstractNode[[34mNode{NodalMachine{OneHotEncoder}} @ 1…47[39m, [34mSource{:target} @ 4…10[39m, [34mSource{:weights} @ 8…48[39m]
mach.model = ConstantClassifier @ 3…26
[ Info: Training [34mNodalMachine{OneHotEncoder} @ 4…67[39m.
[ Info: Training [34mNodalMachine{ConstantClassifier} @ 1…88[39m.
[ Info: Training [34mMachine{Piper3} @ 1…71[39m.
train_args = Source{:input}[[34mSource{:input} @ 1…07[39m]
mach.model = [34mOneHotEncoder @ 1…12[39m
train_args = AbstractNode[[34mNode{NodalMachine{OneHotEncoder}} @ 8…85[39m, [34mSource{:target} @ 1…12[39m, [34mSource{:weights} @ 3…87[39m]
mach.model = ConstantClassifier @ 3…26
[ Info: Training [34mNodalMachine{OneHotEncoder} @ 1…80[39m.
[ Info: Training [34mNodalMachine{ConstantClassifier} @ 3…44[39m.
[ Info: Training [34mNodalMachine{OneHotEncoder} @ 6…56[39m.
[ Info: Spawning 3 sub-features to one-hot encode feature :x3.
[ Info: Training [34mNodalMachine{FeatureSelector} @ 1…48[39m.
[ Info: Training [34mNodalMachine{KNNRegressor} @ 8…28[39m.
[ Info: Training [34mMachine{Pipe4} @ 2…39[39m.
train_args = Source{:input}[[34mSource{:input} @ 3…80[39m]
mach.model = [34mOneHotEncoder @ 2…84[39m
train_args = Node{NodalMachine{OneHotEncoder}}[[34mNode{NodalMachine{OneHotEncoder}} @ 1…56[39m]
mach.model = [34mFeatureSelector @ 1…98[39m
train_args = Source{:target}[[34mSource{:target} @ 1…49[39m]
mach.model = [34mStaticTransformer @ 1…97[39m
train_args = AbstractNode[[34mNode{NodalMachine{FeatureSelector}} @ 1…31[39m, [34mNode{NodalMachine{StaticTransformer}} @ 1…90[39m, [34mSource{:weights} @ 5…46[39m]
mach.model = [34mKNNRegressor @ 1…99[39m
train_args = Node{NodalMachine{KNNRegressor}}[[34mNode{NodalMachine{KNNRegressor}} @ 9…47[39m]
mach.model = [34mStaticTransformer @ 1…29[39m
[ Info: Training [34mNodalMachine{OneHotEncoder} @ 1…58[39m.
[ Info: Spawning 3 sub-features to one-hot encode feature :x3.
[ Info: Training [34mNodalMachine{FeatureSelector} @ 1…54[39m.
[ Info: Training [34mNodalMachine{StaticTransformer} @ 7…45[39m.
[ Info: Training [34mNodalMachine{KNNRegressor} @ 1…33[39m.
[ Info: Training [34mNodalMachine{StaticTransformer} @ 9…46[39m.
[ Info: Training [34mMachine{Pipe9} @ 7…19[39m.
train_args = Node{Nothing}[[34mNode{Nothing} @ 5…59[39m]
mach.model = [34mOneHotEncoder @ 6…42[39m
train_args = Source{:target}[[34mSource{:target} @ 7…35[39m]
mach.model = UnivariateStandardizer @ 4…56
train_args = AbstractNode[[34mNode{NodalMachine{OneHotEncoder}} @ 7…79[39m, [34mNode{NodalMachine{UnivariateStandardizer}} @ 1…98[39m, [34mSource{:weights} @ 4…38[39m]
mach.model = [34mKNNRegressor @ 1…00[39m
[ Info: Training [34mNodalMachine{OneHotEncoder} @ 1…69[39m.
[ Info: Spawning 2 sub-features to one-hot encode feature :gender.
[ Info: Training [34mNodalMachine{UnivariateStandardizer} @ 1…62[39m.
[ Info: Training [34mNodalMachine{KNNRegressor} @ 9…49[39m.
[ Info: Training [34mMachine{Pipe99} @ 1…49[39m.
train_args = Node{Nothing}[[34mNode{Nothing} @ 3…27[39m]
mach.model = [34mOneHotEncoder @ 1…78[39m
train_args = Node{NodalMachine{OneHotEncoder}}[[34mNode{NodalMachine{OneHotEncoder}} @ 1…07[39m]
mach.model = [34mMyTransformer @ 1…46[39m
[ Info: Training [34mNodalMachine{OneHotEncoder} @ 8…61[39m.
[ Info: Spawning 2 sub-features to one-hot encode feature :gender.
[ Info: Training [34mNodalMachine{MyTransformer} @ 2…60[39m.
┌ Info: Not retraining [34mNodalMachine{KNNRegressor} @ 8…45[39m.
└  It appears up-to-date. Use `force=true` to force retraining.
[ Info: Training [34mMachine{KNNRegressor} @ 1…28[39m.
[ Info: Training [34mNodalMachine{MyTransformer1} @ 1…27[39m.
train_args = Node{Nothing}[[34mNode{Nothing} @ 7…11[39m]
mach.model = [34mStandardizer @ 1…44[39m
train_args = Source{:target}[[34mSource{:target} @ 2…26[39m]
mach.model = [34mUnivariateBoxCoxTransformer @ 9…54[39m
train_args = AbstractNode[[34mNode{NodalMachine{Standardizer}} @ 8…43[39m, [34mNode{NodalMachine{UnivariateBoxCoxTransformer}} @ 1…97[39m, [34mSource{:weights} @ 1…75[39m]
mach.model = [34mKNNRegressor @ 1…11[39m
train_args = Source{:input}[[34mSource{:input} @ 1…27[39m]
mach.model = [34mMyTransformer @ 1…47[39m
train_args = Node{NodalMachine{Main.TestLearningNetworks.MyTransformer}}[[34mNode{NodalMachine{MyTransformer}} @ 1…80[39m]
mach.model = [34mStandardizer @ 8…27[39m
train_args = Source{:target}[[34mSource{:target} @ 1…86[39m]
mach.model = [34mUnivariateBoxCoxTransformer @ 4…18[39m
train_args = AbstractNode[[34mNode{NodalMachine{Standardizer}} @ 9…16[39m, [34mNode{NodalMachine{UnivariateBoxCoxTransformer}} @ 1…48[39m, [34mSource{:weights} @ 9…90[39m]
mach.model = [34mKNNRegressor @ 1…14[39m
train_args = Node{Nothing}[[34mNode{Nothing} @ 1…50[39m]
mach.model = [34mStandardizer @ 1…61[39m
train_args = Source{:target}[[34mSource{:target} @ 3…04[39m]
mach.model = [34mUnivariateBoxCoxTransformer @ 5…65[39m
train_args = Node[[34mNode{NodalMachine{Standardizer}} @ 1…95[39m, [34mNode{NodalMachine{UnivariateBoxCoxTransformer}} @ 1…48[39m]
mach.model = [34mKNNRegressor @ 1…76[39m
train_args = Union{}[]
mach.model = [34mMyTransformer @ 3…86[39m
train_args = Node{NodalMachine{Main.TestLearningNetworks.MyTransformer}}[[34mNode{NodalMachine{MyTransformer}} @ 1…18[39m]
mach.model = [34mStandardizer @ 1…33[39m
train_args = Source{:target}[[34mSource{:target} @ 1…49[39m]
mach.model = [34mUnivariateBoxCoxTransformer @ 1…64[39m
train_args = Node[[34mNode{NodalMachine{Standardizer}} @ 7…46[39m, [34mNode{NodalMachine{UnivariateBoxCoxTransformer}} @ 5…79[39m]
mach.model = [34mKNNRegressor @ 1…31[39m
[ Info: Training [34mNodalMachine{KNNRegressor} @ 1…91[39m.
[ Info: Training [34mNodalMachine{Standardizer} @ 6…19[39m.
[ Info: Training [34mNodalMachine{UnivariateBoxCoxTransformer} @ 3…85[39m.
[ Info: Training [34mNodalMachine{RidgeRegressor} @ 1…91[39m.
┌ Info: Not retraining [34mNodalMachine{Standardizer} @ 6…19[39m.
└  It appears up-to-date. Use `force=true` to force retraining.
┌ Info: Not retraining [34mNodalMachine{UnivariateBoxCoxTransformer} @ 3…85[39m.
└  It appears up-to-date. Use `force=true` to force retraining.
[ Info: Updating [34mNodalMachine{RidgeRegressor} @ 1…91[39m.
[ Info: Training [34mNodalMachine{Standardizer} @ 1…04[39m.
[ Info: Training [34mNodalMachine{PCA} @ 9…01[39m.
┌ Info: Not retraining [34mNodalMachine{Standardizer} @ 1…04[39m.
└  It appears up-to-date. Use `force=true` to force retraining.
┌ Info: Not retraining [34mNodalMachine{PCA} @ 9…01[39m.
└  It appears up-to-date. Use `force=true` to force retraining.
[ Info: Training [34mNodalMachine{RidgeRegressor} @ 2…88[39m.
[ Info: Training [34mNodalMachine{Standardizer} @ 1…48[39m.
[ Info: Training [34mNodalMachine{PCA} @ 2…96[39m.
[ Info: Training [34mNodalMachine{RidgeRegressor} @ 1…11[39m.
[ Info: Training [34mNodalMachine{Standardizer} @ 1…48[39m.
[ Info: Training [34mNodalMachine{PCA} @ 1…40[39m.
[ Info: Training [34mNodalMachine{UnivariateBoxCoxTransformer} @ 1…25[39m.
[ Info: Training [34mNodalMachine{RidgeRegressor} @ 9…94[39m.
[ Info: Training [34mNodalMachine{DecisionTreeRegressor} @ 1…61[39m.
[ Info: Training [34mNodalMachine{DecisionTreeRegressor} @ 1…98[39m.
[ Info: Training [34mNodalMachine{Standardizer} @ 7…89[39m.
[ Info: Training [34mNodalMachine{UnivariateBoxCoxTransformer} @ 2…88[39m.
[ Info: Training [34mNodalMachine{KNNRegressor} @ 9…25[39m.
[ Info: Training [34mNodalMachine{MyTransformer} @ 9…21[39m.
[ Info: Training [34mNodalMachine{Standardizer} @ 3…40[39m.
[ Info: Training [34mNodalMachine{UnivariateBoxCoxTransformer} @ 2…66[39m.
[ Info: Training [34mNodalMachine{KNNRegressor} @ 1…43[39m.
Test Summary:        | Pass  Total
machines+composition |  293    293
Test Summary: | Pass  Total
hyperparam    |  118    118
Test Summary: | Pass  Total
openml        |   15     15
┌ Warning: Forcibly interrupting busy workers
│   exception = rmprocs: pids [2, 3, 4, 5, 6, 7, 9, 10, 11, 12, 13, 14, 15, 16, 17, 18, 19, 20, 21, 22, 23, 24, 25, 26, 27, 28, 29, 30, 31, 32, 33, 34, 35, 36, 37, 38, 39, 40, 41] not terminated after 5.0 seconds.
└ @ Distributed /workspace/srcdir/usr/share/julia/stdlib/v1.4/Distributed/src/cluster.jl:1219
┌ Warning: rmprocs: process 1 not removed
└ @ Distributed /workspace/srcdir/usr/share/julia/stdlib/v1.4/Distributed/src/cluster.jl:1015
    Testing MLJBase tests passed 
