Current time is 2020-10-27T05:26:17.958
Julia Version 1.6.0-DEV.1331
Commit bac321d949 (2020-10-25 22:53 UTC)
Platform Info:
  OS: Linux (x86_64-pc-linux-gnu)
  CPU: AMD EPYC 7502 32-Core Processor
  WORD_SIZE: 64
  LIBM: libopenlibm
  LLVM: libLLVM-11.0.0 (ORCJIT, znver2)
Environment:
  JULIA_DEPOT_PATH = ::/usr/local/share/julia
  JULIA_NUM_THREADS = 2
  JULIA_MAX_NUM_PRECOMPILE_FILES = 9223372036854775807
  JULIA_PKG_SERVER = 

Starting installation at 2020-10-27T05:26:19.246
   Resolving package versions...
   Installed Missings ─────────── v0.4.4
   Installed Compat ───────────── v3.22.0
   Installed StatsBase ────────── v0.33.2
   Installed DataStructures ───── v0.18.8
   Installed DataAPI ──────────── v1.3.0
     Cloning [a2af1166-a08f-5f64-846c-94a0d3cef48c] SortingAlgorithms from https://github.com/JuliaCollections/SortingAlgorithms.jl.git
[?25l    Fetching: [>                                        ]  0.0 %[2K[?25h   Installed SortingAlgorithms ── v0.3.1
     Cloning [1520ce14-60c1-5f80-bbc7-55ef81b5835c] AbstractTrees from https://github.com/JuliaCollections/AbstractTrees.jl.git
[?25l    Fetching: [>                                        ]  0.0 %[2K[?25h   Installed AbstractTrees ────── v0.3.3
     Cloning [bac558e1-5e72-5ebc-8fee-abe8a469f55d] OrderedCollections from https://github.com/JuliaCollections/OrderedCollections.jl.git
[?25l    Fetching: [>                                        ]  0.0 %[2K[?25h   Installed OrderedCollections ─ v1.3.1
     Cloning [925886fa-5bf2-5e8e-b522-a9147a512338] OnlineStatsBase from https://github.com/joshday/OnlineStatsBase.jl.git
[?25l    Fetching: [>                                        ]  0.0 %[2K[?25h   Installed OnlineStatsBase ──── v1.4.4
Updating `~/.julia/environments/v1.6/Project.toml`
  [925886fa] + OnlineStatsBase v1.4.4
Updating `~/.julia/environments/v1.6/Manifest.toml`
  [1520ce14] + AbstractTrees v0.3.3
  [34da2185] + Compat v3.22.0
  [9a962f9c] + DataAPI v1.3.0
  [864edb3b] + DataStructures v0.18.8
  [e1d29d7a] + Missings v0.4.4
  [925886fa] + OnlineStatsBase v1.4.4
  [bac558e1] + OrderedCollections v1.3.1
  [a2af1166] + SortingAlgorithms v0.3.1
  [2913bbd2] + StatsBase v0.33.2
  [0dad84c5] + ArgTools
  [56f22d72] + Artifacts
  [2a0f44e3] + Base64
  [ade2ca70] + Dates
  [8bb1440f] + DelimitedFiles
  [8ba89e20] + Distributed
  [f43a241f] + Downloads
  [b77e0a4c] + InteractiveUtils
  [b27032c2] + LibCURL
  [76f85450] + LibGit2
  [8f399da3] + Libdl
  [37e2e46d] + LinearAlgebra
  [56ddb016] + Logging
  [d6f4376e] + Markdown
  [a63ad114] + Mmap
  [44cfe95a] + Pkg
  [de0858da] + Printf
  [3fa0cd96] + REPL
  [9a3f8284] + Random
  [ea8e919c] + SHA
  [9e88b42a] + Serialization
  [1a1011a3] + SharedArrays
  [6462fe0b] + Sockets
  [2f01184e] + SparseArrays
  [10745b16] + Statistics
  [fa267f1f] + TOML
  [8dfed614] + Test
  [cf7118a7] + UUIDs
  [4ec0a83e] + Unicode
  [deac9b47] + LibCURL_jll
  [14a3606d] + MozillaCACerts_jll
Precompiling project... (tip: to disable auto-precompilation set ENV["JULIA_PKG_PRECOMPILE_AUTO"]=0)
[32m  ✓ [39m[90mDataAPI[39m
[32m  ✓ [39m[90mOrderedCollections[39m
[32m  ✓ [39m[90mAbstractTrees[39m
[32m  ✓ [39m[90mCompat[39m
[32m  ✓ [39m[90mMissings[39m
[32m  ✓ [39m[90mDataStructures[39m
[32m  ✓ [39m[90mSortingAlgorithms[39m
[32m  ✓ [39m[90mStatsBase[39m
[32m  ✓ [39mOnlineStatsBase
9 dependencies successfully precompiled
Starting tests at 2020-10-27T05:28:42.522
     Testing OnlineStatsBase
Status `/tmp/jl_F9G87Z/Project.toml`
  [1520ce14] AbstractTrees v0.3.3
  [925886fa] OnlineStatsBase v1.4.4
  [bac558e1] OrderedCollections v1.3.1
  [2913bbd2] StatsBase v0.33.2
  [ade2ca70] Dates
  [37e2e46d] LinearAlgebra
  [10745b16] Statistics
  [8dfed614] Test
Status `/tmp/jl_F9G87Z/Manifest.toml`
  [1520ce14] AbstractTrees v0.3.3
  [34da2185] Compat v3.22.0
  [9a962f9c] DataAPI v1.3.0
  [864edb3b] DataStructures v0.18.8
  [e1d29d7a] Missings v0.4.4
  [925886fa] OnlineStatsBase v1.4.4
  [bac558e1] OrderedCollections v1.3.1
  [a2af1166] SortingAlgorithms v0.3.1
  [2913bbd2] StatsBase v0.33.2
  [0dad84c5] ArgTools
  [56f22d72] Artifacts
  [2a0f44e3] Base64
  [ade2ca70] Dates
  [8bb1440f] DelimitedFiles
  [8ba89e20] Distributed
  [f43a241f] Downloads
  [b77e0a4c] InteractiveUtils
  [b27032c2] LibCURL
  [76f85450] LibGit2
  [8f399da3] Libdl
  [37e2e46d] LinearAlgebra
  [56ddb016] Logging
  [d6f4376e] Markdown
  [a63ad114] Mmap
  [44cfe95a] Pkg
  [de0858da] Printf
  [3fa0cd96] REPL
  [9a3f8284] Random
  [ea8e919c] SHA
  [9e88b42a] Serialization
  [1a1011a3] SharedArrays
  [6462fe0b] Sockets
  [2f01184e] SparseArrays
  [10745b16] Statistics
  [fa267f1f] TOML
  [8dfed614] Test
  [cf7118a7] UUIDs
  [4ec0a83e] Unicode
  [deac9b47] LibCURL_jll
  [14a3606d] MozillaCACerts_jll
     Testing Running tests...
  > Counter
  > CountMap
┌ Warning: `sort(d::Dict; args...)` is deprecated, use `sort!(OrderedDict(d); args...)` instead.
│   caller = macro expansion at test_stats.jl:41 [inlined]
└ @ Core ~/.julia/packages/OnlineStatsBase/OqLB6/test/test_stats.jl:41
┌ Warning: `sort(d::Dict; args...)` is deprecated, use `sort!(OrderedDict(d); args...)` instead.
│   caller = macro expansion at test_stats.jl:51 [inlined]
└ @ Core ~/.julia/packages/OnlineStatsBase/OqLB6/test/test_stats.jl:51
  > CountMissing
  > CovMatrix
  > Extrema
  > Group
  > GroupBy
  > Mean
  > Moments
  > Series/FTSeries
  > Sum
  > Variance
Test Summary: | Pass  Total
Testing Stats |  157    157
┌ Warning: Merging Variance{Float64, Float64, EqualWeight} into Mean{Float64, EqualWeight} is not well-defined.  No merging occurred.
└ @ OnlineStatsBase ~/.julia/packages/OnlineStatsBase/OqLB6/src/OnlineStatsBase.jl:80
Test Summary: | Pass  Total
Random Stuff  |    8      8
Test Summary: | Pass  Total
Broadcasting  |    3      3
  > EqualWeight
  > ExponentialWeight(λ = 0.1)
  > LearningRate(r = 0.6)
  > LearningRate2(c = 0.5)
  > HarmonicWeight(a = 4.0)
Test Summary: | Pass  Total
Weight        |  210    210
     Testing OnlineStatsBase tests passed 
Finished at 2020-10-27T05:29:11.603
