Current time is 2020-10-27T04:22:06.452
Julia Version 1.6.0-DEV.1331
Commit bac321d949 (2020-10-25 22:53 UTC)
Platform Info:
  OS: Linux (x86_64-pc-linux-gnu)
  CPU: AMD EPYC 7502 32-Core Processor
  WORD_SIZE: 64
  LIBM: libopenlibm
  LLVM: libLLVM-11.0.0 (ORCJIT, znver2)
Environment:
  JULIA_DEPOT_PATH = ::/usr/local/share/julia
  JULIA_NUM_THREADS = 2
  JULIA_MAX_NUM_PRECOMPILE_FILES = 9223372036854775807
  JULIA_PKG_SERVER = 

Starting installation at 2020-10-27T04:22:07.844
   Resolving package versions...
   Installed IniFile ──────────────── v0.5.0
   Installed Compat ───────────────── v3.22.0
   Installed AbstractFFTs ─────────── v0.4.1
   Installed FillArrays ───────────── v0.8.14
   Installed DiffEqDiffTools ──────── v1.7.0
   Installed ForwardDiff ──────────── v0.10.12
   Installed Dolang ───────────────── v3.1.2
   Installed ZipFile ──────────────── v0.9.3
   Installed VersionParsing ───────── v1.2.0
   Installed CodecBzip2 ───────────── v0.7.2
   Installed SymEngine ────────────── v0.8.2
   Installed MathProgBase ─────────── v0.7.8
   Installed Dolo ─────────────────── v0.4.1
   Installed Polynomials ──────────── v0.5.2
   Installed Reexport ─────────────── v0.2.0
   Installed JSON ─────────────────── v0.21.1
   Installed IterativeSolvers ─────── v0.8.4
   Installed MbedTLS ──────────────── v1.0.2
   Installed Bzip2_jll ────────────── v1.0.6+5
   Installed ArrayInterface ───────── v2.13.7
   Installed StringDistances ──────── v0.8.0
   Installed IntervalSets ─────────── v0.5.1
   Installed Missings ─────────────── v0.4.4
   Installed Parameters ───────────── v0.12.1
   Installed LineSearches ─────────── v7.1.0
   Installed MathOptInterface ─────── v0.9.17
   Installed NLSolversBase ────────── v7.5.0
   Installed Requires ─────────────── v1.1.0
   Installed MPFR_jll ─────────────── v4.1.0+1
   Installed SpecialFunctions ─────── v0.8.0
   Installed BinaryProvider ───────── v0.5.10
   Installed BinDeps ──────────────── v1.0.1
   Installed Distributions ────────── v0.23.8
   Installed EllipsisNotation ─────── v0.4.0
   Installed PDMats ───────────────── v0.10.1
   Installed DSP ──────────────────── v0.6.0
   Installed MutableArithmetics ───── v0.2.10
   Installed DataAPI ──────────────── v1.3.0
   Installed Zlib_jll ─────────────── v1.2.11+18
   Installed FFTW ─────────────────── v1.0.1
   Installed IterTools ────────────── v1.3.0
   Installed JLLWrappers ──────────── v1.1.3
   Installed MacroTools ───────────── v0.5.6
   Installed NLopt_jll ────────────── v2.6.2+0
   Installed RangeArrays ──────────── v0.3.2
   Installed NLopt ────────────────── v0.6.1
   Installed DiffRules ────────────── v1.0.1
   Installed Optim ────────────────── v0.22.0
   Installed NaNMath ──────────────── v0.3.4
   Installed JSONSchema ───────────── v0.3.2
   Installed NLsolve ──────────────── v4.4.1
   Installed BenchmarkTools ───────── v0.5.0
   Installed Parsers ──────────────── v1.0.11
   Installed StaticArrays ─────────── v0.12.4
   Installed YAML ─────────────────── v0.4.2
   Installed MPC_jll ──────────────── v1.1.0+0
   Installed SortingAlgorithms ────── v0.3.1
   Installed Calculus ─────────────── v0.5.1
   Installed QuantEcon ────────────── v0.16.2
   Installed BasisMatrices ────────── v0.6.0
   Installed DataStructures ───────── v0.18.8
   Installed Rmath ────────────────── v0.6.1
   Installed StatsBase ────────────── v0.33.2
   Installed MbedTLS_jll ──────────── v2.16.8+0
   Installed ArnoldiMethod ────────── v0.0.4
   Installed Distances ────────────── v0.9.2
   Installed QuadGK ───────────────── v2.4.1
   Installed Inflate ──────────────── v0.1.2
   Installed SymEngine_jll ────────── v0.6.0+1
   Installed OrderedCollections ───── v1.3.1
   Installed UnPack ───────────────── v1.0.2
   Installed Conda ────────────────── v1.4.1
   Installed CodecZlib ────────────── v0.7.0
   Installed LightGraphs ──────────── v1.3.0
   Installed RecipesBase ──────────── v1.1.0
   Installed Combinatorics ────────── v0.7.0
   Installed DiffResults ──────────── v1.0.2
   Installed StatsFuns ────────────── v0.9.5
   Installed PositiveFactorizations ─ v0.2.3
   Installed URIParser ────────────── v0.4.1
   Installed HTTP ─────────────────── v0.8.19
   Installed Rmath_jll ────────────── v0.2.2+1
     Cloning [bbf7d656-a473-5ed7-a52c-81e309532950] CommonSubexpressions from https://github.com/rdeits/CommonSubexpressions.jl.git
[?25l    Fetching: [>                                        ]  0.0 %[2K[?25h   Installed CommonSubexpressions ─── v0.3.0
     Cloning [781609d7-10c4-51f6-84f2-b8444358ff6d] GMP_jll from https://github.com/JuliaBinaryWrappers/GMP_jll.jl.git
[?25l    Fetching: [>                                        ]  0.0 %[2K[?25h   Installed GMP_jll ──────────────── v6.2.0+3
     Cloning [39de3d68-74b9-583c-8d2d-e117c070f3a9] AxisArrays from https://github.com/JuliaArrays/AxisArrays.jl.git
[?25l    Fetching: [>                                        ]  0.0 %[2K[?25h   Installed AxisArrays ───────────── v0.4.3
     Cloning [699a6c99-e7fa-54fc-8d76-47d257e15c1d] SimpleTraits from https://github.com/mauro3/SimpleTraits.jl.git
[?25l    Fetching: [>                                        ]  0.0 %[2K[?25h   Installed SimpleTraits ─────────── v0.9.3
     Cloning [27ebfcd6-29c5-5fa9-bf4b-fb8fc14df3ae] Primes from https://github.com/JuliaMath/Primes.jl.git
[?25l    Fetching: [>                                        ]  0.0 %[2K[?25h   Installed Primes ───────────────── v0.5.0
     Cloning [3bb67fe8-82b1-5028-8e26-92a6c54297fa] TranscodingStreams from https://github.com/bicycle1885/TranscodingStreams.jl.git
[?25l    Fetching: [>                                        ]  0.0 %[2K[?25h   Installed TranscodingStreams ───── v0.9.5
Updating `~/.julia/environments/v1.6/Project.toml`
  [9d24351c] + Dolo v0.4.1
Updating `~/.julia/environments/v1.6/Manifest.toml`
  [621f4979] + AbstractFFTs v0.4.1
  [ec485272] + ArnoldiMethod v0.0.4
  [4fba245c] + ArrayInterface v2.13.7
  [39de3d68] + AxisArrays v0.4.3
  [08854c51] + BasisMatrices v0.6.0
  [6e4b80f9] + BenchmarkTools v0.5.0
  [9e28174c] + BinDeps v1.0.1
  [b99e7846] + BinaryProvider v0.5.10
  [49dc2e85] + Calculus v0.5.1
  [523fee87] + CodecBzip2 v0.7.2
  [944b1d66] + CodecZlib v0.7.0
  [861a8166] + Combinatorics v0.7.0
  [bbf7d656] + CommonSubexpressions v0.3.0
  [34da2185] + Compat v3.22.0
  [8f4d0f93] + Conda v1.4.1
  [717857b8] + DSP v0.6.0
  [9a962f9c] + DataAPI v1.3.0
  [864edb3b] + DataStructures v0.18.8
  [01453d9d] + DiffEqDiffTools v1.7.0
  [163ba53b] + DiffResults v1.0.2
  [b552c78f] + DiffRules v1.0.1
  [b4f34e82] + Distances v0.9.2
  [31c24e10] + Distributions v0.23.8
  [e5c7262c] + Dolang v3.1.2
  [9d24351c] + Dolo v0.4.1
  [da5c29d0] + EllipsisNotation v0.4.0
  [7a1cc6ca] + FFTW v1.0.1
  [1a297f60] + FillArrays v0.8.14
  [f6369f11] + ForwardDiff v0.10.12
  [cd3eb016] + HTTP v0.8.19
  [d25df0c9] + Inflate v0.1.2
  [83e8ac13] + IniFile v0.5.0
  [8197267c] + IntervalSets v0.5.1
  [c8e1da08] + IterTools v1.3.0
  [42fd0dbc] + IterativeSolvers v0.8.4
  [692b3bcd] + JLLWrappers v1.1.3
  [682c06a0] + JSON v0.21.1
  [7d188eb4] + JSONSchema v0.3.2
  [093fc24a] + LightGraphs v1.3.0
  [d3d80556] + LineSearches v7.1.0
  [1914dd2f] + MacroTools v0.5.6
  [b8f27783] + MathOptInterface v0.9.17
  [fdba3010] + MathProgBase v0.7.8
  [739be429] + MbedTLS v1.0.2
  [e1d29d7a] + Missings v0.4.4
  [d8a4904e] + MutableArithmetics v0.2.10
  [d41bc354] + NLSolversBase v7.5.0
  [76087f3c] + NLopt v0.6.1
  [2774e3e8] + NLsolve v4.4.1
  [77ba4419] + NaNMath v0.3.4
  [429524aa] + Optim v0.22.0
  [bac558e1] + OrderedCollections v1.3.1
  [90014a1f] + PDMats v0.10.1
  [d96e819e] + Parameters v0.12.1
  [69de0a69] + Parsers v1.0.11
  [f27b6e38] + Polynomials v0.5.2
  [85a6dd25] + PositiveFactorizations v0.2.3
  [27ebfcd6] + Primes v0.5.0
  [1fd47b50] + QuadGK v2.4.1
  [fcd29c91] + QuantEcon v0.16.2
  [b3c3ace0] + RangeArrays v0.3.2
  [3cdcf5f2] + RecipesBase v1.1.0
  [189a3867] + Reexport v0.2.0
  [ae029012] + Requires v1.1.0
  [79098fc4] + Rmath v0.6.1
  [699a6c99] + SimpleTraits v0.9.3
  [a2af1166] + SortingAlgorithms v0.3.1
  [276daf66] + SpecialFunctions v0.8.0
  [90137ffa] + StaticArrays v0.12.4
  [2913bbd2] + StatsBase v0.33.2
  [4c63d2b9] + StatsFuns v0.9.5
  [88034a9c] + StringDistances v0.8.0
  [123dc426] + SymEngine v0.8.2
  [3bb67fe8] + TranscodingStreams v0.9.5
  [30578b45] + URIParser v0.4.1
  [3a884ed6] + UnPack v1.0.2
  [81def892] + VersionParsing v1.2.0
  [ddb6d928] + YAML v0.4.2
  [a5390f91] + ZipFile v0.9.3
  [6e34b625] + Bzip2_jll v1.0.6+5
  [781609d7] + GMP_jll v6.2.0+3
  [2ce0c516] + MPC_jll v1.1.0+0
  [3a97d323] + MPFR_jll v4.1.0+1
  [c8ffd9c3] + MbedTLS_jll v2.16.8+0
  [079eb43e] + NLopt_jll v2.6.2+0
  [f50d1b31] + Rmath_jll v0.2.2+1
  [3428059b] + SymEngine_jll v0.6.0+1
  [83775a58] + Zlib_jll v1.2.11+18
  [0dad84c5] + ArgTools
  [56f22d72] + Artifacts
  [2a0f44e3] + Base64
  [ade2ca70] + Dates
  [8bb1440f] + DelimitedFiles
  [8ba89e20] + Distributed
  [f43a241f] + Downloads
  [b77e0a4c] + InteractiveUtils
  [b27032c2] + LibCURL
  [76f85450] + LibGit2
  [8f399da3] + Libdl
  [37e2e46d] + LinearAlgebra
  [56ddb016] + Logging
  [d6f4376e] + Markdown
  [a63ad114] + Mmap
  [44cfe95a] + Pkg
  [de0858da] + Printf
  [3fa0cd96] + REPL
  [9a3f8284] + Random
  [ea8e919c] + SHA
  [9e88b42a] + Serialization
  [1a1011a3] + SharedArrays
  [6462fe0b] + Sockets
  [2f01184e] + SparseArrays
  [10745b16] + Statistics
  [4607b0f0] + SuiteSparse
  [fa267f1f] + TOML
  [8dfed614] + Test
  [cf7118a7] + UUIDs
  [4ec0a83e] + Unicode
  [deac9b47] + LibCURL_jll
  [14a3606d] + MozillaCACerts_jll
    Building Conda ───────────→ `~/.julia/scratchspaces/44cfe95a-1eb2-52ea-b672-e2afdf69b78f/7a58bb32ce5d85f8bf7559aa7c2842f9aecf52fc/build.log`
    Building FFTW ────────────→ `~/.julia/scratchspaces/44cfe95a-1eb2-52ea-b672-e2afdf69b78f/6c5b420da0b8c12098048561b8d58f81adea506f/build.log`
    Building SpecialFunctions → `~/.julia/scratchspaces/44cfe95a-1eb2-52ea-b672-e2afdf69b78f/3bdd374b6fd78faf0119b8c5d538788dbf910c6e/build.log`
Precompiling project... (tip: to disable auto-precompilation set ENV["JULIA_PKG_PRECOMPILE_AUTO"]=0)
[32m  ✓ [39m[90mEllipsisNotation[39m
[32m  ✓ [39m[90mDataAPI[39m
[32m  ✓ [39m[90mNaNMath[39m
[32m  ✓ [39m[90mReexport[39m
[32m  ✓ [39m[90mUnPack[39m
[32m  ✓ [39m[90mIniFile[39m
[32m  ✓ [39m[90mRangeArrays[39m
[32m  ✓ [39m[90mVersionParsing[39m
[32m  ✓ [39m[90mAbstractFFTs[39m
[32m  ✓ [39m[90mJLLWrappers[39m
[32m  ✓ [39m[90mPrimes[39m
[32m  ✓ [39m[90mOrderedCollections[39m
[32m  ✓ [39m[90mInflate[39m
[32m  ✓ [39m[90mPositiveFactorizations[39m
[32m  ✓ [39m[90mPolynomials[39m
[32m  ✓ [39m[90mURIParser[39m
[32m  ✓ [39m[90mRecipesBase[39m
[32m  ✓ [39m[90mIterTools[39m
[32m  ✓ [39m[90mRequires[39m
[32m  ✓ [39m[90mPDMats[39m
[32m  ✓ [39m[90mCompat[39m
[32m  ✓ [39m[90mDistances[39m
[32m  ✓ [39m[90mMissings[39m
[32m  ✓ [39m[90mTranscodingStreams[39m
[32m  ✓ [39m[90mCalculus[39m
[32m  ✓ [39m[90mMathProgBase[39m
[32m  ✓ [39m[90mIntervalSets[39m
[32m  ✓ [39m[90mParameters[39m
[32m  ✓ [39m[90mFillArrays[39m
[32m  ✓ [39m[90mNLopt_jll[39m
[32m  ✓ [39m[90mMbedTLS_jll[39m
[32m  ✓ [39m[90mStringDistances[39m
[32m  ✓ [39m[90mRmath_jll[39m
[32m  ✓ [39m[90mYAML[39m
[32m  ✓ [39m[90mCombinatorics[39m
[32m  ✓ [39m[90mBinDeps[39m
[32m  ✓ [39m[90mZlib_jll[39m
[32m  ✓ [39m[90mBzip2_jll[39m
[32m  ✓ [39m[90mAxisArrays[39m
[32m  ✓ [39m[90mGMP_jll[39m
[32m  ✓ [39m[90mCodecZlib[39m
[32m  ✓ [39m[90mRmath[39m
[32m  ✓ [39m[90mCodecBzip2[39m
[32m  ✓ [39m[90mZipFile[39m
[32m  ✓ [39m[90mMbedTLS[39m
[32m  ✓ [39m[90mArrayInterface[39m
[32m  ✓ [39m[90mIterativeSolvers[39m
[32m  ✓ [39m[90mMacroTools[39m
[32m  ✓ [39m[90mDataStructures[39m
[32m  ✓ [39m[90mParsers[39m
[32m  ✓ [39m[90mMPFR_jll[39m
[32m  ✓ [39m[90mSortingAlgorithms[39m
[32m  ✓ [39m[90mCommonSubexpressions[39m
[32m  ✓ [39m[90mQuadGK[39m
[32m  ✓ [39m[90mJSON[39m
[32m  ✓ [39m[90mSpecialFunctions[39m
[32m  ✓ [39m[90mMPC_jll[39m
[32m  ✓ [39m[90mSimpleTraits[39m
[32m  ✓ [39m[90mConda[39m
[32m  ✓ [39m[90mDiffRules[39m
[32m  ✓ [39m[90mStaticArrays[39m
[32m  ✓ [39m[90mBenchmarkTools[39m
[32m  ✓ [39m[90mHTTP[39m
[32m  ✓ [39m[90mStatsBase[39m
[32m  ✓ [39m[90mFFTW[39m
[32m  ✓ [39m[90mStatsFuns[39m
[32m  ✓ [39m[90mSymEngine_jll[39m
[32m  ✓ [39m[90mDiffResults[39m
[32m  ✓ [39m[90mJSONSchema[39m
[32m  ✓ [39m[90mDiffEqDiffTools[39m
[32m  ✓ [39m[90mMutableArithmetics[39m
[32m  ✓ [39m[90mArnoldiMethod[39m
[32m  ✓ [39m[90mSymEngine[39m
[32m  ✓ [39m[90mDSP[39m
[32m  ✓ [39m[90mForwardDiff[39m
[32m  ✓ [39m[90mDistributions[39m
[32m  ✓ [39m[90mDolang[39m
[32m  ✓ [39m[90mNLSolversBase[39m
[32m  ✓ [39m[90mLightGraphs[39m
[32m  ✓ [39m[90mLineSearches[39m
[32m  ✓ [39m[90mNLsolve[39m
[32m  ✓ [39m[90mOptim[39m
[32m  ✓ [39m[90mMathOptInterface[39m
[32m  ✓ [39m[90mNLopt[39m
[32m  ✓ [39m[90mQuantEcon[39m
[32m  ✓ [39m[90mBasisMatrices[39m
86 dependencies successfully precompiled (1 already precompiled)
Starting tests at 2020-10-27T04:26:25.071
     Testing Dolo
Status `/tmp/jl_D0CNLX/Project.toml`
  [39de3d68] AxisArrays v0.4.3
  [08854c51] BasisMatrices v0.6.0
  [34da2185] Compat v3.22.0
  [864edb3b] DataStructures v0.18.8
  [31c24e10] Distributions v0.23.8
  [e5c7262c] Dolang v3.1.2
  [9d24351c] Dolo v0.4.1
  [cd3eb016] HTTP v0.8.19
  [c8e1da08] IterTools v1.3.0
  [42fd0dbc] IterativeSolvers v0.8.4
  [1914dd2f] MacroTools v0.5.6
  [2774e3e8] NLsolve v4.4.1
  [429524aa] Optim v0.22.0
  [fcd29c91] QuantEcon v0.16.2
  [90137ffa] StaticArrays v0.12.4
  [88034a9c] StringDistances v0.8.0
  [ddb6d928] YAML v0.4.2
  [37e2e46d] LinearAlgebra
  [de0858da] Printf
  [3fa0cd96] REPL
  [8dfed614] Test
Status `/tmp/jl_D0CNLX/Manifest.toml`
  [621f4979] AbstractFFTs v0.4.1
  [ec485272] ArnoldiMethod v0.0.4
  [4fba245c] ArrayInterface v2.13.7
  [39de3d68] AxisArrays v0.4.3
  [08854c51] BasisMatrices v0.6.0
  [6e4b80f9] BenchmarkTools v0.5.0
  [9e28174c] BinDeps v1.0.1
  [b99e7846] BinaryProvider v0.5.10
  [49dc2e85] Calculus v0.5.1
  [523fee87] CodecBzip2 v0.7.2
  [944b1d66] CodecZlib v0.7.0
  [861a8166] Combinatorics v0.7.0
  [bbf7d656] CommonSubexpressions v0.3.0
  [34da2185] Compat v3.22.0
  [8f4d0f93] Conda v1.4.1
  [717857b8] DSP v0.6.0
  [9a962f9c] DataAPI v1.3.0
  [864edb3b] DataStructures v0.18.8
  [01453d9d] DiffEqDiffTools v1.7.0
  [163ba53b] DiffResults v1.0.2
  [b552c78f] DiffRules v1.0.1
  [b4f34e82] Distances v0.9.2
  [31c24e10] Distributions v0.23.8
  [e5c7262c] Dolang v3.1.2
  [9d24351c] Dolo v0.4.1
  [da5c29d0] EllipsisNotation v0.4.0
  [7a1cc6ca] FFTW v1.0.1
  [1a297f60] FillArrays v0.8.14
  [f6369f11] ForwardDiff v0.10.12
  [cd3eb016] HTTP v0.8.19
  [d25df0c9] Inflate v0.1.2
  [83e8ac13] IniFile v0.5.0
  [8197267c] IntervalSets v0.5.1
  [c8e1da08] IterTools v1.3.0
  [42fd0dbc] IterativeSolvers v0.8.4
  [692b3bcd] JLLWrappers v1.1.3
  [682c06a0] JSON v0.21.1
  [7d188eb4] JSONSchema v0.3.2
  [093fc24a] LightGraphs v1.3.0
  [d3d80556] LineSearches v7.1.0
  [1914dd2f] MacroTools v0.5.6
  [b8f27783] MathOptInterface v0.9.17
  [fdba3010] MathProgBase v0.7.8
  [739be429] MbedTLS v1.0.2
  [e1d29d7a] Missings v0.4.4
  [d8a4904e] MutableArithmetics v0.2.10
  [d41bc354] NLSolversBase v7.5.0
  [76087f3c] NLopt v0.6.1
  [2774e3e8] NLsolve v4.4.1
  [77ba4419] NaNMath v0.3.4
  [429524aa] Optim v0.22.0
  [bac558e1] OrderedCollections v1.3.1
  [90014a1f] PDMats v0.10.1
  [d96e819e] Parameters v0.12.1
  [69de0a69] Parsers v1.0.11
  [f27b6e38] Polynomials v0.5.2
  [85a6dd25] PositiveFactorizations v0.2.3
  [27ebfcd6] Primes v0.5.0
  [1fd47b50] QuadGK v2.4.1
  [fcd29c91] QuantEcon v0.16.2
  [b3c3ace0] RangeArrays v0.3.2
  [3cdcf5f2] RecipesBase v1.1.0
  [189a3867] Reexport v0.2.0
  [ae029012] Requires v1.1.0
  [79098fc4] Rmath v0.6.1
  [699a6c99] SimpleTraits v0.9.3
  [a2af1166] SortingAlgorithms v0.3.1
  [276daf66] SpecialFunctions v0.8.0
  [90137ffa] StaticArrays v0.12.4
  [2913bbd2] StatsBase v0.33.2
  [4c63d2b9] StatsFuns v0.9.5
  [88034a9c] StringDistances v0.8.0
  [123dc426] SymEngine v0.8.2
  [3bb67fe8] TranscodingStreams v0.9.5
  [30578b45] URIParser v0.4.1
  [3a884ed6] UnPack v1.0.2
  [81def892] VersionParsing v1.2.0
  [ddb6d928] YAML v0.4.2
  [a5390f91] ZipFile v0.9.3
  [6e34b625] Bzip2_jll v1.0.6+5
  [781609d7] GMP_jll v6.2.0+3
  [2ce0c516] MPC_jll v1.1.0+0
  [3a97d323] MPFR_jll v4.1.0+1
  [c8ffd9c3] MbedTLS_jll v2.16.8+0
  [079eb43e] NLopt_jll v2.6.2+0
  [f50d1b31] Rmath_jll v0.2.2+1
  [3428059b] SymEngine_jll v0.6.0+1
  [83775a58] Zlib_jll v1.2.11+18
  [0dad84c5] ArgTools
  [56f22d72] Artifacts
  [2a0f44e3] Base64
  [ade2ca70] Dates
  [8bb1440f] DelimitedFiles
  [8ba89e20] Distributed
  [f43a241f] Downloads
  [b77e0a4c] InteractiveUtils
  [b27032c2] LibCURL
  [76f85450] LibGit2
  [8f399da3] Libdl
  [37e2e46d] LinearAlgebra
  [56ddb016] Logging
  [d6f4376e] Markdown
  [a63ad114] Mmap
  [44cfe95a] Pkg
  [de0858da] Printf
  [3fa0cd96] REPL
  [9a3f8284] Random
  [ea8e919c] SHA
  [9e88b42a] Serialization
  [1a1011a3] SharedArrays
  [6462fe0b] Sockets
  [2f01184e] SparseArrays
  [10745b16] Statistics
  [4607b0f0] SuiteSparse
  [fa267f1f] TOML
  [8dfed614] Test
  [cf7118a7] UUIDs
  [4ec0a83e] Unicode
  [deac9b47] LibCURL_jll
  [14a3606d] MozillaCACerts_jll
     Testing Running tests...
Test Summary:       | Pass  Total
testing model_types |   82     82
Importing LAMP.yaml
Importing neoclassical.yaml
Importing rbc.yaml
Importing rbc_catastrophe.yaml
Importing rbc_catastrophe_newstyle.yaml
[0.001]
[0.0; 0.1]
[0.97 0.03; 0.1 0.9]
Importing rbc_iid.yaml
Importing rbc_mc.yaml
Importing rmt3_ch11.yaml
Importing sudden_stop.yaml
Importing sudden_stop_ar1.yaml
Test Summary:       | Pass  Total
Testing yaml_import |   10     10
Test Summary:             | Pass  Total
Testing model calibration |   13     13
┌ Warning: `a::StaticArray + b::Number` is deprecated, use `a .+ b` instead.
│   caller = (::Dolo.var"#196#197"{2, Dolo.CartesianGrid{1}})(#unused#::Int64) at none:0
└ @ Dolo ./none:0
------------------------------------------------------------------
It    ϵₙ              ηₙ=|xₙ-xₙ₋|    λₙ=ηₙ/ηₙ₋      Time            Newton steps
------------------------------------------------------------------
0     NaN             NaN             NaN             0.00e+00        NaN  
1     NaN             7.56e-01        NaN             2.49e+09        NaN  
2     NaN             4.12e-02        5.45e-02        3.21e+05        NaN  
3     NaN             3.10e-02        7.54e-01        1.40e+05        NaN  
4     NaN             2.51e-02        8.07e-01        1.38e+05        NaN  
5     NaN             2.21e-02        8.81e-01        1.36e+05        NaN  
6     NaN             1.92e-02        8.69e-01        1.38e+05        NaN  
7     NaN             1.71e-02        8.90e-01        1.38e+05        NaN  
8     NaN             1.51e-02        8.85e-01        1.34e+05        NaN  
9     NaN             1.34e-02        8.89e-01        1.31e+05        NaN  
10    NaN             1.20e-02        8.90e-01        1.29e+05        NaN  
11    NaN             1.07e-02        8.92e-01        1.32e+05        NaN  
12    NaN             9.54e-03        8.95e-01        1.39e+05        NaN  
13    NaN             8.56e-03        8.97e-01        1.32e+05        NaN  
14    NaN             7.69e-03        8.99e-01        1.30e+05        NaN  
15    NaN             6.92e-03        9.01e-01        1.30e+05        NaN  
16    NaN             6.25e-03        9.02e-01        1.29e+05        NaN  
17    NaN             5.65e-03        9.04e-01        1.33e+05        NaN  
18    NaN             5.12e-03        9.06e-01        1.34e+05        NaN  
19    NaN             4.64e-03        9.07e-01        1.30e+05        NaN  
20    NaN             4.21e-03        9.08e-01        1.26e+05        NaN  
------------------------------------------------------------------
 15.142869 seconds (24.84 M allocations: 1.255 GiB, 3.93% gc time, 99.54% compilation time)
  5.997823 seconds (9.48 M allocations: 570.964 MiB, 4.17% gc time, 98.88% compilation time)
 10.000431 seconds (22.29 M allocations: 1.171 GiB, 8.87% gc time, 99.30% compilation time)
┌ Warning: `a::StaticArray + b::Number` is deprecated, use `a .+ b` instead.
│   caller = (::Dolo.var"#196#197"{1, Dolo.CartesianGrid{1}})(#unused#::Int64) at none:0
└ @ Dolo ./none:0
  2.163137 seconds (3.13 M allocations: 184.501 MiB, 4.03% gc time, 99.03% compilation time)
  1.454654 seconds (2.63 M allocations: 157.943 MiB, 6.26% gc time, 99.99% compilation time)
┌ Warning: `a::StaticArray + b::Number` is deprecated, use `a .+ b` instead.
│   caller = Dolo.CubicDR(exo_grid::Dolo.EmptyGrid, endo_grid::Dolo.CartesianGrid{2}, i::Type{Val{2}}) at csplines.jl:14
└ @ Dolo ~/.julia/packages/Dolo/d0Rro/src/numeric/decision_rules/csplines.jl:14
------------------------------------------------------------------
It    ϵₙ              ηₙ=|xₙ-xₙ₋|    λₙ=ηₙ/ηₙ₋      Time            Newton steps
------------------------------------------------------------------
0     NaN             NaN             NaN             0.00e+00        NaN  
1     NaN             2.08e-01        NaN             9.39e+08        NaN  
2     NaN             5.93e-02        2.85e-01        1.39e+06        NaN  
3     NaN             4.15e-02        6.99e-01        1.24e+06        NaN  
4     NaN             2.95e-02        7.11e-01        1.26e+06        NaN  
5     NaN             2.14e-02        7.26e-01        1.24e+06        NaN  
6     NaN             1.59e-02        7.41e-01        1.28e+06        NaN  
7     NaN             1.20e-02        7.57e-01        1.25e+06        NaN  
8     NaN             9.25e-03        7.71e-01        1.25e+06        NaN  
9     NaN             7.26e-03        7.85e-01        1.27e+06        NaN  
10    NaN             5.79e-03        7.97e-01        1.22e+06        NaN  
11    NaN             4.69e-03        8.09e-01        1.23e+06        NaN  
12    NaN             3.85e-03        8.21e-01        1.26e+06        NaN  
13    NaN             3.20e-03        8.31e-01        1.23e+06        NaN  
14    NaN             2.69e-03        8.40e-01        1.22e+06        NaN  
15    NaN             2.28e-03        8.49e-01        1.25e+06        NaN  
16    NaN             1.95e-03        8.57e-01        1.21e+06        NaN  
17    NaN             1.69e-03        8.64e-01        1.18e+06        NaN  
18    NaN             1.47e-03        8.70e-01        1.23e+06        NaN  
19    NaN             1.28e-03        8.75e-01        9.65e+05        NaN  
20    NaN             1.13e-03        8.80e-01        9.63e+05        NaN  
------------------------------------------------------------------
  5.353474 seconds (7.49 M allocations: 434.620 MiB, 2.70% gc time, 99.18% compilation time)
  4.071976 seconds (3.38 M allocations: 254.552 MiB, 4.65% gc time, 88.09% compilation time)
  3.071296 seconds (3.78 M allocations: 323.523 MiB, 6.00% gc time, 75.09% compilation time)
  1.187035 seconds (1.02 M allocations: 62.434 MiB, 97.38% compilation time)
┌ Warning: `a::StaticArray + b::Number` is deprecated, use `a .+ b` instead.
│   caller = Dolo.CubicDR(exo_grid::Dolo.CartesianGrid{1}, endo_grid::Dolo.CartesianGrid{1}, i::Type{Val{2}}) at csplines.jl:53
└ @ Dolo ~/.julia/packages/Dolo/d0Rro/src/numeric/decision_rules/csplines.jl:53
┌ Warning: `a::StaticArray + b::Number` is deprecated, use `a .+ b` instead.
│   caller = Dolo.CubicDR(exo_grid::Dolo.CartesianGrid{1}, endo_grid::Dolo.CartesianGrid{1}, i::Type{Val{2}}) at csplines.jl:53
└ @ Dolo ~/.julia/packages/Dolo/d0Rro/src/numeric/decision_rules/csplines.jl:53
------------------------------------------------------------------
It    ϵₙ              ηₙ=|xₙ-xₙ₋|    λₙ=ηₙ/ηₙ₋      Time            Newton steps
------------------------------------------------------------------
0     NaN             NaN             NaN             0.00e+00        NaN  
1     NaN             8.71e-01        NaN             8.10e+08        NaN  
2     NaN             7.09e-02        8.13e-02        2.85e+06        NaN  
3     NaN             5.71e-02        8.05e-01        2.75e+06        NaN  
4     NaN             4.61e-02        8.08e-01        2.82e+06        NaN  
5     NaN             3.76e-02        8.14e-01        2.89e+06        NaN  
6     NaN             3.08e-02        8.21e-01        2.97e+06        NaN  
7     NaN             2.56e-02        8.30e-01        2.89e+06        NaN  
8     NaN             2.15e-02        8.39e-01        2.15e+06        NaN  
9     NaN             1.82e-02        8.48e-01        2.10e+06        NaN  
10    NaN             1.56e-02        8.56e-01        2.04e+06        NaN  
11    NaN             1.35e-02        8.63e-01        2.07e+06        NaN  
12    NaN             1.17e-02        8.70e-01        1.81e+06        NaN  
13    NaN             1.03e-02        8.76e-01        1.81e+06        NaN  
14    NaN             9.05e-03        8.82e-01        1.76e+06        NaN  
15    NaN             8.02e-03        8.87e-01        1.71e+06        NaN  
16    NaN             7.15e-03        8.91e-01        1.94e+06        NaN  
17    NaN             6.39e-03        8.95e-01        1.49e+06        NaN  
18    NaN             5.74e-03        8.98e-01        1.54e+06        NaN  
19    NaN             5.17e-03        9.01e-01        1.49e+06        NaN  
20    NaN             4.67e-03        9.03e-01        1.47e+06        NaN  
------------------------------------------------------------------
  3.708084 seconds (5.27 M allocations: 316.566 MiB, 3.68% gc time, 97.23% compilation time)
  3.826042 seconds (5.68 M allocations: 367.083 MiB, 4.63% gc time, 71.68% compilation time)
  4.750669 seconds (5.81 M allocations: 400.250 MiB, 6.34% gc time, 48.27% compilation time)
Test Summary:       | Pass  Total
testing model algos |    6      6
Iter     f(x) inf-norm    Step 2-norm 
------   --------------   --------------
     0     2.336746e-01              NaN
     1     1.090389e+00     7.850462e-17
     2     1.090389e+00     0.000000e+00
     3     1.090389e+00     0.000000e+00
     4     1.090389e+00     0.000000e+00
     5     9.244591e-01     1.110223e-16
     6     7.565965e-01     6.206335e-17
     7     8.702654e-01     6.798700e-17
     8     1.968438e-01     6.542663e-02
     9     8.453575e-02     8.402554e-01
    10     9.037182e-03     1.237813e+00
    11     3.018357e-04     2.353474e-01
    12     1.222641e-07     1.087953e-03
    13     2.753353e-14     1.818750e-06
 20.446443 seconds (33.53 M allocations: 1.910 GiB, 5.56% gc time, 93.52% compilation time)
Test Summary:             | Pass  Total
testing perfect_foresight |    1      1
Iter     f(x) inf-norm    Step 2-norm 
------   --------------   --------------
     0     2.336746e-01              NaN
     1     1.090389e+00     7.850462e-17
     2     1.090389e+00     0.000000e+00
     3     1.090389e+00     0.000000e+00
     4     1.090389e+00     0.000000e+00
     5     9.244591e-01     1.110223e-16
     6     7.565965e-01     6.206335e-17
     7     8.702654e-01     6.798700e-17
     8     1.968438e-01     6.542663e-02
     9     8.453575e-02     8.402554e-01
    10     9.037182e-03     1.237813e+00
    11     3.018357e-04     2.353474e-01
    12     1.222641e-07     1.087953e-03
    13     2.753353e-14     1.818750e-06
  3.682791 seconds (6.65 M allocations: 337.627 MiB, 5.49% gc time, 70.41% compilation time)
Iter     f(x) inf-norm    Step 2-norm 
------   --------------   --------------
     0     2.336746e-01              NaN
     1     1.090389e+00     7.850462e-17
     2     1.090389e+00     0.000000e+00
     3     1.090389e+00     0.000000e+00
     4     1.090389e+00     0.000000e+00
     5     9.244591e-01     1.110223e-16
     6     7.565965e-01     6.206335e-17
     7     8.702654e-01     6.798700e-17
     8     1.968438e-01     6.542663e-02
     9     8.453575e-02     8.402554e-01
    10     9.037182e-03     1.237813e+00
    11     3.018357e-04     2.353474e-01
    12     1.222641e-07     1.087953e-03
    13     2.753353e-14     1.818750e-06
  1.463378 seconds (2.75 M allocations: 106.909 MiB, 9.17% gc time, 33.05% compilation time)
df is the same
Iter     f(x) inf-norm    Step 2-norm 
------   --------------   --------------
     0     2.336746e-01              NaN
     1     1.090389e+00     7.850462e-17
     2     1.090389e+00     0.000000e+00
     3     1.090389e+00     0.000000e+00
     4     1.090389e+00     0.000000e+00
     5     9.244591e-01     1.110223e-16
     6     7.565965e-01     6.206335e-17
     7     8.702654e-01     6.798700e-17
     8     1.968438e-01     6.542663e-02
     9     8.453575e-02     8.402554e-01
    10     9.037182e-03     1.237813e+00
    11     3.018357e-04     2.353474e-01
    12     1.222641e-07     1.087953e-03
    13     2.753353e-14     1.818750e-06
  3.600129 seconds (6.85 M allocations: 348.359 MiB, 5.44% gc time, 74.36% compilation time)
Iter     f(x) inf-norm    Step 2-norm 
------   --------------   --------------
     0     2.336746e-01              NaN
     1     1.090389e+00     7.850462e-17
     2     1.090389e+00     0.000000e+00
     3     1.090389e+00     0.000000e+00
     4     1.090389e+00     0.000000e+00
     5     9.244591e-01     1.110223e-16
     6     7.565965e-01     6.206335e-17
     7     8.702654e-01     6.798700e-17
     8     1.968438e-01     6.542663e-02
     9     8.453575e-02     8.402554e-01
    10     9.037182e-03     1.237813e+00
    11     3.018357e-04     2.353474e-01
    12     1.222641e-07     1.087953e-03
    13     2.753353e-14     1.818750e-06
  1.148839 seconds (2.34 M allocations: 82.741 MiB, 10.47% gc time, 20.54% compilation time)
df is the same
Iter     f(x) inf-norm    Step 2-norm 
------   --------------   --------------
     0     2.336746e-01              NaN
     1     1.090389e+00     7.850462e-17
     2     1.090389e+00     0.000000e+00
     3     1.090389e+00     0.000000e+00
     4     1.090389e+00     0.000000e+00
     5     9.244591e-01     1.110223e-16
     6     7.565965e-01     6.206335e-17
     7     8.702654e-01     6.798700e-17
     8     1.968438e-01     6.542663e-02
     9     8.453575e-02     8.402554e-01
    10     9.037182e-03     1.237813e+00
    11     3.018357e-04     2.353474e-01
    12     1.222641e-07     1.087953e-03
    13     2.753353e-14     1.818750e-06
  0.950754 seconds (2.21 M allocations: 76.499 MiB, 10.06% gc time)
df is the same
Iter     f(x) inf-norm    Step 2-norm 
------   --------------   --------------
     0     2.336746e-01              NaN
     1     1.090389e+00     7.850462e-17
     2     1.090389e+00     0.000000e+00
     3     1.090389e+00     0.000000e+00
     4     1.090389e+00     0.000000e+00
     5     9.244591e-01     1.110223e-16
     6     7.565965e-01     6.206335e-17
     7     8.702654e-01     6.798700e-17
     8     1.968438e-01     6.542663e-02
     9     8.453575e-02     8.402554e-01
    10     9.037182e-03     1.237813e+00
    11     3.018357e-04     2.353474e-01
    12     1.222641e-07     1.087953e-03
    13     2.753353e-14     1.818750e-06
  1.009784 seconds (2.21 M allocations: 76.499 MiB, 11.16% gc time)
df is the same
Iter     f(x) inf-norm    Step 2-norm 
------   --------------   --------------
     0     2.336746e-01              NaN
     1     1.090389e+00     7.850462e-17
     2     1.090389e+00     0.000000e+00
     3     1.090389e+00     0.000000e+00
     4     1.090389e+00     0.000000e+00
     5     9.244591e-01     1.110223e-16
     6     7.565965e-01     6.206335e-17
     7     8.702654e-01     6.798700e-17
     8     1.968438e-01     6.542663e-02
     9     8.453575e-02     8.402554e-01
    10     9.037182e-03     1.237813e+00
    11     3.018357e-04     2.353474e-01
    12     1.222641e-07     1.087953e-03
    13     2.753353e-14     1.818750e-06
  1.552650 seconds (2.66 M allocations: 101.358 MiB, 3.91% gc time, 34.31% compilation time)
df is the same
Test Summary: | Pass  Total
features      |   15     15
/home/pkgeval/.julia/packages/Dolo/d0Rro/examples/models/LAMP.yaml
/home/pkgeval/.julia/packages/Dolo/d0Rro/examples/models/neoclassical.yaml
/home/pkgeval/.julia/packages/Dolo/d0Rro/examples/models/rbc.yaml
/home/pkgeval/.julia/packages/Dolo/d0Rro/examples/models/rbc_catastrophe.yaml
/home/pkgeval/.julia/packages/Dolo/d0Rro/examples/models/rbc_catastrophe_newstyle.yaml
/home/pkgeval/.julia/packages/Dolo/d0Rro/examples/models/rbc_iid.yaml
/home/pkgeval/.julia/packages/Dolo/d0Rro/examples/models/rbc_mc.yaml
/home/pkgeval/.julia/packages/Dolo/d0Rro/examples/models/rmt3_ch11.yaml
/home/pkgeval/.julia/packages/Dolo/d0Rro/examples/models/sudden_stop.yaml
/home/pkgeval/.julia/packages/Dolo/d0Rro/examples/models/sudden_stop_ar1.yaml
error at line 1, column 5 : Invalid model name '' >> Model name should be non-empty string
error at line 8, column 17 : Invalid symbol 'i*$' >> symbol should be an 'alphanumeric' string
error at line 12, column 46 : Invalid symbol '_alpha' >> symbol should not start with a number or an underscore
error at line 12, column 16 : Invalid symbol 'beta' >> beta already declared as 'parameters at line 9, column 23
error at line 18, column 4 : Invalid definition 'rk%' >> symbol should be an 'alphanumeric' string
error at line 19, column 4 : Invalid definition '_w' >> symbol should not start with a number or an underscore
error at line 20, column 4 : Invalid definition 'c' >> c already declared in definitions section at line 17, column 4
error at line 21, column 4 : Invalid definition 'n' >> n  already declared in symbols section as 'controls' at line8, column 14
error at line 30, column 4 : Invalid number of equations 'transition' >> Number of transition equations should be equal to number of states
error at line 68, column 4 : Invalid calibration 'z' >> z already declared in calibration section at line 66, column 4
warning at line 9, colummn 3 : Unknown symbol type 'strange_params' 
warning at line 8, colummn 17 : Symbol not calibrated 'i*$' >> i*$ not found in calibration section
warning at line 10, colummn 18 : Symbol not calibrated '15b' >> 15b not found in calibration section
warning at line 12, colummn 46 : Symbol not calibrated '_alpha' >> _alpha not found in calibration section
warning at line 51, colummn 4 : Calibration not in symbols 'phi' >> phi is not declared in the symbols section 
warning at line 53, colummn 4 : Calibration not in symbols 'alpha' >> alpha is not declared in the symbols section 
warning at line 58, colummn 4 : Calibration not in symbols 'alpha' >> alpha is not declared in the symbols section 
warning at line 61, colummn 4 : Calibration not in symbols 'c_i' >> c_i is not declared in the symbols section 
warning at line 62, colummn 4 : Calibration not in symbols 'c_y' >> c_y is not declared in the symbols section 
warning at line 69, colummn 4 : Calibration not in symbols 'rk' >> rk is not declared in the symbols section 
warning at line 70, colummn 4 : Calibration not in symbols 'w' >> w is not declared in the symbols section 
warning at line 77, colummn 4 : Calibration not in symbols 'm' >> m is not declared in the symbols section 
Test Summary: |
linter        | No tests
Test Summary:     | Pass  Total
minilang.jl tests |    2      2
Test Summary: | Pass  Total
DR types      |  240    240
Test Summary:                  | Pass  Total
testing discretizing functions |    1      1
     Testing Dolo tests passed 
Finished at 2020-10-27T04:29:55.482
