Julia Version 1.5.0-DEV.57
Commit a2fe09e6a7 (2020-01-13 17:14 UTC)
Platform Info:
  OS: Linux (x86_64-pc-linux-gnu)
  CPU: Intel(R) Xeon(R) Silver 4114 CPU @ 2.20GHz
  WORD_SIZE: 64
  LIBM: libopenlibm
  LLVM: libLLVM-8.0.1 (ORCJIT, skylake)
Environment:
  JULIA_DEPOT_PATH = ::/usr/local/share/julia

 Resolving package versions...
 Installed LambdaFn ─────────── v0.3.0
 Installed Reexport ─────────── v0.2.0
 Installed SignalOperators ──── v0.3.0
 Installed PrettyPrinting ───── v0.2.0
 Installed OrderedCollections ─ v1.1.0
 Installed SpecialFunctions ─── v0.9.0
 Installed FileIO ───────────── v1.2.1
 Installed MacroTools ───────── v0.5.3
 Installed FillArrays ───────── v0.8.4
 Installed Unitful ──────────── v0.18.0
 Installed MKL_jll ──────────── v2019.0.117+0
 Installed OpenSpecFun_jll ──── v0.5.3+1
 Installed FFTW_jll ─────────── v3.3.9+3
 Installed Polynomials ──────── v0.6.0
 Installed RecipesBase ──────── v0.7.0
 Installed IntelOpenMP_jll ──── v2018.0.3+0
 Installed DSP ──────────────── v0.6.2
 Installed MetaArrays ───────── v0.2.7
 Installed AbstractFFTs ─────── v0.5.0
 Installed ConstructionBase ─── v1.0.0
 Installed Compat ───────────── v2.2.0
 Installed Requires ─────────── v0.5.2
 Installed DataStructures ───── v0.17.7
 Installed FFTW ─────────────── v1.2.0
  Updating `~/.julia/environments/v1.5/Project.toml`
  [4d633899] + SignalOperators v0.3.0
  Updating `~/.julia/environments/v1.5/Manifest.toml`
  [621f4979] + AbstractFFTs v0.5.0
  [34da2185] + Compat v2.2.0
  [187b0558] + ConstructionBase v1.0.0
  [717857b8] + DSP v0.6.2
  [864edb3b] + DataStructures v0.17.7
  [7a1cc6ca] + FFTW v1.2.0
  [f5851436] + FFTW_jll v3.3.9+3
  [5789e2e9] + FileIO v1.2.1
  [1a297f60] + FillArrays v0.8.4
  [1d5cc7b8] + IntelOpenMP_jll v2018.0.3+0
  [fcefd6c4] + LambdaFn v0.3.0
  [856f044c] + MKL_jll v2019.0.117+0
  [1914dd2f] + MacroTools v0.5.3
  [36b8f3f0] + MetaArrays v0.2.7
  [efe28fd5] + OpenSpecFun_jll v0.5.3+1
  [bac558e1] + OrderedCollections v1.1.0
  [f27b6e38] + Polynomials v0.6.0
  [54e16d92] + PrettyPrinting v0.2.0
  [3cdcf5f2] + RecipesBase v0.7.0
  [189a3867] + Reexport v0.2.0
  [ae029012] + Requires v0.5.2
  [4d633899] + SignalOperators v0.3.0
  [276daf66] + SpecialFunctions v0.9.0
  [1986cc42] + Unitful v0.18.0
  [2a0f44e3] + Base64 
  [ade2ca70] + Dates 
  [8bb1440f] + DelimitedFiles 
  [8ba89e20] + Distributed 
  [b77e0a4c] + InteractiveUtils 
  [76f85450] + LibGit2 
  [8f399da3] + Libdl 
  [37e2e46d] + LinearAlgebra 
  [56ddb016] + Logging 
  [d6f4376e] + Markdown 
  [a63ad114] + Mmap 
  [44cfe95a] + Pkg 
  [de0858da] + Printf 
  [3fa0cd96] + REPL 
  [9a3f8284] + Random 
  [ea8e919c] + SHA 
  [9e88b42a] + Serialization 
  [1a1011a3] + SharedArrays 
  [6462fe0b] + Sockets 
  [2f01184e] + SparseArrays 
  [10745b16] + Statistics 
  [8dfed614] + Test 
  [cf7118a7] + UUIDs 
  [4ec0a83e] + Unicode 
  Building FFTW → `~/.julia/packages/FFTW/qqcBj/deps/build.log`
  Updating `/tmp/jl_AA8kQf/Project.toml`
 [no changes]
  Updating `/tmp/jl_AA8kQf/Manifest.toml`
 [no changes]
   Testing SignalOperators
 Installed BenchmarkTools ──── v0.4.3
 Installed FixedPointNumbers ─ v0.7.1
 Installed ProgressMeter ───── v1.2.0
 Installed IterTools ───────── v1.3.0
 Installed Parsers ─────────── v0.3.10
 Installed DimensionalData ─── v0.5.0
 Installed WAV ─────────────── v1.0.3
 Installed AxisArrays ──────── v0.4.0
 Installed IntervalSets ────── v0.3.2
 Installed RangeArrays ─────── v0.3.2
 Installed JSON ────────────── v0.21.0
  Updating `/tmp/jl_AoPH4l/Project.toml`
  [39de3d68] + AxisArrays v0.4.0
  [6e4b80f9] + BenchmarkTools v0.4.3
  [0703355e] + DimensionalData v0.5.0
  [53c48c17] + FixedPointNumbers v0.7.1
  [92933f4c] + ProgressMeter v1.2.0
  [8149f6b0] + WAV v1.0.3
  Updating `/tmp/jl_AoPH4l/Manifest.toml`
  [39de3d68] + AxisArrays v0.4.0
  [6e4b80f9] + BenchmarkTools v0.4.3
  [0703355e] + DimensionalData v0.5.0
  [53c48c17] + FixedPointNumbers v0.7.1
  [8197267c] + IntervalSets v0.3.2
  [c8e1da08] + IterTools v1.3.0
  [682c06a0] + JSON v0.21.0
  [69de0a69] + Parsers v0.3.10
  [92933f4c] + ProgressMeter v1.2.0
  [b3c3ace0] + RangeArrays v0.3.2
  [8149f6b0] + WAV v1.0.3
Running sandbox
Status `/tmp/jl_AoPH4l/Project.toml`
  [39de3d68] AxisArrays v0.4.0
  [6e4b80f9] BenchmarkTools v0.4.3
  [34da2185] Compat v2.2.0
  [717857b8] DSP v0.6.2
  [0703355e] DimensionalData v0.5.0
  [5789e2e9] FileIO v1.2.1
  [1a297f60] FillArrays v0.8.4
  [53c48c17] FixedPointNumbers v0.7.1
  [fcefd6c4] LambdaFn v0.3.0
  [36b8f3f0] MetaArrays v0.2.7
  [54e16d92] PrettyPrinting v0.2.0
  [92933f4c] ProgressMeter v1.2.0
  [ae029012] Requires v0.5.2
  [4d633899] SignalOperators v0.3.0
  [1986cc42] Unitful v0.18.0
  [8149f6b0] WAV v1.0.3
  [44cfe95a] Pkg 
  [9a3f8284] Random 
  [10745b16] Statistics 
  [8dfed614] Test 
Running tests...  3%|█                                  |  ETA: 0:07:37[KRunning tests...  9%|███▁                               |  ETA: 0:03:54[KRunning tests... 12%|████▁                              |  ETA: 0:04:00[KRunning tests... 15%|█████▁                             |  ETA: 0:03:36[KRunning tests... 18%|██████▁                            |  ETA: 0:02:54[KRunning tests... 21%|███████▁                           |  ETA: 0:02:47[KRunning tests... 24%|████████▁                          |  ETA: 0:02:41[KRunning tests... 26%|█████████▁                         |  ETA: 0:02:41[KRunning tests... 29%|██████████▁                        |  ETA: 0:03:13[KRunning tests... 32%|███████████▁                       |  ETA: 0:03:33[KRunning tests... 35%|████████████▁                      |  ETA: 0:03:20[KRunning tests... 38%|█████████████▁                     |  ETA: 0:03:23[KRunning tests... 41%|██████████████▁                    |  ETA: 0:03:49[KRunning tests... 44%|███████████████▌                   |  ETA: 0:04:50[KRunning tests... 47%|████████████████▌                  |  ETA: 0:04:29[KRunning tests... 50%|█████████████████▌                 |  ETA: 0:04:07[KRunning tests... 53%|██████████████████▌                |  ETA: 0:03:52[KRunning tests... 56%|███████████████████▌               |  ETA: 0:03:27[KRunning tests... 59%|████████████████████▋              |  ETA: 0:03:12[KRunning tests... 62%|█████████████████████▋             |  ETA: 0:03:10[KRunning tests... 65%|██████████████████████▋            |  ETA: 0:02:51[KRunning tests... 68%|███████████████████████▋           |  ETA: 0:02:30[KRunning tests... 71%|████████████████████████▊          |  ETA: 0:02:20[KRunning tests... 74%|█████████████████████████▊         |  ETA: 0:02:06[KRunning tests... 76%|██████████████████████████▊        |  ETA: 0:02:02[KRunning tests... 79%|███████████████████████████▊       |  ETA: 0:01:55[KRunning tests... 82%|████████████████████████████▉      |  ETA: 0:01:46[KRunning tests... 85%|█████████████████████████████▉     |  ETA: 0:01:29[KRunning tests... 88%|██████████████████████████████▉    |  ETA: 0:01:22[KRunning tests... 91%|███████████████████████████████▉   |  ETA: 0:01:08[KRunning tests... 94%|█████████████████████████████████  |  ETA: 0:00:44[KActivating new environment at `~/.julia/packages/SignalOperators/MhAzE/test/jl_zDj57W/Project.toml`
 Resolving package versions...
 Installed TreeViews ───────── v0.3.0
 Installed LibSndFile ──────── v2.2.0
 Installed FLAC_jll ────────── v1.3.3+1
 Installed Ogg_jll ─────────── v1.3.3+0
 Installed libsndfile_jll ──── v1.0.28+0
 Installed FixedPointNumbers ─ v0.6.1
 Installed Unitful ─────────── v0.17.0
 Installed SampledSignals ──── v2.1.0
 Installed libvorbis_jll ───── v1.3.6+2
  Updating `~/.julia/packages/SignalOperators/MhAzE/test/jl_zDj57W/Project.toml`
  [b13ce0c6] + LibSndFile v2.2.0
  Updating `~/.julia/packages/SignalOperators/MhAzE/test/jl_zDj57W/Manifest.toml`
  [621f4979] + AbstractFFTs v0.5.0
  [34da2185] + Compat v2.2.0
  [717857b8] + DSP v0.6.2
  [7a1cc6ca] + FFTW v1.2.0
  [f5851436] + FFTW_jll v3.3.9+3
  [1d38b3a6] + FLAC_jll v1.3.3+1
  [5789e2e9] + FileIO v1.2.1
  [53c48c17] + FixedPointNumbers v0.6.1
  [1d5cc7b8] + IntelOpenMP_jll v2018.0.3+0
  [8197267c] + IntervalSets v0.3.2
  [b13ce0c6] + LibSndFile v2.2.0
  [856f044c] + MKL_jll v2019.0.117+0
  [e7412a2a] + Ogg_jll v1.3.3+0
  [efe28fd5] + OpenSpecFun_jll v0.5.3+1
  [f27b6e38] + Polynomials v0.6.0
  [3cdcf5f2] + RecipesBase v0.7.0
  [189a3867] + Reexport v0.2.0
  [bd7594eb] + SampledSignals v2.1.0
  [276daf66] + SpecialFunctions v0.9.0
  [a2a6695c] + TreeViews v0.3.0
  [1986cc42] + Unitful v0.17.0
  [5bf562c0] + libsndfile_jll v1.0.28+0
  [f27f6e37] + libvorbis_jll v1.3.6+2
  [2a0f44e3] + Base64 
  [ade2ca70] + Dates 
  [8bb1440f] + DelimitedFiles 
  [8ba89e20] + Distributed 
  [b77e0a4c] + InteractiveUtils 
  [76f85450] + LibGit2 
  [8f399da3] + Libdl 
  [37e2e46d] + LinearAlgebra 
  [56ddb016] + Logging 
  [d6f4376e] + Markdown 
  [a63ad114] + Mmap 
  [44cfe95a] + Pkg 
  [de0858da] + Printf 
  [3fa0cd96] + REPL 
  [9a3f8284] + Random 
  [ea8e919c] + SHA 
  [9e88b42a] + Serialization 
  [1a1011a3] + SharedArrays 
  [6462fe0b] + Sockets 
  [2f01184e] + SparseArrays 
  [10745b16] + Statistics 
  [8dfed614] + Test 
  [cf7118a7] + UUIDs 
  [4ec0a83e] + Unicode 
 Resolving package versions...
  Updating `~/.julia/packages/SignalOperators/MhAzE/test/jl_zDj57W/Project.toml`
  [bd7594eb] + SampledSignals v2.1.0
  Updating `~/.julia/packages/SignalOperators/MhAzE/test/jl_zDj57W/Manifest.toml`
 [no changes]
[ Info: Loading LibSndFile backend for SignalOperators.
Running tests... 97%|██████████████████████████████████ |  ETA: 0:00:24[KRunning tests...100%|███████████████████████████████████| Time: 0:13:23[K
Test Summary:      | Pass  Total
SignalOperators.jl |  455    455
   Testing SignalOperators tests passed 
